{
    "PMC": "7607542",
    "DOI": "10.1007/s11427-020-1796-0",
    "PMID": "33141302",
    "PMCID": "PMC7607542",
    "title": "Ubiquitination modification: critical regulation of IRF family stability and activity.",
    "year": 2021,
    "source_url": "https://europepmc.org/article/PMC/PMC7607542",
    "source": "MED",
    "abstract_text": "Interferon regulatory factors (IRFs) play pivotal and critical roles in innate and adaptive immune responses; thus, precise and stringent regulation of the stability and activation of IRFs in physiological processes is necessary. The stability and activities of IRFs are directly or indirectly targeted by endogenous and exogenous proteins in an ubiquitin-dependent manner. However, few reviews have summarized how host E3 ligases/DUBs or viral proteins regulate IRF stability and activity. Additionally, with recent technological developments, details about the ubiquitination of IRFs have been continuously revealed. As knowledge of how these proteins function and interact with IRFs may facilitate a better understanding of the regulation of IRFs in immune responses or other biological processes, we summarized current studies on the direct ubiquitination of IRFs, with an emphasis on how these proteins interact with IRFs and affect their activities, which may provide exciting targets for drug development by regulating the functions of specific E3 ligases.",
    "full_text": "pmc Sci China Life Sci Sci China Life Sci Science China. Life Sciences 1674-7305 1869-1889 Science China Press Beijing 7607542 33141302 1796 10.1007/s11427-020-1796-0 Review Ubiquitination modification: critical regulation of IRF family stability and activity Liu Bao-qin 1 2 Jin Jin 2 3 Li Yi-yuan 103200067@seu.edu.cn 1 2 1 grid.263826.b 0000 0004 1761 0489 Key Laboratory for Developmental Genes and Human Disease, Ministry of Education, Institute of Life Sciences, Jiangsu Province High-Tech Key Laboratory for Bio-Medical Research, Southeast University, Nanjing, 210096 China 2 grid.13402.34 0000 0004 1759 700X MOE Laboratory of Biosystem Homeostasis and Protection, and Life Sciences Institute, Zhejiang University, Hangzhou, 310058 China 3 grid.13402.34 0000 0004 1759 700X Sir Run Run Shaw Hospital, College of Medicine Zhejiang University, Hangzhou, 310016 China 30 10 2020 2021 64 6 957 965 24 7 2020 11 8 2020 \u00a9 Science China Press and Springer-Verlag GmbH Germany, part of Springer Nature 2020 This article is made available via the PMC Open Access Subset for unrestricted research re-use and secondary analysis in any form or by any means with acknowledgement of the original source. These permissions are granted for the duration of the World Health Organization (WHO) declaration of COVID-19 as a global pandemic. Interferon regulatory factors (IRFs) play pivotal and critical roles in innate and adaptive immune responses; thus, precise and stringent regulation of the stability and activation of IRFs in physiological processes is necessary. The stability and activities of IRFs are directly or indirectly targeted by endogenous and exogenous proteins in an ubiquitin-dependent manner. However, few reviews have summarized how host E3 ligases/DUBs or viral proteins regulate IRF stability and activity. Additionally, with recent technological developments, details about the ubiquitination of IRFs have been continuously revealed. As knowledge of how these proteins function and interact with IRFs may facilitate a better understanding of the regulation of IRFs in immune responses or other biological processes, we summarized current studies on the direct ubiquitination of IRFs, with an emphasis on how these proteins interact with IRFs and affect their activities, which may provide exciting targets for drug development by regulating the functions of specific E3 ligases. Keywords IRFs ubiquitination E3 ubiquitin ligase viral proteins activation degradation issue-copyright-statement \u00a9 Science China Press and Springer-Verlag GmbH Germany, part of Springer Nature 2021 Compliance and ethics The author(s) declare that they have no conflict of interest. Acknowledgements This work was supported by the National Key Research and Development Program of China (2018YFA0800503 and 2018YFD0500100), an excellent young scientist foundation of NSFC (31822017), Zhejiang Provincial Natural Science Foundation of China (LR19C080001), the National Natural Science Foundation of China (81572651 and 81771675), and the Fundamental Research Funds for the Central Universities. References Arnold MM The rotavirus interferon antagonist NSP1: Many targets, many questions J Virol 2016 90 5212 5215 27009959 Balkhi MY Fitzgerald KA Pitha PM Functional regulation of MyD88-activated interferon regulatory factor 5 by K63-linked polyubiquitination Mol Cell Biol 2008 28 7296 7308 18824541 Barro M Patton JT Rotavirus nonstructural protein 1 subverts innate immune response by inducing degradation of IFN regulatory factor 3 Proc Natl Acad Sci USA 2005 102 4114 4119 15741273 Barro M Patton JT Rotavirus NSP1 inhibits expression of type I interferon by antagonizing the function of interferon regulatory factors IRF3, IRF5, and IRF7 J Virol 2007 81 4473 4481 17301153 Bauhofer O Summerfield A Sakoda Y Tratschin JD Hofmann M A Ruggli N Classical swine fever virus Npro interacts with interferon regulatory factor 3 and induces its proteasomal degradation J Virol 2007 81 3087 3096 17215286 Bhoj VG Chen ZJ Ubiquitylation in innate and adaptive immunity Nature 2009 458 430 437 19325622 Cao C An R Yu YY Dai HY Qu ZH Gao MC Wang JW BICP0 negatively regulates TRAF6-mediated NF-\u03baB and interferon activation by promoting K48-linked polyubiquitination of TRAF6 Front Microbiol 2019 10 3040 31969874 Chattopadhyay S Kuzmanovic T Zhang Y Wetzel JL Sen GC Ubiquitination of the transcription factor IRF-3 activates RIPA, the apoptotic pathway that protects mice from viral pathogenesis Immunity 2016 44 1151 1161 27178468 Chattopadhyay S Sen GC RIG-I-like receptor-induced IRF3 mediated pathway ofapoptosis (RIPA): a new antiviral pathway Protein Cell 2017 8 165 168 27815826 Chen Y Wu Y Yang H Li X Jie M Hu C Wu Y Yang S Yang Y Prolyl isomerase Pin1: a promoter of cancer and a target for therapy Cell Death Dis 2018 9 883 30158600 Chen Z Rijnbrand R Jangra RK Devaraj SG Qu L Ma Y Lemon SM Li K Ubiquitination and proteasomal degradation of interferon regulatory factor-3 induced by Npro from a cytopathic bovine viral diarrhea virus Virology 2007 366 277 292 17531282 Chen ZJ Sun LJ Nonproteolytic functions of ubiquitin in cell signaling Mol Cell 2009 33 275 286 19217402 Deribe YL Pawson T Dikic I Post-translational modifications in signal integration Nat Struct Mol Biol 2010 17 666 672 20495563 Doehle BP Chang K Fleming L McNevin J Hladik F McElrath MJ Gale M Jr. Vpu-deficient HIV strains stimulate innate immune signaling responses in target cells J Virol 2012 86 8499 8506 22647704 Doehle BP Hladik F McNevin JP McElrath MJ Gale M Jr. Human immunodeficiency virus type 1 mediates global disruption of innate antiviral signaling and immune defenses within infected cells J Virol 2009 83 10395 10405 19706707 Dove KK Klevit RE RING-between-RING E3 ligases: emerging themes amid the variations J Mol Biol 2017 429 3363 3375 28827147 Gao B Wang Y Xu W Li S Li Q Xiong S Inhibition of histone deacetylase activity suppresses IFN-y induction of tripartite motif 22 via CHIP-mediated proteasomal degradation of IRF-1 J Immunol 2013 191 464 471 23729439 Gatti M Pinato S Maiolica A Rocchio F Prato MG Aebersold R Penengo L RNF168 promotes noncanonical K27 ubiquitination to signal DNA damage Cell Rep 2015 10 226 238 25578731 Guo Z Xu P Ge S Zhang C Zheng X Xu J Liu Z Li B Ge S Ubiquitin specific peptidase 4 stabilizes interferon regulatory factor protein and promotes its function to facilitate interleukin-4 expression in T helper type 2 cells Int J Mol Med 2017 40 979 986 28791349 Harada H Kitagawa M Tanaka N Yamamoto H Harada K Ishihara M Taniguchi T Anti-oncogenic and oncogenic potentials of interferon regulatory factors-1 and -2 Science 1993 259 971 974 8438157 Harikumar KB Yester JW Surace MJ Oyeniran C Price MM Huang WC Hait NC Allegood JC Yamada A Kong X K63-linked polyubiquitination of transcription factor IRF1 is essential for IL-1-induced production of chemokines CXCL10 and CCL5 Nat Immunol 2014 15 231 238 24464131 Heaton SM Borg NA Dixit VM Ubiquitin in the activation and attenuation of innate antiviral immunity J Exp Med 2016 213 1 13 26712804 Higgs R Jefferies CA Targeting IRFs by ubiquitination: regulating antiviral responses Biochem Soc Trans 2008 36 453 458 18481980 Higgs R Lazzari E Wynne C Ni Gabhann J Espinosa A Wahren-Herlenius M Jefferies CA Self protection from anti-viral responses\u2014Ro52 promotes degradation of the transcription factor IRF7 downstream of the viral Toll-Like receptors PLoS One 2010 5 e11776 20668674 Higgs R Gabhann JN Larbi NB Breen EP Fitzgerald KA Jefferies CA The E3 ubiquitin ligase Ro52 negatively regulates IFN-\u03b2 production post-pathogen recognition by polyubiquitin-mediated degradation of IRF3 J Immunol 2008 181 1780 1786 18641315 Huang H Jeon M Liao L Yang C Elly C Yates JR Liu Y C K33-linked polyubiquitination of T cell receptor-\u03b6 regulates proteolysis-independent T cell signaling Immunity 2010 33 60 70 20637659 Huye LE Ning S Kelliher M Pagano JS Interferon regulatory factor 7 is activated by a viral oncoprotein through RIP-dependent ubiquitination Mol Cell Biol 2007 27 2910 2918 17296724 Ikeda F Dikic I Atypical ubiquitin chains: new molecular signals.\u2019 Protein Modifications: Beyond the Usual Suspects\u2019 review series EMBO Rep 2008 9 536 542 18516089 Jefferies CA Regulating IRFs in IFN driven disease Front Immunol 2019 10 325 30984161 Jin SM Lazarou M Wang C Kane LA Narendra DP Youle RJ Mitochondrial membrane potential regulates PINK1 import and proteolytic destabilization by PARL J Cell Biol 2010 191 933 942 21115803 Karin M Ben-Neriah Y Phosphorylation meets ubiquitination: the control of NF-\u03baB activity Annu Rev Immunol 2000 18 621 663 10837071 Komander D Rape M The ubiquitin code Annu Rev Biochem 2012 81 203 229 22524316 Kong HJ Anderson DE Lee CH Jang MK Tamura T Tailor P Cho HK Cheong JH Xiong H Morse HC III Cutting edge: autoantigen Ro52 is an interferon inducible E3 ligase that ubiquitinates IRF-8 and enhances cytokine expression in macrophages J Immunol 2007 179 26 30 17579016 Landr\u00e9 V Pion E Narayan V Xirodimas DP Ball KL DNA-binding regulates site-specific ubiquitination of IRF-1 Biochem J 2013 449 707 717 23134341 Langer S Hammer C Hopfensperger K Klein L Hotter D De Jesus PD Herbert KM Pache L Smith N van der Merwe JA HIV-1 Vpu is a potent transcriptional suppressor of NF-\u03baB-elicited antiviral immune responses eLife 2019 8 e41930 30717826 Lazear HM Lancaster A Wilkins C Suthar MS Huang A Vick S C Clepper L Thackray L Brassil MM Virgin HW IRF-3, IRF-5, and IRF-7 coordinately regulate the type I IFN response in myeloid dendritic cells downstream of MAVS signaling PLoS Pa-thog 2013 9 e1003118 Lazzari E Korczeniewska J Ni Gabhann J Smith S Barnes BJ Jefferies CA TRIpartite motif 21 (TRIM21) differentially regulates the stability of interferon regulatory factor 5 (IRF5) isoforms PLoS One 2014 9 e103609 25084355 Li X Gadzinsky A Gong L Tong H Calderon V Li Y Kitamura D Klein U Langdon WY Hou F Cbl ubiquitin ligases control B cell exit from the germinal-center reaction Immunity 2018 48 530 541 29562201 Lin R Nie J Ren J Liang R Li D Wang P Gao C Zhuo C Yang C Li B USP4 interacts and positively regulates IRF8 function via K48-linked deubiquitination in regulatory T cells FEBS Lett 2017 591 1677 1686 28477415 Liu J Qian C Cao X Post-translational modification control of innate immunity Immunity 2016 45 15 30 27438764 Marsili G Perrotti E Remoli AL Acchioni C Sgarbanti M Battistini A IFN regulatory factors and antiviral innate immunity: how viruses can get better J Interferon Cytokine Res 2016 36 414 432 27379864 Moll UM Petrenko O The MDM2-p53 interaction Mol Cancer Res 2003 1 1001 1008 14707283 Mukhopadhyay D Riezman H Proteasome-independent functions of ubiquitin in endocytosis and signaling Science 2007 315 201 205 17218518 Murata S Minami Y Minami M Chiba T Tanaka K CHIP is a chaperone-dependent E3 ligase that ubiquitylates unfolded protein EMBO Rep 2001 2 1133 1138 11743028 Narayan V Pion E Landr\u00e9 V M\u00fcller P Ball KL Docking-dependent ubiquitination of the interferon regulatory factor-1 tumor suppressor protein by the ubiquitin ligase CHIP J Biol Chem 2011 286 607 619 20947504 Nehyba J Hrdlickova R Bose HR Dynamic evolution of immune system regulators: the history of the interferon regulatory factor family Mol Biol Evol 2009 26 2539 2550 19638535 Nijman SMB Luna-Vargas MPA Velds A Brummelkamp TR Dirac AMG Sixma TK Bernards R A genomic and functional inventory of deubiquitinating enzymes Cell 2005 123 773 786 16325574 Ning S Campos AD Darnay BG Bentz GL Pagano JS TRAF6 and the three C-terminal lysine sites on IRF7 are required for its ubiquitination-mediated activation by the tumor necrosis factor receptor family member latent membrane protein 1 Mol Cell Biol 2008 28 6536 6546 18710948 Ning S Pagano JS Barber GN IRF7: activation, regulation, modification and function Genes Immun 2011 12 399 414 21490621 Ning S Pagano JS The A20 deubiquitinase activity negatively regulates LMP1 activation of IRF7 J Virol 2010 84 6130 6138 20392859 Okumura A Alce T Lubyova B Ezelle H Strebel K Pitha PM HIV-1 accessory proteins VPR and Vif modulate antiviral response by targeting IRF-3 for degradation Virology 2008 373 85 97 18082865 Pettersson S Kelleher M Pion E Wallace M Ball KL Role of Mdm2 acid domain interactions in recognition and ubiquitination of the transcription factor IRF-2 Biochem J 2009 418 575 585 19032150 Pion E Narayan V Eckert M Ball KL Role of the IRF-1 enhancer domain in signalling polyubiquitination and degradation Cell Signal 2009 21 1479 1487 19450680 Randow F Lehner PJ Viral avoidance and exploitation of the ubiquitin system Nat Cell Biol 2009 11 527 534 19404332 Remoli AL Marsili G Perrotti E Acchioni C Sgarbanti M Borsetti A Hiscott J Battistini A HIV-1 tat recruits HDM2 E3 ligase to target IRF-1 for ubiquitination and proteasomal degradation mBio 2016 7 e01528 27795392 Rhodes DA Ihrke G Reinicke AT Malcherek G Towey M Isenberg DA Trowsdale J The 52 000 MW Ro/SS-A autoantigen in Sjogren\u2019s syndrome/systemic lupus erythematosus (Ro52) is an interferon-gamma inducible tripartite motif protein associated with membrane proximal structures Immunology 2002 106 246 256 12047754 Richardson RJ Dixon J Malhotra S Hardman MJ Knowles L Boot-Handford RP Shore P Whitmarsh A Dixon MJ Irf6 is a key determinant of the keratinocyte proliferation-differentiation switch Nat Genet 2006 38 1329 1334 17041603 Saira K Zhou Y Jones C The infected cell protein 0 encoded by bovine herpesvirus 1 (bICP0) induces degradation of interferon response factor 3 and, consequently, inhibits beta interferon promoter activity J Virol 2007 81 3077 3086 17215277 Saira K Zhou Y Jones C The infected cell protein 0 encoded by bovine herpesvirus 1 (bICP0) associates with interferon regulatory factor 7 and consequently inhibits beta interferon promoter activity J Virol 2009 83 3977 3981 19176627 Saitoh T Tun-Kyi A Ryo A Yamamoto M Finn G Fujita T Akira S Yamamoto N Lu KP Yamaoka S Negative regulation of interferon-regulatory factor 3-dependent innate antiviral response by the prolyl isomerase Pin1 Nat Immunol 2006 7 598 605 16699525 Savitsky D Tamura T Yanai H Taniguchi T Regulation of immunity and oncogenesis by the IRF transcription factor family Cancer Immunol Immunother 2010 59 489 510 20049431 Schneider WM Chevillotte MD Rice CM Interferon-stimulated genes: a complex web of host defenses Annu Rev Immunol 2014 32 513 545 24555472 Stacey KB Breen E Jefferies CA Tyrosine phosphorylation of the E3 ubiquitin ligase TRIM21 positively regulates interaction with IRF3 and hence TRIM21 activity PLoS ONE 2012 7 e34041 22479513 Swaminathan G Tsygankov AY The Cbl family proteins: ring leaders in regulation of cell signaling J Cell Physiol 2006 209 21 43 16741904 Takaoka A Hayakawa S Yanai H Stoiber D Negishi H Kikuchi H Sasaki S Imai K Shibue T Honda K Integration of interferon-a/\u03b2 signalling to p53 responses in tumour suppression and antiviral defence Nature 2003 424 516 523 12872134 Tamura T Yanai H Savitsky D Taniguchi T The IRF family transcription factors in immunity and oncogenesis Annu Rev Immunol 2008 26 535 584 18303999 Thien CBF Langdon WY c-Cbl and Cbl-b ubiquitin ligases: substrate diversity and the negative regulation of signalling responses Biochem J 2005 391 153 166 16212556 Tian Y Zhang Y Zhong B Wang YY Diao FC Wang RP Zhang M Chen DY Zhai ZH Shu HB RBCK1 negatively regulates tumor necrosis factor- and interleukin-1-triggered NF-\u03baB activation by targeting TAB2/3 for degradation J Biol Chem 2007 282 16776 16782 17449468 Tokunaga F Iwai K LUBAC, a novel ubiquitin ligase for linear ubiquitination, is crucial for inflammation and immune responses Microbes Infection 2012 14 563 572 22309894 Tokunaga F Sakata S Saeki Y Satomi Y Kirisako T Kamei K Nakagawa T Kato M Murata S Yamaoka S Involvement of linear polyubiquitylation of NEMO in NF-\u03baB activation Nat Cell Biol 2009 11 123 132 19136968 Tsuchida T Kawai T Akira S Inhibition of IRF3-dependent antiviral responses by cellular and viral proteins Cell Res 2009 19 3 4 19125153 Verweij MC Wellish M Whitmer T Malouli D Lapel M Jonjic S Haas JG DeFilippis VR Mahalingam R Fruh K Varicella viruses inhibit interferon-stimulated JAK-STAT signaling through multiple mechanisms PLoS Pathog 2015 11 e1004901 25973608 Wang Q Liu X Cui Y Tang Y Chen W Li S Yu H Pan Y Wang C The E3 ubiquitin ligase AMFR and INSIG1 bridge the activation of TBK1 kinase by modifying the adaptor STING Immunity 2014 41 919 933 25526307 Welchman RL Gordon C Mayer RJ Ubiquitin and ubiquitin-like proteins as multifunctional signals Nat Rev Mol Cell Biol 2005 6 599 609 16064136 Wu-Baer F Lagrazon K Yuan W Baer R The BRCA1/BARD1 heterodimer assembles polyubiquitin chains through an unconventional linkage involving lysine residue K6 of ubiquitin J Biol Chem 2003 278 34743 34746 12890688 Xiong H Li H Kong HJ Chen Y Zhao J Xiong S Huang B Gu H Mayer L Ozato K Ubiquitin-dependent degradation of interferon regulatory factor-8 mediated by Cbl down-regulates interleukin-12 expression J Biol Chem 2005 280 23531 23539 15837792 Xue Q Liu H Zhu Z Yang F Ma L Cai X Xue Q Zheng H Seneca Valley Virus 3Cpro abrogates the IRF3- and IRF7-mediated innate immune response by degrading IRF3 and IRF7 Virology 2018 518 1 7 29427864 Xue Q Liu H Zhu Z Yang F Xue Q Cai X Liu X Zheng H Seneca Valley Virus 3C protease negatively regulates the type I interferon pathway by acting as a viral deubiquitinase Antiviral Res 2018 160 183 189 30408499 Yanai H Negishi H Taniguchi T The IRF family of transcription factors Oncoimmunology 2012 1 1376 1386 23243601 Yang K Shi HX Liu XY Shan YF Wei B Chen S Wang C TRIM21 is essential to sustain IFN regulatory factor 3 activation during antiviral response J Immunol 2009 182 3782 3792 19265157 Yang M Chen T Li X Yu Z Tang S Wang C Gu Y Liu Y Xu S Li W K33-linked polyubiquitination of Zap70 by Nrdp1 controls CD8 + T cell activation Nat Immunol 2015 16 1253 1262 26390156 Young JA Sermwittayawong D Kim HJ Nandu S An N Erdjument-Bromage H Tempst P Coscoy L Winoto A Fas-associated death domain (FADD) and the E3 ubiquitin-protein ligase TRIM21 interact to negatively regulate virus-induced interferon production J Biol Chem 2011 286 6521 6531 21183682 Yu Y Hayward GS The ubiquitin E3 ligase RAUL negatively regulates type I interferon through ubiquitination of the transcription factors IRF7 and IRF3 Immunity 2010 33 863 877 21167755 Yu Y Wang SE Hayward GS The KSHV immediate-early transcription factor RTA encodes ubiquitin E3 ligase activity that targets IRF7 for proteosome-mediated degradation Immunity 2005 22 59 70 15664159 Zhang C Lu LF Li ZC Zhou XY Zhou Y Chen DD Li S Zhang YA Grass carp reovirus VP56 represses interferon production by degrading phosphorylated IRF7 Fish Shellfish Immunol 2020 99 99 106 32032764 Zhang M Tian Y Wang RP Gao D Zhang Y Diao FC Chen D Y Zhai ZH Shu HB Negative feedback regulation of cellular antiviral signaling by RBCK1-mediated degradation of IRF3 Cell Res 2008 18 1096 1104 18711448 Zhao X Zhu H Yu J Li H Ge J Chen W c-Cbl-mediated ubiquitination of IRF3 negatively regulates IFN-\u03b2 production and cellular antiviral response Cell Signal 2016 28 1683 1693 27503123 Zheng D Chen G Guo B Cheng G Tang H PLP2, a potent deubiquitinase from murine hepatitis virus, strongly inhibits cellular type I interferon production Cell Res 2008 18 1105 1113 18957937 Zheng N Shabek N Ubiquitin ligases: structure, function, and regulation Annu Rev Biochem 2017 86 129 157 28375744 Zhu H Zheng C Xing J Wang S Li S Lin R Mossman KL Varicella-zoster virus immediate-early protein ORF61 abrogates the IRF3-mediated innate immune response through degradation of activated IRF3 J Virol 2011 85 11079 11089 21835786",
    "full_text_abstract": "Interferon regulatory factors (IRFs) play pivotal and critical roles in innate and adaptive immune responses; thus, precise and stringent regulation of the stability and activation of IRFs in physiological processes is necessary. The stability and activities of IRFs are directly or indirectly targeted by endogenous and exogenous proteins in an ubiquitin-dependent manner. However, few reviews have summarized how host E3 ligases/DUBs or viral proteins regulate IRF stability and activity. Additionally, with recent technological developments, details about the ubiquitination of IRFs have been continuously revealed. As knowledge of how these proteins function and interact with IRFs may facilitate a better understanding of the regulation of IRFs in immune responses or other biological processes, we summarized current studies on the direct ubiquitination of IRFs, with an emphasis on how these proteins interact with IRFs and affect their activities, which may provide exciting targets for drug development by regulating the functions of specific E3 ligases."
}