{
    "PMC": "1977555",
    "DOI": "10.1038/bjc.1992.109",
    "PMID": "1562462",
    "PMCID": "PMC1977555",
    "title": "Constitutional p53 mutation in a non-Li-Fraumeni cancer family.",
    "year": 1992,
    "source_url": "https://europepmc.org/article/PMC/PMC1977555",
    "source": "MED",
    "full_text": "pmc Br J Cancer Br J Cancer British Journal of Cancer 0007-0920 1532-1827 Nature Publishing Group 1977555 1562462 Research Article Constitutional p53 mutation in a non-Li-Fraumeni cancer family. Prosser J. Porter D. Coles C. Condie A. Thompson A. M. Chetty U. Steel C. M. Evans H. J. MRC Human Genetics Unit, Western General Hospital, Edinburgh, UK. 4 1992 65 4 527 528 https://creativecommons.org/licenses/by/4.0/ This article is licensed under a Creative Commons Attribution 4.0 International License, which permits use, sharing, adaptation, distribution and reproduction in any medium or format, as long as you give appropriate credit to the original author(s) and the source, provide a link to the Creative Commons license, and indicate if changes were made. The images or other third party material in this article are included in the article\u2019s Creative Commons license, unless indicated otherwise in a credit line to the material. If material is not included in the article\u2019s Creative Commons license and your intended use is not permitted by statutory regulation or exceeds the permitted use, you will need to obtain permission directly from the copyright holder. To view a copy of this license, visit https://creativecommons.org/licenses/by/4.0/ . Images Figure 1",
    "full_text_abstract": "Images Figure 1",
    "abstract_text": "Images Figure 1"
}