{
  "PMC": "2033909",
  "DOI": "10.1038/bjc.1995.385",
  "PMID": "7669573",
  "PMCID": "PMC2033909",
  "title": "High-dose interleukin 2 promotes bacterial translocation from the gut.",
  "year": 1995,
  "source_url": "https://europepmc.org/article/PMC/PMC2033909",
  "source": "MED",
  "abstract_text": "Toxicity associated with high-dose recombinant interleukin 2 (rIL-2) therapy simulates a sepsis syndrome, but the mechanism remains unclear. We hypothesised that translocated gut-origin bacteria may be important. Fifty-one male rats were randomised to receive rIL-2 by intraperitoneal injection at doses (IU) of 10(5) (n = 15), 10(4) (n = 8), 10(3) (n = 8) or 10(2) (n = 8) twice daily, or a saline bolus (n = 12). After 5 days, ileal histomorphology was assessed and the mesenteric lymph node complex cultured. Results showed that colonisation of mesenteric lymph nodes with Escherichia coli occurred in all rats treated with 10(5) IU of rIL-2, and in 62%, 37% and 12% of rats treated with decreasing doses of rIL-2. No translocation was observed in control animals. An increase in submucosal lymphatics and occasional mucosal disruption was seen only in the group receiving 10(5) IU. These data show that rIL-2 promotes bacterial translocation and suggests a mechanism that may fuel high-dose rIL-2 toxicity in man.",
  "full_text": "pmc Br J Cancer Br J Cancer British Journal of Cancer 0007-0920 1532-1827 Nature Publishing Group 2033909 7669573 Research Article High-dose interleukin 2 promotes bacterial translocation from the gut. Reynolds J. V. Murchan P. Leonard N. Gough D. B. Clarke P. Keane F. B. Tanner W. A. Department of Surgery, St. James University Hospital, Leeds, UK. 9 1995 72 3 634 636 https://creativecommons.org/licenses/by/4.0/ This article is licensed under a Creative Commons Attribution 4.0 International License, which permits use, sharing, adaptation, distribution and reproduction in any medium or format, as long as you give appropriate credit to the original author(s) and the source, provide a link to the Creative Commons license, and indicate if changes were made. The images or other third party material in this article are included in the article’s Creative Commons license, unless indicated otherwise in a credit line to the material. If material is not included in the article’s Creative Commons license and your intended use is not permitted by statutory regulation or exceeds the permitted use, you will need to obtain permission directly from the copyright holder. To view a copy of this license, visit https://creativecommons.org/licenses/by/4.0/ . Toxicity associated with high-dose recombinant interleukin 2 (rIL-2) therapy simulates a sepsis syndrome, but the mechanism remains unclear. We hypothesised that translocated gut-origin bacteria may be important. Fifty-one male rats were randomised to receive rIL-2 by intraperitoneal injection at doses (IU) of 10(5) (n = 15), 10(4) (n = 8), 10(3) (n = 8) or 10(2) (n = 8) twice daily, or a saline bolus (n = 12). After 5 days, ileal histomorphology was assessed and the mesenteric lymph node complex cultured. Results showed that colonisation of mesenteric lymph nodes with Escherichia coli occurred in all rats treated with 10(5) IU of rIL-2, and in 62%, 37% and 12% of rats treated with decreasing doses of rIL-2. No translocation was observed in control animals. An increase in submucosal lymphatics and occasional mucosal disruption was seen only in the group receiving 10(5) IU. These data show that rIL-2 promotes bacterial translocation and suggests a mechanism that may fuel high-dose rIL-2 toxicity in man. Images Figure 1",
  "plain_text": "Toxicity associated with high-dose recombinant interleukin 2 (rIL-2) therapy simulates a sepsis syndrome, but the mechanism remains unclear. We hypothesised that translocated gut-origin bacteria may be important. Fifty-one male rats were randomised to receive rIL-2 by intraperitoneal injection at doses (IU) of 10(5) (n = 15), 10(4) (n = 8), 10(3) (n = 8) or 10(2) (n = 8) twice daily, or a saline bolus (n = 12). After 5 days, ileal histomorphology was assessed and the mesenteric lymph node complex cultured. Results showed that colonisation of mesenteric lymph nodes with Escherichia coli occurred in all rats treated with 10(5) IU of rIL-2, and in 62%, 37% and 12% of rats treated with decreasing doses of rIL-2. No translocation was observed in control animals. An increase in submucosal lymphatics and occasional mucosal disruption was seen only in the group receiving 10(5) IU. These data show that rIL-2 promotes bacterial translocation and suggests a mechanism that may fuel high-dose rIL-2 toxicity in man. Images Figure 1"
}
