{
  "PMC": "6275896",
  "DOI": "10.2478/s11658-010-0014-4",
  "PMID": "20428959",
  "PMCID": "PMC6275896",
  "title": "12-O-tetradecanoylphorbol-1, 3-acetate induces the negative regulation of protein kinase B by protein kinase Calpha during gastric cancer cell apoptosis.",
  "year": 2010,
  "source_url": "https://europepmc.org/article/PMC/PMC6275896",
  "source": "MED",
  "abstract_text": "The PKB signaling pathway is essential for cell survival and the inhibition of apoptosis, but its functional mechanisms have not been fully explored. Previously, we reported that TPA effectively inhibited PKB activity and caused PKB degradation, which was correlated with the repression of PKB phosphorylation at Ser473. In this study, we focus on how PKB is regulated by TPA in gastric cancer cells. One of the TPA targets, PKCalpha, was found to mediate the inhibition of PKB phosphorylation and degredation caused by TPA. Furthermore, TPA induced the import of PKCalpha into the nucleus, where PKCalpha exerted an inhibitory effect on PKB expression and phosphorylation. As a result, cancer cell proliferation was arrested. Our study characterizes a novel function of PKCalpha in mediating the negative regulation of PKB by TPA, and suggests a potential application in the clinical treatment of gastric cancer.",
  "full_text": "Cell Mol Biol Lett Cell. Mol. Biol. Lett Cellular & Molecular Biology Letters 1425-8153 1689-1392 SP Versita Heidelberg 6275896 20428959 14 10.2478/s11658-010-0014-4 Research Article 12-O-tetradecanoylphorbol-1, 3-acetate induces the negative regulation of protein kinase B by protein kinase Cα during gastric cancer cell apoptosis Zhang Bing 1 Xia Chun +86 5925921461 +86 5922188680 chunxia99@yahoo.com.cn chunxia@xmu.edu.cn 2 1 grid.12955.3a 0000000122647233 Medical School, Xiamen University, Xiamen, 361005 Fujian Province, China 2 grid.12955.3a 0000000122647233 Zhongshan Hospital, Xiamen University, Xiamen, 361004 Fujian Province, China 20 4 2010 9 2010 15 3 377 394 30 10 2009 10 4 2010 © © Versita Warsaw and Springer-Verlag Wien 2010 The PKB signaling pathway is essential for cell survival and the inhibition of apoptosis, but its functional mechanisms have not been fully explored. Previously, we reported that TPA effectively inhibited PKB activity and caused PKB degradation, which was correlated with the repression of PKB phosphorylation at Ser473. In this study, we focus on how PKB is regulated by TPA in gastric cancer cells. One of the TPA targets, PKCα, was found to mediate the inhibition of PKB phosphorylation and degredation caused by TPA. Furthermore, TPA induced the import of PKCα into the nucleus, where PKCα exerted an inhibitory effect on PKB expression and phosphorylation. As a result, cancer cell proliferation was arrested. Our study characterizes a novel function of PKCα in mediating the negative regulation of PKB by TPA, and suggests a potential application in the clinical treatment of gastric cancer. Keywords Protein kinase B (PKB) Protein kinase Cα (PKCα) Translocation Growth inhibition TPA issue-copyright-statement © © Versita Warsaw and Springer-Verlag Wien 2010 Abbreviations BrdU 5-bromo-2’-deoxyuridine PI3K phosphoinositide-3-OH kinase PDK1/PDK2 3-phosphoinositide-dependent kinase PI propidium iodide PKB protein kinase B PKC protein kinase C TPA 12-O-tetradecanoylphorbol-1,3-acetate WGA wheat germ agglutinin References 1. Brazil D.P. Hemmings B.A. Ten years of protein kinase B signalling: a hard Akt to follow Trends Biochem. Sci. 2001 26 657 664 10.1016/S0968-0004(01)01958-2 11701324 2. Kohn A.D. Kovacina K.S. Roth R.A. Insulin stimulates the kinase activity of RAC-PK, a pleckstrin homology domain containing ser/thr kinase EMBO J. 1995 14 4288 4295 7556070 3. Alessi D.R. Andjelkovic M. Caudwell B. Cron P. Morrice N. Cohen P. Hemmings B.A. Mechanism of activation of protein kinase B by insulin and IGF-1 EMBO J. 1996 15 6541 6551 8978681 4. Andjelkovic M. Jakubowicz T. Corn P. Ming X.F. Han J.W. Hemmings B.A. Activation and phosphorylation of a pleckstrin homology domain containing protein kinase (RAC-PK/PKB) promoted by serum and protein phosphatase inhibitors Proc. Natl. Acad. Sci. USA 1996 93 5699 5704 10.1073/pnas.93.12.5699 8650155 5. Vanhaesebroeck B. Alessi D.R. The PI3k-PDK1 connection: more than just a road to PKB Biochem. J. 2000 346 561 576 10.1042/0264-6021:3460561 10698680 6. Alessi D.R. James S.R. Downes C.P. Holmes A.B. Gaffney P.R. Reese C.B. Cohen P. Characterization of a 3-phosphoinositide-dependent protein kinase which phosphorylates and activates protein kinase B alpha Curr. Biol. 1997 7 261 269 10.1016/S0960-9822(06)00122-9 9094314 7. Kroner C. Eybrechts K. Akkerman J.W. Dual regulation of platelet protein kinase B J. Biol. Chem. 2000 275 27790 27798 10874027 8. Hill M.M. Andjelkovic M. Brazil D.P. Ferrari S. Fabbro D. Hemmings B.A. Insulin-stimulated protein kinase B phosphorylation on Ser-473 is independent of its activity and occurs through a staurosporineinsensitive kinase J. Biol. Chem. 2001 276 25643 25646 10.1074/jbc.C100174200 11373274 9. Andjelkovic M. Maira S.M. Cron P. Parker P.J. Hemmings B.A. Domain swapping used to investigate the mechanism of protein kinase B regulation by 3-phosphoinositide-dependent protein kinase 1 and Ser473 kinase Mol. Cell Biol. 1999 19 5061 5072 10373555 10. Chen D. Fucini R.V. Olson A.L. Hemmings B.A. Pessin J.E. Osmotic shock inhibits insulin signaling by maintaining Akt/protein kinase B in an inactive dephosphorylated state Mol. Cell Biol. 1999 19 4684 4694 10373517 11. Schubert K.M. Scheid M.P. Duronio V. Ceramide inhibits protein kinase B/Akt by promoting dephosphorylation of serine 473 J. Biol. Chem. 2000 275 13330 13335 10.1074/jbc.275.18.13330 10788440 12. Zhang B. Xia C. The expression of protein kinase B in gastric cancer cell apoptosis induced by 12-O-tetradecanoylphorbol-1, 3-acetate Cell. Mol. Biol. Lett. 2009 14 466 480 10.2478/s11658-009-0013-5 19238332 13. Moore E.D. Ring M. Scriven D.R. Smith V.C. Meloche R.M. Buchan A.M. The role of protein kinase C isozymes in bombesin-stimulated gastrin release from human antral gastrin cells J. Biol. Chem. 1999 274 22493 22501 10.1074/jbc.274.32.22493 10428825 14. Kelly M.L. Tang Y. Rosensweig N. Clejan S. Beckman B.S. Granulocyte-macrophage colony-stimulating factor rescues TF-1 leukemia cells from ionizing radiation-induced apoptosis through a pathway mediated by protein kinase Calpha Blood 1998 92 416 424 9657740 15. Shao R.G. Cao C.X. Prommier Y. Activation of PKCalpha downstream from caspases apoptosis induced by 7-hydroxystaurosporine or the topoisomerase inhibitors, camptothecin and etoposide, in human myeloid leukemia HL60 cells J. Biol. Chem. 1997 272 31321 31325 10.1074/jbc.272.50.31321 9395460 16. Iioka Y. Mishima K. Azuma N. Tsuchida A. Takagi Y. Aoki T. Saito I. Overexpression of protein kinase Cdelta enhances cisplatin-induced cytotoxicity correlated with p53 in gastric cancer cell line Pathobiology 2005 72 152 159 10.1159/000084119 15860933 17. Endo K. Kohnoe S. Tsujita E. Watanabe A. Nakashima H. Baba H. Maehara Y. Modulation of anti-apoptosis by endogenous IAP expression in MKN45 human gastric cancer cells Anticancer Res. 2005 25 2713 2717 16080516 18. Zhu G.H. Wong B.C. Slosberg E.D. Eggo M.C. Ching C.K. Yuen S.T. Lai K.C. Soh J.W. Weinstein I.B. Lam S.K. Overexpression of protein kinase C-beta1 isoenzyme suppresses indomethacin-induced apoptosis in gastric epithelial cells Gastroenterology 2000 118 507 514 10.1016/S0016-5085(00)70256-3 10702201 19. Jiang X.H. Lam S.K. Lin M.C. Jiang S.H. Kung H.F. Slosberg E.D. Soh J.W. Weinstein I.B. Wong B.C. Novel target for induction of apoptosis by cyclo-oxygenase-2 inhibitor SC-236 through a protein kinase C-beta(1)-dependent pathway Oncogene 2002 21 6113 6122 10.1038/sj.onc.1205778 12203123 20. Li W. Zhang J. Flechner L. Hyun T. Yam A. Franke T.F. Pierce J.H. Protein kinase C-alpha overexpression stimulates Akt activity and suppresses apoptosis induced by interleukin 3 withdrawal Oncogene 1999 18 6564 6572 10.1038/sj.onc.1203065 10597260 21. Doornbos R.P. Theelen M. Van Der Hoeven P.C. Van Blitterswijk W.J. Verkleij A.J. Van Bergen En Henegouwen P.M. Protein kinase Czeta is a negative regulator of protein kinase B activity J. Biol. Chem. 1999 274 8589 8596 10.1074/jbc.274.13.8589 10085094 22. Kawakami Y. Nishimoto H. Kitaura J. Maeda-Yamamoto M. Kato R.M. Littman D.R. Leitges M. Rawlings D.J. Kawakami T. Protein kinase C betaII regulates Akt phosphorylation on Ser-473 in a cell type- and stimulus-specific fashion J. Biol. Chem. 2004 279 47720 47725 10.1074/jbc.M408797200 15364915 23. Aicher B. Lerch M.M. Muller T. Schilling J. Ullrich A. Cellular redistribution of protein tyrosine phosphatases LAR and PTPsigma by inducible proteolytic processing J. Biol. Chem. 1997 138 681 696 24. Wu Q. Lin X.F. Zhang B. Xie Z. Su W.J. Ubiquitinated or sumoylated retinoic acid receptor alpha determines its characteristic and interacting model with retinoid X receptor alpha in gastric and breast cancer cells J. Mol. Endocrinol. 2004 32 595 613 10.1677/jme.0.0320595 15171703 25. Zhao B.X. Chen H.Z. Lei N.Z. Li G.D. Zhao W.X. Zhan Y.Y. Liu B. Lin S.C. Wu Q. p53 mediates the negative regulation of MDM2 by orphan receptor TR3 EMBO J. 2006 25 5703 5715 10.1038/sj.emboj.7601435 17139261 26. Partovian C. Zhuang Z. Moodie K. Lin M. Ouchi N. Sessa W.C. Walsh K. Simons M. PKCalpha activates eNOS and increases arterial blood flow in vivo Circ. Res. 2005 97 482 487 10.1161/01.RES.0000179775.04114.45 16081872 27. Chipuk J.E. Kuwana T. Bouchier-Hayes L. Droin N.M. Newmeyer D.D. Schuler M. Green D.R. Direct activation of Bax by p53 mediates mitochondrial membrane permeabilization and apoptosis Science 2004 303 1010 1014 10.1126/science.1092734 14963330 28. Lu D. Huang J. Basu A. Deregulation of PKB influences antiapoptotic signaling by PKC in breast cancer cells Int. J. Oncol. 2004 25 671 676 15289868 29. Wu Q. Liu S. Ding L. Ye X. Su W. PKC alpha translocation from mitochondria to nucleus is closely related to induction of apoptosis in gastric cancer cells Science in China 2002 45 237 244 18759046 30. Bunn C.F. Neidig J.A. Freidinger K.E. Stankiewicz T.A. Weaver B.S. Mcgrew J. Allison L.A. Nucleocytoplasmic shuttling of the thyroid hormone receptor alpha Mol. Endocrinol. 2001 15 512 533 10.1210/me.15.4.512 11266504 31. Hermann A. Maisel M. Wegner F. Liebau S. Kim D.W. Gerlach M. Schwarz J. Kim K.S. Storch A. Multipotent neural stem cells from the adult tegmentum with dopaminergic potential develop essential properties of functional neurons Stem Cells 2006 24 949 964 10.1634/stemcells.2005-0192 16373695 32. Kolluri S.K. Bruey-Sedano N. Cao X. Lin B. Lin F. Han Y.H. Dawson M.I. Zhang X.K. Mitogenic effect of orphan receptor TR3 and its regulation by MEKK1 in lung cancer cells Mol. Cell Biol. 2003 23 8651 8667 10.1128/MCB.23.23.8651-8667.2003 14612408 33. Balendran A. Casamayor A. Deak M. Paterson A. Gaffney P. Currie R. Downes P.S. Alessi D.R. PDK1 acquires PDK2 activity in the presence of a synthetic peptide derived from the carboxyl terminus of PRK2 Curr. Biol. 1999 9 393 404 10.1016/S0960-9822(99)80186-9 10226025 34. Delcommenne M. Tan C. Gray V. Rue L. Woodgett J. Dedhar S. Phosphoinositide-3-OH kinase-dependent regulation of glycogen synthase kinase 3 and protein kinase B/AKT by the integrin-linked kinase Proc. Natl. Acad. Sci. USA 1998 95 11211 11216 10.1073/pnas.95.19.11211 9736715 35. Peterson R.T. Schreiber S.L. Kinase phosphorylation: Keeping it all in the family Curr. Biol. 1999 9 R521 R524 10.1016/S0960-9822(99)80326-1 10421571 36. Li L. Sampat K. Hu N. Zakari J. Yuspa S.H. Protein kinase C negatively regulates Akt activity and modifies UVC-induced apoptosis in mouse keratinocytes J. Biol. Chem. 2006 281 3237 3243 10.1074/jbc.M512167200 16338928 37. Munteanu A. Taddei M. Tamburini I. Bergamini E. Azzi A. Zingg J.M. Antagonistic effects of oxidized low density lipoprotein and alphatocopherol on CD36 scavenger receptor expression in monocytes: involvement of protein kinase B and peroxisome proliferator-activated receptor-gamma J. Biol. Chem. 2006 281 6489 6497 10.1074/jbc.M508799200 16407258 38. Partovian C. Simons M. Regulation of protein kinase B/Akt activity and Ser473 phosphorylation by protein kinase Calpha in endothelial cells Cell Signal 2004 16 951 957 10.1016/j.cellsig.2004.01.008 15157674 39. Galetic I. Andjelkovic M. Meier R. Brodbeck D. Park J. Hemmings B.A. Mechanism of protein kinase B activation by insulin/insulin-like growth factor-1 revealed by specific inhibitors of phosphoinositide 3-kinase-significance for diabetes and cancer Pharmacol. Ther. 1999 82 409 425 10.1016/S0163-7258(98)00071-0 10454216 40. Wen H.C. Huang W.C. Ali A. Woodgett J.R. Lin W.W. Negative regulation of phosphatidylinositol 3-kinase and Akt signalling pathway by PKC Cell. Signal 2003 15 37 45 10.1016/S0898-6568(02)00047-5 12401518 41. Wang R. Brattain M.G. AKT can be activated in the nucleus Cell. Signal 2006 18 1722 1731 10.1016/j.cellsig.2006.01.020 16616456 42. Newton A.C. Protein kinase C: structural and spatial regulation by phosphorylation, cofactors, and macromolecular interactions Chem. Rev. 2001 101 2353 2364 10.1021/cr0002801 11749377 43. Martelli A.M. Evangelisti C. Nyakern M. Manzoli F.A. Nuclear protein kinase C Biochim. Biophys. Acta 2006 1761 542 551 16574477 44. Eliyahu E. Shalgi R. A role for protein kinase C during rat egg activation Biol. Reprod. 2002 67 189 195 10.1095/biolreprod67.1.189 12080017 45. Carter C.A. Parham G.P. Chambers T. Cytoskeletal reorganization induced by retinoic acid treatment of human endometrial adenocarcinoma (RL95-2) cells is correlated with alterations in protein kinase C-alpha Pathobiology 1998 66 284 292 10.1159/000028035 9769475",
  "plain_text": "The PKB signaling pathway is essential for cell survival and the inhibition of apoptosis, but its functional mechanisms have not been fully explored. Previously, we reported that TPA effectively inhibited PKB activity and caused PKB degradation, which was correlated with the repression of PKB phosphorylation at Ser473. In this study, we focus on how PKB is regulated by TPA in gastric cancer cells. One of the TPA targets, PKCα, was found to mediate the inhibition of PKB phosphorylation and degredation caused by TPA. Furthermore, TPA induced the import of PKCα into the nucleus, where PKCα exerted an inhibitory effect on PKB expression and phosphorylation. As a result, cancer cell proliferation was arrested. Our study characterizes a novel function of PKCα in mediating the negative regulation of PKB by TPA, and suggests a potential application in the clinical treatment of gastric cancer."
}
