{
    "PMC": "5926111",
    "DOI": "10.1111/j.1349-7006.1999.tb00793.x",
    "PMID": "10429654",
    "PMCID": "PMC5926111",
    "title": "Mutational analysis of STK11 gene in ovarian carcinomas.",
    "year": 1999,
    "source_url": "https://europepmc.org/article/PMC/PMC5926111",
    "source": "MED",
    "abstract_text": "Recently STK11, the causative gene of Peutz-Jeghers syndrome (PJS) was identified on chromosome 19p13.3. PJS is often accompanied by several malignancies, including breast tumor, adenoma malignum of the uterine cervix, and ovarian tumor. To investigate the involvement of STK11 gene in the development of ovarian carcinomas, we analyzed 30 ovarian carcinomas for loss of heterozygosity (LOH) and STK11 gene mutations. We found one missense mutation (codon 281, Pro to Leu) with heterozygous and somatic status. This mutation occurred at codon 281, which lies within the mutational hot spot (codon 279-281) of STK11 gene previously reported in PJS. We also detected LOH in 2 (11%) of 19 informative ovarian carcinomas. Our results suggest that mutations of the STK11 gene may play a limited role in the development of ovarian carcinomas.",
    "full_text": "Jpn J Cancer Res Jpn. J. Cancer Res 10.1111/(ISSN)1349-7006a CAS Japanese Journal of Cancer Research : Gann 0910-5050 1876-4673 Blackwell Publishing Ltd Oxford, UK 5926111 10429654 10.1111/j.1349-7006.1999.tb00793.x CAE629 Article Mutational Analysis of STK11 h Gene in Ovarian Carcinomas Nishioka Yoshihiro 1 Kobayashi Kanji 1 Sagae Satoru 1 Sugimura Masaki 1 Ishioka Shinichi 1 Nagata Masami 1 Terasawa Katuhiko 1 Tokino Takashi 2 Kudo Ryuichi 1 1 Department of Obstetrics and Gynecology, Cancer Research Institute, Sapporo Medical University School of Medicine, S\u20101, W\u20101 7 Chuo\u2010ku, Sapporo, Hokkaido 060\u20100061 2 Department of Molecular Biology, Cancer Research Institute, Sapporo Medical University School of Medicine, S\u20101, W\u20101 7 Chuo\u2010ku, Sapporo, Hokkaido 060\u20100061 * To whom correspondence should be addressed. E\u2010mail: sagaes@sapmed.ac.jp 6 1999 90 6 10.1111/cas.1999.90.issue-6 629 632 (Received February 23, 1999/Revised March 25, 1999/Accepted March 30, 1999) Recently STK11 ,the causative gene of Peutz\u2010Jeghers syndrome (PJS) was identified on chromosome 19p13.3. PJS is often accompanied by several malignancies, including breast tumor, adenoma malignum of the uterine cervix, and ovarian tumor. To investigate the involvement of STK11 gene in the development of ovarian carcinomas, we analyzed 30 ovarian carcinomas for loss of hetero\u2010zygosity (LOH) and STK11 gene mutations. We found one missense mutation (codon 281, Pro to Leu) with heterozygous and somatic status. This mutation occurred at codon 281, which lies within the mutational hot spot (codon 279\u2010281) of STK11 gene previously reported in PJS. We also detected LOH in 2 (11%) of 19 informative ovarian carcinomas. Our results suggest that mutations of the STK11 gene may play a limited role in the development of ovarian carcinomas. STK11 Peutz\u2010Jeghers syndrome Human ovarian carcinoma LOH study Mutation search source-schema-version-number 2.0 cover-date June 1999 details-of-publishers-convertor Converter:WILEY_ML3GV2_TO_NLMPMC version:4.6.9 mode:remove_FC converted:04.11.2015 REFERENCES 1) Peutz , J. L. A. On a very remarkable case of familial polyposis of the mucous membrane of the intestinal tract and nasopharynx accompanied by peculiar pigmentation of the skin and mucous membrane . Ned. Tijdschr. Geneeskd. , 10 , 134 \u2013 146 ( 1921 ). 2) Jeghers , H. , McKusick , V. A. and Katz , K. N. Generalized intestinal polyposis and melanin spot of the oral mucosa, lips and digits . N. Engl. J. Med. , 241 , 1031 \u2013 1036 ( 1946 ). 3) Trau , H. , Schewach\u2010Millet , M. , Fisher , B. K. and Tsur , H. Peutz\u2010Jeghers syndrome and bilateral breast carcinoma . Cancer , 50 , 788 \u2013 792 ( 1982 ). 7093914 4) Podczaski , E. , Kaminski , P. F. , Pees , R. C. , Singapuri , K. and Sorosky , J. I. Peutz\u2010Jeghers syndrome with ovarian sex cord tumor with annular tubules and cervical adenoma malignum . Gynecol. Oncol. , 42 , 74 \u2013 78 ( 1991 ). 1916514 5) Cantu , J. M. , Rivera , H. and Ocampo\u2010Campos , R. Peutz Jeghers syndrome with feminizing Sertori cell tumor . Cancer , 46 , 223 \u2013 228 ( 1980 ). 6770991 6) Young , R. H. , Welch , W. R. , Dickersin , G. E. and Scully , R. E. Ovarian sex stromal tumor with annular tubules. Review of 74 cases including 27 with Peutz\u2010Jeghers syndrome and 4 with adenoma malignum of the cervix . Cancer , 50 , 1384 \u2013 1402 ( 1982 ). 7104978 7) Giardiello , F. M. , Welsh , S. B. , Hamilton , S. R. , Offerhaus , G. J. A. , Gittelsohn , A. M. , Booker , S. V. , Krush , A. J. , Yardeley , J. H. and Luk , G. D. Increased risk of cancer in the Peutz\u2010Jeghers syndrome . N. Engl. J. Med. , 316 , 1511 \u2013 1514 ( 1987 ). 3587280 8) Hemminki , A. , Markie , D. , Tomlison , I. , Avizienyte , E. , Roth , S. , Loukola , A. , Bignell , G. , Warren , W. , Aminoff , M. , Houglund , P. , Jarvinen , H. , Kisto , P. , Pelin , K. , Ridanpaa , M. , Salovaara , R. , Toro , T. , Bodmer , W. , Olshwang , S. , Oslon , S. A. , Stratton , R. M. , Chapelle , A. and Aaltonen , A. L. A serine/threonine kinase gene defective in Peutz\u2010Jeghers syndrome . Nature , 391 , 184 \u2013 187 ( 1998 ). 9428765 9) Jenne , E. D. , Reimann , H. , Nezu , J. , Fridel , W. , Loff , S. , Jeschke , R. , Mullar , O. , Back , W. and Zimmer , M. Peutz\u2010Jeghers syndrome is caused by mutations in a novel serine threonine kinase . Nat. Genet. , 18 , 38 \u2013 43 ( 1998 ). 9425897 10) Nakagawa , H. , Koyama , K. , Miyoshi , Y. , Ando , H. , Baba , S. , Watatani , M. , Yasutomi , M. , Matsuura , N. , Monden , M. and Nakamura , Y. Nine novel germline mutations of STK11 in ten families with Peutz\u2010Jeghers syndrome . Hum. Genet. , 103 , 168 \u2013 172 ( 1998 ). 9760200 11) Hemminki , A. , Tomlison , I. , Markie , D. , Jarvinen , H. , Sistonen , P. , Bjorkqvist , A.\u2010M. , Knuutila , S. , Salovaara , R. , Bodmer , W. , Shibata , D. , Chapelle , A. and Aaltonen , L. A. Localization of a susceptibility locus for Peutz\u2010Jeghers syndrome to 19p using comparative genomic hybridization and targeted linkage analysis . Nat. Genet. , 15 , 87 \u2013 90 ( 1997 ). 8988175 12) Dong , S. M. , Kim , K. M. , Kim , S. Y. , Shin , M. S. , Na , E. Y. , Lee , S. H. , Park , W. S. , Yoo , N. J. , Jang , J. J. , Yoon , C. Y. , Kim , J. W. , Kim , S. Y. , Yang , Y. M. , Kim , S. H. , Kim , S. H. and Lee , J. Y. Frequent somatic mutations in serinine/sereonine kinase 11/Peutz\u2010Jeghers syndrome gene in left side colon cancer . Cancer Res. , 58 , 3787 \u2013 3790 ( 1998 ). 9731485 13) Avizienyte , E. , Roth , S. , Loukola , A. , Hemminki , A. , Lothe , R. A. , Stenwig , A. E. , Fossa , S. D. , Salovaara , R. and Aaltonen , L. A. Somatic mutations in LKB1 are rare in 17) sporadic colorectal and testicular tumors . Cancer Res. , 58 , 2087 \u2013 2090 ( 1998 ). 9605748 14) Bignell , G. R. , Barfoot , R. , Seal , S. , Collins , N. , Warren , W. and Stratton , M. R. Low frequency of somatic mutations in the LKB1/Peutz\u2010Jeghers syndrome gene in sporadic breast cancer . Cancer Res. , 58 , 1384 \u2013 1386 ( 1998 ). 9537235 15) Sato , T. , Saito , H. , Morita , R. , Koi , S. , Lee , J. H. and Nakamura , Y. Alleletype of ovarian cancer . Cancer Res. , 51 , 5118 \u2013 5122 ( 1991 ). 1655245 16) Sato , T. , Tanigami , A. , Yamakawa , K. , Akiyama , F. , Kasumi , F. , Sakamoto , G. and Nakamura , Y. Allelotype of breast cancer: cumulative allele losses promote tumor progression in primary breast cancer . Cancer Res. , 50 , 7184 \u2013 7189 ( 1990 ). 1977515 17) Scully , R. E. , Bonfiglo , T. A. , Kurman , R. J. , Silverberg , S. G. and Wilkinson , E. J. Histological typing of female genital tract tumors . In \u201c International Histological Classification of Tumors\u201d , 2nd Ed. , WHO ( 1996 ). Springer\u2010Verlag , Berlin . 18) FIGO Stages \u2013 1988 Revision. Gynecol. Oncol. . 19) White , H. W. and Kusukawa , N. Agarose\u2010based system for separation of short tandem repeat loci . Biotechniques , 22 , 976 \u2013 980 ( 1997 ). 9149885 20) Kobayashi , K. , Sagae , S. , Kudo , R. , Saito , H. , Koi , S. and Nakamura , Y. Microsatellite instability in endometrial carcinomas . Genes Chromosom. Cancer , 14 , 128 \u2013 132 ( 1995 ). 8527394",
    "full_text_abstract": "Recently STK11 ,the causative gene of Peutz\u2010Jeghers syndrome (PJS) was identified on chromosome 19p13.3. PJS is often accompanied by several malignancies, including breast tumor, adenoma malignum of the uterine cervix, and ovarian tumor. To investigate the involvement of STK11 gene in the development of ovarian carcinomas, we analyzed 30 ovarian carcinomas for loss of hetero\u2010zygosity (LOH) and STK11 gene mutations. We found one missense mutation (codon 281, Pro to Leu) with heterozygous and somatic status. This mutation occurred at codon 281, which lies within the mutational hot spot (codon 279\u2010281) of STK11 gene previously reported in PJS. We also detected LOH in 2 (11%) of 19 informative ovarian carcinomas. Our results suggest that mutations of the STK11 gene may play a limited role in the development of ovarian carcinomas."
}