{
    "PMC": "10692122",
    "DOI": "10.1038/s41467-023-42706-4",
    "PMID": "38040684",
    "PMCID": "PMC10692122",
    "title": "Author Correction: Discovery of an exosite on the SOCS2-SH2 domain that enhances SH2 binding to phosphorylated ligands.",
    "year": 2023,
    "source_url": "https://europepmc.org/article/PMC/PMC10692122",
    "source": "MED",
    "full_text": "pmc Nat Commun Nat Commun Nature Communications 2041-1723 Nature Publishing Group UK London 10692122 38040684 42706 10.1038/s41467-023-42706-4 Author Correction Author Correction: Discovery of an exosite on the SOCS2-SH2 domain that enhances SH2 binding to phosphorylated ligands Linossi Edmond M. 1 2 Li Kunlun 1 2 Veggiani Gianluca 3 Tan Cyrus 1 2 Dehkhoda Farhad 1 2 Hockings Colin 1 2 http://orcid.org/0000-0002-8306-0900 Calleja Dale J. 1 2 Keating Narelle 1 2 http://orcid.org/0000-0001-8376-6869 Feltham Rebecca 1 2 http://orcid.org/0000-0002-2691-1668 Brooks Andrew J. 4 http://orcid.org/0000-0003-3610-9035 Li Shawn S. 5 http://orcid.org/0000-0001-7755-5918 Sidhu Sachdev S. 3 http://orcid.org/0000-0002-5408-6239 Babon Jeffrey J. 1 2 http://orcid.org/0000-0002-3554-2622 Kershaw Nadia J. kershaw@wehi.edu.au 1 2 http://orcid.org/0000-0002-1314-2134 Nicholson Sandra E. snicholson@wehi.edu.au 1 2 1 https://ror.org/01b6kha49 grid.1042.7 0000 0004 0432 4889 The Walter and Eliza Hall Institute of Medical Research, Parkville, VIC Australia 2 https://ror.org/01ej9dk98 grid.1008.9 0000 0001 2179 088X Department of Medical Biology, University of Melbourne, Parkville, VIC Australia 3 https://ror.org/03dbr7087 grid.17063.33 0000 0001 2157 2938 The Donnelly Center for Cellular and Biomolecular Research, University of Toronto, Toronto, ON Canada 4 https://ror.org/00rqy9422 grid.1003.2 0000 0000 9320 7537 The University of Queensland Diamantina Institute, Woolloongabba, QLD 4102 Australia 5 https://ror.org/02grkyz14 grid.39381.30 0000 0004 1936 8884 Department of Biochemistry and the Siebens-Drake Medical Research Institute, Schulich School of Medicine and Dentistry, University of Western Ontario, London, ON Canada 1 12 2023 1 12 2023 2023 14 7951 \u00a9 The Author(s) 2023 https://creativecommons.org/licenses/by/4.0/ Open Access This article is licensed under a Creative Commons Attribution 4.0 International License, which permits use, sharing, adaptation, distribution and reproduction in any medium or format, as long as you give appropriate credit to the original author(s) and the source, provide a link to the Creative Commons license, and indicate if changes were made. The images or other third party material in this article are included in the article\u2019s Creative Commons license, unless indicated otherwise in a credit line to the material. If material is not included in the article\u2019s Creative Commons license and your intended use is not permitted by statutory regulation or exceeds the permitted use, you will need to obtain permission directly from the copyright holder. To view a copy of this license, visit http://creativecommons.org/licenses/by/4.0/ . Subject terms Cell signalling Peptides X-ray crystallography Phosphorylation issue-copyright-statement \u00a9 Springer Nature Limited 2023 Correction to: Nature Communications 10.1038/s41467-021-26983-5, published online 02 December 2021 The original version of this article contained an error in Table 2, in which the original bottom 5 rows showed the incorrect values. The correct version of Table 2 is: Location GHR pY595 (\u03bcM) F3 (\u03bcM) GHR pY595 + F3 (\u03bcM)* SOCS2 mutation WT 1.08 \u00b1 0.07 0.67 \u00b1 0.03 0.15 \u00b1 0.02 L36A ESS 0.80 \u00b1 0.02 ND 1 0.50 \u00b1 0.02 L40F 1.03 \u00b1 0.07 0.81 \u00b1 0.02 0.29 \u00b1 0.02 L40A 1.76 \u00b1 0.21 >50 0.46 \u00b1 0.08 R41A 1.18 \u00b1 0.54 0.89 \u00b1 0.05 0.25 \u00b1 0.07 Q45A 1.32 \u00b1 0.03 0.60 \u00b1 0.34 0.22 \u00b1 0.03 Y49F \u03b2 A 0.98 \u00b1 0.01 0.79 \u00b1 0.01 0.18 \u00b1 0.01 Y99A \u03b2 D 2.03 \u00b1 0.05 ND 1.84 \u00b1 0.4 L81F \u03b2 C 1.88 \u00b1 0.01 ND 1.75 \u00b1 0.27 L82F \u03b2 C 1.17 \u00b1 0.04 1.53 \u00b1 0.03 0.45 \u00b1 0.02 L81, 82F \u03b2 C 0.93 \u00b1 0.34 ND 1.94 \u00b1 0.27 which replaces the previous incorrect version: Location GHR pY595 (\u03bcM) F3 (\u03bcM) GHR pY595 + F3 (\u03bcM)* SOCS2 mutation WT 1.08 \u00b1 0.07 0.67 \u00b1 0.03 0.15 \u00b1 0.02 L36A ESS 0.80 \u00b1 0.02 ND 1 0.50 \u00b1 0.02 L40F 1.03 \u00b1 0.07 0.81 \u00b1 0.02 0.29 \u00b1 0.02 L40A 1.76 \u00b1 0.21 >50 0.46 \u00b1 0.08 R41A 1.18 \u00b1 0.54 0.89 \u00b1 0.05 0.25 \u00b1 0.07 Q45A 1.32 \u00b1 0.03 0.60 \u00b1 0.34 0.22 \u00b1 0.03 Y49F \u03b2 A 0.98 \u00b1 0.01 0.79 \u00b1 0.01 0.18 \u00b1 0.01 S78A BC loop 2.03 \u00b1 0.05 ND 1.84 \u00b1 0.4 Y99A \u03b2 D 1.88 \u00b1 0.01 ND 1.75 \u00b1 0.27 L81F \u03b2 C 1.17 \u00b1 0.04 1.53 \u00b1 0.03 0.45 \u00b1 0.02 L82F \u03b2 C 0.93 \u00b1 0.34 ND 1.94 \u00b1 0.27 L81, 82F \u03b2 C 1.08 \u00b1 0.07 0.67 \u00b1 0.03 0.15 \u00b1 0.02 This has been corrected in both the PDF and HTML versions of the Article."
}