{
    "PMC": "10242086",
    "DOI": "10.1084/jem.20221105",
    "PMID": "37273190",
    "PMCID": "PMC10242086",
    "title": "Inborn errors of human B cell development, differentiation, and function.",
    "year": 2023,
    "source_url": "https://europepmc.org/article/PMC/PMC10242086",
    "source": "MED",
    "abstract_text": "B cells develop from hematopoietic stem cells in the bone marrow. Once generated, they serve multiple roles in immune regulation and host defense. However, their most important function is producing antibodies (Ab) that efficiently clear invading pathogens. This is achieved by generating memory B cells that rapidly respond to subsequent Ag exposure, and plasma cells (PCs) that continually secrete Ab. These B cell subsets maintain humoral immunity and host protection against recurrent infections for extended periods of time. Thus, the generation of antigen (Ag)-specific memory cells and PCs underlies long-lived serological immunity, contributing to the success of most vaccines. Our understanding of immunity is often derived from animal models. However, analysis of individuals with monogenic defects that disrupt immune cell function are unprecedented models to link genotypes to clinical phenotypes, establish mechanisms of disease pathogenesis, and elucidate critical pathways for immune cell development and differentiation. Here, we review fundamental breakthroughs in unraveling the complexities of humoral immunity in humans that have come from the discovery of inborn errors disrupting B cell function.",
    "full_text": "pmc J Exp Med J Exp Med jem The Journal of Experimental Medicine 0022-1007 1540-9538 Rockefeller University Press 10242086 37273190 jem.20221105 10.1084/jem.20221105 Review Immunodeficiency Human disease genetics Lymphocyte Biology Inborn errors of human B cell development, differentiation, and function Human B cells and IEI https://orcid.org/0000-0002-5360-5180 Tangye Stuart G. Conceptualization Formal analysis Funding acquisition Investigation Project administration Supervision Visualization Writing - original draft Writing - review & editing 1 2 https://orcid.org/0000-0003-0709-3636 Nguyen Tina Visualization Writing - original draft 1 2 https://orcid.org/0000-0002-9271-0004 Deenick Elissa K. Writing - original draft Writing - review & editing 1 2 https://orcid.org/0000-0002-4697-7410 Bryant Vanessa L. Writing - original draft Writing - review & editing 3 4 5 https://orcid.org/0000-0001-5387-8413 Ma Cindy S. Supervision Writing - original draft Writing - review & editing 1 2 1 https://ror.org/01b3dvp57 Garvan Institute of Medical Research , Darlinghurst, Australia 2 School of Clinical Medicine, Faculty of Medicine and Health, UNSW Sydney , Sydney, Australia 3 https://ror.org/01b6kha49 Immunology Division, Walter & Eliza Hall Institute , Parkville, Australia 4 Department of Medical Biology, University of Melbourne , Parkville, Australia 5 Department of Clinical Immunology & Allergy, The Royal Melbourne Hospital , Parkville, Australia Correspondence to Stuart G. Tangye: s.tangye@garvan.org.au Disclosures: S.G. Tangye is a member of the Pharming Group NV Global Advisory Board for the use of leniolisib to treat individuals with inborn errors of immunity due to mutations in PIK3CD or PIK3R1 . E.K. Deenick reported \u201cother\u201d from CSL outside the submitted work. No other disclosures were reported. 03 7 2023 05 6 2023 05 6 2023 220 7 e20221105 10 3 2023 08 5 2023 15 5 2023 \u00a9 2023 Tangye et al. 2023 Tangye et al. https://creativecommons.org/licenses/by/4.0/ This article is available under a Creative Commons License (Attribution 4.0 International, as described at https://creativecommons.org/licenses/by/4.0/ ). The fundamental importance of the role of human B cells in host defense against infectious diseases has been established by the discovery of inborn errors of immunity that disrupt B cell development, differentiation, or function. These findings have laid the groundwork for understanding mechanisms of disease and revealing pathways to improve humoral immunity and treat disease. B cells develop from hematopoietic stem cells in the bone marrow. Once generated, they serve multiple roles in immune regulation and host defense. However, their most important function is producing antibodies (Ab) that efficiently clear invading pathogens. This is achieved by generating memory B cells that rapidly respond to subsequent Ag exposure, and plasma cells (PCs) that continually secrete Ab. These B cell subsets maintain humoral immunity and host protection against recurrent infections for extended periods of time. Thus, the generation of antigen (Ag)-specific memory cells and PCs underlies long-lived serological immunity, contributing to the success of most vaccines. Our understanding of immunity is often derived from animal models. However, analysis of individuals with monogenic defects that disrupt immune cell function are unprecedented models to link genotypes to clinical phenotypes, establish mechanisms of disease pathogenesis, and elucidate critical pathways for immune cell development and differentiation. Here, we review fundamental breakthroughs in unraveling the complexities of humoral immunity in humans that have come from the discovery of inborn errors disrupting B cell function. National Health and Medical Research Council http://dx.doi.org/10.13039/501100000925 1176665 2017463 Allergy & Immunology Foundation of Australia Job Research Foundation Sir Clive McPherson Family Fellowship D.W. Keir Fellowship American Association of Immunologists http://dx.doi.org/10.13039/100002570 Introduction B cell development and function B cells develop from hematopoietic stem cells (HSCs) in the bone marrow (BM) through a series of iterations whereby HSCs give rise to common lymphoid progenitors (CLP), which develop into progenitor (pro), precursor (pre), and then immature B cells ( Morgan and Tergaonkar, 2022 ; Pieper et al., 2013 ; Uckun, 1990 ; Fig. 1 ). Each of these stages is characterized by the sequential and temporal rearrangement of genes encoding V, D, and J elements of the IgH chain, acquisition of expression of a pre-B cell receptor (BCR) complex comprising IgH chain and a surrogate IgL chain on large pre-B cells, followed by recombination of genes encoding an IgL chain in small pre-B cells, and then finally expression of a functional BCR on immature B cells. Figure 1. Intrinsic molecular requirements for human B cell development as revealed by IEIs. B cell development occurs in the BM and involves the sequential progression of HSCs into CLP, which then gives rise to progenitor B cells committed to a B cell fate. B cell development requires assembly and expression of a functional BCR. The initial stages of Ig gene rearrangement occur at the early and late pro-B cell stages. Pro-B cells that successfully express cytoplasmic Ig\u00b5 chains develop into pre-BI cells that express a preBCR; rearrangement of Ig L chain genes occurs in pre-BII cells, which then express a functional sIgM molecule. Pre-B cells develop into immature B cells which then give rise to transitional B cells which egress from the BM and enter the peripheral circulation. Genetic variants causing severe disruption to B cell development are shown in red, and those having a milder effect on B cell development are shown in blue. Some of these latter variants also result in an accumulation of transitional B cells (shown in purple). Data for the impact of Pax5 deficiency on B cell development are inferred from studies of a mouse model expressing the human mutations. Rearrangement of genes encoding the V, D, and J elements of the IgH (VDJ) and IgL (VJ) chains during B cell development is regulated by the coordinated induction and activity of the recombination activating genes RAG1 and RAG2 in pro-(VDJ) and pre-(VJ) B cells ( Morgan and Tergaonkar, 2022 ; Pieper et al., 2013 ; Uckun, 1990 ). As VDJ recombination is a random process, some immature B cells that express a BCR recognizing endogenous self-antigens (Ag) will inevitably be generated. To establish B cell tolerance and avoid autoimmunity, developing B cells are screened for self-reactivity. Thus, immature B cells that bind self-Ag with sufficient avidity undergo either receptor editing, which results in expression of a BCR that does not recognize self-Ags, or clonal deletion resulting in elimination of autoreactive B cells ( Pelanda et al., 2022 ; Pieper et al., 2013 ). Immature B cells that do not bind self-Ag, or bind self-Ag with minimal avidity, then exit the BM as transitional B cells, and undergo final maturation and selection to yield a pool of naive B cells capable of recognizing a potentially unlimited number and array of foreign Ags ( Fig. 1 ; Morgan and Tergaonkar, 2022 ; Pelanda et al., 2022 ; Pieper et al., 2013 ; Uckun, 1990 ). Naive B cells differentiate into memory cells and plasma cells (PCs) during germinal center (GC) reactions When naive B cells traffic through secondary lymphoid tissues and encounter foreign Ag, they differentiate into various fates depending on signals provided by the microenvironment. T-independent and T-dependent (TD) Ag can induce naive B cells to rapidly differentiate into short-lived plasmablasts that predominantly secrete IgM and preferentially localize to extrafollicular regions of lymphoid tissues. These cells provide initial protection against pathogen infection ( Tangye and Tarlinton, 2009 ). Activated B cells can also undergo Ig class switch recombination (CSR) to express IgG, IgA, or IgE, and seed GCs, which form transiently in lymphoid tissues. Within GCs, Ag-specific B cells undergo clonal expansion and somatic hypermutation (SHM) of IgV genes. On one hand, GC B cells that acquire the highest affinity for specific Ag compete for limited survival signals provided by CD4 + T follicular helper (Tfh) cells\u2014CD4 + T cells specialized to support B cell differentiation\u2014dendritic cells and follicular dendritic cells generate memory B cells or PCs ( Fig. 2 ; Victora and Nussenzweig, 2022 ). On the other hand, B cells that acquire self-reactivity as a result of SHM, or retain low-affinity BCRs, undergo apoptosis and are purged from the B cell repertoire ( Victora and Nussenzweig, 2022 ). Once generated, memory cells and PCs migrate to lymphoid tissues, peripheral blood, or the BM ( Tangye and Tarlinton, 2009 ; Fig. 2 ). The anatomical distribution of PCs and memory cells enables the immune system to provide basal protection against infection by producing antibodies (Ab) that clear invading pathogens, and responding rapidly following re-encounter with specific pathogens to mitigate infectious diseases ( Robinson et al., 2020 ; Tangye and Tarlinton, 2009 ). Figure 2. IEIs can disrupt human B cell differentiation by intrinsic and extrinsic mechanisms. In secondary lymphoid tissues, Ag-specific naive B cells interact with cognate CD4 + T cells and seed a GC. Here, B cells undergo intense proliferation (clonal expansion) and SHM. GC B cells with the highest affinity for Ag compete for survival signals provided by Tfh cells and then differentiate into memory or PCs that produce high-affinity neutralizing Ig (IgM, IgG, and IgA). IEIs affecting various stages of TD B cell differentiation are shown in red. Inborn errors of immunity (IEIs) reveal the fundamental roles of B cells in host defense IEIs result from monogenic germline variants and are characterized by defects in immune cell development and/or function ( Tangye et al., 2022 ). Due to an immune-deficient state, most affected individuals are susceptible to severe, recurrent, and/or potentially fatal infections. The critical role of humoral immunity in host defense is evident from IEIs that impact B cells ( Pieper et al., 2013 ; Tangye et al., 2022 ). A classic example is the description by Colonel Ogden Bruton in 1952 of the first case of agammaglobulinemia in an 8-yr-old boy who experienced 19 episodes of severe bacterial infection; importantly, infusion of donor immune serum prevented further infections ( Bruton, 1952 ). These observations established that agammaglobulinemia caused recurrent infections, and serum gammaglobulin contained Ab capable of preventing infection. It cannot be emphasized enough that these observations in a single patient not only pre-dated by 4 yr the serendipitous finding by Glick and colleagues that the Bursa of Fabricius was required for generating Ab responses in chickens ( Glick et al., 1956 ), and the formal discovery of B cells by Max Cooper by >10 yr ( Cooper et al., 1965 ), but also led to the findings that: \u2022 X-linked agammaglobulinemia (XLA) is caused by mutations in BTK ( Conley et al., 2009 ); \u2022 Bruton\u2019s tyrosine kinase (BTK) links the BCR to many intracellular signaling pathways and is critical for human B cell development and function; \u2022 Ab deficiency can be treated by Ig replacement therapy irrespective of genetic cause; and \u2022 Pharmacological targeting of BTK would revolutionize treatment for B cell malignancies and some autoimmune conditions decades later ( Garg et al., 2022 ; Gayko et al., 2015 ). Such insights, often gleaned from single patients, kindreds, or small numbers of affected individuals, are frequently repeated such that our understanding of human B cell biology has been greatly enriched by seminal discoveries of IEI that impact B cells ( Fig. 3 ). Figure 3. Timeline of key discoveries of IEI affecting human B cells. Key discoveries over the last 70 yr that have advanced the field of human B cell biology. agamma, agammaglobuliemia; AD, autosomal dominant; AR, autosomal recessive; HIES, hyper IgE syndrome; HIGM, hyper IgM syndrome; XL-HIGM ED, X-linked hyper IgM syndrome with ectodermal dysplasia; X-SCID, X-linked severe combined immunodeficiency; XLP, X-linked lymphoproliferative disease. Agammaglobulinemia and B cell deficiency BTK mutations cause XLA Bruton\u2019s description of congenital agammaglobulinemia is generally acknowledged as being one of the first reports of an IEI ( Bruton, 1952 ; Conley et al., 2009 ; Cooper and Lawton, 1972 ). The first genetic etiology of agammaglobulinemia (i.e., early-onset immunodeficiency, repeated hospitalization for severe life-threatening bacterial infections, <1% peripheral blood B cells, severe reduction of all serum Ig) was identified in 1993 as variants in BTK , an X-linked gene ( Tsukada et al., 1993 ; Vetrie et al., 1993 ; Fig. 3 ). Thus, BTK deficiency causes XLA and accounts for \u223c85% of agammaglobulinemia cases ( Conley et al., 2009 ). BTK deficiency arrests development at the pro-B cell stage ( Fig. 1 ), causing a 100\u20131,000-fold reduction in recirculating B cells, and a lack of all serum Ig isotypes ( Cooper and Lawton, 1972 ; Conley et al., 2009 ; Dobbs et al., 2011 ). The few B cells that can be detected in peripheral blood of XLA patients exhibit a phenotype of immature transitional B cells, characterized by elevated expression of IgM, reduced expression of CD19 and CD21, and BCRs enriched for autoreactive specificities ( Conley, 1985 ; Dobbs et al., 2011 ; Ng et al., 2004 ; Suryani et al., 2010 ). Female carriers of BTK mutations are healthy. Furthermore, their B cells exhibit skewed inactivation of the X chromosome harboring the mutant BTK allele ( Conley et al., 1986 ). This indicates that impaired or absent BTK function causes an intrinsic survival disadvantage in developing B cells. Thus, BTK is necessary for generating a pool of mature B cells capable of responding to foreign Ag to provide Ab-mediated host defense against infection pathogens. Interestingly, a number of cases have been reported of males who presented with recurrent bacterial infections, hypogammaglobulinemia or Ig subclass deficiencies and variable numbers of circulating B cells, and were found to have hypomorphic variants in BTK that had modest effects on B cell development and differentiation ( Geier et al., 2018 ; Kr\u00fcger et al., 2020 ; Mitsuiki et al., 2015 ; Toker et al., 2022 ). This highlights the importance of validating variants in genes that are known to cause disease and identified in individuals with atypical presentations of classic IEIs. Phenocopies of XLA: Elucidation of molecular causes of autosomal recessive (AR) agammaglobulinemia Subsequent studies of cases resembling XLA identified biallelic mutations in IGHM (Ig\u00b5 chain; Yel et al., 1996 ), IGLL1 (\u03bb5 surrogate L chain; Minegishi et al., 1998 ), CD79A (Ig\u03b1; Minegishi et al., 1999a ), CD79B (Ig\u03b2; Dobbs et al., 2007 ; Ferrari et al., 2007 ), BLNK ( Minegishi et al., 1999b ), PIK3R1 ( Conley et al., 2012 ; Tang et al., 2017 ), or PIK3CD ( Sogkas et al., 2018 ; Fig. 3 ). Ig\u00b5, \u03bb5, Ig\u03b1, and Ig\u03b2 comprise the pre-BCR expressed during B cell development. PIK3R1 and PIK3CD encode the p85 regulatory and p110\u03b4 catalytic subunits of PI3K, which is activated following BCR ligation to generate phosphatidylinositol 3,4,5-triphosphate (PIP3). PIP3 binds to and recruits BTK to the cell membrane to undergo autophosphorylation-mediated activation, interacts with BLNK, and then phosphorylates specific substrates ( Fig. 4 ; Conley et al., 2009 ; Niiro and Clark, 2002 ; Tangye et al., 2019 ). Collectively, these cases further highlighted the fundamental requirement for intact BCR signaling in human B cell development, and revealed critical, complementary, coordinated, and integrated roles of BTK, BLNK, and PI3K in this process ( Figs. 1 and 4 ). Interestingly, individuals heterozygous for BLNK , IGHM , IGLL1 , CD79A , or CD79B variants are healthy, indicating that haploinsufficiency or dominant negative (DN) functions of the encoded proteins are not pathogenic. Thus, B cell deficiency and agammaglobulinemia result from loss of expression or loss of function (LOF) of encoded proteins. As BTK , BLNK , IGHM , IGLL1 , CD79A , and CD79B are prominently\u2014or exclusively\u2014expressed in B cells, T cell development and differentiation were largely unaffected in individuals with mutations in these genes. Figure 4. Intracellular signaling pathways and transcriptional networks necessary for human B cell development and differentiation. Diagrammatic representation of the key receptor signaling pathways, intermediates, and transcription factors that cooperatively underpin human B cell development, differentiation, and effector function. B cell development is also severely disrupted by biallelic variants in either RAG1 or RAG2 ( Fig. 1 ; Schwarz et al., 1996 ). These variants reduce the activity of RAG1 and RAG2 proteins, thus preventing rearrangement and recombination of IgH and IgL chains and subsequent assembly of a functional BCR complex ( Fig. 1 ; Schwarz et al., 1996 ). However, unlike other IEI affecting B cell development resulting in agammaglobulinemia, variants in RAG1 or RAG2 cause severe combined immunodeficiency (SCID) because recombination of TCR chains during thymic development is also compromised. Transcription factors required for B cell development IEI also identified key transcription factors necessary for B cell lineage commitment. SPI1 encodes PU.1 that functions at early stages of specification of HSC to the B cell lineage. TCF3 encodes E12 and E47 that are critical for lymphoid progenitors to commit to the B lineage. Within hematopoietic cells, PAX5 is exclusively and stably expressed in B cells and is required for commitment of progenitor cells to the B lineage and progression of developing B cells beyond the pro-B cell stage. PAX5 initiates and maintains B cell commitment by repressing genes that influence HSC commitment to other lineages and promoting expression of genes crucial for B cell development ( Nutt and Kee, 2007 ). Ikaros family members IKAROS ( IKZF1 ), HELIOS ( IKZF2 ), and AIOLOS ( IKZF3 ) are highly expressed in leukocytes and form homo- and hetero-dimers to regulate gene expression and hematopoiesis ( Yamashita and Morio, 2021 ). Recently, individuals with B lymphopenia, agammaglobulinemia, and recurrent sinopulmonary infections due to mutations in TCF3 , SPI1 , PAX5 , IKZF1 , or IKZF3 have been reported ( Fig. 3 ). TCF3. Five unrelated individuals with <1% blood B cells and dramatic reductions in B-lineage BM cells due to a loss of CLPs had heterozygous DN mutations in TCF3 ( Al Sheikh et al., 2021 ; Boisson et al., 2013 ; Dobbs et al., 2011 ). Biallelic nonsense TCF3 variants were also identified in two individuals with B cell deficiency and hypo/agammaglobulinemia ( Ben-Ali et al., 2017 ). In this latter setting, heterozygous carriers of nonsense TCF3 variants were healthy, indicating E2A haploinsufficiency does not impact B cell development ( Figs. 1 and 3 ). SPI1. Six unrelated individuals with heterozygous mutations in SPI1 had 0\u20130.2% blood B cells. Pro-B cells were the only B cells detected in their BM ( Le Coz et al., 2021 ), consistent with PU.1 expression increasing as B cells transit through the pro \u2192 pre stages of development ( Nutt and Kee, 2007 ; Fig. 1 ). PU-1\u2013deficient pro-B cells expressed reduced levels of genes required for B cell development compared to PU.1-sufficient pro-B cells ( IGLL5 , IGHM , CD79B , and BTK ; Le Coz et al., 2021 ). Notably, mutant PU.1 did not affect WT PU.1 function, indicating the mechanism of pathogenicity is PU.1 haploinsufficiency. Thus, human B cell development is strictly dependent on PU.1 dose, as one WT SPI1 allele could not support B cell development in affected individuals ( Le Coz et al., 2021 ). PAX5. A single individual with compound heterozygous PAX5 variants had reduced levels of all serum Ig isotypes and peripheral B-lymphopenia ( Kaiser et al., 2022 ). Mice expressing patient-specific PAX5 alleles ( Pax5 R31Q/E242 * ) had an accumulation of pro-B cells and 5\u201310-fold fewer pre- and immature B cells in BM compared to WT mice ( Fig. 1 ). Pax5 R31Q/E242 * mice also had significantly reduced peripheral B cells and levels of serum IgG (10\u201320-fold), IgA (\u223c5-fold), and IgM (2-fold). Mechanistically, Pax5 R31Q encoded a hypomorphic protein, impaired in regulating 10\u201320% of PAX5 target genes ( Kaiser et al., 2022 ). Thus, human PAX5 deficiency blocks B cell development resulting in B cell cytopenia, hypogammaglobulinemia, and impaired Ab responses. IKZF1. The first case of IKZF1 mutation was reported in 2012 in an infant with pancytopenia, including a near absence of B cells ( Fig. 3 ; Goldman et al., 2012 ). Since then, heterozygous IKZF1 mutations have been reported in \u223c100 individuals. B cell lymphopenia, hypogammaglobulinemia, and recurrent infections are highly penetrant clinical features of most patients with IKZF1 mutations ( Hoshino et al., 2017 ; Kuehn et al., 2022 ; Yamashita and Morio, 2021 ). IKAROS deficiency disrupts B cell development by impairing the generation of CLP and B-lineage cells in the BM ( Fig. 1 ; Hoshino et al., 2017 ; Kuehn et al., 2022 ; Kuehn et al., 2016 ; Yamashita and Morio, 2021 ). Notably, the block in B cell development is quantitative rather than qualitative as proportions of developing B cell subsets in IKAROS deficiency were largely normal ( Hoshino et al., 2017 ; Kuehn et al., 2016 ). Thus, IKZF1 mutations predominantly impact the trajectory of CLP to the B cell lineage ( Fig. 1 ). IKZF3. Three related individuals with recurrent sinopulmonary infections, undetectable blood B cells, and very few BM B cells had a heterozygous IKZF3 variant (AIOLOS G159R ; Yamashita et al., 2021 ). Unlike IKAROS, AIOLOS is absent from CLP and early B cell progenitors but is highly expressed in pre-B cells ( Yamashita et al., 2021 ). Analysis of mice bearing the patient-specific allele ( Ikzf3 +/G159R ) revealed a block at the pre-B cell stage ( Fig. 1 ; Yamashita et al., 2021 ). Importantly, Ikzf3 +/G159R intrinsically affected murine B cell development ( Yamashita et al., 2021 ). Thus, IKZF3 variants cause B cell lymphopenia by disrupting progression of pre-B to immature B cells, rather than impacting the progression of CLP into B-lineage precursors. AIOLOS G159R was LOF for binding canonical DNA sequences defined for WT AIOLOS, gain of function (GOF)/neomorphic for binding novel motifs, and impaired WT AIOLOS from binding target sequences by DN. Furthermore, AIOLOS G159R /IKAROS heterodimers exhibited altered chromatin localization and DNA binding. Thus, AIOLOS G159R compromised B cell development by LOF, GOF, DN, and impeding IKAROS function ( Yamashita et al., 2021 ; Yamashita and Morio, 2021 ). This provides an explanation for the similarity in clinical features of IKAROS and AIOLOS deficiency. Combined, novel IEIs that intrinsically disrupt human B cell development identified key transcriptional regulators with non-redundant roles in commitment of CLP to a B cell fate or regulating expression of key genes required for B cell development ( Figs. 1 and 3 ). Additional genetic causes of agammaglobulinemia and B cell deficiency SLC39A7. The obligate role of divalent cations in signaling pathways is well-established ( Vaeth and Feske, 2018 ). For instance, mutations disrupting Mg 2+ ( MAGT1 ) or Ca 2+ ( STIM1 , ORAI1 ) transport in lymphoid cells ( Vaeth and Feske, 2018 ) cause combined immunodeficiencies (CID) predominantly due to defects in functions of T cells and NK cells, rather than B cells ( Vaeth and Feske, 2018 ). Recently, the importance of zinc in B cell development was revealed by identifying seven individuals from six families with biallelic hypomorphic variants in SLC39A7 , encoding the zinc transporter ZIP7 ( Anzilotti et al., 2019 ; Erd\u0151s et al., 2022 ; Fig. 3 ). All patients had recurrent bacterial infections, agammaglobulinemia, very few blood B cells, and a severe block at the pro \u2192 pre-stage of B cell development ( Fig. 1 ; Anzilotti et al., 2019 ; Erd\u0151s et al., 2022 ). By generating mice carrying patient hypomorphic Slc39a7 alleles, Anzilotti et al. (2019) elegantly determined the causes of the selective B cell deficiency due to impaired ZIP7 function. ZIP7 P198A/P198A mice recapitulated the severe reductions in BM and peripheral B cells, low levels of serum Ig, and an intrinsic block at the pro-B cell stage of development noted in affected humans ( Fig. 1 ). Total phosphatase activity was increased in ZIP7 P198A/P198A B cells, dampening overall BCR signaling. Thus, consistent with zinc inhibiting phosphatases ( Vaeth and Feske, 2018 ), hypomorphic ZIP7 reduces cytoplasmic zinc concentrations thereby enabling increased phosphatase activity which sufficiently attenuates BCR signaling to disrupt B cell development ( Anzilotti et al., 2019 ). Notably, biallelic SLC39A7 variants had no effect on T cell signaling, development, or function ( Anzilotti et al., 2019 ). Thus, similar to mutations in genes encoding the BCR complex ( IGHM , IGLL1 , CD79A , and CD79B ), downstream mediators of BCR signaling ( BTK , BLNK , PIK3R1 , and PIK3CD ), or transcription factors that regulate some of these key genes ( SPIB and PAX5 ), ZIP7 deficiency abolishes early B cell development by impairing BCR function ( Fig. 1 ). FNIP1. Folliculin-interacting protein 1, encoded by FNIP1 , interacts with folliculin to modulate AMP kinase activity, a sensor of energy consumption and regulator of cellular metabolism. Fnip1 deficiency in mice increased mTORC1 activity, mitochondrial biogenesis, and autophagy, disrupting B cell development and causing agammaglobulinemia ( Siggs et al., 2016 ). To date, six patients from five families have been identified with biallelic FNIP1 variants ( Niehues et al., 2020 ; Saettini et al., 2021 ; Fig. 3 ). All patients had frank B cell deficiency, agammaglobulinemia, and recurrent respiratory infections ( Niehues et al., 2020 ; Saettini et al., 2021 ). Limited analysis of BM samples suggested FNIP1 deficiency affects the early stages of B cell development, evidenced by increased proportions of pro-B and pre-B1 cells and reductions in pre-BII and immature B cells ( Niehues et al., 2020 ; Saettini et al., 2021 ; Fig. 1 ). Molecular mechanisms underlying this selective effect of FNIP1 deficiency on early B cell development are unclear. However, increased mTOR and AMPK activity indicates perturbations to cellular energy homeostasis compromise B cell development and/or survival. TOP2B. Topoisomerase 2B induces transient double-stranded DNA breaks to modulate topological chromatin conformation and maintain genomic integrity during replication; it also regulates transcription of particularly long genes ( Austin et al., 2021 ). 11 individuals with B cell immunodeficiency, limb anomalies, and urogenital malformations, or Hoffman\u2019s syndrome were found to have heterozygous TOP2B variants ( Broderick et al., 2019 ; Erd\u0151s et al., 2021 ; Papapietro et al., 2020 ; Fig. 3 ). Despite variability in the impact of TOP2B variants on developmental features, a unifying trait of all patients was greatly reduced peripheral B cells, hypogammaglobulinemia, and recurrent respiratory infections ( Broderick et al., 2019 ; Erd\u0151s et al., 2021 ; Papapietro et al., 2020 ). Analysis of BM from patients and mice harboring a patient mutation ( Top2b EE587E/WT ) identified a block at the CLP \u2192 pro-B stage of development ( Fig. 1 ; Broderick et al., 2019 ; Papapietro et al., 2020 ). TOP2B variants were LOF and DN ( Broderick et al., 2019 ; Papapietro et al., 2020 ). Top2b is more highly expressed in B cells than T cells, and CLPs from Top2b EE587E/WT mice expressed significantly lower levels of Pax5 and Foxo1 \u2014factors important for B cell development ( Nutt and Kee, 2007 )\u2014than Top2b WT/WT CLPs ( Broderick et al., 2019 ). This potentially explains why immune lineages other than B cells were unaffected ( Broderick et al., 2019 ; Erd\u0151s et al., 2021 ; Papapietro et al., 2020 ). Thus, B cell development is highly sensitive to impaired TOP2B function. However, the exact molecular mechanism underlying selective B cell deficiency due to DN TOP2B and altered genomic integrity remains incompletely defined. Inborn errors affecting B cell differentiation and humoral immunity In the 1960s and 1970s, pioneering clinical immunologists were harnessing emerging techniques (of the times!) to characterize different classes of serum gammaglobulins or lymphocytes in distinct immune deficiencies. These studies followed the seminal discoveries of XLA by Bruton in 1952 ( Bruton, 1952 ), of the requirement for the Bursa of Fabricius in chickens to generate Ab responses by Bruce Glick in 1956 ( Glick et al., 1956 ), and of B cells by Max Cooper in 1965 ( Cooper et al., 1965 ; Fig. 3 ). Thus, it became possible to define immune-deficient states according to immune phenotype and serology. Rosen et al. (1961) described two males ( Rosen et al., 1961 ) and one female ( Rosen and Bougas, 1963 ) with recurrent bacterial infections and increased levels of 19S (i.e., modern day IgM) but lacked 7S (i.e., IgG, IgA) gammaglobulins. These probably represent the first reports of XL and AR hyper-IgM syndrome ( Fig. 3 ; Fadlallah et al., 2020 ; Rosen and Bougas, 1963 ). Cooper et al. (1965) and Siegal et al. (1971) extended Rosen\u2019s observation by reporting additional cases of \u201cXL immunodeficiency with hyper-IgM syndrome\u201d (HIGM) and likely cases of AR HIGM, as well as examples of \u201cagammaglobulinemia with B cells\u201d ( Cooper and Lawton, 1972 ; Siegal et al., 1971 ). Over the past 30 yr, the genetic cause of many IEI presenting as severe infections despite intact B cell development has been identified ( Fig. 3 ). These molecular lesions disrupt signaling pathways initiated following interactions between B cells, specific Ag, and cognate CD4 + T cells, resulting in impaired CSR, GC formation, SHM, memory B cell and PC generation, hypogammaglobulinemia, and/or functional Ab deficiency ( Fig. 2 ). Defects in the BCR/CD19 co-receptor complex The BCR interacts with a complex comprising CD19, CD21, CD81, and CD225 ( Fig. 4 ; Wentink et al., 2018 ). CD21 is the receptor for complement component C3d, and CD19 transduces signals following engagement of CD21; CD81 is required for CD19 expression. Ag-C3d aggregates the BCR with the CD19/CD21/CD81 complex, amplifying and sustaining BCR signaling. This also decreases the threshold for B cells to respond to limited Ag and bridges the adaptive and innate immune systems ( Wentink et al., 2018 ). Biallelic mutations in CD19 ( n = 10; Kanegane et al., 2007 ; Skendros et al., 2014 ; van Zelm et al., 2006 ; Vince et al., 2011 ; Wentink et al., 2018 ) or CD81 ( n = 2; van Zelm et al., 2010 ; Yang et al., 2022 ) cause severe recurrent respiratory tract infections, hypogammaglobulinemia (reduced IgG in all; low IgM and/or IgA in \u223c50%), impaired vaccine responses, and reduced memory B cells; however, B cell development is intact ( Fig. 2 ). Although GCs were detected in lymph nodes of CD19-deficient patients ( van Zelm et al., 2006 ), SHM in IgV genes of patient B cells was reduced compared to healthy donors ( Kanegane et al., 2007 ; van Zelm et al., 2014 ; van Zelm et al., 2006 ; van Zelm et al., 2010 ; Wentink et al., 2015 ). Thus, CD19 or CD81 deficiency impedes affinity maturation. Mutations in CD81 abolished CD19 expression on patients\u2019 B cells, indicating the requirement for CD81 in stabilizing CD19 expression, and explaining similarities in clinical features of these IEI ( van Zelm et al., 2010 ; Yang et al., 2022 ). CD19 or CD81 deficiency reduced BCR-mediated signaling, proliferation, and differentiation in B cells from affected patients ( van Zelm et al., 2006 ; van Zelm et al., 2010 ; Yang et al., 2022 ). CD19 mutations also reduced CD21 expression on B cells ( Kanegane et al., 2007 ; van Zelm et al., 2006 ; Vince et al., 2011 ), potentially further compromising function of the BCR/CD19 complex. Heterozygous carriers of CD19 or CD81 mutations are asymptomatic, establishing haploinsufficiency of these genes is not pathogenic. In contrast to CD19 or CD81 deficiency, biallelic CD21 ( CR2 ) mutations causes a milder immunodeficiency: hypogammaglobulinemia, normal/mildly reduced serum IgM or IgA, fewer memory B cells, variable respiratory infections, and low-normal responses to protein and polysaccharide Ags ( n = 4; Rosain et al., 2017 ; Thiel et al., 2012 ; Wentink et al., 2015 ). Responses of CD21-deficient B cells to an Ag-C3 complex were reduced, but direct BCR engagement induced intact B cell activation ( Thiel et al., 2012 ). Furthermore, SHM in CD21-deficient memory B cells was only modestly reduced, and significantly greater than CD19-deficient B cells ( Wentink et al., 2015 ). Thus, although CD19, CD81, and CD21 form a multimeric signaling complex with the BCR, CD19/CD81 and CD21 have unique roles in regulating human B cell responses. Specifically, CD21 deficiency can be compensated by signaling through receptors whose expression and function does not require CD21. CD19 or CD81 deficiency may also reflect effects of these mutations on expression/function of additional co-receptors\u2014CD21\u2014together with loss of CD19. These findings also highlight that CD19 has key roles in B cell responses beyond it functioning exclusively as the signal transduction partner of CD21. The tetraspanin transmembrane molecule CD20 is another well-defined receptor expressed on B cells ( Fig. 4 ); indeed, it is typically used to identify and enumerate human B cells and is the target of the biological therapeutic rituximab used to treat human B cell malignancies and some autoimmune conditions ( LeBien and Tedder, 2008 ; Paley et al., 2017 ). Despite its ubiquitous expression during B cell development and maturation, the specific function of CD20 during humoral immune responses remains enigmatic. Some insights have been gleaned from the discovery of one individual with a homozygous CD20 mutation ( Kuijpers et al., 2010 ). Clinically, the patient experienced intermittent respiratory infections and persistently low levels of serum IgG and was diagnosed with common variable immunodeficiency (CVID) during her first decade of life. Numbers and proportions of B cells, titers and affinity of tetanus-specific IgG, levels of SHM, as well as an in vitro proliferation and calcium flux in response to BCR ligation and T-independent and TD stimuli were intact. However, proportions of class switched memory B cells, Ab responses to pneumococcal vaccination and in vitro production of IgG by activated B cells were reduced ( Fig. 3 ; Kuijpers et al., 2010 ). It should be noted though that as the functional assays relied on responses of total B cells, then any reduction in IgG secretion noted in vitro could reflect the presence of fewer IgG + memory B cells in the patient ex vivo compared to healthy donors. Despite this caveat, while CD20 appears to be dispensable for B cell development and responses to TD Ag, it appears to have a key role in regulating humoral immunity to T-independent Ags. B cell\u2013intrinsic defects directly impacting Ig class switching and SHM A key component of an effective B cell response is CSR in naive B cells to express IgG, IgA, or IgE ( de la Morena, 2016 ; Durandy et al., 2007 ; Notarangelo et al., 2006 ). IEIs intrinsically affecting CSR fall into two categories: those that disrupt signals inducing CSR and those that directly affect the molecular machinery required for this process. Engagement of CD40 on B cells by CD40L expressed on activated CD4 + T cell is a critical driver of CSR. Thus, the former category includes IEIs due to CD40LG (discussed further below) or CD40 mutations. Since 2001, five patients have been identified with CD40 deficiency ( Ferrari et al., 2001 ; Lougaris et al., 2005 ; Renner et al., 2021 ; Fig. 3 ). The original example of the second category was reported in 2000 as AR mutations in AICDA ( Revy et al., 2000 ; Fig. 3 ), encoding activation-induced cytidine deaminase (AID) which is involved in CSR and SHM ( de la Morena, 2016 ; Durandy et al., 2007 ; Notarangelo et al., 2006 ). Subsequently, patients were identified with biallelic mutations in other genes involved in CSR/SHM: UNG ( n = 3; Imai et al., 2003 ), INO80 ( n = 2; Kracker et al., 2015 ), and CTNNBL1 ( n = 1; Kuhny et al., 2020 ; Fig. 3 ). Patients with these B cell\u2013intrinsic IEIs display similar phenotypes: recurrent infections, reduced serum IgA and IgG but normal/high IgM, impaired responses to vaccination, and a deficiency of class-switched memory B cells. However, there are several key clinical differences: CD40/CD40L deficiency results in severe opportunistic infections (due to defects in CD4 + T cell\u2013mediated myeloid cell activation), while patients lacking AID, UNG, or CTNNBL1 exhibit follicular hypoplasia and autoimmunity ( de la Morena, 2016 ; Ferrari et al., 2001 ; Imai et al., 2003 ; Kuhny et al., 2020 ; Lougaris et al., 2005 ; Notarangelo et al., 2006 ; Renner et al., 2021 ; Revy et al., 2000 ). Interestingly, monoallelic AICDA variants that truncate the last 10\u201312 amino acids of AID protein have been identified in 18 patients from seven kindreds with a hyper-IgM-type phenotype ( Durandy et al., 2007 ; Fadlallah et al., 2020 ; Imai et al., 2005 ; Kasahara et al., 2003 ; Kermode et al., 2022 ; Fig. 3 ). These patients presented with recurrent infection, increased levels of serum IgM, reduced serum IgG and IgA, and impaired Ab responses to vaccines and infection. However, whilst CSR was abolished in vivo and in vitro, SHM was unaffected in these patients ( Durandy et al., 2007 ; Fadlallah et al., 2020 ; Imai et al., 2005 ; Kasahara et al., 2003 ; Kermode et al., 2022 ; Fig. 2 ). Patients also did not develop autoimmune features characteristic of AR AID deficiency ( Durandy et al., 2007 ). Thus, AD AICDA variants affecting the C-terminal domain of AID can disrupt Ig CSR resulting in humoral immunodeficiency. This likely results from a DN effect of the truncated AID protein, rather than haploinsufficiency, because carriers of heterozygous AICDA variants\u2014including null mutation\u2014that are pathogenic in the homozygous state are healthy ( Durandy et al., 2007 ; Fadlallah et al., 2020 ). CD40 signaling in B cells initiates SHM and CSR via induction of AID. Thus, it is not surprising that these processes are severely affected by recessive mutations in CD40 or AICDA , or XL CD40LG mutations ( de la Morena, 2016 ; Notarangelo et al., 2006 ; Renner et al., 2021 ; van Zelm et al., 2014 ). Interestingly, while variants in UNG , INO80, and CTNNBL1 all impact CSR, they do not universally affect SHM. Thus, UNG mutations alter the pattern, and possibly quality, but not overall level of SHM ( de la Morena, 2016 ; Imai et al., 2003 ; Notarangelo et al., 2006 ), the CTNNBL1 variant reduced but did not ablate SHM ( Kuhny et al., 2020 ), while INO80 deficiency had little effect on SHM ( de la Morena, 2016 ; Kracker et al., 2015 ; Notarangelo et al., 2006 ). This suggests that the effector function of Ig acquired following CSR is critical to effective host defense even when B cells can undergo SHM and affinity maturation. OBF-1 (also known as OCA-B or BOB1; encoded by POU2AF1 ) is a B cell\u2013specific transcription factor originally considered to be important for regulating Ig transcripts during B cell development ( Teitell, 2003 ). The generation of gene-targeted mice revealed that Obf-1 does have a modest role during B cell development, evidenced by two- to fourfold reductions in numbers of splenic B cells. However, the more striking function of OBF-1 was in governing the formation of GCs and establishing humoral immunity in murine models of viral infection or immunization ( Teitell, 2003 ). Recently, the first case of human OBF-1 deficiency, due to homozygous variants in POU2AF1 , was reported ( Kury et al., 2021 ; Fig. 3 ). Despite normal numbers of peripheral B cells, the OBF-1\u2013deficient patient presented with recurrent respiratory infection, agammaglobulinemia, and an absence of class switched memory B cells ( Kury et al., 2021 ). Furthermore, OBF-1\u2013deficient B cells exhibited impaired biochemical responses and reduced differentiation into IgG-expressing or plasmablast-type cells following in vitro stimulation with CD40L, TLR, or BCR agonists. Importantly, reconstitution of patient-derived OBF-1\u2013deficient B cells with wild-type OBF-1 restored these functional defects, indicating that the POU2AF1 variants identified are likely pathogenic ( Kury et al., 2021 ). These findings highlight a critical role for OBF-1 in human B cell differentiation. As CD40 stimulation induces OBF-1 expression in B cells ( Teitell, 2003 ), OBF-1 deficiency probably disrupts aspects of CD40-induced human B cell activation ( Figs. 2 and 4 ). B cell\u2013extrinsic defects: Impaired generation and function of Tfh cells Defective humoral immunity can result from B cell\u2013extrinsic mechanisms due to mutations in genes predominantly expressed in T cells ( Tangye et al., 2022 ; Tangye and Ma, 2021 ). XL HIGM is caused by hemizygous variants in CD40LG ( Allen et al., 1993 ; Aruffo et al., 1993 ; DiSanto et al., 1993 ; Korth\u00e4uer et al., 1993 ; Ramesh et al., 1993 ). CD40L deficiency causes severe and frequent opportunistic infections ( Pneumocystis , Cryptosporidia ; de la Morena, 2016 ). ICOS deficiency causes recurrent bacterial, viral, and opportunistic infections, immune dysregulation and malignancy ( Grimbacher et al., 2003 ; Schepp et al., 2017 ). The single case of IL-21 deficiency presented with recurrent sinopulmonary infections and early onset colitis ( Salzer et al., 2014 ), while \u223c50% of patients with XL lymphoproliferative disease due to SH2D1A mutations (encoding SAP) have recurrent infections and impaired vaccine responses ( Ma et al., 2007 ). These IEIs all share hypogammaglobulinemia, reduced IgM + and class-switched memory B cells, few or poorly formed GCs, and diminished specific Ab responses ( de la Morena, 2016 ; Ma et al., 2007 ; Renner et al., 2021 ; Salzer et al., 2014 ; Schepp et al., 2017 ; Warnatz et al., 2006 ). Interestingly, IgA + CD27 \u2212 memory B cells persist at normal numbers in CD40L deficiency ( van Zelm et al., 2014 ). Importantly, in vitro function of B cells from these patients is intact ( Ma et al., 2007 ; Ma et al., 2016 ; Mayer et al., 1986 ; Salzer et al., 2014 ), consistent with low or absent expression of CD40L , IL21 , ICOS , or SH2D1A in human B cells. These findings indicated that impaired B cell differentiation results from compromised CD4 + T cell function, specifically Tfh cells. Tfh cells express high levels of CD40L, ICOS, and IL-21, which interact, respectively, with CD40, ICOS-ligand (ICOS-L), and IL-21R on B cells to mediate memory cell and PC generation ( Tangye and Ma, 2021 ). SAP is also highly expressed by Tfh cells and signals downstream of SLAM family receptors on T cells ( Ma et al., 2007 ). IEI due to mutations in CD40 ( Ferrari et al., 2001 ; Lougaris et al., 2005 ), ICOSL ( Roussel et al., 2018 ), or IL21R ( Cagdas et al., 2021 ; Kotlarz et al., 2013 ) phenocopy CD40L, ICOS, or IL-21 deficiencies ( Fig. 2 ). Patients with impaired CD40L/CD40, ICOS/ICOS-L, or IL-21/IL-21R signaling have reduced circulating Tfh (cTfh) cells, while SAP deficiency compromises Tfh cell function ( Fig. 3 ; Tangye and Ma, 2021 ). cTfh cells are also quantitatively and qualitatively reduced by mutations in CARMIL2 (encoding RLTPR; Fig. 2 ), which causes a CID with clinical features including hypogammaglobulinemia, poor humoral/Ag-specific immune responses, and few memory B cells ( L\u00e9vy et al., 2023 ; Wang et al., 2016 ). Interestingly, RLTPR functions downstream of CD28, enabling CD4 + T cell activation and differentiation ( Wang et al., 2016 ). Strikingly, cTfh cells, total and class-switched memory B cells, and levels of total and Ag-specific serum Ig are all intact in CD28-deficient humans ( B\u00e9ziat et al., 2021 ). Thus, this finding reveals that CD28 is dispensable for generating long-lived humoral immunity in humans and indicates fundamental CD28-independent roles for RLTPR in human immunity. These findings underscore the critical role of Tfh cells in mediating B cell differentiation during natural infection and vaccination, even when B cells are intrinsically functional, and highlight how IEI can identify key Tfh-dependent mechanisms regulating humoral immunity. B cell defects due to inborn errors of NF-\u03baB signaling The NF-\u03baB family of transcription factors regulate expression of >500 genes involved in immune cell proliferation, inflammation, development, and survival ( Zhang et al., 2017 ). The canonical pathway (NF-\u03baB1) is activated by many receptors including the BCR, Toll-like receptors, and CD40, while the non-canonical (NF-\u03baB2) pathway is restricted to receptors that are typically expressed by B cells such as CD40, BAFF-R, and lymphotoxin-\u03b2 receptor (LT-\u03b2R), and bind the TNF ligands CD40L, BAFF and APRIL, and LT-\u03b2, respectively ( Fig. 4 ; Zhang et al., 2017 ). When activated, NF-\u03baB1 (p105) and NF-\u03baB2 (p100) are phosphorylated and cleaved to their respective active subunits (p50 and p52) that dimerize with other NF-\u03baB members (RelA/p65, RelB, and c-Rel) and translocate to the nucleus. NF-\u03baB signaling is restrained by inhibitory proteins (e.g., inhibitor of \u03baB [I\u03baB\u03b1]) that retain NF-\u03baB1/2 in the cytoplasm, preventing their activation ( Zhang et al., 2017 ; Fig. 4 ). Here, we review some IEIs due to germline mutations in genes encoding canonical and non-canonical NF-\u03baB pathway proteins that likely contribute to disease via B cell\u2013intrinsic mechanisms. Remarkably, most of these gene defects have little if any effect on B cell development in the BM, indicating that NF-\u03baB signaling is largely redundant for B cell development. NF-\u03baB1 deficiency. NF-\u03baB1/p50 haploinsufficiency, caused by heterozygous mutations in NFKB1 , was initially discovered in 13 individuals from three kindreds with a diagnosis of CVID ( Fliegauf et al., 2015 ; Fig. 3 ). Since then, >200 patients with NFKB1 mutations have been identified that disrupt NF-\u03baB1 expression, stability, phosphorylation, or nuclear transport ( Kaustio et al., 2017 ; Li et al., 2021 ; Lorenzini et al., 2020 ; Tuijnenburg et al., 2018 ; Tuovinen et al., 2023 ). Most affected individuals present with late onset hypogammaglobulinemia, recurrent respiratory tract infections, lymphoproliferation, autoimmunity, B cell lymphopenia, and reductions in switched memory B cells ( Kaustio et al., 2017 ; Li et al., 2021 ; Lorenzini et al., 2020 ; Tuijnenburg et al., 2018 ; Tuovinen et al., 2023 ). Impaired differentiation of patient B cells in vitro argues that NFKB1 variants intrinsically disrupt B cell function ( Tuijnenburg et al., 2018 ). Thus, NF-\u03baB1 LOF compromises human B cell survival and/or differentiation, resulting in immune dysregulation ( Fig. 4 ). IKK\u03b3/NEMO deficiency. IKK\u03b3 (NEMO, NF- \u03baB essential modulator) encoded by IKBKG is a regulatory subunit of the kinase complex that phosphorylates I\u03baB\u03b1 leading to its degradation and subsequent activation and nuclear translocation of NF-\u03baB1 ( Zhang et al., 2017 ). Hemizygous hypomorphic IKBKG mutations cause XL anhidrotic ectodermal dysplasia with immunodeficiency (XL-EDA-ID; D\u00f6ffinger et al., 2001 ; Jain et al., 2001 ). More than 90% of patients suffer from severe recurrent infections, and \u223c60\u201380% exhibit hypogammaglobulinemia, impaired functional Ab responses, and reduced memory B cells ( Hanson et al., 2008 ; Jain et al., 2004 ; Ma et al., 2015 ; Orange et al., 2004 ; Renner et al., 2021 ). The heterogeneity in clinical presentation of NEMO deficiency reflects the extreme variability in NEMO function due to different hypomorphic IKBKG variants ( Hanson et al., 2008 ; Jain et al., 2004 ; Orange et al., 2004 ; Renner et al., 2021 ). These clinical features of XL-EDA-ID are reminiscent of CD40L or CD40 deficiency ( de la Morena, 2016 ; Notarangelo et al., 2006 ; Renner et al., 2021 ). This clinical overlap reflects a key role of NEMO in CD40/NF-\u03baB1 signaling ( Fig. 4 ). Indeed, CD40L-induced cRel activation, proliferation, and Ig CSR were dramatically disrupted in B cells with hypomorphic IKBK G mutations ( Jain et al., 2001 ; Jain et al., 2004 ; Ma et al., 2016 ), indicating that B cell\u2013intrinsic defects contribute to disease etiology due to NEMO deficiency. Furthermore, complete cRel deficiency prevented the generation of Ag-specific Abs, and reduced memory B cell formation and Ig CSR in vivo, as well as intrinsically abolished CD40L-induced B cell differentiation in vitro ( Beaussant-Cohen et al., 2019 ; L\u00e9vy et al., 2021 ; Figs. 3 and 4 ). Thus, CD40L-mediated activation of the NF-\u03baB1 pathway, involving NEMO, NF-\u03baB1, and cRel, is critical for inducing B cell differentiation and establishing humoral immunity ( Figs. 2 and 4 ). Notably, cTfh cells are also reduced in patients with hemizygous IKBK G or recessive CREL mutations ( L\u00e9vy et al., 2021 ; Ma et al., 2015 ), which would further impact humoral immunity. CARD11/BCL10/MALT1 (CBM) complex. The BCR is functionally linked to the NF-\u03baB1 pathway by a multimeric complex comprising CARD11, BCL10, and MALT1 ( Lu et al., 2018 ; Lu et al., 2019 ; Fig. 4 ). CARD11 is recruited to the BCR following ligation, where it is phosphorylated and undergoes conformational change enabling recruitment of BCL10 and MALT1, which constitutively associate with one another. The CBM complex then regulates activation of the canonical NF-\u03baB1 pathway ( Lu et al., 2018 ; Fig. 4 ). Recessive mutations in CARD11 (8 patients; Greil et al., 2013 ; Lu et al., 2021 ; Nguyen et al., 2023a ; Stepensky et al., 2013 ), MALT1 (\u223c20 patients; Charbit-Henrion et al., 2017 ; Frizinsky et al., 2019 ; Jabara et al., 2013 ; Kutukculer et al., 2021 ; McKinnon et al., 2014 ; Punwani et al., 2015 ; Sonoda et al., 2021 ), or BCL10 (4 patients; Al-Tamemi et al., 2022 ; Garcia-Solis et al., 2021 ; Torres et al., 2014 ; Van Den Rym et al., 2020 ) all result in a CID due to profound defects in lymphocyte differentiation ( Lu et al., 2018 ; Lu et al., 2019 ). Deficiencies of these key components of BCR signaling did not disrupt B cell development per se, as circulating B cells were present in the patients in normal numbers. However, there was a marked defect in peripheral B cell development and differentiation, evidenced by an accumulation of immature transitional B cells, a complete absence of memory B cells and hypogammaglobulinemia ( Fig. 1 ). Thus, canonical NF-\u03baB1 signaling mediated via the CBM complex is redundant for B cell development but critical for the generation of a pool of naive B cells ( Lu et al., 2018 ; Lu et al., 2019 ). This likely reflects a B cell\u2013intrinsic requirement for CARD11, BCL10, and MALT1 during the final stages of B cell development that occur in peripheral lymphoid organs, while the paucity of memory B cells may also arise from impaired CD4 + T cell help as these proteins are also expressed in T cells and have similar functions in TCR signaling ( Lu et al., 2018 ; Lu et al., 2019 ). Monoallelic activating variants in CARD11 have also been identified in individuals with childhood-onset polyclonal B cell lymphocytosis. The first clinical description of this condition was actually reported in 1971 ( Darte et al., 1971 ), and it was solved genetically in 2012 when the two daughters of the index case also presented with these clinical features and were investigated by next-generation sequencing ( Snow et al., 2012 ; Fig. 3 ). Since then, \u223c30 cases of CARD11 GOF have been described, with clinical features including B cell lymphocytosis, splenomegaly, lymphadenopathy, and recurrent bacterial (100% of cases) and viral (30\u201345% cases) infections ( Lu et al., 2018 ; Shields et al., 2020 ). Laboratory investigations revealed that the vast increase in peripheral blood B cell numbers was due to an expansion of transitional and naive B cells, but a paucity of total and Ig class-switched memory B cells ( Arjunaraja et al., 2017 ; Figs. 1 and 2 ). Consistent with this block in peripheral B cell maturation, and recurrent infections, serum Ig levels and Ab responses to polysaccharide or protein vaccines were reduced in many patients with CARD11 GOF ( Lu et al., 2018 ; Lu et al., 2019 ). CARD11 GOF B cells were unable to differentiate into PCs following in vitro stimulation, establishing that aberrant CARD11 function disrupts B cell differentiation in a cell intrinsic manner ( Arjunaraja et al., 2017 ). Mechanistically, GOF variants result in spontaneous activation of CARD11 and CBM formation, and subsequent constitutive NF-\u03baB1 signaling without requiring BCR engagement ( Lu et al., 2018 ; Lu et al., 2019 ). Thus, elevated basal NF-\u03baB1 signaling leads to B cell lymphoproliferation and impaired humoral immunity. NF-\u03baB2 deficiency. Inactivating mutations in NFKB2 encoding NF-\u03baB2 (p100/p52) were initially identified in individuals who presented with hypogammaglobulinemia with or without endocrine or autoimmune features ( Brue et al., 2014 ; Chen et al., 2013 ; Lee et al., 2014 ; Liu et al., 2014 ; Fig. 3 ). Most variants target the C-terminus of NF-\u03baB2/p100 ( Klemann et al., 2019 ) which contains critical phosphorylation sites necessary for processing p100 to the active p52 form. Thus, nuclear translocation of p52 was impeded in CD40L-stimulated B cells lines from patients ( Chen et al., 2013 ). Typical clinical features of NFKB2 deficiency are early onset hypogammaglobulinemia, recurrent respiratory infections, poor Ab responses to vaccines, autoimmunity, and adrenocorticotropic deficiency ( Brue et al., 2014 ; Chen et al., 2013 ; Klemann et al., 2019 ; Lee et al., 2014 ; Liu et al., 2014 ). Patients with NFKB2 deficiency exhibit normal/low B cell numbers, or even complete B cell deficiency, possibly due to progressive B cell lymphopenia ( Brue et al., 2014 ; Chen et al., 2013 ; Klemann et al., 2019 ; Lee et al., 2014 ; Liu et al., 2014 ). Interestingly, analysis of BM from one patient revealed a partial block in B cell development at the pre-B stage ( Lougaris et al., 2019 ; Fig. 1 ). When peripheral B cells are present, severe reductions in memory B cells have been observed ( Brue et al., 2014 ; Chen et al., 2013 ; Klemann et al., 2019 ; Lee et al., 2014 ; Liu et al., 2014 ; Fig. 2 ). Notably, the T cell compartment is generally less affected by NFKB2 variants than B cells; however, cTfh cells are generally lower in these patients compared to healthy donors ( Klemann et al., 2019 ; Fig. 2 ). Thus, NF-\u03baB2 signaling, likely downstream of CD40 and BAFF-R, is critical for intact human B cell development, differentiation, and function ( Fig. 4 ). The importance of non-canonical NF-\u03baB2 signaling is further highlighted by the clinical phenotypes of individuals with biallelic variants in either MAP3K14 (encoding NF-\u03baB\u2013inducing kinase [NIK]; Willmann et al., 2014 ), which acts upstream of NF-\u03baB2, or RELB ( Sharfe et al., 2015 ), which dimerizes with NF-\u03baB2 ( Fig. 4 ). Deficiency of NIK or RelB impacts peripheral B cell maturation, evidenced by an accumulation of transitional B cells, hypogammaglobulinemia, and dramatic reductions in circulating memory B cells, as well as impaired CSR and Ab responses to infections and vaccines ( Sharfe et al., 2015 ; Willmann et al., 2014 ). B cells from these patients exhibit poor responses to stimulation with BAFF or CD40L in vitro, including reduced NF-\u03baB2 signaling, survival, upregulation of activation markers, and Ig class switching ( Sharfe et al., 2015 ; Willmann et al., 2014 ), indicating B cell\u2013intrinsic defects contribute to the clinical features of NIK deficiency or RelB deficiency. NIK-deficient B cells also express reduced levels of ICOS-L and fail to further upregulate its expression in response to CD40L signaling ( Willmann et al., 2014 ). Consistent with this, and similar to individuals with mutations in CD40LG , ICOS , ICOSLG , or NFKB2 ( Tangye and Ma, 2021 ), cTfh cells are reduced in NIK-deficient individuals ( Sharfe et al., 2015 ; Willmann et al., 2014 ; Fig. 2 ). While the Tfh deficit may be secondary to defective B cell function, recessive mutations in MAP3K14 or RELB do significantly affect T cells, indicating that the clinical features of these IEI likely result from impaired effector functions of many immune lineages, rather than being disease-causing by predominantly impacting B cells ( Sharfe et al., 2015 ; Willmann et al., 2014 ). Impaired signaling via BAFF and APRIL. Two siblings have been reported with homozygous mutations in TNFRSF13C , encoding BAFF-R which signals predominantly via the NF-\u03baB2 pathway ( Warnatz et al., 2009 ; Fig. 4 ). Laboratory findings of these individuals partially overlapped with NIK deficiency or RelB deficiency, including B cell lymphopenia, reduced serum IgM and IgG (but normal levels of IgA), poor responses to pneumococcal polysaccharides vaccines, an accumulation of transitional B cells and corresponding paucity of total and class-switched memory B cells in peripheral blood. However, B cell development in the BM, SHM in peripheral blood B cells, Ab responses to tetanus vaccination, as well as the distribution of T cell subsets were unaffected by BAFF-R deficiency ( Warnatz et al., 2009 ). Thus, impaired BAFF-R signaling results in a selective block in B cell maturation at the transitional \u2192 naive stages ( Figs. 1 and 4 ), thereby significantly impacting the final stages of B cell development that occur in the periphery and manifesting as B cell deficiency and impaired T-independent immune responses. This is consistent with BAFF functioning as a survival factor for human and murine B cells ( Tangye et al., 2006 ). Interestingly, the index case was diagnosed with CVID late in life (aged 57 yr) following a history of recurrent infections ( Warnatz et al., 2009 ), while recessive TNFRSF13C mutations were clinically silent in the sibling, suggesting compensatory pathways may overcome BAFF-R deficiency. Despite this, the discovery of individuals with BAFF-R deficiency has shed light on mechanisms underlying different IEIs affecting NF-\u03baB. Thus, as BAFF-R almost exclusively signals via the NF-\u03baB2 pathway ( Tangye et al., 2006 ), impaired responsiveness to BAFF likely explains defective peripheral B cell maturation in individuals with NIK or RelB deficiency ( Sharfe et al., 2015 ; Willmann et al., 2014 ), while an inability to respond to CD40L and other TNFR ligands would contribute to the more severe clinical phenotype of these patients compared to those with BAFF-R deficiency. BAFF can also bind the TNFR-SF members TACI and BCMA; furthermore, the related TNF ligand APRIL binds TACI and BCMA, but not BAFF-R ( Tangye et al., 2006 ; Pieper et al., 2013 ). Heterozygous variants have been identified in TNFRSF13B , encoding TACI, in 5\u201310% of CVID patients ( Bogaert et al., 2016 ; Pieper et al., 2013 ). However, the same TNFRSF13B variants are present in 1\u20132% of healthy donors, and the penetrance of a CVID phenotype due to TNFRSF13B variants is incredibly variable ( Bogaert et al., 2016 ). Thus, TNFRSF13B variants are likely to be disease-modifying alleles rather than pathogenic. Recently, the first case of APRIL deficiency due to homozygous nonsense variants in TNFSF13 , encoding APRIL, was reported in an individual diagnosed with adult-onset CVID ( Yeh et al., 2020 ; Fig. 3 ). The patient presented with hypogammaglobulinemia (low IgM, IgG; very low IgA) and mild infections that were controlled with Ab replacement. While numbers of peripheral B cells, including IgG + and IgA + memory B cells, the BCR repertoire and levels of SHM were similar to healthy donors, circulating PCs were reduced 10-fold in the absence of APRIL ( Yeh et al., 2020 ; Fig. 4 ). Although it is difficult to draw too many conclusions from a single case, these findings confirm a likely role for APRIL in maintaining PC survival and serum Ig levels ( Fig. 2 ). However, like BAFF-R deficiency, the clinical phenotype of APRIL deficiency was late onset and relatively mild, suggesting modest, albeit important, roles for the BAFF/APRIL system in maintaining humoral immunity in humans. Indeed, the findings that IgA levels are particularly low in APRIL deficiency ( Yeh et al., 2020 ), but IgA + CD27 \u2212 B cells are present at normal numbers in CD40L deficiency ( van Zelm et al., 2014 ), suggests APRIL predominantly regulates IgA class-switching and production by human PC. Dysregulated PI3K signaling causes immune dysregulation Biallelic mutations in PIK3R1 or PIK3CD established the fundamental requirement for PI3K signaling in B cell development ( Fig. 1 ; Conley et al., 2012 ; Sogkas et al., 2018 ; Tang et al., 2017 ). The discovery of heterozygous GOF PIK3CD (p110\u03b4 catalytic subunit; Angulo et al., 2013 ; Lucas et al., 2014a ) or LOF PIK3R1 (p85 regulatory subunit) mutations ( Deau et al., 2014 ; Lucas et al., 2014b )\u2014which both increase PI3K activation\u2014revealed a key role for balanced PI3K signaling in B cell development and differentiation ( Fig. 3 ). Affected individuals present with recurrent respiratory infections, poor immune responses to vaccines, hypogammaglobulinemia with occasional increased levels of serum IgM, susceptibility to viral infections, lymphadenopathy, autoimmunity, and B cell malignancy ( Angulo et al., 2013 ; Deau et al., 2014 ; Lucas et al., 2014a ; Lucas et al., 2014b ; Tangye et al., 2019 ). These conditions are termed activated PI3K-\u03b4 syndrome (APDS1: PIK3CD ; APDS2: PIK3R1 ). PIK3CD GOF and PIK3R1 LOF variants cause a partial block at the pro/pre-B cell stage, resulting in few mature B cells in the BM ( Fig. 1 ). APDS patients also have low numbers of peripheral B cells, significantly increased frequencies of transitional cells, and reductions in naive and memory cells ( Figs. 1 and 2 ; Avery et al., 2018 ; Dulau Florea et al., 2017 ; Nguyen et al., 2023b ). In vitro assessment revealed intrinsic differentiation defects, evidenced by impaired CSR and Ig secretion by PIK3CD GOF/ PIK3R1 LOF B cells ( Avery et al., 2018 ; Nguyen et al., 2023b ), which likely contribute to poor humoral immune responses in APDS. Importantly, some in vitro B cell defects could be overcome by pharmacological attenuation of p110\u03b4 ( Avery et al., 2018 ; Nguyen et al., 2023b ), thus establishing that hyperactive PI3K causes this disorder. Indeed, the p110\u03b4-specific inhibitor leniolisib corrects aberrant B cell phenotypes in vivo and substantially improves clinical features of APDS ( Rao et al., 2022 ). PI3K is directly regulated by the lipid phosphatases PTEN and SHIP ( Tangye et al., 2019 ). Heterozygous PTEN mutations are associated with PTEN harmatoma tumor syndromes and neurodevelopmental delay ( Tangye et al., 2019 ). However, PTEN deficiency has recently also been associated with an APDS-like clinical phenotype, including autoimmunity, lymphoid hyperplasia, hypogammaglobulinemia, reduced responses to vaccinations and recurrent infections, CD4 + T cell lymphopenia, transitional B cell accumulation, and reduced memory B cells ( Browning et al., 2015 ; Chen et al., 2017 ; Driessen et al., 2016 ; Tsujita et al., 2016 ). The underlying biochemical defect in these patients is likely to be similar to PIK3CD GOF and PIK3R1 LOF individuals, as PTEN mutations also result in enhanced PI3K signaling ( Browning et al., 2015 ; Tsujita et al., 2016 ). However, more detailed analysis of immune defects in individuals with PTEN mutations is required to determine whether the severity and penetrance of their clinical feature are as dramatic as those observed in individuals with PIK3CD GOF or PIK3R1 LOF mutations. IL-21R/STAT3 signaling in B cells is required for generating long-lived humoral immunity and memory Over the past four decades, studies have established that many cytokines induce human B cell differentiation in vitro ( Moens and Tangye, 2014 ). However, assessment of humoral immunity and memory in IEIs has revealed that IL-21 is the fundamental cytokine driving human B cell differentiation in vivo. IL-21R comprises the IL-21R chain associated with the common \u03b3 chain (\u03b3c). IL-21/IL-21R signaling activates STAT1, STAT3, and STAT5, and induces lymphocyte proliferation, differentiation, and effector function ( Leonard, 2001 ; Tangye and Ma, 2020 ). A key regulator of STAT3 expression and activation is the transcription factor ZNF341 ( Fig. 4 ; B\u00e9ziat et al., 2018 ; Frey-Jakobs et al., 2018 ). Strikingly, IL-21 induces all the intrinsic molecular requirements necessary for GC formation and B cell differentiation: proliferation, AICDA and IRF4 for CSR, BCL6 to form GCs, and PRDM1 (Blimp-1), XBP1 , and IRF4 to mediate PC formation ( Avery et al., 2010 ; Deenick et al., 2013 ; Dvorscek et al., 2022 ; Quast et al., 2022 ; Tangye and Ma, 2020 ). DN STAT3 ( Holland et al., 2007 ; Minegishi et al., 2007 ) or biallelic LOF ZNF341 ( B\u00e9ziat et al., 2018 ; Frey-Jakobs et al., 2018 ) mutations cause recurrent bacterial and fungal infections, impaired functional Ab responses and few circulating memory B cells ( Avery et al., 2010 ; B\u00e9ziat et al., 2018 ; Chandesris et al., 2012 ; Frey-Jakobs et al., 2018 ; Leung et al., 1988 ; Sheerin and Buckley, 1991 ). STAT3 DN or ZNF341 LOF naive B cells fail to differentiate in vitro into Ab-secreting cells in response to IL-21 ( Avery et al., 2010 ; B\u00e9ziat et al., 2018 ; Deenick et al., 2013 ). Interestingly, biallelic variants in IL21 or IL21R cause recurrent infections, hypogammaglobulinemia, and reductions in Ag-specific Ab and total and class-switched memory B cells ( Cagdas et al., 2021 ; Kotlarz et al., 2013 ; Ma et al., 2015 ). Not surprisingly, mutations in IL21R or IL2RG (\u03b3c) prevent B cell responses to IL-21 ( Cagdas et al., 2021 ; Kotlarz et al., 2013 ; Recher et al., 2011 ; Tangye et al., 2023 ). Furthermore, memory B cell formation, humoral immunity and hypogammaglobulinemia were not restored by HSC transplant of patients with IL2RG variants who retained their own \u03b3c-deficient B cells but engrafted donor ( IL2RG WT) T cells after transplant ( Recher et al., 2011 ). Inborn errors affecting IL-10/IL-10R, IL-12/IL-12R, IL-23R, IL-6R, IFN\u03b3/IFN\u03b3R, type I IFN/IFN\u03b1R, or IL-17/IL-17R have a mild\u2014if any\u2014impact on humoral immunity, as determined by quantifying basal levels of memory B cells and serum Ig, as well as of Ag-specific memory B cells and Abs following natural infection and/or vaccination ( Beziat et al., 2020 ; Chen et al., 2021 ; Kotlarz et al., 2012 ; Ma et al., 2015 ; Philippot et al., 2023 ; Schwerd et al., 2017 ; Shahin et al., 2019 ; Sharifinejad et al., 2022 ; Sokal et al., 2023 ; Spencer et al., 2019 ). Consistent with this, memory B cell formation and serum Ig levels are within or exceed normal ranges in patients with inactivating mutations in STAT1 , which is activated by several of these cytokines ( Avery et al., 2010 ; Deenick et al., 2013 ; Ma et al., 2015 ). Combined, these findings revealed that IL-21R:\u03b3c/STAT3/ZNF341 signaling in B cells is the predominant cytokine pathway responsible for inducing and maintaining robust long-lived humoral immunity in humans ( Fig. 2 ). A novel IEI was recently reported in seven individuals from six families due to a recurrent heterozygous IRF4 variant (IRF4 T95R ; International Consortium et al., 2023 ). These patients had opportunistic infections, agammaglobulinemia, and a severe deficiency of memory B cells and PC. Patient naive B cells were unable to undergo CSR and PC differentiation in vitro, establishing that B cell\u2013intrinsic effects of IRF4 T95R contributed to their humoral defects ( International Consortium et al., 2023 ). IL-21 induces IRF4 expression in activated B cells ( Deenick et al., 2013 ; Luo et al., 2023 ), and IRF4 upregulates AID and promotes CSR and PC generation in vivo in an IL-21\u2013dependent manner ( Klein et al., 2006 ; Luo et al., 2023 ). Thus, the overlap in clinical features of patients with IL-21R deficiency or IRF4 T95R may reflect the IL-21/IRF4 axis being a major regulator of late B cell differentiation ( Figs. 2 and 4 ). Notably, cTfh cells are also reduced in patients with the IRF4 T95R variant ( International Consortium et al., 2023 ), confirming a role for IRF in Tfh generation ( Fig. 3 ). Humans are not mice Much of our understanding of immunology has been derived from studies performed in mouse models. This, of course, is an entirely suitable approach to address biological and physiological phenomena\u2014however, it is often assumed that mechanisms underpinning processes in one species also apply in another. And while this can indeed be true, it isn\u2019t always. Thus, it is worth highlighting that the study of IEI has revealed fundamental differences between the molecular requirements for B cell development and differentiation between mice and humans. Examples include: \u2022 The block in B cell development in mice lacking Btk occurs later than in humans with XLA; this results in a milder reduction in numbers of peripheral B cells and levels of serum Ig ( Conley et al., 2009 ); \u2022 Baffr deficiency in mice impedes B cell development at the early transitional stage, resulting in dramatic reductions in B cell numbers and an immunodeficient state that is not recapitulated in humans with TNFRSF13B mutations ( Bogaert et al., 2016 ; Pieper et al., 2013 ; Warnatz et al., 2009 ); \u2022 Unlike mice lacking IL-7/IL-7R signaling, B cells develop in humans with biallelic variants in IL7RA ( Giliani et al., 2005 ; Puel and Leonard, 2000 ), suggesting human B cell development is independent of IL-7. These examples are not simply important from a biological perspective but also clinically, because therapies have been developed that target BTK (ibrutinib) or BAFF (belilumab) to treat B cell diseases ( Paley et al., 2017 ), or utilize IL-7 as an immunostimulatory adjuvant therapy for treating cancer, HIV, or immune reconstitution ( Morre and Beq, 2012 ). Thus, understanding the roles of these molecules and pathways in humans is critical to ensure maximum efficacy of targeted therapeutics in treating human immune dyscrasias. Conclusion It has been over 70 yr since Bruton first reported agammaglobulinemia, and 30 yr since the discovery that BTK mutations cause XLA. By studying inborn errors affecting humoral immunity, the past three decades has seen an exponential increase in our understanding of fundamental molecular, biochemical, and cellular requirements underpinning the development and differentiation of human B cells. These studies have identified non-redundant intrinsic signaling pathways, transcriptional networks, and cognate cell\u2013cell interactions that enable the generation of immunocompetent naive B cells that undergo Ag-specific expansion and affinity maturation to generate memory cells and PC to ensure long-lived humoral immunity and host defense against infectious disease. Discoveries from IEI have also impacted our understanding of mechanisms causing immune dysregulation (autoimmunity, allergy, and malignancy), enabled therapeutic interventions for B cell\u2013mediated immunopathologies, and have the potential to improve the design of future vaccinations strategies. However, as starkly revealed by the COVID-19 pandemic, we still have much to learn about long-lived humoral immunity and maximizing vaccine efficacy. No doubt these and other unknowns will be solved in part by future discoveries of novel inborn errors affecting human B cells. Acknowledgments We thank the many patients and their families who have participated in research studies performed in our labs that have enabled us to make some of the findings discussed in this review. S.G. Tangye and C.S. Ma also thank their long-term colleagues and collaborators (Jean-Laurent Casanova, Gulbu Uzel, Vivien Beziat, Satoshi Okada, Isabelle Meyts, Anne Puel, Stephanie Boisson-Dupuis, Jacinta Bustamante, Peter Arkwright, Kaan Boztug, Klaus Warnatz, Polina Stepensky, Steve Holland, Alexandra Freeman, Paul Gray, Peter Hsu, Melanie Wong, John Ziegler, Jo Smart, Jane Peake, and Martyn French), as well as current and former members of their labs, without whom much of this work would not have been possible. S.G. Tangye and C.S. Ma are supported by investigator grants awarded by the National Health and Medical Research Council of Australia (1176665 [S.G. Tangye] and 2017463 [C.S. Ma]) and project grants from the Allergy & Immunology Foundation of Australia, the American Association of Immunologists, and the Job Research Foundation. V.L. Bryant is supported by the Sir Clive McPherson Family Fellowship and the D.W. Keir Fellowship. References Al Sheikh , E. , P.D. Arkwright , A. Herwadkar , T. Hussell , and T.A. Briggs . 2021 . TCF3 dominant negative variant causes an early block in B-lymphopoiesis and agammaglobulinemia . J. Clin. Immunol. 41 : 1391 \u2013 1394 . 10.1007/s10875-021-01049-9 33905048 Al-Tamemi , S. , Z. Alhinai , N. Al-Rahbi , R. Al-Abdawani , L. Al-Yazidi , J. Al-Shekaili , M. Al-Kindi , and A. Al-Maawali . 2022 . BCL10 loss-of-function novel mutation leading to atypical severe combined immunodeficiency . Clin. Immunol. 241 : 109067 . 10.1016/j.clim.2022.109067 35750252 Allen , R.C. , R.J. Armitage , M.E. Conley , H. Rosenblatt , N.A. Jenkins , N.G. Copeland , M.A. Bedell , S. Edelhoff , C.M. Disteche , D.K. Simoneaux , . 1993 . CD40 ligand gene defects responsible for X-linked hyper-IgM syndrome . Science . 259 : 990 \u2013 993 . 10.1126/science.7679801 7679801 Angulo , I. , O. Vadas , F. Gar\u00e7on , E. Banham-Hall , V. Plagnol , T.R. Leahy , H. Baxendale , T. Coulter , J. Curtis , C. Wu , . 2013 . Phosphoinositide 3-kinase \u03b4 gene mutation predisposes to respiratory infection and airway damage . Science . 342 : 866 \u2013 871 . 10.1126/science.1243292 24136356 Anzilotti , C. , D.J. Swan , B. Boisson , M. Deobagkar-Lele , C. Oliveira , P. Chabosseau , K.R. Engelhardt , X. Xu , R. Chen , L. Alvarez , . 2019 . An essential role for the Zn 2+ transporter ZIP7 in B cell development . Nat. Immunol. 20 : 350 \u2013 361 . 10.1038/s41590-018-0295-8 30718914 Arjunaraja , S. , B.D. Nos\u00e9 , G. Sukumar , N.M. Lott , C.L. Dalgard , and A.L. Snow . 2017 . Intrinsic plasma cell differentiation defects in B cell expansion with NF-\u03baB and T cell anergy patient B cells . Front. Immunol. 8 : 913 . 10.3389/fimmu.2017.00913 28824638 Aruffo , A. , M. Farrington , D. Hollenbaugh , X. Li , A. Milatovich , S. Nonoyama , J. Bajorath , L.S. Grosmaire , R. Stenkamp , M. Neubauer , . 1993 . The CD40 ligand, gp39, is defective in activated T cells from patients with X-linked hyper-IgM syndrome . Cell . 72 : 291 \u2013 300 . 10.1016/0092-8674(93)90668-G 7678782 Austin , C.A. , I.G. Cowell , M.M. Khazeem , D. Lok , and H.T. Ng . 2021 . TOP2B\u2019s contributions to transcription . Biochem. Soc. Trans. 49 : 2483 \u2013 2493 . 10.1042/BST20200454 34747992 Avery , D.T. , E.K. Deenick , C.S. Ma , S. Suryani , N. Simpson , G.Y. Chew , T.D. Chan , U. Palendira , J. Bustamante , S. Boisson-Dupuis , . 2010 . B cell-intrinsic signaling through IL-21 receptor and STAT3 is required for establishing long-lived antibody responses in humans . J. Exp. Med. 207 : 155 \u2013 171 . 10.1084/jem.20091706 20048285 Avery , D.T. , A. Kane , T. Nguyen , A. Lau , A. Nguyen , H. Lenthall , K. Payne , W. Shi , H. Brigden , E. French , . 2018 . Germline-activating mutations in PIK3CD compromise B cell development and function . J. Exp. Med. 215 : 2073 \u2013 2095 . 10.1084/jem.20180010 30018075 Beaussant-Cohen , S. , F. Jaber , M.J. Massaad , S. Weeks , J. Jones , M.F. Alosaimi , J. Wallace , W. Al-Herz , R.S. Geha , and J. Chou . 2019 . Combined immunodeficiency in a patient with c-Rel deficiency . J. Allergy Clin. Immunol. 144 : 606 \u2013 608.e4 . 10.1016/j.jaci.2019.05.003 31103457 Ben-Ali , M. , J. Yang , K.W. Chan , I. Ben-Mustapha , N. Mekki , C. Benabdesselem , F. Mellouli , M. Bejaoui , W. Yang , L. Aissaoui , . 2017 . Homozygous transcription factor 3 gene (TCF3) mutation is associated with severe hypogammaglobulinemia and B-cell acute lymphoblastic leukemia . J. Allergy Clin. Immunol. 140 : 1191 \u2013 1194.e4 . 10.1016/j.jaci.2017.04.037 28532655 B\u00e9ziat , V. , F. Rapaport , J. Hu , M. Titeux , M. Bonnet des Claustres , M. Bourgey , H. Griffin , \u00c9. Bandet , C.S. Ma , R. Sherkat , . 2021 . Inherited CD28 deficiency in otherwise healthy patients with disseminated warts and giant horns . Cell . 184 : 3812 \u2013 3828.e30 . 34214472 B\u00e9ziat , V. , J. Li , J.X. Lin , C.S. Ma , P. Li , A. Bousfiha , I. Pellier , S. Zoghi , S. Baris , S. Keles , . 2018 . A recessive form of hyper-IgE syndrome by disruption of ZNF341-dependent STAT3 transcription and activity . Sci. Immunol. 3 : 3 . 10.1126/sciimmunol.aat4956 Beziat , V. , S.J. Tavernier , Y.H. Chen , C.S. Ma , M. Materna , A. Laurence , J. Staal , D. Aschenbrenner , L. Roels , L. Worley , . 2020 . Dominant-negative mutations in human IL6ST underlie hyper-IgE syndrome . J. Exp. Med. 217 : e20191804 . 10.1084/jem.20191804 32207811 Bogaert , D.J. , M. Dullaers , B.N. Lambrecht , K.Y. Vermaelen , E. De Baere , and F. Haerynck . 2016 . Genes associated with common variable immunodeficiency: One diagnosis to rule them all? J. Med. Genet. 53 : 575 \u2013 590 . 10.1136/jmedgenet-2015-103690 27250108 Boisson , B. , Y.D. Wang , A. Bosompem , C.S. Ma , A. Lim , T. Kochetkov , S.G. Tangye , J.L. Casanova , and M.E. Conley . 2013 . A recurrent dominant negative E47 mutation causes agammaglobulinemia and BCR(-) B cells . J. Clin. Invest. 123 : 4781 \u2013 4785 . 10.1172/JCI71927 24216514 Broderick , L. , S. Yost , D. Li , M.D. McGeough , L.M. Booshehri , M. Guaderrama , S.D. Brydges , K. Kucharova , N.C. Patel , M. Harr , . 2019 . Mutations in topoisomerase II\u03b2 result in a B cell immunodeficiency . Nat. Commun. 10 : 3644 . 10.1038/s41467-019-11570-6 31409799 Browning , M.J. , A. Chandra , V. Carbonaro , K. Okkenhaug , and J. Barwell . 2015 . Cowden\u2019s syndrome with immunodeficiency . J. Med. Genet. 52 : 856 \u2013 859 . 10.1136/jmedgenet-2015-103266 26246517 Brue , T. , M.H. Quentien , K. Khetchoumian , M. Bensa , J.M. Capo-Chichi , B. Delemer , A. Balsalobre , C. Nassif , D.T. Papadimitriou , A. Pagnier , . 2014 . Mutations in NFKB2 and potential genetic heterogeneity in patients with DAVID syndrome, having variable endocrine and immune deficiencies . BMC Med. Genet. 15 : 139 . 10.1186/s12881-014-0139-9 25524009 Bruton , O.C. 1952 . Agammaglobulinemia . Pediatrics . 9 : 722 \u2013 728 . 10.1542/peds.9.6.722 14929630 Cagdas , D. , D. Mayr , S. Baris , L. Worley , D.B. Langley , A. Metin , E.S. Aytekin , R. Atan , N. Kasap , S.K. Bal , . 2021 . Genomic spectrum and phenotypic heterogeneity of human IL-21 receptor deficiency . J. Clin. Immunol. 41 : 1272 \u2013 1290 . 10.1007/s10875-021-01031-5 33929673 Chandesris , M.O. , I. Melki , A. Natividad , A. Puel , C. Fieschi , L. Yun , C. Thumerelle , E. Oksenhendler , D. Boutboul , C. Thomas , . 2012 . Autosomal dominant STAT3 deficiency and hyper-IgE syndrome: Molecular, cellular, and clinical features from a French national survey . Medicine . 91 : e1 \u2013 e19 . 10.1097/MD.0b013e31825f95b9 22751495 Charbit-Henrion , F. , A.K. Jeverica , B. B\u00e8gue , G. Markelj , M. Parlato , S.L. Av\u010din , I. Callebaut , M. Bras , M. Parisot , J. Jazbec , . 2017 . Deficiency in mucosa-associated lymphoid tissue lymphoma translocation 1: A novel cause of IPEX-like syndrome . J. Pediatr. Gastroenterol. Nutr. 64 : 378 \u2013 384 . 10.1097/MPG.0000000000001262 27253662 Chen , H.H. , N. H\u00e4ndel , J. Ngeow , J. Muller , M. H\u00fchn , H.T. Yang , M. Heindl , R.M. Berbers , A.N. Hegazy , J. Kionke , . 2017 . Immune dysregulation in patients with PTEN hamartoma tumor syndrome: Analysis of FOXP3 regulatory T cells . J. Allergy Clin. Immunol. 139 : 607 \u2013 620.e15 . 10.1016/j.jaci.2016.03.059 27477328 Chen , K. , E.M. Coonrod , A. Kum\u00e1novics , Z.F. Franks , J.D. Durtschi , R.L. Margraf , W. Wu , N.M. Heikal , N.H. Augustine , P.G. Ridge , . 2013 . Germline mutations in NFKB2 implicate the noncanonical NF-\u03baB pathway in the pathogenesis of common variable immunodeficiency . Am. J. Hum. Genet. 93 : 812 \u2013 824 . 10.1016/j.ajhg.2013.09.009 24140114 Chen , Y.H. , S. Spencer , A. Laurence , J.E. Thaventhiran , and H.H. Uhlig . 2021 . Inborn errors of IL-6 family cytokine responses . Curr. Opin. Immunol. 72 : 135 \u2013 145 . 10.1016/j.coi.2021.04.007 34044328 Conley , M.E. 1985 . B cells in patients with X-linked agammaglobulinemia . J. Immunol. 134 : 3070 \u2013 3074 . 10.4049/jimmunol.134.5.3070 3920309 Conley , M.E. , P. Brown , A.R. Pickard , R.H. Buckley , D.S. Miller , W.H. Raskind , J.W. Singer , and P.J. Fialkow . 1986 . Expression of the gene defect in X-linked agammaglobulinemia . N. Engl. J. Med. 315 : 564 \u2013 567 . 10.1056/NEJM198608283150907 3488506 Conley , M.E. , A.K. Dobbs , D.M. Farmer , S. Kilic , K. Paris , S. Grigoriadou , E. Coustan-Smith , V. Howard , and D. Campana . 2009 . Primary B cell immunodeficiencies: Comparisons and contrasts . Annu. Rev. Immunol. 27 : 199 \u2013 227 . 10.1146/annurev.immunol.021908.132649 19302039 Conley , M.E. , A.K. Dobbs , A.M. Quintana , A. Bosompem , Y.D. Wang , E. Coustan-Smith , A.M. Smith , E.E. Perez , and P.J. Murray . 2012 . Agammaglobulinemia and absent B lineage cells in a patient lacking the p85\u03b1 subunit of PI3K . J. Exp. Med. 209 : 463 \u2013 470 . 10.1084/jem.20112533 22351933 Cooper , M.D. , and A.R. Lawton . 1972 . Circulating B-cells in patients with immunodeficiency . Am. J. Pathol. 69 : 513 \u2013 528 . 4564038 Cooper , M.D. , R.D. Peterson , and R.A. Good . 1965 . Delineation of the thymic and bursal lymphoid systems in the chicken . Nature . 205 : 143 \u2013 146 . 10.1038/205143a0 14276257 Darte , J.M. , P.D. McClure , E.F. Saunders , J.L. Weber , and W.L. Donohue . 1971 . Congenital lymphoid hyperplasia with persistent hyperlymphocytosis . N. Engl. J. Med. 284 : 431 \u2013 432 . 10.1056/NEJM197102252840807 5540480 de la Morena , M.T. 2016 . Clinical phenotypes of hyper-IgM syndromes . J. Allergy Clin. Immunol. Pract. 4 : 1023 \u2013 1036 . 10.1016/j.jaip.2016.09.013 27836054 Deau , M.C. , L. Heurtier , P. Frange , F. Suarez , C. Bole-Feysot , P. Nitschke , M. Cavazzana , C. Picard , A. Durandy , A. Fischer , and S. Kracker . 2014 . A human immunodeficiency caused by mutations in the PIK3R1 gene . J. Clin. Invest. 124 : 3923 \u2013 3928 . 10.1172/JCI75746 25133428 Deenick , E.K. , D.T. Avery , A. Chan , L.J. Berglund , M.L. Ives , L. Moens , J.L. Stoddard , J. Bustamante , S. Boisson-Dupuis , M. Tsumura , . 2013 . Naive and memory human B cells have distinct requirements for STAT3 activation to differentiate into antibody-secreting plasma cells . J. Exp. Med. 210 : 2739 \u2013 2753 . 10.1084/jem.20130323 24218138 DiSanto , J.P. , J.Y. Bonnefoy , J.F. Gauchat , A. Fischer , and G. de Saint Basile . 1993 . CD40 ligand mutations in x-linked immunodeficiency with hyper-IgM . Nature . 361 : 541 \u2013 543 . 10.1038/361541a0 8094231 Dobbs , A.K. , A. Bosompem , E. Coustan-Smith , G. Tyerman , F.T. Saulsbury , and M.E. Conley . 2011 . Agammaglobulinemia associated with BCR\u207b B cells and enhanced expression of CD19 . Blood . 118 : 1828 \u2013 1837 . 10.1182/blood-2011-01-330472 21693761 Dobbs , A.K. , T. Yang , D. Farmer , L. Kager , O. Parolini , and M.E. Conley . 2007 . Cutting edge: A hypomorphic mutation in igbeta (CD79b) in a patient with immunodeficiency and a leaky defect in B cell development . J. Immunol. 179 : 2055 \u2013 2059 . 10.4049/jimmunol.179.4.2055 17675462 D\u00f6ffinger , R. , A. Smahi , C. Bessia , F. Geissmann , J. Feinberg , A. Durandy , C. Bodemer , S. Kenwrick , S. Dupuis-Girod , S. Blanche , . 2001 . X-linked anhidrotic ectodermal dysplasia with immunodeficiency is caused by impaired NF-kappaB signaling . Nat. Genet. 27 : 277 \u2013 285 . 10.1038/85837 11242109 Driessen , G.J. , H. IJspeert , M. Wentink , H.G. Yntema , P.M. van Hagen , A. van Strien , G. Bucciol , O. Cogulu , M. Trip , W. Nillesen , . 2016 . Increased PI3K/Akt activity and deregulated humoral immune response in human PTEN deficiency . J. Allergy Clin. Immunol. 138 : 1744 \u2013 1747.e1745 . 10.1016/j.jaci.2016.07.010 27531073 Dulau Florea , A.E. , R.C. Braylan , K.T. Schafernak , K.W. Williams , J. Daub , R.K. Goyal , J.M. Puck , V.K. Rao , S. Pittaluga , S.M. Holland , . 2017 . Abnormal B-cell maturation in the bone marrow of patients with germline mutations in PIK3CD . J. Allergy Clin. Immunol. 139 : 1032 \u2013 1035.e6 . 10.1016/j.jaci.2016.08.028 27697496 Durandy , A. , N. Taubenheim , S. Peron , and A. Fischer . 2007 . Pathophysiology of B-cell intrinsic immunoglobulin class switch recombination deficiencies . Adv. Immunol. 94 : 275 \u2013 306 . 10.1016/S0065-2776(06)94009-7 17560278 Dvorscek , A.R. , C.I. McKenzie , M.J. Robinson , Z. Ding , C. Pitt , K. O\u2019Donnell , D. Zotos , R. Brink , D.M. Tarlinton , and I. Quast . 2022 . IL-21 has a critical role in establishing germinal centers by amplifying early B cell proliferation . EMBO Rep. 23 : e54677 . 10.15252/embr.202254677 35801309 Erd\u0151s , M. , \u00c1. L\u00e1nyi , G. Bal\u00e1zs , J.L. Casanova , B. Boisson , and L. Mar\u00f3di . 2021 . Inherited TOP2B mutation: Possible confirmation of mutational hotspots in the TOPRIM domain . J. Clin. Immunol. 41 : 817 \u2013 819 . 10.1007/s10875-020-00963-8 33459963 Erd\u0151s , M. , K. Mironska , L. Kareva , K. Stavric , A. Hasani , \u00c1. L\u00e1nyi , J. K\u00e1llai , and L. Mar\u00f3di . 2022 . A novel mutation in SLC39A7 identified in a patient with autosomal recessive agammaglobulinemia: The impact of the J Project . Pediatr. Allergy Immunol. 33 : e13805 . 10.1111/pai.13805 35754127 Fadlallah , J. , L. Chentout , B. Boisson , A. Pouliet , C. Masson , F. Morin , A. Durandy , J.L. Casanova , E. Oksenhendler , and S. Kracker . 2020 . From dysgammaglobulinemia to autosomal-dominant activation-induced cytidine deaminase deficiency: Unraveling an inherited immunodeficiency after 50 Years . J. Pediatr. 223 : 207 \u2013 211.e1 . 10.1016/j.jpeds.2020.03.024 32423680 Ferrari , S. , S. Giliani , A. Insalaco , A. Al-Ghonaium , A.R. Soresina , M. Loubser , M.A. Avanzini , M. Marconi , R. Badolato , A.G. Ugazio , . 2001 . Mutations of CD40 gene cause an autosomal recessive form of immunodeficiency with hyper IgM . Proc. Natl. Acad. Sci. USA . 98 : 12614 \u2013 12619 . 10.1073/pnas.221456898 11675497 Ferrari , S. , V. Lougaris , S. Caraffi , R. Zuntini , J. Yang , A. Soresina , A. Meini , G. Cazzola , C. Rossi , M. Reth , and A. Plebani . 2007 . Mutations of the Igbeta gene cause agammaglobulinemia in man . J. Exp. Med. 204 : 2047 \u2013 2051 . 10.1084/jem.20070264 17709424 Fliegauf , M. , V.L. Bryant , N. Frede , C. Slade , S.T. Woon , K. Lehnert , S. Winzer , A. Bulashevska , T. Scerri , E. Leung , . 2015 . Haploinsufficiency of the NF-\u03baB1 subunit p50 in common variable immunodeficiency . Am. J. Hum. Genet. 97 : 389 \u2013 403 . 10.1016/j.ajhg.2015.07.008 26279205 Frey-Jakobs , S. , J.M. Hartberger , M. Fliegauf , C. Bossen , M.L. Wehmeyer , J.C. Neubauer , A. Bulashevska , M. Proietti , P. Fr\u00f6bel , C. N\u00f6ltner , . 2018 . ZNF341 controls STAT3 expression and thereby immunocompetence . Sci. Immunol. 3 : 3 . 10.1126/sciimmunol.aat4941 Frizinsky , S. , E. Rechavi , O. Barel , R.H. Najeeb , S. Greenberger , Y.N. Lee , A.J. Simon , A. Lev , C.A. Ma , G. Sun , . 2019 . Novel MALT1 mutation linked to immunodeficiency, immune dysregulation, and an abnormal T cell receptor repertoire . J. Clin. Immunol. 39 : 401 \u2013 413 . 10.1007/s10875-019-00629-0 31037583 Garcia-Solis , B. , A. Van Den Rym , J.J. P\u00e9rez-Caraballo , A. Al-Ayoubi , A.M. Alazami , L. Lorenzo , C. Cubillos-Zapata , E. L\u00f3pez-Collazo , A. P\u00e9rez-Mart\u00ednez , L.M. Allende , . 2021 . Clinical and immunological features of human BCL10 deficiency . Front. Immunol. 12 : 786572 . 10.3389/fimmu.2021.786572 34868072 Garg , N. , E.J. Padron , K.W. Rammohan , and C.F. Goodman . 2022 . Bruton\u2019s tyrosine kinase inhibitors: The next frontier of B-Cell-Targeted therapies for cancer, autoimmune disorders, and multiple sclerosis . J. Clin. Med. 11 : 6131 . 10.3390/jcm11206139 36294452 Gayko , U. , M. Fung , F. Clow , S. Sun , E. Faust , S. Price , D. James , M. Doyle , S. Bari , and S.H. Zhuang . 2015 . Development of the Bruton\u2019s tyrosine kinase inhibitor ibrutinib for B cell malignancies . Ann. N. Y. Acad. Sci. 1358 : 82 \u2013 94 . 10.1111/nyas.12878 26348626 Geier , C.B. , K.M.T. Sauerwein , A. Leiss-Piller , I. Zmek , M.B. Fischer , M.M. Eibl , and H.M. Wolf . 2018 . Hypomorphic mutations in the BCR signalosome lead to selective immunoglobulin M deficiency and impaired B-cell homeostasis . Front. Immunol. 9 : 2984 . 10.3389/fimmu.2018.02984 30619340 Giliani , S. , L. Mori , G. de Saint Basile , F. Le Deist , C. Rodriguez-Perez , C. Forino , E. Mazzolari , S. Dupuis , R. Elhasid , A. Kessel , . 2005 . Interleukin-7 receptor alpha (IL-7Ralpha) deficiency: Cellular and molecular bases. Analysis of clinical, immunological, and molecular features in 16 novel patients . Immunol. Rev. 203 : 110 \u2013 126 . 10.1111/j.0105-2896.2005.00234.x 15661025 Glick , B. , T.S. Chang , and R.G. Jaap . 1956 . The bursa of Fabricius and antibody production . Poult. Sci. 35 : 224 \u2013 225 . 10.3382/ps.0350224 Goldman , F.D. , Z. Gurel , D. Al-Zubeidi , A.J. Fried , M. Icardi , C. Song , and S. Dovat . 2012 . Congenital pancytopenia and absence of B lymphocytes in a neonate with a mutation in the Ikaros gene . Pediatr. Blood Cancer . 58 : 591 \u2013 597 . 10.1002/pbc.23160 21548011 Greil , J. , T. Rausch , T. Giese , O.R. Bandapalli , V. Daniel , I. Bekeredjian-Ding , A.M. St\u00fctz , C. Drees , S. Roth , J. Ruland , . 2013 . Whole-exome sequencing links caspase recruitment domain 11 (CARD11) inactivation to severe combined immunodeficiency . J. Allergy Clin. Immunol. 131 : 1376 \u2013 1383.e3 . 10.1016/j.jaci.2013.02.012 23561803 Grimbacher , B. , A. Hutloff , M. Schlesier , E. Glocker , K. Warnatz , R. Dr\u00e4ger , H. Eibel , B. Fischer , A.A. Sch\u00e4ffer , H.W. Mages , . 2003 . Homozygous loss of ICOS is associated with adult-onset common variable immunodeficiency . Nat. Immunol. 4 : 261 \u2013 268 . 10.1038/ni902 12577056 Hanson , E.P. , L. Monaco-Shawver , L.A. Solt , L.A. Madge , P.P. Banerjee , M.J. May , and J.S. Orange . 2008 . Hypomorphic nuclear factor-kappaB essential modulator mutation database and reconstitution system identifies phenotypic and immunologic diversity . J. Allergy Clin. Immunol. 122 : 1169 \u2013 1177.e16 . 10.1016/j.jaci.2008.08.018 18851874 Holland , S.M. , F.R. DeLeo , H.Z. Elloumi , A.P. Hsu , G. Uzel , N. Brodsky , A.F. Freeman , A. Demidowich , J. Davis , M.L. Turner , . 2007 . STAT3 mutations in the hyper-IgE syndrome . N. Engl. J. Med. 357 : 1608 \u2013 1619 . 10.1056/NEJMoa073687 17881745 Hoshino , A. , S. Okada , K. Yoshida , N. Nishida , Y. Okuno , H. Ueno , M. Yamashita , T. Okano , M. Tsumura , S. Nishimura , . 2017 . Abnormal hematopoiesis and autoimmunity in human subjects with germline IKZF1 mutations . J. Allergy Clin. Immunol. 140 : 223 \u2013 231 . 10.1016/j.jaci.2016.09.029 27939403 Imai , K. , G. Slupphaug , W.I. Lee , P. Revy , S. Nonoyama , N. Catalan , L. Yel , M. Forveille , B. Kavli , H.E. Krokan , . 2003 . Human uracil-DNA glycosylase deficiency associated with profoundly impaired immunoglobulin class-switch recombination . Nat. Immunol. 4 : 1023 \u2013 1028 . 10.1038/ni974 12958596 Imai , K. , Y. Zhu , P. Revy , T. Morio , S. Mizutani , A. Fischer , S. Nonoyama , and A. Durandy . 2005 . Analysis of class switch recombination and somatic hypermutation in patients affected with autosomal dominant hyper-IgM syndrome type 2 . Clin. Immunol. 115 : 277 \u2013 285 . 10.1016/j.clim.2005.02.003 15893695 International Consortium , Fornes , O. , A. Jia , H.S. Kuehn , Q. Min , U. Pannicke , N. Schleussner , R. Thouenon , Z. Yu , M. de Los Angeles Astbury , C.M. Biggs , . 2023 . A multimorphic mutation in IRF4 causes human autosomal dominant combined immunodeficiency . Sci. Immunol. 8 : eade7953 . 10.1126/sciimmunol.ade7953 36662884 Jabara , H.H. , T. Ohsumi , J. Chou , M.J. Massaad , H. Benson , A. Megarbane , E. Chouery , R. Mikhael , O. Gorka , A. Gewies , . 2013 . A homozygous mucosa-associated lymphoid tissue 1 (MALT1) mutation in a family with combined immunodeficiency . J. Allergy Clin. Immunol. 132 : 151 \u2013 158 . 10.1016/j.jaci.2013.04.047 23727036 Jain , A. , C.A. Ma , S. Liu , M. Brown , J. Cohen , and W. Strober . 2001 . Specific missense mutations in NEMO result in hyper-IgM syndrome with hypohydrotic ectodermal dysplasia . Nat. Immunol. 2 : 223 \u2013 228 . 10.1038/85277 11224521 Jain , A. , C.A. Ma , E. Lopez-Granados , G. Means , W. Brady , J.S. Orange , S. Liu , S. Holland , and J.M. Derry . 2004 . Specific NEMO mutations impair CD40-mediated c-Rel activation and B cell terminal differentiation . J. Clin. Invest. 114 : 1593 \u2013 1602 . 10.1172/JCI21345 15578091 Kaiser , F.M.P. , S. Gruenbacher , M.R. Oyaga , E. Nio , M. Jaritz , Q. Sun , W. van der Zwaag , E. Kreidl , L.M. Zopf , V. Dalm , . 2022 . Biallelic PAX5 mutations cause hypogammaglobulinemia, sensorimotor deficits, and autism spectrum disorder . J. Exp. Med. 219 : 219 . 10.1084/jem.20220498 Kanegane , H. , K. Agematsu , T. Futatani , M.M. Sira , K. Suga , T. Sekiguchi , M.C. van Zelm , and T. Miyawaki . 2007 . Novel mutations in a Japanese patient with CD19 deficiency . Genes Immun. 8 : 663 \u2013 670 . 10.1038/sj.gene.6364431 17882224 Kasahara , Y. , H. Kaneko , T. Fukao , T. Terada , T. Asano , K. Kasahara , and N. Kondo . 2003 . Hyper-IgM syndrome with putative dominant negative mutation in activation-induced cytidine deaminase . J. Allergy Clin. Immunol. 112 : 755 \u2013 760 . 10.1016/S0091-6749(03)01860-8 14564357 Kaustio , M. , E. Haapaniemi , H. G\u00f6\u00f6s , T. Hautala , G. Park , J. Syrj\u00e4nen , E. Einarsdottir , B. Sahu , S. Kilpinen , S. Rounioja , . 2017 . Damaging heterozygous mutations in NFKB1 lead to diverse immunologic phenotypes . J. Allergy Clin. Immunol. 140 : 782 \u2013 796 . 10.1016/j.jaci.2016.10.054 28115215 Kermode , W. , D. De Santis , L. Truong , E. Della Mina , S. Salman , G. Thompson , D. Nolan , R. Loh , D. Mallon , A. Mclean-Tooke , . 2022 . A novel targeted amplicon next-generation sequencing gene panel for the diagnosis of common variable immunodeficiency has a high Diagnostic Yield: Results from the perth CVID cohort study . J. Mol. Diagn. 24 : 586 \u2013 599 . 10.1016/j.jmoldx.2022.02.007 35570134 Klein , U. , S. Casola , G. Cattoretti , Q. Shen , M. Lia , T. Mo , T. Ludwig , K. Rajewsky , and R. Dalla-Favera . 2006 . Transcription factor IRF4 controls plasma cell differentiation and class-switch recombination . Nat. Immunol. 7 : 773 \u2013 782 . 10.1038/ni1357 16767092 Klemann , C. , N. Camacho-Ordonez , L. Yang , Z. Eskandarian , J.L. Rojas-Restrepo , N. Frede , A. Bulashevska , M. Heeg , M.S. Al-Ddafari , J. Premm , . 2019 . Clinical and immunological phenotype of patients with primary immunodeficiency due to damaging mutations in NFKB2 . Front. Immunol. 10 : 297 . 10.3389/fimmu.2019.00297 30941118 Korth\u00e4uer , U. , D. Graf , H.W. Mages , F. Bri\u00e8re , M. Padayachee , S. Malcolm , A.G. Ugazio , L.D. Notarangelo , R.J. Levinsky , and R.A. Kroczek . 1993 . Defective expression of T-cell CD40 ligand causes X-linked immunodeficiency with hyper-IgM . Nature . 361 : 539 \u2013 541 . 10.1038/361539a0 7679206 Kotlarz , D. , R. Beier , D. Murugan , J. Diestelhorst , O. Jensen , K. Boztug , D. Pfeifer , H. Kreipe , E.D. Pfister , U. Baumann , . 2012 . Loss of interleukin-10 signaling and infantile inflammatory bowel disease: Implications for diagnosis and therapy . Gastroenterology . 143 : 347 \u2013 355 . 10.1053/j.gastro.2012.04.045 22549091 Kotlarz , D. , N. Zi\u0119tara , G. Uzel , T. Weidemann , C.J. Braun , J. Diestelhorst , P.M. Krawitz , P.N. Robinson , J. Hecht , J. Pucha\u0142ka , . 2013 . Loss-of-function mutations in the IL-21 receptor gene cause a primary immunodeficiency syndrome . J. Exp. Med. 210 : 433 \u2013 443 . 10.1084/jem.20111229 23440042 Kracker , S. , M. Di Virgilio , J. Schwartzentruber , C. Cuenin , M. Forveille , M.C. Deau , K.M. McBride , J. Majewski , A. Gazumyan , S. Seneviratne , . 2015 . An inherited immunoglobulin class-switch recombination deficiency associated with a defect in the INO80 chromatin remodeling complex . J. Allergy Clin. Immunol. 135 : 998 \u2013 1007.e6 . 10.1016/j.jaci.2014.08.030 25312759 Kr\u00fcger , R. , U. Baumann , S. Borte , U. K\u00f6lsch , M.R. Lorenz , B. Keller , I. Harder , K. Warnatz , S. Ehl , K. Schwarz , . 2020 . Impaired polysaccharide responsiveness without agammaglobulinaemia in three patients with hypomorphic mutations in Bruton Tyrosine Kinase-No detection by newborn screening for primary immunodeficiencies . Scand. J. Immunol. 91 : e12811 . 10.1111/sji.12811 31378960 Kuehn , H.S. , B. Boast , and S.D. Rosenzweig . 2022 . Inborn errors of human IKAROS: LOF and GOF variants associated with primary immunodeficiency . Clin. Exp. Immunol. 212 : 129 \u2013 136 . 10.1093/cei/uxac109 Kuehn , H.S. , B. Boisson , C. Cunningham-Rundles , J. Reichenbach , A. Stray-Pedersen , E.W. Gelfand , P. Maffucci , K.R. Pierce , J.K. Abbott , K.V. Voelkerding , . 2016 . Loss of B Cells in patients with heterozygous mutations in IKAROS . N. Engl. J. Med. 374 : 1032 \u2013 1043 . 10.1056/NEJMoa1512234 26981933 Kuhny , M. , L.R. Forbes , E. \u00c7akan , A. Vega-Loza , V. Kostiuk , R.K. Dinesh , S. Glauzy , A. Stray-Pedersen , A.E. Pezzi , I.C. Hanson , . 2020 . Disease-associated CTNNBL1 mutation impairs somatic hypermutation by decreasing nuclear AID . J. Clin. Invest. 130 : 4411 \u2013 4422 . 10.1172/JCI131297 32484799 Kuijpers , T.W. , R.J. Bende , P.A. Baars , A. Grummels , I.A. Derks , K.M. Dolman , T. Beaumont , T.F. Tedder , C.J. van Noesel , E. Eldering , and R.A. van Lier . 2010 . CD20 deficiency in humans results in impaired T cell-independent antibody responses . J. Clin. Invest. 120 : 214 \u2013 222 . 10.1172/JCI40231 20038800 Kury , P. , J. Staniek , O. Wegehaupt , I. Janowska , M. Eckenweiler , R. Korinthenberg , N. Japaridze , M. Pendziwiat , I. Helbig , E. Verhoeyen , . 2021 . Agammaglobulinemia with normal B-cell numbers in a patient lacking Bob1 . J. Allergy Clin. Immunol. 147 : 1977 \u2013 1980 . 10.1016/j.jaci.2021.01.027 33571536 Kutukculer , N. , T. Seeholzer , T.J. O\u2019Neill , C. Gra\u00df , A. Aykut , N.E. Karaca , A. Durmaz , O. Cogulu , G. Aksu , T. Gehring , . 2021 . Human immune disorder associated with homozygous hypomorphic mutation affecting MALT1B splice variant . J. Allergy Clin. Immunol. 147 : 775 \u2013 778.e8 . 10.1016/j.jaci.2020.07.034 32858082 Le Coz , C. , D.N. Nguyen , C. Su , B.E. Nolan , A.V. Albrecht , S. Xhani , D. Sun , B. Demaree , P. Pillarisetti , C. Khanna , . 2021 . Constrained chromatin accessibility in PU.1-mutated agammaglobulinemia patients . J. Exp. Med. 218 : 218 . 10.1084/jem.20201750 LeBien , T.W. , and T.F. Tedder . 2008 . B lymphocytes: How they develop and function . Blood . 112 : 1570 \u2013 1580 . 10.1182/blood-2008-02-078071 18725575 Lee , C.E. , D.A. Fulcher , B. Whittle , R. Chand , N. Fewings , M. Field , D. Andrews , C.C. Goodnow , and M.C. Cook . 2014 . Autosomal-dominant B-cell deficiency with alopecia due to a mutation in NFKB2 that results in nonprocessable p100 . Blood . 124 : 2964 \u2013 2972 . 10.1182/blood-2014-06-578542 25237204 Leonard , W.J. 2001 . Cytokines and immunodeficiency diseases . Nat. Rev. Immunol. 1 : 200 \u2013 208 . 10.1038/35105066 11905829 Leung , D.Y. , D.M. Ambrosino , R.D. Arbeit , J.L. Newton , and R.S. Geha . 1988 . Impaired antibody responses in the hyperimmunoglobulin E syndrome . J. Allergy Clin. Immunol. 81 : 1082 \u2013 1087 . 10.1016/0091-6749(88)90873-1 3379221 L\u00e9vy , R. , F. Gothe , M. Momenilandi , T. Magg , M. Materna , P. Peters , J. Raedler , Q. Philippot , A.L. Rack-Hoch , D. Langlais , . 2023 . Human CARMIL2 deficiency underlies a broader immunological and clinical phenotype than CD28 deficiency . J. Exp. Med. 220 : 220 . 10.1084/jem.20220275 L\u00e9vy , R. , D. Langlais , V. B\u00e9ziat , F. Rapaport , G. Rao , T. Lazarov , M. Bourgey , Y.J. Zhou , C. Briand , K. Moriya , . 2021 . Inherited human c-Rel deficiency disrupts myeloid and lymphoid immunity to multiple infectious agents . J. Clin. Invest. 131 : 131 . 10.1172/JCI150143 Li , J. , W.T. Lei , P. Zhang , F. Rapaport , Y. Seeleuthner , B. Lyu , T. Asano , J. Rosain , B. Hammadi , Y. Zhang , . 2021 . Biochemically deleterious human NFKB1 variants underlie an autosomal dominant form of common variable immunodeficiency . J. Exp. Med. 218 : 218 . 10.1084/jem.20210566 Liu , Y. , S. Hanson , P. Gurugama , A. Jones , B. Clark , and M.A. Ibrahim . 2014 . Novel NFKB2 mutation in early-onset CVID . J. Clin. Immunol. 34 : 686 \u2013 690 . 10.1007/s10875-014-0064-x 24888602 Lorenzini , T. , M. Fliegauf , N. Klammer , N. Frede , M. Proietti , A. Bulashevska , N. Camacho-Ordonez , M. Varjosalo , M. Kinnunen , E. de Vries , . 2020 . Characterization of the clinical and immunologic phenotype and management of 157 individuals with 56 distinct heterozygous NFKB1 mutations . J. Allergy Clin. Immunol. 146 : 901 \u2013 911 . 10.1016/j.jaci.2019.11.051 32278790 Lougaris , V. , R. Badolato , S. Ferrari , and A. Plebani . 2005 . Hyper immunoglobulin M syndrome due to CD40 deficiency: Clinical, molecular, and immunological features . Immunol. Rev. 203 : 48 \u2013 66 . 10.1111/j.0105-2896.2005.00229.x 15661021 Lougaris , V. , D. Moratto , M. Baronio , T. Lorenzini , S. Rossi , L. Gazzurelli , M.P. Bondioni , and A. Plebani . 2019 . Early B cell developmental impairment with progressive B cell deficiency in NFKB2 mutated CVID disease without autoimmunity . Clin. Immunol. 205 : 153 \u2013 155 . 10.1016/j.clim.2018.11.014 30500415 Lu , H.Y. , B.M. Bauman , S. Arjunaraja , B. Dorjbal , J.D. Milner , A.L. Snow , and S.E. Turvey . 2018 . The CBM-opathies-A rapidly expanding spectrum of human inborn errors of immunity caused by mutations in the CARD11-BCL10-MALT1 complex . Front. Immunol. 9 : 2078 . 10.3389/fimmu.2018.02078 30283440 Lu , H.Y. , C.M. Biggs , G. Blanchard-Rohner , S.Y. Fung , M. Sharma , and S.E. Turvey . 2019 . Germline CBM-opathies: From immunodeficiency to atopy . J. Allergy Clin. Immunol. 143 : 1661 \u2013 1673 . 10.1016/j.jaci.2019.03.009 31060714 Lu , H.Y. , M. Sharma , A.A. Sharma , A. Lacson , A. Szpurko , J. Luider , P. Dharmani-Khan , A. Shameli , P.A. Bell , G.M.T. Guilcher , . 2021 . Mechanistic understanding of the combined immunodeficiency in complete human CARD11 deficiency . J. Allergy Clin. Immunol. 148 : 1559 \u2013 1574 e1513 . 10.1016/j.jaci.2021.04.006 33872653 Lucas , C.L. , H.S. Kuehn , F. Zhao , J.E. Niemela , E.K. Deenick , U. Palendira , D.T. Avery , L. Moens , J.L. Cannons , M. Biancalana , . 2014a . Dominant-activating germline mutations in the gene encoding the PI(3)K catalytic subunit p110\u03b4 result in T cell senescence and human immunodeficiency . Nat. Immunol. 15 : 88 \u2013 97 . 10.1038/ni.2771 24165795 Lucas , C.L. , Y. Zhang , A. Venida , Y. Wang , J. Hughes , J. McElwee , M. Butrick , H. Matthews , S. Price , M. Biancalana , . 2014b . Heterozygous splice mutation in PIK3R1 causes human immunodeficiency with lymphoproliferation due to dominant activation of PI3K . J. Exp. Med. 211 : 2537 \u2013 2547 . 10.1084/jem.20141759 25488983 Luo , W. , L. Conter , R.A. Elsner , S. Smita , F. Weisel , D. Callahan , S. Wu , M. Chikina , and M. Shlomchik . 2023 . IL-21R signal reprogramming cooperates with CD40 and BCR signals to select and differentiate germinal center B cells . Sci. Immunol. 8 : eadd1823 . 10.1126/sciimmunol.add1823 36800413 Ma , C.S. , K.E. Nichols , and S.G. Tangye . 2007 . Regulation of cellular and humoral immune responses by the SLAM and SAP families of molecules . Annu. Rev. Immunol. 25 : 337 \u2013 379 . 10.1146/annurev.immunol.25.022106.141651 17201683 Ma , C.S. , N. Wong , G. Rao , D.T. Avery , J. Torpy , T. Hambridge , J. Bustamante , S. Okada , J.L. Stoddard , E.K. Deenick , . 2015 . Monogenic mutations differentially affect the quantity and quality of T follicular helper cells in patients with human primary immunodeficiencies . J. Allergy Clin. Immunol. 136 : 993 \u2013 1006.e1 . 10.1016/j.jaci.2015.05.036 26162572 Ma , C.S. , N. Wong , G. Rao , A. Nguyen , D.T. Avery , K. Payne , J. Torpy , P. O\u2019Young , E. Deenick , J. Bustamante , . 2016 . Unique and shared signaling pathways cooperate to regulate the differentiation of human CD4+ T cells into distinct effector subsets . J. Exp. Med. 213 : 1589 \u2013 1608 . 10.1084/jem.20151467 27401342 Mayer , L. , S.P. Kwan , C. Thompson , H.S. Ko , N. Chiorazzi , T. Waldmann , and F. Rosen . 1986 . Evidence for a defect in \u201cswitch\u201d T cells in patients with immunodeficiency and hyperimmunoglobulinemia M . N. Engl. J. Med. 314 : 409 \u2013 413 . 10.1056/NEJM198602133140703 3080678 McKinnon , M.L. , J. Rozmus , S.Y. Fung , A.F. Hirschfeld , K.L. Del Bel , L. Thomas , N. Marr , S.D. Martin , A.K. Marwaha , J.J. Priatel , . 2014 . Combined immunodeficiency associated with homozygous MALT1 mutations . J. Allergy Clin. Immunol. 133 : 1458 \u2013 1462.e1-7 . 10.1016/j.jaci.2013.10.045 24332264 Minegishi , Y. , E. Coustan-Smith , L. Rapalus , F. Ersoy , D. Campana , and M.E. Conley . 1999a . Mutations in Igalpha (CD79a) result in a complete block in B-cell development . J. Clin. Invest. 104 : 1115 \u2013 1121 . 10.1172/JCI7696 10525050 Minegishi , Y. , E. Coustan-Smith , Y.H. Wang , M.D. Cooper , D. Campana , and M.E. Conley . 1998 . Mutations in the human lambda5/14.1 gene result in B cell deficiency and agammaglobulinemia . J. Exp. Med. 187 : 71 \u2013 77 . 10.1084/jem.187.1.71 9419212 Minegishi , Y. , J. Rohrer , E. Coustan-Smith , H.M. Lederman , R. Pappu , D. Campana , A.C. Chan , and M.E. Conley . 1999b . An essential role for BLNK in human B cell development . Science . 286 : 1954 \u2013 1957 . 10.1126/science.286.5446.1954 10583958 Minegishi , Y. , M. Saito , S. Tsuchiya , I. Tsuge , H. Takada , T. Hara , N. Kawamura , T. Ariga , S. Pasic , O. Stojkovic , . 2007 . Dominant-negative mutations in the DNA-binding domain of STAT3 cause hyper-IgE syndrome . Nature . 448 : 1058 \u2013 1062 . 10.1038/nature06096 17676033 Mitsuiki , N. , X. Yang , S.J. Bartol , C. Grosserichter-Wagener , Y. Kosaka , H. Takada , K. Imai , H. Kanegane , S. Mizutani , M. van der Burg , . 2015 . Mutations in Bruton\u2019s tyrosine kinase impair IgA responses . Int. J. Hematol. 101 : 305 \u2013 313 . 10.1007/s12185-015-1732-1 25589397 Moens , L. , and S.G. Tangye . 2014 . Cytokine-mediated regulation of plasma cell generation: IL-21 takes center stage . Front. Immunol. 5 : 65 . 10.3389/fimmu.2014.00065 24600453 Morgan , D. , and V. Tergaonkar . 2022 . Unraveling B cell trajectories at single cell resolution . Trends Immunol. 43 : 210 \u2013 229 . 10.1016/j.it.2022.01.003 35090788 Morre , M. , and S. Beq . 2012 . Interleukin-7 and immune reconstitution in cancer patients: A new paradigm for dramatically increasing overall survival . Target. Oncol. 7 : 55 \u2013 68 . 10.1007/s11523-012-0210-4 22383042 Ng , Y.S. , H. Wardemann , J. Chelnis , C. Cunningham-Rundles , and E. Meffre . 2004 . Bruton\u2019s tyrosine kinase is essential for human B cell tolerance . J. Exp. Med. 200 : 927 \u2013 934 . 10.1084/jem.20040920 15466623 Nguyen , A. , H.Y. Lu , S.E. Turvey , and A.L. Snow . USUHS-NIAID-KPLA Consortium . 2023a . Autosomal recessive inflammatory skin disease caused by a novel biallelic loss-of-function variant in CARD11 . J. Clin. Immunol. 43 : 709 \u2013 713 . 10.1007/s10875-023-01440-8 36729250 Nguyen , T. , A. Lau , J. Bier , K.C. Cooke , H. Lenthall , S. Ruiz-Diaz , D.T. Avery , H. Brigden , D. Zahra , W.A. Sewell , . 2023b . Human PIK3R1 mutations disrupt lymphocyte differentiation to cause activated PI3K\u03b4 syndrome 2 . J. Exp. Med. 220 : 220 . 10.1084/jem.20221020 Niehues , T. , T.T. \u00d6zg\u00fcr , M. Bickes , R. Waldmann , J. Sch\u00f6ning , J. Br\u00e4sen , C. Hagel , M. Ballmaier , J.H. Klusmann , A. Niedermayer , . 2020 . Mutations of the gene FNIP1 associated with a syndromic autosomal recessive immunodeficiency with cardiomyopathy and pre-excitation syndrome . Eur. J. Immunol. 50 : 1078 \u2013 1080 . 10.1002/eji.201948504 32181500 Niiro , H. , and E.A. Clark . 2002 . Regulation of B-cell fate by antigen-receptor signals . Nat. Rev. Immunol. 2 : 945 \u2013 956 . 10.1038/nri955 12461567 Notarangelo , L.D. , G. Lanzi , S. Peron , and A. Durandy . 2006 . Defects of class-switch recombination . J. Allergy Clin. Immunol. 117 : 855 \u2013 864 . 10.1016/j.jaci.2006.01.043 16630945 Nutt , S.L. , and B.L. Kee . 2007 . The transcriptional regulation of B cell lineage commitment . Immunity . 26 : 715 \u2013 725 . 10.1016/j.immuni.2007.05.010 17582344 Orange , J.S. , A. Jain , Z.K. Ballas , L.C. Schneider , R.S. Geha , and F.A. Bonilla . 2004 . The presentation and natural history of immunodeficiency caused by nuclear factor kappaB essential modulator mutation . J. Allergy Clin. Immunol. 113 : 725 \u2013 733 . 10.1016/j.jaci.2004.01.762 15100680 Paley , M.A. , V. Strand , and A.H. Kim . 2017 . From mechanism to therapies in systemic lupus erythematosus . Curr. Opin. Rheumatol. 29 : 178 \u2013 186 . 10.1097/BOR.0000000000000369 28118202 Papapietro , O. , A. Chandra , D. Eletto , S. Inglott , V. Plagnol , J. Curtis , M. Maes , A. Alisaac , A.S. Albuquerque , E. Basseres , . 2020 . Topoisomerase 2\u03b2 mutation impairs early B-cell development . Blood . 135 : 1497 \u2013 1501 . 10.1182/blood.2019003299 32128574 Pelanda , R. , S.A. Greaves , T. Alves da Costa , L.M. Cedrone , M.L. Campbell , and R.M. Torres . 2022 . B-cell intrinsic and extrinsic signals that regulate central tolerance of mouse and human B cells . Immunol. Rev. 307 : 12 \u2013 26 . 10.1111/imr.13062 34997597 Philippot , Q. , M. Ogishi , J. Bohlen , J. Puchan , A.A. Arias , T. Nguyen , M. Martin-Fernandez , C. Conil , D. Rinchai , M. Momenilandi , . 2023 . Human IL-23 is essential for IFN-\u03b3-dependent immunity to mycobacteria . Sci. Immunol. 8 : eabq5204 . 10.1126/sciimmunol.abq5204 36763636 Pieper , K. , B. Grimbacher , and H. Eibel . 2013 . B-cell biology and development . J. Allergy Clin. Immunol. 131 : 959 \u2013 971 . 10.1016/j.jaci.2013.01.046 23465663 Puel , A. , and W.J. Leonard . 2000 . Mutations in the gene for the IL-7 receptor result in T(-)B(+)NK(+) severe combined immunodeficiency disease . Curr. Opin. Immunol. 12 : 468 \u2013 473 . 10.1016/S0952-7915(00)00122-9 10899029 Punwani , D. , H. Wang , A.Y. Chan , M.J. Cowan , J. Mallott , U. Sunderam , M. Mollenauer , R. Srinivasan , S.E. Brenner , A. Mulder , . 2015 . Combined immunodeficiency due to MALT1 mutations, treated by hematopoietic cell transplantation . J. Clin. Immunol. 35 : 135 \u2013 146 . 10.1007/s10875-014-0125-1 25627829 Quast , I. , A.R. Dvorscek , C. Pattaroni , T.M. Steiner , C.I. McKenzie , C. Pitt , K. O\u2019Donnell , Z. Ding , D.L. Hill , R. Brink , . 2022 . Interleukin-21, acting beyond the immunological synapse, independently controls T follicular helper and germinal center B cells . Immunity . 55 : 1414 \u2013 1430.e5 . 10.1016/j.immuni.2022.06.020 35896116 Ramesh , N. , R. Fuleihan , V. Ramesh , S. Lederman , M.J. Yellin , S. Sharma , L. Chess , F.S. Rosen , and R.S. Geha . 1993 . Deletions in the ligand for CD40 in X-linked immunoglobulin deficiency with normal or elevated IgM (HIGMX-1) . Int. Immunol. 5 : 769 \u2013 773 . 10.1093/intimm/5.7.769 8103673 Rao , V.K. , S. Webster , A. Sediva , A. Plebani , C. Schuetz , A. Shcherbina , N. Conlon , T.I. Coulter , V.A. Dalm , A. Trizzino , . 2022 . Randomized, placebo-controlled, phase 3 trial of PI3Kdelta inhibitor leniolisib for activated PI3Kdelta syndrome . Blood . 141 : 971 \u2013 983 . 10.1182/blood.2022018546 Recher , M. , L.J. Berglund , D.T. Avery , M.J. Cowan , A.R. Gennery , J. Smart , J. Peake , M. Wong , S.Y. Pai , S. Baxi , . 2011 . IL-21 is the primary common \u03b3 chain-binding cytokine required for human B-cell differentiation in vivo . Blood . 118 : 6824 \u2013 6835 . 10.1182/blood-2011-06-362533 22039266 Renner , E.D. , C.E. Kr\u00e4tz , J.S. Orange , B. Hagl , S. Rylaarsdam , G. Notheis , A. Durandy , T.R. Torgerson , and H.D. Ochs . 2021 . Class switch recombination defects: Impact on B cell maturation and antibody responses . Clin. Immunol. 222 : 108638 . 10.1016/j.clim.2020.108638 33276124 Revy , P. , T. Muto , Y. Levy , F. Geissmann , A. Plebani , O. Sanal , N. Catalan , M. Forveille , R. Dufourcq-Labelouse , A. Gennery , . 2000 . Activation-induced cytidine deaminase (AID) deficiency causes the autosomal recessive form of the Hyper-IgM syndrome (HIGM2) . Cell . 102 : 565 \u2013 575 . 10.1016/S0092-8674(00)00079-9 11007475 Robinson , M.J. , R.H. Webster , and D.M. Tarlinton . 2020 . How intrinsic and extrinsic regulators of plasma cell survival might intersect for durable humoral immunity . Immunol. Rev. 296 : 87 \u2013 103 . 10.1111/imr.12895 32592168 Rosain , J. , C. Miot , N. Lambert , M.C. Rousselet , I. Pellier , and C. Picard . 2017 . CD21 deficiency in 2 siblings with recurrent respiratory infections and hypogammaglobulinemia . J. Allergy Clin. Immunol. Pract. 5 : 1765 \u2013 1767.e1763 . 10.1016/j.jaip.2017.04.011 28499783 Rosen , F.S. , and J.A. Bougas . 1963 . Acquired dysgammaglobulinemia: Elevation of the 19s gamma globulin and deficiency of the 7s gamma globulin in a woman with chronic progressive bronchiectasis . N. Engl. J. Med. 269 : 1336 \u2013 1340 . 10.1056/NEJM196312192692502 14064316 Rosen , F.S. , S.V. Kevy , E. Merler , C.A. Janeway , and D. Gitlin . 1961 . Recurrent bacterial infections and dysgamma-globulinemia: Deficiency of 7S gamma-globulins in the presence of elevated 19S gamma-globulins. Report of two cases . Pediatrics . 28 : 182 \u2013 195 . 10.1542/peds.28.2.182 13743326 Roussel , L. , M. Landekic , M. Golizeh , C. Gavino , M.C. Zhong , J. Chen , D. Faubert , A. Blanchet-Cohen , L. Dansereau , M.A. Parent , . 2018 . Loss of human ICOSL results in combined immunodeficiency . J. Exp. Med. 215 : 3151 \u2013 3164 . 10.1084/jem.20180668 30498080 Saettini , F. , C. Poli , J. Vengoechea , S. Bonanomi , J.C. Orellana , G. Fazio , F.H. Rodriguez III , L.P. Noguera , C. Booth , V. Jarur-Chamy , . 2021 . Absent B cells, agammaglobulinemia, and hypertrophic cardiomyopathy in folliculin-interacting protein 1 deficiency . Blood . 137 : 493 \u2013 499 . 10.1182/blood.2020006441 32905580 Salzer , E. , A. Kansu , H. Sic , P. Majek , A. Ikinciogullari , F.E. Dogu , N.K. Prengemann , E. Santos-Valente , W.F. Pickl , I. Bilic , . 2014 . Early-onset inflammatory bowel disease and common variable immunodeficiency-like disease caused by IL-21 deficiency . J. Allergy Clin. Immunol. 133 : 1651 \u2013 1659 . e1612 . 10.1016/j.jaci.2014.02.034 24746753 Schepp , J. , J. Chou , A. Skrabl-Baumgartner , P.D. Arkwright , K.R. Engelhardt , S. Hambleton , T. Morio , E. R\u00f6ther , K. Warnatz , R. Geha , and B. Grimbacher . 2017 . 14 Years after discovery: Clinical follow-up on 15 patients with inducible Co-stimulator deficiency . Front. Immunol. 8 : 964 . 10.3389/fimmu.2017.00964 28861081 Schwarz , K. , G.H. Gauss , L. Ludwig , U. Pannicke , Z. Li , D. Lindner , W. Friedrich , R.A. Seger , T.E. Hansen-Hagge , S. Desiderio , . 1996 . RAG mutations in human B cell-negative SCID . Science . 274 : 97 \u2013 99 . 10.1126/science.274.5284.97 8810255 Schwerd , T. , S.R.F. Twigg , D. Aschenbrenner , S. Manrique , K.A. Miller , I.B. Taylor , M. Capitani , S.J. McGowan , E. Sweeney , A. Weber , . 2017 . A biallelic mutation in IL6ST encoding the GP130 co-receptor causes immunodeficiency and craniosynostosis . J. Exp. Med. 214 : 2547 \u2013 2562 . 10.1084/jem.20161810 28747427 Shahin , T. , D. Aschenbrenner , D. Cagdas , S.K. Bal , C.D. Conde , W. Garncarz , D. Medgyesi , T. Schwerd , B. Karaatmaca , P.G. Cetinkaya , . 2019 . Selective loss of function variants in IL6ST cause Hyper-IgE syndrome with distinct impairments of T-cell phenotype and function . Haematologica . 104 : 609 \u2013 621 . 10.3324/haematol.2018.194233 30309848 Sharfe , N. , D. Merico , A. Karanxha , C. Macdonald , H. Dadi , B. Ngan , J.A. Herbrick , and C.M. Roifman . 2015 . The effects of RelB deficiency on lymphocyte development and function . J. Autoimmun. 65 : 90 \u2013 100 . 10.1016/j.jaut.2015.09.001 26385063 Sharifinejad , N. , M. Zaki-Dizaji , R. Sepahvandi , F. Fayyaz , M.M. Dos Santos Vilela , G. ElGhazali , H. Abolhassani , H.D. Ochs , and G. Azizi . 2022 . The clinical, molecular, and therapeutic features of patients with IL10/IL10R deficiency: A systematic review . Clin. Exp. Immunol. 208 : 281 \u2013 291 . 10.1093/cei/uxac040 35481870 Sheerin , K.A. , and R.H. Buckley . 1991 . Antibody responses to protein, polysaccharide, and phi X174 antigens in the hyperimmunoglobulinemia E (hyper-IgE) syndrome . J. Allergy Clin. Immunol. 87 : 803 \u2013 811 . 10.1016/0091-6749(91)90126-9 1826506 Shields , A.M. , B.M. Bauman , C.E. Hargreaves , A.J. Pollard , A.L. Snow , and S.Y. Patel . 2020 . A novel, heterozygous three base-pair deletion in CARD11 results in B cell expansion with NF-\u03baB and T cell anergy disease . J. Clin. Immunol. 40 : 406 \u2013 411 . 10.1007/s10875-019-00729-x 31897776 Siegal , F.P. , B. Pernis , and H.G. Kunkel . 1971 . Lymphocytes in human immunodeficiency states: A study of membrane-associated immunoglobulins . Eur. J. Immunol. 1 : 482 \u2013 486 . 10.1002/eji.1830010615 18236610 Siggs , O.M. , A. Stockenhuber , M. Deobagkar-Lele , K.R. Bull , T.L. Crockford , B.L. Kingston , G. Crawford , C. Anzilotti , V. Steeples , S. Ghaffari , . 2016 . Mutation of Fnip1 is associated with B-cell deficiency, cardiomyopathy, and elevated AMPK activity . Proc. Natl. Acad. Sci. USA . 113 : E3706 \u2013 E3715 . 10.1073/pnas.1607592113 27303042 Skendros , P. , S. Rondeau , J.F. Chateil , S. Bui , V. Bocly , J.F. Moreau , I. Theodorou , and N. Aladjidi . 2014 . Misdiagnosed CD19 deficiency leads to severe lung disease . Pediatr. Allergy Immunol. 25 : 603 \u2013 606 . 10.1111/pai.12222 24684239 Snow , A.L. , W. Xiao , J.R. Stinson , W. Lu , B. Chaigne-Delalande , L. Zheng , S. Pittaluga , H.F. Matthews , R. Schmitz , S. Jhavar , . 2012 . Congenital B cell lymphocytosis explained by novel germline CARD11 mutations . J. Exp. Med. 209 : 2247 \u2013 2261 . 10.1084/jem.20120831 23129749 Sogkas , G. , M. Fedchenko , A. Dhingra , A. Jablonka , R.E. Schmidt , and F. Atschekzei . 2018 . Primary immunodeficiency disorder caused by phosphoinositide 3-kinase delta deficiency . J. Allergy Clin. Immunol. 142 : 1650 \u2013 1653.e1652 . 10.1016/j.jaci.2018.06.039 30040974 Sokal , A. , P. Bastard , P. Chappert , G. Barba-Spaeth , S. Fourati , A. Vanderberghe , P. Lagouge-Roussey , I. Meyts , A. Gervais , M. Bouvier-Alias , . 2023 . Human type I IFN deficiency does not impair B cell response to SARS-CoV-2 mRNA vaccination . J. Exp. Med. 220 : 220 . 10.1084/jem.20220258 Sonoda , M. , M. Ishimura , K. Eguchi , Y. Yada , N. Lenhartov\u00e1 , A. Shiraishi , T. Tanaka , Y. Sakai , and S. Ohga . 2021 . Progressive B cell depletion in human MALT1 deficiency . Clin. Exp. Immunol. 206 : 237 \u2013 247 . 10.1111/cei.13662 34559885 Spencer , S. , S. K\u00f6stel Bal , W. Egner , H. Lango Allen , S.I. Raza , C.A. Ma , M. G\u00fcrel , Y. Zhang , G. Sun , R.A. Sabroe , . 2019 . Loss of the interleukin-6 receptor causes immunodeficiency, atopy, and abnormal inflammatory responses . J. Exp. Med. 216 : 1986 \u2013 1998 . 10.1084/jem.20190344 31235509 Stepensky , P. , B. Keller , M. Buchta , A.K. Kienzler , O. Elpeleg , R. Somech , S. Cohen , I. Shachar , L.A. Miosge , M. Schlesier , . 2013 . Deficiency of caspase recruitment domain family, member 11 (CARD11), causes profound combined immunodeficiency in human subjects . J. Allergy Clin. Immunol. 131 : 477 \u2013 485.e1 . 10.1016/j.jaci.2012.11.050 23374270 Suryani , S. , D.A. Fulcher , B. Santner-Nanan , R. Nanan , M. Wong , P.J. Shaw , J. Gibson , A. Williams , and S.G. Tangye . 2010 . Differential expression of CD21 identifies developmentally and functionally distinct subsets of human transitional B cells . Blood . 115 : 519 \u2013 529 . 10.1182/blood-2009-07-234799 19965666 Tang , P. , J.E.M. Upton , M.A. Barton-Forbes , M.I. Salvadori , M.P. Clynick , A.K. Price , and S.L. Goobie . 2017 . Autosomal recessive agammaglobulinemia due to a homozygous mutation in PIK3R1 . J. Clin. Immunol. 38 : 88 \u2013 95 . 10.1007/s10875-017-0462-y 29178053 Tangye , S.G. , W. Al-Herz , A. Bousfiha , C. Cunningham-Rundles , J.L. Franco , S.M. Holland , C. Klein , T. Morio , E. Oksenhendler , C. Picard , . 2022 . Human inborn errors of immunity: 2022 update on the classification from the international union of immunological societies expert committee . J. Clin. Immunol. 42 : 1473 \u2013 1507 . 10.1007/s10875-022-01289-3 35748970 Tangye , S.G. , J. Bier , A. Lau , T. Nguyen , G. Uzel , and E.K. Deenick . 2019 . Immune dysregulation and disease pathogenesis due to activating mutations in PIK3CD-the goldilocks\u2019 effect . J. Clin. Immunol. 39 : 148 \u2013 158 . 10.1007/s10875-019-00612-9 30911953 Tangye , S.G. , V.L. Bryant , A.K. Cuss , and K.L. Good . 2006 . BAFF, APRIL and human B cell disorders . Semin. Immunol. 18 : 305 \u2013 317 . 10.1016/j.smim.2006.04.004 16916610 Tangye , S.G. , and C.S. Ma . 2020 . Regulation of the germinal center and humoral immunity by interleukin-21 . J. Exp. Med. 217 : 217 . 10.1084/jem.20191638 Tangye , S.G. , and C.S. Ma . 2021 . Molecular regulation and dysregulation of T follicular helper cells: Learning from inborn errors of immunity . Curr. Opin. Immunol. 72 : 249 \u2013 261 . 10.1016/j.coi.2021.06.011 34284230 Tangye , S.G. , K. Pathmanandavel , and C.S. Ma . 2023 . Cytokine-mediated STAT-dependent pathways underpinning human B-cell differentiation and function . Curr. Opin. Immunol. 81 : 102286 . 10.1016/j.coi.2023.102286 36764056 Tangye , S.G. , and D.M. Tarlinton . 2009 . Memory B cells: Effectors of long-lived immune responses . Eur. J. Immunol. 39 : 2065 \u2013 2075 . 10.1002/eji.200939531 19637202 Teitell , M.A. 2003 . OCA-B regulation of B-cell development and function . Trends Immunol. 24 : 546 \u2013 553 . 10.1016/j.it.2003.08.002 14552839 Thiel , J. , L. Kimmig , U. Salzer , M. Grudzien , D. Lebrecht , T. Hagena , R. Draeger , N. Voelxen , A. Bergbreiter , S. Jennings , . 2012 . Genetic CD21 deficiency is associated with hypogammaglobulinemia . J. Allergy Clin. Immunol. 129 : 801 \u2013 810.e6 . 10.1016/j.jaci.2011.09.027 22035880 Toker , O. , A. Broides , A. Lev , A.J. Simon , O. Megged , O. Shamriz , Y. Tal , R. Somech , Y.N. Lee , and A. Nahum . 2022 . B cell repertoire in patients with a novel BTK mutation: Expanding the spectrum of atypical X-linked agammaglobulinemia . Immunol. Res. 70 : 216 \u2013 223 . 10.1007/s12026-022-09263-2 35001352 Torres , J.M. , R. Martinez-Barricarte , S. Garc\u00eda-G\u00f3mez , M.S. Mazariegos , Y. Itan , B. Boisson , R. Rholvarez , A. Jim\u00e9nez-Reinoso , L. del Pino , R. Rodr\u00edguez-Pena , . 2014 . Inherited BCL10 deficiency impairs hematopoietic and nonhematopoietic immunity . J. Clin. Invest. 124 : 5239 \u2013 5248 . 10.1172/JCI77493 25365219 Tsujita , Y. , K. Mitsui-Sekinaka , K. Imai , T.W. Yeh , N. Mitsuiki , T. Asano , H. Ohnishi , Z. Kato , Y. Sekinaka , K. Zaha , . 2016 . Phosphatase and tensin homolog (PTEN) mutation can cause activated phosphatidylinositol 3-kinase delta syndrome-like immunodeficiency . J. Allergy Clin. Immunol. 138 : 1672 \u2013 1680.e1610 . 10.1016/j.jaci.2016.03.055 27426521 Tsukada , S. , D.C. Saffran , D.J. Rawlings , O. Parolini , R.C. Allen , I. Klisak , R.S. Sparkes , H. Kubagawa , T. Mohandas , S. Quan , . 1993 . Deficient expression of a B cell cytoplasmic tyrosine kinase in human X-linked agammaglobulinemia . Cell . 72 : 279 \u2013 290 . 10.1016/0092-8674(93)90667-F 8425221 Tuijnenburg , P. , H. Lango Allen , S.O. Burns , D. Greene , M.H. Jansen , E. Staples , J. Stephens , K.J. Carss , D. Biasci , H. Baxendale , . 2018 . Loss-of-function nuclear factor \u03baB subunit 1 (NFKB1) variants are the most common monogenic cause of common variable immunodeficiency in Europeans . J. Allergy Clin. Immunol. 142 : 1285 \u2013 1296 . 10.1016/j.jaci.2018.01.039 29477724 Tuovinen , E.A. , O. Kuismin , L. Soikkonen , T. Martelius , M. Kaustio , S. H\u00e4m\u00e4l\u00e4inen , H. Viskari , J. Syrj\u00e4nen , U. Wartiovaara-Kautto , K.K. Eklund , . 2023 . Long-term follow up of families with pathogenic NFKB1 variants reveals incomplete penetrance and frequent inflammatory sequelae . Clin. Immunol. 246 : 109181 . 10.1016/j.clim.2022.109181 36356849 Uckun , F.M. 1990 . Regulation of human B-cell ontogeny . Blood . 76 : 1908 \u2013 1923 . 10.1182/blood.V76.10.1908.bloodjournal76101908 2242419 Vaeth , M. , and S. Feske . 2018 . Ion channelopathies of the immune system . Curr. Opin. Immunol. 52 : 39 \u2013 50 . 10.1016/j.coi.2018.03.021 29635109 Van Den Rym , A. , P. Taur , R. Martinez-Barricarte , L. Lorenzo , A. Puel , P. Gonzalez-Navarro , A. Pandrowala , V. Gowri , A. Safa , V. Toledano , . 2020 . Human BCL10 deficiency due to homozygosity for a rare allele . J. Clin. Immunol. 40 : 388 \u2013 398 . 10.1007/s10875-020-00760-3 32008135 van Zelm , M.C. , S.J. Bartol , G.J. Driessen , F. Mascart , I. Reisli , J.L. Franco , B. Wolska-Kusnierz , H. Kanegane , L. Boon , J.J. van Dongen , and M. van der Burg . 2014 . Human CD19 and CD40L deficiencies impair antibody selection and differentially affect somatic hypermutation . J. Allergy Clin. Immunol. 134 : 135 \u2013 144 . 10.1016/j.jaci.2013.11.015 24418477 van Zelm , M.C. , I. Reisli , M. van der Burg , D. Casta\u00f1o , C.J. van Noesel , M.J. van Tol , C. Woellner , B. Grimbacher , P.J. Pati\u00f1o , J.J. van Dongen , and J.L. Franco . 2006 . An antibody-deficiency syndrome due to mutations in the CD19 gene . N. Engl. J. Med. 354 : 1901 \u2013 1912 . 10.1056/NEJMoa051568 16672701 van Zelm , M.C. , J. Smet , B. Adams , F. Mascart , L. Schanden\u00e9 , F. Janssen , A. Ferster , C.C. Kuo , S. Levy , J.J. van Dongen , and M. van der Burg . 2010 . CD81 gene defect in humans disrupts CD19 complex formation and leads to antibody deficiency . J. Clin. Invest. 120 : 1265 \u2013 1274 . 10.1172/JCI39748 20237408 Vetrie , D. , I. Vorechovsk\u00fd , P. Sideras , J. Holland , A. Davies , F. Flinter , L. Hammarstr\u00f6m , C. Kinnon , R. Levinsky , M. Bobrow , . 1993 . The gene involved in X-linked agammaglobulinaemia is a member of the src family of protein-tyrosine kinases . Nature . 361 : 226 \u2013 233 . 10.1038/361226a0 8380905 Victora , G.D. , and M.C. Nussenzweig . 2022 . Germinal centers . Annu. Rev. Immunol. 40 : 413 \u2013 442 . 10.1146/annurev-immunol-120419-022408 35113731 Vince , N. , D. Boutboul , G. Mouillot , N. Just , M. Peralta , J.L. Casanova , M.E. Conley , J.C. Bories , E. Oksenhendler , M. Malphettes , . 2011 . Defects in the CD19 complex predispose to glomerulonephritis, as well as IgG1 subclass deficiency . J. Allergy Clin. Immunol. 127 : 538 \u2013 541.e1-5 . 10.1016/j.jaci.2010.10.019 21159371 Wang , Y. , C.S. Ma , Y. Ling , A. Bousfiha , Y. Camcioglu , S. Jacquot , K. Payne , E. Crestani , R. Roncagalli , A. Belkadi , . 2016 . Dual T cell- and B cell-intrinsic deficiency in humans with biallelic RLTPR mutations . J. Exp. Med. 213 : 2413 \u2013 2435 . 10.1084/jem.20160576 27647349 Warnatz , K. , L. Bossaller , U. Salzer , A. Skrabl-Baumgartner , W. Schwinger , M. van der Burg , J.J. van Dongen , M. Orlowska-Volk , R. Knoth , A. Durandy , . 2006 . Human ICOS deficiency abrogates the germinal center reaction and provides a monogenic model for common variable immunodeficiency . Blood . 107 : 3045 \u2013 3052 . 10.1182/blood-2005-07-2955 16384931 Warnatz , K. , U. Salzer , M. Rizzi , B. Fischer , S. Gutenberger , J. B\u00f6hm , A.K. Kienzler , Q. Pan-Hammarstr\u00f6m , L. Hammarstr\u00f6m , M. Rakhmanov , . 2009 . B-cell activating factor receptor deficiency is associated with an adult-onset antibody deficiency syndrome in humans . Proc. Natl. Acad. Sci. USA . 106 : 13945 \u2013 13950 . 10.1073/pnas.0903543106 19666484 Wentink , M.W. , A.J. Lambeck , M.C. van Zelm , E. Simons , J.J. van Dongen , H. IJspeert , E.H. Sch\u00f6lvinck , and M. van der Burg . 2015 . CD21 and CD19 deficiency: Two defects in the same complex leading to different disease modalities . Clin. Immunol. 161 : 120 \u2013 127 . 10.1016/j.clim.2015.08.010 26325596 Wentink , M.W.J. , M.C. van Zelm , J.J.M. van Dongen , K. Warnatz , and M. van der Burg . 2018 . Deficiencies in the CD19 complex . Clin. Immunol. 195 : 82 \u2013 87 . 10.1016/j.clim.2018.07.017 30075290 Willmann , K.L. , S. Klaver , F. Do\u011fu , E. Santos-Valente , W. Garncarz , I. Bilic , E. Mace , E. Salzer , C.D. Conde , H. Sic , . 2014 . Biallelic loss-of-function mutation in NIK causes a primary immunodeficiency with multifaceted aberrant lymphoid immunity . Nat. Commun. 5 : 5360 . 10.1038/ncomms6360 25406581 Yamashita , M. , H.S. Kuehn , K. Okuyama , S. Okada , Y. Inoue , N. Mitsuiki , K. Imai , M. Takagi , H. Kanegane , M. Takeuchi , . 2021 . A variant in human AIOLOS impairs adaptive immunity by interfering with IKAROS . Nat. Immunol. 22 : 893 \u2013 903 . 10.1038/s41590-021-00951-z 34155405 Yamashita , M. , and T. Morio . 2021 . Inborn errors of IKAROS and AIOLOS . Curr. Opin. Immunol. 72 : 239 \u2013 248 . 10.1016/j.coi.2021.06.010 34265590 Yang , L. , P. Liu , H. Du , R. Chen , B. Zhou , Y. Li , L. Zhou , X. Wang , C. Liu , Y. Ding , . 2022 . Novel CD81 mutations in a Chinese patient led to IgA nephropathy and impaired BCR signaling . J. Clin. Immunol. 42 : 1672 \u2013 1684 . 10.1007/s10875-022-01333-2 35849269 Yeh , T.W. , T. Okano , T. Naruto , M. Yamashita , M. Okamura , K. Tanita , L. Du , Q. Pan-Hammarstr\u00f6m , N. Mitsuiki , S. Okada , . 2020 . APRIL-dependent lifelong plasmacyte maintenance and immunoglobulin production in humans . J. Allergy Clin. Immunol. 146 : 1109 \u2013 1120.e4 . 10.1016/j.jaci.2020.03.025 32298700 Yel , L. , Y. Minegishi , E. Coustan-Smith , R.H. Buckley , H. Tr\u00fcbel , L.M. Pachman , G.R. Kitchingman , D. Campana , J. Rohrer , and M.E. Conley . 1996 . Mutations in the mu heavy-chain gene in patients with agammaglobulinemia . N. Engl. J. Med. 335 : 1486 \u2013 1493 . 10.1056/NEJM199611143352003 8890099 Zhang , Q. , M.J. Lenardo , and D. Baltimore . 2017 . 30 Years of NF-\u03baB: A blossoming of relevance to human pathobiology . Cell . 168 : 37 \u2013 57 . 10.1016/j.cell.2016.12.012 28086098",
    "full_text_abstract": "The fundamental importance of the role of human B cells in host defense against infectious diseases has been established by the discovery of inborn errors of immunity that disrupt B cell development, differentiation, or function. These findings have laid the groundwork for understanding mechanisms of disease and revealing pathways to improve humoral immunity and treat disease.\n\nB cells develop from hematopoietic stem cells in the bone marrow. Once generated, they serve multiple roles in immune regulation and host defense. However, their most important function is producing antibodies (Ab) that efficiently clear invading pathogens. This is achieved by generating memory B cells that rapidly respond to subsequent Ag exposure, and plasma cells (PCs) that continually secrete Ab. These B cell subsets maintain humoral immunity and host protection against recurrent infections for extended periods of time. Thus, the generation of antigen (Ag)-specific memory cells and PCs underlies long-lived serological immunity, contributing to the success of most vaccines. Our understanding of immunity is often derived from animal models. However, analysis of individuals with monogenic defects that disrupt immune cell function are unprecedented models to link genotypes to clinical phenotypes, establish mechanisms of disease pathogenesis, and elucidate critical pathways for immune cell development and differentiation. Here, we review fundamental breakthroughs in unraveling the complexities of humoral immunity in humans that have come from the discovery of inborn errors disrupting B cell function."
}