{
  "PMC": "6276013",
  "DOI": "10.2478/s11658-009-0013-5",
  "PMID": "19238332",
  "PMCID": "PMC6276013",
  "title": "The expression of protein kinase B in gastric cancer cell apoptosis induced by 12-O-tetradecanoylphorbol-1, 3-acetate.",
  "year": 2009,
  "source_url": "https://europepmc.org/article/PMC/PMC6276013",
  "source": "MED",
  "abstract_text": "Protein kinase B (PKB/Akt) is a serine-threonine kinase functioning downstream of phosphatidylinositol 3-kinase (PI-3 kinase) in response to mitogen or growth factor stimulation. In several cell types, it plays an important anti-apoptotic role. TPA is a potent regulator of the growth of many different cell types. Here, we detected that TPA could induce cell apoptosis in the gastric cancer cell line, BGC-823. We also found that TPA inhibited the expression of PKB/Akt in a TPA concentration- and time-dependent manner. Furthermore, TPA inhibited the phosphorylation of PKB at Ser473, but did not affect the phosphorylation of Thr308. It only attenuated the expression of PKB/Akt and the phosphorylation of Ser473 in the cell nucleus, whereas it did not change the PKB/Akt distribution in BGC-823 cells. These results suggest that PKB/Akt inhibition by TPA may be the important factor in the mechanism of effect of TPA on gastric cell lines.",
  "full_text": "Cell Mol Biol Lett Cell. Mol. Biol. Lett Cellular & Molecular Biology Letters 1425-8153 1689-1392 SP Versita Heidelberg 6276013 19238332 13 10.2478/s11658-009-0013-5 Research Article The expression of protein kinase B in gastric cancer cell apoptosis induced by 12-O-tetradecanoylphorbol-1, 3-acetate Zhang Bing 1 Xia Chun +86 5925921461 +86 5922188680 chunxia99@yahoo.com.cn 2 1 grid.12955.3a 0000000122647233 Medical School, Xiamen University, Xiamen, Fujian Province, 361005 P.R. China 2 grid.12955.3a 0000000122647233 Zhongshan Hospital, Xiamen University, Xiamen, Fujian Province, 361004 P.R. China 23 2 2009 9 2009 14 3 466 18 8 2008 17 1 2009 © © Versita Warsaw and Springer-Verlag Berlin Heidelberg 2009 Protein kinase B (PKB/Akt) is a serine-threonine kinase functioning downstream of phosphatidylinositol 3-kinase (PI-3 kinase) in response to mitogen or growth factor stimulation. In several cell types, it plays an important anti-apoptotic role. TPA is a potent regulator of the growth of many different cell types. Here, we detected that TPA could induce cell apoptosis in the gastric cancer cell line, BGC-823. We also found that TPA inhibited the expression of PKB/Akt in a TPA concentration- and time-dependent manner. Furthermore, TPA inhibited the phosphorylation of PKB at Ser473, but did not affect the phosphorylation of Thr308. It only attenuated the expression of PKB/Akt and the phosphorylation of Ser473 in the cell nucleus, whereas it did not change the PKB/Akt distribution in BGC-823 cells. These results suggest that PKB/Akt inhibition by TPA may be the important factor in the mechanism of effect of TPA on gastric cell lines. Key words TPA Cell apoptosis PKB/Akt Gastric cancer BGC-823 cell line issue-copyright-statement © © Versita Warsaw and Springer-Verlag Berlin Heidelberg 2009 Abbreviations used BrdU 5-bromo-2′-deoxyuridine OA okadaic acid PDK1/PDK2 3-phosphoinositide-dependent kinase PI propidium iodide PI3K phosphoinositide-3-OH kinase PKB/Akt protein kinase B TPA 12-O-tetradecanoylphorbol-1,3-acetate References 1. Liu Z. Liu Y. Zeng Y. Synergistic effect of Epstein-Barr virus and tumor promoters on induction of lymphoma and carcinoma in nude mice J. Cancer Res. Clin. Oncol. 1998 124 541 548 10.1007/s004320050212 9829857 2. Jiang P.Z. Gan M. Huang H. Shen X.M. Wang S. Yao K.T. Proteomics-based identification of proteins with altered expression induced by 12-o-Tetradecanoylphorbol 13-acetate in nasopharyngeal carcinoma CNE2 cells Acta Biochim. Biophys. Sin. 2005 37 97 106 10.1111/j.1745-7270.2005.00016.x 15685366 3. Zhu D. Jiang X. Wu X. Tian F. Mearow K. Lipsky R.H. Marini A.M. Inhibition of protein kinase C promotes neuronal survival in low potassium through an Akt-dependent pathway Neurotox. Res. 2004 6 281 289 10.1007/BF03033438 15545011 4. Kohn A.D. Kovacina K.S. Roth R.A. Insulin stimulates the kinase activity of RAC-PK, a pleckstrin homology domain containing ser/thr kinase EMBO J. 1995 14 4288 4295 7556070 5. Alessi D.R. Andjelkovic M. Caudwell B. Cron P. Morrice N. Cohen P. Hemmings B.A. Mechanism of activation of protein kinase B by insulin and IGF-1 EMBO J. 1996 15 6541 6551 8978681 6. Andjelkovic M. Jakubowicz T. Corn P. Ming X.F. Han J.W. Hemmings B.A. Activation and phosphorylation of a pleckstrin homology domain containing protein kinase (RAC-PK/PKB) promoted by serum and protein phosphatase inhibitors Proc. Natl. Acad. Sci. USA 1996 93 5699 5704 10.1073/pnas.93.12.5699 8650155 7. Vanhaesebroeck B. Alessi D.R. The PI3k-PDK1 connection: more than just a road to PKB Biochem. J. 2000 346 561 576 10.1042/0264-6021:3460561 10698680 8. Hreslko R.C. Murata H. Mueckler M. Phosphoinositide-dependent kinase-2 is a distinct protein kinase enriched in a novel cytoskeletal fraction associated with adipocyte plasma membrane J. Biol. Chem. 2003 278 21615 21622 10.1074/jbc.M302937200 12682057 9. Brazil D.P. Hemmings B.A. Ten years of protein kinase B signalling: a hard Akt to follow Trends Biochem. Sci. 2001 26 657 664 10.1016/S0968-0004(01)01958-2 11701324 10. Liu B. Wu J.F. Zhan Y.Y. Chen H.Z. Zhang X.Y. Wu Q. Regulation of the orphan receptor TR3 nuclear functions by c-Jun N terminal kinase phosphorylation Endocrinology 2007 148 34 44 10.1210/en.2006-0800 17023523 11. Liu S. Wu Q. Ye X.F. Cai J.H. Huang Z.W. Su W.J. Induction of apoptosis by TPA and VP-16 is through translocation of TR3 World J. Gastroenterol. 2002 8 446 450 12046067 12. Ye X.F. Liu S. Wu Q. Lin X.F. Zhang B. Wu J.F. Zhang M.Q. Su W.J. Degradation of retinoid X receptor alpha by TPA through proteasome pathway in gastric cancer cells World J. Gastroenterol. 2003 9 1915 1919 12970875 13. Wu Q. Liu S. Ye X.F. Huang Z.W. Su W.J. Dual roles of Nur77 in selective regulation of apoptosis and cell cycle by TPA and ATRA in gastric cancer cells Carcinogenesis 2002 23 1583 1592 10.1093/carcin/23.10.1583 12376465 14. Zhou H. Summers S.A. Birnbaum M.J. Pittman R.N. Inhibition of Akt kinase by cell-permeable ceramide and its implications for ceramideinduced apoptosis J. Biol. Chem. 1998 273 16568 16575 10.1074/jbc.273.26.16568 9632728 15. Hermann A. Maisel M. Wegner F. Liebau S. Kim D.W. Gerlachm M. Schwarz J. Kim K.S. Storch A. Multipotent neural stem cells from the adult tegmentum with dopaminergic potential develop essential properties of functional neurons Stem Cells 2006 24 949 964 10.1634/stemcells.2005-0192 16373695 16. Staal S.P. Molecular cloning of the akt oncogene and its human homologues AKT1 and AKT2: amplification of AKT1 in a primary human gastric adenocarcinoma Proc. Natl. Acad. Sci. USA 1987 84 5034 5037 10.1073/pnas.84.14.5034 3037531 17. Cheng J.Q. Godwin A.K. Bellacosa A. Taguchi T. Franke T.F. Hamilton T.C. Tsichlis P.N. Testa J.R. AKT2, a putative oncogene encoding a member of a subfamily of protein-serine/threonine kinases, is amplified in human ovarian carcinomas Proc. Natl. Acad. Sci. USA 1992 89 9267 9271 10.1073/pnas.89.19.9267 1409633 18. Cheng J.Q. Ruggei B. Klen W.M. Sonoda G. Altomare D.A. Watson D.K. Testa J.R. Amplification of AKT2 in human pancreatic cells and inhibition of AKT2 expression and tumorigenicity by antisense RNA Proc. Natl. Acad. Sci. USA 1996 93 3636 3641 10.1073/pnas.93.8.3636 8622988 19. Basso A.D. Solit D.S. Chiosis G. Giri B. Tsichlis P. Rosen N. Akt forms an intracellular complex with heat shock protein 90(Hsp90) and Cdc37 and is destabilized by inhibitors of Hsp90 function J. Biol. Chem. 2002 277 39858 39866 10.1074/jbc.M206322200 12176997 20. Li J. Yang S. Billiar T.R. Cyclic nucleotides suppress tumor necrosis factor-mediated apoptosis by inhibiting caspase activation and cytochrome c release in primary hepatocytes via a mechanism independent of Akt activation J. Biol. Chem. 2000 275 13026 13034 10.1074/jbc.275.17.13026 10777606 21. Alessi D.R. James S.R. Downes C.P. Holmes A.B. Gaffney P.R. Reese C.B. Cohen P. Characterization of a 3-phosphoinositidedependent protein kinase which phosphorylates and activates protein kinase B alpha Curr Biol. 1997 7 261 269 22. Stephens L. Anderson K. Stokoe D. Erdjument-Bromage H. Painter G.F. Holmes A.B. Gaffney P.R. Reese C.B. McCormick F. Tempst P. Coadwell J. Hawkins P.T. Protein kinase B kinases that mediate phosphatidylinositol 3,4,5-trisphosphate-dependent activation of protein kinase B Science 1998 279 710 714 10.1126/science.279.5351.710 9445477 23. Nakashio A. Fujita N. Rokudai S. Sato S. Tsuruo T. Prevention of phosphatidylinositol 3’-kinase-Akt survival signaling pathway during topotecan-induced apoptosis Cancer Res. 2000 60 5303 5309 11016662 24. Zundel W. Giaccia A. Inhibition of the anti-apoptotia PI(3)K/Akt/Bad pathway by stress Genes Dev. 1998 12 1941 1946 10.1101/gad.12.13.1941 9649498 25. Borgatti P. Martelli A.M. Tabellini G. Bellacosa A. Capitani S. Neri L.M. Threonine 308 phosphorylated form of Akt translocates to the nucleus of PC12 cells under nerve growth factor stimulation and associates with the nuclear matrix protein nucleolin J. Cell Physiol. 2003 196 79 88 10.1002/jcp.10279 12767043 26. Andjelkovic M. Alessi D.R. Meier R. Fernandez A. Lamb N.J. Frech M. Cron P. Cohen P. Lucocq J.M. Hemmings B.A. Role of translocation in the activation and function of protein kinase B J. Biol. Chem. 1997 272 31515 31524 10.1074/jbc.272.50.31515 9395488 27. Toker A. Newton A.C. Akt/protein kinase B is regulated by autophosphorylation at the hypothetical PDK-2 site J. Biol. Chem. 2000 275 8271 8274 10.1074/jbc.275.12.8271 10722653 28. Vasko SAJI. M. Hardy E. Kruhlak M. Larin A. Savchenko V. Miyakawa M. Isozaki O. Murakami H. Tsushima T. Burman K.D. De M.C. Ringel M.D. Akt activation and localisation correlate with tumour invasion and oncogene expression in thyroid cancer J. Med. Genet. 2004 41 161 170 10.1136/jmg.2003.015339 14985374 29. Kim D. Kim S. Koh H. Yoon S.O. Chung A.S. Cho K.S. Chung J. Akt/PKB promotes cancer cell invasion via increased motility and metalloproteinase production FASEB J. 2001 15 1953 1962 10.1096/fj.01-0198com 11532975 30. Martin D. Salinas M. Fujita N. Tsuruo T. Cuadrado A. Ceramide and reactive oxygen species generated by H2O2 induce caspase-3-independent degradation of Akt/protein kinase B J. Biol. Chem. 2002 277 42943 42952 10.1074/jbc.M201070200 12213802 31. Chan T.O. Rittenhouse S.E. Tsichlis P.N. Akt/PKB and other phosphoinositide-regulated kinases: kinase activation by phosphoinositidedependent phosphorylation Annu. Rev. Biochem. 1999 68 965 1014 10.1146/annurev.biochem.68.1.965 10872470 32. Galetic I. Andjelkovic M. Meier R. Brodbeck D. Park J. Hemmings B.A. Mechanism of protein kinase B activation by insulin/insulin-like growth factor-1 revealed by specific inhibitors of phosphoinositide 3-kinase-significance for diabetes and cancer Pharmocol. Ther. 1999 82 409 425 10.1016/S0163-7258(98)00071-0 33. Ng S.S.W. Tsao M.S. Chow S. Hedley D.W. Inhibition of phosphatidylinositide 3-kinase enhances gemcitabine-induced apoptosis in human pancreatic cancer cells Cancer Res. 2000 60 5451 5455 11034087 34. Welch H. Eguinoa A. Stephens L.R. Hawkins P.T. Protein kinase B and rac are activated in parallel within a phosphatidylinositide 3OH-kinasecontrolled signaling pathway J. Biol. Chem. 1998 273 11248 11256 10.1074/jbc.273.18.11248 9556616 35. O’toole A. Moule S.K. Lockyer P.J. Halestrap A.P. Tumour necrosis factor-alpha activation of protein kinase B in WEHI-164 cells is accompanied by increased phosphorylation of Ser473, but not Thr308 Biochem. J. 2001 359 119 127 10.1042/0264-6021:3590119 11563975 36. Schubert K.M. Scheid M.P. Duronio V. Ceramide inhibits protein kinase B/Akt by promoting dephosphorylation of serine 473 J. Biol. Chem. 2000 275 13330 13335 10.1074/jbc.275.18.13330 10788440 37. Li L. Sampat K. Hu N. Zakari J. Yuspa S.H. Protein kinase C negatively regulates Akt activity and modifies UVC-induced apoptosis in mouse keratinocytes J. Biol. Chem. 2006 281 3237 3243 10.1074/jbc.M512167200 16338928 38. Ahmed N.N. Franke T.F. Bellacosa A. Datta K. Gonzalez-Portal M.E. Taguchi T. Testa J.R. Tsichlis P.N. The proteins encoded by c-Akt and v-Akt differ in post-translational modification, subcellular localization and oncogenic potential Oncogene 1993 8 1957 1963 8510938 39. Meier R. Alessi D.R. Cron P. Andjelkovic M. Hemmings B.A. Mitogenic activation, phosphorylation, and nuclear translocation of protein kinase Bbeta J. Biol. Chem. 1997 272 30491 30497 10.1074/jbc.272.48.30491 9374542 40. Brownawell A.M. Kops G.J. Macara I.G. Burgering B.M. Inhibition of nuclear import by protein kinase B (Akt) regulates the subcellular distribution and activity of the forkhead transcription factor AFX Mol. Cell Biol. 2001 21 3534 3546 10.1128/MCB.21.10.3534-3546.2001 11313479 41. Borgatti P. Martelli A.M. Bellacosa A. Casto R. Massari L. Capitani S. Neri L.M. Translocation of Akt/PKB to the nucleus of osteoblastlike MC3T3-E1 cells exposed to proliferative growth factors FEBS. Lett. 2000 477 27 32 10.1016/S0014-5793(00)01758-0 10899305 42. Gupta D. Syed N.A. Roesler W.J. Khandelwal R.L. Effect of overexpression and nuclear translocation of constitutively active PKB-alpha on cellular survival and proliferation in HepG2 cells J. Cell Biochem. 2004 93 513 525 10.1002/jcb.20200 15372623 43. Pekarsky Y. Koval A. Hallas C. Bichi R. Tresini M. Malstrom S. Russo G. Tsichlis P. Croce C.M. Tcl1 enhances Akt kinase activity and mediates its nuclear translocation Proc. Natl. Acad. Sci. USA 2000 97 3028 3033 10.1073/pnas.040557697 10716693 44. Huang H. Regan K.M. Wang F. Wang D. Smith D.I. van Deursen J.M. Tindall D.J. Skp2 inhibits FOXO1 in tumor suppression through ubiquitin-mediated degradation Proc. Natl. Acad. Sci. USA 2005 102 1649 1654 10.1073/pnas.0406789102 15668399",
  "plain_text": "Protein kinase B (PKB/Akt) is a serine-threonine kinase functioning downstream of phosphatidylinositol 3-kinase (PI-3 kinase) in response to mitogen or growth factor stimulation. In several cell types, it plays an important anti-apoptotic role. TPA is a potent regulator of the growth of many different cell types. Here, we detected that TPA could induce cell apoptosis in the gastric cancer cell line, BGC-823. We also found that TPA inhibited the expression of PKB/Akt in a TPA concentration- and time-dependent manner. Furthermore, TPA inhibited the phosphorylation of PKB at Ser473, but did not affect the phosphorylation of Thr308. It only attenuated the expression of PKB/Akt and the phosphorylation of Ser473 in the cell nucleus, whereas it did not change the PKB/Akt distribution in BGC-823 cells. These results suggest that PKB/Akt inhibition by TPA may be the important factor in the mechanism of effect of TPA on gastric cell lines."
}
