{
  "PMC": "2228221",
  "DOI": "10.1038/bjc.1997.238",
  "PMID": "9155067",
  "PMCID": "PMC2228221",
  "title": "No association of a 306-bp insertion polymorphism in the progesterone receptor gene with ovarian and breast cancer.",
  "year": 1997,
  "source_url": "https://europepmc.org/article/PMC/PMC2228221",
  "source": "MED",
  "full_text": "pmc Br J Cancer Br J Cancer British Journal of Cancer 0007-0920 1532-1827 Nature Publishing Group 2228221 9155067 Letter No association of a 306-bp insertion polymorphism in the progesterone receptor gene with ovarian and breast cancer. Manolitsas T. P. Englefield P. Eccles D. M. Campbell I. G. 1997 75 9 1398 1399 https://creativecommons.org/licenses/by/4.0/ This article is licensed under a Creative Commons Attribution 4.0 International License, which permits use, sharing, adaptation, distribution and reproduction in any medium or format, as long as you give appropriate credit to the original author(s) and the source, provide a link to the Creative Commons license, and indicate if changes were made. The images or other third party material in this article are included in the article’s Creative Commons license, unless indicated otherwise in a credit line to the material. If material is not included in the article’s Creative Commons license and your intended use is not permitted by statutory regulation or exceeds the permitted use, you will need to obtain permission directly from the copyright holder. To view a copy of this license, visit https://creativecommons.org/licenses/by/4.0/ . Images Figure 1",
  "abstract_text": "Images Figure 1",
  "plain_text": "Images Figure 1"
}
