{
    "PMC": "2363333",
    "DOI": "10.1054/bjoc.1999.0954",
    "PMID": "10682656",
    "PMCID": "PMC2363333",
    "title": "Oestrogen and growth factor cross-talk and endocrine insensitivity and acquired resistance in breast cancer.",
    "year": 2000,
    "source_url": "https://europepmc.org/article/PMC/PMC2363333",
    "source": "MED",
    "full_text": "pmc Br J Cancer Br J Cancer British Journal of Cancer 0007-0920 1532-1827 Nature Publishing Group 2363333 6690954 10.1054/bjoc.1999.0954 10682656 Review Oestrogen and growth factor cross-talk and endocrine insensitivity and acquired resistance in breast cancer Nicholson RI 1 Gee J M W 1 Tenovus Cancer Research Centre, University of Wales College of Medicine, Cardiff, CF14 4XX, UK 2 2000 18 01 2000 82 3 501 513 15 03 1999 11 06 1999 08 08 1999 Copyright \u00a9 2000 Cancer Research Campaign 2000 Cancer Research Campaign https://creativecommons.org/licenses/by/4.0/ This article is licensed under a Creative Commons Attribution 4.0 International License, which permits use, sharing, adaptation, distribution and reproduction in any medium or format, as long as you give appropriate credit to the original author(s) and the source, provide a link to the Creative Commons license, and indicate if changes were made.The images or other third party material in this article are included in the article\u2019s Creative Commons license, unless indicated otherwise in a credit line to the material.If material is not included in the article\u2019s Creative Commons license and your intended use is not permitted by statutory regulation or exceeds the permitted use, you will need to obtain permission directly from the copyright holder. To view a copy of this license, visit https://creativecommons.org/licenses/by/4.0/ ."
}