{
  "PMC": "6009406",
  "DOI": "10.1100/tsw.2002.98",
  "PMID": "12806056",
  "PMCID": "PMC6009406",
  "title": "Protein repair and degradation during aging.",
  "year": 2002,
  "source_url": "https://europepmc.org/article/PMC/PMC6009406",
  "source": "MED",
  "abstract_text": "Cellular aging is characterized by a build-up of oxidatively modified proteins. The steady-state level of oxidized proteins depends on the balance between the rate of protein oxidative damage and the rates of protein degradation and repair. Therefore, the accumulation of oxidized protein with age can be due to increased protein damage, decreased oxidized protein degradation and repair, or the combination of both mechanisms. The proteasomal system is the major intracellular proteolytic pathway implicated in the degradation of oxidized protein, and the peptide methionine sulfoxide reductase catalyzes the reduction of methionine sulfoxide (i.e., oxidized methionine) to methionine within proteins. A short summary on protein oxidative damage and oxidized protein degradation is given, and evidence for a decline of proteasome function with age is presented. Arguments for the implication of peptide methionine sulfoxide reductase in the age-related accumulation of oxidized protein are also discussed.",
  "full_text": "ScientificWorldJournal ScientificWorldJournal TSWJ The Scientific World Journal 2356-6140 1537-744X TheScientificWorldJOURNAL 6009406 12806056 874368 10.1100/tsw.2002.98 Mini-Review Article Protein Repair and Degradation during Aging Friguet Bertrand * Laboratoire de Biologie et Biochimie Cellulaire du Vieillissement, Université Denis Diderot-Paris 7, CC 7128, 2 Place Jussieu, 75251 Paris Cedex 05, France *Bertrand Friguet: bfriguet@paris7.jussieu.fr 2002 29 1 2002 2 248 254 1 11 2001 2 12 2001 11 12 2001 Copyright © 2002 Bertrand Friguet. 2002 This is an open access article distributed under the Creative Commons Attribution License, which permits unrestricted use, distribution, and reproduction in any medium, provided the original work is properly cited. Cellular aging is characterized by a build-up of oxidatively modified proteins. The steady-state level of oxidized proteins depends on the balance between the rate of protein oxidative damage and the rates of protein degradation and repair. Therefore, the accumulation of oxidized protein with age can be due to increased protein damage, decreased oxidized protein degradation and repair, or the combination of both mechanisms. The proteasomal system is the major intracellular proteolytic pathway implicated in the degradation of oxidized protein, and the peptide methionine sulfoxide reductase catalyzes the reduction of methionine sulfoxide (i.e., oxidized methionine) to methionine within proteins. A short summary on protein oxidative damage and oxidized protein degradation is given, and evidence for a decline of proteasome function with age is presented. Arguments for the implication of peptide methionine sulfoxide reductase in the age-related accumulation of oxidized protein are also discussed. aging protein maintenance protein oxidative damage protein degradation protein repair proteasome peptide methionine sulfoxide reductase Institut Universitaire de France Fondation pour la Recherche Médicale European 5th Framework Program QLK6-CT1999-02193",
  "plain_text": "Cellular aging is characterized by a build-up of oxidatively modified proteins. The steady-state level of oxidized proteins depends on the balance between the rate of protein oxidative damage and the rates of protein degradation and repair. Therefore, the accumulation of oxidized protein with age can be due to increased protein damage, decreased oxidized protein degradation and repair, or the combination of both mechanisms. The proteasomal system is the major intracellular proteolytic pathway implicated in the degradation of oxidized protein, and the peptide methionine sulfoxide reductase catalyzes the reduction of methionine sulfoxide (i.e., oxidized methionine) to methionine within proteins. A short summary on protein oxidative damage and oxidized protein degradation is given, and evidence for a decline of proteasome function with age is presented. Arguments for the implication of peptide methionine sulfoxide reductase in the age-related accumulation of oxidized protein are also discussed."
}
