{
    "PMC": "7818012",
    "DOI": "10.1631/jzus.b2000356",
    "PMID": "33448183",
    "PMCID": "PMC7818012",
    "title": "Mass spectrometry-based protein\u2012protein interaction techniques and their applications in studies of DNA damage repair.",
    "year": 2021,
    "source_url": "https://europepmc.org/article/PMC/PMC7818012",
    "source": "MED",
    "abstract_text": "Proteins are major functional units that are tightly connected to form complex and dynamic networks. These networks enable cells and organisms to operate properly and respond efficiently to environmental cues. Over the past decades, many biochemical methods have been developed to search for protein-binding partners in order to understand how protein networks are constructed and connected. At the same time, rapid development in proteomics and mass spectrometry (MS) techniques makes it possible to identify interacting proteins and build comprehensive protein\u2012protein interaction networks. The resulting interactomes and networks have proven informative in the investigation of biological functions, such as in the field of DNA damage repair. In recent years, a number of proteins involved in DNA damage response and DNA repair pathways have been uncovered with MS-based protein\u2012protein interaction studies. As the technologies for enriching associated proteins and MS become more sophisticated, the studies of protein\u2012protein interactions are entering a new era. In this review, we summarize the strategies and recent developments for exploring protein\u2012protein interaction. In addition, we discuss the application of these tools in the investigation of protein\u2012protein interaction networks involved in DNA damage response and DNA repair.",
    "full_text": "pmc J Zhejiang Univ Sci B J Zhejiang Univ Sci B Journal of Zhejiang University. Science. B 1673-1581 1862-1783 Zhejiang University Press Hangzhou 7818012 33448183 483 10.1631/jzus.B2000356 Review Mass spectrometry-based protein-protein interaction techniques and their applications in studies of DNA damage repair \u57fa\u4e8e\u8d28\u8c31\u6280\u672f\u7684\u86cb\u767d\u8d28\u4e92\u4f5c\u7814\u7a76\u65b9\u6cd5\u8fdb\u5c55\u53ca\u5176\u5728DNA\u635f\u4f24\u4fee\u590d\u4e2d\u7684\u5e94\u7528 Chen Zhen http://orcid.org/0000-0002-1493-2189 Chen Junjie jchen8@mdanderson.org grid.240145.6 0000 0001 2291 4776 Department of Experimental Radiation Oncology, The University of Texas MD Anderson Cancer Center, Houston, TX 77030 USA 22 1 2021 1 2021 22 1 1 20 1 7 2020 8 9 2020 \u00a9 Zhejiang University Press 2021 This article is made available via the PMC Open Access Subset for unrestricted research re-use and secondary analysis in any form or by any means with acknowledgement of the original source. These permissions are granted for the duration of the World Health Organization (WHO) declaration of COVID-19 as a global pandemic. Proteins are major functional units that are tightly connected to form complex and dynamic networks. These networks enable cells and organisms to operate properly and respond efficiently to environmental cues. Over the past decades, many biochemical methods have been developed to search for protein-binding partners in order to understand how protein networks are constructed and connected. At the same time, rapid development in proteomics and mass spectrometry (MS) techniques makes it possible to identify interacting proteins and build comprehensive protein-protein interaction networks. The resulting interactomes and networks have proven informative in the investigation of biological functions, such as in the field of DNA damage repair. In recent years, a number of proteins involved in DNA damage response and DNA repair pathways have been uncovered with MS-based protein-protein interaction studies. As the technologies for enriching associated proteins and MS become more sophisticated, the studies of protein-protein interactions are entering a new era. In this review, we summarize the strategies and recent developments for exploring protein-protein interaction. In addition, we discuss the application of these tools in the investigation of protein-protein interaction networks involved in DNA damage response and DNA repair. \u86cb\u767d\u8d28\u4f5c\u4e3a\u4e3b\u8981\u7684\u751f\u7269\u529f\u80fd\u5206\u5b50\u5f80\u5f80\u901a\u8fc7\u76f8\u4e92\u4f5c\u7528\u5f62\u6210\u590d\u5408\u4f53\u548c\u52a8\u6001\u7684\u4e92\u4f5c\u7f51\u7edc\u6765\u884c\u4f7f\u5176\u529f\u80fd\u3002\u8fd9\u4e9b\u4e92\u4f5c\u7f51\u7edc\u4f7f\u5f97\u7ec6\u80de\u548c\u5668\u5b98\u80fd\u591f\u6b63\u5e38\u884c\u4f7f\u529f\u80fd,\u5e76\u6709\u6548\u5730\u5e94\u5bf9\u5916\u754c\u73af\u5883\u7684\u523a\u6fc0\u3002\u5728\u8fc7\u53bb\u7684\u51e0\u5341\u5e74\u91cc,\u4e3a\u4e86\u7814\u7a76\u86cb\u767d\u8d28\u76f8\u4e92\u4f5c\u7528\u7f51\u7edc,\u7814\u7a76\u4eba\u5458\u5f00\u53d1\u4e86\u8bb8\u591a\u751f\u7269\u5316\u5b66\u65b9\u6cd5\u6765\u5bfb\u627e\u76ee\u6807\u86cb\u767d\u8d28\u7684\u76f8\u4e92\u4f5c\u7528\u86cb\u767d\u3002\u4e0e\u6b64\u540c\u65f6,\u86cb\u767d\u8d28\u7ec4\u548c\u8d28\u8c31\u6280\u672f\u7684\u5feb\u901f\u53d1\u5c55\u4e5f\u4f7f\u5f97\u9274\u5b9a\u76f8\u4e92\u4f5c\u7528\u86cb\u767d\u5e76\u6784\u5efa\u76f8\u5173\u86cb\u767d\u8d28\u4e92\u4f5c\u7f51\u7edc\u6210\u4e3a\u4e86\u53ef\u80fd\u3002\u5229\u7528\u8fd9\u4e9b\u86cb\u767d\u8d28\u9274\u5b9a\u6280\u672f,\u86cb\u767d\u8d28\u4e92\u4f5c\u7f51\u7edc\u53d6\u5f97\u4e86\u5f88\u591a\u91cd\u8981\u8fdb\u5c55,\u5305\u62ec\u5728DNA\u635f\u4f24\u4fee\u590d\u7814\u7a76\u9886\u57df\u3002\u5728\u8fd1\u4e9b\u5e74,\u901a\u8fc7\u86cb\u767d\u8d28\u4e92\u4f5c\u7814\u7a76,\u5927\u91cf\u7684DNA\u635f\u4f24\u5e94\u7b54\u548c\u4fee\u590d\u76f8\u5173\u86cb\u767d\u88ab\u53d1\u73b0\u3002\u800c\u968f\u7740\u86cb\u767d\u8d28\u5bcc\u96c6\u548c\u8d28\u8c31\u6280\u672f\u7684\u8fdb\u4e00\u6b65\u53d1\u5c55,\u86cb\u767d\u8d28\u4e92\u4f5c\u7814\u7a76\u8fdb\u5165\u4e86\u4e00\u4e2a\u65b0\u7684\u9636\u6bb5\u3002\u5728\u8fd9\u7bc7\u7efc\u8ff0\u91cc,\u6211\u4eec\u603b\u7ed3\u4e86\u86cb\u767d\u8d28\u4e92\u4f5c\u7814\u7a76\u7b56\u7565\u7684\u6700\u65b0\u8fdb\u5c55,\u4ee5\u53ca\u8fd9\u4e9b\u6280\u672f\u5728DNA\u635f\u4f24\u5e94\u7b54\u53ca\u5176\u4fee\u590d\u7814\u7a76\u4e2d\u7684\u5e94\u7528\u3002 Key words Protein-protein interaction Interactome Proteomics Mass spectrometry DNA repair DNA damage response \u5173\u952e\u8bcd \u86cb\u767d\u8d28\u4e92\u4f5c \u76f8\u4e92\u4f5c\u7528\u7ec4 \u86cb\u767d\u8d28\u7ec4 \u8d28\u8c31 DNA\u635f\u4f24\u4fee\u590d DNA\u635f\u4f24\u5e94\u7b54 issue-copyright-statement \u00a9 Zhejiang University Press 2021 Compliance with ethics guidelines Zhen CHEN and Junjie CHEN declare that they have no conflict of interest. This article does not contain any studies with human or animal subjects performed by either of the authors. Change history 4/8/2021 The typesetting format of the online version of the first issue (2021 22(01)) of Journal of Zhejiang University-SCIENCE B is different from that of the printed version (but all the text, figure and table contents in the article are correct). This is due to the new typesetting company adopted this year. Junjie CHEN received support from the Pamela and Wayne Garrison Distinguished Chair in Cancer Research, the Cancer Prevention & Research Institute of Texas (Nos. RP160667 and RP180813) and the National Institutes of Health (NIH) (Nos. CA210929, CA216911, and CA216437). We apologize to many colleagues whose outstanding work was not cited because of the page limitation. We thank all the members of the CHEN laboratory for their help and constructive discussion. We thank Mrinal SRIVASTAVA and Samuel K. SWISHER for critically reading the manuscript and insightful discussions. Author contributions Zhen CHEN and Junjie CHEN wrote and edited the manuscript and created the figures, and have read and approved the final version. References Abbasi S Schild-Poulter C Mapping the Ku interactome using proximity-dependent biotin identification in human cells J Proteome Res 2019 18 3 1064 1077 10.1021/acs.jproteome.8b00771 30585729 Ali AM Pradhan A Singh TR FAAP20: a novel ubiquitin-binding FA nuclear core-complex protein required for functional integrity of the FA-BRCA DNA repair pathway Blood 2012 119 14 3285 3294 10.1182/blood-2011-10-385963 22343915 Andersen SL Bergstralh DT Kohl KP Drosophila MUS312 and the vertebrate ortholog BTBD12 interact with DNA structure-specific endonucleases in DNA repair and recombination Mol Cell 2009 35 1 128 135 10.1016/j.molcel.2009.06.019 19595722 Ayyildiz D Antoniali G D\u2019Ambrosio C Architecture of the human APE1 interactome defines novel cancers signatures Sci Rep 2020 10 28 10.1038/s41598-019-56981-z 31913336 Bagci H Sriskandarajah N Robert A Mapping the proximity interaction network of the Rho-family GTPases reveals signalling pathways and regulatory mechanisms Nat Cell Biol 2020 22 1 120 134 10.1038/s41556-019-0438-7 31871319 Bass TE Luzwick JW Kavanaugh G ETAA1 acts at stalled replication forks to maintain genome integrity Nat Cell Biol 2016 18 11 1185 1195 10.1038/ncb3415 27723720 Batra J Hultquist JF Liu DD Protein interaction mapping identifies RBBP6 as a negative regulator of Ebola virus replication Cell 2018 175 7 1917 1930.e13 10.1016/j.cell.2018.08.044 30550789 Baymaz HI Spruijt CG Vermeulen M Warscheid B Identifying nuclear protein-protein interactions using GFP affinity purification and SILAC-based quantitative mass spectrometry Stable Isotope Labeling by Amino Acids in Cell Culture (SILAC): Methods and Protocols 2014 New York Humana Press 207 226 Botuyan MV Cui GF Dran\u00e9 P Mechanism of 53BP1 activity regulation by RNA-binding TIRR and a designer protein Nat Struct Mol Biol 2018 25 7 591 600 10.1038/s41594-018-0083-z 29967538 Brandsma I van Gent DC Pathway choice in DNA double strand break repair: observations of a balancing act Genome Integr 2012 3 9 10.1186/2041-9414-3-9 23181949 Branon TC Bosch JA Sanchez AD Efficient proximity labeling in living cells and organisms with TurboID Nat Biotechnol 2018 36 9 880 887 10.1038/nbt.4201 30125270 Cannavo E Gerrits B Marra G Characterization of the interactome of the human MutL homologues MLH1, PMS1, and PMS2 J Biol Chem 2007 282 5 2976 2986 10.1074/jbc.M609989200 17148452 Cantor SB Bell DW Ganesan S BACH1, a novel helicase-like protein, interacts directly with BRCA1 and contributes to its DNA repair function Cell 2001 105 1 149 160 10.1016/S0092-8674(01)00304-X 11301010 Castello A Horos R Strein C Dassi E Comprehensive identification of RNA-binding proteins by RNA interactome capture Post-Transcriptional Gene Regulation 2016 New York Humana Press 131 139 Chapman JR Sossick AJ Boulton SJ BRCA1-associated exclusion of 53BP1 from DNA damage sites underlies temporal control of DNA repair J Cell Sci 2012 125 3529 3534 10.1242/jcs.105353 22553214 Chavez JD Schweppe DK Eng JK In vivo conformational dynamics of Hsp90 and its interactors Cell Chem Biol 2016 23 6 716 726 10.1016/j.chembiol.2016.05.012 27341434 Cheeseman IM Desai A A combined approach for the localization and tandem affinity purification of protein complexes from metazoans Sci STKE 2005 2005 266 pl1 10.1126/stke.2662005pl1 15644491 Cheeseman IM Niessen S Anderson S A conserved protein network controls assembly of the outer kinetochore and its ability to sustain tension Genes Dev 2004 18 18 2255 2268 10.1101/gad.1234104 15371340 Chen JJ Silver DP Walpita D Stable interaction between the products of the BRCA1 and BRCA2 tumor suppressor genes in mitotic and meiotic cells Mol Cell 1998 2 3 317 328 10.1016/S1097-2765(00)80276-2 9774970 Chen Z Tran M Tang MF Proteomic analysis reveals a novel mutator S (MutS) partner involved in mismatch repair pathway Mol Cell Proteomics 2016 15 4 1299 1308 10.1074/mcp.M115.056093 27037360 Chen Z Lei CQ Wang C Global phosphoproteomic analysis reveals ARMC10 as an AMPK substrate that regulates mitochondrial dynamics Nat Commun 2019 10 104 10.1038/s41467-018-08004-0 30631047 Chen Z Wang C Jain A AMPK interactome reveals new function in non-homologous end joining DNA repair Mol Cell Proteomics 2020 19 3 467 477 10.1074/mcp.RA119.001794 31900314 Cho KF Branon TC Rajeev S Split-TurboID enables contact-dependent proximity labeling in cells Proc Natl Acad Sci USA 2020 117 22 12143 12154 10.1073/pnas.1919528117 32424107 Cortez D Wang Y Qin J Requirement of ATM-dependent phosphorylation of BRCA1 in the DNA damage response to double-strand breaks Science 1999 286 5442 1162 1166 10.1126/science.286.5442.1162 10550055 Cortez-Retamozo V Backmann N Senter PD Efficient cancer therapy with a nanobody-based conjugate Cancer Res 2004 64 8 2853 2857 10.1158/0008-5472.CAN-03-3935 15087403 Coyaud E Ranadheera C Cheng D Global interactomics uncovers extensive organellar targeting by Zika virus Mol Cell Proteomics 2018 17 11 2242 2255 10.1074/mcp.TIR118.000800 30037810 Craxton A Munnur D Jukes-Jones R PAXX and its paralogs synergistically direct DNA polymerase \u03bb activity in DNA repair Nat Commun 2018 9 3877 10.1038/s41467-018-06127-y 30250067 Cristea IM Williams R Chait BT Fluorescent proteins as proteomic probes Mol Cell Proteomics 2005 4 12 1933 1941 10.1074/mcp.M500227-MCP200 16155292 Davis ZH Verschueren E Jang GM Global mapping of herpesvirus-host protein complexes reveals a transcription strategy for late genes Mol Cell 2015 57 2 349 360 10.1016/j.molcel.2014.11.026 25544563 de Munter S G\u00f6rnemann J Derua R Split-BioID: a proximity biotinylation assay for dimerization-dependent protein interactions FEBS Lett 2017 591 2 415 424 10.1002/1873-3468.12548 28032891 Diep J Ooi YS Wilkinson AW Enterovirus pathogenesis requires the host methyltransferase SETD3 Nat Microbiol 2019 4 12 2523 2537 10.1038/s41564-019-0551-1 31527793 Dong YS Hakimi MA Chen XW Regulation of BRCC, a holoenzyme complex containing BRCA1 and BRCA2, by a signalosome-like subunit and its role in DNA repair Mol Cell 2003 12 5 1087 1099 10.1016/S1097-2765(03)00424-6 14636569 Dran\u00e9 P Brault ME Cui GF TIRR regulates 53BP1 by masking its histone methyl-lysine binding function Nature 2017 543 7644 211 216 10.1038/nature21358 28241136 Eckhardt M Zhang W Gross AM Multiple routes to oncogenesis are promoted by the human papillomavirushost protein network Cancer Discov 2018 8 11 1474 1489 10.1158/2159-8290.CD-17-1018 30209081 Fekairi S Scaglione S Chahwan C Human SLX4 is a Holliday junction resolvase subunit that binds multiple DNA repair/recombination endonucleases Cell 2009 138 1 78 89 10.1016/j.cell.2009.06.029 19596236 Feng W Liu CZ Spinozzi S Identifying the cardiac dyad proteome in vivo by a BioID2 knock-in strategy Circulation 2020 141 11 940 942 10.1161/CIRCULATIONAHA.119.043434 32176542 Feng WJ Guo YY Huang J TRAIP regulates replication fork recovery and progression via PCNA Cell Discov 2016 2 16016 10.1038/celldisc.2016.16 27462463 Fleck O Nielsen O DNA repair J Cell Sci 2004 117 4 515 517 10.1242/jcs.00952 14730007 Friedberg EC McDaniel LD Schultz RA The role of endogenous and exogenous DNA damage and mutagenesis Curr Opin Genet Dev 2004 14 1 5 10 10.1016/j.gde.2003.11.001 15108798 Gao XD Tu LC Mir A C-BERST: defining subnuclear proteomic landscapes at genomic elements with dCas9-APEX2 Nat Methods 2018 15 6 433 436 10.1038/s41592-018-0006-2 29735996 Gavin AC Bosche M Krause R Functional organization of the yeast proteome by systematic analysis of protein complexes Nature 2002 415 6868 141 147 10.1038/415141a 11805826 Gavin AC Aloy P Grandi P Proteome survey reveals modularity of the yeast cell machinery Nature 2006 440 7084 631 636 10.1038/nature04532 16429126 Gheiratmand L Coyaud E Gupta GD Spatial and proteomic profiling reveals centrosome-independent features of centriolar satellites EMBO J 2019 38 14 e101109 10.15252/embj.2018101109 31304627 Ghezraoui H Oliveira C Becker JR 53BP1 cooperation with the REV7-shieldin complex underpins DNA structure-specific NHEJ Nature 2018 560 7716 122 127 10.1038/s41586-018-0362-1 30046110 Ghosal G Leung JWC Nair BC Proliferating cell nuclear antigen (PCNA)-binding protein C1orf124 is a regulator of translesion synthesis J Biol Chem 2012 287 41 34225 34233 10.1074/jbc.M112.400135 22902628 Go CD, Knight JDR, Rajasekharan A, et al., 2019. A proximity biotinylation map of a human cell. bioRxiv, preprint. 10.1101/796391 Gonatopoulos-Pournatzis T Wu MK Braunschweig U Genome-wide CRISPR-Cas9 interrogation of splicing networks reveals a mechanism for recognition of autism-misregulated neuronal microexons Mol Cell 2018 72 3 510 524.e12 10.1016/j.molcel.2018.10.008 30388412 Gong ZH Chen JJ E3 ligase RFWD3 participates in replication checkpoint control J Biol Chem 2011 286 25 22308 22313 10.1074/jbc.M111.222869 21504906 Gordon DE Jang GM Bouhaddou M A SARS-CoV-2 protein interaction map reveals targets for drug repurposing Nature 2020 583 7816 459 468 10.1038/s41586-020-2286-9 32353859 Gupta GD Coyaud \u00c9 Gon\u00e7alves J A dynamic protein interaction landscape of the human centrosomecilium interface Cell 2015 163 6 1484 1499 10.1016/j.cell.2015.10.065 26638075 Gupta R Somyajit K Narita T DNA repair network analysis reveals shieldin as a key regulator of NHEJ and PARP inhibitor sensitivity Cell 2018 173 4 972 988.e23 10.1016/j.cell.2018.03.050 29656893 Han J Liu T Huen MS SIVA1 directs the E3 ubiquitin ligase RAD18 for PCNA monoubiquitination J Cell Biol 2014 205 6 811 827 10.1083/jcb.201311007 24958773 Han YS Branon TC Martell JD Directed evolution of split APEX2 peroxidase ACS Chem Biol 2019 14 4 619 635 10.1021/acschembio.8b00919 30848125 Havugimana PC Hart GT Nepusz T A census of human soluble protein complexes Cell 2012 150 5 1068 1081 10.1016/j.cell.2012.08.011 22939629 Hein MY Hubner NC Poser I A human interactome in three quantitative dimensions organized by stoichiometries and abundances Cell 2015 163 3 712 723 10.1016/j.cell.2015.09.053 26496610 Ho Y Gruhler A Heilbut A Systematic identification of protein complexes in Saccharomyces cerevisiae by mass spectrometry Nature 2002 415 6868 180 183 10.1038/415180a 11805837 Hoeijmakers JH DNA damage, aging, and cancer N Engl J Med 2009 361 15 1475 1485 10.1056/NEJMra0804615 19812404 Holthenrich A Drexler HCA Chehab T Proximity proteomics of endothelial Weibel-Palade bodies identifies novel regulator of von Willebrand factor secretion Blood 2019 134 12 979 982 10.1182/blood.2019000786 31262780 Hung V Zou P Rhee HW Proteomic mapping of the human mitochondrial intermembrane space in live cells via ratiometric APEX tagging Mol Cell 2014 55 2 332 341 10.1016/j.molcel.2014.06.003 25002142 Hung V Udeshi ND Lam SS Spatially resolved proteomic mapping in living cells with the engineered peroxidase APEX2 Nat Protoc 2016 11 3 456 475 10.1038/nprot.2016.018 26866790 Huttlin EL Ting L Bruckner RJ The BioPlex network: a systematic exploration of the human interactome Cell 2015 162 2 425 440 10.1016/j.cell.2015.06.043 26186194 Huttlin EL Bruckner RJ Paulo JA Architecture of the human interactome defines protein communities and disease networks Nature 2017 545 7655 505 509 10.1038/nature22366 28514442 Huttlin EL, Bruckner RJ, Navarrete-Perea J, et al., 2020. Dual proteome-scale networks reveal cell-specific remodeling of the human interactome. bioRxiv, preprint. 10.1101/2020.01.19.905109 Isabelle M Moreel X Gagn\u00e9 JP Investigation of PARP-1, PARP-2, and PARG interactomes by affinity-purification mass spectrometry Proteome Sci 2010 8 22 10.1186/1477-5956-8-22 20388209 J\u00e4ger S Cimermancic P Gulbahce N Global landscape of HIV-human protein complexes Nature 2012 481 7381 365 370 10.1038/nature10719 Jiricny J The multifaceted mismatch-repair system Nat Rev Mol Cell Biol 2006 7 5 335 346 10.1038/nrm1907 16612326 Kadyrov FA Dzantiev L Constantin N Endonucleolytic function of MutL\u03b1 in human mismatch repair Cell 2006 126 2 297 308 10.1016/j.cell.2006.05.039 16873062 Kaufmann T Grishkovskaya I Polyansky AA A novel non-canonical PIP-box mediates PARG interaction with PCNA Nucleic Acids Res 2017 45 16 9741 9759 10.1093/nar/gkx604 28934471 Kim DI Roux KJ Filling the void: proximity-based labeling of proteins in living cells Trends Cell Biol 2016 26 11 804 817 10.1016/j.tcb.2016.09.004 27667171 Kim DI Birendra KC Zhu WH Probing nuclear pore complex architecture with proximity-dependent biotinylation Proc Natl Acad Sci USA 2014 111 24 E2453 E2461 10.1073/pnas.1406459111 24927568 Kim DI Jensen SC Noble KA An improved smaller biotin ligase for BioID proximity labeling Mol Biol Cell 2016 27 8 1188 1196 10.1091/mbc.E15-12-0844 26912792 Kim H Huang J Chen JJ CCDC98 is a BRCA1-BRCT domain-binding protein involved in the DNA damage response Nat Struct Mol Biol 2007 14 8 710 715 10.1038/nsmb1277 17643122 Kim H Chen JJ Yu XC Ubiquitin-binding protein RAP80 mediates BRCA1-dependent DNA damage response Science 2007 316 5828 1202 1205 10.1126/science.1139621 17525342 Kristensen AR Gsponer J Foster LJ A high-throughput approach for measuring temporal changes in the interactome Nat Methods 2012 9 9 907 909 10.1038/nmeth.2131 22863883 Krogan NJ Cagney G Yu HY Global landscape of protein complexes in the yeast Saccharomyces cerevisiae Nature 2006 440 7084 637 643 10.1038/nature04670 16554755 Lam SS Martell JD Kamer KJ Directed evolution of APEX2 for electron microscopy and proximity labeling Nat Methods 2015 12 1 51 54 10.1038/nmeth.3179 25419960 Larance M Kirkwood KJ Tinti M Global membrane protein interactome analysis using in vivo cross-linking and mass spectrometry-based protein correlation profiling Mol Cell Proteomics 2016 15 7 2476 2490 10.1074/mcp.O115.055467 27114452 le Guerrou\u00e9 F Eck F Jung J Autophagosomal content profiling reveals an LC3C-dependent piecemeal mitophagy pathway Mol Cell 2017 68 4 786 796.e6 10.1016/j.molcel.2017.10.029 29149599 Lee YC Zhou Q Chen JJ RPA-binding protein ETAA1 is an ATR activator involved in DNA replication stress response Curr Biol 2016 26 24 3257 3268 10.1016/j.cub.2016.10.030 27818175 Leung JWC Wang YC Fong KW Fanconi anemia (FA) binding protein FAAP20 stabilizes FA complementation group A (FANCA) and participates in interstrand cross-link repair Proc Natl Acad Sci USA 2012 109 12 4491 4496 10.1073/pnas.1118720109 22396592 Leung JWC Makharashvili N Agarwal P ZMYM3 regulates BRCA1 localization at damaged chromatin to promote DNA repair Genes Dev 2017 31 3 260 274 10.1101/gad.292516.116 28242625 Li GM Mechanisms and functions of DNA mismatch repair Cell Res 2008 18 1 85 98 10.1038/cr.2007.115 18157157 Li MH Johnson JR Truong B Identification of antiviral roles for the exon-junction complex and nonsense-mediated decay in flaviviral infection Nat Microbiol 2019 4 6 985 995 10.1038/s41564-019-0375-z 30833725 Li S Chen PL Subramanian T Binding of CtIP to the BRCT repeats of BRCA1 involved in the transcription regulation of p21 is disrupted upon DNA damage J Biol Chem 1999 274 16 11334 11338 10.1074/jbc.274.16.11334 10196224 Li X Wang WQ Wang JD Proteomic analyses reveal distinct chromatin-associated and soluble transcription factor complexes Mol Syst Biol 2015 11 1 775 10.15252/msb.20145504 25609649 Li X Gao M Choi JM Clustered, regularly interspaced short palindromic repeats (CRISPR)/Cas9-coupled affinity purification/mass spectrometry analysis revealed a novel role of neurofibromin in mTOR signaling Mol Cell Proteomics 2017 16 4 594 607 10.1074/mcp.M116.064543 28174230 Ling C Ishiai M Ali AM FAAP100 is essential for activation of the Fanconi anemia-associated DNA damage response pathway EMBO J 2007 26 8 2104 2114 10.1038/sj.emboj.7601666 17396147 Liu F Heck AJR Interrogating the architecture of protein assemblies and protein interaction networks by cross-linking mass spectrometry Curr Opin Struct Biol 2015 35 100 108 10.1016/j.sbi.2015.10.006 26615471 Liu F Rijkers DTS Post H Proteome-wide profiling of protein assemblies by cross-linking mass spectrometry Nat Methods 2015 12 12 1179 1184 10.1038/nmeth.3603 26414014 Liu F L\u00f6ssl P Rabbitts BM The interactome of intact mitochondria by cross-linking mass spectrometry provides evidence for coexisting respiratory supercomplexes Mol Cell Proteomics 2018 17 2 216 232 10.1074/mcp.RA117.000470 29222160 Liu T Ghosal G Yuan JS FAN1 acts with FANCI-FANCD2 to promote DNA interstrand cross-link repair Science 2010 329 5992 693 696 10.1126/science.1192656 20671156 Liu WS Song HP Chen Q Recent advances in the selection and identification of antigen-specific nanobodies Mol Immunol 2018 96 37 47 10.1016/j.molimm.2018.02.012 29477934 Liu XN Salokas K Tamene F An AP-MS- and BioID-compatible MAC-tag enables comprehensive mapping of protein interactions and subcellular localizations Nat Commun 2018 9 1188 10.1038/s41467-018-03523-2 29568061 Liu ZX Wu JX Yu XC CCDC98 targets BRCA1 to DNA damage sites Nat Struct Mol Biol 2007 14 8 716 720 10.1038/nsmb1279 17643121 Lord CJ Ashworth A The DNA damage response and cancer therapy Nature 2012 481 7381 287 294 10.1038/nature10760 22258607 Lossaint G Larroque M Ribeyre C FANCD2 binds MCM proteins and controls replisome function upon activation of S phase checkpoint signaling Mol Cell 2013 51 5 678 690 10.1016/j.molcel.2013.07.023 23993743 Lubin A Zhang L Chen H A human XPC protein interactome\u2014a resource Int J Mol Sci 2014 15 1 141 158 10.3390/ijms15010141 Mackay C D\u00e9clais AC Lundin C Identification of KIAA1018/FAN1, a DNA repair nuclease recruited to DNA damage by monoubiquitinated FANCD2 Cell 2010 142 1 65 76 10.1016/j.cell.2010.06.021 20603015 Malovannaya A Lanz RB Jung SY Analysis of the human endogenous coregulator complexome Cell 2011 145 5 787 799 10.1016/j.cell.2011.05.006 21620140 Mar\u00e9chal A Zou L RPA-coated single-stranded DNA as a platform for post-translational modifications in the DNA damage response Cell Res 2015 25 1 9 23 10.1038/cr.2014.147 25403473 Mar\u00e9chal A Li JM Ji XY PRP19 transforms into a sensor of RPA-ssDNA after DNA damage and drives ATR activation via a ubiquitin-mediated circuitry Mol Cell 2014 53 2 235 246 10.1016/j.molcel.2013.11.002 24332808 Martell JD Deerinck TJ Sancak Y Engineered ascorbate peroxidase as a genetically encoded reporter for electron microscopy Nat Biotechnol 2012 30 11 1143 1148 10.1038/nbt.2375 23086203 Mateus A Kurzawa N Becher I Thermal proteome profiling for interrogating protein interactions Mol Syst Biol 2020 16 3 e9232 10.15252/msb.20199232 32133759 Meetei AR de Winter JP Medhurst AL A novel ubiquitin ligase is deficient in Fanconi anemia Nat Genet 2003 35 2 165 170 10.1038/ng1241 12973351 Mirman Z Lottersberger F Takai H 53BP1-RIF1-shieldin counteracts DSB resection through CST-and Pol\u03b1-dependent fill-in Nature 2018 560 7716 112 116 10.1038/s41586-018-0324-7 30022158 Mirrashidi KM Elwell CA Verschueren E Global mapping of the Inc-human interactome reveals that retromer restricts Chlamydia infection Cell Host Microbe 2015 18 1 109 121 10.1016/j.chom.2015.06.004 26118995 Mohni KN Wessel SR Zhao RX HMCES maintains genome integrity by shielding abasic sites in singlestrand DNA Cell 2019 176 1\u20132 144 153.e13 10.1016/j.cell.2018.10.055 30554877 Mostofa AGM Punganuru SR Madala HR S-phase specific downregulation of human O 6 -methylguanine DNA methyltransferase (MGMT) and its serendipitous interactions with PCNA and p21 cip1 proteins in glioma cells Neoplasia 2018 20 4 305 323 10.1016/j.neo.2018.01.010 29510343 Mu YH Lou JM Srivastava M SLFN11 inhibits checkpoint maintenance and homologous recombination repair EMBO Rep 2016 17 1 94 109 10.15252/embr.201540964 26658330 Mu\u00f1oz IM Hain K D\u00e9clais AC Coordination of structure-specific nucleases by human SLX4/BTBD12 is required for DNA repair Mol Cell 2009 35 1 116 127 10.1016/j.molcel.2009.06.020 19595721 Muyldermans S Nanobodies: natural single-domain antibodies Annu Rev Biochem 2013 82 775 797 10.1146/annurev-biochem-063011-092449 23495938 Myers SA Wright J Peckner R Discovery of proteins associated with a predefined genomic locus via dCas9-APEX-mediated proximity labeling Nat Methods 2018 15 6 437 439 10.1038/s41592-018-0007-1 29735997 Negrini S Gorgoulis VG Halazonetis TD Genomic instability\u2014an evolving hallmark of cancer Nat Rev Mol Cell Biol 2010 11 3 220 228 10.1038/nrm2858 20177397 Niture SK Doneanu CE Velu CS Proteomic analysis of human O 6 -methylguanine-DNA methyltransferase by affinity chromatography and tandem mass spectrometry Biochem Biophys Res Commun 2005 337 4 1176 1184 10.1016/j.bbrc.2005.09.177 16226712 Noordermeer SM Adam S Setiaputra D The shieldin complex mediates 53BP1-dependent DNA repair Nature 2018 560 7716 117 121 10.1038/s41586-018-0340-7 30022168 Ohta S Shiomi Y Sugimoto K A proteomics approach to identify proliferating cell nuclear antigen (PCNA)-binding proteins in human cell lysates. Identification of the human CHL12/RFCs2-5 complex as a novel PCNA-binding protein J Biol Chem 2002 277 43 40362 40367 10.1074/jbc.M206194200 12171929 Olson MG Widner RE Jorgenson LM Proximity labeling to map host-pathogen interactions at the membrane of a bacterium-containing vacuole in Chlamydia trachomatis -infected human cells Infect Immun 2019 87 11 e00537 19 10.1128/IAI.00537-19 31405957 O\u2019Reilly FJ Rappsilber J Cross-linking mass spectrometry: methods and applications in structural, molecular and systems biology Nat Struct Mol Biol 2018 25 11 1000 1008 10.1038/s41594-018-0147-0 30374081 Penn BH Netter Z Johnson JR An Mtb -human protein-protein interaction map identifies a switch between host antiviral and antibacterial responses Mol Cell 2018 71 4 637 648.e5 10.1016/j.molcel.2018.07.010 30118682 Pili\u00e9 PG Tang C Mills GB State-of-the-art strategies for targeting the DNA damage response in cancer Nat Rev Clin Oncol 2019 16 2 81 104 10.1038/s41571-018-0114-z 30356138 Prasad R Williams JG Hou EW Pol \u03b2 associated complex and base excision repair factors in mouse fibro-blasts Nucleic Acids Res 2012 40 22 11571 11582 10.1093/nar/gks898 23042675 Prasad R Dyrkheeva N Williams J Mammalian base excision repair: functional partnership between PARP-1 and APE1 in AP-site repair PLoS ONE 2015 10 5 e0124269 10.1371/journal.pone.0124269 26020771 Ramage HR Kumar GR Verschueren E A combined proteomics/genomics approach links hepatitis C virus infection with nonsense-mediated mRNA decay Mol Cell 2015 57 2 329 340 10.1016/j.molcel.2014.12.028 25616068 Ramanathan M Majzoub K Rao DS RNA-protein interaction detection in living cells Nat Methods 2018 15 3 207 212 10.1038/nmeth.4601 29400715 Rappold I Iwabuchi K Date T Tumor suppressor p53 binding protein 1 (53bp1) is involved in DNA damage-signaling pathways J Cell Biol 2001 153 3 613 620 10.1083/jcb.153.3.613 11331310 Reardon JT Sancar A Purification and characterization of Escherichia coli and human nucleotide excision repair enzyme systems Methods Enzymol 2006 408 189 213 10.1016/S0076-6879(06)08012-8 16793370 Rees JS Li XW Perrett S Protein neighbors and proximity proteomics Mol Cell Proteomics 2015 14 11 2848 2856 10.1074/mcp.R115.052902 26355100 Rhee HW Zou P Udeshi ND Proteomic mapping of mitochondria in living cells via spatially restricted enzymatic tagging Science 2013 339 6125 1328 1331 10.1126/science.1230593 23371551 Rigaut G Shevchenko A Rutz B A generic protein purification method for protein complex characterization and proteome exploration Nat Biotechnol 1999 17 10 1030 1032 10.1038/13732 10504710 Robertson AB Klungland A Rognes T DNA repair in mammalian cells Cell Mol Life Sci 2009 66 6 981 993 10.1007/s00018-009-8736-z 19153658 Robu M Shah RG Purohit NK Poly(ADP-ribose) polymerase 1 escorts XPC to UV-induced DNA lesions during nucleotide excision repair Proc Natl Acad Sci USA 2017 114 33 E6847 E6856 10.1073/pnas.1706981114 28760956 Rodriguez A D\u2019Andrea A Fanconi anemia pathway Curr Biol 2017 27 18 R986 R988 10.1016/j.cub.2017.07.043 28950089 Roux KJ Kim DI Raida M A promiscuous biotin ligase fusion protein identifies proximal and interacting proteins in mammalian cells J Cell Biol 2012 196 6 801 810 10.1083/jcb.201112098 22412018 Roux KJ Kim DI Burke B BioID: a screen for protein-protein interactions Curr Protoc Protein Sci 2013 74 1 19.23.1 19.23.14 10.1002/0471140864.ps1923s74 Savitski MM Reinhard FBM Franken H Tracking cancer drugs in living cells by thermal profiling of the proteome Science 2014 346 6205 1255784 10.1126/science.1255784 25278616 Schenstrom SM Rebula CA Tatham MH Expanded interactome of the intrinsically disordered protein Dss1 Cell Rep 2018 25 4 862 870 10.1016/j.celrep.2018.09.080 30355493 Schmidt TGM Skerra A The Strep -tag system for one-step purification and high-affinity detection or capturing of proteins Nat Protocols 2007 2 6 1528 1535 10.1038/nprot.2007.209 17571060 Schmidtmann E Anton T Rombaut P Determination of local chromatin composition by CasID Nucleus 2016 7 5 476 484 10.1080/19491034.2016.1239000 27676121 Schopp IM, B\u00e9thune J, 2018. Split-BioID\u2014proteomic analysis of context-specific protein complexes in their native cellular environment. J Vis Exp , (134):e57479. 10.3791/57479 Schopp IM Amaya Ramirez CC Debeljak J Split-BioID a conditional proteomics approach to monitor the composition of spatiotemporally defined protein complexes Nat Commun 2017 8 15690 10.1038/ncomms15690 28585547 Schweppe DK Harding C Chavez JD Hostmicrobe protein interactions during bacterial infection Chem Biol 2015 22 11 1521 1530 10.1016/j.chembiol.2015.09.015 26548613 Schweppe DK Chavez JD Lee CF Mitochondrial protein interactome elucidated by chemical cross-linking mass spectrometry Proc Natl Acad Sci USA 2017 114 7 1732 1737 10.1073/pnas.1617220114 28130547 Scott DE Bayly AR Abell C Small molecules, big targets: drug discovery faces the protein-protein interaction challenge Nat Rev Drug Discov 2016 15 8 533 550 10.1038/nrd.2016.29 27050677 Scully R Chen JJ Plug A Association of BRCA1 with Rad51 in mitotic and meiotic cells Cell 1997 88 2 265 275 10.1016/S0092-8674(00)81847-4 9008167 Scully R Panday A Elango R DNA doublestrand break repair-pathway choice in somatic mammalian cells Nat Rev Mol Cell Biol 2019 20 11 698 714 10.1038/s41580-019-0152-0 31263220 Shah PS Link N Jang GM Comparative flavivirushost protein interaction mapping reveals mechanisms of dengue and Zika virus pathogenesis Cell 2018 175 7 1931 1945.e18 10.1016/j.cell.2018.11.028 30550790 Sharan SK Morimatsu M Albrecht U Embryonic lethality and radiation hypersensitivity mediated by RAD51 in mice lacking BRCA2 Nature 1997 386 6627 804 810 10.1038/386804a0 9126738 Sobhian B Shao GZ Lilli DR RAP80 targets BRCA1 to specific ubiquitin structures at DNA damage sites Science 2007 316 5828 1198 1202 10.1126/science.1139516 17525341 Sowa ME Bennett EJ Gygi SP Defining the human deubiquitinating enzyme interaction landscape Cell 2009 138 2 389 403 10.1016/j.cell.2009.04.042 19615732 Srivastava M Chen Z Zhang HM Replisome dynamics and their functional relevance upon DNA damage through the PCNA interactome Cell Rep 2018 25 13 3869 3883.e4 10.1016/j.celrep.2018.11.099 30590055 Srivastava M Su D Zhang HM HMCES safeguards replication from oxidative stress and ensures error-free repair EMBO Rep 2020 21 6 e49123 10.15252/embr.201949123 32307824 Stacey RG Skinnider MA Scott NE A rapid and accurate approach for prediction of interactomes from coelution data (PrInCE) BMC Bioinformatics 2017 18 457 10.1186/s12859-017-1865-8 29061110 St-Denis N Gupta GD Lin ZY Phenotypic and interaction profiling of the human phosphatases identifies diverse mitotic regulators Cell Rep 2016 17 9 2488 2501 10.1016/j.celrep.2016.10.078 27880917 Stukalov A, Girault V, Grass V, et al., 2020. Multi-level proteomics reveals host-perturbation strategies of SARS-CoV-2 and SARS-CoV. bioRxiv, preprint. 10.1101/2020.06.17.156455 Su DX Ma S Shan L Ubiquitin-specific protease 7 sustains DNA damage response and promotes cervical carcinogenesis J Clin Invest 2018 128 10 4280 4296 10.1172/JCI120518 30179224 Sung P Klein H Mechanism of homologous recombination: mediators and helicases take on regulatory functions Nat Rev Mol Cell Biol 2006 7 10 739 750 10.1038/nrm2008 16926856 Svendsen JM Smogorzewska A Sowa ME Mammalian BTBD12/SLX4 assembles a Holliday junction resolvase and is required for DNA repair Cell 2009 138 1 63 77 10.1016/j.cell.2009.06.030 19596235 Sy SMH Huen MSY Chen JJ PALB2 is an integral component of the BRCA complex required for homologous recombination repair Proc Natl Acad Sci USA 2009 106 17 7155 7160 10.1073/pnas.0811159106 19369211 Tadi SK Tellier-Leb\u00e8gue C Nemoz C PAXX is an accessory c-NHEJ factor that associates with Ku70 and has overlapping functions with XLF Cell Rep 2016 17 2 541 555 10.1016/j.celrep.2016.09.026 27705800 Tan CSH Go KD Bisteau X Thermal proximity coaggregation for system-wide profiling of protein complex dynamics in cells Science 2018 359 6380 1170 1177 10.1126/science.aan0346 29439025 Thomashevski A High AA Drozd M The Fanconi anemia core complex forms four complexes of different sizes in different subcellular compartments J Biol Chem 2004 279 25 26201 26209 10.1074/jbc.M400091200 15082718 Trinkle-Mulcahy L Recent advances in proximity-based labeling methods for interactome mapping F1000Res 2019 8 135 10.12688/f1000research.16903.1 Unno J Itaya A Taoka M FANCD2 binds CtIP and regulates DNA-end resection during DNA inter-strand crosslink repair Cell Rep 2014 7 4 1039 1047 10.1016/j.celrep.2014.04.005 24794430 Wachi S Yoneda K Wu RE Interactome-transcriptome analysis reveals the high centrality of genes differentially expressed in lung cancer tissues Bioinformatics 2005 21 23 4205 4208 10.1093/bioinformatics/bti688 16188928 Wan CH Borgeson B Phanse S Panorama of ancient metazoan macromolecular complexes Nature 2015 525 7569 339 344 10.1038/nature14877 26344197 Wan L Lou JM Xia YS hPrimpol1/CCDC111 is a human DNA primase-polymerase required for the maintenance of genome integrity EMBO Rep 2013 14 12 1104 1112 10.1038/embor.2013.159 24126761 Wang B Matsuoka S Ballif BA Abraxas and RAP80 form a BRCA1 protein complex required for the DNA damage response Science 2007 316 5828 1194 1198 10.1126/science.1139476 17525340 Wang JD Aroumougame A Lobrich M PTIP associates with Artemis to dictate DNA repair pathway choice Genes Dev 2014 28 24 2693 2698 10.1101/gad.252478.114 25512557 Wang Y Cortez D Yazdi P BASC, a super complex of BRCA1-associated proteins involved in the recognition and repair of aberrant DNA structures Genes Dev 2000 14 8 927 939 10.1101/gad.14.8.927 10783165 Wong AKC Ormonde PA Pero R Characterization of a carboxy-terminal BRCA1 interacting protein Oncogene 1998 17 18 2279 2285 10.1038/sj.onc.1202150 9811458 Wu LC Wang ZW Tsan JT Identification of a ring protein that can interact in vivo with the BRCA1 gene product Nat Genet 1996 14 4 430 440 10.1038/ng1296-430 8944023 Wu WW Rokutanda N Takeuchi J HERC2 facilitates BLM and WRN helicase complex interaction with RPA to suppress G-quadruplex DNA Cancer Res 2018 78 22 6371 6385 10.1158/0008-5472.CAN-18-1877 30279242 Wu X Petrini JH Heine WF Independence of R/M/N focus formation and the presence of intact BRCA1 Science 2000 289 5476 11 10.1126/science.289.5476.11 10928918 Wu X Chavez JD Schweppe DK In vivo protein interaction network analysis reveals porin-localized antibiotic inactivation in Acinetobacter baumannii strain AB5075 Nat Commun 2016 7 13414 10.1038/ncomms13414 27834373 Xia B Sheng Q Nakanishi K Control of BRCA2 cellular and clinical functions by a nuclear partner, PALB2 Mol Cell 2006 22 6 719 729 10.1016/j.molcel.2006.05.022 16793542 Xing MT Yang MR Huo W Interactome analysis identifies a new paralogue of XRCC4 in non-homologous end joining DNA repair pathway Nat Commun 2015 6 6233 10.1038/ncomms7233 25670504 Xue MM Hou JJ Wang LL Optimizing the fragment complementation of APEX2 for detection of specific protein-protein interactions in live cells Sci Rep 2017 7 12039 10.1038/s41598-017-12365-9 28955036 Yan ZJ Delannoy M Ling C A histone-fold complex and FANCM form a conserved DNA-remodeling complex to maintain genome stability Mol Cell 2010 37 6 865 878 10.1016/j.molcel.2010.01.039 20347428 Yan ZJ Guo R Paramasivam M A ubiquitin-binding protein, FAAP20, links RNF8-mediated ubiquitination to the Fanconi anemia DNA repair network Mol Cell 2012 47 1 61 75 10.1016/j.molcel.2012.05.026 22705371 Yi CQ He C DNA repair by reversal of DNA damage Cold Spring Harb Perspect Biol 2013 5 a012575 10.1101/cshperspect.a012575 23284047 Youn JY Dunham WH Hong SJ High-density proximity mapping reveals the subcellular organization of mRNA-associated granules and bodies Mol Cell 2018 69 3 517 532.e11 10.1016/j.molcel.2017.12.020 29395067 Yu X Wu LC Bowcock AM The C-terminal (BRCT) domains of brca1 interact in vivo with CtIP, a protein implicated in the CtBP pathway of transcriptional repression J Biol Chem 1998 273 39 25388 25392 10.1074/jbc.273.39.25388 9738006 Zhang AL Peng B Huang P The p53-binding protein 1-Tudor-interacting repair regulator complex participates in the DNA damage response J Biol Chem 2017 292 16 6461 6467 10.1074/jbc.M117.777474 28213517 Zhang D Zaugg K Mak TW A role for the deubiquitinating enzyme USP28 in control of the DNA-damage response Cell 2006 126 3 529 542 10.1016/j.cell.2006.06.039 16901786 Zhang F Ma JL Wu JX PALB2 links BRCA1 and BRCA2 in the DNA-damage response Curr Biol 2009 19 6 524 529 10.1016/j.cub.2009.02.018 19268590 Zhang HM Chen Z Ye Y SLX4IP acts with SLX4 and XPF-ERCC1 to promote interstrand crosslink repair Nucleic Acids Res 2019 47 19 10181 10201 10.1093/nar/gkz769 31495888 Zhong Q Chen CF Li S Association of BRCA1 with the hRad50-hMre11-p95 complex and the DNA damage response Science 1999 285 5428 747 750 10.1126/science.285.5428.747 10426999",
    "full_text_abstract": "Proteins are major functional units that are tightly connected to form complex and dynamic networks. These networks enable cells and organisms to operate properly and respond efficiently to environmental cues. Over the past decades, many biochemical methods have been developed to search for protein-binding partners in order to understand how protein networks are constructed and connected. At the same time, rapid development in proteomics and mass spectrometry (MS) techniques makes it possible to identify interacting proteins and build comprehensive protein-protein interaction networks. The resulting interactomes and networks have proven informative in the investigation of biological functions, such as in the field of DNA damage repair. In recent years, a number of proteins involved in DNA damage response and DNA repair pathways have been uncovered with MS-based protein-protein interaction studies. As the technologies for enriching associated proteins and MS become more sophisticated, the studies of protein-protein interactions are entering a new era. In this review, we summarize the strategies and recent developments for exploring protein-protein interaction. In addition, we discuss the application of these tools in the investigation of protein-protein interaction networks involved in DNA damage response and DNA repair."
}