{
    "PMC": "8233606",
    "DOI": "10.1007/s12268-021-1587-3",
    "PMID": "34219983",
    "PMCID": "PMC8233606",
    "title": "Atlas der SARS-CoV-2-RNA-Protein-Interaktionen in infizierten Zellen.",
    "year": 2021,
    "source_url": "https://europepmc.org/article/PMC/PMC8233606",
    "source": "MED",
    "abstract_text": "Using RNA antisense purification and mass spectrometry, we identified more than 100 human proteins that directly and specifically bind SARS-CoV-2 RNA in infected cells. To gain insights into the functions of selected RNA interactors, we applied genetic perturbation and pharmacological inhibition experiments, and mapped the contact sites on the viral RNA. This led to the identification of host dependency factors and defense strategies, which can guide the design of novel therapeutics against SARS-CoV-2.",
    "full_text": "pmc Biospektrum (Heidelb) Biospektrum (Heidelb) Biospektrum 0947-0867 1868-6249 Springer Berlin Heidelberg Berlin/Heidelberg 8233606 34219983 1587 10.1007/s12268-021-1587-3 Wissenschaft Atlas der SARS-CoV-2-RNA-Protein-Interaktionen in infizierten Zellen Schmidt Nora 1 Munschauer Mathias mathias.munschauer@helmholtz-hiri.de http://www.helmholtz-hiri.de 1 2 1 grid.7490.a 0000 0001 2238 295X Helmholtz-Institut f\u00fcr RNA-basierte Infektionsforschung (HIRI), Helmholtz-Zentrum f\u00fcr Infektionsforschung (HZI), Josef-Schneider-Stra\u00dfe 2/D15, D-97080 W\u00fcrzburg, Deutschland 2 grid.8379.5 0000 0001 1958 8658 Medizinische Fakult\u00e4t der Julius-Maximilians-Universit\u00e4t W\u00fcrzburg, Josef-Schneider-Stra\u00dfe 2/D15, D-97080 W\u00fcrzburg, Deutschland 26 6 2021 26 6 2021 2021 27 4 376 379 \u00a9 Die Autoren 2021 https://creativecommons.org/licenses/by/4.0/ Open Access: Dieser Artikel wird unter der Creative Commons Namensnennung 4.0 International Lizenz ver\u00f6ffentlicht, welche die Nutzung, Vervielf\u00e4ltigung, Bearbeitung, Verbreitung und Wiedergabe in jeglichem Medium und Format erlaubt, sofern Sie den/die urspr\u00fcnglichen Autor(en) und die Quelle ordnungsgem\u00e4\u00df nennen, einen Link zur Creative Commons Lizenz beif\u00fcgen und angeben, ob \u00c4nderungen vorgenommen wurden. Die in diesem Artikel enthaltenen Bilder und sonstiges Drittmaterial unterliegen ebenfalls der genannten Creative Commons Lizenz, sofern sich aus der Abbildungslegende nichts anderes ergibt. Sofern das betreffende Material nicht unter der genannten Creative Commons Lizenz steht und die betreffende Handlung nicht nach gesetzlichen Vorschriften erlaubt ist, ist f\u00fcr die oben aufgef\u00fchrten Weiterverwendungen des Materials die Einwilligung des jeweiligen Rechteinhabers einzuholen. Weitere Details zur Lizenz entnehmen Sie bitte der Lizenzinformation auf http://creativecommons.org/licenses/by/4.0/deed.de . Using RNA antisense purification and mass spectrometry, we identified more than 100 human proteins that directly and specifically bind SARS-CoV-2 RNA in infected cells. To gain insights into the functions of selected RNA interactors, we applied genetic perturbation and pharmacological inhibition experiments, and mapped the contact sites on the viral RNA. This led to the identification of host dependency factors and defense strategies, which can guide the design of novel therapeutics against SARS-CoV-2. issue-copyright-statement \u00a9 Springer-Verlag GmbH Deutschland, ein Teil von Springer Nature 2021 Mathias Munschauer 2006\u20132010 Studium Biotechnologie, Hochschule Mannheim. 2010\u20132014 Promotion im Fach Biochemie, FU Berlin. 2014\u20132019 Postdoktorand am Broad Institute of MIT und Harvard. Seit 2019 Helmholtz-Nachwuchsgruppenleiter am Helmholtz-Institut f\u00fcr RNA-basierte Infektionsforschung. Seit 2021 Juniorprofessor an der Medizinischen Fakult\u00e4t der Universit\u00e4t W\u00fcrzburg. Nora Schmidt 2009\u20132015 Studium der Technischen Biologie, Universit\u00e4t Stuttgart mit Masterarbeit am Imperial College London, UK, Labor von Prof. Dr. P. O\u2019Hare. 2015\u20132019 Promotion im Bereich Virologie an der Universit\u00e4t Z\u00fcrich, Schweiz, Arbeitsgruppe von Prof. Dr. B. Hale. Seit 2020 Postdoktorat in der Arbeitsgruppe von Jun. Prof. Dr. M. Munschauer am Helmholtz-Institut f\u00fcr RNA-basierte Infektionsforschung in W\u00fcrzburg. Funding note: Open Access funding enabled and organized by Projekt DEAL. Literatur [1] Garcia-Moreno M Jarvelin AI Castello A Unconventional RNA-binding proteins step into the virus-host battlefront Wiley Interdiscip Rev RNA 2018 9 e1498 10.1002/wrna.1498 30091184 [2] McHugh CA Chen CK Chow A The Xist lncRNA interacts directly with SHARP to silence transcription through HDAC3 Nature 2015 521 232 236 10.1038/nature14443 25915022 [3] Munschauer M Nguyen CT Sirokman K The NORAD lncRNA assembles a topoisomerase complex critical for genome stability Nature 2018 561 132 136 10.1038/s41586-018-0453-z 30150775 [4] Schmidt N Lareau CA Keshishian H The SARS-CoV-2 RNA-protein interactome in infected human cells Nat Microbiol 2021 6 339 353 10.1038/s41564-020-00846-z 33349665 [5] Van Nostrand EL Pratt GA Shishkin AA Robust transcriptome-wide discovery of RNA-binding protein binding sites with enhanced CLIP (eCLIP) Nat Methods 2016 13 508 514 10.1038/nmeth.3810 27018577 [6] Wei J Alfajaro MM DeWeirdt PC Genome-wide CRISPR screens reveal host factors critical for SARS-CoV-2 infection Cell 2021 184 76 91 10.1016/j.cell.2020.10.028 33147444 [7] Chen Y Sharma S Assis PA CNBP controls IL-12 gene transcription and Th1 immunity J Exp Med 2018 215 3136 3150 10.1084/jem.20181031 30442645 [8] Benhalevy D Gupta SK Danan CH The human CCHC-type zinc finger nucleic acid-binding protein binds G-rich elements in target mRNA coding sequences and promotes translation Cell Rep 2017 18 2979 2990 10.1016/j.celrep.2017.02.080 28329689 [9] Philippe L van den Elzen AMG Watson MJ Global analysis of LARP1 translation targets reveals tunable and dynamic features of 5\u2032 TOP motifs Proc Nat Acad Sci USA 2020 117 5319 5328 10.1073/pnas.1912864117 32094190 [10] Fonseca BD Zakaria C Jia JJ La-related protein 1 (LARP1) represses terminal oligopyrimidine (TOP) mRNA translation downstream of mTOR complex 1 (mTORC1) J Biol Chem 2015 290 15996 16020 10.1074/jbc.M114.621730 25940091 [11] Kim D Lee JY Yang JS The architecture of SARS-CoV-2 transcriptome Cell 2020 181 914 921 10.1016/j.cell.2020.04.011 32330414",
    "full_text_abstract": "Using RNA antisense purification and mass spectrometry, we identified more than 100 human proteins that directly and specifically bind SARS-CoV-2 RNA in infected cells. To gain insights into the functions of selected RNA interactors, we applied genetic perturbation and pharmacological inhibition experiments, and mapped the contact sites on the viral RNA. This led to the identification of host dependency factors and defense strategies, which can guide the design of novel therapeutics against SARS-CoV-2."
}