{
    "PMC": "9446657",
    "DOI": "10.1007/s11427-022-2161-3",
    "PMID": "36066811",
    "PMCID": "PMC9446657",
    "title": "The landscape of aging.",
    "year": 2022,
    "source_url": "https://europepmc.org/article/PMC/PMC9446657",
    "source": "MED",
    "abstract_text": "Aging is characterized by a progressive deterioration of physiological integrity, leading to impaired functional ability and ultimately increased susceptibility to death. It is a major risk factor for chronic human diseases, including cardiovascular disease, diabetes, neurological degeneration, and cancer. Therefore, the growing emphasis on \"healthy aging\" raises a series of important questions in life and social sciences. In recent years, there has been unprecedented progress in aging research, particularly the discovery that the rate of aging is at least partly controlled by evolutionarily conserved genetic pathways and biological processes. In an attempt to bring full-fledged understanding to both the aging process and age-associated diseases, we review the descriptive, conceptual, and interventive aspects of the landscape of aging composed of a number of layers at the cellular, tissue, organ, organ system, and organismal levels.",
    "full_text": "pmc Sci China Life Sci Sci China Life Sci Science China. Life Sciences 1674-7305 1869-1889 Science China Press Beijing 9446657 36066811 2161 10.1007/s11427-022-2161-3 Review The landscape of aging Cai Yusheng 1 2 3 Song Wei 4 Li Jiaming 5 6 Jing Ying 6 7 Liang Chuqian 1 2 3 Zhang Liyuan 5 Zhang Xia 8 Zhang Wenhui 6 9 Liu Beibei 5 An Yongpan 10 Li Jingyi 1 2 3 Tang Baixue 11 Pei Siyu 8 Wu Xueying 12 Liu Yuxuan 13 Zhuang Cheng-Le 14 Ying Yilin 15 16 Dou Xuefeng 8 Chen Yu 17 Xiao Fu-Hui 18 19 Li Dingfeng 20 Yang Ruici 21 Zhao Ya 22 Wang Yang 23 Wang Lihui 24 Li Yujing 1 2 3 Ma Shuai mashuai@ioz.ac.cn 1 2 3 Wang Si wangsi@xwh.ccmu.edu.cn 25 26 27 Song Xiaoyuan songxy5@ustc.edu.cn 28 Ren Jie renjie@big.ac.cn 2 5 6 Zhang Liang zhangliang01@sibs.ac.cn 2 8 Wang Jun junwang@im.ac.cn 6 9 Zhang Weiqi zhangwq@big.ac.cn 2 5 6 26 Xie Zhengwei xiezhengwei@hsc.pku.edu.cn 10 Qu Jing qujing@ioz.ac.cn 2 3 7 Wang Jianwei jianweiwang@mail.tsinghua.edu.cn 11 Xiao Yichuan ycxiao@sibs.ac.cn 8 Tian Ye ytian@genetics.ac.cn 6 12 Wang Gelin gelinwang@tsinghua.edu.cn 13 Hu Ping hup@sibcb.ac.cn 2 14 29 Ye Jing yj11254@rjh.com.cn 15 16 Sun Yu sunyu@sibs.ac.cn 8 30 Mao Zhiyong zhiyong_mao@tongji.edu.cn 17 Kong Qing-Peng kongqp@mail.kiz.ac.cn 18 19 Liu Qiang liuq2012@ustc.edu.cn 19 20 Zou Weiguo zouwg94@sibcb.ac.cn 21 Tian Xiao-Li tianxiaoli@ncu.edu.cn 22 Xiao Zhi-Xiong jimzx@scu.edu.cn 23 Liu Yong liuyong31279@whu.edu.cn 4 Liu Jun-Ping jun-ping.liu@monash.edu 24 31 32 Song Moshi songmoshi@ioz.ac.cn 1 2 3 6 Han Jing-Dong J. jackie.han@pku.edu.cn 33 Liu Guang-Hui ghliu@ioz.ac.cn 1 2 3 6 25 26 1 grid.9227.e 0000000119573309 State Key Laboratory of Membrane Biology, Institute of Zoology, Chinese Academy of Sciences, Beijing, 100101 China 2 grid.9227.e 0000000119573309 Institute for Stem Cell and Regeneration, Chinese Academy of Sciences, Beijing, 100101 China 3 grid.512959.3 Beijing Institute for Stem Cell and Regenerative Medicine, Beijing, 100101 China 4 grid.49470.3e 0000 0001 2331 6153 Frontier Science Center for Immunology and Metabolism, Medical Research Institute, College of Life Sciences, Wuhan University, Wuhan, 430071 China 5 grid.9227.e 0000000119573309 CAS Key Laboratory of Genomic and Precision Medicine, Beijing Institute of Genomics, Chinese Academy of Sciences and China National Center for Bioinformation, Beijing, 100101 China 6 grid.410726.6 0000 0004 1797 8419 University of Chinese Academy of Sciences, Beijing, 100049 China 7 grid.9227.e 0000000119573309 State Key Laboratory of Stem Cell and Reproductive Biology, Institute of Zoology, Chinese Academy of Sciences, Beijing, 100101 China 8 grid.9227.e 0000000119573309 CAS Key Laboratory of Tissue Microenvironment and Tumor, Shanghai Institute of Nutrition and Health, Chinese Academy of Sciences, Shanghai, 200031 China 9 grid.9227.e 0000000119573309 CAS Key Laboratory of Pathogenic Microbiology and Immunology, Institute of Microbiology, Chinese Academy of Sciences, Beijing, 100101 China 10 grid.11135.37 0000 0001 2256 9319 Peking University International Cancer Institute, Peking University Health Science Center, Peking University, Beijing, 100191 China 11 grid.12527.33 0000 0001 0662 3178 School of Pharmaceutical Sciences, Tsinghua University, Beijing, 100084 China 12 grid.9227.e 0000000119573309 State Key Laboratory of Molecular Developmental Biology, Institute of Genetics and Developmental Biology, Chinese Academy of Sciences, Beijing, 100101 China 13 grid.12527.33 0000 0001 0662 3178 School of Pharmaceutical Sciences, Beijing Advanced Innovation Center for Structural Biology, Ministry of Education Key Laboratory of Bioorganic Phosphorus Chemistry and Chemical Biology, Tsinghua University, Beijing, 100084 China 14 grid.412538.9 0000 0004 0527 0050 Colorectal Cancer Center/Department of Gastrointestinal Surgery, Shanghai Tenth People\u2019s Hospital Affiliated to Tongji University, Shanghai, 200072 China 15 grid.16821.3c 0000 0004 0368 8293 Department of Geriatrics, Medical Center on Aging of Shanghai Ruijin Hospital, Shanghai Jiaotong University School of Medicine, Shanghai, 200025 China 16 grid.16821.3c 0000 0004 0368 8293 International Laboratory in Hematology and Cancer, Shanghai Jiaotong University School of Medicine/Ruijin Hospital, Shanghai, 200025 China 17 grid.24516.34 0000000123704535 Shanghai Key Laboratory of Maternal Fetal Medicine, Clinical and Translational Research Center of Shanghai First Maternity and Infant Hospital, Frontier Science Center for Stem Cell Research, School of Life Sciences and Technology, Tongji University, Shanghai, 200092 China 18 grid.9227.e 0000000119573309 State Key Laboratory of Genetic Resources and Evolution/Key Laboratory of Healthy Aging Research of Yunnan Province, Kunming Institute of Zoology, Chinese Academy of Sciences, Kunming, 650223 China 19 grid.9227.e 0000000119573309 CAS Center for Excellence in Animal Evolution and Genetics, Chinese Academy of Sciences, Kunming, 650223 China 20 grid.59053.3a 0000000121679639 Institute on Aging and Brain Disorders, The First Affiliated Hospital of USTC, Division of Life Sciences and Medicine, University of Science and Technology of China, Hefei, 230027 China 21 grid.410726.6 0000 0004 1797 8419 State Key Laboratory of Cell Biology, Shanghai Institute of Biochemistry and Cell Biology, CAS Center for Excellence in Molecular Cell Science, Chinese Academy of Sciences, University of Chinese Academy of Sciences, Shanghai, 200031 China 22 grid.260463.5 0000 0001 2182 8825 Aging and Vascular Diseases, Human Aging Research Institute (HARI) and School of Life Science, Nanchang University, and Jiangxi Key Laboratory of Human Aging, Nanchang, 330031 China 23 grid.13291.38 0000 0001 0807 1581 Center of Growth, Metabolism and Aging, Key Laboratory of Bio-Resource and Eco-Environment, Ministry of Education, College of Life Sciences, Sichuan University, Chengdu, 610065 China 24 grid.410595.c 0000 0001 2230 9154 Institute of Ageing Research, Hangzhou Normal University, School of Basic Medical Sciences, Hangzhou, 311121 China 25 grid.413259.8 0000 0004 0632 3337 Advanced Innovation Center for Human Brain Protection, National Clinical Research Center for Geriatric Disorders, Xuanwu Hospital Capital Medical University, Beijing, 100053 China 26 grid.413259.8 0000 0004 0632 3337 Aging Translational Medicine Center, International Center for Aging and Cancer, Beijing Municipal Geriatric Medical Research Center, Xuanwu Hospital Capital Medical University, Beijing, 100053 China 27 The Fifth People\u2019s Hospital of Chongqing, Chongqing, 400062 China 28 grid.59053.3a 0000000121679639 MOE Key Laboratory of Cellular Dynamics, Hefei National Research Center for Physical Sciences at the Microscale, CAS Key Laboratory of Brain Function and Disease, Neurodegenerative Disorder Research Center, School of Life Sciences, Division of Life Sciences and Medicine, University of Science and Technology of China, Hefei, 230026 China 29 Guangzhou Laboratory, Guangzhou International Bio Island, Guangzhou, 510005 China 30 grid.34477.33 0000000122986657 Department of Medicine and VAPSHCS, University of Washington, Seattle, 98195 USA 31 grid.1002.3 0000 0004 1936 7857 Department of Immunology and Pathology, Monash University Faculty of Medicine, Prahran, Victoria 3181 Australia 32 grid.452824.d Hudson Institute of Medical Research, and Monash University Department of Molecular and Translational Science, Clayton, Victoria, 3168 Australia 33 grid.11135.37 0000 0001 2256 9319 Peking-Tsinghua Center for Life Sciences, Academy for Advanced Interdisciplinary Studies, Center for Quantitative Biology, Peking University, Beijing, 100871 China 2 9 2022 2022 65 12 2354 2454 6 4 2022 5 7 2022 \u00a9 Science China Press and Springer-Verlag GmbH Germany, part of Springer Nature 2022 This article is made available via the PMC Open Access Subset for unrestricted research re-use and secondary analysis in any form or by any means with acknowledgement of the original source. These permissions are granted for the duration of the World Health Organization (WHO) declaration of COVID-19 as a global pandemic. Aging is characterized by a progressive deterioration of physiological integrity, leading to impaired functional ability and ultimately increased susceptibility to death. It is a major risk factor for chronic human diseases, including cardiovascular disease, diabetes, neurological degeneration, and cancer. Therefore, the growing emphasis on \u201chealthy aging\u201d raises a series of important questions in life and social sciences. In recent years, there has been unprecedented progress in aging research, particularly the discovery that the rate of aging is at least partly controlled by evolutionarily conserved genetic pathways and biological processes. In an attempt to bring full-fledged understanding to both the aging process and age-associated diseases, we review the descriptive, conceptual, and interventive aspects of the landscape of aging composed of a number of layers at the cellular, tissue, organ, organ system, and organismal levels. aging mechanism intervention issue-copyright-statement \u00a9 Science China Press and Springer-Verlag GmbH Germany, part of Springer Nature 2022 Compliance and ethics The author(s) declare that they have no conflict of interest. Contributed equally to this work Acknowledgements This work was supported by the National Natural Science Foundation of China (31871380, 32000500, 32070730, 32170756, 32170804, 81330008, 81671377, 81725010, 81725010, 81872874, 81921006, 81922027, 81971312, 81991512, 82030041, 82103167, 82122024, 82125009, 82125011, 82130044, 91749126, 91949101, 91949207, 92049302), the National Key Research and Development Program of China (2017YFA0506400, 2018YFA0800200, 2018YFA0800700, 2018YFA0900200, 2018YFC2000100, 2018YFC2000400, 2018YFE-0203700, 20192ACB70002, 2019YFA0802202, 2020YFA0113400, 2020YFA0803401, 2020YFA0804000, 2020YFC2002800, 2020YFC-2002900, 2021ZD0202401), the Strategic Priority Research Program of the Chinese Academy of Sciences (XDA16010100, XDA16010603, XDA16020400, XDB29020000, XDB39000000, XDB39000000, XDB39030300), the China Association for Science and Technology (2021QNRC001), the Beijing Municipal Science and Technology Commission (Z200022), the Natural Science Foundation of Shanghai (21JC1406400), the Key Programs of the Jiangxi Province, China (20192ACB70002), the \u201cShu Guang\u201d Project supported by the Shanghai Municipal Education Commission and Shanghai Education Development Foundation (19SG18), the Shanghai Sailing Program (22YF1434300), the Research Project of Joint Laboratory of University of Science and Technology of China and Anhui Mental Health Center (2019LH03), the Fundamental Research Funds for the Central Universities (WK2070210004), the Young Elite Scientists Sponsorship Program by China Association for Science and Technology (YESS20210002), and the Youth Innovation Promotion Association of Chinese Academy of Sciences (2022083). We apologize for omission of relevant works due to space constraints. We thank all the members of the Chinese Society for Aging Cell Research, Chinese Society for Cell Biology for their helpful suggestions on the manuscript. We thank Qiaoran Wang for drawing the Figure 1. We are also grateful to Shanshan Che and Jinghao Hu for their assistant in reviewing the manuscript. References Acosta JC Banito A Wuestefeld T Georgilis A Janich P Morton J P Athineos D Kang TW Lasitschka F Andrulis M A complex secretory program orchestrated by the inflammasome controls paracrine senescence Nat Cell Biol 2013 15 978 990 10.1038/ncb2784 23770676 Acosta JC O\u2019Loghlen A Banito A Guijarro MV Augert A Raguz S Fumagalli M Da Costa M Brown C Popov N Chemokine signaling via the CXCR2 receptor reinforces senescence Cell 2008 133 1006 1018 10.1016/j.cell.2008.03.038 18555777 Adams MM Donohue HS Linville MC Iversen EA Newton IG Brunso-Bechtold JK Age-related synapse loss in hippocampal CA3 is not reversed by caloric restriction Neuroscience 2010 171 373 382 10.1016/j.neuroscience.2010.09.022 20854882 Aghajanian H Kimura T Rurik JG Hancock AS Leibowitz MS Li L Scholler J Monslow J Lo A Han W Targeting cardiac fibrosis with engineered T cells Nature 2019 573 430 433 10.1038/s41586-019-1546-z 31511695 Liu GH Bao Y Qu J Zhang W Zhang T Kang W Yang F Ji Q Jiang X Ma Y Aging Atlas: a multi-omics database for aging biology Nucl Acids Res 2021 49 D825 D830 10.1093/nar/gkaa894 33119753 Agrawal A Gupta S Impact of aging on dendritic cell functions in humans Ageing Res Rev 2011 10 336 345 10.1016/j.arr.2010.06.004 20619360 Aguado J d\u2019Adda di Fagagna F Wolvetang E Telomere transcription in ageing Ageing Res Rev 2020 62 101115 10.1016/j.arr.2020.101115 32565330 Ahadi S Zhou W Sch\u00fcssler-Fiorenza Rose SM Sailani MR Contrepois K Avina M Ashland M Brunet A Snyder M Personal aging markers and ageotypes revealed by deep longitudinal profiling Nat Med 2020 26 83 90 10.1038/s41591-019-0719-5 31932806 Ahmed TA Ahmed SM El-Gammal Z Shouman S Ahmed A Mansour R El-Badri N Oocyte aging: the role of cellular and environmental factors and impact on female fertility Adv Exp Med Biol 2020 1247 109 123 10.1007/5584_2019_456 31802446 Ailshire JA Beltr\u00e1n-S\u00e1nchez H Crimmins EM Becoming centenarians: disease and functioning trajectories of older U.S. adults as they survive to 100 Js Gerontology Ser A-Biol Sci Med Sci 2015 70 193 201 Aird KM Iwasaki O Kossenkov AV Tanizawa H Fatkhutdinov N Bitler BG Le L Alicea G Yang TL Johnson FB HMGB2 orchestrates the chromatin landscape of senescence-associated secretory phenotype gene loci J Cell Biol 2016 215 325 334 10.1083/jcb.201608026 27799366 Akbari S Amiri FT Naderi M Shaki F Seyedabadi M Sodium arsenite accelerates D-galactose-induced aging in the testis of the rat: evidence for mitochondrial oxidative damage, NF-\u03baB, JNK, and apoptosis pathways Toxicology 2022 470 153148 10.1016/j.tox.2022.153148 35259467 Albert V Hall MN mTOR signaling in cellular and organismal energetics Curr Opin Cell Biol 2015 33 55 66 10.1016/j.ceb.2014.12.001 25554914 Albright JM Dunn RC Shults JA Boe DM Afshar M Kovacs EJ Advanced age alters monocyte and macrophage responses Antioxid Redox Signal 2016 25 805 815 10.1089/ars.2016.6691 27357201 Alder JK Barkauskas CE Limjunyawong N Stanley SE Kembou F Tuder RM Hogan BLM Mitzner W Armanios M Telomere dysfunction causes alveolar stem cell failure Proc Natl Acad Sci USA 2015 112 5099 5104 10.1073/pnas.1504780112 25840590 Alder JK Guo N Kembou F Parry EM Anderson CJ Gorgy AI Walsh MF Sussan T Biswal S Mitzner W Telomere length is a determinant of emphysema susceptibility Am J Respir Crit Care Med 2011 184 904 912 10.1164/rccm.201103-0520OC 21757622 Alehagen U Aaseth J Alexander J Johansson P Larsson A Supplemental selenium and coenzyme Q10 reduce glycation along with cardiovascular mortality in an elderly population with low selenium status\u2014a four-year, prospective, randomised, double-blind placebo-controlled trial J Trace Elem Med Biol 2020 61 126541 10.1016/j.jtemb.2020.126541 32417634 Alexander JL Wilson ID Teare J Marchesi JR Nicholson JK Kinross JM Gut microbiota modulation of chemotherapy efficacy and toxicity Nat Rev Gastroenterol Hepatol 2017 14 356 365 10.1038/nrgastro.2017.20 28270698 Allen NJ Barres BA Glia\u2014more than just brain glue Nature 2009 457 675 677 10.1038/457675a 19194443 Almanzar N Antony J Baghel AS Bakerman I Bansal I Barres B A Beachy PA Berdnik D Bilen B Brownfield D A single-cell transcriptomic atlas characterizes ageing tissues in the mouse Nature 2020 583 590 595 10.1038/s41586-020-2496-1 32669714 Alon S Goodwin DR Sinha A Wassie AT Chen F Daugharthy E R Bando Y Kajita A Xue AG Marrett K Expansion sequencing: spatially precise in situ transcriptomics in intact biological systems Science 2021 371 481 10.1126/science.aax2656 Aman Y Schmauck-Medina T Hansen M Morimoto RI Simon A K Bjedov I Palikaras K Simonsen A Johansen T Tavernarakis N Autophagy in healthy aging and disease Nat Aging 2021 1 634 650 10.1038/s43587-021-00098-4 34901876 Ambrosi TH Goodnough LH Steininger HM Hoover MY Kim E Koepke LS Marecic O Zhao L Seita J Bishop JA Geriatric fragility fractures are associated with a human skeletal stem cell defect Aging Cell 2020 19 e13164 10.1111/acel.13164 32537886 Ambrosi TH Longaker MT Chan CKF A revised perspective of skeletal stem cell biology Front Cell Dev Biol 2019 7 189 10.3389/fcell.2019.00189 31572721 Ambrosi TH Marecic O McArdle A Sinha R Gulati GS Tong X Wang Y Steininger HM Hoover MY Koepke LS Aged skeletal stem cells generate an inflammatory degenerative niche Nature 2021 597 256 262 10.1038/s41586-021-03795-7 34381212 Ambrosi TH Scialdone A Graja A Gohlke S Jank AM Bocian C Woelk L Fan H Logan DW Sch\u00fcrmann A Adipocyte accumulation in the bone marrow during obesity and aging impairs stem cell-based hematopoietic and bone regeneration Cell Stem Cell 2017 20 771 784 10.1016/j.stem.2017.02.009 28330582 Amor C Feucht J Leibold J Ho YJ Zhu C Alonso-Curbelo D Mansilla-Soto J Boyer JA Li X Giavridis T Senolytic CAR T cells reverse senescence-associated pathologies Nature 2020 583 127 132 10.1038/s41586-020-2403-9 32555459 Andersen MJ Ersb\u00f8ll M Axelsson A Gustafsson F Hassager C K\u00f8ber L Borlaug BA Boesgaard S Skovgaard LT M\u00f8ller J E Sildenafil and diastolic dysfunction after acute myocardial infarction in patients with preserved ejection fraction Circulation 2013 127 1200 1208 10.1161/CIRCULATIONAHA.112.000056 23406672 Anderson EJ Neufer PD Type II skeletal myofibers possess unique properties that potentiate mitochondrial H 2 O 2 generation Am J Physiol-Cell Physiol 2006 290 C844 C851 10.1152/ajpcell.00402.2005 16251473 Angelidis I Simon LM Fernandez IE Strunz M Mayr CH Greiffo FR Tsitsiridis G Ansari M Graf E Strom TM An atlas of the aging lung mapped by single cell transcriptomics and deep tissue proteomics Nat Commun 2019 10 963 10.1038/s41467-019-08831-9 30814501 Angelier F Costantini D Bl\u00e9vin P Chastel O Do glucocorticoids mediate the link between environmental conditions and telomere dynamics in wild vertebrates? A review Gen Comp Endocrinol 2018 256 99 111 10.1016/j.ygcen.2017.07.007 28705731 Anker SD Morley JE von Haehling S Welcome to the ICD-10 code for sarcopenia J Cachexia Sarcopenia Muscle 2016 7 512 514 10.1002/jcsm.12147 27891296 Anselmi CV Malovini A Roncarati R Novelli V Villa F Condorelli G Bellazzi R Puca AA Association of the FOXO3A locus with extreme longevity in a Southern Italian centenarian study Rejuvenation Res 2009 12 95 104 10.1089/rej.2008.0827 19415983 Araujo AB Wittert GA Endocrinology of the aging male Best Pract Res Clin Endocrinol Metab 2011 25 303 319 10.1016/j.beem.2010.11.004 21397200 Argelaguet R Velten B Arnol D Dietrich S Zenz T Marioni JC Buettner F Huber W Stegle O Multi-Omics Factor Analysis\u2014a framework for unsupervised integration of multi-omics data sets Mol Syst Biol 2018 14 e8124 10.15252/msb.20178124 29925568 Armanios M Telomerase and idiopathic pulmonary fibrosis Mutat Res Fundamental Mol Mech Mutagenesis 2012 730 52 58 10.1016/j.mrfmmm.2011.10.013 Armanios MY Chen JJL Cogan JD Alder JK Ingersoll RG Markin C Lawson WE Xie M Vulto I Phillips Iii JA Telomerase mutations in families with idiopathic pulmonary fibrosis N Engl J Med 2007 356 1317 1326 10.1056/NEJMoa066157 17392301 Armulik A Genov\u00e9 G Betsholtz C Pericytes: developmental, physiological, and pathological perspectives, problems, and promises Dev Cell 2011 21 193 215 10.1016/j.devcel.2011.07.001 21839917 Asadi Shahmirzadi A Edgar D Liao CY Hsu YM Lucanic M Asadi Shahmirzadi A Wiley CD Gan G Kim DE Kasler HG Alpha-ketoglutarate, an endogenous metabolite, extends lifespan and compresses morbidity in aging mice Cell Metab 2020 32 447 456 10.1016/j.cmet.2020.08.004 32877690 Atchison L Abutaleb NO Snyder-Mounts E Gete Y Ladha A Ribar T Cao K Truskey GA iPSC-derived endothelial cells affect vascular function in a tissue-engineered blood vessel model of hutchinson-gilford progeria syndrome Stem Cell Rep 2020 14 325 337 10.1016/j.stemcr.2020.01.005 Ayyadevara S Bharill P Dandapat A Hu C Khaidakov M Mitra S Shmookler Reis RJ Mehta JL Aspirin inhibits oxidant stress, reduces age-associated functional declines, and extends lifespan of Caenorhabditis elegans Antioxid Redox Signal 2013 18 481 490 10.1089/ars.2011.4151 22866967 Baar MP Brandt RMC Putavet DA Klein JDD Derks KWJ Bourgeois BRM Stryeck S Rijksen Y van Willigenburg H Feijtel DA Targeted apoptosis of senescent cells restores tissue homeostasis in response to chemotoxicity and aging Cell 2017 169 132 147 10.1016/j.cell.2017.02.031 28340339 Baeyens N Fluid shear stress sensing in vascular homeostasis and remodeling: Towards the development of innovative pharmacological approaches to treat vascular dysfunction Biochem Pharmacol 2018 158 185 191 10.1016/j.bcp.2018.10.023 30365948 Bailey KL Bonasera SJ Wilderdyke M Hanisch BW Pavlik JA DeVasure J Robinson JE Sisson JH Wyatt TA Aging causes a slowing in ciliary beat frequency, mediated by PKC\u03b5 Am J Physiol-Lung Cell Mol Physiol 2014 306 L584 L589 10.1152/ajplung.00175.2013 24487393 Baillie JK Barnett MW Upton KR Gerhardt DJ Richmond TA De Sapio F Brennan PM Rizzu P Smith S Fell M Somatic retrotransposition alters the genetic landscape of the human brain Nature 2011 479 534 537 10.1038/nature10531 22037309 Baker DJ Wijshake T Tchkonia T LeBrasseur NK Childs BG van de Sluis B Kirkland JL van Deursen JM Clearance of p16Ink4a-positive senescent cells delays ageing-associated disorders Nature 2011 479 232 236 10.1038/nature10600 22048312 Ball, M., Hossain, M., and Padalia, D. (2022). Anatomy, Airway. In Stat-Pearls (Treasure Island (FL)). Balog P Negative emotions associated with cardiovascular diseases Orv Hetil 2018 159 2005 2010 10.1556/650.2018.31221 30501523 Bar-Ziv R Bolas T Dillin A Systemic effects of mitochondrial stress EMBO Rep 2020 21 e50094 10.15252/embr.202050094 32449292 B\u00e4r C Bernardes de Jesus B Serrano R Tejera A Ayuso E Jimenez V Formentini I Bobadilla M Mizrahi J de Martino A Telomerase expression confers cardioprotection in the adult mouse heart after acute myocardial infarction Nat Commun 2014 5 5863 10.1038/ncomms6863 25519492 Barbieri M Bonaf\u00e8 M Franceschi C Paolisso G Insulin/IGF-I-signaling pathway: an evolutionarily conserved mechanism of longevity from yeast to humans Am J Physiol-Endocrinol Metab 2003 285 E1064 E1071 10.1152/ajpendo.00296.2003 14534077 Barcena C Mayoral P Quiros PM Mitohormesis, an antiaging paradigm Int Rev Cell Mol Biol 2018 340 35 77 10.1016/bs.ircmb.2018.05.002 30072093 Barzilai N Atzmon G Schechter C Schaefer EJ Cupples AL Lipton R Cheng S Shuldiner AR Unique lipoprotein phenotype and genotype associated with exceptional longevity JAMA 2003 290 2030 2040 10.1001/jama.290.15.2030 14559957 Barzilai N Crandall JP Kritchevsky SB Espeland MA Metformin as a tool to target aging Cell Metab 2016 23 1060 1065 10.1016/j.cmet.2016.05.011 27304507 Basisty N Kale A Jeon OH Kuehnemann C Payne T Rao C Holtz A Shah S Sharma V Ferrucci L A proteomic atlas of senescence-associated secretomes for aging biomarker development PLoS Biol 2020 18 e3000599 10.1371/journal.pbio.3000599 31945054 Basisty N Kale A Patel S Campisi J Schilling B The power of proteomics to monitor senescence-associated secretory phenotypes and beyond: toward clinical applications Expert Rev Proteom 2020 17 297 308 10.1080/14789450.2020.1766976 Battson ML Lee DM Weir TL Gentile CL The gut microbiota as a novel regulator of cardiovascular function and disease J Nutral Biochem 2018 56 1 15 10.1016/j.jnutbio.2017.12.010 Baur JA Pearson KJ Price NL Jamieson HA Lerin C Kalra A Prabhu VV Allard JS Lopez-Lluch G Lewis K Resveratrol improves health and survival of mice on a high-calorie diet Nature 2006 444 337 342 10.1038/nature05354 17086191 Bautista Ni\u00f1o PK Durik M Danser AHJ de Vries R Musterd-Bhaggoe UM Meima ME Kavousi M Ghanbari M Hoeijmakers JH O\u2019Donnell CJ Phosphodiesterase 1 regulation is a key mechanism in vascular aging Clin Sci 2015 129 1061 1075 10.1042/CS20140753 Beattie MC Adekola L Papadopoulos V Chen H Zirkin BR Leydig cell aging and hypogonadism Exp Gerontol 2015 68 87 91 10.1016/j.exger.2015.02.014 25700847 Becker JR Gallo D Leung W Croissant T Thu YM Nguyen HD Starr TK Brown GW Bielinsky AK Flap endonuclease overexpression drives genome instability and DNA damage hypersensitivity in a PCNA-dependent manner Nucl Acids Res 2018 46 5634 5650 10.1093/nar/gky313 29741650 Beier F Foronda M Martinez P Blasco MA Conditional TRF1 knockout in the hematopoietic compartment leads to bone marrow failure and recapitulates clinical features of dyskeratosis congenita Blood 2012 120 2990 3000 10.1182/blood-2012-03-418038 22932806 Bell CG Lowe R Adams PD Baccarelli AA Beck S Bell JT Christensen BC Gladyshev VN Heijmans BT Horvath S DNA methylation aging clocks: challenges and recommendations Genome Biol 2019 20 249 10.1186/s13059-019-1824-y 31767039 Bellebaum C Daum I Cerebellar involvement in executive control Cerebellum 2007 6 184 192 10.1080/14734220601169707 17786814 Benarroch-Popivker D Pisano S Mendez-Bermudez A Lototska L Kaur P Bauwens S Djerbi N Latrick CM Fraisier V Pei B TRF2-mediated control of telomere dna topology as a mechanism for chromosome-end protection Mol Cell 2016 61 274 286 10.1016/j.molcel.2015.12.009 26774283 Bereczki E Branca RM Francis PT Pereira JB Baek JH Hortob\u00e1gyi T Winblad B Ballard C Lehti\u00f6 J Aarsland D Synaptic markers of cognitive decline in neurodegenerative diseases: a proteomic approach Brain 2018 141 582 595 10.1093/brain/awx352 29324989 Bereczki E Francis PT Howlett D Pereira JB H\u00f6glund K Bogstedt A Cedazo-Minguez A Baek JH Hortob\u00e1gyi T Attems J Synaptic proteins predict cognitive decline in Alzheimer\u2019s disease and Lewy body dementia Alzheimers Dement 2016 12 1149 1158 10.1016/j.jalz.2016.04.005 27224930 Bernet JD Doles JD Hall JK Kelly Tanaka K Carter TA Olwin BB p38 MAPK signaling underlies a cell-autonomous loss of stem cell self-renewal in skeletal muscle of aged mice Nat Med 2014 20 265 271 10.1038/nm.3465 24531379 Bi S Liu Z Wu Z Wang Z Liu X Wang S Ren J Yao Y Zhang W Song M SIRT7 antagonizes human stem cell aging as a heterochromatin stabilizer Protein Cell 2020 11 483 504 10.1007/s13238-020-00728-4 32504224 Biagi E Franceschi C Rampelli S Severgnini M Ostan R Turroni S Consolandi C Quercia S Scurti M Monti D Gut microbiota and extreme longevity Curr Biol 2016 26 1480 1485 10.1016/j.cub.2016.04.016 27185560 Bilaud T Brun C Ancelin K Koering CE Laroche T Gilson E Telomeric localization of TRF2, a novel human telobox protein Nat Genet 1997 17 236 239 10.1038/ng1097-236 9326951 Bilaud T Koering CE Binet-Brasselet E Ancelin K Pollice A Gasser SM Gilson E The telobox, a Myb-related telomeric DNA binding motif found in proteins from yeast, plants and human Nucl Acids Res 1996 24 1294 1303 10.1093/nar/24.7.1294 8614633 Biroccio A Cherfils-Vicini J Augereau A Pinte S Bauwens S Ye J Simonet T Horard B Jamet K Cervera L TRF2 inhibits a cell-extrinsic pathway through which natural killer cells eliminate cancer cells Nat Cell Biol 2013 15 818 828 10.1038/ncb2774 23792691 Bissell MJ Hines WC Why don\u2019t we get more cancer? A proposed role of the microenvironment in restraining cancer progression Nat Med 2011 17 320 329 10.1038/nm.2328 21383745 Bitto A Ito TK Pineda VV LeTexier NJ Huang HZ Sutlief E Tung H Vizzini N Chen B Smith K Transient rapamycin treatment can increase lifespan and healthspan in middle-aged mice eLife 2016 5 e16351 10.7554/eLife.16351 27549339 Bjornson CRR Cheung TH Liu L Tripathi PV Steeper KM Rando TA Notch signaling is necessary to maintain quiescence in adult muscle stem cells Stem Cells 2012 30 232 242 10.1002/stem.773 22045613 Blanc RS Kallenbach JG Bachman JF Mitchell A Paris ND Chakkalakal JV Inhibition of inflammatory CCR2 signaling promotes aged muscle regeneration and strength recovery after injury Nat Commun 2020 11 4167 10.1038/s41467-020-17620-8 32820177 Blanpain C Fuchs E Epidermal stem cells of the skin Annu Rev Cell Dev Biol 2006 22 339 373 10.1146/annurev.cellbio.22.010305.104357 16824012 Blau HM Cosgrove BD Ho ATV The central role of muscle stem cells in regenerative failure with aging Nat Med 2015 21 854 862 10.1038/nm.3918 26248268 Bodine SC Baehr LM Skeletal muscle atrophy and the E3 ubiquitin ligases MuRF1 and MAFbx/atrogin-1 Am J Physiol-Endocrinol Metab 2014 307 E469 E484 10.1152/ajpendo.00204.2014 25096180 Boehme M Guzzetta KE Bastiaanssen TFS van de Wouw M Moloney GM Gual-Grau A Spichak S Olavarr\u00eda-Ram\u00edrez L Fitzgerald P Morillas E Microbiota from young mice counteracts selective age-associated behavioral deficits Nat Aging 2021 1 666 676 10.1038/s43587-021-00093-9 Boengler K Kosiol M Mayr M Schulz R Rohrbach S Mitochondria and ageing: role in heart, skeletal muscle and adipose tissue J Cachexia Sarcopenia Muscle 2017 8 349 369 10.1002/jcsm.12178 28432755 Boisvert MM Erikson GA Shokhirev MN Allen NJ The aging astrocyte transcriptome from multiple regions of the mouse brain Cell Rep 2018 22 269 285 10.1016/j.celrep.2017.12.039 29298427 Bolotin DA Poslavsky S Davydov AN Frenkel FE Fanchi L Zolotareva OI Hemmers S Putintseva EV Obraztsova AS Shugay M Antigen receptor repertoire profiling from RNA-seq data Nat Biotechnol 2017 35 908 911 10.1038/nbt.3979 29020005 Bonithon-Kopp C Touboul PJ Berr C Leroux C Mainard F Courbon D Ducimetiere P Relation of intima-media thickness to atherosclerotic plaques in carotid arteries Arterioscler Thromb Vasc Biol 1996 16 310 316 10.1161/01.ATV.16.2.310 8620348 Bonkowski MS Sinclair DA Slowing ageing by design: the rise of NAD+ and sirtuin-activating compounds Nat Rev Mol Cell Biol 2016 17 679 690 10.1038/nrm.2016.93 27552971 Booth LN Brunet A The aging epigenome Mol Cell 2016 62 728 744 10.1016/j.molcel.2016.05.013 27259204 Bordon Y Growing old disgracefully? Nat Rev Immunol 2015 15 665 10.1038/nri3924 26471779 Bork S Pfister S Witt H Horn P Korn B Ho AD Wagner W DNA methylation pattern changes upon long-term culture and aging of human mesenchymal stromal cells Aging Cell 2010 9 54 63 10.1111/j.1474-9726.2009.00535.x 19895632 Bosco N Noti M The aging gut microbiome and its impact on host immunity Genes Immun 2021 22 289 303 10.1038/s41435-021-00126-8 33875817 Boskey AL Coleman R Aging and bone J Dent Res 2010 89 1333 1348 10.1177/0022034510377791 20924069 Bostr\u00f6m P Wu J Jedrychowski MP Korde A Ye L Lo JC Rasbach KA Bostr\u00f6m EA Choi JH Long JZ A PGC1-\u03b1-dependent myokine that drives brown-fat-like development of white fat and thermogenesis Nature 2012 481 463 468 10.1038/nature10777 22237023 Bourc\u2019his D Bestor TH Meiotic catastrophe and retrotransposon reactivation in male germ cells lacking Dnmt3L Nature 2004 431 96 99 10.1038/nature02886 15318244 Brack AS Conboy MJ Roy S Lee M Kuo CJ Keller C Rando TA Increased Wnt signaling during aging alters muscle stem cell fate and increases fibrosis Science 2007 317 807 810 10.1126/science.1144090 17690295 Braidy N Guillemin GJ Mansour H Chan-Ling T Poljak A Grant R Age related changes in NAD metabolism oxidative stress and Sirt1 activity in wistar rats PLoS ONE 2011 6 e19194 10.1371/journal.pone.0019194 21541336 Branca JJV Gulisano M Nicoletti C Intestinal epithelial barrier functions in ageing Ageing Res Rev 2019 54 100938 10.1016/j.arr.2019.100938 31369869 Brighton PJ Maruyama Y Fishwick K Vrljicak P Tewary S Fujihara R Muter J Lucas ES Yamada T Woods L Clearance of senescent decidual cells by uterine natural killer cells in cycling human endometrium eLife 2017 6 e31274 10.7554/eLife.31274 29227245 Broccoli D Smogorzewska A Chong L de Lange T Human telomeres contain two distinct Myb-related proteins, TRF1 and TRF2 Nat Genet 1997 17 231 235 10.1038/ng1097-231 9326950 Brooks-Wilson AR Genetics of healthy aging and longevity Hum Genet 2013 132 1323 1338 10.1007/s00439-013-1342-z 23925498 Browder KC Reddy P Yamamoto M Haghani A Guillen IG Sahu S Wang C Luque Y Prieto J Shi L In vivo partial reprogramming alters age-associated molecular changes during physiological aging in mice Nat Aging 2022 2 243 253 10.1038/s43587-022-00183-2 Brusasco V Barisione G Crimi E Pulmonary physiology: future directions for lung function testing in COPD Respirology 2015 20 209 218 10.1111/resp.12388 25257934 Bruss MD Khambatta CF Ruby MA Aggarwal I Hellerstein MK Calorie restriction increases fatty acid synthesis and whole body fat oxidation rates Am J Physiol-Endocrinol Metab 2010 298 E108 E116 10.1152/ajpendo.00524.2009 19887594 Bua E Johnson J Herbst A Delong B McKenzie D Salamat S Aiken JM Mitochondrial DNA-deletion mutations accumulate intracellularly to detrimental levels in aged human skeletal muscle fibers Am J Hum Genet 2006 79 469 480 10.1086/507132 16909385 Budoff MJ Takasu J Flores FR Niihara Y Lu B Lau BH Rosen RT Amagase H Inhibiting progression of coronary calcification using Aged Garlic Extract in patients receiving statin therapy: a preliminary study Prev Med 2004 39 985 991 10.1016/j.ypmed.2004.04.012 15475033 Burkewitz K Zhang Y Mair WB AMPK at the nexus of energetics and aging Cell Metab 2014 20 10 25 10.1016/j.cmet.2014.03.002 24726383 Bussian TJ Aziz A Meyer CF Swenson BL van Deursen JM Baker DJ Clearance of senescent glial cells prevents tau-dependent pathology and cognitive decline Nature 2018 562 578 582 10.1038/s41586-018-0543-y 30232451 Bustos FJ Ampuero E Jury N Aguilar R Falahi F Toledo J Ahumada J Lata J Cubillos P Henr\u00edquez B Epigenetic editing of the Dlg4/PSD95 gene improves cognition in aged and Alzheimer\u2019s disease mice Brain 2017 140 3252 3268 10.1093/brain/awx272 29155979 Cable DM Murray E Zou LS Goeva A Macosko EZ Chen F Irizarry RA Robust decomposition of cell type mixtures in spatial transcriptomics Nat Biotechnol 2022 40 517 526 10.1038/s41587-021-00830-w 33603203 Cabral-Miranda, F., Tamburini, G., Martinez, G., Henriquez, J.P., and Hetz, C. (2020). Control of mammalian brain aging by the unfolded protein response (UPR). bioRxiv, doi: 10.1101/2020.04.13.039172. Cai D Han JDJ Aging-associated lncRNAs are evolutionarily conserved and participate in NF\u03baB signaling Nat Aging 2021 1 438 453 10.1038/s43587-021-00056-0 Cai Y Wang S Qu J Belmonte JCI Liu GH Rejuvenation of tissue stem cells by intrinsic and extrinsic factors Stem Cells Transl Med 2022 11 231 238 10.1093/stcltm/szab012 35303745 Cai Y Zhou H Zhu Y Sun Q Ji Y Xue A Wang Y Chen W Yu X Wang L Elimination of senescent cells by \u03b2-galactosidase-targeted prodrug attenuates inflammation and restores physical function in aged mice Cell Res 2020 30 574 589 10.1038/s41422-020-0314-9 32341413 Cai Z Wang C Yang W Role of berberine in Alzheimer\u2019s disease Neuropsychiatr Dis Treat 2016 12 2509 2520 10.2147/NDT.S114846 27757035 Calcinotto, A., and Alimonti, A. (2017). Aging tumour cells to cure cancer:\u201cpro-senescence\u201d therapy for cancer. Swiss Med Wkly, 147, doi: 10.4414/smw.2017.14367. Calcinotto A Kohli J Zagato E Pellegrini L Demaria M Alimonti A Cellular senescence: aging, cancer, and injury Physiol Rev 2019 99 1047 1078 10.1152/physrev.00020.2018 30648461 Camell CD G\u00fcnther P Lee A Goldberg EL Spadaro O Youm Y H Bartke A Hubbard GB Ikeno Y Ruddle NH Aging induces an Nlrp3 inflammasome-dependent expansion of adipose B cells that impairs metabolic homeostasis Cell Metab 2019 30 1024 1039 10.1016/j.cmet.2019.10.006 31735593 Campbell JM Bellman SM Stephenson MD Lisy K Metformin reduces all-cause mortality and diseases of ageing independent of its effect on diabetes control: a systematic review and meta-analysis Ageing Res Rev 2017 40 31 44 10.1016/j.arr.2017.08.003 28802803 Campbell KR Steif A Laks E Zahn H Lai D McPherson A Farahani H Kabeer F O\u2019Flanagan C Biele J Clonealign: statistical integration of independent single-cell RNA and DNA sequencing data from human cancers Genome Biol 2019 20 54 10.1186/s13059-019-1645-z 30866997 Campisi J Cellular senescence, cancer and aging Mol Biol Cell 2004 15 354A Campisi J Aging, cellular senescence, and cancer Annu Rev Physiol 2013 75 685 705 10.1146/annurev-physiol-030212-183653 23140366 Cancro MP Age-associated B cells Annu Rev Immunol 2020 38 315 340 10.1146/annurev-immunol-092419-031130 31986068 Cang Z Nie Q Inferring spatial and signaling relationships between cells from single cell transcriptomic data Nat Commun 2020 11 2084 10.1038/s41467-020-15968-5 32350282 Cao Y Nishihara R Wu K Wang M Ogino S Willett WC Spiegelman D Fuchs CS Giovannucci EL Chan AT Population-wide impact of long-term use of aspirin and the risk for cancer JAMA Oncol 2016 2 762 769 10.1001/jamaoncol.2015.6396 26940135 Carneiro MC Henriques CM Nabais J Ferreira T Carvalho T Ferreira MG Short telomeres in key tissues initiate local and systemic aging in zebrafish PLoS Genet 2016 12 e1005798 10.1371/journal.pgen.1005798 26789415 Carrasquillo MM Zou F Pankratz VS Wilcox SL Ma L Walker LP Younkin SG Younkin CS Younkin LH Bisceglio GD Genetic variation in PCDH11X is associated with susceptibility to late-onset Alzheimer\u2019s disease Nat Genet 2009 41 192 198 10.1038/ng.305 19136949 Caruso C Accardi G Virruso C Candore G Sex, gender and immunosenescence: a key to understand the different lifespan between men and women Immun Ageing 2013 10 20 10.1186/1742-4933-10-20 23680476 Castellano M Rossi F Giacche M Perani C Rivadossi F Muiesan ML Salvetti M Beschi M Rizzoni D Agabiti-Rosei E \u03b2 2 -adrenergic receptor gene polymorphism, age, and cardiovascular phenotypes Hypertension 2003 41 361 367 10.1161/01.HYP.0000052831.85600.79 12574108 Caughey GE Vitry AI Gilbert AL Roughead EE Prevalence of comorbidity of chronic diseases in Australia BMC Public Health 2008 8 221 10.1186/1471-2458-8-221 18582390 Cavalcante MB Saccon TD Nunes ADC Kirkland JL Tchkonia T Schneider A Masternak MM Dasatinib plus quercetin prevents uterine age-related dysfunction and fibrosis in mice Aging 2020 12 2711 2722 10.18632/aging.102772 31955151 Cevenini E Monti D Franceschi C Inflamm-ageing Curr Opin Clin Nutr Metab Care 2013 16 14 20 10.1097/MCO.0b013e32835ada13 23132168 Chadda KR Ajijola OA Vaseghi M Shivkumar K Huang CLH Jeevaratnam K Ageing, the autonomic nervous system and arrhythmia: from brain to heart Ageing Res Rev 2018 48 40 50 10.1016/j.arr.2018.09.005 30300712 Chadwick SR Lajoie P Endoplasmic reticulum stress coping mechanisms and lifespan regulation in health and diseases Front Cell Dev Biol 2019 7 84 10.3389/fcell.2019.00084 31231647 Chakkalakal JV Jones KM Basson MA Brack AS The aged niche disrupts muscle stem cell quiescence Nature 2012 490 355 360 10.1038/nature11438 23023126 Chakravarti D LaBella KA DePinho RA Telomeres: history, health, and hallmarks of aging Cell 2021 184 306 322 10.1016/j.cell.2020.12.028 33450206 Chakravarti, D., Lee, R., Multani, A.S., Santoni, A., Keith, Z., Hsu, W.H., Chang, K., Reyes, L., Rashid, A., Wu, C.J., et al. (2021b). Telomere dysfunction instigates inflammation in inflammatory bowel disease. Proc Natl Acad Sci USA 118. Chan CKF Seo EY Chen JY Lo D McArdle A Sinha R Tevlin R Seita J Vincent-Tompkins J Wearda T Identification and specification of the mouse skeletal stem cell Cell 2015 160 285 298 10.1016/j.cell.2014.12.002 25594184 Chan CKF Gulati GS Sinha R Tompkins JV Lopez M Carter A C Ransom RC Reinisch A Wearda T Murphy M Identification of the human skeletal stem cell Cell 2018 175 43 56 10.1016/j.cell.2018.07.029 30241615 Chang HC Guarente L SIRT1 and other sirtuins in metabolism Trends Endocrinol Metab 2014 25 138 145 10.1016/j.tem.2013.12.001 24388149 Chang J Wang Y Shao L Laberge RM Demaria M Campisi J Janakiraman K Sharpless NE Ding S Feng W Clearance of senescent cells by ABT263 rejuvenates aged hematopoietic stem cells in mice Nat Med 2016 22 78 83 10.1038/nm.4010 26657143 Chauhan D Tian Z Nicholson B Kumar KGS Zhou B Carrasco R McDermott JL Leach CA Fulcinniti M Kodrasov MP A small molecule inhibitor of ubiquitin-specific protease-7 induces apoptosis in multiple myeloma cells and overcomes bortezomib resistance Cancer Cell 2012 22 345 358 10.1016/j.ccr.2012.08.007 22975377 Chen A Liao S Cheng M Ma K Wu L Lai Y Qiu X Yang J Xu J Hao S Spatiotemporal transcriptomic atlas of mouse organogenesis using DNA nanoball-patterned arrays Cell 2022 185 1777 1792 10.1016/j.cell.2022.04.003 35512705 Chen C Liu Y Liu Y Zheng P mTOR regulation and therapeutic rejuvenation of aging hematopoietic stem cells Sci Signal 2009 2 ra75 10.1126/scisignal.2000559 19934433 Chen C Zhou M Ge Y Wang X SIRT1 and aging related signaling pathways Mech Ageing Dev 2020 187 111215 10.1016/j.mad.2020.111215 32084459 Chen F Long Q Fu D Zhu D Ji Y Han L Zhang B Xu Q Liu B Li Y Targeting SPINK1 in the damaged tumour microenvironment alleviates therapeutic resistance Nat Commun 2018 9 4315 10.1038/s41467-018-06860-4 30333494 Chen H Ruiz PD McKimpson WM Novikov L Kitsis RN Gamble MJ MacroH2A1 and atm play opposing roles in paracrine senescence and the senescence-associated secretory phenotype Mol Cell 2015 59 719 731 10.1016/j.molcel.2015.07.011 26300260 Chen H Xue J Churikov D Hass EP Shi S Lemon LD Luciano P Bertuch AA Zappulla DC G\u00e9li V Structural insights into yeast telomerase recruitment to telomeres Cell 2018 172 331 343 10.1016/j.cell.2017.12.008 29290466 Chen R Zhang K Chen H Zhao X Wang J Li L Cong Y Ju Z Xu D Williams BRG Telomerase deficiency causes alveolar stem cell senescence-associated low-grade inflammation in lungs J Biol Chem 2015 290 30813 30829 10.1074/jbc.M115.681619 26518879 Chen S Chen L Qi Y Xu J Ge Q Fan Y Chen D Zhang Y Wang L Hou T Bifidobacterium adolescentis regulates catalase activity and host metabolism and improves healthspan and lifespan in multiple species Nat Aging 2021 1 991 1001 10.1038/s43587-021-00129-0 Chen T Wang F Wei S Nie Y Zheng X Deng Y Zhu X Deng Y Zhong N Zhou C FGFR/RACK1 interacts with MDM2, promotes P53 degradation, and inhibits cell senescence in lung squamous cell carcinoma Cancer Biol Med 2021 18 665 674 10.20892/j.issn.2095-3941.2020.0389 33710818 Chen WT Lu A Craessaerts K Pavie B Sala Frigerio C Corthout N Qian X Lal\u00e1kov\u00e1 J K\u00fchnemund M Voytyuk I Spatial transcriptomics and in situ sequencing to study Alzheimer\u2019s disease Cell 2020 182 976 991 10.1016/j.cell.2020.06.038 32702314 Chen W Qian W Wu G Chen W Xian B Chen X Cao Y Green CD Zhao F Tang K Three-dimensional human facial morphologies as robust aging markers Cell Res 2015 25 574 587 10.1038/cr.2015.36 25828530 Chen X Sun YC Zhan H Kebschull JM Fischer S Matho K Huang ZJ Gillis J Zador AM High-throughput mapping of long-range neuronal projection using in situ sequencing Cell 2019 179 772 786 10.1016/j.cell.2019.09.023 31626774 Chen Y An X Wang Z Guan S An H Huang Q Zhang H Liang L Huang B Wang H Transcriptome and lipidome profile of human mesenchymal stem cells with reduced senescence and increased trilineage differentiation ability upon drug treatment Aging 2021 13 9991 10014 10.18632/aging.202759 33795523 Chen Y Geng A Zhang W Qian Z Wan X Jiang Y Mao Z Fight to the bitter end: DNA repair and aging Ageing Res Rev 2020 64 101154 10.1016/j.arr.2020.101154 32977059 Chen Y Zhou X Research progress of mTOR inhibitors Eur J Med Chem 2020 208 112820 10.1016/j.ejmech.2020.112820 32966896 Chen YA Shen YL Hsia HY Tiang YP Sung TL Chen LY Extrachromosomal telomere repeat DNA is linked to ALT development via cGAS-STING DNA sensing pathway Nat Struct Mol Biol 2017 24 1124 1131 10.1038/nsmb.3498 29106411 Cheng H Xuan H Green CD Han Y Sun N Shen H McDermott J Bennett DA Lan F Han JDJ Repression of human and mouse brain inflammaging transcriptome by broad gene-body histone hyperacetylation Proc Natl Acad Sci USA 2018 115 7611 7616 10.1073/pnas.1800656115 29967166 Cheung P Vallania F Warsinske HC Donato M Schaffert S Chang SE Dvorak M Dekker CL Davis MM Utz PJ Single-cell chromatin modification profiling reveals increased epigenetic variations with aging Cell 2018 173 1385 1397 10.1016/j.cell.2018.03.079 29706550 Chiang HM Chen HC Chiu HH Chen CW Wang SM Wen KC Neonauclea reticulata (Havil.) Merr stimulates skin regeneration after UVB exposure via ROS scavenging and modulation of the MAPK/MMPs/collagen pathway Evid-Based Complement Alternat Med 2013 2013 1 9 Chiang JL Shukla P Pagidas K Ahmed NS Karri S Gunn DD Hurd WW Singh KK Mitochondria in ovarian aging and reproductive longevity Ageing Res Rev 2020 63 101168 10.1016/j.arr.2020.101168 32896666 Chien Y Scuoppo C Wang X Fang X Balgley B Bolden JE Premsrirut P Luo W Chicas A Lee CS Control of the senescence-associated secretory phenotype by NF-\u03baB promotes senescence and enhances chemosensitivity Genes Dev 2011 25 2125 2136 10.1101/gad.17276711 21979375 Childs BG Gluscevic M Baker DJ Laberge RM Marquess D Dananberg J van Deursen JM Senescent cells: an emerging target for diseases of ageing Nat Rev Drug Discov 2017 16 718 735 10.1038/nrd.2017.116 28729727 Childs BG Li H van Deursen JM Senescent cells: a therapeutic target for cardiovascular disease J Clin Investigation 2018 128 1217 1228 10.1172/JCI95146 Chin RM Fu X Pai MY Vergnes L Hwang H Deng G Diep S Lomenick B Meli VS Monsalve GC The metabolite \u03b1-ketoglutarate extends lifespan by inhibiting ATP synthase and TOR Nature 2014 510 397 401 10.1038/nature13264 24828042 Chini EN Chini CCS Espindola Netto JM de Oliveira GC van Schooten W The pharmacology of CD38/NADase: an emerging target in cancer and diseases of aging Trends Pharmacol Sci 2018 39 424 436 10.1016/j.tips.2018.02.001 29482842 Cho SJ Stout-Delgado HW Aging and lung disease Annu Rev Physiol 2020 82 433 459 10.1146/annurev-physiol-021119-034610 31730381 Choi S Zhang B Ma S Gonzalez-Celeiro M Stein D Jin X Kim ST Kang YL Besnard A Rezza A Corticosterone inhibits GAS6 to govern hair follicle stem-cell quiescence Nature 2021 592 428 432 10.1038/s41586-021-03417-2 33790465 Chondronasiou D Gill D Mosteiro L Urdinguio RG Berenguer-Llergo A Aguilera M Durand S Aprahamian F Nirmalathasan N Abad M Multi-omic rejuvenation of naturally aged tissues by a single cycle of transient reprogramming Aging Cell 2022 21 e13578 10.1111/acel.13578 35235716 Christensen K Johnson TE Vaupel JW The quest for genetic determinants of human longevity: challenges and insights Nat Rev Genet 2006 7 436 448 10.1038/nrg1871 16708071 Chu HP Cifuentes-Rojas C Kesner B Aeby E Lee HG Wei C Oh HJ Boukhali M Haas W Lee JT TERRA RNA antagonizes ATRX and protects telomeres Cell 2017 170 86 101 10.1016/j.cell.2017.06.017 28666128 Chung CL Lawrence I Hoffman M Elgindi D Nadhan K Potnis M Jin A Sershon C Binnebose R Lorenzini A Topical rapamycin reduces markers of senescence and aging in human skin: an exploratory, prospective, randomized trial GeroScience 2019 41 861 869 10.1007/s11357-019-00113-y 31761958 Clarke LE Liddelow SA Chakraborty C M\u00fcnch AE Heiman M Barres BA Normal aging induces A1-like astrocyte reactivity Proc Natl Acad Sci USA 2018 115 E1896 E1905 10.1073/pnas.1800165115 29437957 Collins JJ Evason K Kornfeld K Pharmacology of delayed aging and extended lifespan of Caenorhabditis elegans Exp Gerontology 2006 41 1032 1039 10.1016/j.exger.2006.06.038 Collins VP Brunk UT Characterization of residual bodies formed in phase II cultivated human glia cells Mech Ageing Dev 1976 5 193 207 10.1016/0047-6374(76)90018-X 940361 Comazzetto S Shen B Morrison SJ Niches that regulate stem cells and hematopoiesis in adult bone marrow Dev Cell 2021 56 1848 1860 10.1016/j.devcel.2021.05.018 34146467 Cooper C Campion G Melton LJ III Hip fractures in the elderly: a world-wide projection Osteoporosis Int 1992 2 285 289 10.1007/BF01623184 Copp\u00e9 JP Desprez PY Krtolica A Campisi J The senescence-associated secretory phenotype: the dark side of tumor suppression Annu Rev Pathol Mech Dis 2010 5 99 118 10.1146/annurev-pathol-121808-102144 Copp\u00e9 JP Patil CK Rodier F Sun Y Mu\u00f1oz DP Goldstein J Nelson PS Desprez PY Campisi J Senescence-associated secretory phenotypes reveal cell-nonautonomous functions of oncogenic RAS and the p53 tumor suppressor PLoS Biol 2008 6 e301 10.1371/journal.pbio.0060301 19053174 Cosgrove BD Gilbert PM Porpiglia E Mourkioti F Lee SP Corbel SY Llewellyn ME Delp SL Blau HM Rejuvenation of the muscle stem cell population restores strength to injured aged muscles Nat Med 2014 20 255 264 10.1038/nm.3464 24531378 Costantino S Paneni F Cosentino F Targeting chromatin remodeling to prevent cardiovascular disease in diabetes Curr Pharm Biotechnol 2015 16 531 543 10.2174/138920101606150407113644 25860064 Cotto B Natarajaseenivasan K Langford D Astrocyte activation and altered metabolism in normal aging, age-related CNS diseases, and HAND J Neurovirol 2019 25 722 733 10.1007/s13365-019-00721-6 30671779 Coufal NG Garcia-Perez JL Peng GE Marchetto MCN Muotri AR Mu Y Carson CT Macia A Moran JV Gage FH Ataxia telangiectasia mutated (ATM) modulates long interspersed element-1 (L1) retrotransposition in human neural stem cells Proc Natl Acad Sci USA 2011 108 20382 20387 10.1073/pnas.1100273108 22159035 Covarrubias AJ Perrone R Grozio A Verdin E NAD+ metabolism and its roles in cellular processes during ageing Nat Rev Mol Cell Biol 2021 22 119 141 10.1038/s41580-020-00313-x 33353981 Cox MM Battista JR Deinococcus radiodurans\u2014the consummate survivor Nat Rev Microbiol 2005 3 882 892 10.1038/nrmicro1264 16261171 Cox MM Keck JL Battista JR Rising from the Ashes: DNA repair in Deinococcus radiodurans PLoS Genet 2010 6 e1000815 10.1371/journal.pgen.1000815 20084105 Crescioli C Targeting age-dependent functional and metabolic decline of human skeletal muscle: the geroprotective role of exercise, myokine IL-6, and vitamin D Int J Mol Sci 2020 21 1010 10.3390/ijms21031010 32033000 Crimmins EM Lifespan and healthspan: past, present, and promise Geront 2015 55 901 911 10.1093/geront/gnv130 Cruz-Jentoft AJ Bahat G Bauer J Boirie Y Bruy\u00e8re O Cederholm T Cooper C Landi F Rolland Y Sayer AA Sarcopenia: revised European consensus on definition and diagnosis Age Ageing 2019 48 16 31 10.1093/ageing/afy169 30312372 Dai DF Chen T Szeto H Nieves-Cintr\u00f3n M Kutyavin V Santana LF Rabinovitch PS Mitochondrial targeted antioxidant Peptide ameliorates hypertensive cardiomyopathy J Am College Cardiol 2011 58 73 82 10.1016/j.jacc.2010.12.044 Dai DF Karunadharma PP Chiao YA Basisty N Crispin D Hsieh EJ Chen T Gu H Djukovic D Raftery D Altered proteome turnover and remodeling by short-term caloric restriction or rapamycin rejuvenate the aging heart Aging Cell 2014 13 529 539 10.1111/acel.12203 24612461 Dai L Huang Q Boeke JD Effect of reverse transcriptase inhibitors on LINE-1 and Ty1 reverse transcriptase activities and on LINE-1 retrotransposition BMC Biochem 2011 12 18 10.1186/1471-2091-12-18 21545744 Dalal M Jacobs-El N Nicholson B Tuo J Chew E Chan CC Nussenblatt R Ferris F Meyerle C Subconjunctival Palomid 529 in the treatment of neovascular age-related macular degeneration Graefes Arch Clin Exp Ophthalmol 2013 251 2705 2709 10.1007/s00417-013-2375-7 23689994 Dan J Liu Y Liu N Chiourea M Okuka M Wu T Ye X Mou C Wang L Wang L Rif1 maintains telomere length homeostasis of ESCs by mediating heterochromatin silencing Dev Cell 2014 29 7 19 10.1016/j.devcel.2014.03.004 24735877 Dang Y An Y He J Huang B Zhu J Gao M Zhang S Wang X Yang B Xie Z Berberine ameliorates cellular senescence and extends the lifespan of mice via regulating p16 and cyclin protein expression Aging Cell 2020 19 e13060 10.1111/acel.13060 31773901 Daniali L Benetos A Susser E Kark JD Labat C Kimura M Desai KK Granick M Aviv A Telomeres shorten at equivalent rates in somatic tissues of adults Nat Commun 2013 4 1597 10.1038/ncomms2602 23511462 Daniel KR Wells G Stewart K Moore B Kitzman DW Effect of aldosterone antagonism on exercise tolerance, Doppler diastolic function, and quality of life in older women with diastolic heart failure Congestive Heart Failure 2009 15 68 74 10.1111/j.1751-7133.2009.00056.x 19379452 Daniel M Tollefsbol TO Epigenetic linkage of aging, cancer and nutrition J Exp Biol 2015 218 59 70 10.1242/jeb.107110 25568452 Das A Huang GX Bonkowski MS Longchamp A Li C Schultz MB Kim LJ Osborne B Joshi S Lu Y Impairment of an endothelial NAD + -H2S signaling network is a reversible cause of vascular aging Cell 2018 173 74 89 10.1016/j.cell.2018.02.008 29570999 Davidsohn N Pezone M Vernet A Graveline A Oliver D Slomovic S Punthambaker S Sun X Liao R Bonventre JV A single combination gene therapy treats multiple age-related diseases Proc Natl Acad Sci USA 2019 116 23505 23511 10.1073/pnas.1910073116 31685628 Davis EJ Lobach I Dubal DB Female XX sex chromosomes increase survival and extend lifespan in aging mice Aging Cell 2019 18 e12871 10.1111/acel.12871 30560587 de Brabander JM Kramers RJ Uylings HB Layer-specific dendritic regression of pyramidal cells with ageing in the human prefrontal cortex Eur J Neurosci 1998 10 1261 1269 10.1046/j.1460-9568.1998.00137.x 9749780 De Cecco M Criscione SW Peterson AL Neretti N Sedivy JM Kreiling JA Transposable elements become active and mobile in the genomes of aging mammalian somatic tissues Aging 2013 5 867 883 10.18632/aging.100621 24323947 De Cecco M Criscione SW Peckham EJ Hillenmeyer S Hamm E A Manivannan J Peterson AL Kreiling JA Neretti N Sedivy JM Genomes of replicatively senescent cells undergo global epigenetic changes leading to gene silencing and activation of transposable elements Aging Cell 2013 12 247 256 10.1111/acel.12047 23360310 De Cecco M Ito T Petrashen AP Elias AE Skvir NJ Criscione S W Caligiana A Brocculi G Adney EM Boeke JD L1 drives IFN in senescent cells and promotes age-associated inflammation Nature 2019 566 73 78 10.1038/s41586-018-0784-9 30728521 Bernardes de Jesus B Vera E Schneeberger K Tejera AM Ayuso E Bosch F Blasco MA Telomerase gene therapy in adult and old mice delays aging and increases longevity without increasing cancer EMBO Mol Med 2012 4 691 704 10.1002/emmm.201200245 22585399 de Lange T Shelterin-mediated telomere protection Annu Rev Genet 2018 52 223 247 10.1146/annurev-genet-032918-021921 30208292 de Lucia C Gambino G Petraglia L Elia A Komici K Femminella GD D\u2019Amico ML Formisano R Borghetti G Liccardo D Long-term caloric restriction improves cardiac function, remodeling, adrenergic responsiveness, and sympathetic innervation in a model of postischemic heart failure Circ-Heart Failure 2018 11 e004153 10.1161/CIRCHEARTFAILURE.117.004153 de Magalh\u00e3es JP Stevens M Thornton D The business of anti-aging science Trends Biotechnol 2017 35 1062 1073 10.1016/j.tibtech.2017.07.004 28778607 De Miguel Z Khoury N Betley MJ Lehallier B Willoughby D Olsson N Yang AC Hahn O Lu N Vest RT Exercise plasma boosts memory and dampens brain inflammation via clusterin Nature 2021 600 494 499 10.1038/s41586-021-04183-x 34880498 DeBusk FL The hutchinson-gilford progeria syndrome J Pediatr 1972 80 697 724 10.1016/S0022-3476(72)80229-4 4552697 DeGregori J Aging, inflammation, and HSC Blood 2020 136 153 154 10.1182/blood.2020006070 32645167 DeJong EN Surette MG Bowdish DME The gut microbiota and unhealthy aging: disentangling cause from consequence Cell Host Microbe 2020 28 180 189 10.1016/j.chom.2020.07.013 32791111 Demanelis K Jasmine F Chen LS Chernoff M Tong L Delgado D Zhang C Shinkle J Sabarinathan M Lin H Determinants of telomere length across human tissues Science 2020 369 eaaz6876 10.1126/science.aaz6876 32913074 Demaria M O\u2019Leary MN Chang J Shao L Liu S Alimirah F Koenig K Le C Mitin N Deal AM Cellular senescence promotes adverse effects of chemotherapy and cancer relapse Cancer Discovery 2017 7 165 176 10.1158/2159-8290.CD-16-0241 27979832 Demaria M Ohtani N Youssef SA Rodier F Toussaint W Mitchell JR Laberge RM Vijg J Van Steeg H Doll\u00e9 MET An essential role for senescent cells in optimal wound healing through secretion of PDGF-AA Dev Cell 2014 31 722 733 10.1016/j.devcel.2014.11.012 25499914 Demontis F Patel VK Swindell WR Perrimon N Intertissue control of the nucleolus via a myokine-dependent longevity pathway Cell Rep 2014 7 1481 1494 10.1016/j.celrep.2014.05.001 24882005 Deng L Ren R Liu Z Song M Li J Wu Z Ren X Fu L Li W Zhang W Stabilizing heterochromatin by DGCR8 alleviates senescence and osteoarthritis Nat Commun 2019 10 3329 10.1038/s41467-019-10831-8 31350386 Deng P Yuan Q Cheng Y Li J Liu Z Liu Y Li Y Su T Wang J Salvo ME Loss of KDM4B exacerbates bone-fat imbalance and mesenchymal stromal cell exhaustion in skeletal aging Cell Stem Cell 2021 28 1057 1073 10.1016/j.stem.2021.01.010 33571444 Deng Z Norseen J Wiedmer A Riethman H Lieberman PM TERRA RNA binding to TRF2 facilitates heterochromatin formation and ORC recruitment at telomeres Mol Cell 2009 35 403 413 10.1016/j.molcel.2009.06.025 19716786 Desd\u00edn-Mic\u00f3 G Soto-Heredero G Aranda JF Oller J Carrasco E Gaband\u00e9-Rodr\u00edguez E Blanco EM Alfranca A Cuss\u00f3 L Desco M T cells with dysfunctional mitochondria induce multimorbidity and premature senescence Science 2020 368 1371 1376 10.1126/science.aax0860 32439659 di Domenico A Carola G Calatayud C Pons-Espinal M Mu\u00f1oz JP Richaud-Patin Y Fernandez-Carasa I Gut M Faella A Parameswaran J Patient-specific iPSC-derived astrocytes contribute to non-cell-autonomous neurodegeneration in Parkinson\u2019s disease Stem Cell Rep 2019 12 213 229 10.1016/j.stemcr.2018.12.011 Di Giorgio E Paluvai H Dalla E Ranzino L Renzini A Moresi V Minisini M Picco R Brancolini C HDAC4 degradation during senescence unleashes an epigenetic program driven by AP-1/p300 at selected enhancers and super-enhancers Genome Biol 2021 22 129 10.1186/s13059-021-02340-z 33966634 Di Micco R Krizhanovsky V Baker D d\u2019Adda di Fagagna F Cellular senescence in ageing: from mechanisms to therapeutic opportunities Nat Rev Mol Cell Biol 2021 22 75 95 10.1038/s41580-020-00314-w 33328614 Diao Z Ji Q Wu Z Zhang W Cai Y Wang Z Hu J Liu Z Wang Q Bi S SIRT3 consolidates heterochromatin and counteracts senescence Nucl Acids Res 2021 49 4203 4219 10.1093/nar/gkab161 33706382 Ding G Xiang X Hu Y Xiao G Chen Y Binari R Comjean A Li J Rushworth E Fu Z Coordination of tumor growth and host wasting by tumor-derived Upd3 Cell Rep 2021 36 109553 10.1016/j.celrep.2021.109553 34407411 Dinulovic I Furrer R Beer M Ferry A Cardel B Handschin C Muscle PGC-1\u03b1 modulates satellite cell number and proliferation by remodeling the stem cell niche Skeletal Muscle 2016 6 39 10.1186/s13395-016-0111-9 27908291 Doksani Y Wu JY de Lange T Zhuang X Superresolution fluorescence imaging of telomeres reveals TRF2-dependent T-loop formation Cell 2013 155 345 356 10.1016/j.cell.2013.09.048 24120135 Doles J Storer M Cozzuto L Roma G Keyes WM Age-associated inflammation inhibits epidermal stem cell function Genes Dev 2012 26 2144 2153 10.1101/gad.192294.112 22972935 Donekal S Venkatesh BA Liu YC Liu CY Yoneyama K Wu C O Nacif M Gomes AS Hundley WG Bluemke DA Interstitial fibrosis, left ventricular remodeling, and myocardial mechanical behavior in a population-based multiethnic cohort Circ-Cardiovasc Imag 2014 7 292 302 10.1161/CIRCIMAGING.113.001073 Dong X Milholland B Vijg J Evidence for a limit to human lifespan Nature 2016 538 257 259 10.1038/nature19793 27706136 Dou X Sun Y Li J Zhang J Hao D Liu W Wu R Kong F Peng X Li J Short-term rapamycin treatment increases ovarian lifespan in young and middle-aged female mice Aging Cell 2017 16 825 836 10.1111/acel.12617 28544226 Dou Z Ghosh K Vizioli MG Zhu J Sen P Wangensteen KJ Simithy J Lan Y Lin Y Zhou Z Cytoplasmic chromatin triggers inflammation in senescence and cancer Nature 2017 550 402 406 10.1038/nature24050 28976970 Downs JL Wise PM The role of the brain in female reproductive aging Mol Cell Endocrinol 2009 299 32 38 10.1016/j.mce.2008.11.012 19063938 Drake MT Srinivasan B M\u00f6dder UI Ng AC Undale AH Roforth MM Peterson JM McCready LK Riggs BL Khosla S Effects of intermittent parathyroid hormone treatment on osteoprogenitor cells in postmenopausal women Bone 2011 49 349 355 10.1016/j.bone.2011.05.003 21600325 Dray C Knauf C Daviaud D Waget A Boucher J Bul\u00e9on M Cani PD Attan\u00e9 C Guign\u00e9 C Carp\u00e9n\u00e9 C Apelin stimulates glucose utilization in normal and obese insulin-resistant mice Cell Metab 2008 8 437 445 10.1016/j.cmet.2008.10.003 19046574 Dries R Zhu Q Dong R Eng CHL Li H Liu K Fu Y Zhao T Sarkar A Bao F Giotto: a toolbox for integrative analysis and visualization of spatial expression data Genome Biol 2021 22 78 10.1186/s13059-021-02286-2 33685491 Duan S Yuan G Liu X Ren R Li J Zhang W Wu J Xu X Fu L Li Y PTEN deficiency reprogrammes human neural stem cells towards a glioblastoma stem cell-like phenotype Nat Commun 2015 6 10068 10.1038/ncomms10068 26632666 Duncan, F.E., Confino, R., and Pavone, M.E. (2018). Female Reproductive Aging. In Conn\u2019s Handbook of Models for Human Aging. pp. 109\u2013130. Durik M Kavousi M van der Pluijm I Isaacs A Cheng C Verdonk K Loot AE Oeseburg H Bhaggoe UM Leijten F Nucleotide excision DNA repair is associated with age-related vascular dysfunction Circulation 2012 126 468 478 10.1161/CIRCULATIONAHA.112.104380 22705887 Eisenberg T Abdellatif M Schroeder S Primessnig U Stekovic S Pendl T Harger A Schipke J Zimmermann A Schmidt A Cardioprotection and lifespan extension by the natural polyamine spermidine Nat Med 2016 22 1428 1438 10.1038/nm.4222 27841876 Eisenberg T Knauer H Schauer A B\u00fcttner S Ruckenstuhl C Carmona-Gutierrez D Ring J Schroeder S Magnes C Antonacci L Induction of autophagy by spermidine promotes longevity Nat Cell Biol 2009 11 1305 1314 10.1038/ncb1975 19801973 Ekpenyong-Akiba AE Canfarotta F Abd H B Poblocka M Casulleras M Castilla-Vallmanya L Kocsis-Fodor G Kelly ME Janus J Althubiti M Detecting and targeting senescent cells using molecularly imprinted nanoparticles Nanoscale Horiz 2019 4 757 768 10.1039/C8NH00473K El Messaoudi S Rongen GA de Boer RA Riksen NP The cardioprotective effects of metformin Curr Opin Lipidol 2011 22 445 453 10.1097/MOL.0b013e32834ae1a7 21897229 Elosua-Bayes M Nieto P Mereu E Gut I Heyn H SPOTlight: seeded NMF regression to deconvolute spatial transcriptomics spots with single-cell transcriptomes Nucl Acids Res 2021 49 e50 10.1093/nar/gkab043 33544846 Elyahu Y Hekselman I Eizenberg-Magar I Berner O Strominger I Schiller M Mittal K Nemirovsky A Eremenko E Vital A Aging promotes reorganization of the CD4 T cell landscape toward extreme regulatory and effector phenotypes Sci Adv 2019 5 eaaw8330 10.1126/sciadv.aaw8330 31457092 Eng CHL Lawson M Zhu Q Dries R Koulena N Takei Y Yun J Cronin C Karp C Yuan GC Transcriptome-scale super-resolved imaging in tissues by RNA seqFISH + Nature 2019 568 235 239 10.1038/s41586-019-1049-y 30911168 Engberg H Oksuzyan A Jeune B Vaupel JW Christensen K Centenarians\u2014a useful model for healthy aging? A 29-year follow-up of hospitalizations among 40,000 Danes born in 1905 Aging Cell 2009 8 270 276 10.1111/j.1474-9726.2009.00474.x 19627266 Englund DA Zhang X Aversa Z LeBrasseur NK Skeletal muscle aging, cellular senescence, and senotherapeutics: Current knowledge and future directions Mech Ageing Dev 2021 200 111595 10.1016/j.mad.2021.111595 34742751 Epel ES Prather AA Stress, telomeres, and psychopathology: toward a deeper understanding of a triad of early aging Annu Rev Clin Psychol 2018 14 371 397 10.1146/annurev-clinpsy-032816-045054 29494257 Erlinge D Gurbel PA James S Lindahl TL Svensson P Ten Berg JM Foley DP Wagner H Brown PB Luo J Prasugrel 5 mg in the very elderly attenuates platelet inhibition but maintains noninferiority to prasugrel 10 mg in nonelderly patients: the GENERATIONS trial, a pharmacodynamic and pharmacokinetic study in stable coronary artery disease patients J Am College Cardiol 2013 62 577 583 10.1016/j.jacc.2013.05.023 Espada L Dakhovnik A Chaudhari P Martirosyan A Miek L Poliezhaieva T Schaub Y Nair A D\u00f6ring N Rahnis N Loss of metabolic plasticity underlies metformin toxicity in aged Caenorhabditis elegans Nat Metab 2020 2 1316 1331 10.1038/s42255-020-00307-1 33139960 Mejia-Ramirez E Florian MC Understanding intrinsic hematopoietic stem cell aging Haematologica 2020 105 22 37 10.3324/haematol.2018.211342 31806687 Evdokimov A Kutuzov M Petruseva I Lukjanchikova N Kashina E Kolova E Zemerova T Romanenko S Perelman P Prokopov D Naked mole rat cells display more efficient excision repair than mouse cells Aging 2018 10 1454 1473 10.18632/aging.101482 29930219 Fafi\u00e1n-Labora JA O\u2019Loghlen A Classical and nonclassical intercellular communication in senescence and ageing Trends Cell Biol 2020 30 628 639 10.1016/j.tcb.2020.05.003 32505550 Fane M Weeraratna AT How the ageing microenvironment influences tumour progression Nat Rev Cancer 2020 20 89 106 10.1038/s41568-019-0222-9 31836838 Farr JN Xu M Weivoda MM Monroe DG Fraser DG Onken J L Negley BA Sfeir JG Ogrodnik MB Hachfeld CM Targeting cellular senescence prevents age-related bone loss in mice Nat Med 2017 23 1072 1079 10.1038/nm.4385 28825716 Faulkner GJ Kimura Y Daub CO Wani S Plessy C Irvine KM Schroder K Cloonan N Steptoe AL Lassmann T The regulated retrotransposon transcriptome of mammalian cells Nat Genet 2009 41 563 571 10.1038/ng.368 19377475 Fealy CE Grevendonk L Hoeks J Hesselink MKC Skeletal muscle mitochondrial network dynamics in metabolic disorders and aging Trends Mol Med 2021 27 1033 1044 10.1016/j.molmed.2021.07.013 34417125 Feng D Huang A Yan W Chen D CD200 dysfunction in neuron contributes to synaptic deficits and cognitive impairment Biochem Biophysl Res Commun 2019 516 1053 1059 10.1016/j.bbrc.2019.06.134 Feng, S., Zhang, T., Ke, W., Xiao, Y., Guo, Z., Lu, C., Li, S., Guo, Z., Liu, Y., Tan, G., et al. (2022). The long-term survival and functional maturation of human iNPC-derived neurons in the basal forebrain of cynomolgus monkeys. Life Med, doi: 10.1093/lifemedi/lnac008. Feretzaki M Pospisilova M Valador Fernandes R Lunardi T Krejci L Lingner J RAD51-dependent recruitment of TERRA lncRNA to telomeres through R-loops Nature 2020 587 303 308 10.1038/s41586-020-2815-6 33057192 Fern\u00e1ndez AF Fraga MF The effects of the dietary polyphenol resveratrol on human healthy aging and lifespan Epigenetics 2011 6 870 874 10.4161/epi.6.7.16499 21613817 Fern\u00e1ndez \u00c1F Sebti S Wei Y Zou Z Shi M McMillan KL He C Ting T Liu Y Chiang WC Disruption of the beclin 1-BCL2 autophagy regulatory complex promotes longevity in mice Nature 2018 558 136 140 10.1038/s41586-018-0162-7 29849149 Ferrara N Gerber HP LeCouter J The biology of VEGF and its receptors Nat Med 2003 9 669 676 10.1038/nm0603-669 12778165 Ferrucci L Fabbri E Inflammageing: chronic inflammation in ageing, cardiovascular disease, and frailty Nat Rev Cardiol 2018 15 505 522 10.1038/s41569-018-0064-2 30065258 Fingerlin TE Murphy E Zhang W Peljto AL Brown KK Steele MP Loyd JE Cosgrove GP Lynch D Groshong S Genome-wide association study identifies multiple susceptibility loci for pulmonary fibrosis Nat Genet 2013 45 613 620 10.1038/ng.2609 23583980 Fischer KE Riddle NC Sex differences in aging: genomic instability J Gerontol-Ser A 2018 73 166 174 10.1093/gerona/glx105 Flach J Bakker ST Mohrin M Conroy PC Pietras EM Reynaud D Alvarez S Diolaiti ME Ugarte F Forsberg EC Replication stress is a potent driver of functional decline in ageing haematopoietic stem cells Nature 2014 512 198 202 10.1038/nature13619 25079315 Fleischer JG Schulte R Tsai HH Tyagi S Ibarra A Shokhirev M N Huang L Hetzer MW Navlakha S Predicting age from the transcriptome of human dermal fibroblasts Genome Biol 2018 19 221 10.1186/s13059-018-1599-6 30567591 Flores I Canela A Vera E Tejera A Cotsarelis G Blasco MA The longest telomeres: a general signature of adult stem cell compartments Genes Dev 2008 22 654 667 10.1101/gad.451008 18283121 Flynn JM O\u2019Leary MN Zambataro CA Academia EC Presley M P Garrett BJ Zykovich A Mooney SD Strong R Rosen CJ Late-life rapamycin treatment reverses age-related heart dysfunction Aging Cell 2013 12 851 862 10.1111/acel.12109 23734717 Flynn RL Centore RC O\u2019Sullivan RJ Rai R Tse A Songyang Z Chang S Karlseder J Zou L TERRA and hnRNPA1 orchestrate an RPA-to-POT1 switch on telomeric single-stranded DNA Nature 2011 471 532 536 10.1038/nature09772 21399625 Fontana L Interventions to promote cardiometabolic health and slow cardiovascular ageing Nat Rev Cardiol 2018 15 566 577 10.1038/s41569-018-0026-8 29795242 Fontana L Partridge L Promoting health and longevity through diet: from model organisms to humans Cell 2015 161 106 118 10.1016/j.cell.2015.02.020 25815989 Fouquerel E Barnes RP Uttam S Watkins SC Bruchez MP Opresko PL Targeted and persistent 8-oxoguanine base damage at telomeres promotes telomere loss and crisis Mol Cell 2019 75 117 130 10.1016/j.molcel.2019.04.024 31101499 Fox K Ford I Steg PG Tardif JC Tendera M Ferrari R Ivabradine in stable coronary artery disease without clinical heart failure N Engl J Med 2014 371 1091 1099 10.1056/NEJMoa1406430 25176136 Franceschi C Campisi J Chronic inflammation (inflammaging) and its potential contribution to age-associated diseases Js Gerontol Ser A-Biol Sci Med Sci 2014 69 S4 S9 Franceschi C Garagnani P Morsiani C Conte M Santoro A Grignolio A Monti D Capri M Salvioli S The continuum of aging and age-related diseases: common mechanisms but different rates Front Med 2018 5 61 10.3389/fmed.2018.00061 Francis AA Lee WH Regan JD The relationship of DNA excision repair of ultraviolet-induced lesions to the maximum life span of mammals Mech Ageing Dev 1981 16 181 189 10.1016/0047-6374(81)90094-4 7266079 Franco I Johansson A Olsson K Vrta\u010dnik P Lundin P Helgadottir HT Larsson M Rev\u00eachon G Bosia C Pagnani A Somatic mutagenesis in satellite cells associates with human skeletal muscle aging Nat Commun 2018 9 800 10.1038/s41467-018-03244-6 29476074 Fransquet PD Wrigglesworth J Woods RL Ernst ME Ryan J The epigenetic clock as a predictor of disease and mortality risk: a systematic review and meta-analysis Clin Epigenet 2019 11 62 10.1186/s13148-019-0656-7 Freund A Patil CK Campisi J p38MAPK is a novel DNA damage response-independent regulator of the senescence-associated secretory phenotype EMBO J 2011 30 1536 1548 10.1038/emboj.2011.69 21399611 Friedman SM Mendelson DA Epidemiology of fragility fractures Clin Geriatric Med 2014 30 175 181 10.1016/j.cger.2014.01.001 Fritzen R Delbos F De Smet A Palancade B Canman CE Aoufouchi S Weill JC Reynaud CA Storck S A single aspartate mutation in the conserved catalytic site of Rev3L generates a hypomorphic phenotype in vivo and in vitro DNA Repair 2016 46 37 46 10.1016/j.dnarep.2016.07.002 27481099 Fu X Wang H Hu P Stem cell activation in skeletal muscle regeneration Cell Mol Life Sci 2015 72 1663 1677 10.1007/s00018-014-1819-5 25572293 Fu X Xiao J Wei Y Li S Liu Y Yin J Sun K Sun H Wang H Zhang Z Combination of inflammation-related cytokines promotes long-term muscle stem cell expansion Cell Res 2015 25 655 673 10.1038/cr.2015.58 25976405 Fuchs E Skin stem cells: rising to the surface J Cell Biol 2008 180 273 284 10.1083/jcb.200708185 18209104 Fuchs E Blau HM Tissue stem cells: architects of their niches Cell Stem Cell 2020 27 532 556 10.1016/j.stem.2020.09.011 33007238 Fuentes D Fern\u00e1ndez N Garc\u00eda Y Garc\u00eda T Morales AR Men\u00e9ndez R Age-related changes in the behavior of apolipoprotein E knockout mice Behaval Sci 2018 8 33 10.3390/bs8030033 Fuhrmann-Stroissnigg H Ling YY Zhao J McGowan SJ Zhu Y Brooks RW Grassi D Gregg SQ Stripay JL Dorronsoro A Identification of HSP90 inhibitors as a novel class of senolytics Nat Commun 2017 8 422 10.1038/s41467-017-00314-z 28871086 Fujimoto N Hastings JL Carrick-Ranson G Shafer KM Shibata S Bhella PS Abdullah SM Barkley KW Adams-Huet B Boyd K N Cardiovascular effects of 1 year of alagebrium and endurance exercise training in healthy older individuals Circ-Heart Failure 2013 6 1155 1164 10.1161/CIRCHEARTFAILURE.113.000440 Furman D Campisi J Verdin E Carrera-Bastos P Targ S Franceschi C Ferrucci L Gilroy DW Fasano A Miller GW Chronic inflammation in the etiology of disease across the life span Nat Med 2019 25 1822 1832 10.1038/s41591-019-0675-0 31806905 Furman D Chang J Lartigue L Bolen CR Haddad F Gaudilliere B Ganio EA Fragiadakis GK Spitzer MH Douchet I Expression of specific inflammasome gene modules stratifies older individuals into two extreme clinical and immunological states Nat Med 2017 23 174 184 10.1038/nm.4267 28092664 Galatro TF Holtman IR Lerario AM Vainchtein ID Brouwer N Sola PR Veras MM Pereira TF Leite REP M\u00f6ller T Transcriptomic analysis of purified human cortical microglia reveals age-associated changes Nat Neurosci 2017 20 1162 1171 10.1038/nn.4597 28671693 Galderisi U Helmbold H Squillaro T Alessio N Komm N Khadang B Cipollaro M Bohn W Giordano A In vitro senescence of rat mesenchymal stem cells is accompanied by downregulation of stemness-related and DNA damage repair genes Stem Cells Dev 2009 18 1033 1042 10.1089/scd.2008.0324 19099372 Galkin F Mamoshina P Aliper A Putin E Moskalev V Gladyshev VN Zhavoronkov A Human gut microbiome aging clock based on taxonomic profiling and deep learning iScience 2020 23 101199 10.1016/j.isci.2020.101199 32534441 Gao B Yu W Lv P Liang X Sun S Zhang Y Parkin overexpression alleviates cardiac aging through facilitating K63-polyubiquitination of TBK1 to facilitate mitophagy Biochim Biophys Acta (BBA) \u2014 Mol Basis Dis 2021 1867 165997 10.1016/j.bbadis.2020.165997 Gao L Hu Y Tian Y Fan Z Wang K Li H Zhou Q Zeng G Hu X Yu L Lung cancer deficient in the tumor suppressor GATA4 is sensitive to TGFBR1 inhibition Nat Commun 2019 10 1665 10.1038/s41467-019-09295-7 30971692 Garagnani P Marquis J Delledonne M Pirazzini C Marasco E Kwiatkowska KM Iannuzzi V Bacalini MG Valsesia A Carayol J Whole-genome sequencing analysis of semi-supercentenarians eLife 2021 10 e57849 10.7554/eLife.57849 33941312 Garc\u00eda-Prat L Mart\u00ednez-Vicente M Perdiguero E Ortet L Rodr\u00edguez-Ubreva J Rebollo E Ruiz-Bonilla V Gutarra S Ballestar E Serrano AL Autophagy maintains stemness by preventing senescence Nature 2016 529 37 42 10.1038/nature16187 26738589 Garrett-Bakelman, F.E., Darshi, M., Green, S.J., Gur, R.C., Lin, L., Macias, B.R., McKenna, M.J., Meydan, C., Mishra, T., Nasrini, J., et al. (2019). The NASA Twins Study: a multidimensional analysis of a year-long human spaceflight. Science 364. Gasior SL Wakeman TP Xu B Deininger PL The human LINE-1 retrotransposon creates DNA double-strand breaks J Mol Biol 2006 357 1383 1393 10.1016/j.jmb.2006.01.089 16490214 Ge Y Gomez NC Adam RC Nikolova M Yang H Verma A Lu CPJ Polak L Yuan S Elemento O Stem cell lineage infidelity drives wound repair and cancer Cell 2017 169 636 650 10.1016/j.cell.2017.03.042 28434617 Geiger H de Haan G Florian MC The ageing haematopoietic stem cell compartment Nat Rev Immunol 2013 13 376 389 10.1038/nri3433 23584423 Geng L Liu Z Wang S Sun S Ma S Liu X Chan P Sun L Song M Zhang W Low-dose quercetin positively regulates mouse healthspan Protein Cell 2019 10 770 775 10.1007/s13238-019-0646-8 31325157 Geng L Liu Z Zhang W Li W Wu Z Wang W Ren R Su Y Wang P Sun L Chemical screen identifies a geroprotective role of quercetin in premature aging Protein Cell 2019 10 417 435 10.1007/s13238-018-0567-y 30069858 Geraci A Calvani R Ferri E Marzetti E Arosio B Cesari M Sarcopenia and menopause: the role of estradiol Front Endocrinol 2021 12 682012 10.3389/fendo.2021.682012 Gerdts J Summers DW Sasaki Y DiAntonio A Milbrandt J Sarm1-mediated axon degeneration requires both SAM and TIR interactions J Neurosci 2013 33 13569 13580 10.1523/JNEUROSCI.1197-13.2013 23946415 Ghanam AR Cao J Ouyang X Song X New insights into chronological mobility of retrotransposons in vivo Oxid Med Cell Longev 2019 2019 1 11 10.1155/2019/2818415 Ghanam AR Xu Q Ke S Azhar M Cheng Q Song X Shining the light on senescence associated lncRNAs Aging Dis 2017 8 149 161 10.14336/AD.2016.0810 28400982 Gibbings SL Thomas SM Atif SM McCubbrey AL Desch AN Danhorn T Leach SM Bratton DL Henson PM Janssen WJ Three unique interstitial macrophages in the murine lung at steady state Am J Respir Cell Mol Biol 2017 57 66 76 10.1165/rcmb.2016-0361OC 28257233 Gielen S Sandri M Kozarez I Kratzsch J Teupser D Thiery J Erbs S Mangner N Lenk K Hambrecht R Exercise training attenuates MuRF-1 expression in the skeletal muscle of patients with chronic heart failure independent of age Circulation 2012 125 2716 2727 10.1161/CIRCULATIONAHA.111.047381 22565934 Gilbert N Lutz-Prigge S Moran JV Genomic deletions created upon LINE-1 retrotransposition Cell 2002 110 315 325 10.1016/S0092-8674(02)00828-0 12176319 Gilson E G\u00e9li V How telomeres are replicated Nat Rev Mol Cell Biol 2007 8 825 838 10.1038/nrm2259 17885666 Gimbel M Qaderdan K Willemsen L Hermanides R Bergmeijer T de Vrey E Heestermans T Tjon Joe Gin M Waalewijn R Hofma S Clopidogrel versus ticagrelor or prasugrel in patients aged 70 years or older with non-ST-elevation acute coronary syndrome (POPular AGE): the randomised, open-label, non-inferiority trial Lancet 2020 395 1374 1381 10.1016/S0140-6736(20)30325-1 32334703 Glasgow SD McPhedrain R Madranges JF Kennedy TE Ruthazer ES Approaches and limitations in the investigation of synaptic transmission and plasticity Front Synaptic Neurosci 2019 11 20 10.3389/fnsyn.2019.00020 31396073 Glass DJ PI3 kinase regulation of skeletal muscle hypertrophy and atrophy Curr Top Microbiol Immunol 2010 346 267 278 20593312 Glass DJ Signaling pathways perturbing muscle mass Curr Opin Clin Nutr Metab Care 2010 13 225 229 10.1097/MCO.0b013e32833862df 20397318 Glisovic T Bachorik JL Yong J Dreyfuss G RNA-binding proteins and post-transcriptional gene regulation FEBS Lett 2008 582 1977 1986 10.1016/j.febslet.2008.03.004 18342629 Gl\u00fcck S Guey B Gulen MF Wolter K Kang TW Schmacke NA Bridgeman A Rehwinkel J Zender L Ablasser A Innate immune sensing of cytosolic chromatin fragments through cGAS promotes senescence Nat Cell Biol 2017 19 1061 1070 10.1038/ncb3586 28759028 Godin LM Sandri BJ Wagner DE Meyer CM Price AP Akinnola I Weiss DJ Panoskaltsis-Mortari A Decreased laminin expression by human lung epithelial cells and fibroblasts cultured in acellular lung scaffolds from aged mice PLoS ONE 2016 11 e0150966 10.1371/journal.pone.0150966 26954258 Golia MT Poggini S Alboni S Garofalo S Ciano Albanese N Viglione A Ajmone-Cat MA St-Pierre A Brunello N Limatola C Interplay between inflammation and neural plasticity: both immune activation and suppression impair LTP and BDNF expression Brain Behav Immun 2019 81 484 494 10.1016/j.bbi.2019.07.003 31279682 Gomes AP Price NL Ling AJY Moslehi JJ Montgomery MK Rajman L White JP Teodoro JS Wrann CD Hubbard BP Declining NAD + induces a pseudohypoxic state disrupting nuclear-mitochondrial communication during aging Cell 2013 155 1624 1638 10.1016/j.cell.2013.11.037 24360282 Gomez Perdiguero E Klapproth K Schulz C Busch K Azzoni E Crozet L Garner H Trouillet C de Bruijn MF Geissmann F Tissue-resident macrophages originate from yolk-sac-derived erythro-myeloid progenitors Nature 2015 518 547 551 10.1038/nature13989 25470051 Gonz\u00e1lez-Rodr\u00edguez P Zampese E Stout KA Guzman JN Ilijic E Yang B Tkatch T Stavarache MA Wokosin DL Gao L Disruption of mitochondrial complex I induces progressive parkinsonism Nature 2021 599 650 656 10.1038/s41586-021-04059-0 34732887 Gonz\u00e1lez A Hall MN Lin SC Hardie DG AMPK and TOR: the Yin and Yang of cellular nutrient sensing and growth control Cell Metab 2020 31 472 492 10.1016/j.cmet.2020.01.015 32130880 Gonzalo S Kreienkamp R DNA repair defects and genome instability in Hutchinson\u2014Gilford Progeria Syndrome Curr Opin Cell Biol 2015 34 75 83 10.1016/j.ceb.2015.05.007 26079711 Gorbunova V Seluanov A Mita P McKerrow W Feny\u00f6 D Boeke J D Linker SB Gage FH Kreiling JA Petrashen AP The role of retrotransposable elements in ageing and age-associated diseases Nature 2021 596 43 53 10.1038/s41586-021-03542-y 34349292 Goukassian D Gad F Yaar M Eller MS Nehal US Gilchrest BA Mechanisms and implications of the age-associated decrease in DNA repair capacity FASEB J 2000 14 1325 1334 10877825 Grabert K Michoel T Karavolos MH Clohisey S Baillie JK Stevens MP Freeman TC Summers KM McColl BW Microglial brain region-dependent diversity and selective regional sensitivities to aging Nat Neurosci 2016 19 504 516 10.1038/nn.4222 26780511 Grammatikakis I Panda AC Abdelmohsen K Gorospe M Long noncoding RNAs (lncRNAs) and the molecular hallmarks of aging Aging 2014 6 992 1009 10.18632/aging.100710 25543668 Gredilla R S\u00e1nchez-Rom\u00e1n I G\u00f3mez A L\u00f3pez-Torres M Barja G Mitochondrial base excision repair positively correlates with longevity in the liver and heart of mammals Geroscience 2020 42 653 665 10.1007/s11357-020-00158-4 31970600 Green CD Huang Y Dou X Yang L Liu Y Han JDJ Impact of dietary interventions on noncoding RNA networks and mRNAs encoding chromatin-related factors Cell Rep 2017 18 2957 2968 10.1016/j.celrep.2017.03.001 28329687 Green CL Lamming DW Fontana L Molecular mechanisms of dietary restriction promoting health and longevity Nat Rev Mol Cell Biol 2022 23 56 73 10.1038/s41580-021-00411-4 34518687 Greendale GA Huang MH Wight RG Seeman T Luetters C Avis NE Johnston J Karlamangla AS Effects of the menopause transition and hormone use on cognitive performance in midlife women Neurology 2009 72 1850 1857 10.1212/WNL.0b013e3181a71193 19470968 Griffith JD Comeau L Rosenfield S Stansel RM Bianchi A Moss H de Lange T Mammalian telomeres end in a large duplex loop Cell 1999 97 503 514 10.1016/S0092-8674(00)80760-6 10338214 Grigorian-Shamagian L Liu W Fereydooni S Middleton RC Valle J Cho JH Marb\u00e1n E Cardiac and systemic rejuvenation after cardiosphere-derived cell therapy in senescent rats Eur Heart J 2017 38 2957 2967 10.1093/eurheartj/ehx454 29020403 Grigoryan A Guidi N Senger K Liehr T Soller K Marka G Vollmer A Markaki Y Leonhardt H Buske C LaminA/C regulates epigenetic and chromatin architecture changes upon aging of hematopoietic stem cells Genome Biol 2018 19 189 10.1186/s13059-018-1557-3 30404662 Grunewald, M., Kumar, S., Sharife, H., Volinsky, E., Gileles-Hillel, A., Licht, T., Permyakova, A., Hinden, L., Azar, S., Friedmann, Y., et al. (2021). Counteracting age-related VEGF signaling insufficiency promotes healthy aging and extends life span. Science 373. Gu K Xu Y Li H Guo Z Zhu S Zhu S Shi P James TD Tian H Zhu WH Real-time tracking and in vivo visualization of \u03b2-galactosidase activity in colorectal tumor with a ratiometric near-infrared fluorescent probe J Am Chem Soc 2016 138 5334 5340 10.1021/jacs.6b01705 27054782 Gu, X., Yao, H., Kwon, I., and Wang, G. (2022). Small-molecule activation of NAMPT as a potential neuroprotective strategy. Life Med, doi: 10.1093/lifemedi/lnac012. Guerrero A Herranz N Sun B Wagner V Gallage S Guiho R Wolter K Pombo J Irvine EE Innes AJ Cardiac glycosides are broad-spectrum senolytics Nat Metab 2019 1 1074 1088 10.1038/s42255-019-0122-z 31799499 Gumucio JP Mendias CL Atrogin-1, MuRF-1 and sarcopenia Endocrine 2013 43 12 21 10.1007/s12020-012-9751-7 22815045 Guo Z Wang G Wu B Chou WC Cheng L Zhou C Lou J Wu D Su L Zheng J DCAF1 regulates Treg senescence via the ROS axis during immunological aging J Clin Investigation 2020 130 5893 5908 10.1172/JCI136466 Gusarov I Shamovsky I Pani B Gautier L Eremina S Katkova-Zhukotskaya O Mironov A Makarov AA Nudler E Dietary thiols accelerate aging of C. elegans Nat Commun 2021 12 4336 10.1038/s41467-021-24634-3 34267196 Gustafsson T Ulfhake B Sarcopenia: what is the origin of this aging-induced disorder? Front Genet 2021 12 688526 10.3389/fgene.2021.688526 34276788 Gutierrez-Salmean G Ciaraldi TP Nogueira L Barboza J Taub PR Hogan MC Henry RR Meaney E Villarreal F Ceballos G Effects of (\u2014)-epicatechin on molecular modulators of skeletal muscle growth and differentiation J Nutral Biochem 2014 25 91 94 10.1016/j.jnutbio.2013.09.007 Hagan CR Sheffield RF Rudin CM Human Alu element retrotransposition induced by genotoxic stress Nat Genet 2003 35 219 220 10.1038/ng1259 14578886 Haldeman GA Croft JB Giles WH Rashidee A Hospitalization of patients with heart failure: National Hospital Discharge Survey, 1985 to 1995 Am Heart J 1999 137 352 360 10.1053/hj.1999.v137.95495 9924171 Hall KY Hart RW Benirschke AK Walford RL Correlation between ultraviolet-induced DNA repair in primate lymphocytes and fibroblasts and species maximum achievable life span Mech Ageing Dev 1984 24 163 173 10.1016/0047-6374(84)90068-X 6717087 Halloran J Hussong SA Burbank R Podlutskaya N Fischer KE Sloane LB Austad SN Strong R Richardson A Hart MJ Chronic inhibition of mammalian target of rapamycin by rapamycin modulates cognitive and non-cognitive components of behavior throughout lifespan in mice Neuroscience 2012 223 102 113 10.1016/j.neuroscience.2012.06.054 22750207 Ham DJ B\u00f6rsch A Lin S Th\u00fcrkauf M Weihrauch M Reinhard J R Delezie J Battilana F Wang X Kaiser MS The neuromuscular junction is a focal point of mTORC1 signaling in sarcopenia Nat Commun 2020 11 4510 10.1038/s41467-020-18140-1 32908143 Hampton T Studies probe role of telomere length in predicting, modulating cancer risk JAMA 2011 305 2278 2279 10.1001/jama.2011.772 21642670 Hamsanathan S Alder JK Sellares J Rojas M Gurkar AU Mora AL Cellular senescence: the trojan horse in chronic lung diseases Am J Respir Cell Mol Biol 2019 61 21 30 10.1165/rcmb.2018-0410TR 30965013 Hamza RZ Al-Harbi MS Al-Hazaa MA Neurological alterations and testicular damages in aging induced by D-galactose and neuro and testicular protective effects of combinations of chitosan nanoparticles, resveratrol and quercetin in male mice Coatings 2021 11 435 10.3390/coatings11040435 Han B Sivaramakrishnan P Lin CCJ Neve IAA He J Tay LW R Sowa JN Sizovs A Du G Wang J Microbial genetic composition tunes host longevity Cell 2018 173 1058 10.1016/j.cell.2018.04.026 29727664 Han JDJ Understanding biological functions through molecular networks Cell Res 2008 18 224 237 10.1038/cr.2008.16 18227860 Han K Sen SK Wang J Callinan PA Lee J Cordaux R Liang P Batzer MA Genomic rearrangements by LINE-1 insertion-mediated deletion in the human and chimpanzee lineages Nucl Acids Res 2005 33 4040 4052 10.1093/nar/gki718 16034026 Han S Zhao BS Myers SA Carr SA He C Ting AY RNA-protein interaction mapping via MS2- or Cas13-based APEX targeting Proc Natl Acad Sci USA 2020 117 22068 22079 10.1073/pnas.2006617117 32839320 Hanahan D Weinberg RA Hallmarks of cancer: the next generation Cell 2011 144 646 674 10.1016/j.cell.2011.02.013 21376230 Hannum G Guinney J Zhao L Zhang L Hughes G Sadda SV Klotzle B Bibikova M Fan JB Gao Y Genome-wide methylation profiles reveal quantitative views of human aging rates Mol Cell 2013 49 359 367 10.1016/j.molcel.2012.10.016 23177740 Hansel C Jendrossek V Klein D Cellular senescence in the lung: the central role of senescent epithelial cells Int J Mol Sci 2020 21 3279 10.3390/ijms21093279 32384619 Hao Y Hao S Andersen-Nissen E Mauck Iii WM Zheng S Butler A Lee MJ Wilk AJ Darby C Zager M Integrated analysis of multimodal single-cell data Cell 2021 184 3573 3587 10.1016/j.cell.2021.04.048 34062119 Hara Y Park CS Janssen WGM Roberts MT Morrison JH Rapp PR Synaptic correlates of memory and menopause in the hippocampal dentate gyrus in rhesus monkeys Neurobiol Aging 2012 33 421.e17 421.e28 10.1016/j.neurobiolaging.2010.09.014 21030115 Hardt, U., Carlberg, K., Klint, E.A., Sahlstr\u00f6m, P., Larsson, L., van Vollenhoven, A., Machado, S.H., Israelsson, L., Amara, K., Chemin, K., et al. (2021). Integrated single cell and spatial transcriptomics reveal autoreactive differentiated B cells in joints of early rheumatoid arthritis. medRxiv, doi: 10.1101/2021.08.09.21260015. Harrison AP Pierzynowski SG Biological effects of 2-oxoglutarate with particular emphasis on the regulation of protein, mineral and lipid absorption/metabolism, muscle performance, kidney function, bone formation and cancerogenesis, all viewed from a healthy ageing perspective state of the art J Physiol Pharmacol 59 Suppl 2008 1 91 106 Harrison DE Strong R Alavez S Astle CM DiGiovanni J Fernandez E Flurkey K Garratt M Gelfond JAL Javors MA Acarbose improves health and lifespan in aging HET3 mice Aging Cell 2019 18 e12898 10.1111/acel.12898 30688027 Harry GJ Microglia during development and aging Pharmacol Ther 2013 139 313 326 10.1016/j.pharmthera.2013.04.013 23644076 Hartmann FJ Mrdjen D McCaffrey E Glass DR Greenwald NF Bharadwaj A Khair Z Verberk SGS Baranski A Baskar R Single-cell metabolic profiling of human cytotoxic T cells Nat Biotechnol 2021 39 186 197 10.1038/s41587-020-0651-8 32868913 Haydont V Bernard BA Fortunel NO Age-related evolutions of the dermis: clinical signs, fibroblast and extracellular matrix dynamics Mech Ageing Dev 2019 177 150 156 10.1016/j.mad.2018.03.006 29548941 Hayflick L The limited in vitro lifetime of human diploid cell strains Exp Cell Res 1965 37 614 636 10.1016/0014-4827(65)90211-9 14315085 Hayflick L Moorhead PS The serial cultivation of human diploid cell strains Exp Cell Res 1961 25 585 621 10.1016/0014-4827(61)90192-6 13905658 Hazra NC Dregan A Jackson S Gulliford MC Differences in health at age 100 according to sex: population-based cohort study of centenarians using electronic health records J Am Geriatr Soc 2015 63 1331 1337 10.1111/jgs.13484 26096699 He H Xu P Zhang X Liao M Dong Q Cong T Tang B Yang X Ye M Chang Y Aging-induced IL27Ra signaling impairs hematopoietic stem cells Blood 2020 136 183 198 10.1182/blood.2019003910 32305041 He L Sabet A Djedjos S Miller R Sun X Hussain MA Radovick S Wondisford FE Metformin and insulin suppress hepatic gluconeogenesis through phosphorylation of CREB binding protein Cell 2009 137 635 646 10.1016/j.cell.2009.03.016 19450513 He, S., Fu, T., Yu, Y., Liang, Q., Li, L., Liu, J., Zhang, X., Zhou, Q., Guo, Q., Xu, D., et al. (2021). IRE1\u03b1 regulates skeletal muscle regeneration through myostatin mRNA decay. J Clin Investigation 131. He X Memczak S Qu J Belmonte JCI Liu GH Single-cell omics in ageing: a young and growing field Nat Metab 2020 2 293 302 10.1038/s42255-020-0196-7 32694606 He YH Chen XQ Yan DJ Xiao FH Lin R Liao XP Liu YW Pu SY Yu Q Sun HP Familial longevity study reveals a significant association of mitochondrial DNA copy number between centenarians and their offspring Neurobiol Aging 2016 47 218.e11 218 10.1016/j.neurobiolaging.2016.07.026 27600867 He YH Lu X Wu H Cai WW Yang LQ Xu LY Sun HP Kong QP Mitochondrial DNA content contributes to healthy aging in Chinese: a study from nonagenarians and centenarians Neurobiol Aging 2014 35 1779.e1 1779.e4 10.1016/j.neurobiolaging.2014.01.015 24524965 Herbig U Ferreira M Condel L Carey D Sedivy JM Cellular senescence in aging primates Science 2006 311 1257 10.1126/science.1122446 16456035 Hernandez-Gonzalez F Faner R Rojas M Agust\u00ed A Serrano M Sellar\u00e9s J Cellular senescence in lung fibrosis Int J Mol Sci 2021 22 7012 10.3390/ijms22137012 34209809 Hernandez-Segura A de Jong TV Melov S Guryev V Campisi J Demaria M Unmasking transcriptional heterogeneity in senescent cells Curr Biol 2017 27 2652 2660 10.1016/j.cub.2017.07.033 28844647 Hernandez-Segura A Nehme J Demaria M Hallmarks of cellular senescence Trends Cell Biol 2018 28 436 453 10.1016/j.tcb.2018.02.001 29477613 Hernando-Herraez I Evano B Stubbs T Commere PH Jan Bonder M Clark S Andrews S Tajbakhsh S Reik W Ageing affects DNA methylation drift and transcriptional cell-to-cell variability in mouse muscle stem cells Nat Commun 2019 10 4361 10.1038/s41467-019-12293-4 31554804 Herranz N Gallage S Mellone M Wuestefeld T Klotz S Hanley C J Raguz S Acosta JC Innes AJ Banito A mTOR regulates MAPKAPK2 translation to control the senescence-associated secretory phenotype Nat Cell Biol 2015 17 1205 1217 10.1038/ncb3225 26280535 Hetz C Zhang K Kaufman RJ Mechanisms, regulation and functions of the unfolded protein response Nat Rev Mol Cell Biol 2020 21 421 438 10.1038/s41580-020-0250-z 32457508 Hinton PS Nigh P Thyfault J Effectiveness of resistance training or jumping-exercise to increase bone mineral density in men with low bone mass: a 12-month randomized, clinical trial Bone 2015 79 203 212 10.1016/j.bone.2015.06.008 26092649 Hitt R Young-Xu Y Silver M Perls T Centenarians: the older you get, the healthier you have been Lancet 1999 354 652 10.1016/S0140-6736(99)01987-X 10466675 Ho TT Warr MR Adelman ER Lansinger OM Flach J Verovskaya EV Figueroa ME Passegu\u00e9 E Autophagy maintains the metabolism and function of young and old stem cells Nature 2017 543 205 210 10.1038/nature21388 28241143 Ho YH M\u00e9ndez-Ferrer S Microenvironmental contributions to hematopoietic stem cell aging Haematologica 2020 105 38 46 10.3324/haematol.2018.211334 31806690 Hoare M Ito Y Kang TW Weekes MP Matheson NJ Patten DA Shetty S Parry AJ Menon S Salama R NOTCH1 mediates a switch between two distinct secretomes during senescence Nat Cell Biol 2016 18 979 992 10.1038/ncb3397 27525720 Hoeijmakers JHJ DNA damage, aging, and cancer N Engl J Med 2009 361 1475 1485 10.1056/NEJMra0804615 19812404 Holzenberger M Dupont J Ducos B Leneuve P G\u00e9lo\u00ebn A Even P C Cervera P Le Bouc Y IGF-1 receptor regulates lifespan and resistance to oxidative stress in mice Nature 2003 421 182 187 10.1038/nature01298 12483226 Holzscheck N S\u00f6hle J Kristof B Gr\u00f6nniger E Gallinat S Wenck H Winnefeld M Falckenhayn C Kaderali L Multiomics network analysis reveals distinct stages in the human aging progression in epidermal tissue Aging 2020 12 12393 12409 10.18632/aging.103499 32554863 Hong X Campanario S Ram\u00edrez-Pardo I Grima-Terr\u00e9n M Isern J Mu\u00f1oz-C\u00e1noves P Stem cell aging in the skeletal muscle: The importance of communication Ageing Res Rev 2022 73 101528 10.1016/j.arr.2021.101528 34818593 Hood DA Memme JM Oliveira AN Triolo M Maintenance of skeletal muscle mitochondria in health, exercise, and aging Annu Rev Physiol 2019 81 19 41 10.1146/annurev-physiol-020518-114310 30216742 Horikawa DD Cumbers J Sakakibara I Rogoff D Leuko S Harnoto R Arakawa K Katayama T Kunieda T Toyoda A Analysis of DNA repair and protection in the tardigrade ramazzottius varieornatus and hypsibius dujardini after exposure to UVC radiation PLoS ONE 2013 8 e64793 10.1371/journal.pone.0064793 23762256 Horvath S DNA methylation age of human tissues and cell types Genome Biol 2013 14 R115 10.1186/gb-2013-14-10-r115 24138928 Horvath S Gurven M Levine ME Trumble BC Kaplan H Allayee H Ritz BR Chen B Lu AT Rickabaugh TM An epigenetic clock analysis of race/ethnicity, sex, and coronary heart disease Genome Biol 2016 17 171 10.1186/s13059-016-1030-0 27511193 Horvath S Haghani A Peng S Hales EN Zoller JA Raj K Larison B Robeck TR Petersen JL Bellone RR DNA methylation aging and transcriptomic studies in horses Nat Commun 2022 13 40 10.1038/s41467-021-27754-y 35013267 Horvath S Raj K DNA methylation-based biomarkers and the epigenetic clock theory of ageing Nat Rev Genet 2018 19 371 384 10.1038/s41576-018-0004-3 29643443 Hou L Wang D Chen D Liu Y Zhang Y Cheng H Xu C Sun N McDermott J Mair WB A systems approach to reverse engineer lifespan extension by dietary restriction Cell Metab 2016 23 529 540 10.1016/j.cmet.2016.02.002 26959186 Howitz KT Bitterman KJ Cohen HY Lamming DW Lavu S Wood JG Zipkin RE Chung P Kisielewski A Zhang LL Small molecule activators of sirtuins extend Saccharomyces cerevisiae lifespan Nature 2003 425 191 196 10.1038/nature01960 12939617 Hsia CCW Hyde DM Ochs M Weibel ER An official research policy statement of the American Thoracic Society/European Respiratory Society: standards for quantitative assessment of lung structure Am J Respir Crit Care Med 2010 181 394 418 10.1164/rccm.200809-1522ST 20130146 Hu H Ji Q Song M Ren J Liu Z Wang Z Liu X Yan K Hu J Jing Y ZKSCAN3 counteracts cellular senescence by stabilizing heterochromatin Nucl Acids Res 2020 48 6001 6018 10.1093/nar/gkaa425 32427330 Huang, L., Sun, T.Y., Hu, L.J., Hu, S.L., Sun, H.M., Zhao, F.Q., Wu, B., Yang, S., Ji, F.Q., and Zhou, D.S. (2020). Elevated miR-124\u20133p in the aging colon disrupts mucus barrier and increases susceptibility to colitis by targeting T-synthase. Aging Cell 19. Huang S Xing Y Liu Y Emerging roles for the ER stress sensor IRE1\u03b1 in metabolic regulation and disease J Biol Chem 2019 294 18726 18741 10.1074/jbc.REV119.007036 31666338 Huang, Y., Liu, D., Wei, X., Huang, C., Li, C., and Zhang, H. (2022). Time-restricted eating on weight loss: implications from the TREATY study. Life Med, doi: 10.1093/lifemedi/lnac017. Hughes RO Bosanac T Mao X Engber TM DiAntonio A Milbrandt J Devraj R Krauss R Small molecule SARM1 inhibitors recapitulate the SARM1 \u2212/\u2212 phenotype and allow recovery of a metastable pool of axons fated to degenerate Cell Rep 2021 34 108588 10.1016/j.celrep.2020.108588 33406435 Hung WW Ross JS Boockvar KS Siu AL Recent trends in chronic disease, impairment and disability among older adults in the United States BMC Geriatr 2011 11 47 10.1186/1471-2318-11-47 21851629 Hurme M Lehtim\u00e4ki T Jylh\u00e4 M Karhunen PJ Hervonen A Interleukin-6\u2013174G/C polymorphism and longevity: a follow-up study Mech Ageing Dev 2005 126 417 418 10.1016/j.mad.2004.10.001 15664628 Hwang IK Lee CH Li H Yoo KY Choi JH Kim DW Kim D W Suh HW Won MH Comparison of ionized calcium-binding adapter molecule 1 immunoreactivity of the hippocampal dentate gyrus and CA1 region in adult and aged dogs Neurochem Res 2008 33 1309 1315 10.1007/s11064-007-9584-6 18270819 Imai SI Armstrong CM Kaeberlein M Guarente L Transcriptional silencing and longevity protein Sir2 is an NAD-dependent histone deacetylase Nature 2000 403 795 800 10.1038/35001622 10693811 Imai Y PINK1-Parkin signaling in Parkinson\u2019s disease: lessons from Drosophila Neurosci Res 2020 159 40 46 10.1016/j.neures.2020.01.016 32035987 Ito K Suda T Metabolic requirements for the maintenance of self-renewing stem cells Nat Rev Mol Cell Biol 2014 15 243 256 10.1038/nrm3772 24651542 Ivanov A Pawlikowski J Manoharan I van Tuyn J Nelson DM Rai TS Shah PP Hewitt G Korolchuk VI Passos JF Lysosome-mediated processing of chromatin in senescence J Cell Biol 2013 202 129 143 10.1083/jcb.201212110 23816621 Jachowicz JW Bing X Pontabry J Bo\u0161kovi\u0107 A Rando OJ Torres-Padilla ME LINE-1 activation after fertilization regulates global chromatin accessibility in the early mouse embryo Nat Genet 2017 49 1502 1510 10.1038/ng.3945 28846101 Jaijyan DK Selariu A Cruz-Cosme R Tong M Yang S Stefa A Kekich D Sadoshima J Herbig U Tang Q New intranasal and injectable gene therapy for healthy life extension Proc Natl Acad Sci USA 2022 119 e2121499119 10.1073/pnas.2121499119 35537048 Jaiswal, S., and Ebert, B.L. (2019). Clonal hematopoiesis in human aging and disease. Science 366. Jang YY Sharkis SJ A low level of reactive oxygen species selects for primitive hematopoietic stem cells that may reside in the low-oxygenic niche Blood 2007 110 3056 3063 10.1182/blood-2007-05-087759 17595331 Jani B Rajkumar C Ageing and vascular ageing Postgraduate Med J 2006 82 357 362 10.1136/pgmj.2005.036053 Jansen R Han LK Verhoeven JE Aberg KA van den Oord EC Milaneschi Y Penninx BW An integrative study of five biological clocks in somatic and mental health eLife 2021 10 e59479 10.7554/eLife.59479 33558008 Janssen SM Lorincz MC Interplay between chromatin marks in development and disease Nat Rev Genet 2022 23 137 153 10.1038/s41576-021-00416-x 34608297 Janssens JP Aging of the respiratory system: impact on pulmonary function tests and adaptation to exertion Clin Chest Med 2005 26 469 484 10.1016/j.ccm.2005.05.004 16140139 Janssens JP Pache JC Nicod LP Physiological changes in respiratory function associated with ageing Eur Respir J 1999 13 197 10.1183/09031936.99.14614549 10836348 Jasper H Intestinal stem cell aging: origins and interventions Annu Rev Physiol 2020 82 203 226 10.1146/annurev-physiol-021119-034359 31610128 Jeon OH Kim C Laberge RM Demaria M Rathod S Vasserot A P Chung JW Kim DH Poon Y David N Local clearance of senescent cells attenuates the development of post-traumatic osteoarthritis and creates a pro-regenerative environment Nat Med 2017 23 775 781 10.1038/nm.4324 28436958 Jeremy M Gurusubramanian G Roy VK Vitamin D3 regulates apoptosis and proliferation in the testis of D-galactose-induced aged rat model Sci Rep 2019 9 14103 10.1038/s41598-019-50679-y 31575929 Ji Z Liu GH Qu J Mitochondrial sirtuins, metabolism, and aging J Genet Genom 2022 49 287 298 10.1016/j.jgg.2021.11.005 Jia K Chen D Riddle DL The TOR pathway interacts with the insulin signaling pathway to regulate C. elegans larval development, metabolism and life span Development 2004 131 3897 3906 10.1242/dev.01255 15253933 Jiang, J., Cheng, L., Yan L., Ge, M., Yang, L., Ying, H., and Kong, Q. (2021). Decoding the role of long noncoding RNAs in the healthy aging of centenarians. Briefings Bioinf 22. Jiang Y Liu T Lee CH Chang Q Yang J Zhang Z The NAD + -mediated self-inhibition mechanism of pro-neurodegenerative SARM1 Nature 2020 588 658 663 10.1038/s41586-020-2862-z 33053563 Jimenez, V., Jambrina, C., Casana, E., Sacristan, V., Mu\u00f1oz, S., Darriba, S., Rod\u00f3, J., Mallol, C., Garcia, M., Le\u00f3n, X., et al. (2018). FGF21 gene therapy as treatment for obesity and insulin resistance. EMBO Mol Med 10. Jin C Li J Green CD Yu X Tang X Han D Xian B Wang D Huang X Cao X Histone demethylase utx-1 regulates C. elegans life span by targeting the insulin/IGF-1 signaling pathway Cell Metab 2011 14 161 172 10.1016/j.cmet.2011.07.001 21803287 Johnson AA Shokhirev MN Lehallier B The protein inputs of an ultra-predictive aging clock represent viable anti-aging drug targets Ageing Res Rev 2021 70 101404 10.1016/j.arr.2021.101404 34242807 Johnson SC Rabinovitch PS Kaeberlein M mTOR is a key modulator of ageing and age-related disease Nature 2013 493 338 345 10.1038/nature11861 23325216 J\u00f6nsson ME Ludvik Bratt\u00e5s P Gustafsson C Petri R Yudovich D Pircs K Verschuere S Madsen S Hansson J Larsson J Activation of neuronal genes via LINE-1 elements upon global DNA demethylation in human neural progenitors Nat Commun 2019 10 3182 10.1038/s41467-019-11150-8 31320637 Josephson AM Bradaschia-Correa V Lee S Leclerc K Patel KS Muinos Lopez E Litwa HP Neibart SS Kadiyala M Wong M Z Age-related inflammation triggers skeletal stem/progenitor cell dysfunction Proc Natl Acad Sci USA 2019 116 6995 7004 10.1073/pnas.1810692116 30894483 Ju YJ Lee KH Park JE Yi YS Yun MY Ham YH Kim TJ Choi HM Han GJ Lee JH Decreased expression of DNA repair proteins Ku70 and Mre11 is associated with aging and may contribute to the cellular senescence Exp Mol Med 2006 38 686 693 10.1038/emm.2006.81 17202845 Jurk D Wang C Miwa S Maddick M Korolchuk V Tsolou A Gonos ES Thrasivoulou C Jill Saffrey M Cameron K Postmitotic neurons develop a p21-dependent senescence-like phenotype driven by a DNA damage response Aging Cell 2012 11 996 1004 10.1111/j.1474-9726.2012.00870.x 22882466 Jyothi HJ Vidyadhara DJ Mahadevan A Philip M Parmar SK Manohari SG Shankar SK Raju TR Alladi PA Aging causes morphological alterations in astrocytes and microglia in human substantia nigra pars compacta NeuroBiol Aging 2015 36 3321 3333 10.1016/j.neurobiolaging.2015.08.024 26433682 Kabaso D Coskren PJ Henry BI Hof PR Wearne SL The electrotonic structure of pyramidal neurons contributing to prefrontal cortical circuits in macaque monkeys is significantly altered in aging Cerebral Cortex 2009 19 2248 2268 10.1093/cercor/bhn242 19150923 Kaeberlein, M., and Galvan, V. (2019). Rapamycin and Alzheimer\u2019s disease: time for a clinical trial? Sci Transl Med 11. Kalfalah F Seggewi\u00df S Walter R Tigges J Moreno-Villanueva M B\u00fcrkle A Ohse S Busch H Boerries M Hildebrandt B Structural chromosome abnormalities, increased DNA strand breaks and DNA strand break repair deficiency in dermal fibroblasts from old female human donors Aging 2015 7 110 122 10.18632/aging.100723 25678531 Kalmbach KH Fontes Antunes DM Dracxler RC Knier TW Seth-Smith ML Wang F Liu L Keefe DL Telomeres and human reproduction Fertility Sterility 2013 99 23 29 10.1016/j.fertnstert.2012.11.039 23273986 Kalstad AA Myhre PL Laake K Tveit SH Schmidt EB Smith P Nilsen DWT Tveit A Fagerland MW Solheim S Effects of n-3 fatty acid supplements in elderly patients after myocardial infarction Circulation 2021 143 528 539 10.1161/CIRCULATIONAHA.120.052209 33191772 Kamilari M J\u00f8rgensen A Schi\u00f8tt M M\u00f8bjerg N Comparative transcriptomics suggest unique molecular adaptations within tardigrade lineages BMC Genomics 2019 20 607 10.1186/s12864-019-5912-x 31340759 Kanaar R Wyman C Rothstein R Quality control of DNA break metabolism: in the \u2018end\u2019, it\u2019s a good thing EMBO J 2008 27 581 588 10.1038/emboj.2008.11 18285819 Kane AE Sinclair DA Sirtuins and NAD + in the development and treatment of metabolic and cardiovascular diseases Circ Res 2018 123 868 885 10.1161/CIRCRESAHA.118.312498 30355082 Kang C Xu Q Martin TD Li MZ Demaria M Aron L Lu T Yankner BA Campisi J Elledge SJ The DNA damage response induces inflammation and senescence by inhibiting autophagy of GATA4 Science 2015 349 aaa5612 10.1126/science.aaa5612 26404840 Kang W Jin T Zhang T Ma S Yan H Liu Z Ji Z Cai Y Wang S Song M OUP accepted manuscript Nucl Acids Res 2021 50 D1085 D1090 Kapahi P Zid BM Harper T Koslover D Sapin V Benzer S Regulation of lifespan in Drosophila by modulation of genes in the TOR signaling pathway Curr Biol 2004 14 885 890 10.1016/j.cub.2004.03.059 15186745 Kapsiani S Howlin BJ Random forest classification for predicting lifespan-extending chemical compounds Sci Rep 2021 11 13812 10.1038/s41598-021-93070-6 34226569 Karakasilioti I Kamileri I Chatzinikolaou G Kosteas T Vergadi E Robinson AR Tsamardinos I Rozgaja TA Siakouli S Tsatsanis C DNA damage triggers a chronic autoinflammatory response, leading to fat depletion in NER progeria Cell Metab 2013 18 403 415 10.1016/j.cmet.2013.08.011 24011075 Karamitsos TD Arvanitaki A Karvounis H Neubauer S Ferreira VM Myocardial tissue characterization and fibrosis by imaging JACC-Cardiovasc Imag 2020 13 1221 1234 10.1016/j.jcmg.2019.06.030 Karlseder J Kachatrian L Takai H Mercer K Hingorani S Jacks T de Lange T Targeted deletion reveals an essential function for the telomere length regulator Trf1 Mol Cell Biol 2003 23 6533 6541 10.1128/MCB.23.18.6533-6541.2003 12944479 Katsuumi G Shimizu I Yoshida Y Minamino T Vascular senescence in cardiovascular and metabolic diseases Front Cardiovasc Med 2018 5 18 10.3389/fcvm.2018.00018 29556500 Katsyuba E Mottis A Zietak M De Franco F van der Velpen V Gariani K Ryu D Cialabrini L Matilainen O Liscio P De novo NAD + synthesis enhances mitochondrial function and improves health Nature 2018 563 354 359 10.1038/s41586-018-0645-6 30356218 Katsyuba E Romani M Hofer D Auwerx J NAD homeostasis in health and disease Nat Metab 2020 2 9 31 10.1038/s42255-019-0161-5 32694684 Kaufman JM Lapauw B Mahmoud A T\u2019Sjoen G Huhtaniemi I T Aging and the male reproductive system Endocrine Rev 2019 40 906 972 10.1210/er.2018-00178 30888401 Kaur A Ecker BL Douglass SM Kugel Iii CH Webster MR Almeida FV Somasundaram R Hayden J Ban E Ahmadzadeh H Remodeling of the collagen matrix in aging skin promotes melanoma metastasis and affects immune cell motility Cancer Discovery 2019 9 64 81 10.1158/2159-8290.CD-18-0193 30279173 Kennedy BK Berger SL Brunet A Campisi J Cuervo AM Epel ES Franceschi C Lithgow GJ Morimoto RI Pessin JE Geroscience: linking aging to chronic disease Cell 2014 159 709 713 10.1016/j.cell.2014.10.039 25417146 Kenyon C Chang J Gensch E Rudner A Tabtiang R A C. elegans mutant that lives twice as long as wild type Nature 1993 366 461 464 10.1038/366461a0 8247153 Kenyon CJ The genetics of ageing Nature 2010 464 504 512 10.1038/nature08980 20336132 Keyes BE Liu S Asare A Naik S Levorse J Polak L Lu CP Nikolova M Pasolli HA Fuchs E Impaired epidermal to dendritic T cell signaling slows wound repair in aged skin Cell 2016 167 1323 1338 10.1016/j.cell.2016.10.052 27863246 Keyes BE Segal JP Heller E Lien WH Chang CY Guo X Oristian DS Zheng D Fuchs E Nfatc1 orchestrates aging in hair follicle stem cells Proc Natl Acad Sci USA 2013 110 E4950 4959 10.1073/pnas.1320301110 24282298 Kikuchi T Morizane A Doi D Magotani H Onoe H Hayashi T Mizuma H Takara S Takahashi R Inoue H Human iPS cell-derived dopaminergic neurons function in a primate Parkinson\u2019s disease model Nature 2017 548 592 596 10.1038/nature23664 28858313 Kim S Bi X Czarny-Ratajczak M Dai J Welsh DA Myers L Welsch MA Cherry KE Arnold J Poon LW Telomere maintenance genes SIRT1 and XRCC6 impact age-related decline in telomere length but only SIRT1 is associated with human longevity Biogerontology 2012 13 119 131 10.1007/s10522-011-9360-5 21972126 Kim WY Sharpless NE The regulation of INK4/ARF in cancer and aging Cell 2006 127 265 275 10.1016/j.cell.2006.10.003 17055429 Kirkland JL Tchkonia T Senolytic drugs: from discovery to translation J Intern Med 2020 288 518 536 10.1111/joim.13141 32686219 Kirwan M Dokal I Dyskeratosis congenita: a genetic disorder of many faces Clin Genet 2008 73 103 112 10.1111/j.1399-0004.2007.00923.x 18005359 Kitzman DW Herrington DM Brubaker PH Moore JB Eggebeen J Haykowsky MJ Carotid arterial stiffness and its relationship to exercise intolerance in older patients with heart failure and preserved ejection fraction Hypertension 2013 61 112 119 10.1161/HYPERTENSIONAHA.111.00163 23150511 Klass MR A method for the isolation of longevity mutants in the nematode Caenorhabditis elegans and initial results Mech Ageing Dev 1983 22 279 286 10.1016/0047-6374(83)90082-9 6632998 Klein HL The consequences of Rad51 overexpression for normal and tumor cells DNA Repair 2008 7 686 693 10.1016/j.dnarep.2007.12.008 18243065 Knight DA Holgate ST The airway epithelium: structural and functional properties in health and disease Respirology 2003 8 432 446 10.1046/j.1440-1843.2003.00493.x 14708552 Koh J Itahana Y Mendenhall IH Low D Soh EXY Guo AK Chionh YT Wang LF Itahana K ABCB1 protects bat cells from DNA damage induced by genotoxic compounds Nat Commun 2019 10 2820 10.1038/s41467-019-10495-4 31249297 Kolora SRR Owens GL Vazquez JM Stubbs A Chatla K Jainese C Seeto K McCrea M Sandel MW Vianna JA Origins and evolution of extreme life span in Pacific Ocean rockfishes Science 2021 374 842 847 10.1126/science.abg5332 34762458 Kong F Deng F Li Y Zhao J Identification of gut microbiome signatures associated with longevity provides a promising modulation target for healthy aging Gut Microbes 2019 10 210 215 10.1080/19490976.2018.1494102 30142010 Kong, M., Guo, L., Xu, W., He, C., Jia, X., Zhao, Z., and Gu, Z. (2022). Aging-associated accumulation of mitochondrial DNA mutations in tumor origin. Life Med, doi: 10.1093/lifemedi/lnac014/6619299. Kong W Wei J Abidi P Lin M Inaba S Li C Wang Y Wang Z Si S Pan H Berberine is a novel cholesterol-lowering drug working through a unique mechanism distinct from statins Nat Med 2004 10 1344 1351 10.1038/nm1135 15531889 Korotkov A Seluanov A Gorbunova V Sirtuin 6: linking longevity with genome and epigenome stability Trends Cell Biol 2021 31 994 1006 10.1016/j.tcb.2021.06.009 34281779 Kovacovicova K Skolnaja M Heinmaa M Mistrik M Pata P Pata I Bartek J Vinciguerra M Senolytic cocktail dasatinib +quercetin (D+Q) does not enhance the efficacy of senescence-inducing chemotherapy in liver cancer Front Oncol 2018 8 459 10.3389/fonc.2018.00459 30425964 Kovtonyuk, L.V., Fritsch, K., Feng, X., Manz, M.G., and Takizawa, H. (2016). Inflamm-aging of hematopoiesis, hematopoietic stem cells, and the bone marrow microenvironment. Front Immunol 7. Kraig E Linehan LA Liang H Romo TQ Liu Q Wu Y Benavides AD Curiel TJ Javors MA Musi N A randomized control trial to establish the feasibility and safety of rapamycin treatment in an older human cohort: immunological, physical performance, and cognitive effects Exp Gerontol 2018 105 53 69 10.1016/j.exger.2017.12.026 29408453 Kraytsberg Y Kudryavtseva E McKee AC Geula C Kowall NW Khrapko K Mitochondrial DNA deletions are abundant and cause functional impairment in aged human substantia nigra neurons Nat Genet 2006 38 518 520 10.1038/ng1778 16604072 Krukowski K Nolan A Frias ES Boone M Ureta G Grue K Paladini MS Elizarraras E Delgado L Bernales S Small molecule cognitive enhancer reverses age-related memory decline in mice eLife 2020 9 e62048 10.7554/eLife.62048 33258451 Ku HH Brunk UT Sohal RS Relationship between mitochondrial superoxide and hydrogen peroxide production and longevity of mammalian species Free Radical Biol Med 1993 15 621 627 10.1016/0891-5849(93)90165-Q 8138188 Kubben N Zhang W Wang L Voss TC Yang J Qu J Liu GH Misteli T Repression of the antioxidant NRF2 pathway in premature aging Cell 2016 165 1361 1374 10.1016/j.cell.2016.05.017 27259148 Kuilman T Michaloglou C Vredeveld LCW Douma S van Doorn R Desmet CJ Aarden LA Mooi WJ Peeper DS Oncogene-induced senescence relayed by an interleukin-dependent inflammatory network Cell 2008 133 1019 1031 10.1016/j.cell.2008.03.039 18555778 Kurosu H Yamamoto M Clark JD Pastor JV Nandi A Gurnani P McGuinness OP Chikuda H Yamaguchi M Kawaguchi H Suppression of aging in mice by the hormone Klotho Science 2005 309 1829 1833 10.1126/science.1112766 16123266 Kusumbe AP Ramasamy SK Adams RH Coupling of angiogenesis and osteogenesis by a specific vessel subtype in bone Nature 2014 507 323 328 10.1038/nature13145 24646994 Kuswanto W Burzyn D Panduro M Wang KK Jang YC Wagers AJ Benoist C Mathis D Poor repair of skeletal muscle in aging mice reflects a defect in local, interleukin-33-dependent accumulation of regulatory T cells Immunity 2016 44 355 367 10.1016/j.immuni.2016.01.009 26872699 Kwon JH Moon KM Min KW Exercise-induced myokines can explain the importance of physical activity in the elderly: an overview Healthcare 2020 8 378 10.3390/healthcare8040378 33019579 Laberge RM Sun Y Orjalo AV Patil CK Freund A Zhou L Curran SC Davalos AR Wilson-Edell KA Liu S MTOR regulates the pro-tumorigenic senescence-associated secretory phenotype by promoting IL1A translation Nat Cell Biol 2015 17 1049 1061 10.1038/ncb3195 26147250 Lalley PM The aging respiratory system\u2014pulmonary structure, function and neural control Respiratory Physiol NeuroBiol 2013 187 199 210 10.1016/j.resp.2013.03.012 Lam YY Peterson CM Ravussin E Resveratrol vs. calorie restriction: data from rodents to humans Exp Gerontol 2013 48 1018 1024 10.1016/j.exger.2013.04.005 23624181 Lamming DW Ye L Katajisto P Goncalves MD Saitoh M Stevens DM Davis JG Salmon AB Richardson A Ahima RS Rapamycin-induced insulin resistance is mediated by mTORC2 loss and uncoupled from longevity Science 2012 335 1638 1643 10.1126/science.1215135 22461615 LaRocca TJ Gioscia-Ryan RA Hearon CM Jr Seals DR The autophagy enhancer spermidine reverses arterial aging Mech Ageing Dev 2013 134 314 320 10.1016/j.mad.2013.04.004 23612189 Latz E Duewell P NLRP3 inflammasome activation in inflammaging Semin Immunol 2018 40 61 73 10.1016/j.smim.2018.09.001 30268598 Lautrup S Sinclair DA Mattson MP Fang EF NAD + in brain aging and neurodegenerative disorders Cell Metab 2019 30 630 655 10.1016/j.cmet.2019.09.001 31577933 Le R Huang Y Zhang Y Wang H Lin J Dong Y Li Z Guo M Kou X Zhao Y Dcaf11 activates Zscan4-mediated alternative telomere lengthening in early embryos and embryonic stem cells Cell Stem Cell 2021 28 732 747 10.1016/j.stem.2020.11.018 33357405 Lee JH Shamanna RA Kulikowicz T Borhan Fakouri N Kim EW Christiansen LS Croteau DL Bohr VA CDK2 phosphorylation of Werner protein (WRN) contributes to WRN\u2019s DNA double-strand break repair pathway choice Aging Cell 2021 20 e13484 10.1111/acel.13484 34612580 Lee JJ Lee JH Ko YG Hong SI Lee JS Prevention of premature senescence requires JNK regulation of Bcl-2 and reactive oxygen species Oncogene 2010 29 561 575 10.1038/onc.2009.355 19855432 Lee SH Lee JH Lee HY Min KJ Sirtuin signaling in cellular senescence and aging BMB Rep 2019 52 24 34 10.5483/BMBRep.2019.52.1.290 30526767 Lee YS Kim WS Kim KH Yoon MJ Cho HJ Shen Y Ye JM Lee CH Oh WK Kim CT Berberine, a natural plant product, activates AMP-activated protein kinase with beneficial metabolic effects in diabetic and insulin-resistant states Diabetes 2006 55 2256 2264 10.2337/db06-0006 16873688 Lee YW Arora R Wischnewski H Azzalin CM TRF1 participates in chromosome end protection by averting TRF2-dependent telomeric R loops Nat Struct Mol Biol 2018 25 147 153 10.1038/s41594-017-0021-5 29358759 Lehallier B Gate D Schaum N Nanasi T Lee SE Yousef H Moran Losada P Berdnik D Keller A Verghese J Undulating changes in human plasma proteome profiles across the lifespan Nat Med 2019 25 1843 1850 10.1038/s41591-019-0673-2 31806903 Lei J Wang S Kang W Chu Q Liu Z Sun L Ji Y Esteban CR Yao Y Belmonte JCI FOXO3-engineered human mesenchymal progenitor cells efficiently promote cardiac repair after myocardial infarction Protein Cell 2021 12 145 151 10.1007/s13238-020-00779-7 32809106 Leidal AM Levine B Debnath J Autophagy and the cell biology of age-related disease Nat Cell Biol 2018 20 1338 1348 10.1038/s41556-018-0235-8 30482941 Leng, S.X., and Pawelec, G. (2022). Single-cell immune atlas for human aging and frailty. Life Med, doi: 10.1093/lifemedi/lnac013. Leon, K.E., Buj, R., Lesko, E., Dahl, E.S., Chen, C.W., Tangudu, N.K., Imamura-Kawasawa, Y., Kossenkov, A.V., Hobbs, R.P., and Aird, K.M. (2021). DOT1L modulates the senescence-associated secretory phenotype through epigenetic regulation of IL1A. J Cell Biol 220. Levine JM Clinical aspects of aging skin: considerations for the wound care practitioner Adv Skin Wound Care 2020 33 12 19 10.1097/01.ASW.0000613532.25408.8b 31856028 Lew LC Hor YY Jaafar MH Lau ASY Lee BK Chuah LO Yap KP Azlan A Azzam G Choi SB Lactobacillus strains alleviated hyperlipidemia and liver steatosis in aging rats via activation of AMPK Int J Mol Sci 2020 21 5872 10.3390/ijms21165872 32824277 Li CJ Lin LT Tsai HW Chern CU Wen ZH Wang PH Tsui KH The molecular regulation in the pathophysiology in ovarian aging Aging Dis 2021 12 934 949 10.14336/AD.2020.1113 34094652 Li CJ Xiao Y Sun YC He WZ Liu L Huang M He C Huang M Chen KX Hou J Senescent immune cells release grancalcin to promote skeletal aging Cell Metab 2021 33 1957 1973 10.1016/j.cmet.2021.08.009 34614408 Li F Kim H Ji Z Zhang T Chen B Ge Y Hu Y Feng X Han X Xu H The BUB3-BUB1 complex promotes telomere DNA replication Mol Cell 2018 70 395 407 10.1016/j.molcel.2018.03.032 29727616 Li G Zhu Q Wang B Luo R Xiao X Zhang Y Ma L Feng X Huang J Sun X Rejuvenation of senescent bone marrow mesenchymal stromal cells by pulsed triboelectric stimulation Adv Sci 2021 8 2100964 10.1002/advs.202100964 Li, H., Chen, Q., Li, C., Zhong, R., Zhao, Y., Zhang, Q., Tong, W., Zhu, D., and Zhang, Y. (2019a). Muscle-secreted granulocyte colony-stimulating factor functions as metabolic niche factor ameliorating loss of muscle stem cells in aged mice. EMBO J 38. Li HY Wang XC Xu YM Luo NC Luo S Hao XY Cheng S Y Fang JS Wang Q Zhang SJ Berberine improves diabetic encephalopathy through the SIRT1/ER stress pathway in db/db mice Rejuvenat Res 2018 21 200 209 10.1089/rej.2017.1972 Li J Zheng Y Yan P Song M Wang S Sun L Liu Z Ma S Izpisua Belmonte JC Chan P A single-cell transcriptomic atlas of primate pancreatic islet aging Natl Sci Rev 2021 8 nwaa127 10.1093/nsr/nwaa127 34691567 Li JSZ Miralles Fust\u00e9 J Simavorian T Bartocci C Tsai J Karlseder J Lazzerini Denchi E TZAP: a telomere-associated protein involved in telomere length control Science 2017 355 638 641 10.1126/science.aah6752 28082411 Li T Zhou ZW Ju Z Wang ZQ DNA damage response in hematopoietic stem cell ageing Genomics Proteomics BioInf 2016 14 147 154 10.1016/j.gpb.2016.04.002 Li W Zou Z Cai Y Yang K Wang S Liu Z Geng L Chu Q Ji Z Chan P Low-dose chloroquine treatment extends the lifespan of aged rats Protein Cell 2022 13 454 461 10.1007/s13238-021-00903-1 35023015 Li X Ploner A Wang Y Magnusson PK Reynolds C Finkel D Pedersen NL Jylh\u00e4v\u00e4 J H\u00e4gg S Longitudinal trajectories, correlations and mortality associations of nine biological ages across 20-years follow-up eLife 2020 9 e51507 10.7554/eLife.51507 32041686 Li X Zhang J Li D He C He K Xue T Wan L Zhang C Liu Q Astrocytic ApoE reprograms neuronal cholesterol metabolism and histone-acetylation-mediated memory Neuron 2021 109 957 970 10.1016/j.neuron.2021.01.005 33503410 Li Y Jiang Y Paxman J O\u2019Laughlin R Klepin S Zhu Y Pillus L Tsimring LS Hasty J Hao N A programmable fate decision landscape underlies single-cell aging in yeast Science 2020 369 325 329 10.1126/science.aax9552 32675375 Li Y Li L Wu J Zhu Z Feng X Qin L Zhu Y Sun L Liu Y Qiu Z Activation of astrocytes in hippocampus decreases fear memory through adenosine A1 receptors eLife 2020 9 e57155 10.7554/eLife.57155 32869747 Li Y Wang WJ Cao H Lu J Wu C Hu FY Guo J Zhao L Yang F Zhang YX Genetic association of FOXO1A and FOXO3A with longevity trait in Han Chinese populations Hum Mol Genet 2009 18 4897 4904 10.1093/hmg/ddp459 19793722 Li Y Zhang W Chang L Han Y Sun L Gong X Tang H Liu Z Deng H Ye Y Vitamin C alleviates aging defects in a stem cell model for Werner syndrome Protein Cell 2016 7 478 488 10.1007/s13238-016-0278-1 27271327 Li Z Nie L Chen L Sun Y Li G Rapamycin relieves inflammation of experimental autoimmune encephalomyelitis by altering the balance of Treg/Th17 in a mouse model Neurosci Lett 2019 705 39 45 10.1016/j.neulet.2019.04.035 31004709 Li Z Zhang W Chen Y Guo W Zhang J Tang H Xu Z Zhang H Tao Y Wang F Impaired DNA double-strand break repair contributes to the age-associated rise of genomic instability in humans Cell Death Differ 2016 23 1765 1777 10.1038/cdd.2016.65 27391797 Lian J Yue Y Yu W Zhang Y Immunosenescence: a key player in cancer development J Hematol Oncol 2020 13 151 10.1186/s13045-020-00986-z 33168037 Liang, C., Ke, Q., Liu, Z., Ren, J., Zhang, W., Hu, J., Wang, Z., Chen, H., Xia, K., Lai, X., et al. (2022). OUP accepted manuscript. Nucl Acids Res, doi: 10.1093/nar/gkac146. Liang C Liu Z Song M Li W Wu Z Wang Z Wang Q Wang S Yan K Sun L Stabilization of heterochromatin by CLOCK promotes stem cell rejuvenation and cartilage regeneration Cell Res 2021 31 187 205 10.1038/s41422-020-0385-7 32737416 Liao M Chen R Yang Y He H Xu L Jiang Y Guo Z He W Jiang H Wang J Aging-elevated inflammation promotes DNMT3A R878H-driven clonal hematopoiesis Acta Pharmaceut Sin B 2022 12 678 691 10.1016/j.apsb.2021.09.015 Liddelow SA Guttenplan KA Clarke LE Bennett FC Bohlen CJ Schirmer L Bennett ML M\u00fcnch AE Chung WS Peterson TC Neurotoxic reactive astrocytes are induced by activated microglia Nature 2017 541 481 487 10.1038/nature21029 28099414 Likova LT Mineff KN Nicholas SC Mental visualization in the cerebellum: rapid non-motor learning at sub-lobular and causal network levels Front Syst Neurosci 2021 15 655514 10.3389/fnsys.2021.655514 34566588 Lin, Q., Wu, L., Ma, Z., Chowdhury,1, F.A., Mazumder, H.H., and Du, W. (2020). Persistent DNA damage-induced NLRP12 improves hematopoietic stem cell function. JCI Insight 5. Linnane AW Ozawa T Marzuki S Tanaka M Mitochondrial DNA mutations as an important contributor to ageing and degenerative diseases Lancet 1989 333 642 645 10.1016/S0140-6736(89)92145-4 Litvi\u0148ukov\u00e1 M Talavera-L\u00f3pez C Maatz H Reichart D Worth CL Lindberg EL Kanda M Polanski K Heinig M Lee M Cells of the adult human heart Nature 2020 588 466 472 10.1038/s41586-020-2797-4 32971526 Liu, G., Fu, J., and Cao, N. (2022a). Chemical evocation of human cell plasticity\u2014twist of cell fates by small molecules. Life Med, doi: 10.1093/lifemedi/lnac010/6619289. Liu GH Barkho BZ Ruiz S Diep D Qu J Yang SL Panopoulos AD Suzuki K Kurian L Walsh C Recapitulation of premature ageing with iPSCs from Hutchinson-Gilford progeria syndrome Nature 2011 472 221 225 10.1038/nature09879 21346760 Liu GH Suzuki K Li M Qu J Montserrat N Tarantino C Gu Y Yi F Xu X Zhang W Modelling Fanconi anemia pathogenesis and therapeutics using integration-free patient-derived iPSCs Nat Commun 2014 5 4330 10.1038/ncomms5330 24999918 Liu J Hong X Wang L Liang CY Liu JP Sir4 deficiency reverses cell senescence by sub-telomere recombination Cells 2021 10 778 10.3390/cells10040778 33915984 Liu J Wang L Wang Z Liu JP Roles of telomere biology in cell senescence, replicative and chronological ageing Cells 2019 8 54 10.3390/cells8010054 30650660 Liu JJ Crous-Bou M Giovannucci E De Vivo I Coffee consumption is positively associated with longer leukocyte telomere length in the nurses\u2019 health study J Nutr 2016 146 1373 1378 10.3945/jn.116.230490 27281805 Liu L Charville GW Cheung TH Yoo B Santos PJ Schroeder M Rando TA Impaired notch signaling leads to a decrease in p53 activity and mitotic catastrophe in aged muscle stem cells Cell Stem Cell 2018 23 544 556 10.1016/j.stem.2018.08.019 30244867 Liu L Cheung TH Charville GW Hurgo BMC Leavitt T Shih J Brunet A Rando TA Chromatin modifications as determinants of muscle stem cell quiescence and chronological aging Cell Rep 2013 4 189 204 10.1016/j.celrep.2013.05.043 23810552 Liu L Wang H Xu GL Liu L Tet1 deficiency leads to premature ovarian failure Front Cell Dev Biol 2021 9 644135 10.3389/fcell.2021.644135 33834024 Liu N Matsumura H Kato T Ichinose S Takada A Namiki T Asakawa K Morinaga H Mohri Y De Arcangelis A Stem cell competition orchestrates skin homeostasis and ageing Nature 2019 568 344 350 10.1038/s41586-019-1085-7 30944469 Liu, X., Hartman, C.L., Li, L., Albert, C.J., Si, F., Gao, A., Huang, L., Zhao, Y., Lin, W., Hsueh, E.C., et al. (2021d). Reprogramming lipid metabolism prevents effector T cell senescence and enhances tumor immunotherapy. Sci Transl Med 13. Liu X Hoft DF Peng G Senescent T cells within suppressive tumor microenvironments: emerging target for tumor immunotherapy J Clin Investigation 2020 130 1073 1083 10.1172/JCI133679 Liu X Liu M Tang C Xiang Z Li Q Ruan X Xiong K Zheng L Overexpression of Nmnat improves the adaption of health span in aging Drosophila Exp Gerontol 2018 108 276 283 10.1016/j.exger.2018.04.026 29727704 Liu, X., Liu, Z., Sun, L., Ren, J., Wu, Z., Jiang, X., Ji, Q., Wang, Q., Fan, Y., Cai, Y., et al. (2021e). Resurrection of human endogenous retro-viruses during aging reinforces senescence. bioRxiv, doi: 10.1101/2021.02.22.432260. Liu X Mo W Ye J Li L Zhang Y Hsueh EC Hoft DF Peng G Regulatory T cells trigger effector T cell DNA damage and senescence caused by metabolic competition Nat Commun 2018 9 249 10.1038/s41467-017-02689-5 29339767 Liu, X., Song, Z., Li, Y., Yao, Y., Fang, M., Bai, C., An, P., Chen, H., Chen, Z., Tang, B., et al. (2021f). Integrated genetic analyses revealed novel human longevity loci and reduced risks of multiple diseases in a cohort study of 15,651 Chinese individuals. Aging Cell 20. Liu Y Wang Y Rusinol AE Sinensky MS Liu J Shell SM Zou Y Involvement of xeroderma pigmentosum group A (XPA) in progeria arising from defective maturation of prelamin A FASEB J 2008 22 603 611 10.1096/fj.07-8598com 17848622 Liu Y Yang M Deng Y Su G Enninful A Guo CC Tebaldi T Zhang D Kim D Bai Z High-spatial-resolution multi-omics sequencing via deterministic barcoding in tissue Cell 2020 183 1665 1681 10.1016/j.cell.2020.10.026 33188776 Liu YJ McIntyre RL Janssens GE Houtkooper RH Mitochondrial fission and fusion: a dynamic role in aging and potential target for age-related disease Mech Ageing Dev 2020 186 111212 10.1016/j.mad.2020.111212 32017944 Liu Z Chen M Chen S Deng J Song Y Lai L Li Z Highly efficient RNA-guided base editing in rabbit Nat Commun 2018 9 2717 10.1038/s41467-018-05232-2 30006570 Liu Z Belmonte JCI Zhang W Qu J Liu GH Deciphering aging at three-dimensional genomic resolution Cell Insight 2022 1 100034 10.1016/j.cellin.2022.100034 Liu Z Ji Q Ren J Yan P Wu Z Wang S Sun L Wang Z Li J Sun G Large-scale chromatin reorganization reactivates placenta-specific genes that drive cellular aging Dev Cell 2022 57 1347 1368 10.1016/j.devcel.2022.05.004 35613614 Liu Z Ji Z Wang S Zhang W Qu J Liu GH Ectopic resurrection of embryonic/developmental genes in aging Curr Med 2022 1 11 10.1007/s44194-022-00013-y Liu Z Li W Geng L Sun L Wang Q Yu Y Yan P Liang C Ren J Song M Cross-species metabolomic analysis identifies uridine as a potent regeneration promoting factor Cell Discov 2022 8 6 10.1038/s41421-021-00361-3 35102134 Lliberos C Liew SH Mansell A Hutt KJ The inflammasome contributes to depletion of the ovarian reserve during aging in mice Front Cell Dev Biol 2020 8 628473 10.3389/fcell.2020.628473 33644037 Lodato MA Rodin RE Bohrson CL Coulter ME Barton AR Kwon M Sherman MA Vitzthum CM Luquette LJ Yandava C N Aging and neurodegeneration are associated with increased mutations in single human neurons Science 2018 359 555 559 10.1126/science.aao4426 29217584 Loos B Klionsky DJ Wong E Augmenting brain metabolism to increase macro- and chaperone-mediated autophagy for decreasing neuronal proteotoxicity and aging Prog Neurobiol 2017 156 90 106 10.1016/j.pneurobio.2017.05.001 28502807 L\u00f3pez-Ot\u00edn C Blasco MA Partridge L Serrano M Kroemer G The hallmarks of aging Cell 2013 153 1194 1217 10.1016/j.cell.2013.05.039 23746838 L\u00f3pez-Ot\u00edn C Kroemer G Hallmarks of health Cell 2021 184 33 63 10.1016/j.cell.2020.11.034 33340459 Lourenco MV Frozza RL de Freitas GB Zhang H Kincheski GC Ribeiro FC Gon\u00e7alves RA Clarke JR Beckman D Staniszewski A Exercise-linked FNDC5/irisin rescues synaptic plasticity and memory defects in Alzheimer\u2019s models Nat Med 2019 25 165 175 10.1038/s41591-018-0275-4 30617325 Lowery EM Brubaker AL Kuhlmann E Kovacs EJ The aging lung CIA 2013 8 1489 1496 Lozano-Torres B Blandez JF Galiana I Lopez-Dominguez JA Rovira M Paez-Ribes M Gonz\u00e1lez-Gualda E Mu\u00f1oz-Esp\u00edn D Serrano M Sancen\u00f3n F A two-photon probe based on naphthalimide-styrene fluorophore for the in vivo tracking of cellular senescence Anal Chem 2021 93 3052 3060 10.1021/acs.analchem.0c05447 33502178 Lozano-Torres B Galiana I Rovira M Garrido E Chaib S Bernardos A Mu\u00f1oz-Esp\u00edn D Serrano M Mart\u00ednez-M\u00e1\u00f1ez R Sancen\u00f3n F An off-on two-photon fluorescent probe for tracking cell senescence in vivo J Am Chem Soc 2017 139 8808 8811 10.1021/jacs.7b04985 28625064 Lu Y Brommer B Tian X Krishnan A Meer M Wang C Vera D L Zeng Q Yu D Bonkowski MS Reprogramming to recover youthful epigenetic information and restore vision Nature 2020 588 124 129 10.1038/s41586-020-2975-4 33268865 Lu Z Xie Y Huang H Jiang K Zhou B Wang F Chen T Hair follicle stem cells regulate retinoid metabolism to maintain the self-renewal niche for melanocyte stem cells eLife 2020 9 e52712 10.7554/eLife.52712 31898934 Luis NM Wang L Ortega M Deng H Katewa SD Li PWL Karpac J Jasper H Kapahi P Intestinal IRE1 is required for increased triglyceride metabolism and longer lifespan under dietary restriction Cell Rep 2016 17 1207 1216 10.1016/j.celrep.2016.10.003 27783936 Lujambio A Akkari L Simon J Grace D Tschaharganeh DF Bolden JE Zhao Z Thapar V Joyce JA Krizhanovsky V Non-cell-autonomous tumor suppression by p53 Cell 2013 153 449 460 10.1016/j.cell.2013.03.020 23562644 Lukjanenko L Jung MJ Hegde N Perruisseau-Carrier C Migliavacca E Rozo M Karaz S Jacot G Schmidt M Li L Loss of fibronectin from the aged stem cell niche affects the regenerative capacity of skeletal muscle in mice Nat Med 2016 22 897 905 10.1038/nm.4126 27376579 Lukjanenko L Karaz S Stuelsatz P Gurriaran-Rodriguez U Michaud J Dammone G Sizzano F Mashinchian O Ancel S Migliavacca E Aging disrupts muscle stem cell function by impairing matricellular WISP1 secretion from fibro-adipogenic progenitors Cell Stem Cell 2019 24 433 446 10.1016/j.stem.2018.12.014 30686765 Lukonin I Serra D Challet Meylan L Volkmann K Baaten J Zhao R Meeusen S Colman K Maurer F Stadler MB Phenotypic landscape of intestinal organoid regeneration Nature 2020 586 275 280 10.1038/s41586-020-2776-9 33029001 Luo Z Zhang R Hu T Zhu Y Wu Y Li W Zhang Z Yao X Liang H Song X NicE-C efficiently reveals open chromatin-associated chromosome interactions at high resolution Genome Res 2022 32 534 544 10.1101/gr.275986.121 35105668 Ma S Sun S Li J Fan Y Qu J Sun L Wang S Zhang Y Yang S Liu Z Single-cell transcriptomic atlas of primate cardiopulmonary aging Cell Res 2021 31 415 432 10.1038/s41422-020-00412-6 32913304 Ma S Sun S Geng L Song M Wang W Ye Y Ji Q Zou Z Wang S He X Caloric restriction reprograms the single-cell transcriptional landscape of rattus norvegicus aging Cell 2020 180 984 1001 10.1016/j.cell.2020.02.008 32109414 Ma S Wang S Ye Y Ren J Chen R Li W Li J Zhao L Zhao Q Sun G Heterochronic parabiosis induces stem cell revitalization and systemic rejuvenation across aged tissues Cell Stem Cell 2022 29 990 1005 10.1016/j.stem.2022.04.017 35613617 Majumder S Caccamo A Medina DX Benavides AD Javors MA Kraig E Strong R Richardson A Oddo S Lifelong rapamycin administration ameliorates age-dependent cognitive deficits by reducing IL-1\u03b2 and enhancing NMDA signaling Aging Cell 2012 11 326 335 10.1111/j.1474-9726.2011.00791.x 22212527 Malaquin N Martinez A Rodier F Keeping the senescence secretome under control: molecular reins on the senescence-associated secretory phenotype Exp Gerontol 2016 82 39 49 10.1016/j.exger.2016.05.010 27235851 Mamdani F Rollins B Morgan L Myers RM Barchas JD Schatzberg AF Watson SJ Akil H Potkin SG Bunney WE Variable telomere length across post-mortem human brain regions and specific reduction in the hippocampus of major depressive disorder Transl Psychiatry 2015 5 e636 10.1038/tp.2015.134 26371764 Mandal PK Blanpain C Rossi DJ DNA damage response in adult stem cells: pathways and consequences Nat Rev Mol Cell Biol 2011 12 198 202 10.1038/nrm3060 21304553 Mani C Reddy PH Palle K DNA repair fidelity in stem cell maintenance, health, and disease Biochim Biophys Acta 2020 1866 165444 10.1016/j.bbadis.2019.03.017 Mansour AAF Gon\u00e7alves JT Bloyd CW Li H Fernandes S Quang D Johnston S Parylak SL Jin X Gage FH An in vivo model of functional and vascularized human brain organoids Nat Biotechnol 2018 36 432 441 10.1038/nbt.4127 29658944 Mao T Shao M Qiu Y Huang J Zhang Y Song B Wang Q Jiang L Liu Y Han JDJ PKA phosphorylation couples hepatic inositol-requiring enzyme 1\u03b1 to glucagon signaling in glucose metabolism Proc Natl Acad Sci USA 2011 108 15852 15857 10.1073/pnas.1107394108 21911379 Markham JA McKian KP Stroup TS Juraska JM Sexually dimorphic aging of dendritic morphology in CA1 of hippocampus Hippocampus 2005 15 97 103 10.1002/hipo.20034 15390161 Markiewicz-Potoczny M Lobanova A Loeb AM Kirak O Olbrich T Ruiz S Lazzerini Denchi E TRF2-mediated telomere protection is dispensable in pluripotent stem cells Nature 2021 589 110 115 10.1038/s41586-020-2959-4 33239785 Marques-Rocha JL Milagro FI Mansego ML Mour\u00e3o DM Mart\u00ednez JA Bressan J LINE-1 methylation is positively associated with healthier lifestyle but inversely related to body fat mass in healthy young individuals Epigenetics 2016 11 49 60 10.1080/15592294.2015.1135286 26786189 Marschallinger J Iram T Zardeneta M Lee SE Lehallier B Haney MS Pluvinage JV Mathur V Hahn O Morgens DW Lipid-droplet-accumulating microglia represent a dysfunctional and proinflammatory state in the aging brain Nat Neurosci 2020 23 194 208 10.1038/s41593-019-0566-1 31959936 Marsh E Gonzalez DG Lathrop EA Boucher J Greco V Positional stability and membrane occupancy define skin fibroblast homeostasis in vivo Cell 2018 175 1620 1633 10.1016/j.cell.2018.10.013 30415836 Martel J Ojcius DM Wu CY Peng HH Voisin L Perfettini JL Ko YF Young JD Emerging use of senolytics and senomorphics against aging and chronic diseases Med Res Rev 2020 40 2114 2131 10.1002/med.21702 32578904 Martin-Gallausiaux C Marinelli L Blotti\u00e8re HM Larraufie P Lapaque N SCFA: mechanisms and functional importance in the gut Proc Nutr Soc 2021 80 37 49 10.1017/S0029665120006916 32238208 Martin-Montalvo A Mercken EM Mitchell SJ Palacios HH Mote PL Scheibye-Knudsen M Gomes AP Ward TM Minor RK Blouin MJ Metformin improves healthspan and lifespan in mice Nat Commun 2013 4 2192 10.1038/ncomms3192 23900241 Mart\u00edn-Ram\u00edrez R Gonz\u00e1lez-Fern\u00e1ndez R Rotoli D Hern\u00e1ndez J Mart\u00edn-Vasallo P Palumbo A \u00c1vila J Celastrol prevents oxidative stress effects on FSHR, PAPP, and CYP19A1 gene expression in cultured human granulosa-lutein cells Int J Mol Sci 2021 22 3596 10.3390/ijms22073596 33808393 Martin M Dotti CG Ledesma MD Brain cholesterol in normal and pathological aging Biochim Biophys Acta 2010 1801 934 944 10.1016/j.bbalip.2010.03.011 20359547 Martincorena I Campbell PJ Somatic mutation in cancer and normal cells Science 2015 349 1483 1489 10.1126/science.aab4082 26404825 Mart\u00ednez G Duran-Aniotz C Cabral-Miranda F Vivar JP Hetz C Endoplasmic reticulum proteostasis impairment in aging Aging Cell 2017 16 615 623 10.1111/acel.12599 28436203 Martins R Lithgow GJ Link W Long live FOXO: unraveling the role of FOXO proteins in aging and longevity Aging Cell 2016 15 196 207 10.1111/acel.12427 26643314 Martyn JAJ Kaneki M Muscle atrophy and the sestrins N Engl J Med 2020 383 1279 1282 10.1056/NEJMcibr2003528 32966727 Matai L Sarkar GC Chamoli M Malik Y Kumar SS Rautela U Jana NR Chakraborty K Mukhopadhyay A Dietary restriction improves proteostasis and increases life span through endoplasmic reticulum hormesis Proc Natl Acad Sci USA 2019 116 17383 17392 10.1073/pnas.1900055116 31413197 Matsumura H Mohri Y Binh NT Morinaga H Fukuda M Ito M Kurata S Hoeijmakers J Nishimura EK Hair follicle aging is driven by transepidermal elimination of stem cells via COL17A1 proteolysis Science 2016 351 aad4395 10.1126/science.aad4395 26912707 Mattes K Vellenga E Schepers H Differential redox-regulation and mitochondrial dynamics in normal and leukemic hematopoietic stem cells: a potential window for leukemia therapy Crit Rev Oncol Hematol 2019 144 102814 10.1016/j.critrevonc.2019.102814 31593878 Mattson MP Arumugam TV Hallmarks of brain aging: adaptive and pathological modification by metabolic states Cell Metab 2018 27 1176 1199 10.1016/j.cmet.2018.05.011 29874566 Mattson MP Magnus T Ageing and neuronal vulnerability Nat Rev Neurosci 2006 7 278 294 10.1038/nrn1886 16552414 Matzkin ME Calandra RS Rossi SP Bartke A Frungieri MB Hallmarks of testicular aging: the challenge of anti-inflammatory and antioxidant therapies using natural and/or pharmacological compounds to improve the physiopathological status of the aged male gonad Cells 2021 10 3114 10.3390/cells10113114 34831334 Maynard S Keijzers G Akbari M Ezra MB Hall A Morevati M Scheibye-Knudsen M Gonzalo S Bartek J Bohr VA Lamin A/C promotes DNA base excision repair Nucl Acids Res 2019 47 11709 11728 31647095 McCarthy CG Wenceslau CF Webb RC Joe B Novel contributors and mechanisms of cellular senescence in hypertension-associated premature vascular aging Am J Hypertension 2019 32 709 719 10.1093/ajh/hpz052 McCartney DL Stevenson AJ Walker RM Gibson J Morris SW Campbell A Murray AD Whalley HC Porteous DJ McIntosh AM Investigating the relationship between DNA methylation age acceleration and risk factors for Alzheimer\u2019s disease Alzheimers Dement 2018 10 429 437 McCauley BS Sun L Yu R Lee M Liu H Leeman DS Huang Y Webb AE Dang W Altered chromatin states drive cryptic transcription in aging mammalian stem cells Nat Aging 2021 1 684 697 10.1038/s43587-021-00091-x 34746802 McDonald AI Shirali AS Arag\u00f3n R Ma F Hernandez G Vaughn DA Mack JJ Lim TY Sunshine H Zhao P Endothelial regeneration of large vessels is a biphasic process driven by local cells with distinct proliferative capacities Cell Stem Cell 2018 23 210 225 10.1016/j.stem.2018.07.011 30075129 McGee EA Hsueh AJW Initial and cyclic recruitment of ovarian follicles Endocr Rev 2000 21 200 214 10782364 McLaughlin T Falkowski M Park JW Keegan S Elliott M Wang JJ Zhang SX Loss of XBP1 accelerates age-related decline in retinal function and neurodegeneration Mol Neurodegener 2018 13 16 10.1186/s13024-018-0250-z 29615095 McNairn AJ Chuang CH Bloom JC Wallace MD Schimenti JC Female-biased embryonic death from inflammation induced by genomic instability Nature 2019 567 105 108 10.1038/s41586-019-0936-6 30787433 McNeil JJ Wolfe R Woods RL Tonkin AM Donnan GA Nelson MR Reid CM Lockery JE Kirpach B Storey E Effect of aspirin on cardiovascular events and bleeding in the healthyelderly N Engl J Med 2018 379 1509 1518 10.1056/NEJMoa1805819 30221597 McPherron AC Lawler AM Lee SJ Regulation of skeletal muscle mass in mice by a new TGF-p superfamily member Nature 1997 387 83 90 10.1038/387083a0 9139826 McTavish KJ Jimenez M Walters KA Spaliviero J Groome NP Themmen AP Visser JA Handelsman DJ Allan CM Rising follicle-stimulating hormone levels with age accelerate female reproductive failure Endocrinology 2007 148 4432 4439 10.1210/en.2007-0046 17540727 Mendelsohn ME Protective effects of estrogen on the cardiovascular system Am J Cardiol 2002 89 12 17 10.1016/S0002-9149(02)02405-0 11779515 Mender I Zhang A Ren Z Han C Deng Y Siteni S Li H Zhu J Vemula A Shay JW Telomere stress potentiates STING-dependent anti-tumor immunity Cancer Cell 2020 38 400 411 10.1016/j.ccell.2020.05.020 32619407 Mendez-Bermudez A Giraud-Panis MJ Ye J Gilson E Heterochromatin replication goes hand in hand with telomere protection Nat Struct Mol Biol 2020 27 313 318 10.1038/s41594-020-0400-1 32231287 Mendez-Bermudez A Lototska L Bauwens S Giraud-Panis MJ Croce O Jamet K Irizar A Mowinckel M Koundrioukoff S Nottet N Genome-wide control of heterochromatin replication by the telomere capping protein TRF2 Mol Cell 2018 70 449 461 10.1016/j.molcel.2018.03.036 29727617 Menon R Richardson LS Lappas M Fetal membrane architecture, aging and inflammation in pregnancy and parturition Placenta 2019 79 40 45 10.1016/j.placenta.2018.11.003 30454905 Mi L Hu J Li N Gao J Huo R Peng X Zhang N Liu Y Zhao H Liu R The mechanism of stem cell aging Stem Cell Rev Rep 2022 18 1281 1293 10.1007/s12015-021-10317-5 35000109 Michiels CF Kurdi A Timmermans JP De Meyer GRY Martinet W Spermidine reduces lipid accumulation and necrotic core formation in atherosclerotic plaques via induction of autophagy Atherosclerosis 2016 251 319 327 10.1016/j.atherosclerosis.2016.07.899 27450786 Mijit M Caracciolo V Melillo A Amicarelli F Giordano A Role of p53 in the regulation of cellular senescence Biomolecules 2020 10 420 10.3390/biom10030420 32182711 Milanovic M Fan DNY Belenki D D\u00e4britz JHM Zhao Z Yu Y D\u00f6rr JR Dimitrova L Lenze D Monteiro Barbosa IA Senescence-associated reprogramming promotes cancer stemness Nature 2018 553 96 100 10.1038/nature25167 29258294 Milde S Adalbert R Elaman MH Coleman MP Axonal transport declines with age in two distinct phases separated by a period of relative stability Neurobiol Aging 2015 36 971 981 10.1016/j.neurobiolaging.2014.09.018 25443288 Miller KN Clark JP Anderson RM Mitochondrial regulator PGC-1a\u2014modulating the modulator Curr Opin Endocrine Metab Res 2019 5 37 44 10.1016/j.coemr.2019.02.002 31406949 Miller KN Victorelli SG Salmonowicz H Dasgupta N Liu T Passos JF Adams PD Cytoplasmic DNA: sources, sensing, and role in aging and disease Cell 2021 184 5506 5526 10.1016/j.cell.2021.09.034 34715021 Miller RA Harrison DE Astle CM Baur JA Boyd AR de Cabo R Fernandez E Flurkey K Javors MA Nelson JF Rapamycin, but not resveratrol or simvastatin, extends life span of genetically heterogeneous mice Js Gerontol-Ser A 66A 2011 191 201 Miller RA Harrison DE Astle CM Fernandez E Flurkey K Han M Javors MA Li X Nadon NL Nelson JF Rapamycin-mediated lifespan increase in mice is dose and sex dependent and metabolically distinct from dietary restriction Aging Cell 2014 13 468 477 10.1111/acel.12194 24341993 Min, B., Jeon, K., Park, J.S., and Kang, Y.K. (2019). Demethylation and derepression of genomic retroelements in the skeletal muscles of aged mice. Aging Cell 18. Min KJ Yamamoto R Buch S Pankratz M Tatar M Drosophila lifespan control by dietary restriction independent of insulin-like signaling Aging Cell 2008 7 199 206 10.1111/j.1474-9726.2008.00373.x 18221413 Minamino T Komuro I Vascular cell senescence Circ Res 2007 100 15 26 10.1161/01.RES.0000256837.40544.4a 17204661 Minhas PS Latif-Hernandez A McReynolds MR Durairaj AS Wang Q Rubin A Joshi AU He JQ Gauba E Liu L Restoring metabolism of myeloid cells reverses cognitive decline in ageing Nature 2021 590 122 128 10.1038/s41586-020-03160-0 33473210 Mirman Z Lottersberger F Takai H Kibe T Gong Y Takai K Bianchi A Zimmermann M Durocher D de Lange T 53BP1-RIF1-shieldin counteracts DSB resection through CST- and Pol\u03b1-dependent fill-in Nature 2018 560 112 116 10.1038/s41586-018-0324-7 30022158 Mishina T Tabata N Hayashi T Yoshimura M Umeda M Mori M Ikawa Y Hamada H Nikaido I Kitajima TS Single-oocyte transcriptome analysis reveals aging-associated effects influenced by life stage and calorie restriction Aging Cell 2021 20 e13428 10.1111/acel.13428 34245092 Mita P Sun X Feny\u00f6 D Kahler DJ Li D Agmon N Wudzinska A Keegan S Bader JS Yun C BRCA1 and S phase DNA repair pathways restrict LINE-1 retrotransposition in human cells Nat Struct Mol Biol 2020 27 179 191 10.1038/s41594-020-0374-z 32042152 Miyamoto S Nuclear initiated NF-\u03baB signaling: NEMO and ATM take center stage Cell Res 2011 21 116 130 10.1038/cr.2010.179 21187855 Miyata, K., Imai, Y., Hori, S., Nishio, M., Loo, T.M., Okada, R., Yang, L., Nakadai, T., Maruyama, R., Fujii, R., et al. (2021). Pericentromeric noncoding RNA changes DNA binding of CTCF and inflammatory gene expression in senescence and cancer. Proc Natl Acad Sci USA 118. Moffitt JR Bambah-Mukku D Eichhorn SW Vaughn E Shekhar K Perez JD Rubinstein ND Hao J Regev A Dulac C Molecular, spatial, and functional single-cell profiling of the hypothalamic preoptic region Science 2018 362 792 10.1126/science.aau5324 Mohrin M Bourke E Alexander D Warr MR Barry-Holson K Le Beau MM Morrison CG Passegu\u00e9 E Hematopoietic stem cell quiescence promotes error-prone DNA repair and mutagenesis Cell Stem Cell 2010 7 174 185 10.1016/j.stem.2010.06.014 20619762 Molmen HE Wisloff U Aamot IL Stoylen A Ingul CB Aerobic interval training compensates age related decline in cardiac function Scand Cardiovasc J 2012 46 163 171 10.3109/14017431.2012.660192 22273242 Mongelli A Barbi V Gottardi Zamperla M Atlante S Forleo L Nesta M Massetti M Pontecorvi A Nanni S Farsetti A Evidence for biological age acceleration and telomere shortening in COVID-19 survivors Int J Mol Sci 2021 22 6151 10.3390/ijms22116151 34200325 Morinaga H Mohri Y Grachtchouk M Asakawa K Matsumura H Oshima M Takayama N Kato T Nishimori Y Sorimachi Y Obesity accelerates hair thinning by stem cell-centric converging mechanisms Nature 2021 595 266 271 10.1038/s41586-021-03624-x 34163066 Morris BJ Willcox BJ Donlon TA Genetic and epigenetic regulation of human aging and longevity Biochim Biophys Acta 2019 1865 1718 1744 10.1016/j.bbadis.2018.08.039 Morrison JH Baxter MG The ageing cortical synapse: hallmarks and implications for cognitive decline Nat Rev Neurosci 2012 13 240 250 10.1038/nrn3200 22395804 Morrison SJ Scadden DT The bone marrow niche for haematopoietic stem cells Nature 2014 505 327 334 10.1038/nature12984 24429631 Moskalev A Chernyagina E de Magalh\u00e3es JP Barardo D Thoppil H Shaposhnikov M Budovsky A Fraifeld VE Garazha A Tsvetkov V Geroprotectors.org: a new, structured and curated database of current therapeutic interventions in aging and age-related disease Aging 2015 7 616 628 10.18632/aging.100799 26342919 Moslehi J DePinho RA Sahin E Telomeres and mitochondria in the aging heart Circ Res 2012 110 1226 1237 10.1161/CIRCRESAHA.111.246868 22539756 Mottis A Herzig S Auwerx J Mitocellular communication: shaping health and disease Science 2019 366 827 832 10.1126/science.aax3768 31727828 Mouchiroud L Houtkooper RH Moullan N Katsyuba E Ryu D Cant\u00f3 C Mottis A Jo YS Viswanathan M Schoonjans K The NAD + /sirtuin pathway modulates longevity through activation of mitochondrial UPR and FOXO signaling Cell 2013 154 430 441 10.1016/j.cell.2013.06.016 23870130 Mourikis P Sambasivan R Castel D Rocheteau P Bizzarro V Tajbakhsh S A critical requirement for notch signaling in maintenance of the quiescent skeletal muscle stem cell state Stem Cells 2012 30 243 252 10.1002/stem.775 22069237 Mu\u00f1oz-Esp\u00edn D Ca\u00f1amero M Maraver A G\u00f3mez-L\u00f3pez G Contreras J Murillo-Cuesta S Rodr\u00edguez-Baeza A Varela-Nieto I Ruberte J Collado M Programmed cell senescence during mammalian embryonic development Cell 2013 155 1104 1118 10.1016/j.cell.2013.10.019 24238962 Mu\u00f1oz-Esp\u00edn D Serrano M Cellular senescence: from physiology to pathology Nat Rev Mol Cell Biol 2014 15 482 496 10.1038/nrm3823 24954210 Mu\u00f1oz P Blanco R Flores JM Blasco MA XPF nuclease-dependent telomere loss and increased DNA damage in mice overexpressing TRF2 result in premature aging and cancer Nat Genet 2005 37 1063 1071 10.1038/ng1633 16142233 Muotri AR Chu T B Marchetto MCN Deng W Moran JV Gage FH Somatic mosaicism in neuronal precursor cells mediated by L1 retrotransposition Nature 2005 435 903 910 10.1038/nature03663 15959507 Muotri AR Marchetto MCN Coufal NG Oefner R Yeo G Nakashima K Gage FH L1 retrotransposition in neurons is modulated by MeCP2 Nature 2010 468 443 446 10.1038/nature09544 21085180 Naikawadi RP Green G Jones KD Achtar-Zadeh N Mieleszko J E Arnould I Kukreja J Greenland JR Wolters PJ Airway epithelial telomere dysfunction drives remodeling similar to chronic lung allograft dysfunction Am J Respir Cell Mol Biol 2020 63 490 501 10.1165/rcmb.2019-0374OC 32551854 Nakagawa S FitzHarris G Intrinsically defective microtubule dynamics contribute to age-related chromosome segregation errors in mouse oocyte meiosis-I Curr Biol 2017 27 1040 1047 10.1016/j.cub.2017.02.025 28376326 Nakamura-Ishizu A Ito K Suda T Hematopoietic stem cell metabolism during development and aging Dev Cell 2020 54 239 255 10.1016/j.devcel.2020.06.029 32693057 Nakamura-Ishizu A Takizawa H Suda T The analysis, roles and regulation of quiescence in hematopoietic stem cells Development 2014 141 4656 4666 10.1242/dev.106575 25468935 Nakashima Y Chen YX Kinukawa N Sueishi K Distributions of diffuse intimal thickening in human arteries: preferential expression in atherosclerosis-prone arteries from an early age Virchows Arch 2002 441 279 288 10.1007/s00428-002-0605-1 12242525 Nandakumar J Bell CF Weidenfeld I Zaug AJ Leinwand LA Cech TR The TEL patch of telomere protein TPP1 mediates telomerase recruitment and processivity Nature 2012 492 285 289 10.1038/nature11648 23103865 Nargund AM Pellegrino MW Fiorese CJ Baker BM Haynes CM Mitochondrial import efficiency of ATFS-1 regulates mitochondrial UPR activation Science 2012 337 587 590 10.1126/science.1223560 22700657 Nassour J Martien S Martin N Deruy E Tomellini E Malaquin N Bouali F Sabatier L Wernert N Pinte S Defective DNA single-strand break repair is responsible for senescence and neoplastic escape of epithelial cells Nat Commun 2016 7 10399 10.1038/ncomms10399 26822533 Navrotskaya V Oxenkrug G Vorobyova L Summergrad P Berberine attenuated aging-accelerating effect of high temperature in Drosophila model AJPS 2014 05 275 278 10.4236/ajps.2014.53037 Neff F Flores-Dominguez D Ryan DP Horsch M Schr\u00f6der S Adler T Afonso LC Aguilar-Pimentel JA Becker L Garrett L Rapamycin extends murine lifespan but has limited effects on aging J Clin Invest 2013 123 3272 3291 10.1172/JCI67674 23863708 Negishi-Koga T Shinohara M Komatsu N Bito H Kodama T Friedel RH Takayanagi H Suppression of bone formation by osteoclastic expression of semaphorin 4D Nat Med 2011 17 1473 1480 10.1038/nm.2489 22019888 Nemet I Saha PP Gupta N Zhu W Romano KA Skye SM Cajka T Mohan ML Li L Wu Y A cardiovascular disease-linked gut microbial metabolite acts via adrenergic receptors Cell 2020 180 862 877 10.1016/j.cell.2020.02.016 32142679 Ni Z Ebata A Alipanahiramandi E Lee SS Two SET domain containing genes link epigenetic changes and aging in Caenorhabditis elegans Aging Cell 2012 11 315 325 10.1111/j.1474-9726.2011.00785.x 22212395 Nielsen J Systems biology of metabolism: a driver for developing personalized and precision medicine Cell Metab 2017 25 572 579 10.1016/j.cmet.2017.02.002 28273479 Nilsson M Sundh D Mellstr\u00f6m D Lorentzon M Current physical activity is independently associated with cortical bone size and bone strength in elderly swedish women J Bone Miner Res 2017 32 473 485 10.1002/jbmr.3006 27676223 Nishimura EK Granter SR Fisher DE Mechanisms of hair graying: incomplete melanocyte stem cell maintenance in the niche Science 2005 307 720 724 10.1126/science.1099593 15618488 Niu Y Na L Feng R Gong L Zhao Y Li Q Li Y Sun C The phytochemical, EGCG, extends lifespan by reducing liver and kidney function damage and improving age-associated inflammation and oxidative stress in healthy rats Aging Cell 2013 12 1041 1049 10.1111/acel.12133 23834676 Noroozi R Ghafouri-Fard S Pisarek A Rudnicka J Sp\u00f3lnicka M Branicki W Taheri M Po\u015bpiech E DNA methylation-based age clocks: from age prediction to age reversion Ageing Res Rev 2021 68 101314 10.1016/j.arr.2021.101314 33684551 Nunnari J Suomalainen A Mitochondria: in sickness and in health Cell 2012 148 1145 1159 10.1016/j.cell.2012.02.035 22424226 O\u2019Toole PW Jeffery IB Gut microbiota and aging Science 2015 350 1214 1215 10.1126/science.aac8469 26785481 Oberdoerffer P Michan S McVay M Mostoslavsky R Vann J Park SK Hartlerode A Stegmuller J Hafner A Loerch P SIRT1 redistribution on chromatin promotes genomic stability but alters gene expression during aging Cell 2008 135 907 918 10.1016/j.cell.2008.10.025 19041753 Ocampo A Reddy P Martinez-Redondo P Platero-Luengo A Hatanaka F Hishida T Li M Lam D Kurita M Beyret E In vivo amelioration of age-associated hallmarks by partial reprogramming Cell 2016 167 1719 1733 10.1016/j.cell.2016.11.052 27984723 Oh ES Petronis A Origins of human disease: the chrono-epigenetic perspective Nat Rev Genet 2021 22 533 546 10.1038/s41576-021-00348-6 33903745 Oh J Lee YD Wagers AJ Stem cell aging: mechanisms, regulators and therapeutic opportunities Nat Med 2014 20 870 880 10.1038/nm.3651 25100532 Oh J Sinha I Tan KY Rosner B Dreyfuss JM Gjata O Tran P Shoelson SE Wagers AJ Age-associated NF-\u03baB signaling in myofibers alters the satellite cell niche and re-strains muscle stem cell function Aging 2016 8 2871 2896 10.18632/aging.101098 27852976 Okumura K Akao M Yoshida T Kawata M Okazaki O Akashi S Eshima K Tanizawa K Fukuzawa M Hayashi T Low-dose edoxaban in very elderly patients with atrial fibrillation N Engl J Med 2020 383 1735 1745 10.1056/NEJMoa2012883 32865374 Olajuyin AM Zhang X Ji HL Alveolar type 2 progenitor cells for lung injury repair Cell Death Discov 2019 5 63 10.1038/s41420-019-0147-9 30774991 Olova N Simpson DJ Marioni RE Chandra T Partial reprogramming induces a steady decline in epigenetic age before loss of somatic identity Aging Cell 2019 18 e12877 10.1111/acel.12877 30450724 Onishi M Yamano K Sato M Matsuda N Okamoto K Molecular mechanisms and physiological functions of mitophagy EMBO J 2021 40 e104705 10.15252/embj.2020104705 33438778 Orjalo AV Bhaumik D Gengler BK Scott GK Campisi J Cell surface-bound IL-1\u03b1 is an upstream regulator of the senescence-associated IL-6/IL-8 cytokine network Proc Natl Acad Sci USA 2009 106 17031 17036 10.1073/pnas.0905299106 19805069 Ortega-Mart\u00ednez M Rodr\u00edguez-Flores LE Ancer-Arellano A Cerda-Flores RM de-la-Garza-Gonz\u00e1lez C Ancer-Rodr\u00edguez J Jaramillo-Rangel G Analysis of cell turnover in the bronchiolar epithelium through the normal aging process Lung 2016 194 581 587 10.1007/s00408-016-9890-3 27164984 Osterloh JM Yang J Rooney TM Fox AN Adalbert R Powell E H Sheehan AE Avery MA Hackett R Logan MA dSarm/Sarm1 is required for activation of an injury-induced axon death pathway Science 2012 337 481 484 10.1126/science.1223899 22678360 Owusu-Ansah E Song W Perrimon N Muscle mitohormesis promotes longevity via systemic repression of insulin signaling Cell 2013 155 699 712 10.1016/j.cell.2013.09.021 24243023 Ozasa N Morimoto T Bao B Shioi T Kimura T Effects of machine-assisted cycling on exercise capacity and endothelial function in elderly patients with heart failure Circ J 2012 76 1889 1894 10.1253/circj.CJ-11-1113 22664754 Page M Factors affecting surgical risk in elderly patients with inflammatory bowel disease J Gastrointest Surg 2002 6 606 613 10.1016/S1091-255X(01)00060-9 12127128 Page MM Stuart JA Activities of DNA base excision repair enzymes in liver and brain correlate with body mass, but not lifespan Age 2012 34 1195 1209 10.1007/s11357-011-9302-9 21853261 Pal S Tyler JK Epigenetics and aging Sci Adv 2016 2 e1600584 10.1126/sciadv.1600584 27482540 Palm W de Lange T How shelterin protects mammalian telomeres Annu Rev Genet 2008 42 301 334 10.1146/annurev.genet.41.110306.130350 18680434 P\u00e1lovics R Keller A Schaum N Tan W Fehlmann T Borja M Kern F Bonanno L Calcuttawala K Webber J Molecular hallmarks of heterochronic parabiosis at single-cell resolution Nature 2022 603 309 314 10.1038/s41586-022-04461-2 35236985 Pan H Cai N Li M Liu GH Izpisua Belmonte JC Autophagic control of cell \u201cstemness\u201d EMBO Mol Med 2013 5 327 331 10.1002/emmm.201201999 23495139 Paneni F Volpe M L\u00fcscher TF Cosentino F SIRT1, p66Shc, and Set7/9 in vascular hyperglycemic memory: bringing all the strands together Diabetes 2013 62 1800 1807 10.2337/db12-1648 23704521 Papazoglu C Mills AA p53: at the crossroad between cancer and ageing J Pathol 2007 211 124 133 10.1002/path.2086 17200941 Parikh JD Hollingsworth KG Kunadian V Blamire A MacGowan GA Measurement of pulse wave velocity in normal ageing: comparison of Vicorder and magnetic resonance phase contrast imaging BMC Cardiovasc Disord 2016 16 50 10.1186/s12872-016-0224-4 26892669 Park SU Walsh L Berkowitz KM Mechanisms of ovarian aging Reproduction 2021 162 R19 R33 10.1530/REP-21-0022 33999842 Partridge L Alic N Bjedov I Piper MDW Ageing in Drosophila : the role of the insulin/Igf and TOR signalling network Exp Gerontology 2011 46 376 381 10.1016/j.exger.2010.09.003 Partridge L Deelen J Slagboom PE Facing up to the global challenges of ageing Nature 2018 561 45 56 10.1038/s41586-018-0457-8 30185958 Partridge L Fuentealba M Kennedy BK The quest to slow ageing through drug discovery Nat Rev Drug Discov 2020 19 513 532 10.1038/s41573-020-0067-7 32467649 Paschalis EP Fratzl P Gamsjaeger S Hassler N Brozek W Eriksen EF Rauch F Glorieux FH Shane E Dempster D Aging versus postmenopausal osteoporosis: bone composition and maturation kinetics at actively-forming trabecular surfaces of female subjects aged 1 to 84 years J Bone Miner Res 2016 31 347 357 10.1002/jbmr.2696 26308158 Paschalis V Nikolaidis MG Theodorou AA Panayiotou G Fatouros IG Koutedakis Y Jamurtas AZ A weekly bout of eccentric exercise is sufficient to induce health-promoting effects Med Sci Sports Exercise 2011 43 64 73 10.1249/MSS.0b013e3181e91d90 Passarino G Calignano C Vallone A Franceschi C Jeune B Robine JM Yashin AI Cavalli Sforza LL De Benedictis G Male/female ratio in centenarians: a possible role played by population genetic structure Exp Gerontology 2002 37 1283 1289 10.1016/S0531-5565(02)00140-7 Passarino G De Rango F Montesanto A Human longevity: genetics or lifestyle? It takes two to tango Immun Ageing 2016 13 12 10.1186/s12979-016-0066-z 27053941 Pavlidis N Stanta G Audisio RA Cancer prevalence and mortality in centenarians: a systematic review Crit Rev Oncol Hematol 2012 83 145 152 10.1016/j.critrevonc.2011.09.007 22024388 Pawlikowska L Hu D Huntsman S Sung A Chu C Chen J Joyner AH Schork NJ Hsueh WC Reiner AP Association of common genetic variation in the insulin/IGF1 signaling pathway with human longevity Aging Cell 2009 8 460 472 10.1111/j.1474-9726.2009.00493.x 19489743 Pearson KJ Baur JA Lewis KN Peshkin L Price NL Labinskyy N Swindell WR Kamara D Minor RK Perez E Resveratrol delays age-related deterioration and mimics transcriptional aspects of dietary restriction without extending life span Cell Metab 2008 8 157 168 10.1016/j.cmet.2008.06.011 18599363 Pellicori P Ferreira JP Mariottoni B Brunner-La Rocca HP Ahmed FZ Verdonschot J Collier T Cuthbert JJ Petutschnigg J Mujaj B Effects of spironolactone on serum markers of fibrosis in people at high risk of developing heart failure: rationale, design and baseline characteristics of a proof-of-concept, randomised, precision-medicine, prevention trial. The Heart OMics in AGing (HOMAGE) trial Eur J Heart Fail 2020 22 1711 1723 10.1002/ejhf.1716 31950604 Peng JC Karpen GH H3K9 methylation and RNA interference regulate nucleolar organization and repeated DNA stability Nat Cell Biol 2007 9 25 35 10.1038/ncb1514 17159999 Penney J Ralvenius WT Tsai LH Modeling Alzheimer\u2019s disease with iPSC-derived brain cells Mol Psychiatry 2020 25 148 167 10.1038/s41380-019-0468-3 31391546 Pereira BI De Maeyer RPH Covre LP Nehar-Belaid D Lanna A Ward S Marches R Chambers ES Gomes DCO Riddell NE Sestrins induce natural killer function in senescent-like CD8 + T cells Nat Immunol 2020 21 684 694 10.1038/s41590-020-0643-3 32231301 Perez, K., McGirr, J., Limbad, C., Doi, R., Nederveen, J.P., Nilsson, M.I., Tarnopolsky, M., Campisi, J., and Melov, S. (2021). Single nuclei profiling identifies cell specific markers of skeletal muscle aging, sarcopenia and senescence. medRxiv, doi: 10.1101/2021.01.22.21250336. Perheentupa A Huhtaniemi I Aging of the human ovary and testis Mol Cell Endocrinol 2009 299 2 13 10.1016/j.mce.2008.11.004 19059459 Perls TT Male centenarians: how and why are they different from their female counterparts? J Am Geriatr Soc 2017 65 1904 1906 10.1111/jgs.14978 28586117 Perls TT Wilmoth J Levenson R Drinkwater M Cohen M Bogan H Joyce E Brewster S Kunkel L Puca A Life-long sustained mortality advantage of siblings of centenarians Proc Natl Acad Sci USA 2002 99 8442 8447 10.1073/pnas.122587599 12060785 Pertynska-Marczewska M Diamanti-Kandarakis E Aging ovary and the role for advanced glycation end products Menopause 2017 24 345 351 10.1097/GME.0000000000000755 27749734 Peters-Hall JR Min J Tedone E Sho S Siteni S Mender I Shay JW Proliferation of adult human bronchial epithelial cells without a telomere maintenance mechanism for over 200 population doublings FASEB J 2020 34 386 398 10.1096/fj.201902376R 31914653 Peters MJ Joehanes R Pilling LC Schurmann C Conneely KN Powell J Reinmaa E Sutphin GL Zhernakova A Schramm K The transcriptional landscape of age in human peripheral blood Nat Commun 2015 6 8570 10.1038/ncomms9570 26490707 Petitjean A Mathe E Kato S Ishioka C Tavtigian SV Hainaut P Olivier M Impact of mutant p53 functional properties on TP53 mutation patterns and tumor phenotype: lessons from recent developments in the IARC TP53 database Hum Mutat 2007 28 622 629 10.1002/humu.20495 17311302 Petkovich DA Podolskiy DI Lobanov AV Lee SG Miller RA Gladyshev VN Using DNA methylation profiling to evaluate biological age and longevity interventions Cell Metab 2017 25 954 960 10.1016/j.cmet.2017.03.016 28380383 Pi\u00f1eiro-Hermida S Autilio C Mart\u00ednez P Bosch F P\u00e9rez-Gil J Blasco MA Telomerase treatment prevents lung profibrotic pathologies associated with physiological aging J Cell Biol 2020 219 e202002120 10.1083/jcb.202002120 32777016 Pluvinage JV Wyss-Coray T Systemic factors as mediators of brain homeostasis, ageing and neurodegeneration Nat Rev Neurosci 2020 21 93 102 10.1038/s41583-019-0255-9 31913356 Pouikli A Parekh S Maleszewska M Nikopoulou C Baghdadi M Tripodi I Folz-Donahue K Hinze Y Mesaros A Hoey D Chromatin remodeling due to degradation of citrate carrier impairs osteogenesis of aged mesenchymal stem cells Nat Aging 2021 1 810 825 10.1038/s43587-021-00105-8 Povedano JM Martinez P Flores JM Mulero F Blasco MA Mice with pulmonary fibrosis driven by telomere dysfunction Cell Rep 2015 12 286 299 10.1016/j.celrep.2015.06.028 26146081 Povedano JM Martinez P Serrano R Tejera \u00c1 G\u00f3mez-L\u00f3pez G Bobadilla M Flores JM Bosch F Blasco MA Therapeutic effects of telomerase in mice with pulmonary fibrosis induced by damage to the lungs and short telomeres eLife 2018 7 e31299 10.7554/eLife.31299 29378675 Powers RW III Kaeberlein M Caldwell SD Kennedy BK Fields S Extension of chronological life span in yeast by decreased TOR pathway signaling Genes Dev 2006 20 174 184 10.1101/gad.1381406 16418483 Preston AR Eichenbaum H Interplay of hippocampus and prefrontal cortex in memory Curr Biol 2013 23 R764 R773 10.1016/j.cub.2013.05.041 24028960 Priyadarshini M Wicksteed B Schiltz GE Gilchrist A Layden BT SCFA receptors in pancreatic \u03b2 cells: novel diabetes targets Trends Endocrinol Metab 2016 27 653 664 10.1016/j.tem.2016.03.011 27091493 Pullmann R Jr. Kim HH Abdelmohsen K Lal A Martindale JL Yang X Gorospe M Analysis of turnover and translation regulatory RNA-binding protein expression through binding to cognate mRNAs Mol Cell Biol 2007 27 6265 6278 10.1128/MCB.00500-07 17620417 Puyol M Mart\u00edn A Dubus P Mulero F Pizcueta P Khan G Guerra C Santamar\u00eda D Barbacid M A synthetic lethal interaction between K-Ras oncogenes and Cdk4 unveils a therapeutic strategy for non-small cell lung carcinoma Cancer Cell 2010 18 63 73 10.1016/j.ccr.2010.05.025 20609353 Qi, Y., Ding, L., Xie, M., and Du, P. (2022). RDR1-mediated broad antitumor response: a novel strategy manipulating miRNAs as a powerful weapon. Life Med, doi: 10.1093/lifemedi/lnac007. Raihan O Brishti A Li Q Zhang Q Li D Li X Zhang Q Xie Z Li J Zhang J SRSF11 loss leads to aging-associated cognitive decline by modulating LRP8 and ApoE Cell Rep 2019 28 78 90 10.1016/j.celrep.2019.06.002 31269452 Rall-Scharpf M Friedl TWP Biechonski S Denkinger M Milyavsky M Wiesm\u00fcller L Sex-specific differences in DNA double-strand break repair of cycling human lymphocytes during aging Aging 2021 13 21066 21089 10.18632/aging.203519 34506302 Rampelli S Soverini M D\u2019Amico F Barone M Tavella T Monti D Capri M Astolfi A Brigidi P Biagi E Shotgun metagenomics of gut microbiota in humans with up to extreme longevity and the increasing role of xenobiotic degradation mSystems 2020 5 e00124 20 10.1128/mSystems.00124-20 32209716 Rando TA Wyss-Coray T Asynchronous, contagious and digital aging Nat Aging 2021 1 29 35 10.1038/s43587-020-00015-1 34223194 Rao A Barkley D Fran\u00e7a GS Yanai I Exploring tissue architecture using spatial transcriptomics Nature 2021 596 211 220 10.1038/s41586-021-03634-9 34381231 Rawji KS Mishra MK Michaels NJ Rivest S Stys PK Yong VW Immunosenescence of microglia and macrophages: impact on the ageing central nervous system Brain 2016 139 653 661 10.1093/brain/awv395 26912633 Reddy AS Zhang S Polypharmacology: drug discovery for the future Expert Rev Clin Pharmacol 2013 6 41 47 10.1586/ecp.12.74 23272792 Reddy P Ocampo A Suzuki K Luo J Bacman SR Williams SL Sugawara A Okamura D Tsunekawa Y Wu J Selective elimination of mitochondrial mutations in the germline by genome editing Cell 2015 161 459 469 10.1016/j.cell.2015.03.051 25910206 Reece AS Hulse GK Reduction in arterial stiffness and vascular age by naltrexone-induced interruption of opiate agonism: a cohort study BMJ Open 2013 3 e002610 10.1136/bmjopen-2013-002610 23524044 Reifsnyder PC Ryzhov S Flurkey K Anunciado-Koza RP Mills I Harrison DE Koza RA Cardioprotective effects of dietary rapamycin on adult female C57BLKS/J- Lepr db mice Ann NY Acad Sci 2018 1418 106 117 10.1111/nyas.13557 29377150 Ren R Ocampo A Liu GH Izpisua Belmonte JC Regulation of stem cell aging by metabolism and epigenetics Cell Metab 2017 26 460 474 10.1016/j.cmet.2017.07.019 28826795 Ren W Fan H Grimm SA Kim JJ Li L Guo Y Petell CJ Tan XF Zhang ZM Coan JP DNMT1 reads heterochromatic H4K20me3 to reinforce LINE-1 DNA methylation Nat Commun 2021 12 2490 10.1038/s41467-021-22665-4 33941775 Ren X Hu B Song M Ding Z Dang Y Liu Z Zhang W Ji Q Ren R Ding J Maintenance of nucleolar homeostasis by CBX4 alleviates senescence and osteoarthritis Cell Rep 2019 26 3643 3656 10.1016/j.celrep.2019.02.088 30917318 Ressler S Bartkova J Niederegger H Bartek J Scharffetter-Kochanek K Jansen-D\u00fcrr P Wlaschek M p16 INK4A is a robust in vivo biomarker of cellular aging in human skin Aging Cell 2006 5 379 389 10.1111/j.1474-9726.2006.00231.x 16911562 Richardson, S.R., Doucet, A.J., Kopera, H.C., Moldovan, J.B., Garcia-Perez, J.L., and Moran, J.V. (2015). The influence of LINE-1 and SINE retrotransposons on mammalian genomes. Microbiol Spectr 3. Rikhtegar R Pezeshkian M Dolati S Safaie N Afrasiabi Rad A Mahdipour M Nouri M Jodati AR Yousefi M Stem cells as therapy for heart disease: iPSCs, ESCs, CSCs, and skeletal myoblasts Biomed pharmacother 2019 109 304 313 10.1016/j.biopha.2018.10.065 30396088 Ritschka B Storer M Mas A Heinzmann F Ortells MC Morton J P Sansom OJ Zender L Keyes WM The senescence-associated secretory phenotype induces cellular plasticity and tissue regeneration Genes Dev 2017 31 172 183 10.1101/gad.290635.116 28143833 Rivard A Fabre JE Silver M Chen D Murohara T Kearney M Magner M Asahara T Isner JM Age-dependent impairment of angiogenesis Circulation 1999 99 111 120 10.1161/01.CIR.99.1.111 9884387 Robillard KN Lee KM Chiu KB MacLean AG Glial cell morphological and density changes through the lifespan of rhesus macaques Brain Behav Immun 2016 55 60 69 10.1016/j.bbi.2016.01.006 26851132 Robin, J.D., Jacome Burbano, M.S., Peng, H., Croce, O., Thomas, J.L., Laberthonniere, C., Renault, V., Lototska, L., Pousse, M., Tessier, F., et al. (2020). Mitochondrial function in skeletal myofibers is controlled by a TRF2-SIRT3 axis over lifetime. Aging Cell 19. Rodier F Copp\u00e9 JP Patil CK Hoeijmakers WAM Mu\u00f1oz DP Raza SR Freund A Campeau E Davalos AR Campisi J Persistent DNA damage signalling triggers senescence-associated inflammatory cytokine secretion Nat Cell Biol 2009 11 973 979 10.1038/ncb1909 19597488 Rodriguez-Meira A Buck G Clark SA Povinelli BJ Alcolea V Louka E McGowan S Hamblin A Sousos N Barkas N Unravelling intratumoral heterogeneity through high-sensitivity single-cell mutational analysis and parallel RNA sequencing Mol Cell 2019 73 1292 1305 10.1016/j.molcel.2019.01.009 30765193 Rodriques SG Stickels RR Goeva A Martin CA Murray E Vanderburg CR Welch J Chen LM Chen F Macosko EZ Slide-seq: a scalable technology for measuring genome-wide expression at high spatial resolution Science 2019 363 1463 1467 10.1126/science.aaw1219 30923225 Roger L Tomas F Gire V Mechanisms and regulation of cellular senescence Int J Mol Sci 2021 22 13173 10.3390/ijms222313173 34884978 Rosenberg AM Rausser S Ren J Mosharov EV Sturm G Ogden RT Patel P Kumar Soni R Lacefield C Tobin DJ Quantitative mapping of human hair greying and reversal in relation to life stress eLife 2021 10 e67437 10.7554/eLife.67437 34155974 Rossman MJ Kaplon RE Hill SD McNamara MN Santos-Parker JR Pierce GL Seals DR Donato AJ Endothelial cell senescence with aging in healthy humans: prevention by habitual exercise and relation to vascular endothelial function Am J Physiol-Heart Circ Physiol 2017 313 H890 H895 10.1152/ajpheart.00416.2017 28971843 Rostagno C Heart valve disease in elderly World J Cardiol 2019 11 71 83 10.4330/wjc.v11.i2.71 30820277 Rozo M Li L Fan CM Targeting \u03b21-integrin signaling enhances regeneration in aged and dystrophic muscle in mice Nat Med 2016 22 889 896 10.1038/nm.4116 27376575 R\u00fcbe CE Fricke A Widmann TA F\u00fcrst T Madry H Pfreundschuh M R\u00fcbe C Accumulation of DNA damage in hematopoietic stem and progenitor cells during human aging PLoS ONE 2011 6 e17487 10.1371/journal.pone.0017487 21408175 Rubinsztein DC Mari\u00f1o G Kroemer G Autophagy and aging Cell 2011 146 682 695 10.1016/j.cell.2011.07.030 21884931 Rudin CM Thompson CB Transcriptional activation of short interspersed elements by DNA-damaging agents Genes Chromosomes Cancer 2001 30 64 71 10.1002/1098-2264(2000)9999:9999<::AID-GCC1066>3.0.CO;2-F 11107177 Ruis P Van Ly D Borel V Kafer GR McCarthy A Howell S Blassberg R Snijders AP Briscoe J Niakan KK TRF2-independent chromosome end protection during pluripotency Nature 2021 589 103 109 10.1038/s41586-020-2960-y 33239783 Rurik JG Tomb\u00e1cz I Yadegari A M\u00e9ndez Fern\u00e1ndez PO Shewale SV Li L Kimura T Soliman OY Papp TE Tam YK CAR T cells produced in vivo to treat cardiac injury Science 2022 375 91 96 10.1126/science.abm0594 34990237 Ruth KS Day FR Hussain J Mart\u00ednez-Marchal A Aiken CE Azad A Thompson DJ Knoblochova L Abe H Tarry-Adkins J L Genetic insights into biological mechanisms governing human ovarian ageing Nature 2021 596 393 397 10.1038/s41586-021-03779-7 34349265 Ryall JG Dell\u2019Orso S Derfoul A Juan A Zare H Feng X Clermont D Koulnis M Gutierrez-Cruz G Fulco M The NAD + -dependent sirt1 deacetylase translates a metabolic switch into regulatory epigenetics in skeletal muscle stem cells Cell Stem Cell 2015 16 171 183 10.1016/j.stem.2014.12.004 25600643 Ryan CP Epigenetic clocks\u201d: theory and applications in human biology Am J Hum Biol 2021 33 e23488 10.1002/ajhb.23488 32845048 Ryan JL Ionizing radiation: the good, the bad, and the ugly J Investig Dermatol 2012 132 985 993 10.1038/jid.2011.411 22217743 Sager R Senescence as a mode of tumor suppression Environ Health Persp 1991 93 59 62 10.1289/ehp.919359 Sager R Tanaka K Lau CC Ebina Y Anisowicz A Resistance of human cells to tumorigenesis induced by cloned transforming genes Proc Natl Acad Sci USA 1983 80 7601 7605 10.1073/pnas.80.24.7601 6324180 Sahin E Colla S Liesa M Moslehi J M\u00fcller FL Guo M Cooper M Kotton D Fabian AJ Walkey C Telomere dysfunction induces metabolic and mitochondrial compromise Nature 2011 470 359 365 10.1038/nature09787 21307849 Saji N Murotani K Hisada T Tsuduki T Sugimoto T Kimura A Niida S Toba K Sakurai T The relationship between the gut microbiome and mild cognitive impairment in patients without dementia: a cross-sectional study conducted in Japan Sci Rep 2019 9 19227 10.1038/s41598-019-55851-y 31852995 Sakuma I Tanaka T iPSCs and aging Nihon Rinsho 2016 74 1560 1564 30557493 Salahudeen AA Choi SS Rustagi A Zhu J van Unen V de la O S M Flynn RA Margalef-Catal\u00e0 M Santos AJM Ju J Progenitor identification and SARS-CoV-2 infection in human distal lung organoids Nature 2020 588 670 675 10.1038/s41586-020-3014-1 33238290 Salamone D Rivellese AA Vetrani C The relationship between gut microbiota, short-chain fatty acids and type 2 diabetes mellitus: the possible role of dietary fibre Acta Diabetol 2021 58 1131 1138 10.1007/s00592-021-01727-5 33970303 Salas IH Burgado J Allen NJ Glia: victims or villains of the aging brain NeuroBiol Dis 2020 143 105008 10.1016/j.nbd.2020.105008 32622920 Salminen A Activation of immunosuppressive network in the aging process Ageing Res Rev 2020 57 100998 10.1016/j.arr.2019.100998 31838128 Sameri S Samadi P Dehghan R Salem E Fayazi N Amini R Stem cell aging in lifespan and disease: a state-of-the-art review CSCR 2020 15 362 378 10.2174/1574888X15666200213105155 Sanchez-Vazquez R Gu\u00edo-Carri\u00f3n A Zapatero-Gaviria A Mart\u00ednez P Blasco MA Shorter telomere lengths in patients with severe COVID-19 disease Aging 2021 13 1 15 10.18632/aging.202463 33428591 Sarek G Kotsantis P Ruis P Van Ly D Margalef P Borel V Zheng XF Flynn HR Snijders AP Chowdhury D CDK phosphorylation of TRF2 controls t-loop dynamics during the cell cycle Nature 2019 575 523 527 10.1038/s41586-019-1744-8 31723267 Saretzki G von Zglinicki T Telomerase as a promising target for human cancer gene therapy Drugs Today 2003 39 265 276 10.1358/dot.2003.39.4.799403 Sarig R Rimmer R Bassat E Zhang L Umansky KB Lendengolts D Perlmoter G Yaniv K Tzahor E Transient p53-mediated regenerative senescence in the injured heart Circulation 2019 139 2491 2494 10.1161/CIRCULATIONAHA.119.040125 31107623 Sato Y Atarashi K Plichta DR Arai Y Sasajima S Kearney SM Suda W Takeshita K Sasaki T Okamoto S Novel bile acid biosynthetic pathways are enriched in the microbiome of centenarians Nature 2021 599 458 464 10.1038/s41586-021-03832-5 34325466 Sayed N Huang Y Nguyen K Krejciova-Rajaniemi Z Grawe AP Gao T Tibshirani R Hastie T Alpert A Cui L An inflammatory aging clock (iAge) based on deep learning tracks multimorbidity, immunosenescence, frailty and cardiovascular aging Nat Aging 2021 1 598 615 10.1038/s43587-021-00082-y 34888528 Sceneay J Goreczny GJ Wilson K Morrow S DeCristo MJ Ubellacker JM Qin Y Laszewski T Stover DG Barrera V Interferon signaling is diminished with age and is associated with immune checkpoint blockade efficacy in triple-negative breast cancer Cancer Discovery 2019 9 1208 1227 10.1158/2159-8290.CD-18-1454 31217296 Sch\u00e4chter F Faure-Delanef L Gu\u00e9not F Rouger H Froguel P Lesueur-Ginot L Cohen D Genetic associations with human longevity at the APOE and ACE loci Nat Genet 1994 6 29 32 10.1038/ng0194-29 8136829 Schaum N Lehallier B Hahn O P\u00e1lovics R Hosseinzadeh S Lee S E Sit R Lee DP Losada PM Zardeneta ME Ageing hallmarks exhibit organ-specific temporal signatures Nature 2020 583 596 602 10.1038/s41586-020-2499-y 32669715 Schneider JL Rowe JH Garcia-de-Alba C Kim CF Sharpe AH Haigis MC The aging lung: Physiology, disease, and immunity Cell 2021 184 1990 2019 10.1016/j.cell.2021.03.005 33811810 Schulte H M\u00fchlfeld C Brandenberger C Age-related structural and functional changes in the mouse lung Front Physiol 2019 10 1466 10.3389/fphys.2019.01466 31866873 Schultz MB Sinclair DA When stem cells grow old: phenotypes and mechanisms of stem cell aging Development 2016 143 3 14 10.1242/dev.130633 26732838 Schumacher B Pothof J Vijg J Hoeijmakers JHJ The central role of DNA damage in the ageing process Nature 2021 592 695 703 10.1038/s41586-021-03307-7 33911272 Schwartz SM Benditt EP Aortic endothelial cell replication. I. Effects of age and hypertension in the rat Circ Res 1977 41 248 255 10.1161/01.RES.41.2.248 872300 Schw\u00f6rer S Becker F Feller C Baig AH K\u00f6ber U Henze H Kraus JM Xin B Lechel A Lipka DB Epigenetic stress responses induce muscle stem-cell ageing by Hoxa9 developmental signals Nature 2016 540 428 432 10.1038/nature20603 27919074 Scott AJ Ellison M Sinclair DA The economic value of targeting aging Nat Aging 2021 1 616 623 10.1038/s43587-021-00080-0 Sebastiani P Gurinovich A Nygaard M Sasaki T Sweigart B Bae H Andersen SL Villa F Atzmon G Christensen K APOE alleles and extreme human longevity Js Gerontol-Ser A 2019 74 44 51 10.1093/gerona/gly174 Secomandi L Borghesan M Velarde M Demaria M The role of cellular senescence in female reproductive aging and the potential for senotherapeutic interventions Hum Reprod Update 2022 28 172 189 10.1093/humupd/dmab038 34918084 Sedivy JM Banumathy G Adams PD Aging by epigenetics\u2014a consequence of chromatin damage Exp Cell Res 2008 314 1909 1917 10.1016/j.yexcr.2008.02.023 18423606 Segler MHS Kogej T Tyrchan C Waller MP Generating focused molecule libraries for drug discovery with recurrent neural networks ACS Cent Sci 2018 4 120 131 10.1021/acscentsci.7b00512 29392184 Serowoky, M.A., Arata, C.E., Crump, J.G., and Mariani, F.V. (2020). Skeletal stem cells: insights into maintaining and regenerating the skeleton. Development 147. Sezaki M Hayashi Y Wang Y Johansson A Umemoto T Takizawa H Immuno-modulation of hematopoietic stem and progenitor cells in inflammation Front Immunol 2020 11 585367 10.3389/fimmu.2020.585367 33329562 Sfeir A de Lange T Removal of shelterin reveals the telomere end-protection problem Science 2012 336 593 597 10.1126/science.1218498 22556254 Shafik AM Zhang F Guo Z Dai Q Pajdzik K Li Y Kang Y Yao B Wu H He C N6-methyladenosine dynamics in neurodevelopment and aging, and its potential role in Alzheimer\u2019s disease Genome Biol 2021 22 17 10.1186/s13059-020-02249-z 33402207 Shan B Wang X Wu Y Xu C Xia Z Dai J Shao M Zhao F He S Yang L The metabolic ER stress sensor IRE1\u03b1 suppresses alternative activation of macrophages and impairs energy expenditure in obesity Nat Immunol 2017 18 519 529 10.1038/ni.3709 28346409 Shan H Geng L Jiang X Song M Wang J Liu Z Zhuo X Wu Z Hu J Ji Z Large-scale chemical screen identifies Gallic acid as a geroprotector for human stem cells Protein Cell 2022 13 532 539 10.1007/s13238-021-00872-5 34542813 Shao M Shan B Liu Y Deng Y Yan C Wu Y Mao T Qiu Y Zhou Y Jiang S Hepatic IRE1\u03b1 regulates fasting-induced metabolic adaptive programs through the XBP1s-PPAR\u03b1 axis signalling Nat Commun 2014 5 3528 10.1038/ncomms4528 24670948 Shaposhnikov M Proshkina E Shilova L Zhavoronkov A Moskalev A Lifespan and stress resistance in Drosophila with overexpressed DNA repair genes Sci Rep 2015 5 15299 10.1038/srep15299 26477511 Sharma G Goodwin J Effect of aging on respiratory system physiology and immunology Clin Intervent Aging 2006 1 253 260 10.2147/ciia.2006.1.3.253 Sharma, R., Khristov, V., Rising, A., Jha, B.S., Dejene, R., Hotaling, N., Li, Y., Stoddard, J., Stankewicz, C., Wan, Q., et al. (2019). Clinical-grade stem cell-derived retinal pigment epithelium patch rescues retinal degeneration in rodents and pigs. Sci Transl Med 11. Shastri A Will B Steidl U Verma A Stem and progenitor cell alterations in myelodysplastic syndromes Blood 2017 129 1586 1594 10.1182/blood-2016-10-696062 28159737 Shi CY Wang L Sen P The eroding chromatin landscape of aging stem cells Transl Med Aging 2020 4 121 131 10.1016/j.tma.2020.08.002 33024907 Shi D Xia X Cui A Xiong Z Yan Y Luo J Chen G Zeng Y Cai D Hou L The precursor of PI(3,4,5)P3 alleviates aging by activating daf-18(Pten) and independent of daf-16 Nat Commun 2020 11 4496 10.1038/s41467-020-18280-4 32901024 Shimada H Makizako H Doi T Yoshida D Tsutsumimoto K Anan Y Uemura K Lee S Park H Suzuki T A large, cross-sectional observational study of serum BDNF, cognitive function, and mild cognitive impairment in the elderly Front Aging Neurosci 2014 6 69 10.3389/fnagi.2014.00069 24782766 Shin HE Kwak SE Lee JH Zhang D Bae JH Song W Exercise, the gut microbiome, and frailty Ann Geriatr Med Res 2019 23 105 114 10.4235/agmr.19.0014 32743298 Shirasuna K Iwata H Effect of aging on the female reproductive function Contracept Reprod Med 2017 2 23 10.1186/s40834-017-0050-9 29201428 Sicard D Haak AJ Choi KM Craig AR Fredenburgh LE Tschumperlin DJ Aging and anatomical variations in lung tissue stiffness Am J Physiol-Lung Cell Mol Physiol 2018 314 L946 L955 10.1152/ajplung.00415.2017 29469613 Sieben CJ Sturmlechner I van de Sluis B van Deursen JM Two-step senescence-focused cancer therapies Trends Cell Biol 2018 28 723 737 10.1016/j.tcb.2018.04.006 29776716 Sierra A Gottfried-Blackmore AC McEwen BS Bulloch K Microglia derived from aging mice exhibit an altered inflammatory profile Glia 2007 55 412 424 10.1002/glia.20468 17203473 Siersb\u00e6k R Scabia V Nagarajan S Chernukhin I Papachristou EK Broome R Johnston SJ Joosten SEP Green AR Kumar S IL6/STAT3 signaling hijacks estrogen receptor \u03b1 enhancers to drive breast cancer metastasis Cancer Cell 2020 38 412 423 10.1016/j.ccell.2020.06.007 32679107 Simon M Van Meter M Ablaeva J Ke Z Gonzalez RS Taguchi T De Cecco M Leonova KI Kogan V Helfand SL LINE1 derepression in aged wild-type and SIRT6-deficient mice drives inflammation Cell Metab 2019 29 871 885 10.1016/j.cmet.2019.02.014 30853213 Singh M Jensen MD Lerman A Kushwaha S Rihal CS Gersh B J Behfar A Tchkonia T Thomas RJ Lennon RJ Effect of low-dose rapamycin on senescence markers and physical functioning in older adults with coronary artery disease: results of a pilot study J Frailty Aging 2016 5 204 207 27883166 Singh PP Demmitt BA Nath RD Brunet A The genetics of aging: a vertebrate perspective Cell 2019 177 200 220 10.1016/j.cell.2019.02.038 30901541 Singh SK Singh S Gadomski S Sun L Pfannenstein A Magidson V Chen X Kozlov S Tessarollo L Klarmann KD Id1 ablation protects hematopoietic stem cells from stress-induced exhaustion and aging Cell Stem Cell 2018 23 252 265 10.1016/j.stem.2018.06.001 30082068 Singleton MJ Nelson MB Samuel TJ Kitzman DW Brubaker P Haykowsky MJ Upadhya B Chen H Nelson MD Left atrial stiffness index independently predicts exercise intolerance and quality of life in older, obese patients with heart failure with preserved ejection fraction J Cardiac Failure 2022 28 567 575 10.1016/j.cardfail.2021.10.010 34774747 Sinha M Jang YC Oh J Khong D Wu EY Manohar R Miller C Regalado SG Loffredo FS Pancoast JR Restoring systemic GDF11 levels reverses age-related dysfunction in mouse skeletal muscle Science 2014 344 649 652 10.1126/science.1251152 24797481 Skloot GS The effects of aging on lung structure and function Clin Geriatric Med 2017 33 447 457 10.1016/j.cger.2017.06.001 Smith G Della Sala S Logie RH Maylor EA Prospective and retrospective memory in normal ageing and dementia: a questionnaire study Memory 2000 8 311 321 10.1080/09658210050117735 11045239 Smith HJ Sharma A Mair WB Metabolic communication and healthy aging: where should we focus our energy Dev Cell 2020 54 196 211 10.1016/j.devcel.2020.06.011 32619405 Sofroniew MV Astrogliosis Cold Spring Harb Perspect Biol 2014 7 a020420 10.1101/cshperspect.a020420 25380660 Soldner F Jaenisch R iPSC disease modeling Science 2012 338 1155 1156 10.1126/science.1227682 23197518 Song C Zhu C Wu Q Qi J Gao Y Zhang Z Gaur U Yang D Fan X Yang M Metabolome analysis of effect of aspirin on Drosophila lifespan extension Exp Gerontol 2017 95 54 62 10.1016/j.exger.2017.04.010 28457986 Song, G., Ma, Y., Gao, X., Zhang, X., Zhang, F., Tian, C., Hou, J., Liu, Z., Zhao, Z., and Tian, Y. (2022). CRISPR/Cas9-mediated genetic correction reverses spinocerebellar ataxia 3 disease-associated phenotypes in differentiated cerebellar neurons. Life Med, doi: 10.1093/lifemedi/lnac020. Song L Calcium and bone metabolism indices Adv Clin Chem 2017 82 1 46 10.1016/bs.acc.2017.06.005 28939209 Song S Lam EWF Tchkonia T Kirkland JL Sun Y Senescent cells: emerging targets for human aging and age-related diseases Trends Biochem Sci 2020 45 578 592 10.1016/j.tibs.2020.03.008 32531228 Song S Tchkonia T Jiang J Kirkland JL Sun Y Targeting senescent cells for a healthier aging: challenges and opportunities Adv Sci 2020 7 2002611 10.1002/advs.202002611 Song W Owusu-Ansah E Hu Y Cheng D Ni X Zirin J Perrimon N Activin signaling mediates muscle-to-adipose communication in a mitochondria dysfunction-associated obesity model Proc Natl Acad Sci USA 2017 114 8596 8601 10.1073/pnas.1708037114 28739899 Song W Ren D Li W Jiang L Cho KW Huang P Fan C Song Y Liu Y Rui L SH2B regulation of growth, metabolism, and longevity in both insects and mammals Cell Metab 2010 11 427 437 10.1016/j.cmet.2010.04.002 20417156 S\u00f8raas A Matsuyama M de Lima M Wald D Buechner J Gedde-Dahl T S\u00f8raas CL Chen B Ferrucci L Dahl JA Epigenetic age is a cell-intrinsic property in transplanted human hematopoietic cells Aging Cell 2019 18 e12897 10.1111/acel.12897 30712319 Soukas AA Hao H Wu L Metformin as anti-aging therapy: is it for everyone Trends Endocrinol Metab 2019 30 745 755 10.1016/j.tem.2019.07.015 31405774 Sousa-Victor P Garc\u00eda-Prat L Mu\u00f1oz-C\u00e1noves P Control of satellite cell function in muscle regeneration and its disruption in ageing Nat Rev Mol Cell Biol 2022 23 204 226 10.1038/s41580-021-00421-2 34663964 Sousa-Victor P Gutarra S Garc\u00eda-Prat L Rodriguez-Ubreva J Ortet L Ruiz-Bonilla V Jard\u00ed M Ballestar E Gonz\u00e1lez S Serrano A L Geriatric muscle stem cells switch reversible quiescence into senescence Nature 2014 506 316 321 10.1038/nature13013 24522534 Stanley SE Chen JJL Podlevsky JD Alder JK Hansel NN Mathias RA Qi X Rafaels NM Wise RA Silverman EK Telomerase mutations in smokers with severe emphysema J Clin Invest 2015 125 563 570 10.1172/JCI78554 25562321 Stonestrom AJ The key role of epigenetics in human disease N Engl J Med 3 2018 79 400 401 Storer M Mas A Robert-Moreno A Pecoraro M Ortells MC Di Giacomo V Yosef R Pilpel N Krizhanovsky V Sharpe J Senescence is a developmental mechanism that contributes to embryonic growth and patterning Cell 2013 155 1119 1130 10.1016/j.cell.2013.10.041 24238961 Streese L Khan AW Deiseroth A Hussain S Suades R Tiaden A Kyburz D Cosentino F Hanssen H High-intensity interval training modulates retinal microvascular phenotype and DNA methylation of p66Shc gene: a randomized controlled trial (EXAMIN AGE) Eur Heart J 2020 41 1514 1519 10.1093/eurheartj/ehz196 31323685 Strong R Miller RA Astle CM Floyd RA Flurkey K Hensley K L Javors MA Leeuwenburgh C Nelson JF Ongini E Nordihydroguaiaretic acid and aspirin increase lifespan of genetically heterogeneous male mice: a randomized controlled trial (EXAMIN AGE) Aging Cell 2008 7 641 650 10.1111/j.1474-9726.2008.00414.x 18631321 Su Y Wang T Wu N Li D Fan X Xu Z Mishra SK Yang M Alpha-ketoglutarate extends Drosophila lifespan by inhibiting mTOR and activating AMPK Aging 2019 11 4183 4197 10.18632/aging.102045 31242135 Subramanian A Narayan R Corsello SM Peck DD Natoli TE Lu X Gould J Davis JF Tubelli AA Asiedu JK A next generation connectivity map: l1000 platform and the first 1,000,000 profiles Cell 2017 171 1437 1452 10.1016/j.cell.2017.10.049 29195078 Suda M Shimizu I Katsuumi G Yoshida Y Hayashi Y Ikegami R Matsumoto N Yoshida Y Mikawa R Katayama A Senolytic vaccination improves normal and pathological age-related phenotypes and increases lifespan in progeroid mice Nat Aging 2021 1 1117 1126 10.1038/s43587-021-00151-2 Suh Y Atzmon G Cho MO Hwang D Liu B Leahy DJ Barzilai N Cohen P Functionally significant insulin-like growth factor I receptor mutations in centenarians Proc Natl Acad Sci USA 2008 105 3438 3442 10.1073/pnas.0705467105 18316725 Sun D Luo M Jeong M Rodriguez B Xia Z Hannah R Wang H Le T Faull KF Chen R Epigenomic profiling of young and aged hscs reveals concerted changes during aging that reinforce self-renewal Cell Stem Cell 2014 14 673 688 10.1016/j.stem.2014.03.002 24792119 Sun N Youle RJ Finkel T The mitochondrial basis of aging Mol Cell 2016 61 654 666 10.1016/j.molcel.2016.01.028 26942670 Sun P Yoshizuka N New L Moser BA Li Y Liao R Xie C Chen J Deng Q Yamout M PRAK is essential for ras-induced senescence and tumor suppression Cell 2007 128 295 308 10.1016/j.cell.2006.11.050 17254968 Sun Y Xia M Yan H Han Y Zhang F Hu Z Cui A Ma F Liu Z Gong Q Berberine attenuates hepatic steatosis and enhances energy expenditure in mice by inducing autophagy and fibroblast growth factor 21 Br J Pharmacol 2018 175 374 387 10.1111/bph.14079 29065221 Suzuki J Yamada T Inoue K Nabe S Kuwahara M Takemori N Takemori A Matsuda S Kanoh M Imai Y The tumor suppressor menin prevents effector CD8 T-cell dysfunction by targeting mTORC1-dependent metabolic activation Nat Commun 2018 9 3296 10.1038/s41467-018-05854-6 30120246 Szymczak S Dose J Torres GG Heinsen FA Venkatesh G Datlinger P Nygaard M Mengel-From J Flachsbart F Klapper W DNA methylation QTL analysis identifies new regulators of human longevity Hum Mol Genet 2020 29 1154 1167 10.1093/hmg/ddaa033 32160291 Tacutu R Thornton D Johnson E Budovsky A Barardo D Craig T Diana E Lehmann G Toren D Wang J Human Ageing Genomic Resources: new and updated databases Nucl Acids Res 2018 46 D1083 D1090 10.1093/nar/gkx1042 29121237 Taguchi A Wartschow LM White MF Brain IRS2 signaling coordinates life span and nutrient homeostasis Science 2007 317 369 372 10.1126/science.1142179 17641201 Tain LS Jain C Nespital T Froehlich J Hinze Y Gr\u00f6nke S Partridge L Longevity in response to lowered insulin signaling requires glycine N -methyltransferase-dependent spermidine production Aging Cell 2020 19 e13043 10.1111/acel.13043 31721422 Takahashi A Imai Y Yamakoshi K Kuninaka S Ohtani N Yoshimoto S Hori S Tachibana M Anderton E Takeuchi T DNA damage signaling triggers degradation of histone methyltransferases through APC/C-Cdh1 in senescent cells Mol Cell 2012 45 123 131 10.1016/j.molcel.2011.10.018 22178396 Tamura Y Takubo K Aida J Araki A Ito H Telomere attrition and diabetes mellitus Geriatr Gerontol Int 2016 16 66 74 10.1111/ggi.12738 27018285 Tan Q Heijmans BT Hjelmborg JVB Soerensen M Christensen K Christiansen L Epigenetic drift in the aging genome: a ten-year follow-up in an elderly twin cohort Int J Epidemiol 2016 45 1146 1158 27498152 Taniguchi-Ikeda M Kobayashi K Kanagawa M Yu CC Mori K Oda T Kuga A Kurahashi H Akman HO Dimauro S Pathogenic exon-trapping by SVA retrotransposon and rescue in Fukuyama muscular dystrophy Nature 2011 478 127 131 10.1038/nature10456 21979053 Tarrag\u00f3 MG Chini CCS Kanamori KS Warner GM Caride A de Oliveira GC Rud M Samani A Hein KZ Huang R A potent and specific CD38 inhibitor ameliorates age-related metabolic dysfunction by reversing tissue NAD + decline Cell Metab 2018 27 1081 1095 10.1016/j.cmet.2018.03.016 29719225 Tasdemir N Banito A Roe JS Alonso-Curbelo D Camiolo M Tschaharganeh DF Huang CH Aksoy O Bolden JE Chen CC BRD4 connects enhancer remodeling to senescence immune surveillance Cancer Discovery 2016 6 612 629 10.1158/2159-8290.CD-16-0217 27099234 Tatar M Kopelman A Epstein D Tu MP Yin CM Garofalo R S A mutant Drosophila insulin receptor homolog that extends life-span and impairs neuroendocrine function Science 2001 292 107 110 10.1126/science.1057987 11292875 Taylor RC Hetz C Mastering organismal aging through the endoplasmic reticulum proteostasis network Aging Cell 2020 19 e13265 10.1111/acel.13265 33128506 Teleman AA Molecular mechanisms of metabolic regulation by insulin in Drosophila Biochem J 2010 425 13 26 10.1042/BJ20091181 Terman A Kurz T Navratil M Arriaga EA Brunk UT Mitochondrial turnover and aging of long-lived postmitotic cells: the mitochondrial-lysosomal axis theory of aging Antioxid Redox Signal 2010 12 503 535 10.1089/ars.2009.2598 19650712 Terry DF Wilcox M McCormick MA Lawler E Perls TT Cardiovascular advantages among the offspring of centenarians Js Gerontol Ser A-Biol Sci Med Sci 2003 58 M425 M431 Thomas CA Tejwani L Trujillo CA Negraes PD Herai RH Mesci P Macia A Crow YJ Muotri AR Modeling of TREX1-dependent autoimmune disease using human stem cells highlights l1 accumulation as a source of neuroinflammation Cell Stem Cell 2017 21 319 331 10.1016/j.stem.2017.07.009 28803918 Tian X Firsanov D Zhang Z Cheng Y Luo L Tombline G Tan R Simon M Henderson S Steffan J SIRT6 is responsible for more efficient dna double-strand break repair in long-lived species Cell 2019 177 622 638 10.1016/j.cell.2019.03.043 31002797 Tian XL Li Y Endothelial cell senescence and age-related vascular diseases J Genet Genom 2014 41 485 495 10.1016/j.jgg.2014.08.001 Tian Y Garcia G Bian Q Steffen KK Joe L Wolff S Meyer BJ Dillin A Mitochondrial stress induces chromatin reorganization to promote longevity and UPRmt Cell 2016 165 1197 1208 10.1016/j.cell.2016.04.011 27133166 Tokunaga R Zhang W Naseem M Puccini A Berger MD Soni S McSkane M Baba H Lenz HJ CXCL9, CXCL10, CXCL11/CXCR3 axis for immune activation\u2014a target for novel cancer therapy Cancer Treatment Rev 2018 63 40 47 10.1016/j.ctrv.2017.11.007 Toren, D., Kulaga, A., Jethva, M., Rubin, E., Snezhkina, A.V., Kudryavtseva, A.V., Nowicki, D., Tacutu, R., Moskalev, A.A., and Fraifeld, V.E. (2020). Gray whale transcriptome reveals longevity adaptations associated with DNA repair and ubiquitination. Aging Cell 19. Tosato M Zamboni V Ferrini A Cesari M The aging process and potential interventions to extend life expectancy Clin Intervent Aging 2007 2 401 412 Tran D Bergholz J Zhang H He H Wang Y Zhang Y Li Q Kirkland JL Xiao ZX Insulin-like growth factor-1 regulates the SIRT1-p53 pathway in cellular senescence Aging Cell 2014 13 669 678 10.1111/acel.12219 25070626 Trefts E Shaw RJ AMPK: restoring metabolic homeostasis over space and time Mol Cell 2021 81 3677 3690 10.1016/j.molcel.2021.08.015 34547233 Triana-Mart\u00ednez F Picallos-Rabina P Da Silva-\u00c1lvarez S Pietrocola F Llanos S Rodilla V Soprano E Pedrosa P Ferreir\u00f3s A Barradas M Identification and characterization of Cardiac Glycosides as senolytic compounds Nat Commun 2019 10 4731 10.1038/s41467-019-12888-x 31636264 Triposkiadis F Xanthopoulos A Butler J Cardiovascular aging and heart failure: JACC review topic of the week J Am College Cardiol 2019 74 804 813 10.1016/j.jacc.2019.06.053 Trubitsyn AG The mechanism of programmed aging: the way to create a real remedy for senescence Curr Aging Sci 2020 13 31 41 10.2174/1874609812666191014111422 31660847 Tsakiri KD Cronkhite JT Kuan PJ Xing C Raghu G Weissler J C Rosenblatt RL Shay JW Garcia CK Adult-onset pulmonary fibrosis caused by mutations in telomerase Proc Natl Acad Sci USA 2007 104 7552 7557 10.1073/pnas.0701009104 17460043 Tuckermann J Adams RH The endothelium-bone axis in development, homeostasis and bone and joint disease Nat Rev Rheumatol 2021 17 608 620 10.1038/s41584-021-00682-3 34480164 Tumurkhuu G Shimada K Dagvadorj J Crother TR Zhang W Luthringer D Gottlieb RA Chen S Arditi M Ogg1 -dependent DNA repair regulates NLRP3 inflammasome and prevents atherosclerosis Circ Res 2016 119 e76 90 10.1161/CIRCRESAHA.116.308362 27384322 Turan V Oktay K BRCA-related ATM-mediated DNA double-strand break repair and ovarian aging Hum Reprod Update 2020 26 43 57 10.1093/humupd/dmz043 31822904 Turinetto V Vitale E Giachino C Senescence in human mesenchymal stem cells: functional changes and implications in stem cell-based therapy Int J Mol Sci 2016 17 1164 10.3390/ijms17071164 27447618 Tvrd\u00e1 E Benko F Slanina T du Plessis SS The role of selected natural biomolecules in sperm production and functionality Molecules 2021 26 5196 10.3390/molecules26175196 34500629 Tyner SD Venkatachalam S Choi J Jones S Ghebranious N Igelmann H Lu X Soron G Cooper B Brayton C p53 mutant mice that display early ageing-associated phenotypes Nature 2002 415 45 53 10.1038/415045a 11780111 Vadakkadath Meethal S Atwood CS Alzheimer\u2019s disease: the impact of age-related changes in reproductive hormones Cell Mol Life Sci 2005 62 257 270 10.1007/s00018-004-4381-3 15723162 Vagnoni A Bullock SL A simple method for imaging axonal transport in aging neurons using the adult Drosophila wing Nat Protoc 2016 11 1711 1723 10.1038/nprot.2016.112 27560175 Vagnoni A Bullock SL A cAMP/PKA/Kinesin-1 axis promotes the axonal transport of mitochondria in aging Drosophila neurons Curr Biol 2018 28 1265 1272 10.1016/j.cub.2018.02.048 29606421 Valenzano DR Terzibasi E Genade T Cattaneo A Domenici L Cellerino A Resveratrol prolongs lifespan and retards the onset of age-related markers in a short-lived vertebrate Curr Biol 2006 16 296 300 10.1016/j.cub.2005.12.038 16461283 van Deursen JM The role of senescent cells in ageing Nature 2014 509 439 446 10.1038/nature13193 24848057 Van Meter M Kashyap M Rezazadeh S Geneva AJ Morello TD Seluanov A Gorbunova V SIRT6 represses LINE1 retrotransposons by ribosylating KAP1 but this repression fails with stress and age Nat Commun 2014 5 5011 10.1038/ncomms6011 25247314 Van Neste D Tobin DJ Hair cycle and hair pigmentation: dynamic interactions and changes associated with aging Micron 2004 35 193 200 10.1016/j.micron.2003.11.006 15036274 Van Skike CE Lin AL Roberts Burbank R Halloran JJ Hernandez SF Cuvillier J Soto VY Hussong SA Jahrling JB Javors M A mTOR drives cerebrovascular, synaptic, and cognitive dysfunction in normative aging Aging Cell 2020 19 e13057 10.1111/acel.13057 31693798 van Vliet T Varela-Eirin M Wang B Borghesan M Brandenburg S M Franzin R Evangelou K Seelen M Gorgoulis V Demaria M Physiological hypoxia restrains the senescence-associated secretory phenotype via AMPK-mediated mTOR suppression Mol Cell 2021 81 2041 2052 10.1016/j.molcel.2021.03.018 33823141 Vanhoutte PM Aging and vascular responsiveness J Cardiovasc Pharmacol 1988 12 S11 S18 10.1097/00005344-198812081-00004 2469892 Vanhoutte PM Shimokawa H Feletou M Tang EHC Endothelial dysfunction and vascular disease\u2014a 30th anniversary update Acta Physiol 2017 219 22 96 10.1111/apha.12646 Veldhuis JD Keenan DM Liu PY Iranmanesh A Takahashi PY Nehra AX The aging male hypothalamic-pituitary-gonadal axis: pulsatility and feedback Mol Cell Endocrinol 2009 299 14 22 10.1016/j.mce.2008.09.005 18838102 Venkataraman L Fair SR McElroy CA Hester ME Fu H Modeling neurodegenerative diseases with cerebral organoids and other three-dimensional culture systems: focus on Alzheimer\u2019s disease Stem Cell Rev Rep 2022 18 696 717 10.1007/s12015-020-10068-9 33180261 Vergeer M Boekholdt SM Sandhu MS Ricketts SL Wareham NJ Brown MJ de Faire U Leander K Gigante B Kavousi M Genetic variation at the phospholipid transfer protein locus affects its activity and high-density lipoprotein size and is a novel marker of cardiovascular disease susceptibility Circulation 2010 122 470 477 10.1161/CIRCULATIONAHA.109.912519 20644014 Vickovic S Schapiro D Carlberg K L\u00f6tstedt B Larsson L Hildebrandt F Korotkova M Hensvold AH Catrina AI Sorger PK Three-dimensional spatial transcriptomics uncovers cell type localizations in the human rheumatoid arthritis synovium Commun Biol 2022 5 129 10.1038/s42003-022-03050-3 35149753 Victorelli S Lagnado A Halim J Moore W Talbot D Barrett K Chapman J Birch J Ogrodnik M Meves A Senescent human melanocytes drive skin ageing via paracrine telomere dysfunction EMBO J 2019 38 e101982 10.15252/embj.2019101982 31633821 Vijay A Valdes AM Role of the gut microbiome in chronic diseases: a narrative review Eur J Clin Nutr 2022 76 489 501 10.1038/s41430-021-00991-6 34584224 Vilas JM Carneiro C Da Silva-\u00c1lvarez S Ferreir\u00f3s A Gonz\u00e1lez P G\u00f3mez M Ortega S Serrano M Garc\u00eda-Caballero T Gonz\u00e1lez-Barcia M Adult Sox 2+ stem cell exhaustion in mice results in cellular senescence and premature aging Aging Cell 2018 17 e12834 10.1111/acel.12834 30129215 Vilchez D Saez I Dillin A The role of protein clearance mechanisms in organismal ageing and age-related diseases Nat Commun 2014 5 5659 10.1038/ncomms6659 25482515 Vistain LF Tay S Single-cell proteomics Trends Biochem Sci 2021 46 661 672 10.1016/j.tibs.2021.01.013 33653632 Vitale I Manic G De Maria R Kroemer G Galluzzi L DNA damage in stem cells Mol Cell 2017 66 306 319 10.1016/j.molcel.2017.04.006 28475867 Vizioli MG Liu T Miller KN Robertson NA Gilroy K Lagnado AB Perez-Garcia A Kiourtis C Dasgupta N Lei X Mitochondria-to-nucleus retrograde signaling drives formation of cytoplasmic chromatin and inflammation in senescence Genes Dev 2020 34 428 445 10.1101/gad.331272.119 32001510 Vogt J Bengesser K Claes KBM Wimmer K Mautner VF van Minkelen R Legius E Brems H Upadhyaya M H\u00f6gel J SVA retrotransposon insertion-associated deletion represents a novel mutational mechanism underlying large genomic copy number changes with non-recurrent breakpoints Genome Biol 2014 15 R80 10.1186/gb-2014-15-6-r80 24958239 von Zglinicki T Oxidative stress shortens telomeres Trends Biochem Sci 2002 27 339 344 10.1016/S0968-0004(02)02110-2 12114022 von Zglinicki T Wan T Miwa S Senescence in post-mitotic cells: a driver of aging Antioxid Redox Signal 2021 34 308 323 10.1089/ars.2020.8048 32164429 Wagner KD Ying Y Leong W Jiang J Hu X Chen Y Michiels J F Lu Y Gilson E Wagner N The differential spatiotemporal expression pattern of shelterin genes throughout lifespan Aging 2017 9 1219 1232 10.18632/aging.101223 28437249 Waldera Lupa DM Kalfalah F Safferling K Boukamp P Poschmann G Volpi E G\u00f6tz-R\u00f6sch C Bernerd F Haag L Huebenthal U Characterization of skin aging-associated secreted proteins (SAASP) produced by dermal fibroblasts isolated from intrinsically aged human skin J Investig Dermatol 2015 135 1954 1968 10.1038/jid.2015.120 25815425 Walski M Pokorski M Antosiewicz J Rekawek A Frontczak-Baniewicz M Jernajczyk U Di Giulio C Pulmonary surfactant: ultrastructural features and putative mechanisms of aging J Physiol Pharmacol 60 Suppl 2009 5 121 125 Wan M Gray-Gaillard EF Elisseeff JH Cellular senescence in musculoskeletal homeostasis, diseases, and regeneration Bone Res 2021 9 41 10.1038/s41413-021-00164-y 34508069 Wan QL Zheng SQ Wu GS Luo HR Aspirin extends the lifespan of Caenorhabditis elegans via AMPK and DAF-16/FOXO in dietary restriction pathway Exp Gerontol 2013 48 499 506 10.1016/j.exger.2013.02.020 23485446 Wang F Zhang W Yang Q Kang Y Fan Y Wei J Liu Z Dai S Li H Li Z Generation of a Hutchinson-Gilford progeria syndrome monkey model by base editing Protein Cell 2020 11 809 824 10.1007/s13238-020-00740-8 32729022 Wang G Han T Nijhawan D Theodoropoulos P Naidoo J Yadavalli S Mirzaei H Pieper AA Ready JM McKnight SL P7C3 neuroprotective chemicals function by activating the rate-limiting enzyme in NAD salvage Cell 2014 158 1324 1334 10.1016/j.cell.2014.07.040 25215490 Wang H Diao D Shi Z Zhu X Gao Y Gao S Liu X Wu Y Rudolph KL Liu G SIRT6 controls hematopoietic stem cell homeostasis through epigenetic regulation of Wnt signaling Cell Stem Cell 2016 18 495 507 10.1016/j.stem.2016.03.005 27058938 Wang H Huang Y Yu M Yu Y Li S Wang H Sun H Li B Xu G Hu P Muscle regeneration controlled by a designated DNA dioxygenase Cell Death Dis 2021 12 535 10.1038/s41419-021-03817-2 34035232 Wang J Lu X Sakk V Klein CA Rudolph KL Senescence and apoptosis block hematopoietic activation of quiescent hematopoietic stem cells with short telomeres Blood 2014 124 3237 3240 10.1182/blood-2014-04-568055 25232057 Wang J Qian X Gao Q Lv C Xu J Jin H Zhu H Quercetin increases the antioxidant capacity of the ovary in menopausal rats and in ovarian granulosa cell culture in vitro J Ovarian Res 2018 11 51 10.1186/s13048-018-0421-0 29929541 Wang L Chen R Li G Wang Z Liu J Liang Y Liu JP FBW7 mediates senescence and pulmonary fibrosis through telomere uncapping Cell Metab 2020 32 860 877 10.1016/j.cmet.2020.10.004 33086033 Wang, L., Liu, J., Liu, H., Yazawa, M., and Zhu, F. (2022a). The secret of youth\u2014how is systemic rejuvenation achieved at the single cell level? Life Med, doi: 10.1093/lifemedi/lnac018. Wang L Zeng X Ryoo HD Jasper H Integration of UPRER and oxidative stress signaling in the control of intestinal stem cell proliferation PLoS Genet 2014 10 e1004568 10.1371/journal.pgen.1004568 25166757 Wang N He Y Liu S Makarcyzk MJ Lei G Chang A Alexander PG Hao T Padget AM de Pedro N Engineering osteoarthritic cartilage model through differentiating senescent human mesenchymal stem cells for testing disease-modifying drugs Sci China Life Sci 2022 65 309 327 10.1007/s11427-021-1933-7 34109475 Wang R Sun H Ren H Wang G \u03b1-Synuclein aggregation and transmission in Parkinson\u2019s disease: a link to mitochondria and lysosome Sci China Life Sci 2020 63 1850 1859 10.1007/s11427-020-1756-9 32681494 Wang S Min Z Ji Q Geng L Su Y Liu Z Hu H Wang L Zhang W Suzuiki K Rescue of premature aging defects in Cockayne syndrome stem cells by CRISPR/Cas9-mediated gene correction Protein Cell 2020 11 1 22 10.1007/s13238-019-0623-2 31037510 Wang S Yao X Ma S Ping Y Fan Y Sun S He Z Shi Y Sun L Xiao S A single-cell transcriptomic landscape of the lungs of patients with COVID-19 Nat Cell Biol 2021 23 1314 1328 10.1038/s41556-021-00796-6 34876692 Wang S Zheng Y Li J Yu Y Zhang W Song M Liu Z Min Z Hu H Jing Y Single-cell transcriptomic atlas of primate ovarian aging Cell 2020 180 585 600 10.1016/j.cell.2020.01.009 32004457 Wang S Zheng Y Li Q He X Ren R Zhang W Song M Hu H Liu F Sun G Deciphering primate retinal aging at single-cell resolution Protein Cell 2021 12 889 898 10.1007/s13238-020-00791-x 33051815 Wang, W., Zheng, Y., Sun, S., Li, W., Song, M., Ji, Q., Wu, Z., Liu, Z., Fan, Y., Liu, F., et al. (2021d). A genome-wide CRISPR-based screen identifies KAT7 as a driver of cellular senescence. Sci Transl Med 13. Wang, X., Allen, W.E., Wright, M.A., Sylwestrak, E.L., Samusik, N., Vesuna, S., Evans, K., Liu, C., Ramakrishnan, C., Liu, J., et al. (2018b). Three-dimensional intact-tissue sequencing of single-cell transcriptional states. Science 361. Wang Y Fu Z Li X Liang Y Pei S Hao S Zhu Q Yu T Pei Y Yuan J Cytoplasmic DNA sensing by KU complex in aged CD4 + T cell potentiates T cell activation and aging-related autoimmune inflammation Immunity 2021 54 632 647 10.1016/j.immuni.2021.02.003 33667382 Wang, Y., and Ng, S.-C. (2022). Sphingolipids mediate lipotoxicity in muscular dystrophies. Life Med, doi: 10.1093/lifemedi/lnac015/6619267. Wang Y Tong Q Ma SR Zhao ZX Pan LB Cong L Han P Peng R Yu H Lin Y Oral berberine improves brain dopa/dopamine levels to ameliorate Parkinson\u2019s disease by regulating gut microbiota Sig Transduct Target Ther 2021 6 77 10.1038/s41392-020-00456-5 Wang Y Welc SS Wehling-Henricks M Tidball JG Myeloid cell-derived tumor necrosis factor-alpha promotes sarcopenia and regulates muscle cell fusion with aging muscle fibers Aging Cell 2018 17 e12828 10.1111/acel.12828 30256507 Wang Y Zheng JP Luo Y Wang J Xu L Wang J Sedivy JM Song Z Wang H Ju Z L1 drives HSC aging and affects prognosis of chronic myelomonocytic leukemia Sig Transduct Target Ther 2020 5 205 10.1038/s41392-020-00279-4 Wansleeben C Bowie E Hotten DF Yu YRA Hogan BLM Age-related changes in the cellular composition and epithelial organization of the mouse trachea PLoS ONE 2014 9 e93496 10.1371/journal.pone.0093496 24675804 Watanabe K Ikuno Y Kakeya Y Ikeno S Taniura H Kurono M Minemori K Katsuyama Y Naka-Kaneda H Age-related dysfunction of the DNA damage response in intestinal stem cells Inflamm Regener 2019 39 8 10.1186/s41232-019-0096-y Watson JK Sanders P Dunmore R Rosignoli G Jul\u00e9 Y Rawlins E L Mustelin T May R Clarke D Finch DK Distal lung epithelial progenitor cell function declines with age Sci Rep 2020 10 10490 10.1038/s41598-020-66966-y 32591591 Watt FM Fujiwara H Cell-extracellular matrix interactions in normal and diseased skin Cold Spring Harbor Perspect Biol 2011 3 a005124 10.1101/cshperspect.a005124 Wei, R., He, S., Bai, S., Sei, E., Hu, M., Thompson, A., Chen, K., Krishnamurthy, S., and Navin, N.E. (2022a). Spatial charting of single-cell transcriptomes in tissues. Nat Biotechnol, doi: 10.1038/s41587-022-01233-1. Wei, T., Tao, W., and Cheng, Q. (2022b). Lipid nanoparticles for mRNA therapy: recent advances in targeted delivery. Life Med, doi: 10.1093/lifemedi/lnac004. Weir CP Robaire B Spermatozoa have decreased antioxidant enzymatic capacity and increased reactive oxygen species production during aging in the Brown Norway rat J Androl 2007 28 229 240 10.2164/jandrol.106.001362 17021340 Welch JD Hartemink AJ Prins JF MATCHER: manifold alignment reveals correspondence between single cell transcriptome and epigenome dynamics Genome Biol 2017 18 138 10.1186/s13059-017-1269-0 28738873 Welch JD Kozareva V Ferreira A Vanderburg C Martin C Macosko EZ Single-cell multi-omic integration compares and contrasts features of brain cell identity Cell 2019 177 1873 1887 10.1016/j.cell.2019.05.006 31178122 White E Lattime EC Guo JY Autophagy regulates stress responses, metabolism, and anticancer immunity Trends Cancer 2021 7 778 789 10.1016/j.trecan.2021.05.003 34112622 White JP Billin AN Campbell ME Russell AJ Huffman KM Kraus WE The AMPK/p27Kip1 axis regulates autophagy/apoptosis decisions in aged skeletal muscle stem cells Stem Cell Rep 2018 11 425 439 10.1016/j.stemcr.2018.06.014 White TA LeBrasseur NK Myostatin and sarcopenia: opportunities and challenges\u2014a mini-review Gerontology 2014 60 289 293 10.1159/000356740 24457615 Whitehead N Gill JF Brink M Handschin C Moderate modulation of cardiac PGC-1\u03b1 expression partially affects age-associated transcriptional remodeling of the heart Front Physiol 2018 9 242 10.3389/fphys.2018.00242 29618980 Wiley CD Campisi J From ancient pathways to aging cells \u2014connecting metabolism and cellular senescence Cell Metab 2016 23 1013 1021 10.1016/j.cmet.2016.05.010 27304503 Wiley CD Campisi J The metabolic roots of senescence: mechanisms and opportunities for intervention Nat Metab 2021 3 1290 1301 10.1038/s42255-021-00483-8 34663974 Willcox BJ Donlon TA He Q Chen R Grove JS Yano K Masaki KH Willcox DC Rodriguez B Curb JD FOXO3A genotype is strongly associated with human longevity Proc Natl Acad Sci USA 2008 105 13987 13992 10.1073/pnas.0801030105 18765803 Wilkinson JE Burmeister L Brooks SV Chan CC Friedline S Harrison DE Hejtmancik JF Nadon N Strong R Wood LK Rapamycin slows aging in mice Aging Cell 2012 11 675 682 10.1111/j.1474-9726.2012.00832.x 22587563 Willcox DC Willcox BJ Hsueh WC Suzuki M Genetic determinants of exceptional human longevity: insights from the Okinawa Centenarian Study Age 2006 28 313 332 10.1007/s11357-006-9020-x 22253498 Williams GC Pleiotropy, natural selection, and the evolution of senescence Evolution 1957 11 398 411 10.1111/j.1558-5646.1957.tb02911.x Wilmanski T Diener C Rappaport N Patwardhan S Wiedrick J Lapidus J Earls JC Zimmer A Glusman G Robinson M Gut microbiome pattern reflects healthy ageing and predicts survival in humans Nat Metab 2021 3 274 286 10.1038/s42255-021-00348-0 33619379 Wingo AP Dammer EB Breen MS Logsdon BA Duong DM Troncosco JC Thambisetty M Beach TG Serrano GE Reiman EM Large-scale proteomic analysis of human brain identifies proteins associated with cognitive trajectory in advanced age Nat Commun 2019 10 1619 10.1038/s41467-019-09613-z 30962425 Wlosinska M Nilsson AC Hlebowicz J Fakhro M Malmsj\u00f6 M Lindstedt S Aged garlic extract reduces IL-6: a double-blind placebo-controlled trial in females with a low risk of cardiovascular disease Evid-Based Complement Alternat Med 2021 2021 1 9 10.1155/2021/6636875 Wolff EM Byun HM Han HF Sharma S Nichols PW Siegmund KD Yang AS Jones PA Liang G Hypomethylation of a LINE-1 promoter activates an alternate transcript of the MET oncogene in bladders with cancer PLoS Genet 2010 6 e1000917 10.1371/journal.pgen.1000917 20421991 Wong CK Smith CA Sakamoto K Kaminski N Koff JL Goldstein DR Aging impairs alveolar macrophage phagocytosis and increases influenza-induced mortality in mice J Immunol 2017 199 1060 1068 10.4049/jimmunol.1700397 28646038 Wood JG Jones BC Jiang N Chang C Hosier S Wickremesinghe P Garcia M Hartnett DA Burhenn L Neretti N Chromatin-modifying genetic interventions suppress age-associated transposable element activation and extend life span in Drosophila Proc Natl Acad Sci USA 2016 113 11277 11282 10.1073/pnas.1604621113 27621458 Woodruff-Pak DS Foy MR Akopian GG Lee KH Zach J Nguyen KPT Comalli DM Kennard JA Agelan A Thompson RF Differential effects and rates of normal aging in cerebellum and hippocampus Proc Natl Acad Sci USA 2010 107 1624 1629 10.1073/pnas.0914207107 20080589 Woods DC Tilly JL Autologous germline mitochondrial energy transfer (augment) in human assisted reproduction Semin Reprod Med 2015 33 410 421 10.1055/s-0035-1567826 26574741 Wu A Song H Regulation of alveolar type 2 stem/progenitor cells in lung injury and regeneration Acta Biochim Biophys Sin 2020 52 716 722 10.1093/abbs/gmaa052 32445469 Wu H Yu Y Huang H Hu Y Fu S Wang Z Shi M Zhao X Yuan J Li J Progressive pulmonary fibrosis is caused by elevated mechanical tension on alveolar stem cells Cell 2020 180 107 121 10.1016/j.cell.2019.11.027 31866069 Wu J Wang J Jiang S Xu J Di Q Zhou C Min X Pang S Wang H Xu D The efficacy and safety of low intensity warfarin therapy in Chinese elderly atrial fibrillation patients with high CHADS2 risk score Int J Cardiol 2013 167 3067 3068 10.1016/j.ijcard.2012.11.078 23200268 Wu P Takai H de Lange T Telomeric 3, overhangs derive from resection by Exo1 and Apollo and fill-in by POT1b-associated CST Cell 2012 150 39 52 10.1016/j.cell.2012.05.026 22748632 Wu Z Shi Y Lu M Song M Yu Z Wang J Wang S Ren J Yang YG Liu GH METTL3 counteracts premature aging via m6A-dependent stabilization of MIS12 mRNA Nucl Acids Res 2020 48 11083 11096 10.1093/nar/gkaa816 33035345 Wu Z Wang S Belmonte JCI Zhang W Qu J Liu GH Emerging role of RNA m6A modification in aging regulation Curr Med 2022 1 8 10.1007/s44194-022-00009-8 Wu Z Zhang W Song M Wang W Wei G Li W Lei J Huang Y Sang Y Chan P Differential stem cell aging kinetics in Hutchinson-Gilford progeria syndrome and Werner syndrome Protein Cell 2018 9 333 350 10.1007/s13238-018-0517-8 29476423 Wu, Z., and Zhou, X. (2022). Hematopoietic anomalies fuels multiple sclerosis. Life Med, doi: 10.1093/lifemedi/lnac019/6623904. Xia X Chen X Wu G Li F Wang Y Chen Y Chen M Wang X Chen W Xian B Three-dimensional facial-image analysis to predict heterogeneity of the human ageing rate and the impact of lifestyle Nat Metab 2020 2 946 957 10.1038/s42255-020-00270-x 32895578 Xia X Wang Y Yu Z Chen J Han JDJ Assessing the rate of aging to monitor aging itself Ageing Res Rev 2021 69 101350 10.1016/j.arr.2021.101350 33940202 Xiao FH Chen XQ He YH Kong QP Accelerated DNA methylation changes in middle-aged men define sexual dimorphism in human lifespans Clin Epigenet 2018 10 133 10.1186/s13148-018-0573-1 Xiao FH Chen XQ Yu Q Ye Y Liu YW Yan D Yang LQ Chen G Lin R Yang L Transcriptome evidence reveals enhanced autophagy-lysosomal function in centenarians Genome Res 2018 28 1601 1610 10.1101/gr.220780.117 30352807 Xiao FH Wang HT Kong QP Dynamic DNA methylation during aging: a \u201cprophet\u201d of age-related outcomes Front Genet 2019 10 107 10.3389/fgene.2019.00107 30833961 Xiao H Jedrychowski MP Schweppe DK Huttlin EL Yu Q Heppner DE Li J Long J Mills EL Szpyt J A quantitative tissue-specific landscape of protein redox regulation during aging Cell 2020 180 968 983 10.1016/j.cell.2020.02.012 32109415 Xie C Zhuang XX Niu Z Ai R Lautrup S Zheng S Jiang Y Han R Gupta TS Cao S Amelioration of Alzheimer\u2019s disease pathology by mitophagy inducers identified via machine learning and a cross-species workflow Nat Biomed Eng 2022 6 76 93 10.1038/s41551-021-00819-5 34992270 Xie H Cui Z Wang L Xia Z Hu Y Xian L Li C Xie L Crane J Wan M PDGF-BB secreted by preosteoclasts induces angiogenesis during coupling with osteogenesis Nat Med 2014 20 1270 1278 10.1038/nm.3668 25282358 Xie J Ge W Li N Liu Q Chen F Yang X Huang X Ouyang Z Zhang Q Zhao Y Efficient base editing for multiple genes and loci in pigs using base editors Nat Commun 2019 10 2852 10.1038/s41467-019-10421-8 31253764 Xie Y Chen D Jiang K Song L Qian N Du Y Yang Y Wang F Chen T Hair shaft miniaturization causes stem cell depletion through mechanosensory signals mediated by a Piezo1-calcium-TNF-\u03b1 axis Cell Stem Cell 2022 29 70 85 10.1016/j.stem.2021.09.009 34624205 Xin H Liu D Wan M Safari A Kim H Sun W O\u2019Connor MS Songyang Z TPP1 is a homologue of ciliate TEBP-\u03b2 and interacts with POT1 to recruit telomerase Nature 2007 445 559 562 10.1038/nature05469 17237767 Xu Q Fu Q Li Z Liu H Wang Y Lin X He R Zhang X Ju Z Campisi J The flavonoid procyanidin C1 has senotherapeutic activity and increases lifespan in mice Nat Metab 2021 3 1706 1726 10.1038/s42255-021-00491-8 34873338 Xu R Yallowitz A Qin A Wu Z Shin DY Kim JM Debnath S Ji G Bostrom MP Yang X Targeting skeletal endothelium to ameliorate bone loss Nat Med 2018 24 823 833 10.1038/s41591-018-0020-z 29785024 Xu Y Wu Z Liu L Liu J Wang Y Rat model of cockayne syndrome neurological disease Cell Rep 2019 29 800 809 10.1016/j.celrep.2019.09.028 31644904 Xu Z Zhang L Zhang W Meng D Zhang H Jiang Y Xu X Van Meter M Seluanov A Gorbunova V SIRT6 rescues the age related decline in base excision repair in a PARP1-dependent manner Cell Cycle 2015 14 269 276 10.4161/15384101.2014.980641 25607651 Yamashita M Passegu\u00e9 E TNF-\u03b1 coordinates hematopoietic stem cell survival and myeloid regeneration Cell Stem Cell 2019 25 357 372 10.1016/j.stem.2019.05.019 31230859 Yan C Liu J Gao J Sun Y Zhang L Song H Xue L Zhan L Gao G Ke Z IRE1 promotes neurodegeneration through autophagy-dependent neuron death in the Drosophila model of Parkinson\u2019s disease Cell Death Dis 2019 10 800 10.1038/s41419-019-2039-6 31641108 Yan HX Wu HP Zhang HL Ashton C Tong C Wu J Qian QJ Wang HY Ying QL DNA damage-induced sustained p53 activation contributes to inflammation-associated hepato-carcinogenesis in rats Oncogene 2013 32 4565 4571 10.1038/onc.2012.451 23069657 Yan L Gao S Ho D Park M Ge H Wang C Tian Y Lai L De Lorenzo MS Vatner DE Calorie restriction can reverse, as well as prevent, aging cardiomyopathy Age 2013 35 2177 2182 10.1007/s11357-012-9508-5 23334601 Yan P Li Q Wang L Lu P Suzuki K Liu Z Lei J Li W He X Wang S FOXO3-engineered human ESC-derived vascular cells promote vascular protection and regeneration Cell Stem Cell 2019 24 447 461 10.1016/j.stem.2018.12.002 30661960 Yan P Ren J Zhang W Qu J Liu GH Protein quality control of cell stemness Cell regeneration (London, England) 2020 9 22 10.1186/s13619-020-00064-2 33179756 Yan S Tu Z Liu Z Fan N Yang H Yang S Yang W Zhao Y Ouyang Z Lai C A huntingtin knockin pig model recapitulates features of selective neurodegeneration in Huntington\u2019s disease Cell 2018 173 989 1002 10.1016/j.cell.2018.03.005 29606351 Yanai H Shteinberg A Porat Z Budovsky A Braiman A Ziesche R Zeische R Fraifeld VE Cellular senescence-like features of lung fibroblasts derived from idiopathic pulmonary fibrosis patients Aging 2015 7 664 672 10.18632/aging.100807 26399448 Yang H Wang H Ren J Chen Q Chen ZJ cGAS is essential for cellular senescence Proc Natl Acad Sci USA 2017 114 E4612 E4620 10.1073/pnas.1705499114 28533362 Yang NC Hu ML The limitations and validities of senescence associated-\u03b2-galactosidase activity as an aging marker for human foreskin fibroblast Hs68 cells Exp Gerontol 2005 40 813 819 10.1016/j.exger.2005.07.011 16154306 Yang W Hu P Skeletal muscle regeneration is modulated by inflammation J Orthop Translat 2018 13 25 32 10.1016/j.jot.2018.01.002 29662788 Yang W Yang L Wang J Zhang Y Li S Yin Q Suo J Ma R Ye Y Cheng H Msi2-mediated MiR7a-1 processing repression promotes myogenesis J Cachexia Sarcopenia Muscle 2022 13 728 742 10.1002/jcsm.12882 34877814 Yang Y Kueh AJ Grant ZL Abeysekera W Garnham AL Wilcox S Hyland CD Di Rago L Metcalf D Alexander WS The histone lysine acetyltransferase HBO1 (KAT7) regulates hematopoietic stem cell quiescence and self-renewal Blood 2022 139 845 858 10.1182/blood.2021013954 34724565 Yang, Y., Li, X., Zhang, T., and Xu, D. (2022b). RIP kinases and necroptosis in aging and aging-related diseases. Life Med, doi: 10.1093/lifemedi/lnac003. Yatsenko AN Turek PJ Reproductive genetics and the aging male J Assist Reprod Genet 2018 35 933 941 10.1007/s10815-018-1148-y 29524155 Ye J Lenain C Bauwens S Rizzo A Saint-L\u00e9ger A Poulet A Benarroch D Magdinier F Morere J Amiard S TRF2 and apollo cooperate with topoisomerase 2\u03b1 to protect human telomeres from replicative damage Cell 2010 142 230 242 10.1016/j.cell.2010.05.032 20655466 Yin J Yang L Xie Y Liu Y Li S Yang W Xu B Ji H Ding L Wang K Dkk3 dependent transcriptional regulation controls age related skeletal muscle atrophy Nat Commun 2018 9 1752 10.1038/s41467-018-04038-6 29717119 Ying Y Hu X Han P Mendez-Bermudez A Bauwens S Eid R Tan L Pousse M Giraud-Panis MJ Lu Y The non-telomeric evolutionary trajectory of TRF2 in zebrafish reveals its specific roles in neurodevelopment and aging Nucl Acids Res 2022 50 2081 2095 10.1093/nar/gkac065 35150283 Yoon MS The role of mammalian target of rapamycin (mTOR) in insulin signaling Nutrients 2017 9 1176 10.3390/nu9111176 29077002 Youle RJ van der Bliek AM Mitochondrial fission, fusion, and stress Science 2012 337 1062 1065 10.1126/science.1219855 22936770 Young JI Sedivy JM Smith JR Telomerase expression in normal human fibroblasts stabilizes DNA 5-methylcytosine transferase I J Biol Chem 2003 278 19904 19908 10.1074/jbc.M301685200 12665523 Yu B Chang J Liu Y Li J Kevork K Al-Hezaimi K Graves DT Park NH Wang CY Wnt4 signaling prevents skeletal aging and inflammation by inhibiting nuclear factor-\u03baB Nat Med 2014 20 1009 1017 10.1038/nm.3586 25108526 Yu B Huo L Liu Y Deng P Szymanski J Li J Luo X Hong C Lin J Wang CY PGC-1\u03b1 controls skeletal stem cell fate and bone-fat balance in osteoporosis and skeletal aging by inducing TAZ Cell Stem Cell 2018 23 193 209 10.1016/j.stem.2018.06.009 30017591 Yu Q Katlinskaya YV Carbone CJ Zhao B Katlinski KV Zheng H Guha M Li N Chen Q Yang T DNA-damage-induced type I interferon promotes senescence and inhibits stem cell function Cell Rep 2015 11 785 797 10.1016/j.celrep.2015.03.069 25921537 Yu Y Zhao Y Teng F Li J Guan Y Xu J Lv X Guan F Zhang M Chen L Berberine improves cognitive deficiency and muscular dysfunction via activation of the AMPK/SIRT1/PGC-1a pathway in skeletal muscle from naturally aging rats J Nutr Health Aging 2018 22 710 717 10.1007/s12603-018-1015-7 29806860 Yuan J Chang SY Yin SG Liu ZY Cheng X Liu XJ Jiang Q Gao G Lin DY Kang XL Two conserved epigenetic regulators prevent healthy ageing Nature 2020 579 118 122 10.1038/s41586-020-2037-y 32103178 Yuan L Alexander PB Wang XF Cellular senescence: from anti-cancer weapon to anti-aging target Sci China Life Sci 2020 63 332 342 10.1007/s11427-019-1629-6 32060861 Yue F Li W Zou J Jiang X Xu G Huang H Liu L Spermidine Prolongs Lifespan and Prevents Liver Fibrosis and Hepatocellular Carcinoma by Activating MAP1S-Mediated Autophagy Cancer Res 2017 77 2938 2951 10.1158/0008-5472.CAN-16-3462 28386016 Zabolotneva AA Zhavoronkov AA Shegay PV Gaifullin NM Alekseev BY Roumiantsev SA Garazha AV Kovalchuk O Aravin A Buzdin AA A systematic experimental evaluation of microRNA markers of human bladder cancer Front Genet 2013 4 247 10.3389/fgene.2013.00247 24298280 Zada D Sela Y Matosevich N Monsonego A Lerer-Goldshtein T Nir Y Appelbaum L Parp1 promotes sleep, which enhances DNA repair in neurons Mol Cell 2021 81 4979 4993 10.1016/j.molcel.2021.10.026 34798058 Zambrano E Nathanielsz PW Rodr\u00edguez-Gonz\u00e1lez GL Developmental programming and ageing of male reproductive function Eur J Clin Invest 2021 51 e13637 10.1111/eci.13637 34107063 Zeng L Yang J Peng S Zhu J Zhang B Suh Y Tu Z Transcriptome analysis reveals the difference between \u201chealthy\u201d and \u201ccommon\u201d aging and their connection with age-related diseases Aging Cell 2020 19 e13121 10.1111/acel.13121 32077223 Zhang B Long Q Wu S Xu Q Song S Han L Qian M Ren X Liu H Jiang J KDM4 orchestrates epigenomic remodeling of senescent cells and potentiates the senescence-associated secretory phenotype Nat Aging 2021 1 454 472 10.1038/s43587-021-00063-1 34263179 Zhang B Ma S Rachmin I He M Baral P Choi S Gon\u00e7alves W A Shwartz Y Fast EM Su Y Hyperactivation of sympathetic nerves drives depletion of melanocyte stem cells Nature 2020 577 676 681 10.1038/s41586-020-1935-3 31969699 Zhang B Fu D Xu Q Cong X Wu C Zhong X Ma Y Lv Z Chen F Han L The senescence-associated secretory phenotype is potentiated by feedforward regulatory mechanisms involving Zscan4 and TAK1 Nat Commun 2018 9 1723 10.1038/s41467-018-04010-4 29712904 Zhang C Wang D Wang J Wang L Qiu W Kume T Dowell R Yi R Escape of hair follicle stem cells causes stem cell exhaustion during aging Nat Aging 2021 1 889 903 10.1038/s43587-021-00103-w Zhang CS Hawley SA Zong Y Li M Wang Z Gray A Ma T Cui J Feng JW Zhu M Fructose-1,6-bisphosphate and aldolase mediate glucose sensing by AMPK Nature 2017 548 112 116 10.1038/nature23275 28723898 Zhang D Chen G Manwani D Mortha A Xu C Faith JJ Burk R D Kunisaki Y Jang JE Scheiermann C Neutrophil ageing is regulated by the microbiome Nature 2015 525 528 532 10.1038/nature15367 26374999 Zhang, F., Qiu, H., Dong, X., Zhang, X., Wang, C., Li, X., Zhang, X., Na, J., Zhou, J., and Wang, C. (2022a). Single-cell atlas of multilineage cardiac organoids derived from human induced pluripotent stem cells. Life Med, doi: 10.1093/lifemedi/lnac002/6608232. Zhang G Li J Purkayastha S Tang Y Zhang H Yin Y Li B Liu G Cai D Hypothalamic programming of systemic ageing involving IKK-\u03b2, NF-\u03baB and GnRH Nature 2013 497 211 216 10.1038/nature12143 23636330 Zhang G Cowled C Shi Z Huang Z Bishop-Lilly KA Fang X Wynne JW Xiong Z Baker ML Zhao W Comparative analysis of bat genomes provides insight into the evolution of flight and immunity Science 2013 339 456 460 10.1126/science.1230835 23258410 Zhang H Li J Ren J Sun S Ma S Zhang W Yu Y Cai Y Yan K Li W Single-nucleus transcriptomic landscape of primate hippocampal aging Protein Cell 2021 12 695 716 10.1007/s13238-021-00852-9 34052996 Zhang H Ryu D Wu Y Gariani K Wang X Luan P D\u2019Amico D Ropelle ER Lutolf MP Aebersold R NAD + repletion improves mitochondrial and stem cell function and enhances life span in mice Science 2016 352 1436 1443 10.1126/science.aaf2693 27127236 Zhang K Wang L Hong X Chen H Shi Y Liu Y Liu J Liu JP Pulmonary alveolar stem cell senescence, apoptosis, and differentiation by p53-dependent and -independent mechanisms in telomerase-deficient mice Cells 2021 10 2892 10.3390/cells10112892 34831112 Zhang L Mack R Breslin P Zhang J Molecular and cellular mechanisms of aging in hematopoietic stem cells and their niches J Hematol Oncol 2020 13 157 10.1186/s13045-020-00994-z 33228751 Zhang Q Li D Dong X Zhang X Liu J Peng L Meng B Hua Q Pei X Zhao L LncDACH1 promotes mitochondrial oxidative stress of cardiomyocytes by interacting with sirtuin3 and aggravates diabetic cardiomyopathy Sci China Life Sci 2022 65 1198 1212 10.1007/s11427-021-1982-8 34668131 Zhang Q Tian Y Molecular insights into the transgenerational inheritance of stress memory J Genet Genom 2022 49 89 95 10.1016/j.jgg.2021.11.015 Zhang Q Wang Z Zhang W Wen Q Li X Zhou J Wu X Guo Y Liu Y Wei C The memory of neuronal mitochondrial stress is inherited transgenerationally via elevated mitochondrial DNA levels Nat Cell Biol 2021 23 870 880 10.1038/s41556-021-00724-8 34341532 Zhang Q Wu X Chen P Liu L Xin N Tian Y Dillin A The mitochondrial unfolded protein response is mediated cell-non-autonomously by retromer-dependent wnt signaling Cell 2018 174 870 883 10.1016/j.cell.2018.06.029 30057120 Zhang W Li J Suzuki K Qu J Wang P Zhou J Liu X Ren R Xu X Ocampo A A Werner syndrome stem cell model unveils heterochromatin alterations as a driver of human aging Science 2015 348 1160 1163 10.1126/science.aaa1356 25931448 Zhang W Qu J Liu GH Belmonte JCI The ageing epigenome and its rejuvenation Nat Rev Mol Cell Biol 2020 21 137 150 10.1038/s41580-019-0204-5 32020082 Zhang W Wan H Feng G Qu J Wang J Jing Y Ren R Liu Z Zhang L Chen Z SIRT6 deficiency results in developmental retardation in cynomolgus monkeys Nature 2018 560 661 665 10.1038/s41586-018-0437-z 30135584 Zhang W Zhang S Yan P Ren J Song M Li J Lei J Pan H Wang S Ma X A single-cell transcriptomic landscape of primate arterial aging Nat Commun 2020 11 2202 10.1038/s41467-020-15997-0 32371953 Zhang X Liu X Du Z Wei L Fang H Dong Q Niu J Li Y Gao J Zhang MQ The loss of heterochromatin is associated with multiscale three-dimensional genome reorganization and aberrant transcription during cellular senescence Genome Res 2021 31 1121 1135 10.1101/gr.275235.121 34140314 Zhang X Liu Z Liu X Wang S Zhang Y He X Sun S Ma S Shyh-Chang N Liu F Telomere-dependent and telomere-independent roles of RAP1 in regulating human stem cell homeostasis Protein Cell 2019 10 649 667 10.1007/s13238-019-0610-7 30796637 Zhang X Zhong H Li Y Shi Z Ren H Zhang Z Zhou X Tang S Han X Lin Y Sex- and age-related trajectories of the adult human gut microbiota shared across populations of different ethnicities Nat Aging 2021 1 87 100 10.1038/s43587-020-00014-2 Zhang Y Kim MS Jia B Yan J Zuniga-Hertz JP Han C Cai D Hypothalamic stem cells control ageing speed partly through exosomal miRNAs Nature 2017 548 52 57 10.1038/nature23282 28746310 Zhao, D., and Chen, S. (2022). Failures at every level: breakdown of the epigenetic machinery of aging. Life Med, doi: 10.1093/lifemedi/lnac016/6619235. Zhao H Ji Q Wu Z Wang S Ren J Yan K Wang Z Hu J Chu Q Hu H Destabilizing heterochromatin by APOE mediates senescence Nat Aging 2022 2 303 316 10.1038/s43587-022-00186-z Zhao H Ma N Chen Q You X Liu C Wang T Yuan D Zhang C Decline in testicular function in ageing rats: changes in the unfolded protein response and mitochondrial apoptotic pathway Exp Gerontology 2019 127 110721 10.1016/j.exger.2019.110721 Zhao J Zhang L Lu A Han Y Colangelo D Bukata C Scibetta A Yousefzadeh MJ Li X Gurkar AU ATM is a key driver of NF-\u03baB-dependent DNA-damage-induced senescence, stem cell dysfunction and aging Aging 2020 12 4688 4710 10.18632/aging.102863 32201398 Zhao P Huang P Xu T Xiang X Sun Y Liu J Yan C Wang L Gao J Cui S Fat body Ire1 regulates lipid homeostasis through the Xbp1s-FoxO axis in Drosophila iScience 2021 24 102819 10.1016/j.isci.2021.102819 34381963 Zhao Y Oreskovic E Zhang Q Lu Q Gilman A Lin YS He J Zheng Z Lu JY Lee J Transposon-triggered innate immune response confers cancer resistance to the blind mole rat Nat Immunol 2021 22 1219 1230 10.1038/s41590-021-01027-8 34556881 Zhavoronkov A Bhullar B Classifying aging as a disease in the context of ICD-11 Front Genet 2015 6 326 10.3389/fgene.2015.00326 26583032 Zhavoronkov A Kochetov K Diamandis P Mitina M PsychoAge and SubjAge: development of deep markers of psychological and subjective age using artificial intelligence Aging 2020 12 23548 23577 10.18632/aging.202344 33303702 Zheng C Tosti A Alopecia areata: new treatment options including janus kinase inhibitors Dermatologic Clin 2021 39 407 415 10.1016/j.det.2021.03.005 Zheng Y Liu X Le W Xie L Li H Wen W Wang S Ma S Huang Z Ye J A human circulating immune cell landscape in aging and COVID-19 Protein Cell 2020 11 740 770 10.1007/s13238-020-00762-2 32780218 Zhong FL Batista LFZ Freund A Pech MF Venteicher AS Artandi SE TPP1 OB-fold domain controls telomere maintenance by recruiting telomerase to chromosome ends Cell 2012 150 481 494 10.1016/j.cell.2012.07.012 22863003 Zhou B Yang L Li S Huang J Chen H Hou L Wang J Green C D Yan Z Huang X Midlife gene expressions identify modulators of aging through dietary interventions Proc Natl Acad Sci USA 2012 109 E1201 E1209 10.1073/pnas.1119304109 22509016 Zhou M Deng Y Liu M Liao L Dai X Guo C Zhao X He L Peng C Li Y The pharmacological activity of berberine, a review for liver protection Eur J Pharmacol 2021 890 173655 10.1016/j.ejphar.2020.173655 33068590 Zhou R Yazdi AS Menu P Tschopp J A role for mitochondria in NLRP3 inflammasome activation Nature 2011 469 221 225 10.1038/nature09663 21124315 Zhou X Dou Q Fan G Zhang Q Sanderford M Kaya A Johnson J Karlsson EK Tian X Mikhalchenko A Beaver and naked mole rat genomes reveal common paths to longevity Cell Rep 2020 32 107949 10.1016/j.celrep.2020.107949 32726638 Zhu D Wu X Zhou J Li X Huang X Li J Wu J Bian Q Wang Y Tian Y NuRD mediates mitochondrial stress-induced longevity via chromatin remodeling in response to acetyl-CoA level Sci Adv 2020 6 eabb2529 10.1126/sciadv.abb2529 32789178 Zhu J Wang J Wang X Gao M Guo B Gao M Liu J Yu Y Wang L Kong W Prediction of drug efficacy from transcriptional profiles with deep learning Nat Biotechnol 2021 39 1444 1452 10.1038/s41587-021-00946-z 34140681 Zhu X Li B Lou P Dai T Chen Y Zhuge A Yuan Y Li L The relationship between the gut microbiome and neurodegenerative diseases Neurosci Bull 2021 37 1510 1522 10.1007/s12264-021-00730-8 34216356 Zierer J Pallister T Tsai PC Krumsiek J Bell JT Lauc G Spector TD Menni C Kastenm\u00fcller G Exploring the molecular basis of age-related disease comorbidities using a multi-omics graphical model Sci Rep 2016 6 37646 10.1038/srep37646 27886242 Zile MR Gaasch WH Carroll JD Feldman MD Aurigemma GP Schaer GL Ghali JK Liebson PR Heart failure with a normal ejection fraction Circulation 2001 104 779 782 10.1161/hc3201.094226 11502702 Zimmermann M Kibe T Kabir S de Lange T TRF1 negotiates TTAGGG repeat-associated replication problems by recruiting the BLM helicase and the TPP1/POT1 repressor of ATR signaling Genes Dev 2014 28 2477 2491 10.1101/gad.251611.114 25344324 Zong C Lu S Chapman AR Xie XS Genome-wide detection of single-nucleotide and copy-number variations of a single human cell Science 2012 338 1622 1626 10.1126/science.1229164 23258894 Zou Z Long X Zhao Q Zheng Y Song M Ma S Jing Y Wang S He Y Esteban CR A single-cell transcriptomic atlas of human skin aging Dev Cell 2021 56 383 397 10.1016/j.devcel.2020.11.002 33238152",
    "full_text_abstract": "Aging is characterized by a progressive deterioration of physiological integrity, leading to impaired functional ability and ultimately increased susceptibility to death. It is a major risk factor for chronic human diseases, including cardiovascular disease, diabetes, neurological degeneration, and cancer. Therefore, the growing emphasis on \u201chealthy aging\u201d raises a series of important questions in life and social sciences. In recent years, there has been unprecedented progress in aging research, particularly the discovery that the rate of aging is at least partly controlled by evolutionarily conserved genetic pathways and biological processes. In an attempt to bring full-fledged understanding to both the aging process and age-associated diseases, we review the descriptive, conceptual, and interventive aspects of the landscape of aging composed of a number of layers at the cellular, tissue, organ, organ system, and organismal levels."
}