{
    "PMC": "1971872",
    "DOI": "10.1038/bjc.1991.79",
    "PMID": "2003971",
    "PMCID": "PMC1971872",
    "title": "The genetics of retinoblastoma.",
    "year": 1991,
    "source_url": "https://europepmc.org/article/PMC/PMC1971872",
    "source": "MED",
    "full_text": "pmc Br J Cancer Br J Cancer British Journal of Cancer 0007-0920 1532-1827 Nature Publishing Group 1971872 2003971 Research Article The genetics of retinoblastoma. Cowell J. K. 3 1991 63 3 333 336 https://creativecommons.org/licenses/by/4.0/ This article is licensed under a Creative Commons Attribution 4.0 International License, which permits use, sharing, adaptation, distribution and reproduction in any medium or format, as long as you give appropriate credit to the original author(s) and the source, provide a link to the Creative Commons license, and indicate if changes were made. The images or other third party material in this article are included in the article\u2019s Creative Commons license, unless indicated otherwise in a credit line to the material. If material is not included in the article\u2019s Creative Commons license and your intended use is not permitted by statutory regulation or exceeds the permitted use, you will need to obtain permission directly from the copyright holder. To view a copy of this license, visit https://creativecommons.org/licenses/by/4.0/ ."
}