{
    "PMC": "10279635",
    "DOI": "10.1038/s41467-023-39297-5",
    "PMID": "37336880",
    "PMCID": "PMC10279635",
    "title": "Author Correction: The IL-33-PIN1-IRAK-M axis is critical for type 2 immunity in IL-33-induced allergic airway inflammation.",
    "year": 2023,
    "source_url": "https://europepmc.org/article/PMC/PMC10279635",
    "source": "MED",
    "full_text": "pmc Nat Commun Nat Commun Nature Communications 2041-1723 Nature Publishing Group UK London 10279635 37336880 39297 10.1038/s41467-023-39297-5 Author Correction Author Correction: The IL-33-PIN1-IRAK-M axis is critical for type 2 immunity in IL-33-induced allergic airway inflammation Nechama Morris 1 Kwon Jeahoo 2 Wei Shuo 1 Tun-Kyi Adrian 1 Welner Robert S. 1 http://orcid.org/0000-0002-9180-3604 Ben-Dov Iddo Z. 3 Arredouani Mohamed S. 1 Asara John M. 1 Chen Chun-Hau 1 Tsai Cheng-Yu 1 Nelson Kyle F. 4 Kobayashi Koichi S. 5 Israel Elliot 4 Zhou Xiao Zhen 1 Nicholson Linda K. lkn2@cornell.edu 2 Lu Kun Ping klu@bidmc.harvard.edu 1 6 7 1 grid.38142.3c 000000041936754X Division of Translational Therapeutics, Department of Medicine and Cancer Research Institute, Beth Israel Deaconess Medical Center, Harvard Medical School, Boston, MA 02215 USA 2 grid.5386.8 000000041936877X Department of Molecular Biology & Genetics, Cornell University, Ithaca, NY 14853 USA 3 Department of Nephrology and Hypertension, Hadassah-Hebrew Medical Center, 91120 Jerusalem, Israel 4 grid.62560.37 0000 0004 0378 8294 Department of Medicine, Brigham and Women\u2019s Hospital, Boston, MA 02115 USA 5 grid.412408.b Department of Microbial Pathogenesis & Immunology, Texas A&M Health Science Center, College Station, TX 77843 USA 6 grid.66859.34 0000 0004 0546 1623 Broad Institute of MIT and Harvard, Cambridge, MA 02142 USA 7 grid.256112.3 0000 0004 1797 9307 Institute for Translational Medicine, Fujian Key Laboratory for Translational Research in Cancer and Neurodegenerative Diseases, Fujian Medical University, Fuzhou, 350108 Fujian China 19 6 2023 19 6 2023 2023 14 3622 \u00a9 The Author(s) 2023 https://creativecommons.org/licenses/by/4.0/ Open Access This article is licensed under a Creative Commons Attribution 4.0 International License, which permits use, sharing, adaptation, distribution and reproduction in any medium or format, as long as you give appropriate credit to the original author(s) and the source, provide a link to the Creative Commons license, and indicate if changes were made. The images or other third party material in this article are included in the article\u2019s Creative Commons license, unless indicated otherwise in a credit line to the material. If material is not included in the article\u2019s Creative Commons license and your intended use is not permitted by statutory regulation or exceeds the permitted use, you will need to obtain permission directly from the copyright holder. To view a copy of this license, visit http://creativecommons.org/licenses/by/4.0/ . issue-copyright-statement \u00a9 Springer Nature Limited 2023 Correction to: Nature Communications 10.1038/s41467-018-03886-6, published online 23 April 2018 In this article, the author name Adrian Tun-Kyi was incorrectly written as Adrian Tun Kyi and the given and family names were incorrectly structured. The original article has been corrected."
}