{
    "PMC": "7716560",
    "DOI": "10.18699/vj20.658",
    "PMID": "33659850",
    "PMCID": "PMC7716560",
    "title": "[Characteristic of the active substance of the Saccharomyces cerevisiae preparation having radioprotective properties].",
    "year": 2020,
    "source_url": "https://europepmc.org/article/PMC/PMC7716560",
    "source": "MED",
    "abstract_text": "The paper describes some biological features of the radioprotective effect of double-stranded RNA preparation. It was found that yeast RNA preparation has a prolonged radioprotective effect after irradiation by a lethal dose of 9.4 Gy. 100 % of animals survive on the 70th day of observation when irradiated 1 hour or 4 days after 7 mg RNA preparation injection, 60 % animals survive when irradiated on day 8 or 12. Time parameters of repair of double-stranded breaks induced by gamma rays were estimated. It was found that the injection of the RNA preparation at the time of maximum number of double-stranded breaks, 1 hour after irradiation, reduces the efficacy of radioprotective action compared with the injection 1 hour before irradiation and 4 hours after irradiation. A comparison of the radioprotective effect of the standard radioprotector B-190 and the RNA preparation was made in one experiment. It has been established that the total RNA preparation is more efficacious than B-190. Survival on the 40th day after irradiation was 78 % for the group of mice treated with the RNA preparation and 67 % for those treated with B-190. In the course of analytical studies of the total yeast RNA preparation, it was found that the preparation is a mixture of single-stranded and double-stranded RNA. It was shown that only double-stranded RNA has radioprotective properties. Injection of 160 \u03bcg double-stranded RNA protects 100 % of the experimental animals from an absolutely lethal dose of gamma radiation, 9.4 Gy. It was established that the radioprotective effect of double-stranded RNA does not depend on sequence, but depends on its double-stranded form and the presence of \"open\" ends of the molecule. It is supposed that the radioprotective effect of double-stranded RNA is associated with the participation of RNA molecules in the correct repair of radiation-damaged chromatin in blood stem cells. The hematopoietic pluripotent cells that have survived migrate to the periphery, reach the spleen and actively proliferate. The newly formed cell population restores the hematopoietic and immune systems, which determines the survival of lethally irradiated animals.",
    "full_text": "Vavilovskii Zhurnal Genet Selektsii Vavilovskii Zhurnal Genet Selektsii Vavilov Journal of Genetics and Breeding 2500-0462 2500-3259 The Federal Research Center Institute of Cytology and Genetics of Siberian Branch of the Russian Academy of Sciences Russia Website: Vavilov Journal of Genetics and Breeding 7716560 33659850 10.18699/VJ20.658 Original Article \u0425\u0430\u0440\u0430\u043a\u0442\u0435\u0440\u0438\u0441\u0442\u0438\u043a\u0430 \u0430\u043a\u0442\u0438\u0432\u043d\u043e\u0439 \u0441\u0443\u0431\u0441\u0442\u0430\u043d\u0446\u0438\u0438 \u043f\u0440\u0435\u043f\u0430\u0440\u0430\u0442\u0430 \u0434\u0440\u043e\u0436\u0436\u0435\u0439 Saccharomyces \u0441erevisiae, \u043e\u0431\u043b\u0430\u0434\u0430\u044e\u0449\u0435\u0439 \u0440\u0430\u0434\u0438\u043e\u043f\u0440\u043e\u0442\u0435\u043a\u0442\u043e\u0440\u043d\u044b\u043c\u0438 \u0441\u0432\u043e\u0439\u0441\u0442\u0432\u0430\u043c\u0438 Characteristic of the active substance of the Saccharomyces cerevisiae preparation having radioprotective properties Ritter G.S. Institute of Cytology and Genetics of Siberian Branch of the Russian Academy of Sciences, Novosibirsk, Russia Nikolin V.P. Institute of Cytology and Genetics of Siberian Branch of the Russian Academy of Sciences, Novosibirsk, Russia Popova N.A. Institute of Cytology and Genetics of Siberian Branch of the Russian Academy of Sciences, Novosibirsk, Russia Novosibirsk State University, Novosibirsk, Russia Proskurina A.S. Institute of Cytology and Genetics of Siberian Branch of the Russian Academy of Sciences, Novosibirsk, Russia Kisaretova P.E. Institute of Cytology and Genetics of Siberian Branch of the Russian Academy of Sciences, Novosibirsk, Russia Taranov O.S. State Research Center of Virology and Biotechnology \u201cVector\u201d, Koltsovo, Novosibirsk region, Russia Dubatolova T.D. Institute of Molecular and Cellular Biology of Siberian Branch of the Russian Academy of Sciences, Novosibirsk, Russia E.V. Dolgova E.V. Institute of Cytology and Genetics of Siberian Branch of the Russian Academy of Sciences, Novosibirsk, Russia Potter E.A. Institute of Cytology and Genetics of Siberian Branch of the Russian Academy of Sciences, Novosibirsk, Russia Kirikovich S.S. Institute of Cytology and Genetics of Siberian Branch of the Russian Academy of Sciences, Novosibirsk, Russia Efremov Y.R. Institute of Cytology and Genetics of Siberian Branch of the Russian Academy of Sciences, Novosibirsk, Russia Novosibirsk State University, Novosibirsk, Russia Bayborodin S.I. Institute of Cytology and Genetics of Siberian Branch of the Russian Academy of Sciences, Novosibirsk, Russia Novosibirsk State University, Novosibirsk, Russia Romanenko M.V. Novosibirsk State University, Novosibirsk, Russia Meschaninova M.I. Institute of Chemical Biology and Fundamental Medicine of Siberian Branch of the Russian Academy of Sciences, Novosibirsk, Russia Venyaminova A.G. Institute of Chemical Biology and Fundamental Medicine of Siberian Branch of the Russian Academy of Sciences, Novosibirsk, Russia Kolchanov N.A. Institute of Cytology and Genetics of Siberian Branch of the Russian Academy of Sciences, Novosibirsk, Russia Bogachev S.S. Institute of Cytology and Genetics of Siberian Branch of the Russian Academy of Sciences, Novosibirsk, Russia Correspondence to: S.S. Bogachev labmolbiol@mail.ru 10 2020 24 6 643 652 5 2 2020 16 7 2020 16 7 2020 Copyright \u00a9 AUTHORS 2020 This work is licensed under a Creative Commons Attribution 4.0 License \u0412 \u0440\u0430\u0431\u043e\u0442\u0435 \u043e\u0445\u0430\u0440\u0430\u043a\u0442\u0435\u0440\u0438\u0437\u043e\u0432\u0430\u043d\u044b \u043d\u0435\u043a\u043e\u0442\u043e\u0440\u044b\u0435 \u0431\u0438\u043e\u043b\u043e\u0433\u0438\u0447\u0435\u0441\u043a\u0438\u0435 \u043e\u0441\u043e\u0431\u0435\u043d\u043d\u043e\u0441\u0442\u0438 \u0440\u0430\u0434\u0438\u043e\u043f\u0440\u043e\u0442\u0435\u043a\u0442\u043e\u0440\u043d\u043e\u0433\u043e \u0434\u0435\u0439\u0441\u0442\u0432\u0438\u044f \u043f\u0440\u0435\u043f\u0430\u0440\u0430\u0442\u0430 \u0434\u0432\u0443\u0446\u0435\u043f\u043e\u0447\u0435\u0447\u043d\u043e\u0439 \u0420\u041d\u041a. \u041e\u0431\u043d\u0430\u0440\u0443\u0436\u0435\u043d\u043e, \u0447\u0442\u043e \u043f\u0440\u0435\u043f\u0430\u0440\u0430\u0442 \u0434\u0440\u043e\u0436\u0436\u0435\u0432\u043e\u0439 \u0420\u041d\u041a \u043e\u0431\u043b\u0430\u0434\u0430\u0435\u0442 \u043f\u0440\u043e\u043b\u043e\u043d\u0433\u0438\u0440\u043e\u0432\u0430\u043d\u043d\u044b\u043c \u0440\u0430\u0434\u0438\u043e\u043f\u0440\u043e\u0442\u0435\u043a\u0442\u043e\u0440\u043d\u044b\u043c \u0434\u0435\u0439\u0441\u0442\u0432\u0438\u0435\u043c \u043f\u0440\u0438 \u043e\u0431\u043b\u0443\u0447\u0435\u043d\u0438\u0438 \u0436\u0438\u0432\u043e\u0442\u043d\u044b\u0445 \u043b\u0435\u0442\u0430\u043b\u044c\u043d\u043e\u0439 \u0434\u043e\u0437\u043e\u0439 \u0432 9.4 \u0413\u0440. \u041f\u0440\u0438 \u043e\u0431\u043b\u0443\u0447\u0435\u043d\u0438\u0438 \u0447\u0435\u0440\u0435\u0437 1 \u0447 \u0438 \u043d\u0430 4-\u0435 \u0441\u0443\u0442\u043a\u0438 \u043f\u043e\u0441\u043b\u0435 \u0432\u0432\u0435\u0434\u0435\u043d\u0438\u044f 7 \u043c\u0433 \u043f\u0440\u0435\u043f\u0430\u0440\u0430\u0442\u0430 \u0420\u041d\u041a \u0432\u044b\u0436\u0438\u0432\u0430\u0435\u0442 100 % \u0436\u0438\u0432\u043e\u0442\u043d\u044b\u0445 \u043d\u0430 70-\u0435 \u0441\u0443\u0442\u043a\u0438 \u043d\u0430\u0431\u043b\u044e\u0434\u0435\u043d\u0438\u044f, \u043f\u0440\u0438 \u043e\u0431\u043b\u0443\u0447\u0435\u043d\u0438\u0438 \u043d\u0430 8-\u0435 \u0438 12-\u0435 \u0441\u0443\u0442\u043a\u0438 \u2013 60 % \u0436\u0438\u0432\u043e\u0442\u043d\u044b\u0445. \u0411\u044b\u043b\u0438 \u043e\u0446\u0435\u043d\u0435\u043d\u044b \u0432\u0440\u0435\u043c\u0435\u043d\u043d\u044b\u0435 \u043f\u0430\u0440\u0430\u043c\u0435\u0442\u0440\u044b \u043f\u0440\u043e\u0446\u0435\u0441\u0441\u0430 \u0440\u0435\u043f\u0430\u0440\u0430\u0446\u0438\u0438 \u0434\u0432\u0443\u0446\u0435\u043f\u043e\u0447\u0435\u0447\u043d\u044b\u0445 \u0440\u0430\u0437\u0440\u044b\u0432\u043e\u0432, \u0438\u043d\u0434\u0443\u0446\u0438\u0440\u043e\u0432\u0430\u043d\u043d\u044b\u0445 \u03b3-\u043b\u0443\u0447\u0430\u043c\u0438. \u0412\u044b\u044f\u0432\u043b\u0435\u043d\u043e, \u0447\u0442\u043e \u0432\u0432\u0435\u0434\u0435\u043d\u0438\u0435 \u043f\u0440\u0435\u043f\u0430\u0440\u0430\u0442\u0430 \u0420\u041d\u041a \u0432 \u043c\u043e\u043c\u0435\u043d\u0442 \u043c\u0430\u043a\u0441\u0438\u043c\u0430\u043b\u044c\u043d\u043e\u0433\u043e \u043a\u043e\u043b\u0438\u0447\u0435\u0441\u0442\u0432\u0430 \u0434\u0432\u0443\u0446\u0435\u043f\u043e- \u0447\u0435\u0447\u043d\u044b\u0445 \u0440\u0430\u0437\u0440\u044b\u0432\u043e\u0432, \u0447\u0435\u0440\u0435\u0437 1 \u0447 \u043f\u043e\u0441\u043b\u0435 \u043e\u0431\u043b\u0443\u0447\u0435\u043d\u0438\u044f, \u0441\u043d\u0438\u0436\u0430\u0435\u0442 \u044d\u0444\u0444\u0435\u043a\u0442\u0438\u0432\u043d\u043e\u0441\u0442\u044c \u0440\u0430\u0434\u0438\u043e\u043f\u0440\u043e\u0442\u0435\u043a\u0442\u043e\u0440\u043d\u043e\u0433\u043e \u0434\u0435\u0439\u0441\u0442\u0432\u0438\u044f \u043f\u043e \u0441\u0440\u0430\u0432\u043d\u0435\u043d\u0438\u044e \u0441 \u0432\u0432\u0435\u0434\u0435\u043d\u0438\u0435\u043c \u0437\u0430 1 \u0447 \u0434\u043e \u043e\u0431\u043b\u0443\u0447\u0435\u043d\u0438\u044f \u0438 \u0447\u0435\u0440\u0435\u0437 4 \u0447 \u043f\u043e\u0441\u043b\u0435 \u043e\u0431\u043b\u0443\u0447\u0435\u043d\u0438\u044f. \u041f\u0440\u043e\u0432\u0435\u0434\u0435\u043d\u043e \u0441\u0440\u0430\u0432\u043d\u0435\u043d\u0438\u0435 \u044d\u0444\u0444\u0435\u043a\u0442\u0438\u0432\u043d\u043e\u0441\u0442\u0438 \u0440\u0430\u0434\u0438\u043e\u0437\u0430\u0449\u0438\u0442- \u043d\u043e\u0433\u043e \u0434\u0435\u0439\u0441\u0442\u0432\u0438\u044f \u0448\u0442\u0430\u0442\u043d\u043e\u0433\u043e \u0440\u0430\u0434\u0438\u043e\u043f\u0440\u043e\u0442\u0435\u043a\u0442\u043e\u0440\u0430 \u0411-190 \u0438 \u043f\u0440\u0435\u043f\u0430\u0440\u0430\u0442\u0430 \u0420\u041d\u041a \u0432 \u043e\u0434\u043d\u043e\u043c \u044d\u043a\u0441\u043f\u0435\u0440\u0438\u043c\u0435\u043d\u0442\u0435. \u0423\u0441\u0442\u0430\u043d\u043e\u0432\u043b\u0435\u043d\u043e, \u0447\u0442\u043e \u043f\u0440\u0435\u043f\u0430\u0440\u0430\u0442 \u0441\u0443\u043c\u043c\u0430\u0440\u043d\u043e\u0439 \u0420\u041d\u041a \u043d\u0435 \u0443\u0441\u0442\u0443\u043f\u0430\u0435\u0442 \u043f\u043e \u044d\u0444\u0444\u0435\u043a\u0442\u0438\u0432\u043d\u043e\u0441\u0442\u0438 \u043f\u0440\u0435\u043f\u0430\u0440\u0430\u0442\u0443 \u0411-190. \u0412\u044b\u0436\u0438\u0432\u0430\u0435\u043c\u043e\u0441\u0442\u044c \u043d\u0430 40-\u0435 \u0441\u0443\u0442\u043a\u0438 \u043f\u043e\u0441\u043b\u0435 \u043e\u0431\u043b\u0443\u0447\u0435\u043d\u0438\u044f \u0434\u043b\u044f \u0433\u0440\u0443\u043f\u043f\u044b \u043c\u044b\u0448\u0435\u0439, \u043f\u043e\u043b\u0443\u0447\u0430\u0432\u0448\u0438\u0445 \u043f\u0440\u0435\u043f\u0430\u0440\u0430\u0442 \u0420\u041d\u041a, \u0441\u043e\u0441\u0442\u0430\u0432\u0438\u043b\u0430 78 %, \u0434\u043b\u044f \u0411-190 \u2013 67 % \u0436\u0438\u0432\u043e\u0442\u043d\u044b\u0445. \u0412 \u0445\u043e\u0434\u0435 \u0430\u043d\u0430\u043b\u0438\u0442\u0438\u0447\u0435\u0441\u043a\u0438\u0445 \u0438\u0441\u0441\u043b\u0435- \u0434\u043e\u0432\u0430\u043d\u0438\u0439 \u043f\u0440\u0435\u043f\u0430\u0440\u0430\u0442\u0430 \u0441\u0443\u043c\u043c\u0430\u0440\u043d\u043e\u0439 \u0420\u041d\u041a \u0434\u0440\u043e\u0436\u0436\u0435\u0439 \u043e\u0431\u043d\u0430\u0440\u0443\u0436\u0438\u043b\u043e\u0441\u044c, \u0447\u0442\u043e \u043f\u0440\u0435\u043f\u0430\u0440\u0430\u0442 \u043f\u0440\u0435\u0434\u0441\u0442\u0430\u0432\u043b\u044f\u0435\u0442 \u0441\u043e\u0431\u043e\u0439 \u0441\u043c\u0435\u0441\u044c \u043e\u0434\u043d\u043e\u0446\u0435\u043f\u043e\u0447\u0435\u0447- \u043d\u043e\u0439 \u0438 \u0434\u0432\u0443\u0446\u0435\u043f\u043e\u0447\u0435\u0447\u043d\u043e\u0439 \u0420\u041d\u041a. \u0420\u0430\u0434\u0438\u043e\u043f\u0440\u043e\u0442\u0435\u043a\u0442\u043e\u0440\u043d\u044b\u043c\u0438 \u0441\u0432\u043e\u0439\u0441\u0442\u0432\u0430\u043c\u0438 \u043e\u0431\u043b\u0430\u0434\u0430\u0435\u0442 \u0442\u043e\u043b\u044c\u043a\u043e \u0434\u0432\u0443\u0446\u0435\u043f\u043e\u0447\u0435\u0447\u043d\u0430\u044f \u0420\u041d\u041a. \u041f\u0440\u0438 \u0432\u0432\u0435\u0434\u0435\u043d\u0438\u0438 160 \u043c\u043a\u0433 \u043f\u0440\u0435\u043f\u0430\u0440\u0430\u0442\u0430 \u0434\u0432\u0443\u0446\u0435\u043f\u043e\u0447\u0435\u0447\u043d\u043e\u0439 \u0420\u041d\u041a \u0432\u044b\u0436\u0438\u0432\u0430\u0435\u0442 100 % \u043f\u043e\u0434\u043e\u043f\u044b\u0442\u043d\u044b\u0445 \u0436\u0438\u0432\u043e\u0442\u043d\u044b\u0445 \u043f\u043e\u0441\u043b\u0435 \u0430\u0431\u0441\u043e\u043b\u044e\u0442\u043d\u043e \u043b\u0435\u0442\u0430\u043b\u044c\u043d\u043e\u0439 \u0434\u043e\u0437\u044b \u0433\u0430\u043c\u043c\u0430-\u0440\u0430\u0434\u0438\u0430\u0446\u0438\u0438 9.4 \u0413\u0440. \u0423\u0441\u0442\u0430\u043d\u043e\u0432\u043b\u0435\u043d\u043e, \u0447\u0442\u043e \u0440\u0430\u0434\u0438\u043e\u0437\u0430\u0449\u0438\u0442\u043d\u044b\u0439 \u044d\u0444\u0444\u0435\u043a\u0442 \u0434\u0432\u0443\u0446\u0435\u043f\u043e\u0447\u0435\u0447\u043d\u043e\u0439 \u0420\u041d\u041a \u0437\u0430\u0432\u0438\u0441\u0438\u0442 \u043d\u0435 \u043e\u0442 \u043f\u043e\u0441\u043b\u0435\u0434\u043e\u0432\u0430\u0442\u0435\u043b\u044c- \u043d\u043e\u0441\u0442\u0438, \u0430 \u043e\u0442 \u0435\u0435 \u0434\u0432\u0443\u0446\u0435\u043f\u043e\u0447\u0435\u0447\u043d\u043e\u0439 \u0444\u043e\u0440\u043c\u044b, \u043f\u0440\u0438\u0447\u0435\u043c \u0434\u043b\u044f \u043e\u0441\u0443\u0449\u0435\u0441\u0442\u0432\u043b\u0435\u043d\u0438\u044f \u0440\u0430\u0434\u0438\u043e\u043f\u0440\u043e\u0442\u0435\u043a\u0442\u043e\u0440\u043d\u043e\u0433\u043e \u0434\u0435\u0439\u0441\u0442\u0432\u0438\u044f \u0434\u0432\u0443\u0446\u0435\u043f\u043e\u0447\u0435\u0447\u043d\u0430\u044f \u0420\u041d\u041a \u0434\u043e\u043b\u0436\u043d\u0430 \u0438\u043c\u0435\u0442\u044c \u00ab\u043e\u0442\u043a\u0440\u044b\u0442\u044b\u0435\u00bb \u043a\u043e\u043d\u0446\u044b \u043c\u043e\u043b\u0435\u043a\u0443\u043b\u044b. \u041f\u0440\u0435\u0434\u043f\u043e\u043b\u0430\u0433\u0430\u0435\u0442\u0441\u044f, \u0447\u0442\u043e \u0440\u0430\u0434\u0438\u043e\u0437\u0430\u0449\u0438\u0442\u043d\u043e\u0435 \u0434\u0435\u0439\u0441\u0442\u0432\u0438\u0435 \u043f\u0440\u0435\u043f\u0430\u0440\u0430\u0442\u0430 \u0434\u0432\u0443\u0446\u0435\u043f\u043e\u0447\u0435\u0447- \u043d\u043e\u0439 \u0420\u041d\u041a \u0441\u0432\u044f\u0437\u0430\u043d\u043e \u0441 \u0443\u0447\u0430\u0441\u0442\u0438\u0435\u043c \u043c\u043e\u043b\u0435\u043a\u0443\u043b \u0420\u041d\u041a \u0432 \u043a\u043e\u0440\u0440\u0435\u043a\u0442\u043d\u043e\u043c \u0432\u043e\u0441\u0441\u0442\u0430\u043d\u043e\u0432\u043b\u0435\u043d\u0438\u0438 \u043f\u043e\u0432\u0440\u0435\u0436\u0434\u0435\u043d\u043d\u043e\u0433\u043e \u043e\u0431\u043b\u0443\u0447\u0435\u043d\u0438\u0435\u043c \u0445\u0440\u043e\u043c\u0430\u0442\u0438\u043d\u0430 \u0432 \u0441\u0442\u0432\u043e\u043b\u043e\u0432\u044b\u0445 \u043a\u043b\u0435\u0442\u043a\u0430\u0445 \u043a\u0440\u043e\u0432\u0438. \u0421\u043e\u0445\u0440\u0430\u043d\u0438\u0432\u0448\u0438\u0435 \u0436\u0438\u0437\u043d\u0435\u0441\u043f\u043e\u0441\u043e\u0431\u043d\u043e\u0441\u0442\u044c \u0441\u0442\u0432\u043e\u043b\u043e\u0432\u044b\u0435 \u0433\u0435\u043c\u043e\u043f\u043e\u044d\u0442\u0438\u0447\u0435\u0441\u043a\u0438\u0435 \u043a\u043b\u0435\u0442\u043a\u0438 \u043c\u0438\u0433\u0440\u0438\u0440\u0443\u044e\u0442 \u043d\u0430 \u043f\u0435\u0440\u0438- \u0444\u0435\u0440\u0438\u044e \u0438 \u0434\u043e\u0441\u0442\u0438\u0433\u0430\u044e\u0442 \u0441\u0435\u043b\u0435\u0437\u0435\u043d\u043a\u0438, \u0433\u0434\u0435 \u0430\u043a\u0442\u0438\u0432\u043d\u043e \u043f\u0440\u043e\u043b\u0438\u0444\u0435\u0440\u0438\u0440\u0443\u044e\u0442. \u0412\u043d\u043e\u0432\u044c \u043e\u0431\u0440\u0430\u0437\u043e\u0432\u0430\u0432\u0448\u0430\u044f\u0441\u044f \u043a\u043b\u0435\u0442\u043e\u0447\u043d\u0430\u044f \u043f\u043e\u043f\u0443\u043b\u044f\u0446\u0438\u044f \u0432\u043e\u0441\u0441\u0442\u0430\u043d\u0430\u0432- \u043b\u0438\u0432\u0430\u0435\u0442 \u043a\u0440\u043e\u0432\u0435\u0442\u0432\u043e\u0440\u043d\u0443\u044e \u0438 \u0438\u043c\u043c\u0443\u043d\u043d\u0443\u044e \u0441\u0438\u0441\u0442\u0435\u043c\u044b, \u0447\u0442\u043e \u043e\u043f\u0440\u0435\u0434\u0435\u043b\u044f\u0435\u0442 \u0432\u044b\u0436\u0438\u0432\u0430\u043d\u0438\u0435 \u043b\u0435\u0442\u0430\u043b\u044c\u043d\u043e \u043e\u0431\u043b\u0443\u0447\u0435\u043d\u043d\u044b\u0445 \u0436\u0438\u0432\u043e\u0442\u043d\u044b\u0445. The paper describes some biological features of the radioprotective effect of double-stranded RNA preparation. It was found that yeast RNA preparation has a prolonged radioprotective effect after irradiation by a lethal dose of 9.4 Gy. 100 % of animals survive on the 70th day of observation when irradiated 1 hour or 4 days after 7 mg RNA preparation injection, 60 % animals survive when irradiated on day 8 or 12. Time parameters of repair of double-stranded breaks induced by gamma rays were estimated. It was found that the injection of the RNA preparation at the time of maximum number of double-stranded breaks, 1 hour after irradiation, reduces the efficacy of radioprotective action compared with the injection 1 hour before irradiation and 4 hours after irradiation. A comparison of the radioprotective effect of the standard radioprotector B-190 and the RNA preparation was made in one experiment. It has been established that the total RNA preparation is more efficacious than B-190. Survival on the 40th day after irradiation was 78 % for the group of mice treated with the RNA preparation and 67 % for those treated with B-190. In the course of analytical studies of the total yeast RNA preparation, it was found that the preparation is a mixture of single-stranded and double-stranded RNA. It was shown that only double-stranded RNA has radioprotective properties. Injection of 160 \u03bcg double-stranded RNA protects 100 % of the experimental animals from an absolutely lethal dose of gamma radiation, 9.4 Gy. It was established that the radioprotective effect of double-stranded RNA does not depend on sequence, but depends on its double-stranded form and the presence of \u201copen\u201d ends of the molecule. It is supposed that the radioprotective effect of double-stranded RNA is associated with the participation of RNA molecules in the correct repair of radiation-damaged chromatin in blood stem cells. The hematopoietic pluripotent cells that have survived migrate to the periphery, reach the spleen and actively proliferate. The newly formed cell population restores the hematopoietic and immune systems, which determines the survival of lethally irradiated animals. double-stranded RNA B-190 spleen colonies double-stranded breaks \u0434\u0432\u0443\u0446\u0435\u043f\u043e\u0447\u0435\u0447\u043d\u0430\u044f \u0420\u041d\u041a \u0411-190 \u0441\u0435\u043b\u0435\u0437\u0435\u043d\u043e\u0447\u043d\u044b\u0435 \u043a\u043e\u043b\u043e\u043d\u0438\u0438 \u0434\u0432\u0443\u0446\u0435\u043f\u043e\u0447\u0435\u0447\u043d\u044b\u0435 \u0440\u0430\u0437\u0440\u044b\u0432\u044b \u0412\u0432\u0435\u0434\u0435\u043d\u0438\u0435 \u0418\u043e\u043d\u0438\u0437\u0438\u0440\u0443\u044e\u0449\u0435\u0435 \u0438\u0437\u043b\u0443\u0447\u0435\u043d\u0438\u0435 \u0432\u043e\u0437\u0434\u0435\u0439\u0441\u0442\u0432\u0443\u0435\u0442 \u043d\u0430 \u0436\u0438\u0432\u043e\u0439 \u043e\u0440\u0433\u0430- \u043d\u0438\u0437\u043c \u0442\u0430\u043a\u0438\u043c \u043e\u0431\u0440\u0430\u0437\u043e\u043c, \u0447\u0442\u043e \u043f\u0440\u0438\u0432\u043e\u0434\u0438\u0442 \u043a \u043f\u043e\u0432\u0440\u0435\u0436\u0434\u0435\u043d\u0438\u044e \u0435\u0433\u043e \u0444\u0443\u043d\u043a\u0446\u0438\u043e\u043d\u0430\u043b\u044c\u043d\u044b\u0445 \u0441\u0438\u0441\u0442\u0435\u043c \u0438 \u0433\u0438\u0431\u0435\u043b\u0438. \u0412 \u043d\u0430\u0441\u0442\u043e\u044f\u0449\u0435\u0435 \u0432\u0440\u0435\u043c\u044f \u0441\u0447\u0438\u0442\u0430\u0435\u0442\u0441\u044f, \u0447\u0442\u043e \u0438\u043e\u043d\u0438\u0437\u0438\u0440\u0443\u044e\u0449\u0435\u0435 \u0438\u0437\u043b\u0443\u0447\u0435\u043d\u0438\u0435 \u043e\u043a\u0430\u0437\u044b\u0432\u0430\u0435\u0442 \u043d\u0430\u0438- \u0431\u043e\u043b\u044c\u0448\u0435\u0435 \u0432\u043e\u0437\u0434\u0435\u0439\u0441\u0442\u0432\u0438\u0435 \u043d\u0430 \u043c\u0435\u043c\u0431\u0440\u0430\u043d\u043d\u044b\u0435 \u0441\u0442\u0440\u0443\u043a\u0442\u0443\u0440\u044b \u0438 \u044f\u0434\u0440\u043e \u043a\u043b\u0435\u0442\u043a\u0438. \u041b\u0438\u0437\u0438\u0441 \u043c\u0435\u043c\u0431\u0440\u0430\u043d \u043f\u0440\u0438\u0432\u043e\u0434\u0438\u0442 \u043a \u0440\u0430\u0437\u0440\u0443\u0448\u0435\u043d\u0438\u044e \u0441\u0442\u0440\u0443\u043a\u0442\u0443\u0440\u044b \u043a\u043b\u0435\u0442\u043a\u0438, \u0430 \u0434\u0435\u0444\u0435\u043a\u0442\u044b \u0432 \u044f\u0434\u0435\u0440\u043d\u043e\u0439 \u0414\u041d\u041a \u0432\u0435\u0434\u0443\u0442 \u043a \u043d\u0430\u0440\u0443\u0448\u0435\u043d\u0438\u044e \u0438\u043d\u0442\u0435\u0433\u0440\u0430\u043b\u044c\u043d\u043e\u0439 \u0444\u0443\u043d\u043a\u0446\u0438\u043e\u043d\u0430\u043b\u044c\u043d\u043e\u0439 \u0446\u0435\u043b\u043e\u0441\u0442\u043d\u043e\u0441\u0442\u0438 \u0445\u0440\u043e\u043c\u0430\u0442\u0438\u043d\u0430, \u0430\u0442\u0438\u043f\u0438\u0447\u0435\u0441\u043a\u043e\u043c\u0443 \u0442\u0435\u0447\u0435\u043d\u0438\u044e \u043a\u043b\u0435\u0442\u043e\u0447\u043d\u043e\u0433\u043e \u0434\u0435\u043b\u0435\u043d\u0438\u044f, \u043f\u043e\u044f\u0432\u043b\u0435\u043d\u0438\u044e \u0445\u0440\u043e\u043c\u043e\u0441\u043e\u043c\u043d\u044b\u0445 \u0430\u0431\u0435\u0440\u0440\u0430\u0446\u0438\u0439 \u0438 \u0430\u043f\u043e\u043f\u0442\u043e\u0437\u0443 (Dent et al., 2003). \u041e\u0441\u043d\u043e\u0432\u043d\u044b\u043c\u0438 \u043a\u043b\u0435\u0442\u043a\u0430\u043c\u0438-\u043c\u0438\u0448\u0435\u043d\u044f\u043c\u0438 \u0434\u043b\u044f \u0433\u0430\u043c\u043c\u0430-\u043b\u0443\u0447\u0435\u0439 \u044f\u0432\u043b\u044f- \u044e\u0442\u0441\u044f \u043d\u0438\u0437\u043a\u043e\u0434\u0438\u0444\u0444\u0435\u0440\u0435\u043d\u0446\u0438\u0440\u043e\u0432\u0430\u043d\u043d\u044b\u0435 \u043a\u043b\u0435\u0442\u043a\u0438 \u043a\u043e\u0441\u0442\u043d\u043e\u0433\u043e \u043c\u043e\u0437\u0433\u0430, \u0437\u0430\u0440\u043e\u0434\u044b\u0448\u0435\u0432\u044b\u0435 \u043a\u043b\u0435\u0442\u043a\u0438 \u0441\u0435\u043c\u0435\u043d\u043d\u0438\u043a\u043e\u0432, \u043a\u0438\u0448\u0435\u0447\u043d\u044b\u0439 \u0438 \u043a\u043e\u0436\u043d\u044b\u0439 \u044d\u043f\u0438\u0442\u0435\u043b\u0438\u0439 (Bergoni\u00e9, Tribondeau, 2003; Vogin, Foray, 2013). \u0420\u0430\u0434\u0438\u043e\u0447\u0443\u0432\u0441\u0442\u0432\u0438\u0442\u0435\u043b\u044c\u043d\u043e\u0441\u0442\u044c \u0432\u0441\u0435\u0433\u043e \u043e\u0440\u0433\u0430\u043d\u0438\u0437\u043c\u0430 \u0443 \u043c\u043b\u0435\u043a\u043e\u043f\u0438\u0442\u0430\u044e\u0449\u0438\u0445 \u043f\u0440\u0438\u0440\u0430\u0432\u043d\u0438\u0432\u0430\u0435\u0442\u0441\u044f \u043a \u0440\u0430\u0434\u0438\u043e\u0447\u0443\u0432\u0441\u0442\u0432\u0438\u0442\u0435\u043b\u044c\u043d\u043e\u0441\u0442\u0438 \u043a\u0440\u043e\u0432\u0435\u0442\u0432\u043e\u0440\u043d\u044b\u0445 \u043a\u043b\u0435\u0442\u043e\u043a, \u0442\u0430\u043a \u043a\u0430\u043a \u0438\u0445 \u0430\u043f\u043b\u0430\u0437\u0438\u044f, \u0432\u043e\u0437\u043d\u0438\u043a\u0430\u044e\u0449\u0430\u044f \u043f\u043e\u0441\u043b\u0435 \u043e\u0431\u0449\u0435\u0433\u043e \u043e\u0431\u043b\u0443\u0447\u0435\u043d\u0438\u044f \u043c\u0438\u043d\u0438\u043c\u0430\u043b\u044c\u043d\u043e\u0439 \u0430\u0431\u0441\u043e\u043b\u044e\u0442\u043d\u043e \u0441\u043c\u0435\u0440\u0442\u0435\u043b\u044c\u043d\u043e\u0439 \u0434\u043e\u0437\u043e\u0439, \u043f\u0440\u0438\u0432\u043e\u0434\u0438\u0442 \u043a \u0433\u0438\u0431\u0435\u043b\u0438 \u043e\u0440\u0433\u0430\u043d\u0438\u0437\u043c\u0430. \u041f\u043e\u0434 \u0440\u0430\u0434\u0438\u043e\u0437\u0430\u0449\u0438\u0442\u043d\u044b\u043c \u0438\u043b\u0438 \u0440\u0430\u0434\u0438\u043e\u043f\u0440\u043e\u0442\u0435\u043a\u0442\u043e\u0440\u043d\u044b\u043c \u044d\u0444\u0444\u0435\u043a- \u0442\u043e\u043c \u043f\u043e\u043d\u0438\u043c\u0430\u044e\u0442 \u0441\u043d\u0438\u0436\u0435\u043d\u0438\u0435 \u0447\u0430\u0441\u0442\u043e\u0442\u044b \u0438 \u0442\u044f\u0436\u0435\u0441\u0442\u0438 \u043f\u043e\u0441\u0442\u043b\u0443\u0447\u0435\u0432\u044b\u0445 \u043f\u043e\u0432\u0440\u0435\u0436\u0434\u0435\u043d\u0438\u0439 \u0431\u0438\u043e\u043c\u043e\u043b\u0435\u043a\u0443\u043b \u0438(\u0438\u043b\u0438) \u0441\u0442\u0438\u043c\u0443\u043b\u044f\u0446\u0438\u044e \u043f\u0440\u043e\u0446\u0435\u0441\u0441\u043e\u0432 \u0438\u0445 \u043f\u043e\u0441\u0442\u0440\u0430\u0434\u0438\u0430\u0446\u0438\u043e\u043d\u043d\u043e\u0439 \u0440\u0435\u043f\u0430\u0440\u0430\u0446\u0438\u0438. \u041d\u0430\u0438\u0431\u043e\u043b\u0435\u0435 \u044d\u0444\u0444\u0435\u043a\u0442\u0438\u0432\u043d\u044b\u0435 \u0440\u0430\u0434\u0438\u043e\u043f\u0440\u043e\u0442\u0435\u043a\u0442\u043e\u0440\u044b \u043e\u0442\u043d\u043e\u0441\u044f\u0442\u0441\u044f \u043a \u0434\u0432\u0443\u043c \u043a\u043b\u0430\u0441\u0441\u0430\u043c \u0445\u0438\u043c\u0438\u0447\u0435\u0441\u043a\u0438\u0445 \u0441\u043e\u0435\u0434\u0438\u043d\u0435\u043d\u0438\u0439 (Patt et al., 1949; Fridovich, 1995). \u042d\u0442\u043e \u0441\u0435\u0440\u043e\u0441\u043e\u0434\u0435\u0440\u0436\u0430\u0449\u0438\u0435 \u0440\u0430\u0434\u0438\u043e\u0437\u0430\u0449\u0438\u0442\u043d\u044b\u0435 \u0432\u0435\u0449\u0435\u0441\u0442\u0432\u0430 (\u0430\u043c\u0438\u043d\u043e\u0442\u0438\u043e\u043b\u044b), \u0432\u044b\u043f\u043e\u043b\u043d\u044f\u044e\u0449\u0438\u0435 \u0444\u0443\u043d\u043a\u0446\u0438\u044e \u00ab\u043c\u043e\u043b\u0435\u043a\u0443\u043b\u044f\u0440\u043d\u044b\u0445 \u043b\u043e\u0432\u0443\u0448\u0435\u043a\u00bb \u0441\u0432\u043e\u0431\u043e\u0434- \u043d\u044b\u0445 \u0440\u0430\u0434\u0438\u043a\u0430\u043b\u043e\u0432, \u0438 \u043f\u0440\u043e\u0438\u0437\u0432\u043e\u0434\u043d\u044b\u0435 \u0438\u043d\u0434\u043e\u043b\u0438\u043b\u0430\u043b\u043a\u0438\u043b\u0430\u043c\u0438\u043d\u043e\u0432: \u0430\u0433\u043e- \u043d\u0438\u0441\u0442\u044b \u0431\u0438\u043e\u043b\u043e\u0433\u0438\u0447\u0435\u0441\u043a\u0438 \u0430\u043a\u0442\u0438\u0432\u043d\u044b\u0445 \u0430\u043c\u0438\u043d\u043e\u0432, \u0441\u043f\u043e\u0441\u043e\u0431\u043d\u044b\u0435 \u0447\u0435\u0440\u0435\u0437 \u0441\u043f\u0435\u0446\u0438\u0444\u0438\u0447\u0435\u0441\u043a\u0438\u0435 \u043a\u043b\u0435\u0442\u043e\u0447\u043d\u044b\u0435 \u0440\u0435\u0446\u0435\u043f\u0442\u043e\u0440\u044b \u0432\u044b\u0437\u044b\u0432\u0430\u0442\u044c \u043e\u0441\u0442\u0440\u0443\u044e \u0433\u0438\u043f\u043e\u043a\u0441\u0438\u044e \u0438 \u0443\u0433\u043d\u0435\u0442\u0435\u043d\u0438\u0435 \u043c\u0435\u0442\u0430\u0431\u043e\u043b\u0438\u0437\u043c\u0430 \u0432 \u0440\u0430\u0434\u0438\u043e\u0447\u0443\u0432\u0441\u0442\u0432\u0438\u0442\u0435\u043b\u044c- \u043d\u044b\u0445 \u0442\u043a\u0430\u043d\u044f\u0445 (Ward, 1988; Dent et al., 2003; Wang et al., 2013). \u041a\u0430\u043a \u0431\u044b\u043b\u043e \u0441\u043a\u0430\u0437\u0430\u043d\u043e \u0440\u0430\u043d\u0435\u0435, \u043d\u0430\u0438\u0431\u043e\u043b\u0435\u0435 \u0433\u0443\u0431\u0438\u0442\u0435\u043b\u044c\u043d\u043e\u0435 \u0432\u043e\u0437\u0434\u0435\u0439- \u0441\u0442\u0432\u0438\u0435 \u0438\u043e\u043d\u0438\u0437\u0438\u0440\u0443\u044e\u0449\u0435\u0435 \u0438\u0437\u043b\u0443\u0447\u0435\u043d\u0438\u0435 \u043e\u043a\u0430\u0437\u044b\u0432\u0430\u0435\u0442 \u043d\u0430 \u043c\u043e\u043b\u0435\u043a\u0443\u043b\u0443 \u0414\u041d\u041a \u044f\u0434\u0435\u0440\u043d\u043e\u0433\u043e \u0445\u0440\u043e\u043c\u0430\u0442\u0438\u043d\u0430. \u041f\u043e\u0432\u0440\u0435\u0436\u0434\u0435\u043d\u0438\u044f \u0445\u0440\u043e\u043c\u043e\u0441\u043e\u043c, \u0441\u043b\u0435- \u0434\u0443\u044e\u0449\u0438\u0439 \u0437\u0430 \u044d\u0442\u0438\u043c \u0430\u0431\u0435\u0440\u0440\u0430\u043d\u0442\u043d\u044b\u0439 \u043c\u0438\u0442\u043e\u0437 \u0438 \u0433\u0438\u0431\u0435\u043b\u044c \u043a\u043b\u0435\u0442\u043a\u0438 \u2013 \u044d\u0442\u043e \u0435\u0449\u0435 \u043e\u0434\u0438\u043d \u043c\u0435\u0445\u0430\u043d\u0438\u0437\u043c \u0446\u0438\u0442\u043e\u0440\u0435\u0434\u0443\u0446\u0438\u0440\u0443\u044e\u0449\u0435\u0433\u043e \u0434\u0435\u0439\u0441\u0442\u0432\u0438\u044f \u0438\u043e\u043d\u0438\u0437\u0438\u0440\u0443\u044e\u0449\u0435\u0433\u043e \u0438\u0437\u043b\u0443\u0447\u0435\u043d\u0438\u044f. \u041f\u0440\u0438 \u0432\u043e\u0437\u0434\u0435\u0439\u0441\u0442\u0432\u0438\u0438 \u0430\u043a\u0442\u0438\u0432\u043d\u044b\u0445 \u043c\u0435\u0442\u0430- \u0431\u043e\u043b\u0438\u0442\u043e\u0432 \u043d\u0430 \u0414\u041d\u041a \u0445\u0440\u043e\u043c\u0430\u0442\u0438\u043d\u0430 \u0432\u043e\u0437\u043d\u0438\u043a\u0430\u044e\u0442 \u0432\u0441\u0435 \u0432\u043e\u0437\u043c\u043e\u0436\u043d\u044b\u0435 \u0438\u0437 \u043e\u043f\u0438\u0441\u0430\u043d\u043d\u044b\u0445 \u0432 \u043b\u0438\u0442\u0435\u0440\u0430\u0442\u0443\u0440\u0435 \u043f\u043e\u0432\u0440\u0435\u0436\u0434\u0435\u043d\u0438\u0439 \u044d\u0442\u0438\u0445 \u043c\u043e\u043b\u0435\u043a\u0443\u043b. \u041d\u0430\u0438\u0431\u043e\u043b\u0435\u0435 \u0444\u0430\u0442\u0430\u043b\u044c\u043d\u044b\u043c\u0438 \u0441\u0447\u0438\u0442\u0430\u044e\u0442\u0441\u044f \u0434\u0432\u0443\u0446\u0435\u043f\u043e\u0447\u0435\u0447\u043d\u044b\u0435 \u0440\u0430\u0437\u0440\u044b- \u0432\u044b (\u0414\u0426\u0420). \u0415\u0441\u043b\u0438 \u0432 \u043a\u043b\u0435\u0442\u043a\u0435 \u043d\u0430\u0440\u0443\u0448\u0435\u043d\u044b \u0441\u0438\u0441\u0442\u0435\u043c\u044b \u0440\u0435\u043f\u0430\u0440\u0430\u0446\u0438\u0438 \u0442\u0430\u043a\u0438\u0445 \u043f\u043e\u0432\u0440\u0435\u0436\u0434\u0435\u043d\u0438\u0439, \u0442\u043e \u043a\u043b\u0435\u0442\u043a\u0430 \u0437\u0430\u043f\u0443\u0441\u043a\u0430\u0435\u0442 \u043c\u0435\u0445\u0430\u043d\u0438\u0437\u043c\u044b \u0441\u0430\u043c\u043e- \u0443\u043d\u0438\u0447\u0442\u043e\u0436\u0435\u043d\u0438\u044f. \u0412 \u043d\u0430\u0441\u0442\u043e\u044f\u0449\u0435\u043c \u0438\u0441\u0441\u043b\u0435\u0434\u043e\u0432\u0430\u043d\u0438\u0438 \u043e\u043f\u0438\u0441\u044b\u0432\u0430\u0435\u0442\u0441\u044f \u043d\u043e\u0432\u044b\u0439 \u043f\u0440\u0438\u043d- \u0446\u0438\u043f \u0440\u0430\u0434\u0438\u043e\u043f\u0440\u043e\u0442\u0435\u043a\u0442\u043e\u0440\u043d\u043e\u0433\u043e \u0434\u0435\u0439\u0441\u0442\u0432\u0438\u044f, \u043d\u0435 \u0441\u0432\u044f\u0437\u0430\u043d\u043d\u044b\u0439 \u0441 \u043f\u0440\u043e- \u0442\u0435\u043a\u0446\u0438\u0435\u0439 \u043e\u0442 \u043d\u0435\u043f\u043e\u0441\u0440\u0435\u0434\u0441\u0442\u0432\u0435\u043d\u043d\u043e \u03b3-\u043a\u0432\u0430\u043d\u0442\u0430 \u0438 \u0441 \u043e\u0433\u0440\u0430\u043d\u0438\u0447\u0435\u043d\u0438\u0435\u043c \u0432\u043e\u0437\u0434\u0435\u0439\u0441\u0442\u0432\u0438\u044f \u043e\u043a\u0441\u0438\u0434\u0430\u0442\u0438\u0432\u043d\u043e\u0433\u043e \u0441\u0442\u0440\u0435\u0441\u0441\u0430, \u0432\u044b\u0437\u044b\u0432\u0430\u0435\u043c\u043e\u0433\u043e \u0432\u0442\u043e- \u0440\u0438\u0447\u043d\u044b\u043c\u0438 \u0440\u0430\u0434\u0438\u043a\u0430\u043b\u0430\u043c\u0438, \u0430 \u0445\u0430\u0440\u0430\u043a\u0442\u0435\u0440\u0438\u0437\u0443\u044e\u0449\u0438\u0439\u0441\u044f \u0443\u0441\u043f\u0435\u0448\u043d\u044b\u043c \u043f\u043e\u0441\u0442\u0440\u0430\u0434\u0438\u0430\u0446\u0438\u043e\u043d\u043d\u044b\u043c \u0432\u043e\u0441\u0441\u0442\u0430\u043d\u043e\u0432\u043b\u0435\u043d\u0438\u0435\u043c \u0441\u0442\u0432\u043e\u043b\u043e\u0432\u044b\u0445 \u0433\u0435\u043c\u043e\u043f\u043e\u044d\u0442\u0438\u0447\u0435\u0441\u043a\u0438\u0445 \u043f\u0440\u0435\u0434\u0448\u0435\u0441\u0442\u0432\u0435\u043d\u043d\u0438\u043a\u043e\u0432, \u043e\u0431\u0443\u0441\u043b\u043e\u0432\u043b\u0435\u043d\u043d\u044b\u043c \u0443\u0447\u0430\u0441\u0442\u0438- \u0435\u043c \u0432 \u0440\u0435\u043f\u0430\u0440\u0430\u0442\u0438\u0432\u043d\u043e\u043c \u043f\u0440\u043e\u0446\u0435\u0441\u0441\u0435 \u0444\u0440\u0430\u0433\u043c\u0435\u043d\u0442\u043e\u0432 \u044d\u043a\u0441\u0442\u0440\u0430\u043a\u043b\u0435\u0442\u043e\u0447\u043d\u043e\u0439 \u0434\u0432\u0443\u0446\u0435\u043f\u043e\u0447\u0435\u0447\u043d\u043e\u0439 \u043d\u0443\u043a\u043b\u0435\u0438\u043d\u043e\u0432\u043e\u0439 \u043a\u0438\u0441\u043b\u043e\u0442\u044b. \u0422\u0430\u043a\u043e\u0435 \u0432\u0432\u0435\u0434\u0435\u043d\u0438\u0435 \u0432 \u0440\u0435\u043f\u0430\u0440\u0430\u0442\u0438\u0432\u043d\u044b\u0439 \u043f\u0440\u043e\u0446\u0435\u0441\u0441 \u0432\u043d\u0435\u0448\u043d\u0435\u0433\u043e \u00ab\u043a\u043e\u0440\u0440\u0435\u043a\u0442\u043e\u0440\u0430\u00bb \u0432 \u043a\u043e\u043d\u0435\u0447\u043d\u043e\u043c \u0438\u0442\u043e\u0433\u0435 \u043e\u043f\u0440\u0435\u0434\u0435\u043b\u044f\u0435\u0442 \u0432\u043e\u0441\u0441\u0442\u0430\u043d\u043e\u0432\u043b\u0435\u043d\u0438\u0435 \u043a\u0440\u043e\u0432\u0435\u0442\u0432\u043e\u0440\u043d\u043e\u0439 \u0438 \u0438\u043c\u043c\u0443\u043d\u043d\u043e\u0439 \u0441\u0438\u0441\u0442\u0435\u043c\u044b \u0438 \u0441\u043e\u0445\u0440\u0430\u043d\u0435\u043d\u0438\u0435 \u0436\u0438\u0437\u043d\u0435\u0441\u043f\u043e\u0441\u043e\u0431\u043d\u043e\u0441\u0442\u0438 \u043e\u0431- \u043b\u0443\u0447\u0435\u043d\u043d\u043e\u0433\u043e \u043e\u0440\u0433\u0430\u043d\u0438\u0437\u043c\u0430. \u041c\u0430\u0442\u0435\u0440\u0438\u0430\u043b\u044b \u0438 \u043c\u0435\u0442\u043e\u0434\u044b \u0416\u0438\u0432\u043e\u0442\u043d\u044b\u0435. \u0412 \u0440\u0430\u0431\u043e\u0442\u0435 \u0431\u044b\u043b\u0438 \u0438\u0441\u043f\u043e\u043b\u044c\u0437\u043e\u0432\u0430\u043d\u044b \u0442\u0440\u0435\u0445\u043c\u0435\u0441\u044f\u0447\u043d\u044b\u0435 \u043c\u044b\u0448\u0438 \u043b\u0438\u043d\u0438\u0439 CBA/Lac, C57BL \u0438 CC57BR (\u0441\u0430\u043c\u0446\u044b \u0438 \u0441\u0430\u043c- \u043a\u0438, 18\u201322 \u0433) \u0440\u0430\u0437\u0432\u0435\u0434\u0435\u043d\u0438\u044f \u0432\u0438\u0432\u0430\u0440\u0438\u044f \u0418\u043d\u0441\u0442\u0438\u0442\u0443\u0442\u0430 \u0446\u0438\u0442\u043e\u043b\u043e\u0433\u0438\u0438 \u0438 \u0433\u0435\u043d\u0435\u0442\u0438\u043a\u0438 (\u0418\u0426\u0438\u0413) \u0421\u041e \u0420\u0410\u041d. \u0416\u0438\u0432\u043e\u0442\u043d\u044b\u0435 \u0441\u043e\u0434\u0435\u0440\u0436\u0430\u043b\u0438\u0441\u044c \u0432 \u0433\u0440\u0443\u043f\u043f\u0430\u0445 \u043f\u043e 6\u201310 \u043c\u044b\u0448\u0435\u0439 \u043d\u0430 \u043a\u043b\u0435\u0442\u043a\u0443 \u0441\u043e \u0441\u0432\u043e\u0431\u043e\u0434\u043d\u044b\u043c \u0434\u043e\u0441\u0442\u0443\u043f\u043e\u043c \u043a \u043f\u0438\u0449\u0435 \u0438 \u0432\u043e\u0434\u0435. \u041e\u0431\u043b\u0443\u0447\u0435\u043d\u0438\u0435 \u044d\u043a\u0441\u043f\u0435\u0440\u0438\u043c\u0435\u043d\u0442\u0430\u043b\u044c\u043d\u044b\u0445 \u0436\u0438\u0432\u043e\u0442\u043d\u044b\u0445 \u043f\u0440\u043e\u0432\u043e\u0434\u0438\u043b\u0438 \u043d\u0430 \u03b3-\u0443\u0441\u0442\u0430\u043d\u043e\u0432\u043a\u0435 (\u0438\u0441\u0442\u043e\u0447\u043d\u0438\u043a Cs137 \u0418\u0413\u041e 1, \u0420\u043e\u0441\u0441\u0438\u044f) \u0434\u043e- \u0437\u043e\u0439 9.4 \u0413\u0440 \u043f\u0440\u0438 \u043c\u043e\u0449\u043d\u043e\u0441\u0442\u0438 \u0434\u043e\u0437\u044b 0.74\u20131.4 \u0413\u0440/\u043c\u0438\u043d. \u041f\u043e\u0434\u043e\u043f\u044b\u0442\u043d\u044b\u0445 \u0438 \u043a\u043e\u043d\u0442\u0440\u043e\u043b\u044c\u043d\u044b\u0445 \u043c\u044b\u0448\u0435\u0439 \u043e\u0431\u043b\u0443\u0447\u0430\u043b\u0438 \u0433\u0440\u0443\u043f\u043f\u0430\u043c\u0438 \u043f\u043e 9\u201310 \u0436\u0438\u0432\u043e\u0442\u043d\u044b\u0445 \u0432 \u043a\u043e\u043d\u0442\u0435\u0439\u043d\u0435\u0440\u0435 \u0440\u0430\u0437\u043c\u0435\u0440\u043e\u043c 20 \u00d7 20 \u00d7 40 \u0441\u043c. \u0420\u0430\u0434\u0438\u043e\u043f\u0440\u043e\u0442\u0435\u043a\u0442\u043e\u0440\u043d\u043e\u0435 \u0434\u0435\u0439\u0441\u0442\u0432\u0438\u0435 \u043f\u0440\u0435\u043f\u0430\u0440\u0430\u0442\u0430 \u0441\u0443\u043c\u043c\u0430\u0440\u043d\u043e\u0439 \u0420\u041d\u041a \u0434\u0440\u043e\u0436\u0436\u0435\u0439 (\u041d\u041f\u041e \u00ab\u0411\u0438\u043e\u043b\u0430\u0440\u00bb, \u0420\u043e\u0441\u0441\u0438\u044f) \u043e\u0446\u0435\u043d\u0438\u0432\u0430\u043b\u0438 \u043f\u043e \u0433\u0438\u0431\u0435\u043b\u0438 \u044d\u043a\u0441\u043f\u0435\u0440\u0438\u043c\u0435\u043d\u0442\u0430\u043b\u044c\u043d\u044b\u0445 \u0436\u0438\u0432\u043e\u0442\u043d\u044b\u0445 \u0432 \u043f\u0440\u043e\u043c\u0435\u0436\u0443\u0442\u043e\u043a \u0432\u0440\u0435\u043c\u0435\u043d\u0438 \u0434\u043e 30\u201390 \u0441\u0443\u0442. \u041f\u0440\u0435\u043f\u0430\u0440\u0430\u0442 \u0441\u0443\u043c\u043c\u0430\u0440\u043d\u043e\u0439 \u0420\u041d\u041a \u0434\u0440\u043e\u0436\u0436\u0435\u0439 \u0438 \u0434\u0432\u0443\u0446\u0435\u043f\u043e- \u0447\u0435\u0447\u043d\u0430\u044f \u0420\u041d\u041a \u0432\u0432\u043e\u0434\u0438\u043b\u0438\u0441\u044c \u043c\u044b\u0448\u0430\u043c \u043e\u0434\u043d\u043e\u043a\u0440\u0430\u0442\u043d\u043e \u0432\u043d\u0443\u0442\u0440\u0438\u0432\u0435\u043d\u043d\u043e \u0434\u043e \u043e\u0431\u043b\u0443\u0447\u0435\u043d\u0438\u044f \u0432 \u043a\u043e\u043b\u0438\u0447\u0435\u0441\u0442\u0432\u0435, \u043e\u0442\u0434\u0435\u043b\u044c\u043d\u043e \u0443\u043a\u0430\u0437\u0430\u043d\u043d\u043e\u043c \u0434\u043b\u044f \u043a\u0430\u0436\u0434\u043e\u0433\u043e \u044d\u043a\u0441\u043f\u0435\u0440\u0438\u043c\u0435\u043d\u0442\u0430. \u041e\u0446\u0435\u043d\u043a\u0430 \u043a\u043e\u043b\u0438\u0447\u0435\u0441\u0442\u0432\u0430 \u0441\u0435\u043b\u0435\u0437\u0435\u043d\u043e\u0447\u043d\u044b\u0445 \u043a\u043e\u043b\u043e\u043d\u0438\u0439 \u043f\u043e\u0441\u043b\u0435 \u0444\u0438\u043a\u0441\u0430\u0446\u0438\u0438 \u043e\u0440\u0433\u0430\u043d\u0430 \u0432 4 % \u043f\u0430\u0440\u0430\u0444\u043e\u0440\u043c\u0430\u043b\u044c\u0434\u0435\u0433\u0438\u0434\u0435 \u043f\u0440\u043e\u0432\u043e\u0434\u0438\u043b\u0430\u0441\u044c \u043d\u0430 9\u201312-\u0435 \u0441\u0443\u0442\u043a\u0438 \u043f\u043e\u0441\u043b\u0435 \u043e\u0431\u043b\u0443\u0447\u0435\u043d\u0438\u044f. \u0412\u044b\u0434\u0435\u043b\u0435\u043d\u0438\u0435 \u0444\u0440\u0430\u043a\u0446\u0438\u0439 \u043f\u0440\u0435\u043f\u0430\u0440\u0430\u0442\u0430 \u0420\u041d\u041a. \u0425\u0440\u043e\u043c\u0430\u0442\u043e\u0433\u0440\u0430- \u0444\u0438\u044e \u043f\u0440\u0435\u043f\u0430\u0440\u0430\u0442\u0430 \u0420\u041d\u041a \u0432\u044b\u043f\u043e\u043b\u043d\u044f\u043b\u0438 \u043d\u0430 \u043a\u043e\u043b\u043e\u043d\u043a\u0435 \u043e\u0431\u044a\u0435\u043c\u043e\u043c 10 \u043c\u043b, \u0434\u0438\u0430\u043c\u0435\u0442\u0440\u043e\u043c 1 \u0441\u043c. \u0421\u0443\u0445\u043e\u0439 \u0433\u0438\u0434\u0440\u043e\u043a\u0441\u0438\u0430\u043f\u0430\u0442\u0438\u0442 (\u0413\u0410\u041f) \u043f\u043e\u0434\u0432\u0435\u0440\u0433\u0430\u043b\u0438 \u043d\u0430\u0431\u0443\u0445\u0430\u043d\u0438\u044e \u0432 10 \u043c\u043b \u0432\u043e\u0434\u044b, \u043f\u043e\u0441\u043b\u0435 \u0447\u0435\u0433\u043e \u0437\u0430\u043f\u043e\u043b\u043d\u044f\u043b\u0438 \u043a\u043e\u043b\u043e\u043d\u043a\u0443. \u041a\u043e\u043b\u043e\u043d\u043a\u0443 \u043f\u0440\u043e\u043c\u044b\u0432\u0430\u043b\u0438 30 \u043c\u043b 0.01 \u041c PBS. \u041d\u0430\u043d\u043e\u0441\u0438\u043b\u0438 \u043d\u0430 \u043a\u043e\u043b\u043e\u043d\u043a\u0443 \u0440\u0430\u0441\u0442\u0432\u043e\u0440 \u0420\u041d\u041a \u0438 \u043f\u0440\u043e\u043c\u044b\u0432\u0430\u043b\u0438 30 \u043c\u043b 0.01 \u041c PBS. \u042d\u043b\u044e\u0438\u0440\u043e\u0432\u0430\u043b\u0438 \u0420\u041d\u041a 0.15 \u041c PBS, \u0437\u0430\u0442\u0435\u043c \u043f\u0440\u043e\u043c\u044b\u0432\u0430\u043b\u0438 0.18 \u041c PBS \u0438 \u043f\u043e\u0432\u0442\u043e\u0440\u043d\u043e \u044d\u043b\u044e\u0438\u0440\u043e\u0432\u0430\u043b\u0438 \u043d\u0443\u043a\u043b\u0435\u0438\u043d\u043e\u0432\u044b\u0435 \u043a\u0438\u0441\u043b\u043e\u0442\u044b 0.25 \u041c PBS. \u041f\u043e\u043b\u0443\u0447\u0435\u043d\u043d\u044b\u0439 \u043f\u0440\u0438 \u0445\u0440\u043e\u043c\u0430\u0442\u043e\u0433\u0440\u0430\u0444\u0438\u0438 \u0440\u0430\u0441\u0442\u0432\u043e\u0440 \u0420\u041d\u041a \u0432 PBS \u0434\u0438\u0430\u043b\u0438\u0437\u043e\u0432\u0430\u043b\u0438 \u043f\u0440\u043e\u0442\u0438\u0432 \u0422\u0415-\u0431\u0443\u0444\u0435\u0440\u0430 (H2O, \u043e\u0431\u0440\u0430\u0431\u043e\u0442\u0430\u043d\u043d\u0430\u044f DEPC; 10 \u043cM Tris-HCl, 10 \u043cM \u042d\u0414\u0422\u0410, pH 7.4) \u043f\u0440\u0438 +4 \u00b0\u0421 \u0432 \u0442\u0435\u0447\u0435\u043d\u0438\u0435 \u0441\u0443\u0442\u043e\u043a \u0441 \u0434\u0432\u0443\u043c\u044f \u0441\u043c\u0435\u043d\u0430\u043c\u0438 \u0431\u0443\u0444\u0435\u0440\u0430. \u042d\u043b\u0435\u043a\u0442\u0440\u043e\u0444\u043e\u0440\u0435\u0437 \u043f\u0440\u0435\u043f\u0430\u0440\u0430\u0442\u043e\u0432 \u043d\u0443\u043a\u043b\u0435\u0438\u043d\u043e\u0432\u044b\u0445 \u043a\u0438\u0441\u043b\u043e\u0442 \u043f\u0440\u043e\u0432\u043e\u0434\u0438\u043b\u0441\u044f \u0432 1 % \u0438\u043b\u0438 1.5 % \u0430\u0433\u0430\u0440\u043e\u0437\u043d\u043e\u043c \u0433\u0435\u043b\u0435 \u0441 \u0441\u043e\u0434\u0435\u0440\u0436\u0430\u043d\u0438\u0435\u043c 2 \u043c\u043a\u0433/\u043c\u043b \u0431\u0440\u043e\u043c\u0438\u0441\u0442\u043e\u0433\u043e \u044d\u0442\u0438\u0434\u0438\u044f \u0432 \u0442\u0440\u0438\u0441-\u0430\u0446\u0435\u0442\u0430\u0442\u043d\u043e\u043c \u0431\u0443\u0444\u0435\u0440\u0435. \u0412\u044b\u0434\u0435\u043b\u0435\u043d\u0438\u0435 \u043a\u043b\u0435\u0442\u043e\u043a \u043a\u043e\u0441\u0442\u043d\u043e\u0433\u043e \u043c\u043e\u0437\u0433\u0430. \u041a\u043b\u0435\u0442\u043a\u0438 \u043a\u043e\u0441\u0442\u043d\u043e\u0433\u043e \u043c\u043e\u0437\u0433\u0430 \u043c\u044b\u0448\u0435\u0439 \u0432\u044b\u043c\u044b\u0432\u0430\u043b\u0438 \u0438\u0437 \u0442\u0440\u0443\u0431\u0447\u0430\u0442\u044b\u0445 \u043a\u043e\u0441\u0442\u0435\u0439 \u0441\u0440\u0435\u0434\u043e\u0439 RPMI-1640, \u0442\u0449\u0430\u0442\u0435\u043b\u044c\u043d\u043e \u0440\u0435\u0441\u0443\u0441\u043f\u0435\u043d\u0434\u0438\u0440\u043e\u0432\u0430\u043b\u0438. \u0421\u0443\u0441\u043f\u0435\u043d\u0437\u0438\u044e \u0430\u043a\u043a\u0443\u0440\u0430\u0442\u043d\u043e \u043d\u0430\u0441\u043b\u0430\u0438\u0432\u0430\u043b\u0438 \u043d\u0430 3 \u043c\u043b \u0441\u043c\u0435\u0441\u0438 \u0444\u0438\u043a\u043e\u043b-\u0443\u0440\u043e\u0433\u0440\u0430\u0444\u0438\u043d (15 % \u0443\u0440\u043e\u0433\u0440\u0430\u0444\u0438\u043d, 7 % \u0444\u0438\u043a\u043e\u043b\u043b, \u03c1 = 1.119), \u0446\u0435\u043d\u0442\u0440\u0438\u0444\u0443\u0433\u0438- \u0440\u043e\u0432\u0430\u043b\u0438 \u043f\u0440\u0438 400 g, 4 \u00b0\u0421 \u0432 \u0442\u0435\u0447\u0435\u043d\u0438\u0435 40 \u043c\u0438\u043d. \u041f\u043e\u0441\u043b\u0435 \u0446\u0435\u043d\u0442\u0440\u0438- \u0444\u0443\u0433\u0438\u0440\u043e\u0432\u0430\u043d\u0438\u044f \u0432\u0441\u044f \u043a\u043b\u0435\u0442\u043e\u0447\u043d\u0430\u044f \u043c\u0430\u0441\u0441\u0430 \u0440\u0430\u0437\u0434\u0435\u043b\u044f\u043b\u0430\u0441\u044c \u043d\u0430 \u043a\u043b\u0435\u0442\u043a\u0438, \u0441\u043e\u0441\u0442\u0430\u0432\u043b\u044f\u044e\u0449\u0438\u0435 \u0438\u043d\u0442\u0435\u0440\u0444\u0430\u0437\u043d\u043e\u0435 \u043a\u043e\u043b\u044c\u0446\u043e (\u043c\u043e\u043d\u043e\u043d\u0443\u043a\u043b\u0435\u0430\u0440\u044b) \u0438 \u043e\u0441\u0430\u0434\u043e\u043a. \u041c\u043e\u043d\u043e\u043d\u0443\u043a\u043b\u0435\u0430\u0440\u044b \u043e\u0442\u0431\u0438\u0440\u0430\u043b\u0438 \u0432 \u043d\u043e\u0432\u0443\u044e \u043f\u0440\u043e\u0431\u0438\u0440\u043a\u0443, \u043f\u0440\u043e- \u043c\u044b\u0432\u0430\u043b\u0438 4 \u043c\u043b RPMI-1640 \u0438 \u043e\u0441\u0430\u0436\u0434\u0430\u043b\u0438 \u0446\u0435\u043d\u0442\u0440\u0438\u0444\u0443\u0433\u0438\u0440\u043e\u0432\u0430\u043d\u0438\u0435\u043c \u043f\u0440\u0438 400 g, 4 \u00b0\u0421 \u0432 \u0442\u0435\u0447\u0435\u043d\u0438\u0435 5 \u043c\u0438\u043d. \u0410\u043d\u0430\u043b\u0438\u0437 \u0440\u0435\u043f\u0430\u0440\u0430\u0442\u0438\u0432\u043d\u043e\u0433\u043e \u0446\u0438\u043a\u043b\u0430 \u0432 \u043a\u043b\u0435\u0442\u043a\u0430\u0445 \u043a\u043e\u0441\u0442\u043d\u043e\u0433\u043e \u043c\u043e\u0437\u0433\u0430. \u0427\u0435\u0440\u0435\u0437 30, 60 \u0438 120 \u043c\u0438\u043d \u043f\u043e\u0441\u043b\u0435 \u043e\u0431\u043b\u0443\u0447\u0435\u043d\u0438\u044f \u043c\u044b\u0448\u0435\u0439 \u043b\u0438\u043d\u0438\u0438 \u0421\u0412\u0410 \u0430\u0431\u0441\u043e\u043b\u044e\u0442\u043d\u043e \u043b\u0435\u0442\u0430\u043b\u044c\u043d\u043e\u0439 \u0434\u043e\u0437\u043e\u0439 9.4 \u0413\u0440 \u0438\u0437 \u0442\u0440\u0443\u0431- \u0447\u0430\u0442\u044b\u0445 \u043a\u043e\u0441\u0442\u0435\u0439 \u0432\u044b\u0434\u0435\u043b\u044f\u043b\u0438 \u043a\u043b\u0435\u0442\u043a\u0438 \u043a\u043e\u0441\u0442\u043d\u043e\u0433\u043e \u043c\u043e\u0437\u0433\u0430. \u0410\u043d\u0430\u043b\u0438\u0437 \u0440\u0435\u043f\u0430\u0440\u0430\u0442\u0438\u0432\u043d\u043e\u0433\u043e \u0446\u0438\u043a\u043b\u0430 \u043f\u043e \u043a\u043e\u043b\u0438\u0447\u0435\u0441\u0442\u0432\u0443 \u0414\u0426\u0420 \u043e\u0441\u0443\u0449\u0435\u0441\u0442\u0432\u043b\u044f\u043b\u0438 \u043c\u0435\u0442\u043e\u0434\u043e\u043c \u00ab\u043a\u043e\u043c\u0435\u0442\u043d\u044b\u0445 \u0445\u0432\u043e\u0441\u0442\u043e\u0432\u00bb \u0438\u043b\u0438 \u043f\u0440\u0438 \u043f\u043e\u043c\u043e\u0449\u0438 \u0430\u043d\u0442\u0438\u0442\u0435\u043b \u043a \u0433\u0438\u0441\u0442\u043e\u043d\u0443 \u03b3-H2aX, \u043a\u0430\u043a \u043e\u043f\u0438\u0441\u0430\u043d\u043e \u0432 \u0440\u0430\u0431\u043e\u0442\u0435 (Dolgova et al., 2014). \u0414\u043b\u0438\u043d\u0443 \u00ab\u043a\u043e\u043c\u0435\u0442\u043d\u044b\u0445 \u0445\u0432\u043e\u0441\u0442\u043e\u0432\u00bb (TM \u2013 tail moment) \u043e\u0446\u0435\u043d\u0438\u0432\u0430\u043b\u0438 \u0432 \u043f\u0440\u043e\u0433\u0440\u0430\u043c\u043c\u0435 CASP \u0438 ImageJ. \u041e\u0431\u0440\u0430\u0437\u0446\u044b, \u043e\u043a\u0440\u0430\u0448\u0435\u043d\u043d\u044b\u0435 \u0430\u043d\u0442\u0438\u0442\u0435\u043b\u0430\u043c\u0438 \u043a \u0433\u0438\u0441\u0442\u043e\u043d\u0443 \u03b3-H2aX, \u0430\u043d\u0430\u043b\u0438\u0437\u0438\u0440\u043e\u0432\u0430\u043b\u0438 \u043f\u0440\u0438 \u043f\u043e\u043c\u043e- \u0449\u0438 \u043f\u0440\u043e\u0442\u043e\u0447\u043d\u043e\u0433\u043e \u0446\u0438\u0442\u043e\u0444\u043b\u0443\u043e\u0440\u0438\u043c\u0435\u0442\u0440\u0430 BD FACSAria \u0432 \u0426\u041a\u041f \u043f\u0440\u043e\u0442\u043e\u0447\u043d\u043e\u0439 \u0446\u0438\u0442\u043e\u0444\u043b\u0443\u043e\u0440\u043e\u043c\u0435\u0442\u0440\u0438\u0438 \u0418\u0426\u0438\u0413 \u0421\u041e \u0420\u0410\u041d. \u0417\u043d\u0430\u0447\u0435\u043d\u0438\u044f, \u043f\u043e\u043b\u0443\u0447\u0435\u043d\u043d\u044b\u0435 \u043f\u043e\u0441\u043b\u0435 \u0430\u043d\u0430\u043b\u0438\u0437\u0430 50\u2013100 \u043a\u043e\u043c\u0435\u0442\u043d\u044b\u0445 \u0445\u0432\u043e\u0441\u0442\u043e\u0432, \u0431\u044b\u043b\u0438 \u043d\u043e\u0440\u043c\u0438\u0440\u043e\u0432\u0430\u043d\u044b \u043a \u043f\u043e\u043a\u0430\u0437\u0430\u0442\u0435\u043b\u044f\u043c, \u043e\u043f\u0440\u0435\u0434\u0435\u043b\u0435\u043d\u043d\u044b\u043c \u0432 30-\u0439 \u043c\u0438\u043d\u0443\u0442\u0435, \u0438 \u0443\u0441\u0440\u0435\u0434\u043d\u0435\u043d\u044b. \u041f\u0430\u0442\u043e\u043c\u043e\u0440\u0444\u043e\u043b\u043e\u0433\u0438\u0447\u0435\u0441\u043a\u0438\u0439 \u0430\u043d\u0430\u043b\u0438\u0437 \u043e\u0440\u0433\u0430\u043d\u043e\u0432. \u041e\u0440\u0433\u0430\u043d\u044b \u0444\u0438\u043a\u0441\u0438\u0440\u043e\u0432\u0430\u043b\u0438\u0441\u044c \u0432 4 % \u0444\u043e\u0440\u043c\u0430\u043b\u044c\u0434\u0435\u0433\u0438\u0434\u0435 \u0438 \u0437\u0430\u043b\u0438\u0432\u0430\u043b\u0438\u0441\u044c \u0432 \u043f\u0430\u0440\u0430\u0444\u0438\u043d\u043e\u0432\u044b\u0435 \u0431\u043b\u043e\u043a\u0438. \u041f\u0430\u0440\u0430\u0444\u0438\u043d\u043e\u0432\u044b\u0435 \u0441\u0440\u0435\u0437\u044b \u043f\u0440\u043e\u0432\u043e\u0434\u0438\u043b\u0438\u0441\u044c \u0447\u0435\u0440\u0435\u0437 \u0441\u0435\u0440\u0438\u044e \u0441\u043f\u0438\u0440\u0442\u043e\u0432 \u0438 \u043e\u043a\u0440\u0430\u0448\u0438\u0432\u0430\u043b\u0438\u0441\u044c \u0433\u0435\u043c\u0430\u0442\u043e\u043a\u0441\u0438\u043b\u0438\u043d\u043e\u043c-\u044d\u043e\u0437\u0438\u043d\u043e\u043c. \u0421\u0440\u0430\u0432\u043d\u0435\u043d\u0438\u0435 \u044d\u0444\u0444\u0435\u043a\u0442\u0438\u0432\u043d\u043e\u0441\u0442\u0438 \u0440\u0430\u0434\u0438\u043e\u043f\u0440\u043e\u0442\u0435\u043a\u0442\u043e\u0440\u043d\u043e\u0433\u043e \u0434\u0435\u0439- \u0441\u0442\u0432\u0438\u044f \u043f\u0440\u0435\u043f\u0430\u0440\u0430\u0442\u0430 \u0441\u0443\u043c\u043c\u0430\u0440\u043d\u043e\u0439 \u0420\u041d\u041a \u0434\u0440\u043e\u0436\u0436\u0435\u0439 \u0438 \u0448\u0442\u0430\u0442\u043d\u043e\u0433\u043e \u0440\u0430\u0434\u0438\u043e\u043f\u0440\u043e\u0442\u0435\u043a\u0442\u043e\u0440\u0430 \u0411-190. \u0412 \u043a\u0430\u0447\u0435\u0441\u0442\u0432\u0435 \u043f\u0440\u0435\u043f\u0430\u0440\u0430\u0442\u0430 \u0441\u0440\u0430\u0432\u043d\u0435\u043d\u0438\u044f \u0438\u0441\u043f\u043e\u043b\u044c\u0437\u043e\u0432\u0430\u043b\u0438 \u0440\u0430\u0434\u0438\u043e\u043f\u0440\u043e\u0442\u0435\u043a\u0442\u043e\u0440 \u0411-190 (\u0424\u0413\u0423\u041f \u041d\u041f\u0426 \u00ab\u0424\u0430\u0440\u043c- \u0437\u0430\u0449\u0438\u0442\u0430\u00bb \u0424\u041c\u0411\u0410 \u0420\u043e\u0441\u0441\u0438\u0438). \u041f\u0440\u0435\u043f\u0430\u0440\u0430\u0442 \u0411-190 \u0432\u0432\u043e\u0434\u0438\u043b\u0438 \u043c\u044b\u0448\u0430\u043c \u0437\u0430 20 \u043c\u0438\u043d \u0434\u043e \u043e\u0431\u043b\u0443\u0447\u0435\u043d\u0438\u044f \u043f\u0435\u0440\u043e\u0440\u0430\u043b\u044c\u043d\u043e \u0432 \u043a\u043e\u043b\u0438\u0447\u0435\u0441\u0442\u0432\u0435 2.5 \u043c\u0433/ \u043c\u044b\u0448\u044c \u0432 \u043e\u0431\u044a\u0435\u043c\u0435 0.25 \u043c\u043b. \u041f\u0440\u0435\u043f\u0430\u0440\u0430\u0442 \u0441\u0443\u043c\u043c\u0430\u0440\u043d\u043e\u0439 \u0420\u041d\u041a \u0432\u0432\u043e\u0434\u0438\u043b\u0438 \u043c\u044b\u0448\u0430\u043c \u0437\u0430 60 \u043c\u0438\u043d \u0434\u043e \u043e\u0431\u043b\u0443\u0447\u0435\u043d\u0438\u044f \u0432\u043d\u0443\u0442\u0440\u0438\u0432\u0435\u043d\u043d\u043e \u0432 \u043a\u043e\u043b\u0438\u0447\u0435\u0441\u0442\u0432\u0435 7 \u043c\u0433/\u043c\u044b\u0448\u044c \u0432 \u043e\u0431\u044a\u0435\u043c\u0435 0.5 \u043c\u043b (0.15 \u041c PBS). \u0421\u0440\u0430\u0432\u043d\u0438\u0432\u0430\u043b\u0438 \u0432\u044b\u0436\u0438\u0432\u0430\u0435\u043c\u043e\u0441\u0442\u044c \u0436\u0438\u0432\u043e\u0442\u043d\u044b\u0445 \u043f\u043e\u0441\u043b\u0435 \u043e\u0431\u043b\u0443\u0447\u0435\u043d\u0438\u044f \u0434\u043e\u0437\u043e\u0439 9.4 \u0413\u0440, \u0434\u0435\u043b\u0430\u043b\u0438 \u043f\u0430\u0442\u043e\u043c\u043e\u0440\u0444\u043e\u043b\u043e\u0433\u0438\u0447\u0435\u0441\u043a\u0438\u0439 \u0430\u043d\u0430\u043b\u0438\u0437 \u043e\u0440\u0433\u0430\u043d\u043e\u0432. \u041a\u0430\u0447\u0435\u0441\u0442\u0432\u0435\u043d\u043d\u0430\u044f \u0440\u0435\u0430\u043a\u0446\u0438\u044f \u043d\u0430 \u0414\u041d\u041a (\u0440\u0435\u0430\u043a\u0446\u0438\u044f \u0414\u0438\u0448\u0435). \u041c\u0435\u0442\u043e\u0434 \u043e\u0441\u043d\u043e\u0432\u0430\u043d \u043d\u0430 \u0441\u043f\u043e\u0441\u043e\u0431\u043d\u043e\u0441\u0442\u0438 \u0434\u0435\u0437\u043e\u043a\u0441\u0438\u0440\u0438\u0431\u043e\u0437\u044b \u043e\u0431\u0440\u0430\u0437\u043e\u0432\u044b\u0432\u0430\u0442\u044c \u0441\u043e\u0435\u0434\u0438\u043d\u0435\u043d\u0438\u0435 \u0441\u0438\u043d\u0435\u0433\u043e \u0446\u0432\u0435\u0442\u0430 \u0441 \u0434\u0438\u0444\u0435\u043d\u0438\u043b\u0430\u043c\u0438\u043d\u043e\u043c \u043f\u0440\u0438 \u043d\u0430\u0433\u0440\u0435\u0432\u0430- \u043d\u0438\u0438 \u0432 \u0441\u0440\u0435\u0434\u0435, \u0441\u043e\u0434\u0435\u0440\u0436\u0430\u0449\u0435\u0439 \u0441\u043c\u0435\u0441\u044c \u043b\u0435\u0434\u044f\u043d\u043e\u0439 \u0443\u043a\u0441\u0443\u0441\u043d\u043e\u0439 \u0438 \u043a\u043e\u043d- \u0446\u0435\u043d\u0442\u0440\u0438\u0440\u043e\u0432\u0430\u043d\u043d\u043e\u0439 \u0441\u0435\u0440\u043d\u043e\u0439 \u043a\u0438\u0441\u043b\u043e\u0442 (Dische, 1957). \u0421 \u0440\u0438\u0431\u043e\u0437\u043e\u0439 \u0420\u041d\u041a \u0430\u043d\u0430\u043b\u043e\u0433\u0438\u0447\u043d\u0430\u044f \u0440\u0435\u0430\u043a\u0446\u0438\u044f \u0434\u0430\u0435\u0442 \u0437\u0435\u043b\u0435\u043d\u043e\u0435 \u043e\u043a\u0440\u0430\u0448\u0438\u0432\u0430\u043d\u0438\u0435. \u0414\u0438\u0444\u0435\u043d\u0438\u043b\u0430\u043c\u0438\u043d\u043e\u0432\u044b\u0439 \u0440\u0435\u0430\u043a\u0442\u0438\u0432 \u043f\u0440\u0435\u0434\u0441\u0442\u0430\u0432\u043b\u044f\u0435\u0442 \u0441\u043e\u0431\u043e\u0439 1 % (W/V) \u0440\u0430\u0441\u0442\u0432\u043e\u0440 \u0434\u0438\u0444\u0435\u043d\u0438\u043b\u0430\u043c\u0438\u043d\u0430 \u0432 \u0441\u043c\u0435\u0441\u0438 \u043b\u0435\u0434\u044f\u043d\u043e\u0439 \u0443\u043a\u0441\u0443\u0441\u043d\u043e\u0439 \u043a\u0438\u0441\u043b\u043e- \u0442\u044b \u0438 2.75 % (W/V) \u043a\u043e\u043d\u0446\u0435\u043d\u0442\u0440\u0438\u0440\u043e\u0432\u0430\u043d\u043d\u043e\u0439 \u0441\u0435\u0440\u043d\u043e\u0439 \u043a\u0438\u0441\u043b\u043e\u0442\u044b ( \u044020 = 1.836). \u041a \u043e\u0441\u0430\u0434\u043a\u0443 \u043d\u0443\u043a\u043b\u0435\u0438\u043d\u043e\u0432\u044b\u0445 \u043a\u0438\u0441\u043b\u043e\u0442 \u0434\u043e\u0431\u0430\u0432\u043b\u044f\u044e\u0442 0.5 \u043c\u043b \u0440\u0430\u0441\u0442\u0432\u043e\u0440\u0430 \u0435\u0434\u043a\u043e\u0433\u043e \u043d\u0430\u0442\u0440\u0430 (0.1 \u041c) \u0438 \u043f\u0440\u0438\u043b\u0438\u0432\u0430\u044e\u0442 \u0440\u0430\u0432\u043d\u044b\u0439 \u043e\u0431\u044a\u0435\u043c \u0434\u0438\u0444\u0435\u043d\u0438\u043b\u0430\u043c\u0438\u043d\u043e\u0432\u043e\u0433\u043e \u0440\u0435\u0430\u043a\u0442\u0438\u0432\u0430. \u0420\u0430\u0441\u0442\u0432\u043e\u0440 \u043d\u0430\u0433\u0440\u0435\u0432\u0430\u044e\u0442 \u0432 \u0442\u0435\u0447\u0435\u043d\u0438\u0435 15\u201320 \u043c\u0438\u043d \u043d\u0430 \u043a\u0438\u043f\u044f\u0449\u0435\u0439 \u0432\u043e\u0434\u044f\u043d\u043e\u0439 \u0431\u0430\u043d\u0435. \u041f\u043e\u044f\u0432\u043b\u044f\u0435\u0442\u0441\u044f \u0445\u0430\u0440\u0430\u043a\u0442\u0435\u0440\u043d\u043e\u0435 \u0434\u043b\u044f \u0441\u0443\u0431\u0441\u0442\u0440\u0430\u0442\u0430 \u043e\u043a\u0440\u0430\u0448\u0438\u0432\u0430\u043d\u0438\u0435. \u041a\u043b\u043e\u043d\u0438\u0440\u043e\u0432\u0430\u043d\u0438\u0435 \u043a\u0414\u041d\u041a \u043a\u043e\u043f\u0438\u0439 \u043c\u043e\u043b\u0435\u043a\u0443\u043b \u0420\u041d\u041a, \u044d\u043b\u044e\u0438\u0440\u0443\u044e\u0449\u0438\u0445\u0441\u044f \u0441 \u0413\u0410\u041f 0.25 \u041c PBS. \u0414\u043b\u044f \u043f\u043e\u043b\u0443\u0447\u0435\u043d\u0438\u044f \u043a\u0414\u041d\u041a \u0441 \u0420\u041d\u041a \u0438\u0441\u043f\u043e\u043b\u044c\u0437\u043e\u0432\u0430\u043b\u0438 \u0441\u0438\u0441\u0442\u0435\u043c\u0443 \u0440\u0435\u0432\u0435\u0440\u0442\u0430\u0437\u043d\u043e\u0433\u043e \u0441\u0438\u043d\u0442\u0435\u0437\u0430 \u0438 \u043d\u0430\u0431\u043e\u0440 DOP- PCR master kit (\u00ab\u041c\u0435\u0434\u0438\u0433\u0435\u043d\u00bb). \u043a\u0414\u041d\u041a \u043a\u043e\u043f\u0438\u0438 \u043a\u043b\u043e\u043d\u0438\u0440\u043e\u0432\u0430\u043b\u0438 \u0432 \u043f\u043b\u0430\u0437\u043c\u0438\u0434\u043d\u043e\u043c \u0432\u0435\u043a\u0442\u043e\u0440\u0435 Bluescript (\u041d\u041f\u041e \u00ab\u0412\u0435\u043a\u0442\u043e\u0440\u00bb) \u043f\u043e\u0441\u043b\u0435 \u00ab\u043f\u043e\u043b\u0438\u0440\u043e\u0432\u043a\u0438\u00bb \u043a\u043e\u043d\u0446\u043e\u0432 \u0444\u0440\u0430\u0433\u043c\u0435\u043d\u0442\u043e\u0432 \u0441 \u043f\u043e\u043c\u043e\u0449\u044c\u044e Pfu \u043f\u043e\u043b\u0438\u043c\u0435\u0440\u0430\u0437\u044b \u0438 \u0442\u0440\u0430\u043d\u0441\u0444\u043e\u0440\u043c\u0438\u0440\u043e\u0432\u0430\u043b\u0438 \u0432 \u044d\u043b\u0435\u043a\u0442\u0440\u043e\u043a\u043e\u043c\u043f\u0435\u0442\u0435\u043d\u0442\u043d\u044b\u0435 \u043a\u043b\u0435\u0442\u043a\u0438 XL1-Blue MRF. \u0428\u0442\u0430\u043c\u043c E. coli XL1-Blue MRF \u043b\u044e\u0431\u0435\u0437\u043d\u043e \u043f\u0440\u0435\u0434\u043e\u0441\u0442\u0430\u0432\u043b\u0435\u043d \u043b\u0430\u0431\u043e\u0440\u0430\u0442\u043e\u0440\u0438\u0435\u0439 \u0438\u043c\u043c\u0443\u043d\u043e\u0433\u0435\u043d\u0435\u0442\u0438\u043a\u0438 \u0418\u043d\u0441\u0442\u0438\u0442\u0443\u0442\u0430 \u043c\u043e\u043b\u0435\u043a\u0443\u043b\u044f\u0440\u043d\u043e\u0439 \u0438 \u043a\u043b\u0435\u0442\u043e\u0447\u043d\u043e\u0439 \u0431\u0438\u043e\u043b\u043e\u0433\u0438\u0438 \u0421\u041e \u0420\u0410\u041d. \u041f\u043e\u0441\u043b\u0435 \u0430\u043d\u0430\u043b\u0438\u0437\u0430 \u044d\u043b\u0435\u043a\u0442\u0440\u043e\u0444\u043e\u0440\u0435\u0442\u0438\u0447\u0435\u0441\u043a\u043e\u0439 \u043f\u043e\u0434\u0432\u0438\u0436\u043d\u043e\u0441\u0442\u0438 \u0414\u041d\u041a, \u0432\u044b- \u0434\u0435\u043b\u0435\u043d\u043d\u043e\u0439 \u0438\u0437 \u043f\u043e\u043b\u0443\u0447\u0435\u043d\u043d\u044b\u0445 \u0442\u0440\u0430\u043d\u0441\u0444\u043e\u0440\u043c\u0430\u043d\u0442\u043e\u0432, \u043e\u0442\u043e\u0431\u0440\u0430\u043d\u043d\u044b\u0435 \u043a\u043b\u043e\u043d\u044b \u0431\u044b\u043b\u0438 \u0441\u0435\u043a\u0432\u0435\u043d\u0438\u0440\u043e\u0432\u0430\u043d\u044b \u0441 \u0438\u0441\u043f\u043e\u043b\u044c\u0437\u043e\u0432\u0430\u043d\u0438\u0435\u043c \u043f\u0440\u043e\u0442\u043e\u043a\u043e\u043b\u0430 \u0444\u0438\u0440\u043c\u044b Applied Biosystems (\u0421\u0428\u0410) \u043f\u0440\u0438 \u043f\u043e\u043c\u043e\u0449\u0438 \u0430\u0432\u0442\u043e\u043c\u0430\u0442\u0438- \u0447\u0435\u0441\u043a\u043e\u0433\u043e \u0414\u041d\u041a \u0441\u0435\u043a\u0432\u0435\u043d\u0430\u0442\u043e\u0440\u0430 Applied Biosystems 3500 Genetic Analyzer \u0441 8-\u043a\u0430\u043d\u0430\u043b\u044c\u043d\u044b\u043c \u043a\u0430\u043f\u0438\u043b\u043b\u044f\u0440\u043d\u044b\u043c \u0431\u043b\u043e\u043a\u043e\u043c. \u0421\u0435\u043a\u0432\u0435\u043d\u0438\u0440\u043e- \u0432\u0430\u043d\u043d\u044b\u0435 \u043a\u043b\u043e\u043d\u044b \u0430\u043d\u0430\u043b\u0438\u0437\u0438\u0440\u043e\u0432\u0430\u043b\u0438\u0441\u044c \u0432 \u043f\u0440\u043e\u0433\u0440\u0430\u043c\u043c\u0435 Vector NTI. \u041f\u043e\u0441\u043b\u0435\u0434\u043e\u0432\u0430\u0442\u0435\u043b\u044c\u043d\u043e\u0441\u0442\u0438 \u0431\u044b\u043b\u0438 \u0432\u044b\u0440\u0430\u0432\u043d\u0435\u043d\u044b \u0438 \u0441\u043e\u0431\u0440\u0430\u043d\u044b \u0432 \u0433\u0440\u0443\u043f\u043f\u044b \u0433\u043e\u043c\u043e\u043b\u043e\u0433\u0438\u0438. \u041a\u043e\u043d\u0442\u0435\u043a\u0441\u0442\u043d\u044b\u0439 \u0430\u043d\u0430\u043b\u0438\u0437 \u043f\u0440\u043e\u0432\u043e\u0434\u0438\u043b\u0438 \u043d\u0430 \u0441\u0430\u0439\u0442\u0435 http://genome.ucsc.edu , \u0438\u0441\u043f\u043e\u043b\u044c\u0437\u0443\u044f \u0438\u043d\u0441\u0442\u0440\u0443\u043c\u0435\u043d\u0442 Blat. \u0420\u0435\u0437\u0443\u043b\u044c\u0442\u0430\u0442\u044b \u0420\u0430\u0434\u0438\u043e\u043f\u0440\u043e\u0442\u0435\u043a\u0442\u043e\u0440\u043d\u043e\u0435 \u0434\u0435\u0439\u0441\u0442\u0432\u0438\u0435 \u0441\u0443\u043c\u043c\u0430\u0440\u043d\u043e\u0439 \u0434\u0440\u043e\u0436\u0436\u0435\u0432\u043e\u0439 \u0420\u041d\u041a \u0411\u044b\u043b\u043e \u043f\u0440\u043e\u0430\u043d\u0430\u043b\u0438\u0437\u0438\u0440\u043e\u0432\u0430\u043d\u043e 10 \u0440\u0430\u0437\u043b\u0438\u0447\u043d\u044b\u0445 \u0441\u0435\u0440\u0438\u0439\u043d\u044b\u0445 \u043f\u0440\u0435\u043f\u0430\u0440\u0430\u0442\u043e\u0432 \u0434\u0440\u043e\u0436\u0436\u0435\u0432\u043e\u0439 \u0441\u0443\u043c\u043c\u0430\u0440\u043d\u043e\u0439 \u0420\u041d\u041a \u043d\u0430 \u0435\u0435 \u0441\u043f\u043e\u0441\u043e\u0431\u043d\u043e\u0441\u0442\u044c \u0437\u0430\u0449\u0438\u0449\u0430\u0442\u044c \u0436\u0438\u0432\u043e\u0442\u043d\u044b\u0445 \u043e\u0442 \u043b\u0435\u0442\u0430\u043b\u044c\u043d\u043e\u0439 \u0434\u043e\u0437\u044b \u03b3-\u0440\u0430\u0434\u0438\u0430\u0446\u0438\u0438. \u041e\u0431- \u043d\u0430\u0440\u0443\u0436\u0435\u043d\u043e, \u0447\u0442\u043e \u0440\u0430\u0434\u0438\u043e\u0437\u0430\u0449\u0438\u0442\u043d\u044b\u0439 \u044d\u0444\u0444\u0435\u043a\u0442 \u043f\u0440\u0435\u043f\u0430\u0440\u0430\u0442\u0430 \u043f\u0440\u044f\u043c\u043e \u043d\u0435 \u0441\u0432\u044f\u0437\u0430\u043d \u0441 \u043f\u0440\u043e\u0446\u0435\u043d\u0442\u043d\u044b\u043c \u0441\u043e\u0434\u0435\u0440\u0436\u0430\u043d\u0438\u0435\u043c \u0420\u041d\u041a \u0438 \u0431\u0435\u043b\u043a\u0430 \u0432 \u043f\u0440\u0435\u043f\u0430\u0440\u0430\u0442\u0435. \u041e\u0446\u0435\u043d\u0435\u043d\u0430 \u0434\u043b\u0438\u0442\u0435\u043b\u044c\u043d\u043e\u0441\u0442\u044c \u0440\u0430\u0434\u0438\u043e\u0437\u0430\u0449\u0438\u0442\u043d\u043e\u0433\u043e \u0434\u0435\u0439- \u0441\u0442\u0432\u0438\u044f \u043f\u0440\u0435\u043f\u0430\u0440\u0430\u0442\u0430. \u0414\u043b\u044f \u044d\u0442\u043e\u0433\u043e \u043e\u0447\u0438\u0449\u0435\u043d\u043d\u0430\u044f \u0441\u0442\u0435\u0440\u0438\u043b\u044c\u043d\u0430\u044f \u0420\u041d\u041a \u0434\u0440\u043e\u0436\u0436\u0435\u0439 \u0432 \u043a\u043e\u043b\u0438\u0447\u0435\u0441\u0442\u0432\u0435 7 \u043c\u0433 \u0432\u0432\u043e\u0434\u0438\u043b\u0430\u0441\u044c \u044d\u043a\u0441\u043f\u0435\u0440\u0438\u043c\u0435\u043d\u0442\u0430\u043b\u044c\u043d\u044b\u043c \u043c\u044b\u0448\u0430\u043c \u043b\u0438\u043d\u0438\u0438 C57BL \u0437\u0430 \u0447\u0430\u0441, \u0437\u0430 \u0441\u0443\u0442\u043a\u0438, \u0437\u0430 4, 8 \u0438 12 \u0441\u0443\u0442 \u0434\u043e \u043e\u0431\u043b\u0443\u0447\u0435\u043d\u0438\u044f \u043b\u0435\u0442\u0430\u043b\u044c\u043d\u043e\u0439 \u0434\u043e\u0437\u043e\u0439 \u0440\u0430\u0434\u0438\u0430\u0446\u0438\u0438 9.4 \u0413\u0440. \u041e\u043a\u0430\u0437\u0430\u043b\u043e\u0441\u044c, \u043f\u0440\u0438 \u043e\u0431\u043b\u0443\u0447\u0435\u043d\u0438\u0438 \u0447\u0435\u0440\u0435\u0437 1 \u0447 \u0438 \u043d\u0430 4-\u0435 \u0441\u0443\u0442\u043a\u0438 \u043e\u0442 \u0432\u0432\u0435\u0434\u0435\u043d\u0438\u044f \u043f\u0440\u0435- \u043f\u0430\u0440\u0430\u0442\u0430 \u0420\u041d\u041a \u0432\u044b\u0436\u0438\u0432\u0430\u0435\u0442 100 % \u0436\u0438\u0432\u043e\u0442\u043d\u044b\u0445 \u043d\u0430 70-\u0435 \u0441\u0443\u0442\u043a\u0438 \u043d\u0430\u0431\u043b\u044e\u0434\u0435\u043d\u0438\u044f, \u043f\u0440\u0438 \u043e\u0431\u043b\u0443\u0447\u0435\u043d\u0438\u0438 \u043d\u0430 8-\u0435 \u0438 12-\u0435 \u0441\u0443\u0442\u043a\u0438 \u2013 60 % \u0436\u0438\u0432\u043e\u0442\u043d\u044b\u0445 (\u0420\u0438\u0442\u0442\u0435\u0440 \u0438 \u0434\u0440., 2018). \u0421\u043e\u0441\u0442\u043e\u044f\u043d\u0438\u0435 \u044d\u043a\u0441\u043f\u0435\u0440\u0438\u043c\u0435\u043d\u0442\u0430\u043b\u044c\u043d\u044b\u0445 \u0436\u0438\u0432\u043e\u0442\u043d\u044b\u0445, \u0432\u044b\u0436\u0438\u0432\u0448\u0438\u0445 \u043f\u043e\u0441\u043b\u0435 \u043b\u0435\u0442\u0430\u043b\u044c\u043d\u044b\u0445 \u0434\u043e\u0437 \u03b3-\u0440\u0430\u0434\u0438\u0430\u0446\u0438\u0438 \u0432 \u043e\u0442\u0434\u0430\u043b\u0435\u043d\u043d\u044b\u0435 \u0441\u0440\u043e\u043a\u0438 \u043f\u043e- \u0441\u043b\u0435 \u043f\u0440\u043e\u0432\u0435\u0434\u0435\u043d\u043d\u043e\u0433\u043e \u043e\u0431\u043b\u0443\u0447\u0435\u043d\u0438\u044f, \u0441\u0432\u0438\u0434\u0435\u0442\u0435\u043b\u044c\u0441\u0442\u0432\u043e\u0432\u0430\u043b\u043e \u043e \u0437\u043d\u0430\u0447\u0438- \u0442\u0435\u043b\u044c\u043d\u044b\u0445 \u043d\u0430\u0440\u0443\u0448\u0435\u043d\u0438\u044f\u0445 \u0432 \u043a\u043b\u0435\u0442\u043a\u0430\u0445, \u0444\u043e\u0440\u043c\u0438\u0440\u0443\u044e\u0449\u0438\u0445 \u043a\u043e\u0436\u043d\u044b\u0439 \u043f\u043e\u043a\u0440\u043e\u0432 \u043c\u044b\u0448\u0435\u0439. \u0412 \u0442\u0435\u0447\u0435\u043d\u0438\u0435 50\u2013150 \u0434\u043d\u0435\u0439 \u043f\u043e\u0441\u043b\u0435 \u043e\u0431\u0440\u0430\u0431\u043e\u0442\u043a\u0438 \u043c\u044b\u0448\u0438 \u043f\u0440\u043e\u0433\u0440\u0435\u0441\u0441\u0438\u0432\u043d\u043e \u0441\u0435\u0434\u0435\u043b\u0438 (\u0440\u0438\u0441. 1, \u0430). \u0410\u043d\u0430\u043b\u0438\u0437 \u0440\u0430\u0437\u0432\u0438\u0442\u0438\u044f \u0441\u0435\u043b\u0435\u0437\u0435\u043d\u043e\u0447\u043d\u044b\u0445 \u043a\u043e\u043b\u043e\u043d\u0438\u0439 \u043f\u043e\u0441\u043b\u0435 \u043e\u0431\u043b\u0443\u0447\u0435\u043d\u0438\u044f, \u043f\u0440\u043e\u0432\u0435\u0434\u0435\u043d\u043d\u043e\u0433\u043e \u043d\u0430 9\u201312-\u0435 \u0441\u0443\u0442\u043a\u0438 \u043f\u043e\u0441\u043b\u0435 \u0432\u043e\u0437\u0434\u0435\u0439\u0441\u0442\u0432\u0438\u044f, \u043f\u0440\u0435\u0434\u043f\u043e\u043b\u0430\u0433\u0430\u043b, \u0447\u0442\u043e \u0433\u043b\u0430\u0432\u043d\u043e\u0439 \u043c\u0438\u0448\u0435\u043d\u044c\u044e \u0432\u043e\u0437\u0434\u0435\u0439\u0441\u0442\u0432\u0438\u044f \u043f\u0440\u0435\u043f\u0430\u0440\u0430\u0442\u0430 \u0420\u041d\u041a \u044f\u0432\u043b\u044f\u043b\u0438\u0441\u044c \u0441\u0442\u0432\u043e\u043b\u043e\u0432\u044b\u0435 \u043a\u043b\u0435\u0442\u043a\u0438 \u043a\u0440\u043e\u0432\u0438 \u043a\u043e\u0441\u0442\u043d\u043e\u0433\u043e \u043c\u043e\u0437\u0433\u0430 (\u0441\u043c. \u0440\u0438\u0441. 1, \u0431 ). \u0421\u043f\u0430\u0441\u0435\u043d\u043d\u044b\u0435 \u043e\u0442 \u0440\u0430\u0437\u0440\u0443\u0448\u0435\u043d\u0438\u044f \u0438\u043e\u043d\u0438\u0437\u0438\u0440\u0443\u044e\u0449\u0438\u043c \u043e\u0431\u043b\u0443\u0447\u0435\u043d\u0438\u0435\u043c \u0433\u0435\u043c\u043e\u043f\u043e\u044d\u0442\u0438\u0447\u0435\u0441\u043a\u0438\u0435 \u043f\u0440\u0435\u0434\u0448\u0435\u0441\u0442\u0432\u0435\u043d\u043d\u0438\u043a\u0438 \u0441\u043f\u043e\u0441\u043e\u0431\u043d\u044b \u0432\u044b\u0445\u043e\u0434\u0438\u0442\u044c \u043d\u0430 \u043f\u0435\u0440\u0438\u0444\u0435\u0440\u0438\u044e \u0438 \u0437\u0430\u043f\u043e\u043b\u043d\u044f\u0442\u044c \u043e\u043f\u0443\u0441\u0442\u043e\u0448\u0435\u043d\u043d\u044b\u0435 \u0432\u0441\u043b\u0435\u0434\u0441\u0442\u0432\u0438\u0435 \u043e\u0431\u0440\u0430\u0431\u043e\u0442\u043a\u0438 \u0440\u0430\u0434\u0438\u0430- \u0446\u0438\u0435\u0439 \u0438\u043c\u043c\u0443\u043d\u043e\u043a\u043e\u043c\u043f\u0435\u0442\u0435\u043d\u0442\u043d\u044b\u0435 \u043e\u0440\u0433\u0430\u043d\u044b, \u043d\u0430\u043f\u0440\u0438\u043c\u0435\u0440 \u0441\u0435\u043b\u0435\u0437\u0435\u043d\u043a\u0443. \u0412 \u0440\u0435\u0437\u0443\u043b\u044c\u0442\u0430\u0442\u0435 \u043c\u043e\u0431\u0438\u043b\u0438\u0437\u0430\u0446\u0438\u0438 \u0441\u043f\u0430\u0441\u0435\u043d\u043d\u044b\u0445 \u0441\u0442\u0432\u043e\u043b\u043e\u0432\u044b\u0445 \u043a\u043b\u0435\u0442\u043e\u043a \u043a\u0440\u043e\u0432\u0438 \u0432 \u0431\u0435\u043b\u043e\u0439 \u043f\u0443\u043b\u044c\u043f\u0435 \u0441\u0435\u043b\u0435\u0437\u0435\u043d\u043a\u0438 \u0444\u043e\u0440\u043c\u0438\u0440\u0443\u044e\u0442\u0441\u044f \u0441\u0435\u043b\u0435\u0437\u0435\u043d\u043e\u0447- \u043d\u044b\u0435 \u043a\u043e\u043b\u043e\u043d\u0438\u0438, \u0438\u0437 \u043a\u043e\u0442\u043e\u0440\u044b\u0445 \u0440\u0430\u0437\u0432\u0438\u0432\u0430\u0435\u0442\u0441\u044f \u043d\u043e\u0432\u0430\u044f \u0438\u043c\u043c\u0443\u043d\u043d\u0430\u044f \u0438 \u043a\u0440\u043e\u0432\u0435\u0442\u0432\u043e\u0440\u043d\u0430\u044f \u0441\u0438\u0441\u0442\u0435\u043c\u044b \u043e\u0440\u0433\u0430\u043d\u0438\u0437\u043c\u0430 \u0432\u0437\u0430\u043c\u0435\u043d \u0440\u0430\u0437\u0440\u0443\u0448\u0435\u043d\u043d\u044b\u0445 \u0440\u0430\u0434\u0438\u0430\u0446\u0438\u0435\u0439. Fig. 1. Characterization of the radioprotective effect of RNA after irradiation of mice with the absolute lethal radiation dose 9.4 Gy. a \u2013 phenotypic comparison of CBA mice irradiated one hour after injection of RNA preparation (left and right) and an intact mouse (center) 150 days after irradiation; b \u2013 Spleen colonies detected on days 9\u201312 after irradiation in animals treated with the RNA preparation and in control animals. Arrows indicate leukocyte colonies, which are the criterion for the survival of experimental mice. \u0420\u0430\u0434\u0438\u043e\u0442\u0435\u0440\u0430\u043f\u0435\u0432\u0442\u0438\u0447\u0435\u0441\u043a\u043e\u0435 \u0434\u0435\u0439\u0441\u0442\u0432\u0438\u0435 \u043f\u0440\u0435\u043f\u0430\u0440\u0430\u0442\u0430 \u0441\u0443\u043c\u043c\u0430\u0440\u043d\u043e\u0439 \u0420\u041d\u041a \u0434\u0440\u043e\u0436\u0436\u0435\u0439, \u043e\u0440\u0438\u0435\u043d\u0442\u0438\u0440\u043e\u0432\u0430\u043d\u043d\u043e\u0435 \u043d\u0430 \u0432\u0440\u0435\u043c\u0435\u043d\u043d\u044b\u0435 \u043f\u0430\u0440\u0430\u043c\u0435\u0442\u0440\u044b \u0446\u0438\u043a\u043b\u0430 \u0440\u0435\u043f\u0430\u0440\u0430\u0446\u0438\u0438 \u0414\u0426\u0420 \u0432 \u043a\u043b\u0435\u0442\u043a\u0430\u0445 \u043a\u043e\u0441\u0442\u043d\u043e\u0433\u043e \u043c\u043e\u0437\u0433\u0430 \u043c\u044b\u0448\u0435\u0439, \u0438\u043d\u0434\u0443\u0446\u0438\u0440\u043e\u0432\u0430\u043d\u043d\u044b\u0445 \u0433\u0430\u043c\u043c\u0430 \u0440\u0430\u0434\u0438\u0430\u0446\u0438\u0435\u0439 \u0418\u0437\u0432\u0435\u0441\u0442\u043d\u043e, \u0447\u0442\u043e \u03b3-\u0440\u0430\u0434\u0438\u0430\u0446\u0438\u044f \u0438\u043d\u0434\u0443\u0446\u0438\u0440\u0443\u0435\u0442 \u0440\u0430\u0437\u0440\u0443\u0448\u0435\u043d\u0438\u0435 \u0445\u0440\u043e\u043c\u0430- \u0442\u0438\u043d\u0430 \u0432 \u043a\u043b\u0435\u0442\u043a\u0430\u0445 \u043a\u043e\u0441\u0442\u043d\u043e\u0433\u043e \u043c\u043e\u0437\u0433\u0430 \u0438 \u0432 \u0442\u043e\u043c \u0447\u0438\u0441\u043b\u0435 \u0432 \u0441\u0442\u0432\u043e\u043b\u043e\u0432\u044b\u0445 \u043a\u043b\u0435\u0442\u043a\u0430\u0445 \u043a\u0440\u043e\u0432\u0438, \u0447\u0442\u043e \u0438 \u043f\u0440\u0438\u0432\u043e\u0434\u0438\u0442 \u043a \u0440\u0430\u0437\u0432\u0438\u0442\u0438\u044e \u043b\u0443\u0447\u0435\u0432\u043e\u0439 \u0431\u043e\u043b\u0435\u0437- \u043d\u0438 \u0438 \u0433\u0438\u0431\u0435\u043b\u0438 \u043e\u0440\u0433\u0430\u043d\u0438\u0437\u043c\u0430 (Goodhead, 1994; Belli et al., 2002; Morgan, 2003a, b; Shemetun, Pilinska, 2019). \u041e\u0441\u043d\u043e\u0432\u043d\u044b\u043c \u043f\u043e\u0432\u0440\u0435\u0436\u0434\u0435\u043d\u0438\u0435\u043c \u0445\u0440\u043e\u043c\u043e\u0441\u043e\u043c \u044f\u0432\u043b\u044f\u044e\u0442\u0441\u044f \u0414\u0426\u0420, \u043d\u0435\u043a\u043e\u0440\u0440\u0435\u043a\u0442\u043d\u043e\u0435 \u0432\u043e\u0441\u0441\u0442\u0430\u043d\u043e\u0432\u043b\u0435\u043d\u0438\u0435 \u043a\u043e\u0442\u043e\u0440\u044b\u0445 \u043f\u0440\u0438\u0432\u043e\u0434\u0438\u0442 \u043a \u0430\u0431\u0435\u0440\u0440\u0430\u043d\u0442\u043d\u043e\u043c\u0443 \u043c\u0438\u0442\u043e\u0437\u0443 \u0438 \u0430\u043f\u043e\u043f\u0442\u043e\u0437\u0443. \u0412 \u044d\u0442\u043e\u0439 \u0441\u0432\u044f\u0437\u0438 \u0432 \u043d\u0430\u0447\u0430\u043b\u044c\u043d\u044b\u0445 \u044d\u043a\u0441\u043f\u0435\u0440\u0438\u043c\u0435\u043d\u0442\u0430\u0445 \u0431\u044b\u043b\u0438 \u043e\u0446\u0435\u043d\u0435\u043d\u044b \u0432\u0440\u0435\u043c\u0435\u043d\u043d\u044b\u0435 \u043f\u0430\u0440\u0430\u043c\u0435\u0442\u0440\u044b \u043f\u0440\u043e\u0446\u0435\u0441\u0441\u0430 \u0440\u0435\u043f\u0430\u0440\u0430\u0446\u0438\u0438 \u0414\u0426\u0420, \u0438\u043d\u0434\u0443\u0446\u0438\u0440\u043e\u0432\u0430\u043d\u043d\u044b\u0445 \u03b3-\u043b\u0443\u0447\u0430\u043c\u0438. \u041c\u044b\u0448\u0438 \u043f\u043e\u0434\u0432\u0435\u0440\u0433\u0430\u043b\u0438\u0441\u044c \u0432\u043e\u0437\u0434\u0435\u0439- \u0441\u0442\u0432\u0438\u044e \u043b\u0435\u0442\u0430\u043b\u044c\u043d\u043e\u0439 \u0434\u043e\u0437\u044b \u043e\u0431\u043b\u0443\u0447\u0435\u043d\u0438\u044f 9.4 \u0413\u0440, \u043a\u043b\u0435\u0442\u043a\u0438 \u043a\u043e\u0441\u0442\u043d\u043e\u0433\u043e \u043c\u043e\u0437\u0433\u0430 \u0432\u044b\u043c\u044b\u0432\u0430\u043b\u0438\u0441\u044c \u0447\u0435\u0440\u0435\u0437 30, 60 \u0438 120 \u043c\u0438\u043d \u043f\u043e\u0441\u043b\u0435 \u043e\u0431\u043b\u0443\u0447\u0435\u043d\u0438\u044f. \u041a\u043e\u043b\u0438\u0447\u0435\u0441\u0442\u0432\u043e \u0414\u0426\u0420 \u043e\u0446\u0435\u043d\u0438\u0432\u0430\u043b\u0438 \u00ab\u043c\u0435\u0442\u043e\u0434\u043e\u043c \u043a\u043e\u043c\u0435\u0442\u00bb \u0438\u043b\u0438 \u043f\u043e \u0441\u0432\u0435- \u0447\u0435\u043d\u0438\u044e \u0441\u043f\u0435\u0446\u0438\u0444\u0438\u0447\u0435\u0441\u043a\u0438\u0445 \u0430\u043d\u0442\u0438\u0442\u0435\u043b \u043a \u0433\u0438\u0441\u0442\u043e\u043d\u0443 \u03b3H2AX (Rogakou et al., 1998, 1999; Mar\u00e9chal, Zou, 2013). \u0420\u0435\u0437\u0443\u043b\u044c\u0442\u0430\u0442\u044b \u0438\u0437\u043c\u0435\u0440\u0435\u043d\u0438\u0439 \u0441\u0443\u043c\u043c\u0438\u0440\u043e\u0432\u0430\u043d\u044b \u0432 \u0433\u0440\u0430\u0444\u0438\u043a\u0435 \u043d\u0430 \u0440\u0438\u0441. 2, \u0430. Fig. 2. Analysis of the radioprotective effect of the RNA preparation versus the duration of double-strand break (DSB) repair. a \u2013 the duration of the DSB repair cycle in the bone marrow cells of mice after exposure to the lethal dose of \u03b3-radiation 9.4 Gy. The graph shows the relative number of bone marrow cells in mice in which DSBs are detected; b \u2013 survival graph of experimental animals treated with the RNA preparation at critical points of the repair process, established in the analysis of the repair cycle. Mice were administered 7 mg of RNA 1 hour before irradiation (\u20131 h), 1 hour after irradiation (1 h), or 4 hours after irradiation (4 h), C is the control group, not treated with RNA; c \u2013 histological slides (stained with hematoxylin-eosin) of the spleen of mice on day 11 after irradiation. Control: the spleen is mostly devastated; lymphatic follicles are quite abundant but sharply reduced in size and confined to the peripheral zone of the central artery. \u20131 h \u2013 the major part of the organ parenchyma is occupied by a large aggregate of proliferating lymphocytes. 1 h \u2013 one large focus of lymphocytic proliferation is detected with the general decrease in the numbers of red and white pulp cells. 4 h \u2013 at least half of the section area is occupied by large foci of proliferation of lymphoid elements. \u0423\u0441\u0442\u0430\u043d\u043e\u0432\u043b\u0435\u043d\u043e, \u0447\u0442\u043e \u043e\u0441\u043d\u043e\u0432\u043d\u043e\u0439 \u043f\u0438\u043a \u043d\u0430\u043a\u043e\u043f\u043b\u0435\u043d\u0438\u044f \u0414\u0426\u0420 \u043f\u0440\u0438- \u0445\u043e\u0434\u0438\u0442\u0441\u044f \u043d\u0430 60 \u043c\u0438\u043d \u043e\u0442 \u043f\u043e\u043b\u0443\u0447\u0435\u043d\u0438\u044f \u0434\u043e\u0437\u044b \u0440\u0430\u0434\u0438\u0430\u0446\u0438\u0438 9.4 \u0413\u0440. \u041a 120 \u043c\u0438\u043d \u0438 \u0432 \u0431\u043e\u043b\u0435\u0435 \u043f\u043e\u0437\u0434\u043d\u0438\u0435 \u0441\u0440\u043e\u043a\u0438 \u043d\u0430\u0431\u043b\u044e\u0434\u0430\u0435\u0442\u0441\u044f \u043f\u0440\u0430\u043a\u0442\u0438\u0447\u0435\u0441\u043a\u0438 \u043f\u043e\u043b\u043d\u043e\u0435 \u0432\u043e\u0441\u0441\u0442\u0430\u043d\u043e\u0432\u043b\u0435\u043d\u0438\u0435 \u0446\u0435\u043b\u043e\u0441\u0442\u043d\u043e\u0441\u0442\u0438 \u0445\u0440\u043e\u043c\u0430\u0442\u0438\u043d\u0430, \u0442\u0435\u043c \u043d\u0435 \u043c\u0435\u043d\u0435\u0435 \u043a\u0440\u0438\u0432\u0430\u044f \u043d\u0435 \u043e\u043f\u0443\u0441\u043a\u0430\u0435\u0442\u0441\u044f \u0434\u043e \u0437\u043d\u0430\u0447\u0435\u043d\u0438\u0439, \u043f\u043e\u043b\u0443\u0447\u0435\u043d\u043d\u044b\u0445 \u0434\u043e \u043e\u0431\u043b\u0443\u0447\u0435\u043d\u0438\u044f (\u0434\u0430\u043d\u043d\u044b\u0435 \u043d\u0435 \u043f\u0440\u0438\u0432\u043e\u0434\u044f\u0442\u0441\u044f). \u042d\u0442\u043e\u0442 \u0444\u0430\u043a\u0442 \u043f\u043e\u0437\u0432\u043e\u043b\u044f\u0435\u0442 \u043f\u0440\u0435\u0434\u043f\u043e\u043b\u0430\u0433\u0430\u0442\u044c, \u0447\u0442\u043e \u0432 \u0443\u043a\u0430\u0437\u0430\u043d\u043d\u044b\u0439 \u043e\u0442\u0440\u0435\u0437\u043e\u043a \u0432\u0440\u0435\u043c\u0435\u043d\u0438 \u0434\u0435\u0442\u0435\u043a\u0442\u0438\u0440\u0443\u044e\u0442\u0441\u044f \u0414\u0426\u0420, \u044f\u0432\u043b\u044f\u044e\u0449\u0438\u0435\u0441\u044f \u0438\u043d\u0442\u0435\u0440\u043c\u0435\u0434\u0438\u0430\u0442\u0430\u043c\u0438 \u0440\u0435\u043f\u0430- \u0440\u0430\u0446\u0438\u0438, \u0438\u0434\u0443\u0449\u0435\u0439 \u043f\u043e \u043c\u0435\u0445\u0430\u043d\u0438\u0437\u043c\u0443 \u0433\u043e\u043c\u043e\u043b\u043e\u0433\u0438\u0447\u043d\u043e\u0439 \u0440\u0435\u043a\u043e\u043c\u0431\u0438\u043d\u0430\u0446\u0438\u0438 \u0432 \u043a\u043b\u0435\u0442\u043a\u0430\u0445, \u043d\u0430\u0445\u043e\u0434\u0438\u0432\u0448\u0438\u0445\u0441\u044f \u043d\u0430 \u043c\u043e\u043c\u0435\u043d\u0442 \u043e\u0431\u043b\u0443\u0447\u0435\u043d\u0438\u044f \u0432 \u0444\u0430\u0437\u0435 S \u043a\u043b\u0435\u0442\u043e\u0447\u043d\u043e\u0433\u043e \u0446\u0438\u043a\u043b\u0430. \u041f\u043e \u0440\u0435\u0437\u0443\u043b\u044c\u0442\u0430\u0442\u0430\u043c \u043f\u0440\u043e\u0432\u0435\u0434\u0435\u043d\u043d\u044b\u0445 \u0438\u0441\u0441\u043b\u0435\u0434\u043e- \u0432\u0430\u043d\u0438\u0439 \u0434\u043b\u044f \u043e\u0446\u0435\u043d\u043a\u0438 \u0440\u0430\u0434\u0438\u043e\u0442\u0435\u0440\u0430\u043f\u0435\u0432\u0442\u0438\u0447\u0435\u0441\u043a\u043e\u0433\u043e \u0434\u0435\u0439\u0441\u0442\u0432\u0438\u044f \u043f\u0440\u0435- \u043f\u0430\u0440\u0430\u0442\u0430 \u0420\u041d\u041a \u0431\u044b\u043b\u0438 \u0432\u044b\u0431\u0440\u0430\u043d\u044b \u0432\u0440\u0435\u043c\u0435\u043d\u043d\u044b\u0435 \u0442\u043e\u0447\u043a\u0438 1 \u0438 4 \u0447. \u0418\u0434\u0435\u044f \u0432\u044b\u0431\u043e\u0440\u0430 \u0441\u043e\u0441\u0442\u043e\u044f\u043b\u0430 \u0432 \u0442\u043e\u043c, \u0447\u0442\u043e\u0431\u044b \u0432\u043e\u0437\u0434\u0435\u0439\u0441\u0442\u0432\u043e\u0432\u0430\u0442\u044c \u043d\u0430 \u043a\u043b\u0435\u0442\u043a\u0438 \u043f\u0440\u0435\u043f\u0430\u0440\u0430\u0442\u043e\u043c \u0420\u041d\u041a \u0432\u043e \u0432\u0440\u0435\u043c\u044f \u043d\u0430\u0438\u0431\u043e\u043b\u0435\u0435 \u0438\u043d\u0442\u0435\u043d\u0441\u0438\u0432\u043d\u043e\u0433\u043e \u0445\u043e\u0434\u0430 \u0440\u0435\u043f\u0430\u0440\u0430\u0442\u0438\u0432\u043d\u043e\u0433\u043e \u043f\u0440\u043e\u0446\u0435\u0441\u0441\u0430 \u043f\u043e \u043c\u0435\u0445\u0430\u043d\u0438\u0437\u043c\u0443 \u043d\u0435\u0433\u043e\u043c\u043e\u043b\u043e\u0433\u0438\u0447\u043d\u043e\u0433\u043e \u043e\u0431\u044a\u0435\u0434\u0438\u043d\u0435\u043d\u0438\u044f \u043a\u043e\u043d\u0446\u043e\u0432 \u0432 \u043a\u043b\u0435\u0442\u043a\u0430\u0445, \u043d\u0430\u0445\u043e\u0434\u0438\u0432\u0448\u0438\u0445\u0441\u044f \u0432 \u043c\u043e\u043c\u0435\u043d\u0442 \u043e\u0431\u043b\u0443\u0447\u0435\u043d\u0438\u044f \u0432 \u0444\u0430\u0437\u0435 G1, \u0438 \u0432\u043e \u0432\u0440\u0435\u043c\u044f, \u043a\u043e\u0433\u0434\u0430 \u0432\u043e\u0437\u043c\u043e\u0436\u043d\u043e \u043f\u0440\u043e- \u0434\u043e\u043b\u0436\u0435\u043d\u0438\u0435 \u0440\u0435\u043f\u0430\u0440\u0430\u0446\u0438\u0438 \u043f\u043e \u043c\u0435\u0445\u0430\u043d\u0438\u0437\u043c\u0443 \u0433\u043e\u043c\u043e\u043b\u043e\u0433\u0438\u0447\u043d\u043e\u0439 \u0440\u0435\u043a\u043e\u043c- \u0431\u0438\u043d\u0430\u0446\u0438\u0438 \u0432 \u043a\u043b\u0435\u0442\u043a\u0430\u0445, \u043d\u0430\u0445\u043e\u0434\u0438\u0432\u0448\u0438\u0445\u0441\u044f \u0432 \u043c\u043e\u043c\u0435\u043d\u0442 \u043e\u0431\u043b\u0443\u0447\u0435\u043d\u0438\u044f \u0432 \u0444\u0430\u0437\u0435 S \u043a\u043b\u0435\u0442\u043e\u0447\u043d\u043e\u0433\u043e \u0446\u0438\u043a\u043b\u0430 (\u0441\u043c. \u0440\u0438\u0441. 2, \u0431 ). \u0423\u0441\u0442\u0430\u043d\u043e\u0432\u043b\u0435\u043d\u043e, \u0447\u0442\u043e \u043f\u0440\u0435\u043f\u0430\u0440\u0430\u0442 \u0420\u041d\u041a \u043e\u0431\u043b\u0430\u0434\u0430\u0435\u0442 \u043e\u043f\u0440\u0435\u0434\u0435\u043b\u0435\u043d\u043d\u044b\u043c \u0440\u0430\u0434\u0438\u043e\u0442\u0435\u0440\u0430\u043f\u0435\u0432\u0442\u0438\u0447\u0435- \u0441\u043a\u0438\u043c \u044d\u0444\u0444\u0435\u043a\u0442\u043e\u043c \u043f\u0440\u0438 \u0435\u0433\u043e \u0432\u0432\u0435\u0434\u0435\u043d\u0438\u0438 \u0432 \u043e\u043f\u0440\u0435\u0434\u0435\u043b\u0435\u043d\u043d\u044b\u0439 \u043c\u043e\u043c\u0435\u043d\u0442 \u0432\u0440\u0435\u043c\u0435\u043d\u0438 \u043f\u043e\u0441\u043b\u0435 \u0437\u0430\u0432\u0435\u0440\u0448\u0435\u043d\u0438\u044f \u0440\u0435\u043f\u0430\u0440\u0430\u0442\u0438\u0432\u043d\u043e\u0433\u043e \u043f\u0440\u043e\u0446\u0435\u0441\u0441\u0430 \u043f\u043e \u043c\u0435\u0445\u0430\u043d\u0438\u0437\u043c\u0443 \u043d\u0435\u0433\u043e\u043c\u043e\u043b\u043e\u0433\u0438\u0447\u043d\u043e\u0433\u043e \u043e\u0431\u044a\u0435\u0434\u0438\u043d\u0435\u043d\u0438\u044f \u043a\u043e\u043d\u0446\u043e\u0432. \u0412\u0432\u0435\u0434\u0435\u043d\u0438\u0435 \u043f\u0440\u0435\u043f\u0430\u0440\u0430\u0442\u0430 \u0420\u041d\u041a \u0432\u043e \u0432\u0440\u0435\u043c\u044f \u0438\u0434\u0443\u0449\u0435\u0439 \u0440\u0435\u043f\u0430\u0440\u0430\u0446\u0438\u0438 \u043d\u0435\u0433\u043e\u043c\u043e- \u043b\u043e\u0433\u0438\u0447\u043d\u043e\u0433\u043e \u043e\u0431\u044a\u0435\u0434\u0438\u043d\u0435\u043d\u0438\u044f \u043a\u043e\u043d\u0446\u043e\u0432 \u043f\u0440\u0438\u0432\u043e\u0434\u0438\u0442 \u043a \u0433\u0438\u0431\u0435\u043b\u0438 \u043c\u044b\u0448\u0435\u0439 \u044d\u043a\u0441\u043f\u0435\u0440\u0438\u043c\u0435\u043d\u0442\u0430\u043b\u044c\u043d\u043e\u0439 \u0433\u0440\u0443\u043f\u043f\u044b \u0432 \u0441\u0442\u0430\u043d\u0434\u0430\u0440\u0442\u043d\u044b\u0435 \u0432\u0440\u0435\u043c\u0435\u043d\u043d\u044b\u0435 \u043f\u0430\u0440\u0430\u043c\u0435\u0442\u0440\u044b, \u043f\u043e\u043a\u0430\u0437\u0430\u043d\u043d\u044b\u0435 \u0434\u043b\u044f \u043a\u043e\u043d\u0442\u0440\u043e\u043b\u044f (11\u201314-\u0435 \u0441\u0443\u0442\u043a\u0438 \u043f\u043e\u0441\u043b\u0435 \u043e\u0431\u0440\u0430\u0431\u043e\u0442\u043a\u0438 \u0440\u0430\u0434\u0438\u0430\u0446\u0438\u0435\u0439). \u041f\u0430\u0440\u0430\u043b\u043b\u0435\u043b\u044c\u043d\u043e \u0431\u044b\u043b \u043f\u0440\u043e\u0432\u0435\u0434\u0435\u043d \u043f\u0430\u0442\u043e\u043c\u043e\u0440\u0444\u043e\u043b\u043e\u0433\u0438\u0447\u0435\u0441\u043a\u0438\u0439 \u0430\u043d\u0430- \u043b\u0438\u0437 \u0441\u0435\u043b\u0435\u0437\u0435\u043d\u043e\u043a \u043a\u043e\u043d\u0442\u0440\u043e\u043b\u044c\u043d\u044b\u0445 \u0438 \u044d\u043a\u0441\u043f\u0435\u0440\u0438\u043c\u0435\u043d\u0442\u0430\u043b\u044c\u043d\u044b\u0445 \u043c\u044b\u0448\u0435\u0439 (\u0441\u043c. \u0440\u0438\u0441. 2, \u0432). \u041a\u0430\u043a \u043f\u043e\u043a\u0430\u0437\u0430\u043b\u0438 \u0431\u043e\u043b\u0435\u0435 \u0440\u0430\u043d\u043d\u0438\u0435 \u044d\u043a\u0441\u043f\u0435\u0440\u0438\u043c\u0435\u043d\u0442\u044b, \u043e\u0441\u043d\u043e\u0432\u043d\u043e\u0435 \u0434\u0435\u0439\u0441\u0442\u0432\u0438\u0435 \u043f\u0440\u0435\u043f\u0430\u0440\u0430\u0442 \u0420\u041d\u041a \u043e\u043a\u0430\u0437\u044b\u0432\u0430\u0435\u0442 \u043d\u0430 \u0441\u0442\u0432\u043e\u043b\u043e\u0432\u044b\u0435 \u043a\u043b\u0435\u0442\u043a\u0438 \u043a\u0440\u043e\u0432\u0438, \u043a\u043e\u0442\u043e\u0440\u044b\u0435, \u043f\u0435\u0440\u0435\u0436\u0438\u0432 \u0440\u0430\u0434\u0438\u0430\u0446\u0438\u044e, \u043c\u0438\u0433\u0440\u0438\u0440\u0443\u044e\u0442 \u0432 \u0441\u0435\u043b\u0435\u0437\u0435\u043d\u043a\u0443, \u0433\u0434\u0435 \u0444\u043e\u0440\u043c\u0438\u0440\u0443\u044e\u0442 \u0441\u0435\u043b\u0435\u0437\u0435\u043d\u043e\u0447\u043d\u044b\u0435 \u043a\u043e\u043b\u043e\u043d\u0438\u0438. \u041f\u0440\u0435\u0434- \u043f\u043e\u043b\u0430\u0433\u0430\u043b\u043e\u0441\u044c, \u0447\u0442\u043e \u0432 \u0441\u0435\u043b\u0435\u0437\u0435\u043d\u043a\u0430\u0445 \u043c\u044b\u0448\u0435\u0439, \u0432\u0445\u043e\u0434\u044f\u0449\u0438\u0445 \u0432 \u0433\u0440\u0443\u043f\u043f\u044b \u0441 \u0432\u044b\u0441\u043e\u043a\u043e\u0439 \u0434\u043e\u043b\u0435\u0439 \u0432\u044b\u0436\u0438\u0432\u0430\u0435\u043c\u043e\u0441\u0442\u0438, \u0431\u0443\u0434\u0443\u0442 \u043e\u0431\u043d\u0430\u0440\u0443\u0436\u0435\u043d\u044b \u0446\u0435\u043d\u0442\u0440\u044b \u0440\u0430\u0437\u043c\u043d\u043e\u0436\u0435\u043d\u0438\u044f \u043b\u0438\u043c\u0444\u043e\u0446\u0438\u0442\u043e\u0432, \u043f\u043e\u0442\u043e\u043c\u043a\u043e\u0432 \u0432\u044b\u0436\u0438\u0432\u0448\u0438\u0445 \u0438 \u043c\u0438\u0433\u0440\u0438- \u0440\u043e\u0432\u0430\u0432\u0448\u0438\u0445 \u0432 \u0441\u0435\u043b\u0435\u0437\u0435\u043d\u043a\u0443 \u0441\u0442\u0432\u043e\u043b\u043e\u0432\u044b\u0445 \u043a\u043b\u0435\u0442\u043e\u043a \u043a\u0440\u043e\u0432\u0438. \u041f\u0430\u0442\u043e\u043c\u043e\u0440\u0444\u043e\u043b\u043e\u0433\u0438\u0447\u0435\u0441\u043a\u0438\u0439 \u0430\u043d\u0430\u043b\u0438\u0437 \u0441\u0432\u0438\u0434\u0435\u0442\u0435\u043b\u044c\u0441\u0442\u0432\u0443\u0435\u0442 \u043e \u0441\u043b\u0435\u0434\u0443\u044e\u0449\u0435\u043c. \u0412 \u0441\u0435\u043b\u0435\u0437\u0435\u043d\u043a\u0430\u0445 \u043c\u044b\u0448\u0435\u0439 \u043a\u043e\u043d\u0442\u0440\u043e\u043b\u044c\u043d\u043e\u0439 \u0433\u0440\u0443\u043f\u043f\u044b \u043b\u0438\u043c\u0444\u0430\u0442\u0438\u0447\u0435\u0441\u043a\u0438\u0435 \u0444\u043e\u043b\u043b\u0438\u043a\u0443\u043b\u044b \u0434\u043e\u0441\u0442\u0430\u0442\u043e\u0447\u043d\u043e \u043c\u043d\u043e\u0433\u043e\u0447\u0438\u0441\u043b\u0435\u043d\u043d\u044b\u0435, \u043e\u0434\u043d\u0430\u043a\u043e \u0440\u0435\u0437\u043a\u043e \u0441\u043e\u043a\u0440\u0430\u0449\u0435\u043d\u044b \u0432 \u0440\u0430\u0437\u043c\u0435\u0440\u0430\u0445 \u0434\u043e \u043f\u0435\u0440\u0438\u0444\u0435\u0440\u0438\u0447\u0435\u0441\u043a\u043e\u0439 \u0437\u043e\u043d\u044b \u0444\u043e\u043b\u043b\u0438\u043a\u0443\u043b\u044f\u0440\u043d\u043e\u0439 (\u0446\u0435\u043d\u0442\u0440\u0430\u043b\u044c\u043d\u043e\u0439) \u0430\u0440\u0442\u0435\u0440\u0438\u0438. \u0423 \u043c\u044b\u0448\u0435\u0439, \u043a\u043e\u0442\u043e\u0440\u044b\u043c \u0432\u0432\u0435\u043b\u0438 \u043f\u0440\u0435\u043f\u0430\u0440\u0430\u0442 \u0420\u041d\u041a \u0437\u0430 \u0447\u0430\u0441 \u0434\u043e \u043e\u0431\u043b\u0443\u0447\u0435\u043d\u0438\u044f (\u0433\u0440\u0443\u043f- \u043f\u0430 \u00ab\u20131 \u0447\u00bb), \u0431\u043e\u043b\u044c\u0448\u0430\u044f \u0447\u0430\u0441\u0442\u044c \u043f\u0430\u0440\u0435\u043d\u0445\u0438\u043c\u044b \u0437\u0430\u043d\u044f\u0442\u0430 \u0441\u043f\u043b\u043e\u0448\u043d\u043e\u0439 \u043c\u0430\u0441\u0441\u043e\u0439 \u043f\u0440\u043e\u043b\u0438\u0444\u0435\u0440\u0438\u0440\u0443\u044e\u0449\u0438\u0445 \u043b\u0438\u043c\u0444\u043e\u0446\u0438\u0442\u043e\u0432. \u0423 \u0433\u0440\u0443\u043f\u043f\u044b \u00ab1 \u0447\u00bb, \u043a\u043e\u0442\u043e\u0440\u043e\u0439 \u043f\u0440\u0435\u043f\u0430\u0440\u0430\u0442 \u0420\u041d\u041a \u0432\u0432\u0435\u043b\u0438 \u0447\u0435\u0440\u0435\u0437 \u0447\u0430\u0441 \u043f\u043e\u0441\u043b\u0435 \u043e\u0431\u043b\u0443\u0447\u0435\u043d\u0438\u044f, \u043e\u0431\u043d\u0430\u0440\u0443\u0436\u0438\u0432\u0430\u0435\u0442\u0441\u044f \u043e\u0434\u0438\u043d \u043a\u0440\u0443\u043f\u043d\u044b\u0439 \u043e\u0447\u0430\u0433 \u043f\u0440\u043e\u043b\u0438\u0444\u0435\u0440\u0430\u0446\u0438\u0438 \u043b\u0438\u043c- \u0444\u043e\u0446\u0438\u0442\u043e\u0432, \u0437\u0430\u043d\u0438\u043c\u0430\u044e\u0449\u0438\u0439 \u043c\u0435\u043d\u0435\u0435 1/10 \u043e\u0431\u044a\u0435\u043c\u0430 \u043f\u0430\u0440\u0435\u043d\u0445\u0438\u043c\u044b. \u0423 \u0433\u0440\u0443\u043f\u043f\u044b \u00ab4 \u0447\u00bb, \u043f\u043e\u043b\u0443\u0447\u0438\u0432\u0448\u0435\u0439 \u043f\u0440\u0435\u043f\u0430\u0440\u0430\u0442 \u0420\u041d\u041a \u0447\u0435\u0440\u0435\u0437 4 \u0447 \u043f\u043e\u0441\u043b\u0435 \u043e\u0431\u043b\u0443\u0447\u0435\u043d\u0438\u044f, \u043f\u043e \u043c\u0435\u043d\u044c\u0448\u0435\u0439 \u043c\u0435\u0440\u0435 \u043f\u043e\u043b\u043e\u0432\u0438\u043d\u0443 \u043e\u0431\u044a\u0435\u043c\u0430 \u0441\u0442\u0440\u043e\u043c\u044b \u0437\u0430\u043d\u0438\u043c\u0430\u044e\u0442 \u043a\u0440\u0443\u043f\u043d\u044b\u0435 \u043e\u0447\u0430\u0433\u0438 \u043f\u0440\u043e\u043b\u0438\u0444\u0435\u0440\u0430\u0446\u0438\u0438 \u043b\u0438\u043c\u0444\u043e\u0438\u0434\u043d\u044b\u0445 \u044d\u043b\u0435\u043c\u0435\u043d\u0442\u043e\u0432. \u041f\u043e\u043b\u0443\u0447\u0435\u043d\u043d\u044b\u0439 \u0440\u0435\u0437\u0443\u043b\u044c\u0442\u0430\u0442 \u0433\u043e\u0432\u043e\u0440\u0438\u0442 \u043e\u0431 \u0430\u043a\u0442\u0438\u0432\u043d\u043e\u0439 \u043f\u0440\u043e\u043b\u0438\u0444\u0435\u0440\u0430\u0446\u0438\u0438 \u043a\u043b\u0435\u0442\u043e\u0447\u043d\u044b\u0445 \u044d\u043b\u0435\u043c\u0435\u043d\u0442\u043e\u0432 \u0432 \u043f\u0430\u0440\u0435\u043d\u0445\u0438\u043c\u0435 \u0441\u0435\u043b\u0435\u0437\u0435\u043d\u043e\u043a \u043c\u044b\u0448\u0435\u0439, \u043e\u0431\u0440\u0430\u0431\u043e\u0442\u0430\u043d\u043d\u044b\u0445 \u0434\u043e \u043e\u0431\u043b\u0443\u0447\u0435\u043d\u0438\u044f \u0438 \u0447\u0435\u0440\u0435\u0437 4 \u0447 \u043f\u043e\u0441\u043b\u0435 \u044d\u043a\u0441- \u043f\u043e\u0437\u0438\u0446\u0438\u0438 \u043a \u03b3-\u043b\u0443\u0447\u0430\u043c. \u0421\u0440\u0430\u0432\u043d\u0435\u043d\u0438\u0435 \u044d\u0444\u0444\u0435\u043a\u0442\u0438\u0432\u043d\u043e\u0441\u0442\u0438 \u0440\u0430\u0434\u0438\u043e\u043f\u0440\u043e\u0442\u0435\u043a\u0442\u043e\u0440\u043d\u043e\u0433\u043e \u0434\u0435\u0439\u0441\u0442\u0432\u0438\u044f \u043f\u0440\u0435\u043f\u0430\u0440\u0430\u0442\u0430 \u0441\u0443\u043c\u043c\u0430\u0440\u043d\u043e\u0439 \u0420\u041d\u041a \u0434\u0440\u043e\u0436\u0436\u0435\u0439 \u0438 \u0448\u0442\u0430\u0442\u043d\u043e\u0433\u043e \u0440\u0430\u0434\u0438\u043e\u043f\u0440\u043e\u0442\u0435\u043a\u0442\u043e\u0440\u0430 \u0411-190 \u041f\u0440\u0438 \u0441\u0440\u0430\u0432\u043d\u0435\u043d\u0438\u0438 \u044d\u0444\u0444\u0435\u043a\u0442\u0438\u0432\u043d\u043e\u0441\u0442\u0438 \u0440\u0430\u0434\u0438\u043e\u0437\u0430\u0449\u0438\u0442\u043d\u043e\u0433\u043e \u0434\u0435\u0439\u0441\u0442\u0432\u0438\u044f \u0440\u0430\u0434\u0438\u043e\u043f\u0440\u043e\u0442\u0435\u043a\u0442\u043e\u0440\u0430 \u0411-190 \u0438 \u043f\u0440\u0435\u043f\u0430\u0440\u0430\u0442\u0430 \u0420\u041d\u041a \u0432 \u043e\u0434\u043d\u043e\u043c \u044d\u043a\u0441\u043f\u0435- \u0440\u0438\u043c\u0435\u043d\u0442\u0435 (\u0440\u0438\u0441. 3, \u0430) \u0443\u0441\u0442\u0430\u043d\u043e\u0432\u043b\u0435\u043d\u043e, \u0447\u0442\u043e \u043f\u0440\u0435\u043f\u0430\u0440\u0430\u0442 \u0441\u0443\u043c\u043c\u0430\u0440\u043d\u043e\u0439 \u0420\u041d\u041a \u043e\u0431\u043b\u0430\u0434\u0430\u0435\u0442 \u044f\u0440\u043a\u043e \u0432\u044b\u0440\u0430\u0436\u0435\u043d\u043d\u044b\u043c \u0440\u0430\u0434\u0438\u043e\u043f\u0440\u043e\u0442\u0435\u043a\u0442\u043e\u0440\u043d\u044b\u043c \u0434\u0435\u0439\u0441\u0442\u0432\u0438\u0435\u043c, \u043d\u0435 \u0443\u0441\u0442\u0443\u043f\u0430\u044e\u0449\u0438\u043c \u043f\u043e \u044d\u0444\u0444\u0435\u043a\u0442\u0438\u0432\u043d\u043e\u0441\u0442\u0438 \u0448\u0442\u0430\u0442\u043d\u043e\u043c\u0443 \u043f\u0440\u0435\u043f\u0430\u0440\u0430\u0442\u0443 \u0411-190. \u0412\u044b\u0436\u0438\u0432\u0430\u0435\u043c\u043e\u0441\u0442\u044c \u043d\u0430 40-\u0435 \u0441\u0443\u0442\u043a\u0438 \u043f\u043e\u0441\u043b\u0435 \u043e\u0431\u043b\u0443- \u0447\u0435\u043d\u0438\u044f \u0434\u043b\u044f \u0433\u0440\u0443\u043f\u043f\u044b \u043c\u044b\u0448\u0435\u0439, \u043f\u043e\u043b\u0443\u0447\u0430\u0432\u0448\u0438\u0445 \u043f\u0440\u0435\u043f\u0430\u0440\u0430\u0442 \u0420\u041d\u041a, \u0441\u043e\u0441\u0442\u0430\u0432\u0438\u043b\u0430 78 %, \u0434\u043b\u044f \u0411-190 \u2013 67 % \u0436\u0438\u0432\u043e\u0442\u043d\u044b\u0445. Fig. 3. Comparison of the radioprotective effects of B-190 and the total RNA preparation. a \u2013 survival of animals after irradiation with a dose of 9.4 Gy. b \u2013 light microscopy. Control: 1 \u2013 The lymphatic follicle is reduced to the size of the periarterial zone, 2 \u2013 numerous siderophages (arrows) against the background of lysed red blood cells, 3 \u2013 aggregate of bacterial cells, 4 \u2013 hematopoietic islet in the red pulp. B-190: 1 \u2013 The spleen parenchyma is densely filled with hematopoietic blast elements, lymphoid follicles are absent, megakaryocytes are present in abundance, 2 \u2013 subcapsular location of the hematopoietic islet, 3 \u2013 accumulation of blast hematopoietic elements under the spleen capsule. RNA: 1 \u2013 Pronounced reduction of white pulp follicles, subcapsular concentration of blast hematopoietic cells in the dense layer along the contour of the left side, 2 \u2013 a large aggregate of blast elements in the central part of the parenchyma, 3 \u2013 a group of megakaryocytes, 4 \u2013 numerous siderophages among blast elements (arrows), 5 \u2013 young lymphopoietic cells. \u0411\u044b\u043b \u043f\u0440\u043e\u0432\u0435\u0434\u0435\u043d \u043f\u0430\u0442\u043e\u043c\u043e\u0440\u0444\u043e\u043b\u043e\u0433\u0438\u0447\u0435\u0441\u043a\u0438\u0439 \u0430\u043d\u0430\u043b\u0438\u0437 \u0441\u0435\u043b\u0435\u0437\u0435\u043d\u043e\u043a \u0438 \u0442\u0440\u0435\u0445 \u043e\u0442\u0434\u0435\u043b\u043e\u0432 \u043a\u0438\u0448\u0435\u0447\u043d\u0438\u043a\u0430 \u043c\u044b\u0448\u0435\u0439, \u0432\u0437\u044f\u0442\u044b\u0445 \u0438\u0437 \u0433\u0440\u0443\u043f\u043f \u0441\u0443\u043c\u043c\u0430\u0440- \u043d\u043e\u0439 \u0420\u041d\u041a \u0438 \u0411-190 (\u0441\u043c. \u0440\u0438\u0441. 3, \u0431 ). \u0422\u043a\u0430\u043d\u0438 \u0438 \u043e\u0440\u0433\u0430\u043d\u044b \u0437\u0430\u0431\u0438\u0440\u0430\u043b\u0438\u0441\u044c \u043d\u0430 11-\u0435 \u0441\u0443\u0442\u043a\u0438 \u043f\u043e\u0441\u043b\u0435 \u043f\u0440\u043e\u0432\u0435\u0434\u0435\u043d\u043d\u043e\u0433\u043e \u043e\u0431\u043b\u0443\u0447\u0435\u043d\u0438\u044f \u0432 \u0430\u0431\u0441\u043e\u043b\u044e\u0442\u043d\u043e \u043b\u0435\u0442\u0430\u043b\u044c\u043d\u043e\u0439 \u0434\u043e\u0437\u0435 9.4 \u0413\u0440. \u0417\u043d\u0430\u0447\u0438\u043c\u044b\u0445 \u043f\u0430\u0442\u043e\u043c\u043e\u0440\u0444\u043e\u043b\u043e\u0433\u0438\u0447\u0435\u0441\u043a\u0438\u0445 \u0438\u0437\u043c\u0435\u043d\u0435\u043d\u0438\u0439 \u0432 \u044d\u043f\u0438\u0442\u0435\u043b\u0438\u0438 \u043a\u0438\u0448\u0435\u0447\u043d\u0438\u043a\u0430 \u044d\u043a\u0441\u043f\u0435\u0440\u0438\u043c\u0435\u043d\u0442\u0430\u043b\u044c\u043d\u044b\u0445 \u043c\u044b\u0448\u0435\u0439 \u043d\u0435 \u043e\u0431\u043d\u0430\u0440\u0443\u0436\u0435\u043d\u043e. \u0412 \u0441\u0435\u043b\u0435\u0437\u0435\u043d\u043a\u0435 \u043c\u044b\u0448\u0435\u0439 \u043a\u043e\u043d\u0442\u0440\u043e\u043b\u044c\u043d\u043e\u0439 \u0433\u0440\u0443\u043f\u043f\u044b \u043d\u0430\u0431\u043b\u044e\u0434\u0430\u043b\u0438\u0441\u044c \u0442\u043e\u043b\u044c\u043a\u043e \u043e\u0442\u0434\u0435\u043b\u044c\u043d\u044b\u0435 \u0431\u043b\u0430\u0441\u0442\u043d\u044b\u0435 \u043a\u043b\u0435\u0442\u043a\u0438, \u043b\u0435\u0436\u0430\u0449\u0438\u0435 \u043d\u0435\u0431\u043e\u043b\u044c\u0448\u0438\u043c\u0438 \u043e\u0441\u0442\u0440\u043e\u0432\u043a\u0430\u043c\u0438 \u0441\u0440\u0435\u0434\u0438 \u0441\u043e\u0445\u0440\u0430\u043d\u0438\u0432\u0448\u0438\u0445\u0441\u044f \u043a\u043b\u0435\u0442\u043e\u043a \u0441\u0442\u0440\u043e\u043c\u044b. \u0423 \u0436\u0438- \u0432\u043e\u0442\u043d\u044b\u0445 \u043e\u0431\u0435\u0438\u0445 \u043e\u043f\u044b\u0442\u043d\u044b\u0445 \u0433\u0440\u0443\u043f\u043f, \u0441\u0443\u043c\u043c\u0430\u0440\u043d\u043e\u0439 \u0420\u041d\u041a \u0438 \u0411-190, \u0432 \u0441\u0435\u043b\u0435\u0437\u0435\u043d\u043a\u0435 \u043e\u0442\u043c\u0435\u0447\u0435\u043d\u043e \u0431\u043e\u043b\u044c\u0448\u043e\u0435 \u043a\u043e\u043b\u0438\u0447\u0435\u0441\u0442\u0432\u043e \u044d\u0440\u0438\u0442\u0440\u043e\u0438\u0434\u043d\u044b\u0445 \u043a\u043b\u0435\u0442\u043e\u043a \u043a\u0430\u043a \u0432 \u043f\u0440\u043e\u0441\u0432\u0435\u0442\u0435 \u0441\u043e\u0441\u0443\u0434\u043e\u0432, \u0442\u0430\u043a \u0438 \u0432 \u043f\u0430\u0440\u0435\u043d\u0445\u0438\u043c\u0435, \u043f\u0440\u0438 \u044d\u0442\u043e\u043c \u0437\u043d\u0430\u0447\u0438\u0442\u0435\u043b\u044c\u043d\u0443\u044e \u0438\u0445 \u0447\u0430\u0441\u0442\u044c \u0441\u043e\u0441\u0442\u0430\u0432\u043b\u044f\u043b\u0438 \u043c\u043e\u043b\u043e\u0434\u044b\u0435 \u043a\u043b\u0435\u0442\u043a\u0438 \u043a\u0440\u043e\u0432\u0435\u0442\u0432\u043e\u0440\u043d\u043e\u0439 \u0442\u043a\u0430\u043d\u0438, \u0440\u0430\u0441\u043f\u043e\u043b\u0430\u0433\u0430\u0432\u0448\u0438\u0435\u0441\u044f \u0432 \u0432\u0438\u0434\u0435 \u0440\u0430\u0437\u043b\u0438\u0447\u043d\u043e\u0433\u043e \u0440\u0430\u0437\u043c\u0435\u0440\u0430 \u043a\u043e\u043b\u043e\u043d\u0438\u0439. \u0422\u0430\u043a\u0438\u043c \u043e\u0431\u0440\u0430\u0437\u043e\u043c, \u0432 \u043e\u043f\u044b\u0442\u043d\u044b\u0445 \u0433\u0440\u0443\u043f\u043f\u0430\u0445 \u0432 \u0441\u0435\u043b\u0435\u0437\u0435\u043d\u043a\u0435 \u043d\u0430\u0431\u043b\u044e\u0434\u0430\u043b\u0430\u0441\u044c \u043a\u0430\u0440\u0442\u0438\u043d\u0430 \u044d\u043a\u0441\u0442\u0440\u0430\u043c\u0435\u0434\u0443\u043b\u043b\u044f\u0440\u043d\u043e\u0433\u043e \u0433\u0435- \u043c\u043e\u043f\u043e\u044d\u0437\u0430 \u0441 \u043e\u0431\u0440\u0430\u0437\u043e\u0432\u0430\u043d\u0438\u0435\u043c \u043a\u043e\u043b\u043e\u043d\u0438\u0439 \u043a\u0440\u043e\u0432\u0435\u0442\u0432\u043e\u0440\u043d\u044b\u0445 \u043a\u043b\u0435\u0442\u043e\u043a, \u0431\u043e\u043b\u044c\u0448\u0438\u043d\u0441\u0442\u0432\u043e \u0438\u0437 \u043a\u043e\u0442\u043e\u0440\u044b\u0445 \u044f\u0432\u043b\u044f\u043b\u0438\u0441\u044c \u043f\u0440\u0435\u0434\u0448\u0435\u0441\u0442\u0432\u0435\u043d\u043d\u0438\u043a\u0430\u043c\u0438 \u044d\u0440\u0438\u0442\u0440\u043e\u043f\u043e\u044d\u0437\u0430. \u0412 \u043e\u0442\u043b\u0438\u0447\u0438\u0435 \u043e\u0442 \u043c\u044b\u0448\u0435\u0439, \u043f\u0440\u043e\u0444\u0438\u043b\u0430\u043a\u0442\u0438\u0447\u0435\u0441\u043a\u0438 \u043f\u043e\u043b\u0443\u0447\u0430\u0432\u0448\u0438\u0445 \u043f\u0440\u0435\u043f\u0430\u0440\u0430\u0442 \u0411-190, \u0432 \u0433\u0440\u0443\u043f\u043f\u0435 \u0436\u0438\u0432\u043e\u0442\u043d\u044b\u0445, \u043f\u0440\u043e\u043b\u0435\u0447\u0435\u043d\u043d\u044b\u0445 \u043f\u0440\u0435- \u043f\u0430\u0440\u0430\u0442\u043e\u043c \u0441\u0443\u043c\u043c\u0430\u0440\u043d\u043e\u0439 \u0420\u041d\u041a, \u043e\u0442\u043c\u0435\u0447\u0435\u043d\u044b \u0432\u044b\u0440\u0430\u0436\u0435\u043d\u043d\u0430\u044f \u043f\u0440\u043e- \u043b\u0438\u0444\u0435\u0440\u0430\u0446\u0438\u044f \u043a\u043b\u0435\u0442\u043e\u043a \u043b\u0438\u043c\u0444\u043e\u0446\u0438\u0442\u0430\u0440\u043d\u043e\u0433\u043e \u0440\u043e\u0441\u0442\u043a\u0430 \u0438 \u043e\u0442\u0434\u0435\u043b\u044c\u043d\u044b\u0435 \u043a\u043b\u0435\u0442\u043a\u0438-\u043f\u0440\u0435\u0434\u0448\u0435\u0441\u0442\u0432\u0435\u043d\u043d\u0438\u043a\u0438 \u0438\u043b\u0438 \u043d\u0435\u0431\u043e\u043b\u044c\u0448\u0438\u0435 \u043a\u043e\u043b\u043e\u043d\u0438\u0438 \u043a\u043b\u0435\u0442\u043e\u043a \u0434\u0440\u0443\u0433\u0438\u0445 \u0440\u043e\u0441\u0442\u043a\u043e\u0432 \u0433\u0435\u043c\u043e\u043f\u043e\u044d\u0437\u0430. \u0412 \u0441\u0435\u043b\u0435\u0437\u0435\u043d\u043a\u0435 \u043c\u044b\u0448\u0435\u0439, \u043f\u043e\u043b\u0443\u0447\u0430\u0432- \u0448\u0438\u0445 \u043f\u0440\u0435\u043f\u0430\u0440\u0430\u0442 \u0441\u0443\u043c\u043c\u0430\u0440\u043d\u043e\u0439 \u0420\u041d\u041a, \u043f\u0440\u0438\u0441\u0443\u0442\u0441\u0442\u0432\u043e\u0432\u0430\u043b\u0438 \u0431\u043b\u0430\u0441\u0442\u043d\u044b\u0435 \u043a\u043b\u0435\u0442\u043a\u0438-\u043f\u0440\u0435\u0434\u0448\u0435\u0441\u0442\u0432\u0435\u043d\u043d\u0438\u043a\u0438 \u043c\u0438\u0435\u043b\u043e- \u0438 \u043b\u0438\u043c\u0444\u043e\u043f\u043e\u044d\u0437\u0430, \u043c\u043d\u043e\u0433\u043e\u0447\u0438\u0441- \u043b\u0435\u043d\u043d\u044b\u0435 \u043c\u0435\u0433\u0430\u043a\u0430\u0440\u0438\u043e\u0446\u0438\u0442\u044b. \u041f\u0440\u0435\u0434\u0448\u0435\u0441\u0442\u0432\u0435\u043d\u043d\u0438\u043a\u0438 \u043b\u0438\u043c\u0444\u043e\u0446\u0438\u0442\u043e\u0432 \u0431\u044b\u043b\u0438 \u043f\u0440\u0435\u043e\u0431\u043b\u0430\u0434\u0430\u044e\u0449\u0438\u043c \u0442\u0438\u043f\u043e\u043c \u043a\u043b\u0435\u0442\u043e\u043a \u0432 \u0431\u043e\u043b\u044c\u0448\u0435\u0439 \u0447\u0430\u0441\u0442\u0438 \u043f\u043e\u043b\u0435\u0439 \u043d\u0430\u0431\u043b\u044e\u0434\u0435\u043d\u0438\u044f \u043f\u0440\u0438 \u0422\u042d\u041c \u0438\u0441\u0441\u043b\u0435\u0434\u043e\u0432\u0430\u043d\u0438\u0438. \u041a\u0440\u043e\u043c\u0435 \u0442\u043e\u0433\u043e, \u0441\u0440\u0435\u0434\u0438 \u043c\u0435\u0437\u0435\u043d\u0445\u0438\u043c\u0430\u043b\u044c\u043d\u044b\u0445 \u043a\u043b\u0435\u0442\u043e\u043a \u0438\u0434\u0435\u043d\u0442\u0438\u0444\u0438\u0446\u0438\u0440\u043e\u0432\u0430\u043d\u044b \u043c\u0435\u043b\u043a\u0438\u0435 \u0433\u0440\u0443\u043f\u043f\u044b \u043a\u043b\u0435\u0442\u043e\u043a-\u043f\u0440\u0435\u0434\u0448\u0435\u0441\u0442\u0432\u0435\u043d\u043d\u0438\u043a\u043e\u0432 \u0433\u0440\u0430\u043d\u0443\u043b\u043e\u043f\u043e\u044d\u0437\u0430. \u041e\u0434\u043d\u043e- \u0432\u0440\u0435\u043c\u0435\u043d\u043d\u043e \u043d\u0430\u0431\u043b\u044e\u0434\u0430\u043b\u0430\u0441\u044c \u0441\u0442\u0438\u043c\u0443\u043b\u044f\u0446\u0438\u044f \u0444\u0430\u0433\u043e\u0446\u0438\u0442\u043e\u0437\u0430 \u043a\u043b\u0435\u0442\u043a\u0430\u043c\u0438 \u0441\u0442\u0440\u043e\u043c\u044b \u0438 \u0443\u0432\u0435\u043b\u0438\u0447\u0435\u043d\u0438\u0435 \u0432\u0430\u0441\u043a\u0443\u043b\u044f\u0440\u0438\u0437\u0430\u0446\u0438\u0438 \u043e\u0440\u0433\u0430\u043d\u0430. \u041f\u043e\u043b\u0443\u0447\u0435\u043d\u043d\u044b\u0435 \u0440\u0435\u0437\u0443\u043b\u044c\u0442\u0430\u0442\u044b \u0432 \u0431\u043e\u043b\u044c\u0448\u0435\u0439 \u043c\u0435\u0440\u0435 \u043f\u0440\u0435\u0434\u043f\u043e\u043b\u0430\u0433\u0430\u044e\u0442, \u0447\u0442\u043e \u0434\u0432\u0430 \u043f\u0440\u0435\u043f\u0430\u0440\u0430\u0442\u0430 \u043e\u0431\u043b\u0430\u0434\u0430\u044e\u0442 \u0440\u0430\u0437\u043b\u0438\u0447\u043d\u044b\u043c\u0438 \u043c\u0435\u0445\u0430\u043d\u0438\u0437\u043c\u0430\u043c\u0438 \u0440\u0430\u0434\u0438\u043e\u0437\u0430\u0449\u0438\u0442\u043d\u043e\u0433\u043e \u0434\u0435\u0439\u0441\u0442\u0432\u0438\u044f. \u0412 \u0441\u043b\u0443\u0447\u0430\u0435 \u0411-190 \u0437\u0430\u0449\u0438\u0449\u0430\u044e\u0442\u0441\u044f \u043a\u043b\u0435\u0442\u043a\u0438 \u044d\u0440\u0438\u0442\u0440\u043e\u0438\u0434\u043d\u043e\u0433\u043e \u0440\u043e\u0441\u0442\u043a\u0430 \u043a\u0440\u043e\u0432\u0435\u0442\u0432\u043e\u0440\u0435\u043d\u0438\u044f. \u0412 \u0441\u043b\u0443\u0447\u0430\u0435 \u043f\u0440\u0435- \u043f\u0430\u0440\u0430\u0442\u0430 \u0420\u041d\u041a \u0438 \u044d\u0440\u0438\u0442\u0440\u043e\u0438\u0434\u043d\u044b\u0439, \u0438 \u043b\u0438\u043c\u0444\u043e\u0438\u0434\u043d\u044b\u0439 \u0440\u043e\u0441\u0442\u043e\u043a \u043a\u0440\u043e- \u0432\u0435\u0442\u0432\u043e\u0440\u0435\u043d\u0438\u044f \u0441\u043e\u0445\u0440\u0430\u043d\u044f\u044e\u0442 \u0441\u0432\u043e\u0439 \u0444\u0443\u043d\u043a\u0446\u0438\u043e\u043d\u0430\u043b\u044c\u043d\u044b\u0439 \u043f\u043e\u0442\u0435\u043d\u0446\u0438\u0430\u043b. \u0420\u0430\u0434\u0438\u043e\u043f\u0440\u043e\u0442\u0435\u043a\u0442\u043e\u0440\u043d\u043e\u0435 \u0434\u0435\u0439\u0441\u0442\u0432\u0438\u0435 \u0434\u0432\u0443\u0445 \u0444\u0440\u0430\u043a\u0446\u0438\u0439 \u0434\u0440\u043e\u0436\u0436\u0435\u0432\u043e\u0439 \u0420\u041d\u041a \u0410\u043d\u0430\u043b\u0438\u0442\u0438\u0447\u0435\u0441\u043a\u043e\u0435 \u0438\u0441\u0441\u043b\u0435\u0434\u043e\u0432\u0430\u043d\u0438\u0435 \u043f\u0440\u0435\u043f\u0430\u0440\u0430\u0442\u0430 \u0441\u0443\u043c\u043c\u0430\u0440\u043d\u043e\u0439 \u0420\u041d\u041a \u0434\u0440\u043e\u0436\u0436\u0435\u0439 \u0441\u0432\u0438\u0434\u0435\u0442\u0435\u043b\u044c\u0441\u0442\u0432\u043e\u0432\u0430\u043b\u043e, \u0447\u0442\u043e \u0432 \u043f\u0440\u0435\u043f\u0430\u0440\u0430\u0442\u0435 \u043f\u0440\u0438\u0441\u0443\u0442\u0441\u0442\u0432\u0443- \u044e\u0442 \u0434\u0432\u0435 \u0447\u0435\u0442\u043a\u043e \u0440\u0430\u0437\u0433\u0440\u0430\u043d\u0438\u0447\u0435\u043d\u043d\u044b\u0435 \u0444\u0440\u0430\u043a\u0446\u0438\u0438, \u043e\u0434\u043d\u0430 \u0438\u0437 \u043a\u043e\u0442\u043e\u0440\u044b\u0445 \u044d\u043b\u044e\u0438\u0440\u0443\u0435\u0442\u0441\u044f \u0441 \u0413\u0410\u041f \u043a\u0430\u043a \u043e\u0434\u043d\u043e\u0446\u0435\u043f\u043e\u0447\u0435\u0447\u043d\u0430\u044f \u0420\u041d\u041a \u043f\u0440\u0438 \u044d\u043b\u044e\u0446\u0438\u0438 0.15 \u041c PBS. \u0412\u0442\u043e\u0440\u0430\u044f \u0444\u0440\u0430\u043a\u0446\u0438\u044f \u044d\u043b\u044e\u0438\u0440\u0443\u0435\u0442\u0441\u044f \u0432 \u0443\u0441\u043b\u043e\u0432\u0438\u044f\u0445, \u0445\u0430\u0440\u0430\u043a\u0442\u0435\u0440\u043d\u044b\u0445 \u0434\u043b\u044f \u0434\u0432\u0443\u0446\u0435\u043f\u043e\u0447\u0435\u0447\u043d\u044b\u0445 \u043d\u0443\u043a\u043b\u0435\u0438\u043d\u043e\u0432\u044b\u0445 \u043a\u0438\u0441\u043b\u043e\u0442, \u043f\u0440\u0438 0.25 \u041c PBS. \u0420\u0430\u0437\u043c\u0435\u0440 \u044d\u043b\u044e\u0438\u0440\u0443\u044e\u0449\u0438\u0445\u0441\u044f \u043d\u0443\u043a\u043b\u0435\u0438\u043d\u043e\u0432\u044b\u0445 \u043a\u0438\u0441\u043b\u043e\u0442 \u043d\u0430\u0445\u043e\u0434\u0438\u043b\u0441\u044f \u0432 \u043f\u0440\u0435\u0434\u0435\u043b\u0430\u0445 50\u2013400 \u043f. \u043d. (\u0440\u0438\u0441. 4, \u0430, \u0431 ). \u041f\u0440\u043e\u0432\u0435\u0434\u0435\u043d\u043d\u044b\u0435 \u044d\u043a\u0441\u043f\u0435\u0440\u0438\u043c\u0435\u043d\u0442\u044b \u043f\u043e \u0440\u0430\u0434\u0438\u043e\u043f\u0440\u043e\u0442\u0435\u043a\u0446\u0438\u0438 \u043e\u0431\u0435\u0438\u0445 \u0444\u0440\u0430\u043a\u0446\u0438\u0439 \u0441\u0432\u0438\u0434\u0435\u0442\u0435\u043b\u044c\u0441\u0442\u0432\u043e\u0432\u0430\u043b\u0438, \u0447\u0442\u043e \u043f\u0440\u0438 \u0440\u0430\u0432\u043d\u044b\u0445 \u043a\u043e\u043b\u0438\u0447\u0435\u0441\u0442\u0432\u0430\u0445 \u0440\u0430\u0434\u0438\u043e\u043f\u0440\u043e\u0442\u0435\u043a\u0442\u043e\u0440\u043d\u044b\u0435 \u0441\u0432\u043e\u0439\u0441\u0442\u0432\u0430 \u0445\u0430\u0440\u0430\u043a\u0442\u0435\u0440\u043d\u044b \u0442\u043e\u043b\u044c\u043a\u043e \u0434\u043b\u044f \u0444\u0440\u0430\u043a- \u0446\u0438\u0438, \u044d\u043b\u044e\u0438\u0440\u0443\u044e\u0449\u0435\u0439\u0441\u044f \u0432 0.25 \u041c PBS. \u041f\u0440\u0438 \u044d\u0442\u043e\u043c \u043a\u043e\u043b\u0438\u0447\u0435\u0441\u0442\u0432\u043e \u0432\u0432\u043e\u0434\u0438\u043c\u043e\u0433\u043e \u043f\u0440\u0435\u043f\u0430\u0440\u0430\u0442\u0430, \u043d\u0435\u043e\u0431\u0445\u043e\u0434\u0438\u043c\u043e\u0435 \u0434\u043b\u044f \u0440\u0430\u0434\u0438\u043e\u043f\u0440\u043e\u0442\u0435\u043a\u0442\u043e\u0440- \u043d\u043e\u0433\u043e \u0434\u0435\u0439\u0441\u0442\u0432\u0438\u044f, \u043c\u043d\u043e\u0433\u043e\u043a\u0440\u0430\u0442\u043d\u043e \u0441\u043e\u043a\u0440\u0430\u0449\u0430\u043b\u043e\u0441\u044c. \u0415\u0441\u043b\u0438 \u0434\u043b\u044f \u0434\u043e- \u0441\u0442\u0438\u0436\u0435\u043d\u0438\u044f 80\u2013100 % \u0440\u0430\u0434\u0438\u043e\u0437\u0430\u0449\u0438\u0442\u043d\u043e\u0433\u043e \u044d\u0444\u0444\u0435\u043a\u0442\u0430 \u0442\u0440\u0435\u0431\u0443\u0435\u0442\u0441\u044f 7\u201310 \u043c\u0433 \u043f\u0440\u0435\u043f\u0430\u0440\u0430\u0442\u0430 \u0420\u041d\u041a \u043d\u0430 \u043c\u044b\u0448\u044c, \u0442\u043e \u043f\u0440\u0438 \u0438\u0441\u043f\u043e\u043b\u044c\u0437\u043e\u0432\u0430\u043d\u0438\u0438 \u0444\u0440\u0430\u043a\u0446\u0438\u0438, \u044d\u043b\u044e\u0438\u0440\u0443\u044e\u0449\u0435\u0439\u0441\u044f \u0432 0.25 \u041c PBS, \u043a\u043e\u043b\u0438\u0447\u0435\u0441\u0442\u0432\u043e \u043f\u0440\u0435- \u043f\u0430\u0440\u0430\u0442\u0430, \u0440\u0430\u0432\u043d\u043e\u0435 160 \u043c\u043a\u0433 \u043d\u0430 \u043c\u044b\u0448\u044c, \u043f\u043e\u043b\u043d\u043e\u0441\u0442\u044c\u044e \u0437\u0430\u0449\u0438\u0449\u0430\u0435\u0442 \u0436\u0438\u0432\u043e\u0442\u043d\u043e\u0435 \u043e\u0442 \u0430\u0431\u0441\u043e\u043b\u044e\u0442\u043d\u043e \u043b\u0435\u0442\u0430\u043b\u044c\u043d\u043e\u0439 \u0434\u043e\u0437\u044b \u03b3-\u043e\u0431\u043b\u0443\u0447\u0435\u043d\u0438\u044f (\u0441\u043c. \u0440\u0438\u0441. 4, \u0432). Fig. 4. Identification of the fraction determining the radioprotective effect of total yeast RNA. a \u2013 Chromatography of total yeast RNA on hydroxyapatite. The graphs show the elution profiles of nucleic acids in 0.15 M and 0.25 M PBS; b \u2013 Electrophoretic analysis of the 0.15 M and 0.25 M nucleic acid fractions in 1% agarose gel, ethidium bromide staining, M, 1-kb molecular weight ladder; c \u2013 Radioprotective effect of the total RNA preparation fraction obtained by elution from hydroxyapatite with 0.25 M PBS. CBA mice were treated with RNA preparations 40 minutes before irradiation; d \u2013 Assessment of DNA content in the preparation of total yeast RNA by the Dische assay. The figure shows the results of the color reaction with various amounts (10\u20135000 \u03bcg) of DNA preparations compared to a nucleic acid preparation obtained by hydrolysis of 80 mg of total yeast RNA. The upper part of the figure shows color images of the samples after the Dische reaction. The lower part of the figure shows the colors of the samples obtained in comparison with colors of the Pantone scale. The reaction buffer was used as reference. \u041e\u0434\u043d\u0438\u043c \u0438\u0437 \u0438\u043d\u0442\u0440\u0438\u0433\u0443\u044e\u0449\u0438\u0445 \u0432\u043e\u043f\u0440\u043e\u0441\u043e\u0432, \u043a\u0430\u0441\u0430\u044e\u0449\u0438\u0445\u0441\u044f \u0444\u0440\u0430\u043a- \u0446\u0438\u0438 \u0434\u0440\u043e\u0436\u0436\u0435\u0432\u043e\u0439 \u0420\u041d\u041a, \u043e\u0431\u043b\u0430\u0434\u0430\u044e\u0449\u0435\u0439 \u0440\u0430\u0434\u0438\u043e\u043f\u0440\u043e\u0442\u0435\u043a\u0442\u043e\u0440\u043d\u044b\u043c \u0434\u0435\u0439\u0441\u0442\u0432\u0438\u0435\u043c \u0438 \u044d\u043b\u044e\u0438\u0440\u0443\u044e\u0449\u0435\u0439\u0441\u044f \u0432 \u0443\u0441\u043b\u043e\u0432\u0438\u044f\u0445, \u0445\u0430\u0440\u0430\u043a\u0442\u0435\u0440\u043d\u044b\u0445 \u0434\u043b\u044f \u0434\u0432\u0443\u0446\u0435\u043f\u043e\u0447\u0435\u0447\u043d\u044b\u0445 \u0441\u0442\u0440\u0443\u043a\u0442\u0443\u0440 \u0414\u041d\u041a \u0438\u043b\u0438 \u0420\u041d\u041a (0.25 \u041c PBS), \u0431\u044b\u043b \u0432\u043e\u043f\u0440\u043e\u0441 \u043e \u0442\u0438\u043f\u0435 \u043d\u0443\u043a\u043b\u0435\u0438\u043d\u043e\u0432\u044b\u0445 \u043a\u0438\u0441\u043b\u043e\u0442 \u044d\u0442\u043e\u0439 \u0444\u0440\u0430\u043a\u0446\u0438\u0438. \u0412 \u044d\u0442\u043e\u0439 \u0441\u0432\u044f\u0437\u0438 \u043d\u0430\u043c\u0438 \u043f\u0440\u043e\u0432\u0435\u0434\u0435\u043d\u044b \u044d\u043a\u0441\u043f\u0435\u0440\u0438\u043c\u0435\u043d\u0442\u044b \u043f\u043e \u0445\u0430\u0440\u0430\u043a\u0442\u0435\u0440\u0438\u0441\u0442\u0438\u043a\u0435 \u043c\u043e\u043b\u0435\u043a\u0443\u043b\u044f\u0440\u043d\u043e\u0433\u043e \u0441\u043e\u0441\u0442\u0430\u0432\u0430 \u0434\u0430\u043d\u043d\u043e\u0439 \u0444\u0440\u0430\u043a\u0446\u0438\u0438 \u0441\u0443\u043c\u043c\u0430\u0440\u043d\u043e\u0439 \u0420\u041d\u041a \u0434\u0440\u043e\u0436\u0436\u0435\u0439. \u0414\u043b\u044f \u0438\u0441\u0441\u043b\u0435\u0434\u043e\u0432\u0430\u043d\u0438\u044f, \u043a\u0430\u043a \u0438 \u0434\u043b\u044f \u044d\u043a\u0441\u043f\u0435\u0440\u0438\u043c\u0435\u043d\u0442\u043e\u0432 \u043f\u043e \u0440\u0430\u0434\u0438\u043e\u043f\u0440\u043e\u0442\u0435\u043a\u0446\u0438\u0438, \u0444\u0440\u0430\u043a\u0446\u0438\u043e\u043d\u0438\u0440\u043e\u0432\u0430\u043d\u0438\u0435 \u043d\u0443\u043a\u043b\u0435\u0438\u043d\u043e\u0432\u044b\u0445 \u043a\u0438\u0441\u043b\u043e\u0442 \u043f\u0440\u0435\u043f\u0430\u0440\u0430\u0442\u0430 \u0434\u0440\u043e\u0436\u0436\u0435\u0432\u043e\u0439 \u0420\u041d\u041a \u043e\u0441\u0443\u0449\u0435\u0441\u0442\u0432\u043b\u044f\u043b\u0438 \u043c\u0435\u0442\u043e\u0434\u043e\u043c \u0430\u0434\u0441\u043e\u0440\u0431- \u0446\u0438\u043e\u043d\u043d\u043e\u0439 \u0445\u0440\u043e\u043c\u0430\u0442\u043e\u0433\u0440\u0430\u0444\u0438\u0438 \u043d\u0430 \u043a\u043e\u043b\u043e\u043d\u043a\u0435 \u0441 \u0413\u0410\u041f. \u041e\u043f\u0440\u0435\u0434\u0435\u043b\u0435\u043d\u043e, \u0447\u0442\u043e \u0432 \u043f\u0440\u0435\u043f\u0430\u0440\u0430\u0442\u0435 \u0441\u0443\u043c\u043c\u0430\u0440\u043d\u043e\u0439 \u0420\u041d\u041a \u043f\u0440\u0438\u0441\u0443\u0442\u0441\u0442\u0432\u0443\u0435\u0442 ~1\u20133 % \u043d\u0443\u043a\u043b\u0435\u0438\u043d\u043e\u0432\u044b\u0445 \u043a\u0438\u0441\u043b\u043e\u0442 \u0432 \u0434\u0432\u0443\u0446\u0435\u043f\u043e\u0447\u0435\u0447\u043d\u043e\u0439 \u0444\u043e\u0440\u043c\u0435. \u0414\u043b\u044f \u043e\u043f\u0440\u0435\u0434\u0435\u043b\u0435\u043d\u0438\u044f \u0442\u0438\u043f\u0430 \u043d\u0443\u043a\u043b\u0435\u0438\u043d\u043e\u0432\u044b\u0445 \u043a\u0438\u0441\u043b\u043e\u0442 \u0444\u0440\u0430\u043a\u0446\u0438\u0439 \u0431\u044b\u043b\u0438 \u0432\u044b\u043f\u043e\u043b\u043d\u0435\u043d\u044b \u0440\u0430\u0437\u043b\u0438\u0447\u043d\u044b\u0435 \u044d\u043a\u0441\u043f\u0435\u0440\u0438\u043c\u0435\u043d\u0442\u044b \u0441 \u0438\u0441\u043f\u043e\u043b\u044c\u0437\u043e\u0432\u0430- \u043d\u0438\u0435\u043c \u043e\u0431\u0440\u0430\u0431\u043e\u0442\u043a\u0438 \u043d\u0443\u043a\u043b\u0435\u0430\u0437\u0430\u043c\u0438 (\u0414\u041d\u041a\u0430\u0437\u0430 I, SI \u043d\u0443\u043a\u043b\u0435\u0430\u0437\u0430) \u043f\u043e\u0441\u043b\u0435 \u0434\u0435\u043d\u0430\u0442\u0443\u0440\u0430\u0446\u0438\u0438 \u0438\u043b\u0438 \u0449\u0435\u043b\u043e\u0447\u044c\u044e, \u0438\u043b\u0438 \u043a\u0438\u043f\u044f\u0447\u0435\u043d\u0438\u0435\u043c, \u0438\u043b\u0438 \u0431\u0435\u0437 \u0442\u0430\u043a\u043e- \u0432\u043e\u0439, \u043a\u043e\u0442\u043e\u0440\u044b\u0435 \u043d\u0435 \u0434\u0430\u043b\u0438 \u043e\u0434\u043d\u043e\u0437\u043d\u0430\u0447\u043d\u043e \u0442\u0440\u0430\u043a\u0442\u0443\u0435\u043c\u044b\u0445 \u0440\u0435\u0437\u0443\u043b\u044c\u0442\u0430\u0442\u043e\u0432. \u0412 \u0440\u0435\u0437\u0443\u043b\u044c\u0442\u0430\u0442\u0435, \u0447\u0442\u043e\u0431\u044b \u0443\u0441\u0442\u0430\u043d\u043e\u0432\u0438\u0442\u044c \u043f\u0440\u0438\u043d\u0430\u0434\u043b\u0435\u0436\u043d\u043e\u0441\u0442\u044c \u0430\u043d\u0430\u043b\u0438- \u0437\u0438\u0440\u0443\u0435\u043c\u043e\u0439 \u0444\u0440\u0430\u043a\u0446\u0438\u0438 \u043a \u0442\u043e\u043c\u0443 \u0438\u043b\u0438 \u0438\u043d\u043e\u043c\u0443 \u0442\u0438\u043f\u0443 \u043d\u0443\u043a\u043b\u0435\u0438\u043d\u043e\u0432\u044b\u0445 \u043a\u0438\u0441\u043b\u043e\u0442, \u0431\u044b\u043b \u0432\u044b\u0431\u0440\u0430\u043d \u043c\u0435\u0442\u043e\u0434 \u0430\u043d\u0430\u043b\u0438\u0437\u0430 \u043d\u0443\u043a\u043b\u0435\u0438\u043d\u043e\u0432\u044b\u0445 \u043a\u0438\u0441\u043b\u043e\u0442 \u0441 \u0438\u0441\u043f\u043e\u043b\u044c\u0437\u043e\u0432\u0430\u043d\u0438\u0435\u043c \u0434\u0438\u0444\u0435\u043d\u0438\u043b\u0430\u043c\u0438\u043d\u0430 \u0438 \u0441\u043f\u0435\u0446\u0438\u0444\u0438\u0447\u0435\u0441\u043a\u043e\u0439 \u0446\u0432\u0435\u0442\u043d\u043e\u0439 \u0440\u0435\u0430\u043a\u0446\u0438\u0438 \u043d\u0430 \u0434\u0435\u0437\u043e\u043a\u0441\u0438\u0440\u0438\u0431\u043e\u0437\u0443. \u041f\u0440\u0435\u0434\u043f\u043e\u043b\u0430\u0433\u0430\u043b\u043e\u0441\u044c, \u0447\u0442\u043e \u0435\u0441\u043b\u0438 \u0432 \u0438\u0441\u0445\u043e\u0434\u043d\u043e\u0439 \u0420\u041d\u041a \u043f\u0440\u0438\u0441\u0443\u0442\u0441\u0442\u0432\u0443\u0435\u0442 ~1\u20133 % \u0434\u0432\u0443\u0446\u0435\u043f\u043e\u0447\u0435\u0447\u043d\u043e\u0439 \u0444\u043e\u0440- \u043c\u044b \u043d\u0443\u043a\u043b\u0435\u0438\u043d\u043e\u0432\u044b\u0445 \u043a\u0438\u0441\u043b\u043e\u0442, \u0442\u043e \u043f\u0440\u0438 \u0432\u044b\u0434\u0435\u043b\u0435\u043d\u0438\u0438 \u0438\u0437 \u0431\u043e\u043b\u044c\u0448\u043e\u0433\u043e \u043a\u043e\u043b\u0438\u0447\u0435\u0441\u0442\u0432\u0430 \u0438\u0441\u0445\u043e\u0434\u043d\u043e\u0433\u043e \u043f\u0440\u0435\u043f\u0430\u0440\u0430\u0442\u0430 \u0420\u041d\u041a (50\u2013100 \u043c\u0433) \u0431\u0443\u0434\u0435\u0442 \u043f\u043e\u043b\u0443\u0447\u0435\u043d\u0430 \u0443\u0432\u0435\u0440\u0435\u043d\u043d\u0430\u044f, \u043e\u0434\u043d\u043e\u0437\u043d\u0430\u0447\u043d\u043e \u0442\u0440\u0430\u043a\u0442\u0443\u0435\u043c\u0430\u044f \u0446\u0432\u0435\u0442\u043d\u0430\u044f \u0440\u0435\u0430\u043a\u0446\u0438\u044f. \u0418\u0441\u0445\u043e\u0434\u043d\u044b\u0439 \u043f\u0440\u0435\u043f\u0430\u0440\u0430\u0442 \u0420\u041d\u041a \u0432 \u043a\u043e\u043b\u0438\u0447\u0435\u0441\u0442\u0432\u0435 80 \u043c\u0433 \u0433\u0438\u0434\u0440\u043e\u043b\u0438\u0437\u043e\u0432\u0430\u043b\u0438 24 \u0447 \u0441\u043b\u0430\u0431\u043e\u0439 \u0449\u0435\u043b\u043e\u0447\u044c\u044e. \u041f\u043e\u0441\u043b\u0435 \u0433\u0438\u0434\u0440\u043e\u043b\u0438\u0437\u0430 \u043f\u0440\u043e\u0432\u043e- \u0434\u0438\u043b\u043e\u0441\u044c \u043e\u0441\u0430\u0436\u0434\u0435\u043d\u0438\u0435 \u043f\u043e\u043b\u0438\u043c\u0435\u0440\u043d\u043e\u0439 \u0444\u043e\u0440\u043c\u044b \u043d\u0443\u043a\u043b\u0435\u0438\u043d\u043e\u0432\u044b\u0445 \u043a\u0438\u0441\u043b\u043e\u0442. \u041f\u043e\u043b\u0443\u0447\u0435\u043d\u043d\u044b\u0435 \u0440\u0435\u0437\u0443\u043b\u044c\u0442\u0430\u0442\u044b \u0441\u0432\u0438\u0434\u0435\u0442\u0435\u043b\u044c\u0441\u0442\u0432\u0443\u044e\u0442, \u0447\u0442\u043e \u0444\u0440\u0430\u043a-\u0446\u0438\u044f \u043f\u0440\u0435\u043f\u0430\u0440\u0430\u0442\u0430 \u0441\u0443\u043c\u043c\u0430\u0440\u043d\u043e\u0439 \u0420\u041d\u041a, \u044d\u043b\u044e\u0438\u0440\u0443\u044e\u0449\u0430\u044f\u0441\u044f \u0432 0.25 \u041c \u0444\u043e\u0441\u0444\u0430\u0442\u043d\u043e\u043c \u0431\u0443\u0444\u0435\u0440\u0435, \u044f\u0432\u043b\u044f\u0435\u0442\u0441\u044f \u0434\u0432\u0443\u0446\u0435\u043f\u043e\u0447\u0435\u0447\u043d\u043e\u0439 \u0444\u043e\u0440\u043c\u043e\u0439 \u0420\u041d\u041a (\u0441\u043c. \u0440\u0438\u0441. 4, \u0433), \u0438, \u0442\u0430\u043a\u0438\u043c \u043e\u0431\u0440\u0430\u0437\u043e\u043c, \u043c\u043e\u0436\u043d\u043e \u043f\u043e\u043b\u0430\u0433\u0430\u0442\u044c, \u0447\u0442\u043e \u0440\u0430\u0434\u0438\u043e\u043f\u0440\u043e\u0442\u0435\u043a\u0442\u043e\u0440\u043d\u044b\u0439 \u044d\u0444\u0444\u0435\u043a\u0442 \u043e\u0431\u0443\u0441\u043b\u043e\u0432\u043b\u0435\u043d \u043c\u043e\u043b\u0435\u043a\u0443\u043b\u0430\u043c\u0438 \u0434\u0432\u0443\u0446\u0435\u043f\u043e\u0447\u0435\u0447\u043d\u043e\u0439 \u0420\u041d\u041a. \u0410\u043d\u0430\u043b\u0438\u0437 \u043d\u0443\u043a\u043b\u0435\u043e\u0442\u0438\u0434\u043d\u044b\u0445 \u043f\u043e\u0441\u043b\u0435\u0434\u043e\u0432\u0430\u0442\u0435\u043b\u044c\u043d\u043e\u0441\u0442\u0435\u0439 \u0444\u0440\u0430\u0433\u043c\u0435\u043d\u0442\u043e\u0432 \u0434\u0432\u0443\u0446\u0435\u043f\u043e\u0447\u0435\u0447\u043d\u043e\u0439 \u0420\u041d\u041a \u0444\u0440\u0430\u043a\u0446\u0438\u0438 0.25 \u041c \u0414\u043b\u044f \u043f\u043e\u043d\u0438\u043c\u0430\u043d\u0438\u044f \u043f\u0440\u043e\u0438\u0441\u0445\u043e\u0436\u0434\u0435\u043d\u0438\u044f \u0420\u041d\u041a \u0444\u0440\u0430\u043a\u0446\u0438\u0438 0.25 \u041c \u0431\u044b\u043b\u043e \u043d\u0435\u043e\u0431\u0445\u043e\u0434\u0438\u043c\u043e \u043e\u043f\u0440\u0435\u0434\u0435\u043b\u0438\u0442\u044c \u043f\u0440\u0438\u043d\u0430\u0434\u043b\u0435\u0436\u043d\u043e\u0441\u0442\u044c \u0441\u043e\u0441\u0442\u0430\u0432\u043b\u044f- \u044e\u0449\u0438\u0445 \u0434\u0432\u0443\u0446\u0435\u043f\u043e\u0447\u0435\u0447\u043d\u044b\u0445 \u0420\u041d\u041a \u0444\u0440\u0430\u0433\u043c\u0435\u043d\u0442\u043e\u0432 \u043a \u0433\u0435\u043d\u0435\u0442\u0438\u0447\u0435\u0441\u043a\u043e\u043c\u0443 \u043b\u043e\u043a\u0443\u0441\u0443 \u0445\u0440\u043e\u043c\u043e\u0441\u043e\u043c \u0434\u0440\u043e\u0436\u0436\u0435\u0439. \u0424\u0440\u0430\u0433\u043c\u0435\u043d\u0442\u044b \u0434\u0432\u0443\u0446\u0435\u043f\u043e\u0447\u0435\u0447\u043d\u043e\u0439 \u0420\u041d\u041a \u0444\u0440\u0430\u043a\u0446\u0438\u0438, \u044d\u043b\u044e\u0438\u0440\u0443\u044e\u0449\u0435\u0439\u0441\u044f 0.25 \u041c PBS, \u043a\u043b\u043e\u043d\u0438\u0440\u043e\u0432\u0430\u043b\u0438 \u0438 \u0441\u0435\u043a\u0432\u0435\u043d\u0438\u0440\u043e\u0432\u0430\u043b\u0438. \u041f\u043e\u0441\u043b\u0435\u0434\u043e\u0432\u0430\u0442\u0435\u043b\u044c\u043d\u043e\u0441\u0442\u0438 \u0431\u044b\u043b\u0438 \u043e\u0431\u044a\u0435\u0434\u0438\u043d\u0435\u043d\u044b \u0432 \u0433\u0440\u0443\u043f\u043f\u044b \u0433\u043e\u043c\u043e\u043b\u043e\u0433\u0438\u0439 (\u0440\u0438\u0441. 5). \u0410\u043d\u0430\u043b\u0438\u0437 \u043f\u043e\u0441\u043b\u0435\u0434\u043e\u0432\u0430\u0442\u0435\u043b\u044c\u043d\u043e\u0441\u0442\u0435\u0439 \u0441\u0435\u043a\u0432\u0435\u043d\u0438\u0440\u043e\u0432\u0430\u043d\u043d\u044b\u0445 \u043a\u043b\u043e\u043d\u043e\u0432 \u0441\u0432\u0438\u0434\u0435\u0442\u0435\u043b\u044c\u0441\u0442\u0432\u0443\u0435\u0442, \u0447\u0442\u043e \u0432 \u043f\u043e\u043f\u0443\u043b\u044f- \u0446\u0438\u0438 \u0432\u044b\u0434\u0435\u043b\u044f\u0435\u043c\u044b\u0445 \u043c\u043e\u043b\u0435\u043a\u0443\u043b \u043f\u0440\u0438\u0441\u0443\u0442\u0441\u0442\u0432\u0443\u044e\u0442 \u0440\u0430\u0437\u043b\u0438\u0447\u043d\u044b\u0435 \u0442\u0438\u043f\u044b \u0420\u041d\u041a, \u043e\u0442\u043d\u043e\u0441\u044f\u0449\u0438\u0435\u0441\u044f \u043a \u0420\u041d\u041a \u0440\u0438\u0431\u043e\u0441\u043e\u043c\u0430\u043b\u044c\u043d\u043e\u0433\u043e \u043a\u043b\u0430\u0441\u0442\u0435\u0440\u0430 \u0438\u043b\u0438 \u043a \u0442\u0440\u0430\u043d\u0441\u043a\u0440\u0438\u043f\u0442\u0430\u043c, \u043a\u043e\u0434\u0438\u0440\u0443\u044e\u0449\u0438\u043c \u0431\u0435\u043b\u043a\u0438, \u0430\u0441\u0441\u043e\u0446\u0438\u0438\u0440\u043e\u0432\u0430\u043d\u043d\u044b\u0435 \u0441 \u0440\u0438\u0431\u043e\u0441\u043e\u043c\u0430\u043c\u0438. \u041f\u0440\u0438\u0432\u0435\u0434\u0435\u043d\u043d\u044b\u0435 \u0434\u0430\u043d\u043d\u044b\u0435 \u043f\u0440\u0435\u0434\u043f\u043e\u043b\u0430\u0433\u0430\u044e\u0442, \u0447\u0442\u043e \u0434\u043b\u044f \u0440\u0430\u0434\u0438\u043e\u0437\u0430\u0449\u0438\u0442\u043d\u043e\u0433\u043e \u0434\u0435\u0439\u0441\u0442\u0432\u0438\u044f \u043d\u0443\u043a\u043b\u0435\u043e\u0442\u0438\u0434\u043d\u044b\u0435 \u043f\u043e\u0441\u043b\u0435\u0434\u043e\u0432\u0430\u0442\u0435\u043b\u044c- \u043d\u043e\u0441\u0442\u0438 \u0444\u0440\u0430\u0433\u043c\u0435\u043d\u0442\u043e\u0432 \u0420\u041d\u041a \u043d\u0435 \u0438\u043c\u0435\u044e\u0442 \u0437\u043d\u0430\u0447\u0435\u043d\u0438\u044f. Fig. 5. Determination of the double-stranded RNA structure. Homology groups and species affiliation of sequences: 1, 4\u20138, 10, 12 \u2013 homology groups or species are not defined; 2, 3 \u2013 S. cerevisiae ribosomal RNA genes RDN25-1 and RDN37-1; 9 \u2013 S. cerevisiae ribosomal RNA genes RDN18-1 and RDN37-1; 11 \u2013 S. cerevisiae TMA22 (YJR014W) gene (ribosome-associated protein). \u0421 \u043f\u043e\u043c\u043e\u0449\u044c\u044e \u043f\u0440\u043e\u0433\u0440\u0430\u043c\u043c\u044b https://eu.idtdna.com/calc/analyzer \u0431\u044b\u043b\u0430 \u043f\u0440\u043e\u0430\u043d\u0430\u043b\u0438\u0437\u0438\u0440\u043e\u0432\u0430\u043d\u0430 \u0432\u043e\u0437\u043c\u043e\u0436\u043d\u043e\u0441\u0442\u044c \u0441\u0435\u043a\u0432\u0435\u043d\u0438- \u0440\u043e\u0432\u0430\u043d\u043d\u044b\u0445 \u0420\u041d\u041a \u043e\u0431\u0440\u0430\u0437\u043e\u0432\u044b\u0432\u0430\u0442\u044c \u0448\u043f\u0438\u043b\u0435\u0447\u043d\u044b\u0435 \u0441\u0442\u0440\u0443\u043a\u0442\u0443\u0440\u044b. \u0414\u043b\u044f \u044d\u0442\u043e\u0433\u043e \u0431\u044b\u043b\u0438 \u0432\u044b\u0431\u0440\u0430\u043d\u044b \u043d\u0430\u0438\u0431\u043e\u043b\u0435\u0435 \u043f\u0440\u043e\u0442\u044f\u0436\u0435\u043d\u043d\u044b\u0435 \u043f\u043e\u0441\u043b\u0435\u0434\u043e\u0432\u0430- \u0442\u0435\u043b\u044c\u043d\u043e\u0441\u0442\u0438 \u0438\u0437 \u043a\u0430\u0436\u0434\u043e\u0439 \u0433\u0440\u0443\u043f\u043f\u044b \u0433\u043e\u043c\u043e\u043b\u043e\u0433\u0438\u0439. \u0412 \u0440\u0435\u0437\u0443\u043b\u044c\u0442\u0430\u0442\u0435 \u043e\u0431\u043d\u0430\u0440\u0443\u0436\u0435\u043d\u043e, \u0447\u0442\u043e \u0432\u0441\u0435 \u043f\u0440\u043e\u0430\u043d\u0430\u043b\u0438\u0437\u0438\u0440\u043e\u0432\u0430\u043d\u043d\u044b\u0435 \u043f\u043e\u0441\u043b\u0435\u0434\u043e\u0432\u0430\u0442\u0435\u043b\u044c- \u043d\u043e\u0441\u0442\u0438 \u043c\u043e\u0433\u0443\u0442 \u0444\u043e\u0440\u043c\u0438\u0440\u043e\u0432\u0430\u0442\u044c \u0448\u043f\u0438\u043b\u0435\u0447\u043d\u044b\u0435 \u0441\u0442\u0440\u0443\u043a\u0442\u0443\u0440\u044b. \u0414\u043b\u044f \u043c\u043d\u043e\u0433\u0438\u0445 \u0432\u0430\u0440\u0438\u0430\u043d\u0442\u043e\u0432 \u044d\u043d\u0435\u0440\u0433\u0438\u044f \u043e\u0431\u0440\u0430\u0437\u043e\u0432\u0430\u043d\u0438\u044f \u0448\u043f\u0438\u043b\u0435\u043a (\u044d\u043d\u0435\u0440\u0433\u0438\u044f \u0413\u0438\u0431\u0431\u0441\u0430) \u0438\u043c\u0435\u0435\u0442 \u0432\u044b\u0441\u043e\u043a\u043e\u0435 \u0437\u043d\u0430\u0447\u0435\u043d\u0438\u0435, \u0447\u0442\u043e \u043f\u0440\u0435\u0434\u043f\u043e\u043b\u0430\u0433\u0430\u0435\u0442 \u043f\u0440\u0435- \u0438\u043c\u0443\u0449\u0435\u0441\u0442\u0432\u0435\u043d\u043d\u043e\u0435 \u0444\u043e\u0440\u043c\u0438\u0440\u043e\u0432\u0430\u043d\u0438\u0435 \u0442\u0430\u043a\u0438\u0445 \u0441\u0442\u0440\u0443\u043a\u0442\u0443\u0440 (\u0434\u0430\u043d\u043d\u044b\u0435 \u043d\u0435 \u043f\u0440\u0438\u0432\u043e\u0434\u044f\u0442\u0441\u044f). \u041e\u0431\u0441\u0443\u0436\u0434\u0435\u043d\u0438\u0435 \u0412 \u043d\u0430\u0448\u0435\u0439 \u0440\u0430\u043d\u043d\u0435\u0439 \u0440\u0430\u0431\u043e\u0442\u0435 (Likhacheva et al., 2007) \u0431\u044b\u043b\u043e \u043f\u043e\u043a\u0430- \u0437\u0430\u043d\u043e, \u0447\u0442\u043e \u0444\u0440\u0430\u0433\u043c\u0435\u043d\u0442\u0438\u0440\u043e\u0432\u0430\u043d\u043d\u0430\u044f \u0414\u041d\u041a (\u043f\u0440\u0435\u043f\u0430\u0440\u0430\u0442 \u00ab\u041f\u0430\u043d\u0430\u0433\u0435\u043d\u00bb, \u041b\u0421\u0420 \u2116 004429/08 \u043e\u0442 09.06.2008, \u0414\u041d\u041a \u043c\u044b\u0448\u0438), \u0432\u0432\u0435\u0434\u0435\u043d\u043d\u0430\u044f \u0432 \u043e\u0440\u0433\u0430\u043d\u0438\u0437\u043c \u0441\u043c\u0435\u0440\u0442\u0435\u043b\u044c\u043d\u043e \u043e\u0431\u043b\u0443\u0447\u0435\u043d\u043d\u044b\u0445 \u043c\u044b\u0448\u0435\u0439, \u043e\u0431\u043b\u0430\u0434\u0430\u0435\u0442 \u0432\u044b\u0440\u0430\u0436\u0435\u043d\u043d\u044b\u043c \u0440\u0430\u0434\u0438\u043e\u043f\u0440\u043e\u0442\u0435\u043a\u0442\u043e\u0440\u043d\u044b\u043c \u0434\u0435\u0439\u0441\u0442\u0432\u0438\u0435\u043c \u2013 \u043f\u0440\u0438 \u041b\u0414100/30 \u0432\u044b\u0436\u0438\u0432\u0430\u0435\u043c\u043e\u0441\u0442\u044c \u0436\u0438\u0432\u043e\u0442\u043d\u044b\u0445 \u0441\u043e\u0441\u0442\u0430\u0432\u043b\u044f\u0435\u0442 70\u201390 %. \u041f\u0440\u0438 \u044d\u0442\u043e\u043c \u0440\u0430\u0434\u0438\u043e\u043f\u0440\u043e\u0442\u0435\u043a\u0442\u043e\u0440\u043d\u044b\u0439 \u044d\u0444\u0444\u0435\u043a\u0442 \u0444\u0440\u0430\u0433\u043c\u0435\u043d\u0442\u043e\u0432 \u0434\u0432\u0443\u0446\u0435\u043f\u043e\u0447\u0435\u0447\u043d\u043e\u0439 \u0414\u041d\u041a \u043a\u043e\u0440\u0440\u0435\u043b\u0438\u0440\u0443\u0435\u0442 \u0441 \u0440\u0430\u0437\u0432\u0438\u0442\u0438\u0435\u043c \u0441\u0435\u043b\u0435\u0437\u0435\u043d\u043e\u0447\u043d\u044b\u0445 \u043a\u043e\u043b\u043e\u043d\u0438\u0439. \u041a\u0440\u043e\u043c\u0435 \u0442\u043e\u0433\u043e, \u043f\u0440\u0438 \u0432\u043d\u0443\u0442\u0440\u0438\u0432\u0435\u043d\u043d\u043e\u043c \u0432\u0432\u0435\u0434\u0435\u043d\u0438\u0438 \u044d\u043a\u0441\u0442\u0440\u0430\u043a\u043b\u0435\u0442\u043e\u0447\u043d\u0430\u044f \u0434\u0432\u0443\u0446\u0435\u043f\u043e\u0447\u0435\u0447\u043d\u0430\u044f \u0414\u041d\u041a \u0434\u043e\u0441\u0442\u0430\u0432\u043b\u044f\u0435\u0442\u0441\u044f \u0432 \u043a\u043b\u0435\u0442\u043a\u0438 \u043a\u043e\u0441\u0442\u043d\u043e\u0433\u043e \u043c\u043e\u0437\u0433\u0430, \u0432 \u0442\u043e\u043c \u0447\u0438\u0441\u043b\u0435 \u0432 CD34+ \u0441\u0442\u0432\u043e\u043b\u043e\u0432\u044b\u0435 \u0433\u0435\u043c\u043e\u043f\u043e\u044d\u0442\u0438\u0447\u0435\u0441\u043a\u0438\u0435 \u043a\u043b\u0435\u0442\u043a\u0438 \u043c\u044b\u0448\u0438, \u0433\u0434\u0435 \u043c\u043e\u0436\u0435\u0442 \u0434\u0435\u043f\u043e\u043d\u0438\u0440\u043e\u0432\u0430\u0442\u044c\u0441\u044f \u0438 \u043e\u0431\u043d\u0430\u0440\u0443\u0436\u0438\u0432\u0430\u0435\u0442\u0441\u044f \u0432 \u0442\u0435\u0447\u0435\u043d\u0438\u0435 14 \u0434\u043d\u0435\u0439 \u043f\u043e\u0441\u043b\u0435 \u0432\u0432\u0435\u0434\u0435\u043d\u0438\u044f (Dolgova et al., 2013a, b). \u0418\u043c\u0435\u043d\u043d\u043e \u044d\u0442\u0438 \u0434\u0432\u0430 \u0444\u0430\u043a\u0442\u0430 \u043b\u0435\u0433\u043b\u0438 \u0432 \u043e\u0441\u043d\u043e\u0432\u0443 \u043f\u0440\u0435\u0434\u043f\u043e\u043b\u043e\u0436\u0435\u043d\u0438\u044f, \u0447\u0442\u043e \u0444\u0440\u0430\u0433\u043c\u0435\u043d\u0442\u044b \u0434\u0432\u0443\u0446\u0435\u043f\u043e\u0447\u0435\u0447\u043d\u043e\u0439 \u0414\u041d\u041a \u0441\u043f\u0430\u0441\u0430\u044e\u0442 \u0441\u0442\u0432\u043e\u043b\u043e\u0432\u044b\u0435 \u0433\u0435\u043c\u043e- \u043f\u043e\u044d\u0442\u0438\u0447\u0435\u0441\u043a\u0438\u0435 \u043a\u043b\u0435\u0442\u043a\u0438, \u043a\u043e\u0442\u043e\u0440\u044b\u0435 \u043c\u0438\u0433\u0440\u0438\u0440\u0443\u044e\u0442 \u043d\u0430 \u043f\u0435\u0440\u0438\u0444\u0435\u0440\u0438\u044e, \u0441\u0442\u0430\u0431\u0438\u043b\u0438\u0437\u0438\u0440\u0443\u044e\u0442\u0441\u044f \u0432 \u0441\u0435\u043b\u0435\u0437\u0435\u043d\u043a\u0435 \u0438 \u0434\u0430\u044e\u0442 \u043d\u0430\u0447\u0430\u043b\u043e \u043d\u043e\u0432\u043e\u0439 \u043a\u0440\u043e- \u0432\u0435\u0442\u0432\u043e\u0440\u043d\u043e\u0439 \u0438 \u0438\u043c\u043c\u0443\u043d\u043d\u043e\u0439 \u0441\u0438\u0441\u0442\u0435\u043c\u0430\u043c \u043c\u044b\u0448\u0438\u043d\u043e\u0433\u043e \u043e\u0440\u0433\u0430\u043d\u0438\u0437\u043c\u0430, \u0440\u0430\u0437\u0440\u0443\u0448\u0435\u043d\u043d\u044b\u043c \u0432\u044b\u0441\u043e\u043a\u043e\u0434\u043e\u0437\u043e\u0432\u043e\u0439 \u03b3-\u0440\u0430\u0434\u0438\u0430\u0446\u0438\u0435\u0439. \u041f\u043e\u0441\u043a\u043e\u043b\u044c\u043a\u0443 \u0431\u044b\u043b\u043e \u043f\u043e\u043a\u0430\u0437\u0430\u043d\u043e, \u0447\u0442\u043e \u0434\u0432\u0443\u0446\u0435\u043f\u043e\u0447\u0435\u0447\u043d\u0430\u044f \u0444\u043e\u0440\u043c\u0430 \u043d\u0443\u043a\u043b\u0435\u0438\u043d\u043e\u0432\u044b\u0445 \u043a\u0438\u0441\u043b\u043e\u0442 (\u0414\u041d\u041a) \u043e\u0442\u0432\u0435\u0447\u0430\u0435\u0442 \u0437\u0430 \u0440\u0430\u0434\u0438\u043e\u043f\u0440\u043e\u0442\u0435\u043a\u0442\u043e\u0440- \u043d\u044b\u0439 \u044d\u0444\u0444\u0435\u043a\u0442, \u0434\u0435\u0442\u0435\u043a\u0442\u0438\u0440\u0443\u0435\u043c\u044b\u0439 \u0432 \u043f\u0440\u043e\u0432\u0435\u0434\u0435\u043d\u043d\u044b\u0445 \u044d\u043a\u0441\u043f\u0435\u0440\u0438\u043c\u0435\u043d- \u0442\u0430\u0445, \u043d\u0430\u043c\u0438 \u0441\u0434\u0435\u043b\u0430\u043d\u043e \u043f\u0440\u0435\u0434\u043f\u043e\u043b\u043e\u0436\u0435\u043d\u0438\u0435, \u0447\u0442\u043e \u0437\u0430 \u0440\u0430\u0434\u0438\u043e\u043f\u0440\u043e\u0442\u0435\u043a\u0442\u043e\u0440\u043d\u044b\u0439 \u044d\u0444\u0444\u0435\u043a\u0442 \u043f\u0440\u0435\u043f\u0430\u0440\u0430\u0442\u0430 \u0441\u0443\u043c\u043c\u0430\u0440\u043d\u043e\u0439 \u0420\u041d\u041a S. \u0441erevisiae \u043e\u0442\u0432\u0435\u0447\u0430\u0435\u0442 \u043f\u0440\u0438\u0441\u0443\u0442\u0441\u0442\u0432\u0443\u044e\u0449\u0430\u044f \u0432 \u043d\u0435\u043c \u0434\u0432\u0443\u0446\u0435\u043f\u043e\u0447\u0435\u0447\u043d\u0430\u044f \u0444\u0440\u0430\u043a\u0446\u0438\u044f \u043d\u0443\u043a- \u043b\u0435\u0438\u043d\u043e\u0432\u044b\u0445 \u043a\u0438\u0441\u043b\u043e\u0442. \u0425\u0440\u043e\u043c\u0430\u0442\u043e\u0433\u0440\u0430\u0444\u0438\u0435\u0439 \u043d\u0430 \u0433\u0438\u0434\u0440\u043e\u043a\u0441\u0438\u0430\u043f\u0430\u0442\u0438\u0442\u0435 \u0431\u044b\u043b\u0430 \u0432\u044b\u0434\u0435\u043b\u0435\u043d\u0430 \u0444\u0440\u0430\u043a\u0446\u0438\u044f \u043f\u0440\u0435\u043f\u0430\u0440\u0430\u0442\u0430 \u0420\u041d\u041a, \u044d\u043b\u044e\u0438\u0440\u0443\u044e\u0449\u0430\u044f\u0441\u044f \u0441 \u043a\u043e\u043b\u043e\u043d\u043a\u0438 \u043a\u0430\u043a \u0434\u0432\u0443\u0446\u0435\u043f\u043e\u0447\u0435\u0447\u043d\u0430\u044f \u0444\u043e\u0440\u043c\u0430 \u043d\u0443\u043a\u043b\u0435\u0438\u043d\u043e\u0432\u044b\u0445 \u043a\u0438\u0441\u043b\u043e\u0442. \u0411\u0438\u043e\u043b\u043e\u0433\u0438\u0447\u0435- \u0441\u043a\u0438\u0435 \u0442\u0435\u0441\u0442\u044b \u043d\u0430 \u0440\u0430\u0434\u0438\u043e\u043f\u0440\u043e\u0442\u0435\u043a\u0442\u043e\u0440\u043d\u044b\u0435 \u0441\u0432\u043e\u0439\u0441\u0442\u0432\u0430 \u044d\u0442\u043e\u0439 \u0444\u0440\u0430\u043a\u0446\u0438\u0438 \u043e\u0434\u043d\u043e\u0437\u043d\u0430\u0447\u043d\u043e \u0441\u0432\u0438\u0434\u0435\u0442\u0435\u043b\u044c\u0441\u0442\u0432\u043e\u0432\u0430\u043b\u0438, \u0447\u0442\u043e \u0437\u0430 \u0440\u0430\u0434\u0438\u043e\u043f\u0440\u043e\u0442\u0435\u043a\u0442\u043e\u0440\u043d\u044b\u0439 \u044d\u0444\u0444\u0435\u043a\u0442 \u043f\u0440\u0435\u043f\u0430\u0440\u0430\u0442\u043e\u0432 \u0420\u041d\u041a \u0434\u0440\u043e\u0436\u0436\u0435\u0439 \u043e\u0442\u0432\u0435\u0447\u0430\u0435\u0442 \u0434\u0432\u0443\u0446\u0435\u043f\u043e\u0447\u0435\u0447\u043d\u0430\u044f \u0444\u043e\u0440\u043c\u0430 \u043d\u0443\u043a\u043b\u0435\u0438\u043d\u043e\u0432\u044b\u0445 \u043a\u0438\u0441\u043b\u043e\u0442, \u0441\u043e\u0441\u0442\u0430\u0432\u043b\u044f\u044e\u0449\u0430\u044f ~1\u20133 % \u043e\u0442 \u0441\u0443\u043c- \u043c\u0430\u0440\u043d\u043e\u0439 \u0420\u041d\u041a \u043f\u0440\u0435\u043f\u0430\u0440\u0430\u0442\u0430, \u043d\u0430\u0445\u043e\u0434\u044f\u0449\u0435\u0433\u043e\u0441\u044f \u0432 \u0440\u0430\u0431\u043e\u0442\u0435. \u041f\u0440\u0438 \u044d\u0442\u043e\u043c \u044d\u0444\u0444\u0435\u043a\u0442\u0438\u0432\u043d\u0430\u044f \u0434\u043e\u0437\u0430 \u041b\u0414100/30 \u0434\u043b\u044f \u0441\u0443\u043c\u043c\u0430\u0440\u043d\u043e\u0433\u043e \u043f\u0440\u0435\u043f\u0430\u0440\u0430\u0442\u0430 \u0441\u043e- \u0441\u0442\u0430\u0432\u043b\u044f\u043b\u0430 7\u201310 \u043c\u0433/\u043c\u044b\u0448\u044c, \u0432 \u0442\u043e \u0432\u0440\u0435\u043c\u044f \u043a\u0430\u043a \u0434\u043b\u044f \u0434\u0432\u0443\u0446\u0435\u043f\u043e\u0447\u0435\u0447\u043d\u043e\u0439 \u0444\u043e\u0440\u043c\u044b \u2013 160 \u043c\u043a\u0433/\u043c\u044b\u0448\u044c, \u0447\u0442\u043e \u0432 ~60 \u0440\u0430\u0437 \u043c\u0435\u043d\u044c\u0448\u0435. \u0412 \u043c\u043d\u043e\u0433\u043e\u043a\u0440\u0430\u0442\u043d\u044b\u0445 \u044d\u043a\u0441\u043f\u0435\u0440\u0438\u043c\u0435\u043d\u0442\u0430\u0445 \u043f\u043e\u043a\u0430\u0437\u0430\u043d\u043e, \u0447\u0442\u043e \u0432\u0432\u0435\u0434\u0435\u043d\u0438\u0435 \u043f\u0440\u0435\u043f\u0430\u0440\u0430\u0442\u0430 \u0434\u0432\u0443\u0446\u0435\u043f\u043e\u0447\u0435\u0447\u043d\u043e\u0439 \u043d\u0443\u043a\u043b\u0435\u0438\u043d\u043e\u0432\u043e\u0439 \u043a\u0438\u0441\u043b\u043e\u0442\u044b \u0437\u0430 60\u201330 \u043c\u0438\u043d \u0434\u043e \u043e\u0431\u043b\u0443\u0447\u0435\u043d\u0438\u044f \u043f\u043e\u043b\u043d\u043e\u0441\u0442\u044c\u044e \u043a\u0443\u043f\u0438\u0440\u0443\u0435\u0442 \u0440\u0430\u0434\u0438\u0430\u0446\u0438\u043e\u043d\u043d\u043e\u0435 \u0434\u0435\u0439\u0441\u0442\u0432\u0438\u0435 \u03b3-\u043f\u043e\u0442\u043e\u043a\u0430. \u0412\u044b\u0436\u0438\u0432\u0430\u0435\u0442 80\u2013100 % \u044d\u043a\u0441\u043f\u0435\u0440\u0438\u043c\u0435\u043d\u0442\u0430\u043b\u044c\u043d\u044b\u0445 \u043c\u044b\u0448\u0435\u0439. \u0421 \u0438\u0441\u043f\u043e\u043b\u044c\u0437\u043e\u0432\u0430\u043d\u0438\u0435\u043c \u043c\u0435\u0442\u043e\u0434\u0430 \u0434\u0438\u0444\u0444\u0435\u0440\u0435\u043d\u0446\u0438\u0440\u043e\u0432\u0430\u043d\u043d\u043e\u0433\u043e \u0433\u0438\u0434\u0440\u043e\u043b\u0438\u0437\u0430 \u0449\u0435\u043b\u043e\u0447\u044c\u044e \u0438 \u043a\u0438\u0441\u043b\u043e\u0442\u043e\u0439 \u0438 \u0441\u043f\u0435\u0446\u0438\u0444\u0438\u0447\u0435\u0441\u043a\u043e\u0433\u043e \u043a\u0430\u0447\u0435\u0441\u0442\u0432\u0435\u043d\u043d\u043e\u0433\u043e \u043e\u043a\u0440\u0430\u0448\u0438\u0432\u0430\u043d\u0438\u044f \u043d\u0430 \u043f\u0440\u0438\u0441\u0443\u0442\u0441\u0442\u0432\u0438\u0435 \u0414\u041d\u041a \u0431\u044b\u043b\u043e \u0443\u0441\u0442\u0430\u043d\u043e\u0432\u043b\u0435\u043d\u043e, \u0447\u0442\u043e \u0434\u0432\u0443\u0446\u0435\u043f\u043e\u0447\u0435\u0447\u043d\u0430\u044f \u0444\u043e\u0440\u043c\u0430, \u0432\u044b\u0434\u0435\u043b\u044f\u0435\u043c\u0430\u044f \u0432 \u0441\u043e\u0441\u0442\u0430\u0432\u0435 \u043f\u0440\u0435\u043f\u0430\u0440\u0430\u0442\u043e\u0432 \u0420\u041d\u041a \u0438 \u043e\u0431\u043b\u0430\u0434\u0430\u044e\u0449\u0430\u044f \u0440\u0430\u0434\u0438\u043e\u043f\u0440\u043e\u0442\u0435\u043a\u0442\u043e\u0440\u043d\u044b\u043c\u0438 \u0441\u0432\u043e\u0439\u0441\u0442\u0432\u0430\u043c\u0438, \u043f\u0440\u0435\u0434\u0441\u0442\u0430\u0432\u043b\u044f\u0435\u0442 \u0441\u043e\u0431\u043e\u0439 \u0434\u0432\u0443\u0446\u0435\u043f\u043e\u0447\u0435\u0447\u043d\u0443\u044e \u0420\u041d\u041a. \u0424\u0440\u0430\u0433\u043c\u0435\u043d\u0442\u044b \u0434\u0432\u0443\u0446\u0435\u043f\u043e\u0447\u0435\u0447\u043d\u043e\u0439 \u0420\u041d\u041a, \u043f\u0435\u0440\u0435\u0432\u0435\u0434\u0435\u043d\u043d\u044b\u0435 \u0432 \u0444\u043e\u0440\u043c\u0443 \u043a\u0414\u041d\u041a, \u0431\u044b\u043b\u0438 \u043a\u043b\u043e\u043d\u0438\u0440\u043e\u0432\u0430\u043d\u044b \u0438 \u0441\u0435\u043a\u0432\u0435\u043d\u0438\u0440\u043e\u0432\u0430\u043d\u044b. \u041e\u043f\u0440\u0435\u0434\u0435\u043b\u0435\u043d\u043e, \u0447\u0442\u043e \u0441\u043c\u0435\u0441\u044c \u0444\u0440\u0430\u0433\u043c\u0435\u043d\u0442\u043e\u0432 \u0434\u0432\u0443\u0446\u0435\u043f\u043e\u0447\u0435\u0447\u043d\u043e\u0439 \u0420\u041d\u041a \u0433\u0435\u0442\u0435\u0440\u043e\u0433\u0435\u043d\u043d\u0430 \u043f\u043e \u043f\u0435\u0440\u0432\u0438\u0447- \u043d\u043e\u0439 \u0441\u0442\u0440\u0443\u043a\u0442\u0443\u0440\u0435 \u0438, \u043f\u043e-\u0432\u0438\u0434\u0438\u043c\u043e\u043c\u0443, \u0434\u043b\u044f \u043e\u0441\u0443\u0449\u0435\u0441\u0442\u0432\u043b\u0435\u043d\u0438\u044f \u0440\u0430\u0434\u0438\u043e- \u043f\u0440\u043e\u0442\u0435\u043a\u0442\u043e\u0440\u043d\u043e\u0433\u043e \u0434\u0435\u0439\u0441\u0442\u0432\u0438\u044f \u043d\u0435 \u0442\u0440\u0435\u0431\u0443\u0435\u0442\u0441\u044f \u0441\u043f\u0435\u0446\u0438\u0444\u0438\u0447\u0435\u0441\u043a\u043e\u0439 \u043f\u043e-\u0441\u043b\u0435\u0434\u043e\u0432\u0430\u0442\u0435\u043b\u044c\u043d\u043e\u0441\u0442\u0438. \u041f\u0440\u0438 \u0430\u043d\u0430\u043b\u0438\u0437\u0435 \u0440\u0430\u0434\u0438\u043e\u0437\u0430\u0449\u0438\u0442\u043d\u043e\u0433\u043e \u0434\u0435\u0439\u0441\u0442\u0432\u0438\u044f \u0434\u0432\u0443\u0446\u0435\u043f\u043e\u0447\u0435\u0447\u043d\u043e\u0439 \u0420\u041d\u041a \u0443\u0441\u0442\u0430\u043d\u043e\u0432\u043b\u0435\u043d\u043e, \u0447\u0442\u043e \u0442\u0430\u043a \u0436\u0435, \u043a\u0430\u043a \u0438 \u0432 \u0441\u043b\u0443\u0447\u0430\u0435 \u0441 \u043f\u0440\u0435\u043f\u0430\u0440\u0430\u0442\u0430\u043c\u0438 \u0434\u0432\u0443\u0446\u0435\u043f\u043e\u0447\u0435\u0447\u043d\u043e\u0439 \u0414\u041d\u041a, \u0432 \u0441\u0435\u043b\u0435\u0437\u0435\u043d\u043a\u0430\u0445 \u044d\u043a\u0441\u043f\u0435\u0440\u0438\u043c\u0435\u043d\u0442\u0430\u043b\u044c\u043d\u044b\u0445 \u0436\u0438\u0432\u043e\u0442\u043d\u044b\u0445 \u0444\u043e\u0440\u043c\u0438\u0440\u0443\u044e\u0442\u0441\u044f \u0441\u0435\u043b\u0435\u0437\u0435\u043d\u043e\u0447\u043d\u044b\u0435 \u043a\u043e\u043b\u043e\u043d\u0438\u0438. \u041a\u043e\u043b\u043e\u043d\u0438\u0438 \u0441\u043e\u0441\u0442\u043e\u044f\u0442 \u0438\u0437 \u043f\u0440\u043e\u043b\u0438\u0444\u0435\u0440\u0438\u0440\u0443\u044e\u0449\u0438\u0445 \u043a\u043b\u0435\u0442\u043e\u0447\u043d\u044b\u0445 \u044d\u043b\u0435\u043c\u0435\u043d\u0442\u043e\u0432, \u043a\u043e\u0442\u043e- \u0440\u044b\u0435, \u043a\u0430\u043a \u043f\u0440\u0435\u0434\u043f\u043e\u043b\u0430\u0433\u0430\u0435\u0442\u0441\u044f, \u043f\u0440\u0435\u0434\u0441\u0442\u0430\u0432\u043b\u044f\u044e\u0442 \u0441\u043e\u0431\u043e\u0439 \u043f\u043e\u0442\u043e\u043c\u043a\u043e\u0432, \u0441\u043f\u0430\u0441\u0435\u043d\u043d\u044b\u0445 \u0441\u0442\u0432\u043e\u043b\u043e\u0432\u044b\u0445 \u0433\u0435\u043c\u043e\u043f\u043e\u044d\u0442\u0438\u0447\u0435\u0441\u043a\u0438\u0445 \u043f\u0440\u0435\u0434\u0448\u0435\u0441\u0442\u0432\u0435\u043d- \u043d\u0438\u043a\u043e\u0432, \u0434\u0430\u044e\u0449\u0438\u0445 \u043d\u0430\u0447\u0430\u043b\u043e \u043d\u043e\u0432\u043e\u0439 \u043a\u0440\u043e\u0432\u0435\u0442\u0432\u043e\u0440\u043d\u043e\u0439 \u0438 \u0438\u043c\u043c\u0443\u043d\u043d\u043e\u0439 \u0441\u0438\u0441\u0442\u0435\u043c\u0435, \u043a\u043e\u0442\u043e\u0440\u044b\u0435 \u0431\u044b\u043b\u0438 \u0440\u0430\u0437\u0440\u0443\u0448\u0435\u043d\u044b \u043e\u0431\u043b\u0443\u0447\u0435\u043d\u0438\u0435\u043c. \u0412\u0432\u0435\u0434\u0435\u043d\u0438\u0435 \u043f\u0440\u0435\u043f\u0430\u0440\u0430\u0442\u0430 \u0432 \u0442\u043e\u0447\u043a\u0443 \u043c\u0430\u043a\u0441\u0438\u043c\u0430\u043b\u044c\u043d\u043e \u0430\u043a\u0442\u0438\u0432\u043d\u043e\u0439 \u0440\u0435\u043f\u0430\u0440\u0430\u0446\u0438\u0438 \u0414\u0426\u0420, \u0438\u0434\u0443\u0449\u0435\u0439 \u043f\u043e \u043c\u0435\u0445\u0430\u043d\u0438\u0437\u043c\u0443 \u043d\u0435\u0433\u043e\u043c\u043e\u043b\u043e\u0433\u0438\u0447\u0435\u0441\u043a\u043e\u0433\u043e \u043e\u0431\u044a\u0435\u0434\u0438\u043d\u0435\u043d\u0438\u044f \u043a\u043e\u043d\u0446\u043e\u0432, \u0447\u0435\u0440\u0435\u0437 1 \u0447 \u043f\u043e\u0441\u043b\u0435 \u043f\u043e\u043b\u0443\u0447\u0435\u043d\u0438\u044f \u043f\u043e\u043b\u043d\u043e\u0439 \u043b\u0435\u0442\u0430\u043b\u044c\u043d\u043e\u0439 \u0434\u043e\u0437\u044b 9.4 \u0413\u0440 (\u0441\u043c. \u0440\u0438\u0441. 2, \u0431 ) \u043d\u0435 \u0437\u0430\u0449\u0438\u0449\u0430\u0435\u0442 \u043c\u044b\u0448\u0435\u0439 \u043e\u0442 \u0433\u0438\u0431\u0435\u043b\u0438 \u043e\u0442 \u043e\u0431\u043b\u0443\u0447\u0435\u043d\u0438\u044f. \u041f\u0440\u0438 \u044d\u0442\u043e\u043c \u0438\u043d\u044a\u0435\u043a\u0446\u0438\u0438 \u043f\u0440\u0435\u043f\u0430\u0440\u0430\u0442\u0430 \u0447\u0435\u0440\u0435\u0437 4 \u0447 \u043f\u043e\u0441\u043b\u0435 \u043e\u0431\u043b\u0443\u0447\u0435\u043d\u0438\u044f, \u0442. \u0435. \u0442\u043e\u0433\u0434\u0430, \u043a\u043e\u0433\u0434\u0430 \u0430\u043a\u0442\u0438\u0432\u043d\u0430\u044f \u0444\u0430\u0437\u0430 \u043f\u0440\u043e\u0446\u0435\u0441\u0441\u0430 \u0440\u0435\u043f\u0430\u0440\u0430\u0446\u0438\u0438 \u043d\u0435\u0433\u043e\u043c\u043e\u043b\u043e\u0433\u0438\u0447\u043d\u043e\u0433\u043e \u043e\u0431\u044a\u0435\u0434\u0438\u043d\u0435\u043d\u0438\u044f \u043a\u043e\u043d- \u0446\u043e\u0432 \u0437\u0430\u0432\u0435\u0440\u0448\u0435\u043d\u0430, \u044d\u0444\u0444\u0435\u043a\u0442\u0438\u0432\u043d\u043e (\u0434\u043e 60 %) \u0441\u043f\u0430\u0441\u0430\u044e\u0442 \u043c\u044b\u0448\u0435\u0439 \u043e\u0442 \u0433\u0438\u0431\u0435\u043b\u0438. \u0423 \u0442\u0430\u043a\u0438\u0445 \u0436\u0438\u0432\u043e\u0442\u043d\u044b\u0445 \u043f\u043e\u043b\u043d\u043e\u0441\u0442\u044c\u044e \u0432\u043e\u0441\u0441\u0442\u0430\u043d\u0430\u0432\u043b\u0438\u0432\u0430\u044e\u0442\u0441\u044f \u043a\u0440\u043e\u0432\u0435\u0442\u0432\u043e\u0440\u043d\u044b\u0435 \u0440\u043e\u0441\u0442\u043a\u0438 \u043a\u043e\u0441\u0442\u043d\u043e\u0433\u043e \u043c\u043e\u0437\u0433\u0430 \u0438 \u0434\u0435\u0442\u0435\u043a\u0442\u0438\u0440\u0443\u0435\u0442\u0441\u044f \u0432\u044b- \u0440\u0430\u0436\u0435\u043d\u043d\u043e\u0435 \u043a\u043e\u043b\u043e\u043d\u0438\u0435\u043e\u0431\u0440\u0430\u0437\u043e\u0432\u0430\u043d\u0438\u0435 \u0432 \u0441\u0435\u043b\u0435\u0437\u0435\u043d\u043a\u0430\u0445. \u041f\u0440\u0435\u0434\u043f\u043e\u043b\u0430\u0433\u0430\u0435\u0442\u0441\u044f, \u0447\u0442\u043e \u0444\u0440\u0430\u0433\u043c\u0435\u043d\u0442\u044b \u0434\u0432\u0443\u0446\u0435\u043f\u043e\u0447\u0435\u0447\u043d\u043e\u0439 \u0420\u041d\u041a, \u0434\u043e\u0441\u0442\u0430\u0432\u043b\u0435\u043d\u043d\u044b\u0435 \u0432 \u043a\u043b\u0435\u0442\u043a\u0443 \u0432 \u043c\u043e\u043c\u0435\u043d\u0442 \u0438\u0434\u0443\u0449\u0435\u0433\u043e \u0440\u0435\u043f\u0430\u0440\u0430\u0442\u0438\u0432\u043d\u043e\u0433\u043e \u043f\u0440\u043e\u0446\u0435\u0441\u0441\u0430, \u0438\u043d\u0442\u0435\u0440\u0444\u0435\u0440\u0438\u0440\u0443\u044e\u0442 \u043f\u0440\u043e\u0446\u0435\u0441\u0441 \u0440\u0435\u043f\u0430\u0440\u0430\u0446\u0438\u0438 \u043d\u0435\u0433\u043e\u043c\u043e\u043b\u043e- \u0433\u0438\u0447\u043d\u043e\u0433\u043e \u043e\u0431\u044a\u0435\u0434\u0438\u043d\u0435\u043d\u0438\u044f \u043a\u043e\u043d\u0446\u043e\u0432, \u043f\u0440\u0438\u0447\u0435\u043c \u044d\u0442\u0430 \u0438\u043d\u0442\u0435\u0440\u0444\u0435\u0440\u0435\u043d- \u0446\u0438\u044f \u043c\u043e\u0436\u0435\u0442 \u0431\u044b\u0442\u044c \u043e\u0431\u0443\u0441\u043b\u043e\u0432\u043b\u0435\u043d\u0430 \u0440\u0430\u0437\u043b\u0438\u0447\u043d\u044b\u043c\u0438 \u043c\u0435\u0445\u0430\u043d\u0438\u0437\u043c\u0430\u043c\u0438 (\u043a\u043e\u043d\u043a\u0443\u0440\u0435\u043d\u0442\u043d\u043e\u0435 \u0441\u0432\u044f\u0437\u044b\u0432\u0430\u043d\u0438\u0435 \u0440\u0435\u043f\u0430\u0440\u0430\u0442\u0438\u0432\u043d\u044b\u0445 \u043a\u043e\u043c\u043f\u043b\u0435\u043a\u0441\u043e\u0432, \u0438\u043d\u0434\u0443\u043a\u0446\u0438\u044f \u043a\u043e\u043d\u0444\u043b\u0438\u043a\u0442\u043d\u043e\u0433\u043e \u0440\u0435\u043f\u0430\u0440\u0430\u0442\u0438\u0432\u043d\u043e\u0433\u043e \u043f\u0440\u043e\u0446\u0435\u0441\u0441\u0430 \u0438\u043d\u043e\u0439 \u043f\u0440\u0438\u0440\u043e\u0434\u044b, \u0431\u043b\u043e\u043a\u0430\u0434\u0430 \u043a\u0432\u0430\u0437\u0438\u043c\u0430\u0442\u0440\u0438\u0446\u0435\u0439 \u0441\u0443\u0431\u0441\u0442\u0440\u0430\u0442\u043d\u044b\u0445 \u0434\u0432\u0443\u0446\u0435\u043f\u043e- \u0447\u0435\u0447\u043d\u044b\u0445 \u043a\u043e\u043d\u0446\u043e\u0432). \u041e\u0431\u043b\u0443\u0447\u0435\u043d\u0438\u0435 \u0441 \u0443\u043a\u0430\u0437\u0430\u043d\u043d\u043e\u0439 \u0434\u043e\u0437\u043e\u0439 9.4 \u0413\u0440 \u0438 \u043c\u043e\u0449\u043d\u043e\u0441\u0442\u044c\u044e 0.74\u20131.4 \u0413\u0440/\u043c\u0438\u043d \u044f\u0432\u043b\u044f\u0435\u0442\u0441\u044f \u043e\u0441\u0442\u0440\u044b\u043c \u043e\u0431\u043b\u0443\u0447\u0435\u043d\u0438\u0435\u043c, \u0434\u043b\u044f \u043a\u043e\u0442\u043e- \u0440\u043e\u0433\u043e \u043f\u043e\u044f\u0432\u043b\u0435\u043d\u0438\u0435 \u0438 \u043d\u0430\u043a\u043e\u043f\u043b\u0435\u043d\u0438\u0435 \u0414\u0426\u0420, \u043e\u0446\u0435\u043d\u0435\u043d\u043d\u043e\u0435 \u043c\u0435\u0442\u043e\u0434\u043e\u043c \u0444\u043e\u043a\u0443\u0441\u043e\u0432 \u043a \u0433\u0438\u0441\u0442\u043e\u043d\u0443 \u03b3H2X, \u043f\u0440\u043e\u0438\u0441\u0445\u043e\u0434\u0438\u0442 \u043a 40\u201360-\u0439 \u043c\u0438\u043d\u0443\u0442\u0435 \u043f\u043e\u0441\u043b\u0435 \u043e\u043a\u043e\u043d\u0447\u0430\u043d\u0438\u044f \u043e\u0431\u043b\u0443\u0447\u0435\u043d\u0438\u044f (Peitzsch et al., 2013; \u041e\u0437\u0435\u0440\u043e\u0432, \u041e\u0441\u0438\u043f\u043e\u0432, 2015). \u0422\u0430\u043a\u043e\u0439 \u0440\u0435\u0437\u0443\u043b\u044c\u0442\u0430\u0442 \u0431\u043b\u0438\u0437\u043e\u043a \u043a \u0434\u0430\u043d\u043d\u044b\u043c, \u043f\u043e\u043b\u0443- \u0447\u0435\u043d\u043d\u044b\u043c \u0432 \u043d\u0430\u0441\u0442\u043e\u044f\u0449\u0435\u043c \u0438\u0441\u0441\u043b\u0435\u0434\u043e\u0432\u0430\u043d\u0438\u0438. \u0418\u0437\u0432\u0435\u0441\u0442\u043d\u043e, \u0447\u0442\u043e \u043f\u0440\u0438 \u043e\u0441\u0442\u0440\u043e\u043c \u043e\u0431\u043b\u0443\u0447\u0435\u043d\u0438\u0438 \u043f\u043e\u043c\u0438\u043c\u043e \u043f\u0440\u043e\u0441\u0442\u044b\u0445 \u0414\u0426\u0420 \u0444\u043e\u0440\u043c\u0438\u0440\u0443\u044e\u0442\u0441\u044f \u00ab\u0441\u043b\u043e\u0436\u043d\u044b\u0435\u00bb, \u043e\u0431\u0440\u0430\u0437\u0443\u044e\u0449\u0438\u0435\u0441\u044f \u0432 \u0440\u0435\u0437\u0443\u043b\u044c\u0442\u0430- \u0442\u0435 \u0438\u043d\u0434\u0443\u043a\u0446\u0438\u0438 \u0434\u0440\u0443\u0433\u0438\u0445 \u043f\u043e\u0432\u0440\u0435\u0436\u0434\u0435\u043d\u0438\u0439 \u0445\u0440\u043e\u043c\u0430\u0442\u0438\u043d\u0430 \u0438 \u0430\u043a\u0442\u0438\u0432\u0430\u0446\u0438\u0438 \u0438\u043d\u044b\u0445 \u0440\u0435\u043f\u0430\u0440\u0430\u0442\u0438\u0432\u043d\u044b\u0445 \u043f\u0440\u043e\u0446\u0435\u0441\u0441\u043e\u0432 (\u041e\u0437\u0435\u0440\u043e\u0432, \u041e\u0441\u0438\u043f\u043e\u0432, 2015). \u0410\u0432\u0442\u043e\u0440\u044b \u0446\u0438\u0442\u0438\u0440\u0443\u0435\u043c\u043e\u0439 \u0440\u0430\u0431\u043e\u0442\u044b \u0441\u043e\u043e\u0431\u0449\u0430\u044e\u0442, \u0447\u0442\u043e \u0434\u043e 20 % \u0414\u0426\u0420 \u043f\u0440\u0438 \u03b3-\u043e\u0431\u043b\u0443\u0447\u0435\u043d\u0438\u0438 \u043e\u0442\u043d\u043e\u0441\u044f\u0442\u0441\u044f \u043a \u00ab\u0441\u043b\u043e\u0436\u043d\u044b\u043c \u043f\u043e\u0432\u0440\u0435\u0436\u0434\u0435\u043d\u0438\u044f\u043c\u00bb \u0438 \u0440\u0435\u043f\u0430\u0440\u0438\u0440\u0443\u044e\u0442\u0441\u044f \u0437\u043d\u0430\u0447\u0438\u0442\u0435\u043b\u044c\u043d\u043e \u043f\u043e\u0437\u0436\u0435, \u0447\u0435\u043c \u0414\u0426\u0420, \u0438\u043d\u0434\u0443\u0446\u0438- \u0440\u043e\u0432\u0430\u043d\u043d\u044b\u0435 \u043d\u0435\u043f\u043e\u0441\u0440\u0435\u0434\u0441\u0442\u0432\u0435\u043d\u043d\u044b\u043c \u0440\u0430\u0437\u0440\u044b\u0432\u043e\u043c \u0445\u0440\u043e\u043c\u0430\u0442\u0438\u043d\u0430. \u0412\u043e\u0437- \u043c\u043e\u0436\u043d\u043e, \u043e\u0431\u043d\u0430\u0440\u0443\u0436\u0435\u043d\u043d\u044b\u0439 \u0442\u0435\u0440\u0430\u043f\u0435\u0432\u0442\u0438\u0447\u0435\u0441\u043a\u0438\u0439 \u044d\u0444\u0444\u0435\u043a\u0442 \u0441\u0432\u044f\u0437\u0430\u043d \u0441 \u0440\u0435\u043f\u0430\u0440\u0430\u0446\u0438\u0435\u0439 \u0445\u0440\u043e\u043c\u0430\u0442\u0438\u043d\u0430 \u0432 \u0441\u0442\u0432\u043e\u043b\u043e\u0432\u044b\u0445 \u043a\u043b\u0435\u0442\u043a\u0430\u0445 \u043a\u043e\u0441\u0442\u043d\u043e\u0433\u043e \u043c\u043e\u0437\u0433\u0430 \u043f\u043e \u0442\u0438\u043f\u0443 \u0433\u043e\u043c\u043e\u043b\u043e\u0433\u0438\u0447\u043d\u043e\u0439 \u0440\u0435\u043a\u043e\u043c\u0431\u0438\u043d\u0430\u0446\u0438\u0438 \u0441 \u0443\u0447\u0430\u0441\u0442\u0438\u0435\u043c \u0432\u043d\u0435\u0448\u043d\u0435\u0439 \u0420\u041d\u041a \u043c\u0430\u0442\u0440\u0438\u0446\u044b. \u042d\u0442\u043e\u0442 \u0442\u0438\u043f \u0440\u0435\u043f\u0430\u0440\u0430\u0446\u0438\u0438 \u0430\u043a\u0442\u0438\u0432\u0438\u0440\u0443\u0435\u0442\u0441\u044f \u0437\u043d\u0430\u0447\u0438\u0442\u0435\u043b\u044c\u043d\u043e \u043f\u043e\u0437\u0436\u0435 \u043f\u043e \u0441\u0440\u0430\u0432\u043d\u0435\u043d\u0438\u044e \u0441 \u0430\u0432\u0430\u0440\u0438\u0439\u043d\u044b\u043c \u043d\u0435- \u0433\u043e\u043c\u043e\u043b\u043e\u0433\u0438\u0447\u043d\u044b\u043c \u043e\u0431\u044a\u0435\u0434\u0438\u043d\u0435\u043d\u0438\u0435\u043c \u043a\u043e\u043d\u0446\u043e\u0432. \u0422\u043e\u0442 \u0444\u0430\u043a\u0442, \u0447\u0442\u043e \u043d\u0430 \u0433\u0440\u0430\u0444\u0438\u043a\u0430\u0445, \u043f\u043e\u043b\u0443\u0447\u0435\u043d\u043d\u044b\u0445 \u043f\u0440\u0438 \u043e\u0446\u0435\u043d\u043a\u0435 \u0447\u0438\u0441\u043b\u0430 \u0414\u0426\u0420, \u043f\u043e\u043a\u0430\u0437\u0430\u0442\u0435\u043b\u0438 \u0432 \u043f\u043e\u0441\u043b\u0435\u0434\u043d\u0435\u0439 \u0430\u043d\u0430\u043b\u0438\u0437\u0438\u0440\u0443\u0435\u043c\u043e\u0439 \u0442\u043e\u0447\u043a\u0435 (2 \u0447) \u043d\u0438 \u0432 \u043e\u0434\u043d\u043e\u043c \u0438\u0437 \u043f\u0440\u0438\u0432\u0435\u0434\u0435\u043d\u043d\u044b\u0445 \u044d\u043a\u0441\u043f\u0435\u0440\u0438\u043c\u0435\u043d\u0442\u043e\u0432 \u043d\u0435 \u043e\u043f\u0443\u0441\u043a\u0430\u043b\u0438\u0441\u044c \u0434\u043e \u0437\u043d\u0430\u0447\u0435\u043d\u0438\u044f \u0438\u0441\u0445\u043e\u0434\u043d\u043e\u0439 \u043d\u0443\u043b\u0435\u0432\u043e\u0439 \u043e\u0442\u043c\u0435\u0442\u043a\u0438, \u0441\u043e\u0433\u043b\u0430\u0441\u0443\u0435\u0442\u0441\u044f \u0441 \u0432\u044b\u0441\u043a\u0430\u0437\u0430\u043d\u043d\u044b\u043c \u0432\u044b\u0448\u0435 \u043f\u0440\u0435\u0434\u043f\u043e\u043b\u043e\u0436\u0435\u043d\u0438\u0435\u043c. \u0412 \u043b\u0438\u0442\u0435\u0440\u0430\u0442\u0443\u0440\u0435 \u0438\u0437\u0432\u0435\u0441\u0442\u043d\u044b \u0432\u0430\u0440\u0438\u0430\u043d\u0442\u044b \u0440\u0435\u043f\u0430\u0440\u0430\u0442\u0438\u0432\u043d\u044b\u0445 \u043f\u0440\u043e\u0446\u0435\u0441- \u0441\u043e\u0432 \u0441 \u0438\u0441\u043f\u043e\u043b\u044c\u0437\u043e\u0432\u0430\u043d\u0438\u0435\u043c \u0420\u041d\u041a \u0438 \u0414\u041d\u041a \u043c\u0430\u0442\u0440\u0438\u0446\u044b. \u0414\u043b\u044f \u0420\u041d\u041a \u043e\u043f\u0438- \u0441\u0430\u043d\u044b \u043c\u043e\u0434\u0435\u043b\u0438, \u0432 \u043a\u043e\u0442\u043e\u0440\u044b\u0445 \u043e\u0441\u043d\u043e\u0432\u043d\u044b\u043c \u043b\u0435\u0439\u0442\u043c\u043e\u0442\u0438\u0432\u043e\u043c \u044f\u0432\u043b\u044f\u0435\u0442\u0441\u044f \u043f\u043e\u0441\u0442\u0440\u043e\u0435\u043d\u0438\u0435 \u043a\u0414\u041d\u041a \u043a\u043e\u043f\u0438\u0438 \u0438 \u0432\u043e\u0432\u043b\u0435\u0447\u0435\u043d\u0438\u0435 \u0434\u0432\u0443\u0446\u0435\u043f\u043e\u0447\u0435\u0447\u043d\u043e\u0439 \u0444\u043e\u0440\u043c\u044b \u044d\u0442\u043e\u0439 \u043d\u0443\u043a\u043b\u0435\u0438\u043d\u043e\u0432\u043e\u0439 \u043a\u0438\u0441\u043b\u043e\u0442\u044b \u0432 \u0440\u0435\u043f\u0430\u0440\u0430\u0442\u0438\u0432\u043d\u044b\u0439 \u043f\u0440\u043e- \u0446\u0435\u0441\u0441 (Storici et al., 2007; Meers et al., 2016). \u0414\u043b\u044f \u0434\u0432\u0443\u0446\u0435\u043f\u043e- \u0447\u0435\u0447\u043d\u043e\u0439 \u0414\u041d\u041a \u0442\u0430\u043a\u0436\u0435 \u0438\u0437\u0432\u0435\u0441\u0442\u043d\u044b \u0440\u0430\u0437\u043b\u0438\u0447\u043d\u044b\u0435 \u043c\u043e\u0434\u0435\u043b\u0438 \u0440\u0435\u043f\u0430\u0440\u0430\u0446\u0438\u0438 \u0441 \u043f\u0440\u0438\u0432\u043b\u0435\u0447\u0435\u043d\u0438\u0435\u043c \u0432\u043d\u0435\u0448\u043d\u0435\u0439 \u0434\u0432\u0443\u0446\u0435\u043f\u043e\u0447\u0435\u0447\u043d\u043e\u0439 \u043c\u0430\u0442\u0440\u0438\u0446\u044b (Leung et al., 1997; B\u00e4rtsch et al., 2000; Li et al., 2001; Symington, 2005). \u0425\u0430\u0440\u0430\u043a\u0442\u0435\u0440\u043d\u044b\u043c \u0434\u043b\u044f \u0443\u0447\u0430\u0441\u0442\u0438\u044f \u0442\u0430\u043a\u0438\u0445 \u043d\u0443\u043a\u043b\u0435\u0438\u043d\u043e\u0432\u044b\u0445 \u043a\u0438\u0441- \u043b\u043e\u0442 \u0432 \u0438\u0434\u0443\u0449\u0435\u043c \u0440\u0435\u043f\u0430\u0440\u0430\u0442\u0438\u0432\u043d\u043e\u043c \u043f\u0440\u043e\u0446\u0435\u0441\u0441\u0435 \u044f\u0432\u043b\u044f\u0435\u0442\u0441\u044f \u0432\u043d\u0435\u0434\u0440\u0435\u043d\u0438\u0435 \u043f\u0440\u043e\u0446\u0435\u0441\u0441\u0438\u0440\u043e\u0432\u0430\u043d\u043d\u043e\u0433\u043e 3\u2032OH \u043a\u043e\u043d\u0446\u0430 \u0440\u0430\u0437\u043e\u0440\u0432\u0430\u043d\u043d\u043e\u0433\u043e \u0445\u0440\u043e\u043c\u0430\u0442\u0438\u043d\u0430 \u043c\u0435\u0436\u0434\u0443 \u0446\u0435\u043f\u0435\u0439 \u0432\u043d\u0435\u0448\u043d\u0435\u0439 \u043c\u0430\u0442\u0440\u0438\u0446\u044b \u0438 \u0444\u043e\u0440\u043c\u0438\u0440\u043e\u0432\u0430\u043d\u0438\u0435 \u0438\u043d\u0442\u0435\u0440\u043c\u0435- \u0434\u0438\u0430\u0442\u0430 \u0440\u0435\u043f\u0430\u0440\u0430\u0446\u0438\u0438. \u0414\u0430\u043b\u0435\u0435 \u043c\u043e\u0433\u0443\u0442 \u043e\u0441\u0443\u0449\u0435\u0441\u0442\u0432\u043b\u044f\u0442\u044c\u0441\u044f \u0440\u0430\u0437\u043b\u0438\u0447\u043d\u044b\u0435 \u043e\u043f\u0438\u0441\u0430\u043d\u043d\u044b\u0435 \u0432\u0430\u0440\u0438\u0430\u043d\u0442\u044b \u0434\u043e\u0441\u0442\u0440\u0430\u0438\u0432\u0430\u043d\u0438\u044f \u0446\u0435\u043f\u0435\u0439 \u0438 \u0432\u043e\u0441\u0441\u0442\u0430\u043d\u043e\u0432\u043b\u0435- \u043d\u0438\u044f \u0446\u0435\u043b\u043e\u0441\u0442\u043d\u043e\u0441\u0442\u0438 \u0445\u0440\u043e\u043c\u0430\u0442\u0438\u043d\u0430. \u041c\u043e\u0436\u043d\u043e \u043f\u0440\u0435\u0434\u043f\u043e\u043b\u043e\u0436\u0438\u0442\u044c, \u0447\u0442\u043e \u0440\u0435\u043f\u0430\u0440\u0430\u0446\u0438\u044f \u0432 \u043f\u0440\u0438\u0441\u0443\u0442\u0441\u0442\u0432\u0438\u0438 \u044d\u043a\u0441\u0442\u0440\u0430\u043a\u043b\u0435\u0442\u043e\u0447\u043d\u044b\u0445 \u0434\u0432\u0443\u0446\u0435\u043f\u043e\u0447\u0435\u0447\u043d\u044b\u0445 \u0420\u041d\u041a \u0438\u0434\u0435\u0442 \u0438\u043c\u0435\u043d\u043d\u043e \u043f\u043e \u0442\u0430\u043a\u043e\u043c\u0443 \u043e\u0431\u0449\u0435\u043c\u0443 \u043c\u043e\u043b\u0435\u043a\u0443\u043b\u044f\u0440\u043d\u043e\u043c\u0443 \u0441\u0446\u0435- \u043d\u0430\u0440\u0438\u044e. \u041e \u0432\u0430\u0436\u043d\u043e\u0439 \u0440\u043e\u043b\u0438 \u0434\u0432\u0443\u0446\u0435\u043f\u043e\u0447\u0435\u0447\u043d\u043e\u0439 \u0444\u043e\u0440\u043c\u044b \u043d\u0443\u043a\u043b\u0435\u0438\u043d\u043e- \u0432\u044b\u0445 \u043a\u0438\u0441\u043b\u043e\u0442 \u043f\u0440\u0438 \u043e\u0441\u0443\u0449\u0435\u0441\u0442\u0432\u043b\u0435\u043d\u0438\u0438 \u0440\u0435\u043f\u0430\u0440\u0430\u0442\u0438\u0432\u043d\u043e\u0433\u043e \u043f\u0440\u043e\u0446\u0435\u0441\u0441\u0430 \u0441\u0432\u0438\u0434\u0435\u0442\u0435\u043b\u044c\u0441\u0442\u0432\u0443\u044e\u0442 \u0434\u0430\u043d\u043d\u044b\u0435, \u043f\u043e\u043b\u0443\u0447\u0435\u043d\u043d\u044b\u0435 \u0432 \u0440\u0430\u0431\u043e\u0442\u0435 (Storici et al., 2007), \u0433\u0434\u0435 \u043f\u043e\u043a\u0430\u0437\u0430\u043d\u043e, \u0447\u0442\u043e \u0434\u0443\u043f\u043b\u0435\u043a\u0441 \u0420\u041d\u041a/\u0414\u041d\u041a \u043f\u043e\u0432\u044b\u0448\u0430\u0435\u0442 \u044d\u0444\u0444\u0435\u043a\u0442\u0438\u0432\u043d\u043e\u0441\u0442\u044c \u0440\u0435\u043f\u0430\u0440\u0430\u0446\u0438\u0438 \u043f\u043e \u0441\u0440\u0430\u0432\u043d\u0435\u043d\u0438\u044e \u0441 \u043e\u0434\u043d\u043e\u0446\u0435\u043f\u043e\u0447\u0435\u0447- \u043d\u043e\u0439 \u0420\u041d\u041a \u043d\u0430 \u0434\u0432\u0430-\u0442\u0440\u0438 \u043f\u043e\u0440\u044f\u0434\u043a\u0430. \u041f\u043e\u043b\u043d\u043e\u0435 \u043e\u0442\u0441\u0443\u0442\u0441\u0442\u0432\u0438\u0435 \u0440\u0430\u0434\u0438\u043e\u0437\u0430\u0449\u0438\u0442\u043d\u043e\u0433\u043e \u0434\u0435\u0439\u0441\u0442\u0432\u0438\u044f \u0443 \u043f\u0440\u0435\u043f\u0430\u0440\u0430\u0442\u0430 \u043e\u0434\u043d\u043e\u0446\u0435\u043f\u043e\u0447\u0435\u0447\u043d\u043e\u0439 \u0420\u041d\u041a \u0432 \u0434\u043e\u0437\u0430\u0445, \u0441\u043e\u043f\u043e\u0441\u0442\u0430\u0432\u0438\u043c\u044b\u0445 \u0441 \u0440\u0430\u0434\u0438\u043e\u043f\u0440\u043e\u0442\u0435\u043a\u0442\u043e\u0440\u043d\u044b\u043c\u0438 \u0434\u043e\u0437\u0430\u043c\u0438 \u0434\u0432\u0443\u0446\u0435\u043f\u043e\u0447\u0435\u0447\u043d\u043e\u0439 \u0420\u041d\u041a, \u043f\u0440\u0435\u0434\u043f\u043e- \u043b\u0430\u0433\u0430\u0435\u0442, \u0447\u0442\u043e \u0440\u0430\u0434\u0438\u043e\u043f\u0440\u043e\u0442\u0435\u043a\u0442\u043e\u0440\u043d\u043e\u0435 \u0434\u0435\u0439\u0441\u0442\u0432\u0438\u0435 \u0434\u0432\u0443\u0446\u0435\u043f\u043e\u0447\u0435\u0447\u043d\u043e\u0439 \u0420\u041d\u041a \u0441\u0432\u044f\u0437\u0430\u043d\u043e \u0441 \u043f\u043e\u044f\u0432\u0438\u0432\u0448\u0435\u0439\u0441\u044f \u0432 \u043a\u043b\u0435\u0442\u043e\u0447\u043d\u043e\u043c \u043f\u0440\u043e\u0441\u0442\u0440\u0430\u043d\u0441\u0442\u0432\u0435 \u0441\u0442\u0432\u043e\u043b\u043e\u0432\u044b\u0445 \u0433\u0435\u043c\u043e\u043f\u043e\u044d\u0442\u0438\u0447\u0435\u0441\u043a\u0438\u0445 \u043a\u043b\u0435\u0442\u043e\u043a \u0432\u043d\u0435\u0445\u0440\u043e\u043c\u043e\u0441\u043e\u043c\u043d\u043e\u0439 \u0434\u0432\u0443\u0446\u0435\u043f\u043e\u0447\u0435\u0447\u043d\u043e\u0439 \u043c\u0430\u0442\u0440\u0438\u0446\u044b. \u0412\u043d\u0435\u0434\u0440\u0435\u043d\u0438\u0435 \u043c\u0435\u0436\u0434\u0443 \u0446\u0435\u043f\u044f\u043c\u0438 \u0442\u0430\u043a\u043e\u0439 \u0434\u0432\u0443- \u0446\u0435\u043f\u043e\u0447\u0435\u0447\u043d\u043e\u0439 \u0420\u041d\u041a \u043c\u0430\u0442\u0440\u0438\u0446\u044b \u043f\u0440\u043e\u0446\u0435\u0441\u0441\u0438\u0440\u043e\u0432\u0430\u043d\u043d\u043e\u0433\u043e \u0444\u0438\u043b\u0430\u043c\u0435\u043d\u0442\u0430 \u0414\u041d\u041a \u0414\u0426\u0420 \u043c\u043e\u0436\u0435\u0442 \u0431\u044b\u0442\u044c \u0433\u043b\u0430\u0432\u043d\u044b\u043c \u0441\u043e\u0431\u044b\u0442\u0438\u0435\u043c, \u043e\u043f\u0440\u0435\u0434\u0435\u043b\u044f\u044e\u0449\u0438\u043c \u0434\u0430\u043b\u044c\u043d\u0435\u0439\u0448\u0438\u0435 \u0444\u0430\u0437\u044b \u0440\u0435\u043f\u0430\u0440\u0430\u0446\u0438\u0438 \u0444\u0430\u0442\u0430\u043b\u044c\u043d\u043e\u0433\u043e \u043f\u043e\u0432\u0440\u0435\u0436\u0434\u0435\u043d\u0438\u044f, \u0438\u043d\u0434\u0443\u0446\u0438\u0440\u043e\u0432\u0430\u043d\u043d\u043e\u0433\u043e \u03b3-\u0440\u0430\u0434\u0438\u0430\u0446\u0438\u0435\u0439. \u0417\u0430\u043a\u043b\u044e\u0447\u0435\u043d\u0438\u0435 \u0422\u0430\u043a\u0438\u043c \u043e\u0431\u0440\u0430\u0437\u043e\u043c, \u0434\u0430\u043d\u043d\u044b\u0435 \u043c\u043e\u043b\u0435\u043a\u0443\u043b\u044f\u0440\u043d\u043e-\u0431\u0438\u043e\u043b\u043e\u0433\u0438\u0447\u0435\u0441\u043a\u0438\u0445 \u0438\u0441- \u0441\u043b\u0435\u0434\u043e\u0432\u0430\u043d\u0438\u0439, \u044d\u043a\u0441\u043f\u0435\u0440\u0438\u043c\u0435\u043d\u0442\u043e\u0432 \u0441 \u0438\u0441\u043f\u043e\u043b\u044c\u0437\u043e\u0432\u0430\u043d\u0438\u0435\u043c \u043a\u043b\u0435\u0442\u043e\u0447\u043d\u044b\u0445 \u0442\u0435\u0445\u043d\u043e\u043b\u043e\u0433\u0438\u0439 \u0438 \u0431\u0438\u043e\u043b\u043e\u0433\u0438\u0447\u0435\u0441\u043a\u0438\u0435 \u0442\u0435\u0441\u0442\u044b \u0441\u0432\u0438\u0434\u0435\u0442\u0435\u043b\u044c\u0441\u0442\u0432\u0443\u044e\u0442, \u0447\u0442\u043e \u0441\u0443\u0431\u0441\u0442\u0430\u043d\u0446\u0438\u0435\u0439, \u043e\u043f\u0440\u0435\u0434\u0435\u043b\u044f\u044e\u0449\u0435\u0439 \u0440\u0430\u0434\u0438\u043e\u043f\u0440\u043e\u0442\u0435\u043a\u0442\u043e\u0440\u043d\u043e\u0435 \u0434\u0435\u0439\u0441\u0442\u0432\u0438\u0435 \u0444\u0440\u0430\u043a\u0446\u0438\u0438 \u00ab0.25 \u041c\u00bb \u0420\u041d\u041a \u0434\u0440\u043e\u0436\u0436\u0435\u0439 S. \u0441erevisiae, \u044f\u0432\u043b\u044f\u0435\u0442\u0441\u044f \u0434\u0432\u0443\u0446\u0435\u043f\u043e\u0447\u0435\u0447\u043d\u0430\u044f \u0444\u043e\u0440\u043c\u0430 \u043c\u043e\u043b\u0435\u043a\u0443\u043b \u0420\u041d\u041a. Conflict of interest The authors declare no conflict of interest. References \u041e\u0437\u0435\u0440\u043e\u0432 \u0418.\u0412., \u041e\u0441\u0438\u043f\u043e\u0432 \u0410.\u041d. \u041a\u0438\u043d\u0435\u0442\u0438\u0447\u0435\u0441\u043a\u0430\u044f \u043c\u043e\u0434\u0435\u043b\u044c \u0440\u0435\u043f\u0430\u0440\u0430\u0446\u0438\u0438 \u0434\u0432\u0443\u043d\u0438- \u0442\u0435\u0432\u044b\u0445 \u0440\u0430\u0437\u0440\u044b\u0432\u043e\u0432 \u0414\u041d\u041a \u0432 \u043f\u0435\u0440\u0432\u0438\u0447\u043d\u044b\u0445 \u0444\u0438\u0431\u0440\u043e\u0431\u043b\u0430\u0441\u0442\u0430\u0445 \u0447\u0435\u043b\u043e\u0432\u0435\u043a\u0430 \u043f\u0440\u0438 \u0434\u0435\u0439\u0441\u0442\u0432\u0438\u0438 \u0440\u0435\u0434\u043a\u043e\u0438\u043e\u043d\u0438\u0437\u0438\u0440\u0443\u044e\u0449\u0435\u0433\u043e \u0438\u0437\u043b\u0443\u0447\u0435\u043d\u0438\u044f \u0441 \u0440\u0430\u0437\u043b\u0438\u0447\u043d\u043e\u0439 \u043c\u043e\u0449- \u043d\u043e\u0441\u0442\u044c\u044e \u0434\u043e\u0437\u044b. \u041a\u043e\u043c\u043f\u044c\u044e\u0442\u0435\u0440\u043d\u044b\u0435 \u0438\u0441\u0441\u043b\u0435\u0434\u043e\u0432\u0430\u043d\u0438\u044f \u0438 \u043c\u043e\u0434\u0435\u043b\u0438\u0440\u043e\u0432\u0430\u043d\u0438\u0435. 2015;7(1):159-176. DOI 10.20537/2076-7633-2015-7-1-159-176. [Ozerov I.V., Osipov A.N. Kinetic model of DNA double-strand break repair in primary human fibroblasts exposed to low-LET irradiation with various dose rates. Kompyuternye Issledovaniya i Modelirovanie = Computer Research and Modeling. 2015;7(1):159- 176. DOI 10.20537/2076-7633-2015-7-1-159-176. (in Russian)] \u0420\u0438\u0442\u0442\u0435\u0440 \u0413.\u0421., \u041d\u0438\u043a\u043e\u043b\u0438\u043d \u0412.\u041f., \u041f\u043e\u043f\u043e\u0432\u0430 \u041d.\u0410., \u041a\u0438\u0441\u0430\u0440\u0435\u0442\u043e\u0432\u0430 \u041f.\u042d., \u0414\u043e\u043b\u0433\u043e- \u0432\u0430 \u0415.\u0412., \u041f\u0440\u043e\u0441\u043a\u0443\u0440\u0438\u043d\u0430 \u0410.\u0421., \u041f\u043e\u0442\u0442\u0435\u0440 \u0415.\u0410., \u041a\u0438\u0440\u0438\u043a\u043e\u0432\u0438\u0447 \u0421.\u0421., \u0411\u0430\u0439- \u0431\u043e\u0440\u043e\u0434\u0438\u043d \u0421.\u0418., \u0422\u0430\u0440\u0430\u043d\u043e\u0432 \u041e.\u0421., \u0415\u0444\u0440\u0435\u043c\u043e\u0432 \u042f.\u0420., \u041a\u043e\u043b\u0447\u0430\u043d\u043e\u0432 \u041d.\u0410., \u0411\u043e\u0433\u0430\u0447\u0435\u0432 \u0421.\u0421. \u0418\u0437\u0443\u0447\u0435\u043d\u0438\u0435 \u0440\u0430\u0434\u0438\u043e\u043f\u0440\u043e\u0442\u0435\u043a\u0442\u043e\u0440\u043d\u043e\u0433\u043e \u0434\u0435\u0439\u0441\u0442\u0432\u0438\u044f \u0434\u0432\u0443\u0446\u0435\u043f\u043e- \u0447\u0435\u0447\u043d\u043e\u0439 \u0420\u041d\u041a, \u0432\u044b\u0434\u0435\u043b\u0435\u043d\u043d\u043e\u0439 \u0438\u0437 \u0434\u0440\u043e\u0436\u0436\u0435\u0439 Saccharomyces cerevisiae. \u0412: \u0427\u0435\u0442\u0432\u0435\u0440\u0442\u044b\u0439 \u043c\u0435\u0436\u0434\u0438\u0441\u0446\u0438\u043f\u043b. \u043d\u0430\u0443\u0447. \u0444\u043e\u0440\u0443\u043c \u0441 \u043c\u0435\u0436\u0434\u0443\u043d\u0430\u0440. \u0443\u0447\u0430\u0441\u0442\u0438\u0435\u043c \u00ab\u041d\u043e\u0432\u044b\u0435 \u043c\u0430\u0442\u0435\u0440\u0438\u0430\u043b\u044b \u0438 \u043f\u0435\u0440\u0441\u043f\u0435\u043a\u0442\u0438\u0432\u043d\u044b\u0435 \u0442\u0435\u0445\u043d\u043e\u043b\u043e\u0433\u0438\u0438\u00bb: \u0421\u0431. \u043c\u0430\u0442\u0435\u0440\u0438\u0430- \u043b\u043e\u0432. \u041c., 2018;II:161-167. [Ritter G.S., Nikolin V.P., Popova N.A., Kisaretova P.E., Dolgova E.V., Proskurina A.S., Potter E.A., Kirikovich S.S., Bayborodin S.I., Taranov O.S., Efremov Y.R., Kolchanov N.A., Bogachev S.S. Study of radioprotective action of double-stranded RNA extracted from Saccharomyces cerevisiae. In: The Fourth interdisciplinary scientific forum with international participation \u201cNew Materials and Promising Technologies\u201d: Proceedings. Moscow, 2018;II: 161-167. (in Russian)] B\u00e4rtsch S., Kang L.E., Symington L.S. RAD51 is required for the repair of plasmid double-stranded DNA gaps from either plasmid or chromosomal templates. Mol. Cell. Biol. 2000;20(4):1194-1205. DOI 10.1128/mcb.20.4.1194-1205.2000. Belli M., Sapora O., Tabocchini M.A. Molecular targets in cellular response to ionizing radiation and implications in space radiation protection. J. Radiat Res. 2002;43(S):S13-S19. DOI 10.1269/jrr.43.s13. Bergoni\u00e9 J., Tribondeau L. Interpretation of some results from radiotherapy and an attempt to determine a rational treatment technique (1906). Yale J. Biol. Med. 2003;76(4):181-182. Dent P., Yacoub A., Contessa J., Caron R., Amorino G., Valerie K., Hagan M.P., Grant S., Schmidt-Ullrich R. Stress and radiation-induced activation of multiple intracellular signaling pathways. Radiat. Res. 2003;159(3):283-300. DOI 10.1667/0033-7587(2003)159[0283: sariao]2.0.co;2. Dische Z. In: Colowick S.P., Kaplan N.O. (Eds.). Methods in Enzymology. Vol. III. New York: Acad. Press, 1957. Dolgova E.V., Alyamkina E.A., Efremov Y.R., Nikolin V.P., Popova N.A., Tyrinova T.V., Kozel A.V., Minkevich A.M., Andrushkevich O.M., Zavyalov E.L., Romaschenko A.V., Bayborodin S.I., Taranov O.S., Omigov V.V., Shevela E.Y., Stupak V.V., Mishinov S.V., Rogachev V.A., Proskurina A.S., Mayorov V.I., Shurdov M.A., Ostanin A.A., Chernykh E.R., Bogachev S.S. Identification of cancer stem cells and a strategy for their elimination. Cancer Biol. Ther. 2014;15(10):1378-1394. DOI 10.4161/cbt.29854. Dolgova E.V., Efremov Y.R., Orishchenko K.E., Andrushkevich O.M., Alyamkina E.A., Proskurina A.S., Bayborodin S.I., Nikolin V.P., Popova N.A., Chernykh E.R., Ostanin A.A., Taranov O.S., Omigov V.V., Minkevich A.M., Rogachev V.A., Bogachev S.S., Shurdov M.A. Delivery and processing of exogenous double-stranded DNA in mouse CD34+ hematopoietic progenitor cells and their cell cycle changes upon combined treatment with cyclophosphamide and double-stranded DNA. Gene. 2013a;528(2):74-83. DOI 10.1016/ j.gene.2013.06.058. Dolgova E.V., Nikolin V.P., Popova N.A., Proskurina A.S., Orishchenko K.E., Alyamkina E.A., Efremov Y.R., Baiborodin S.I., Chernykh E.R., Ostanin A.A., Bogachev S.S., Gvozdeva T.S., Malkova E.M., Taranov O.S., Rogachev V.A., Panov A.S., Zagrebelnyi S.N., Shurdov M.A. Pathological changes in mice treated with cyclophosphamide and exogenous DNA. Russ. J. Genet.: Appl. Res. 2013b; 3(4):291-304. DOI 10.1134/S2079059713040035. Fridovich I. Superoxide radical and superoxide dismutases. Annu. Rev. Biochem. 1995;64(1):97-112. DOI 10.1146/annurev.bi.64.070195. 000525. Goodhead D.T. Initial events in the cellular effects of ionizing radiations: clustered damage in DNA. Int. J. Radiat. Biol. 1994;65(1): 7-17. DOI 10.1080/09553009414550021. Leung W., Malkova A., Haber J.E. Gene targeting by linear duplex DNA frequently occurs by assimilation of a single strand that is subject to preferential mismatch correction. Proc. Natl. Acad. Sci. USA. 1997;94(13):6851-6856. DOI 10.1073/pnas.94.13.6851. Li J., Read L.R., Baker M.D. The mechanism of mammalian gene replacement is consistent with the formation of long regions of heteroduplex DNA associated with two crossing-over events. Mol. Cell. Biol. 2001;21(2):501-510. DOI 10.1128/mcb.21.2.501-510.2001. Likhacheva A.S., Nikolin V.P., Popova N.A., Rogachev V.A., Prokhorovich M.A., Sebeleva T.E., Bogachev S.S., Shurdov M.A. Exogenous DNA can be captured by stem cells and be involved in their rescue from death after lethal-dose \u03b3-radiation. Gene Ther. Mol. Biol. 2007;11(2):305-314. Mar\u00e9chal A., Zou L. DNA damage sensing by the ATM and ATR kinases. Cold Spring Harb. Perspect. Biol. 2013;5(9). DOI 10.1101/ cshperspect.a012716. Meers C., Keskin H., Storici F. DNA repair by RNA: templated, or not templated, that is the question. DNA Repair (Amst). 2016;44:17-21. DOI 10.1016/j.dnarep.2016.05.002. Morgan W.F. Non-targeted and delayed effects of exposure to ionizing radiation: I. Radiation-induced genomic instability and bystander effects in vitro. Radiat. Res. 2003a;159(5):567-580. DOI 10.1667/ 0033-7587(2003)159[0567:nadeoe]2.0.co;2. Morgan W.F. Non-targeted and delayed effects of exposure to ionizing radiation: II. Radiation-induced genomic instability and bystander effects in vivo, clastogenic factors and transgenerational effects. Radiat. Res. 2003b;159(5):581-596. DOI 10.1667/0033-7587(2003) 159[0581:nadeoe]2.0.co;2. Patt H.M., Tyree E.B., Straube R.L., Smith D.E. Cysteine protection against X irradiation. Science. 1949;110(2852):213-214. DOI 10.1126/science.110.2852.213. Peitzsch C., Kurth I., Kunz-Schughart L., Baumann M., Dubrovska A. Discovery of the cancer stem cell related determinants of radioresistance. Radiother. Oncol. 2013;108(3):378-387. DOI 10.1016/ j.radonc.2013.06.003. Rogakou E.P., Boon C., Redon C., Bonner W.M. Megabase chromatin domains involved in DNA double-strand breaks in vivo. J. Cell Biol. 1999;146(5):905-915. DOI 10.1083/jcb.146.5.905. Rogakou E.P., Pilch D.R., Orr A.H., Ivanova V.S., Bonner W.M. DNA double-stranded breaks induce histone H2AX phosphorylation on serine 139. J. Biol. Chem. 1998;273(10):5858-5868. DOI 10.1074/ jbc.273.10.5858. Shemetun O.V., Pilinska M.A. Radiation-induced bystander effect \u2013 modeling, manifestation, mechanisms, persistence, cancer risks. Probl. Radiac. Med. Radiobiol. 2019;24:65-92. DOI 10.33145/2304- 8336-2019-24-65-92. Storici F., Bebenek K., Kunkel T.A., Gordenin D.A., Resnick M.A. RNA-templated DNA repair. Nature. 2007;447(7142):338-341. DOI 10.1038/nature05720. Symington L.S. Focus on recombinational DNA repair. EMBO Rep. 2005;6(6):512-517. DOI 10.1038/sj.embor.7400438. Vogin G., Foray N. The law of Bergoni\u00e9 and Tribondeau: a nice formula for a first approximation. Int. J. Radiat. Biol. 2013;89(1):2-8. DOI 10.3109/09553002.2012.717732. Wang Y., Xu C., Du L.Q., Cao J., Liu J.X., Su X., Zhao H., Fan F.Y., Wang B., Katsube T., Fan S.J., Liu Q. Evaluation of the comet assay for assessing the dose-response relationship of DNA damage induced by ionizing radiation. Int. J. Mol. Sci. 2013;14(11):22449- 22461. DOI 10.3390/ijms141122449. Ward J.F. DNA damage produced by ionizing radiation in mammalian cells: identities, mechanisms of formation, and reparability. Prog. Nucleic Acid Res. Mol. Biol. 1988;35(C):95-125. DOI 10.1016/ S0079-6603(08)60611-X. This work was supported by State Budgeted Project No. 0324-2019-0042-C-01 for the Institute of Cytology and Genetics, Novosibirsk, registration ID AAAA-\u041017-117071240065-4; and the Russian Foundation for Basic Research, project No. 18-34-00205. Microscopical examination of cells was supported by State Budgeted Project No. 0310-2019-0005 for the Institute of Molecular and Cellular Biology, Novosibirsk.",
    "full_text_abstract": "\u0412 \u0440\u0430\u0431\u043e\u0442\u0435 \u043e\u0445\u0430\u0440\u0430\u043a\u0442\u0435\u0440\u0438\u0437\u043e\u0432\u0430\u043d\u044b \u043d\u0435\u043a\u043e\u0442\u043e\u0440\u044b\u0435 \u0431\u0438\u043e\u043b\u043e\u0433\u0438\u0447\u0435\u0441\u043a\u0438\u0435 \u043e\u0441\u043e\u0431\u0435\u043d\u043d\u043e\u0441\u0442\u0438 \u0440\u0430\u0434\u0438\u043e\u043f\u0440\u043e\u0442\u0435\u043a\u0442\u043e\u0440\u043d\u043e\u0433\u043e \u0434\u0435\u0439\u0441\u0442\u0432\u0438\u044f \u043f\u0440\u0435\u043f\u0430\u0440\u0430\u0442\u0430 \u0434\u0432\u0443\u0446\u0435\u043f\u043e\u0447\u0435\u0447\u043d\u043e\u0439 \u0420\u041d\u041a. \u041e\u0431\u043d\u0430\u0440\u0443\u0436\u0435\u043d\u043e, \u0447\u0442\u043e \u043f\u0440\u0435\u043f\u0430\u0440\u0430\u0442 \u0434\u0440\u043e\u0436\u0436\u0435\u0432\u043e\u0439 \u0420\u041d\u041a \u043e\u0431\u043b\u0430\u0434\u0430\u0435\u0442 \u043f\u0440\u043e\u043b\u043e\u043d\u0433\u0438\u0440\u043e\u0432\u0430\u043d\u043d\u044b\u043c \u0440\u0430\u0434\u0438\u043e\u043f\u0440\u043e\u0442\u0435\u043a\u0442\u043e\u0440\u043d\u044b\u043c \u0434\u0435\u0439\u0441\u0442\u0432\u0438\u0435\u043c \u043f\u0440\u0438 \u043e\u0431\u043b\u0443\u0447\u0435\u043d\u0438\u0438 \u0436\u0438\u0432\u043e\u0442\u043d\u044b\u0445 \u043b\u0435\u0442\u0430\u043b\u044c\u043d\u043e\u0439 \u0434\u043e\u0437\u043e\u0439 \u0432 9.4 \u0413\u0440. \u041f\u0440\u0438 \u043e\u0431\u043b\u0443\u0447\u0435\u043d\u0438\u0438 \u0447\u0435\u0440\u0435\u0437 1 \u0447 \u0438 \u043d\u0430 4-\u0435 \u0441\u0443\u0442\u043a\u0438 \u043f\u043e\u0441\u043b\u0435 \u0432\u0432\u0435\u0434\u0435\u043d\u0438\u044f 7 \u043c\u0433 \u043f\u0440\u0435\u043f\u0430\u0440\u0430\u0442\u0430 \u0420\u041d\u041a \u0432\u044b\u0436\u0438\u0432\u0430\u0435\u0442 100 % \u0436\u0438\u0432\u043e\u0442\u043d\u044b\u0445 \u043d\u0430 70-\u0435 \u0441\u0443\u0442\u043a\u0438 \u043d\u0430\u0431\u043b\u044e\u0434\u0435\u043d\u0438\u044f, \u043f\u0440\u0438 \u043e\u0431\u043b\u0443\u0447\u0435\u043d\u0438\u0438 \u043d\u0430 8-\u0435 \u0438 12-\u0435 \u0441\u0443\u0442\u043a\u0438 \u2013 60 % \u0436\u0438\u0432\u043e\u0442\u043d\u044b\u0445. \u0411\u044b\u043b\u0438 \u043e\u0446\u0435\u043d\u0435\u043d\u044b \u0432\u0440\u0435\u043c\u0435\u043d\u043d\u044b\u0435 \u043f\u0430\u0440\u0430\u043c\u0435\u0442\u0440\u044b \u043f\u0440\u043e\u0446\u0435\u0441\u0441\u0430 \u0440\u0435\u043f\u0430\u0440\u0430\u0446\u0438\u0438 \u0434\u0432\u0443\u0446\u0435\u043f\u043e\u0447\u0435\u0447\u043d\u044b\u0445 \u0440\u0430\u0437\u0440\u044b\u0432\u043e\u0432, \u0438\u043d\u0434\u0443\u0446\u0438\u0440\u043e\u0432\u0430\u043d\u043d\u044b\u0445 \u03b3-\u043b\u0443\u0447\u0430\u043c\u0438. \u0412\u044b\u044f\u0432\u043b\u0435\u043d\u043e, \u0447\u0442\u043e \u0432\u0432\u0435\u0434\u0435\u043d\u0438\u0435 \u043f\u0440\u0435\u043f\u0430\u0440\u0430\u0442\u0430 \u0420\u041d\u041a \u0432 \u043c\u043e\u043c\u0435\u043d\u0442 \u043c\u0430\u043a\u0441\u0438\u043c\u0430\u043b\u044c\u043d\u043e\u0433\u043e \u043a\u043e\u043b\u0438\u0447\u0435\u0441\u0442\u0432\u0430 \u0434\u0432\u0443\u0446\u0435\u043f\u043e- \u0447\u0435\u0447\u043d\u044b\u0445 \u0440\u0430\u0437\u0440\u044b\u0432\u043e\u0432, \u0447\u0435\u0440\u0435\u0437 1 \u0447 \u043f\u043e\u0441\u043b\u0435 \u043e\u0431\u043b\u0443\u0447\u0435\u043d\u0438\u044f, \u0441\u043d\u0438\u0436\u0430\u0435\u0442 \u044d\u0444\u0444\u0435\u043a\u0442\u0438\u0432\u043d\u043e\u0441\u0442\u044c \u0440\u0430\u0434\u0438\u043e\u043f\u0440\u043e\u0442\u0435\u043a\u0442\u043e\u0440\u043d\u043e\u0433\u043e \u0434\u0435\u0439\u0441\u0442\u0432\u0438\u044f \u043f\u043e \u0441\u0440\u0430\u0432\u043d\u0435\u043d\u0438\u044e \u0441 \u0432\u0432\u0435\u0434\u0435\u043d\u0438\u0435\u043c \u0437\u0430 1 \u0447 \u0434\u043e \u043e\u0431\u043b\u0443\u0447\u0435\u043d\u0438\u044f \u0438 \u0447\u0435\u0440\u0435\u0437 4 \u0447 \u043f\u043e\u0441\u043b\u0435 \u043e\u0431\u043b\u0443\u0447\u0435\u043d\u0438\u044f. \u041f\u0440\u043e\u0432\u0435\u0434\u0435\u043d\u043e \u0441\u0440\u0430\u0432\u043d\u0435\u043d\u0438\u0435 \u044d\u0444\u0444\u0435\u043a\u0442\u0438\u0432\u043d\u043e\u0441\u0442\u0438 \u0440\u0430\u0434\u0438\u043e\u0437\u0430\u0449\u0438\u0442- \u043d\u043e\u0433\u043e \u0434\u0435\u0439\u0441\u0442\u0432\u0438\u044f \u0448\u0442\u0430\u0442\u043d\u043e\u0433\u043e \u0440\u0430\u0434\u0438\u043e\u043f\u0440\u043e\u0442\u0435\u043a\u0442\u043e\u0440\u0430 \u0411-190 \u0438 \u043f\u0440\u0435\u043f\u0430\u0440\u0430\u0442\u0430 \u0420\u041d\u041a \u0432 \u043e\u0434\u043d\u043e\u043c \u044d\u043a\u0441\u043f\u0435\u0440\u0438\u043c\u0435\u043d\u0442\u0435. \u0423\u0441\u0442\u0430\u043d\u043e\u0432\u043b\u0435\u043d\u043e, \u0447\u0442\u043e \u043f\u0440\u0435\u043f\u0430\u0440\u0430\u0442 \u0441\u0443\u043c\u043c\u0430\u0440\u043d\u043e\u0439 \u0420\u041d\u041a \u043d\u0435 \u0443\u0441\u0442\u0443\u043f\u0430\u0435\u0442 \u043f\u043e \u044d\u0444\u0444\u0435\u043a\u0442\u0438\u0432\u043d\u043e\u0441\u0442\u0438 \u043f\u0440\u0435\u043f\u0430\u0440\u0430\u0442\u0443 \u0411-190. \u0412\u044b\u0436\u0438\u0432\u0430\u0435\u043c\u043e\u0441\u0442\u044c \u043d\u0430 40-\u0435 \u0441\u0443\u0442\u043a\u0438 \u043f\u043e\u0441\u043b\u0435 \u043e\u0431\u043b\u0443\u0447\u0435\u043d\u0438\u044f \u0434\u043b\u044f \u0433\u0440\u0443\u043f\u043f\u044b \u043c\u044b\u0448\u0435\u0439, \u043f\u043e\u043b\u0443\u0447\u0430\u0432\u0448\u0438\u0445 \u043f\u0440\u0435\u043f\u0430\u0440\u0430\u0442 \u0420\u041d\u041a, \u0441\u043e\u0441\u0442\u0430\u0432\u0438\u043b\u0430 78 %, \u0434\u043b\u044f \u0411-190 \u2013 67 % \u0436\u0438\u0432\u043e\u0442\u043d\u044b\u0445. \u0412 \u0445\u043e\u0434\u0435 \u0430\u043d\u0430\u043b\u0438\u0442\u0438\u0447\u0435\u0441\u043a\u0438\u0445 \u0438\u0441\u0441\u043b\u0435- \u0434\u043e\u0432\u0430\u043d\u0438\u0439 \u043f\u0440\u0435\u043f\u0430\u0440\u0430\u0442\u0430 \u0441\u0443\u043c\u043c\u0430\u0440\u043d\u043e\u0439 \u0420\u041d\u041a \u0434\u0440\u043e\u0436\u0436\u0435\u0439 \u043e\u0431\u043d\u0430\u0440\u0443\u0436\u0438\u043b\u043e\u0441\u044c, \u0447\u0442\u043e \u043f\u0440\u0435\u043f\u0430\u0440\u0430\u0442 \u043f\u0440\u0435\u0434\u0441\u0442\u0430\u0432\u043b\u044f\u0435\u0442 \u0441\u043e\u0431\u043e\u0439 \u0441\u043c\u0435\u0441\u044c \u043e\u0434\u043d\u043e\u0446\u0435\u043f\u043e\u0447\u0435\u0447- \u043d\u043e\u0439 \u0438 \u0434\u0432\u0443\u0446\u0435\u043f\u043e\u0447\u0435\u0447\u043d\u043e\u0439 \u0420\u041d\u041a. \u0420\u0430\u0434\u0438\u043e\u043f\u0440\u043e\u0442\u0435\u043a\u0442\u043e\u0440\u043d\u044b\u043c\u0438 \u0441\u0432\u043e\u0439\u0441\u0442\u0432\u0430\u043c\u0438 \u043e\u0431\u043b\u0430\u0434\u0430\u0435\u0442 \u0442\u043e\u043b\u044c\u043a\u043e \u0434\u0432\u0443\u0446\u0435\u043f\u043e\u0447\u0435\u0447\u043d\u0430\u044f \u0420\u041d\u041a. \u041f\u0440\u0438 \u0432\u0432\u0435\u0434\u0435\u043d\u0438\u0438 160 \u043c\u043a\u0433 \u043f\u0440\u0435\u043f\u0430\u0440\u0430\u0442\u0430 \u0434\u0432\u0443\u0446\u0435\u043f\u043e\u0447\u0435\u0447\u043d\u043e\u0439 \u0420\u041d\u041a \u0432\u044b\u0436\u0438\u0432\u0430\u0435\u0442 100 % \u043f\u043e\u0434\u043e\u043f\u044b\u0442\u043d\u044b\u0445 \u0436\u0438\u0432\u043e\u0442\u043d\u044b\u0445 \u043f\u043e\u0441\u043b\u0435 \u0430\u0431\u0441\u043e\u043b\u044e\u0442\u043d\u043e \u043b\u0435\u0442\u0430\u043b\u044c\u043d\u043e\u0439 \u0434\u043e\u0437\u044b \u0433\u0430\u043c\u043c\u0430-\u0440\u0430\u0434\u0438\u0430\u0446\u0438\u0438 9.4 \u0413\u0440. \u0423\u0441\u0442\u0430\u043d\u043e\u0432\u043b\u0435\u043d\u043e, \u0447\u0442\u043e \u0440\u0430\u0434\u0438\u043e\u0437\u0430\u0449\u0438\u0442\u043d\u044b\u0439 \u044d\u0444\u0444\u0435\u043a\u0442 \u0434\u0432\u0443\u0446\u0435\u043f\u043e\u0447\u0435\u0447\u043d\u043e\u0439 \u0420\u041d\u041a \u0437\u0430\u0432\u0438\u0441\u0438\u0442 \u043d\u0435 \u043e\u0442 \u043f\u043e\u0441\u043b\u0435\u0434\u043e\u0432\u0430\u0442\u0435\u043b\u044c- \u043d\u043e\u0441\u0442\u0438, \u0430 \u043e\u0442 \u0435\u0435 \u0434\u0432\u0443\u0446\u0435\u043f\u043e\u0447\u0435\u0447\u043d\u043e\u0439 \u0444\u043e\u0440\u043c\u044b, \u043f\u0440\u0438\u0447\u0435\u043c \u0434\u043b\u044f \u043e\u0441\u0443\u0449\u0435\u0441\u0442\u0432\u043b\u0435\u043d\u0438\u044f \u0440\u0430\u0434\u0438\u043e\u043f\u0440\u043e\u0442\u0435\u043a\u0442\u043e\u0440\u043d\u043e\u0433\u043e \u0434\u0435\u0439\u0441\u0442\u0432\u0438\u044f \u0434\u0432\u0443\u0446\u0435\u043f\u043e\u0447\u0435\u0447\u043d\u0430\u044f \u0420\u041d\u041a \u0434\u043e\u043b\u0436\u043d\u0430 \u0438\u043c\u0435\u0442\u044c \u00ab\u043e\u0442\u043a\u0440\u044b\u0442\u044b\u0435\u00bb \u043a\u043e\u043d\u0446\u044b \u043c\u043e\u043b\u0435\u043a\u0443\u043b\u044b. \u041f\u0440\u0435\u0434\u043f\u043e\u043b\u0430\u0433\u0430\u0435\u0442\u0441\u044f, \u0447\u0442\u043e \u0440\u0430\u0434\u0438\u043e\u0437\u0430\u0449\u0438\u0442\u043d\u043e\u0435 \u0434\u0435\u0439\u0441\u0442\u0432\u0438\u0435 \u043f\u0440\u0435\u043f\u0430\u0440\u0430\u0442\u0430 \u0434\u0432\u0443\u0446\u0435\u043f\u043e\u0447\u0435\u0447- \u043d\u043e\u0439 \u0420\u041d\u041a \u0441\u0432\u044f\u0437\u0430\u043d\u043e \u0441 \u0443\u0447\u0430\u0441\u0442\u0438\u0435\u043c \u043c\u043e\u043b\u0435\u043a\u0443\u043b \u0420\u041d\u041a \u0432 \u043a\u043e\u0440\u0440\u0435\u043a\u0442\u043d\u043e\u043c \u0432\u043e\u0441\u0441\u0442\u0430\u043d\u043e\u0432\u043b\u0435\u043d\u0438\u0438 \u043f\u043e\u0432\u0440\u0435\u0436\u0434\u0435\u043d\u043d\u043e\u0433\u043e \u043e\u0431\u043b\u0443\u0447\u0435\u043d\u0438\u0435\u043c \u0445\u0440\u043e\u043c\u0430\u0442\u0438\u043d\u0430 \u0432 \u0441\u0442\u0432\u043e\u043b\u043e\u0432\u044b\u0445 \u043a\u043b\u0435\u0442\u043a\u0430\u0445 \u043a\u0440\u043e\u0432\u0438. \u0421\u043e\u0445\u0440\u0430\u043d\u0438\u0432\u0448\u0438\u0435 \u0436\u0438\u0437\u043d\u0435\u0441\u043f\u043e\u0441\u043e\u0431\u043d\u043e\u0441\u0442\u044c \u0441\u0442\u0432\u043e\u043b\u043e\u0432\u044b\u0435 \u0433\u0435\u043c\u043e\u043f\u043e\u044d\u0442\u0438\u0447\u0435\u0441\u043a\u0438\u0435 \u043a\u043b\u0435\u0442\u043a\u0438 \u043c\u0438\u0433\u0440\u0438\u0440\u0443\u044e\u0442 \u043d\u0430 \u043f\u0435\u0440\u0438- \u0444\u0435\u0440\u0438\u044e \u0438 \u0434\u043e\u0441\u0442\u0438\u0433\u0430\u044e\u0442 \u0441\u0435\u043b\u0435\u0437\u0435\u043d\u043a\u0438, \u0433\u0434\u0435 \u0430\u043a\u0442\u0438\u0432\u043d\u043e \u043f\u0440\u043e\u043b\u0438\u0444\u0435\u0440\u0438\u0440\u0443\u044e\u0442. \u0412\u043d\u043e\u0432\u044c \u043e\u0431\u0440\u0430\u0437\u043e\u0432\u0430\u0432\u0448\u0430\u044f\u0441\u044f \u043a\u043b\u0435\u0442\u043e\u0447\u043d\u0430\u044f \u043f\u043e\u043f\u0443\u043b\u044f\u0446\u0438\u044f \u0432\u043e\u0441\u0441\u0442\u0430\u043d\u0430\u0432- \u043b\u0438\u0432\u0430\u0435\u0442 \u043a\u0440\u043e\u0432\u0435\u0442\u0432\u043e\u0440\u043d\u0443\u044e \u0438 \u0438\u043c\u043c\u0443\u043d\u043d\u0443\u044e \u0441\u0438\u0441\u0442\u0435\u043c\u044b, \u0447\u0442\u043e \u043e\u043f\u0440\u0435\u0434\u0435\u043b\u044f\u0435\u0442 \u0432\u044b\u0436\u0438\u0432\u0430\u043d\u0438\u0435 \u043b\u0435\u0442\u0430\u043b\u044c\u043d\u043e \u043e\u0431\u043b\u0443\u0447\u0435\u043d\u043d\u044b\u0445 \u0436\u0438\u0432\u043e\u0442\u043d\u044b\u0445."
}