{
    "PMC": "5921912",
    "DOI": "10.1111/j.1349-7006.1998.tb00637.x",
    "PMID": "9765620",
    "PMCID": "PMC5921912",
    "title": "Nonsense mutation at codon 63 of the BRCA1 gene in Japanese breast cancer patients.",
    "year": 1998,
    "source_url": "https://europepmc.org/article/PMC/PMC5921912",
    "source": "MED",
    "abstract_text": "The involvement of abnormalities of the BRCA1 gene in breast cancers in Japanese patients without any family history of this cancer was investigated by polymerase chain reaction-based single-strand conformation polymorphism analysis of the DNA sequences corresponding to the zinc finger domain (exons 2, 3 and 5) and the binding domain with Rad51 (exon 11) of the BRCA1 protein. An identical nonsense mutation at codon 63 (TTA to TAA) was found in 2 of 56 (3.5%) breast cancers from independent patients. The nucleotide change was also detected in the DNAs from non-cancerous tissues of both patients and therefore was a germline mutation. One of the patients was a member of a pedigree involving 3 ovarian cancer and 1 gastric cancer patients, while the other patient had no family history of malignancy. The same germline mutation at codon 63 was reported in four other independent Japanese pedigrees with frequent breast cancer, but not in such families in other countries. These observations suggest that the mutation commonly originated from a single Japanese ancestor. No other mutation of the BRCA1 gene was observed in the samples analyzed in this study. A low incidence of germline mutation and the absence of somatic mutation suggest that the aberration of the BRCA1 gene is involved only in a subset of Japanese breast cancers.",
    "full_text": "Jpn J Cancer Res Jpn. J. Cancer Res 10.1111/(ISSN)1349-7006a CAS Japanese Journal of Cancer Research : Gann 0910-5050 1876-4673 Blackwell Publishing Ltd Oxford, UK 5921912 9765620 10.1111/j.1349-7006.1998.tb00637.x CAE837 Article Nonsense Mutation at Codon 63 of the BRCA1 Gene in Japanese Breast Cancer Patients Kijima George 1 2 Murakami Yoshinori 1 Ohuchi Noriaki 2 Satomi Susumu 2 Sekiya Takao 1 1 Oncogene Division, National Cancer Center Research Institute, 5\u20101\u20101 Tsukiji, Chuo\u2010ku, Tokyo, 104\u20100045 2 Second Department of Surgery, Tohoku University School of Medicine, 1\u20101 Seiryo\u2010machi, Aoba\u2010ku, Sendai, 980\u20108574 * 3 To whom correspondence should be addressed. 8 1998 89 8 10.1111/cas.1998.89.issue-8 837 841 (Received April 10, 1998/Revised June 8, 1998/Accepted June 11, 1998) The involvement of abnormalities of the BRCA1 gene in breast cancers in Japanese patients without any family history of this cancer was investigated by polymerase chain reaction\u2010based single\u2010strand conformation polymorphism analysis of the DNA sequences corresponding to the zinc finger domain (exons 2, 3 and 5) and the binding domain with Rad51 (exon 11) of the BRCA1 protein. An identical nonsense mutation at codon 63 (TTA to TAA) was found in 2 of 56 (3.5%) breast cancers from independent patients. The nucleotide change was also detected in the DNAs from non\u2010cancerous tissues of both patients and therefore was a germline mutation. One of the patients was a member of a pedigree involving 3 ovarian cancer and 1 gastric cancer patients, while the other patient had no family history of malignancy. The same germline mutation at codon 63 was reported in four other independent Japanese pedigrees with frequent breast cancer, but not in such families in other countries. These observations suggest that the mutation commonly originated from a single Japanese ancestor. No other mutation of the BRCA1 gene was observed in the samples analyzed in this study. A low incidence of germline mutation and the absence of somatic mutation suggest that the aberration of the BRCA1 gene is involved only in a subset of Japanese breast cancers. key words BRCA1 Germline mutation Breast\u2010ovarian cancer Japanese breast cancer source-schema-version-number 2.0 cover-date August 1998 details-of-publishers-convertor Converter:WILEY_ML3GV2_TO_NLMPMC version:4.6.9 mode:remove_FC converted:04.11.2015 REFERENCES 1 ) Easton , D. F. , Bishop , D. T. , Ford , D. and Crockford , G. P. Genetic linkage analysis in familial breast and ovarian cancer: results from 214 families . Am. J. Hum. Genet. , 52 , 678 \u2013 701 ( 1993 ). 8460634 2 ) Narod , S. A. , Ford , D. , Devilee , P. , Barkardottir , R. B. , Lynch , H. T. , Smith , S. A. , Ponder , B. A. , Weber , B. L. , Garber , J. E. and Birch , J. M. An evaluation of genetic heterogeneity in 145 breast\u2010ovarian cancer families. Breast Cancer Linkage Consortium . Am. J. Hum. Genet. , 56 , 254 \u2013 264 ( 1995 ). 7825586 3 ) Smith , A. A. , Easton , D. F. , Evans , D. G. R. and Ponder , B. A. J. Allele losses in the region 17q12\u201021 in familial breast and ovarian cancer involve the wild\u2010type chromosome . Nat. Genet , 2 , 128 \u2013 131 ( 1992 ). 1303261 4 ) Kelsell , D. P. , Black , D. M. , Bishop , D. T. and Spurr , N. K. Genetic analysis of the BRCA1 region in a large breast/ovarian family: refinement of the minimal region containing BRCA1 . Hum. Mol. Genet. , 2 , 1823 \u2013 1828 ( 1993 ). 8281142 5 ) Hall , J. M. , Lee , M. K. , Newman , B. , Morrow , J. E. , Anderson , L. A. , Huey , B. and King , M.\u2010C. Linkage of early\u2010onset familial breast cancer to chromosome 17q21 . Science , 250 , 1684 \u2013 1689 ( 1990 ). 2270482 6 ) Narod , S. A. , Feunteun , J. , Lynch , H. T. , Watson , P. , Conway , T. , Lynch , J. and Lenoir , G. M. Familial breast\u2010ovarian cancer locus on chromosome 17q12 q23 . Lancet , 338 , 82 \u2013 83 ( 1991 ). 1676470 7 ) Miki , Y. , Swensen , J. , Shattuck\u2010Eidens , D. , Futreal , P. A. , Harshman , K. , Tavtigian , S. , Liu , Q. , Cochran , C. , Bennett , L. M. , Ding , W. , Bell , R. , Rosenthal , J. , Hussey , C. , Tran , T. , McClure , M. , Frye , C. , Hattier , T. , Phelps , R. , Haugen Strano , A. , Katcher , H. , Yakumo , K. , Gholami , Z. , Shaffer , D. , Stone , S. , Bayer , S. , Wray , C. , Bogden , R. , Dayananth , P. , Ward , J. , Tonin , P. , Narod , S. , Bristow , P. K. , Norris , F. H. , Helvering , L. , Morrison , P. , Rosteck , P. , Lai , M. , Barrett , J. C. , Lewis , C. , Neuhausen , S. , Cannon\u2010Albright , L. , Goldgar , D. , Wiseman , R. , Kamb , A. and Skolnick , M. H. A strong candidate for the breast and ovarian cancer susceptibility gene BRCA1 . Science , 266 , 66 \u2013 71 ( 1994 ). 7545954 8 ) Scully , R. , Chen , J. , Plug , A. , Xiao , Y. , Weaver , D. , Feunteun , J. , Ashley , T. and Livingston , D. Association of BRCA1 with Rad51 in mitotic and meiotic cells . Cell , 88 , 265 \u2013 275 ( 1997 ). 9008167 9 ) Couch , F. J. , Weber , B. L. and the Breast Cancer Information Core . Mutation and polymorphisms in the familial early\u2010onset breast cancer ( BRCA1 ) gene . Hum. Mutat. , 8 , 8 \u2013 18 ( 1996 ). 8807330 10 ) Inoue , R. , Fukutomi , T. , Ushijima , T. , Matsumoto , Y. , Sugimura , T. and Nagao , M. Germline mutation of BRCA1 in Japanese breast cancer families . Cancer Res. , 55 , 3521 \u2013 3524 ( 1995 ). 7627958 11 ) Katagiri , T. , Emi , M. , Ito , I. , Kobayashi , K. , Yoshimoto , M. , Iwase , T. , Kasumi , F. , Miki , Y. , Skolnick , M. H. and Nakamura , Y. Mutations in the BRCA1 gene in Japanese breast cancer patients . Hum. Mutat. , 7 , 334 \u2013 339 ( 1996 ). 8723683 12 ) Matsushima , M. , Kobayashi , K. , Emi , M. , Saito , H. , Saito , J. , Suzumori , K. and Nakamura , Y. Mutation analysis of the BRCA1 gene in 76 Japanese ovarian cancer patients: four germline mutations, but no evidence of somatic mutation . Hum. Mol. Genet. , 4 , 1953 \u2013 1956 ( 1995 ). 8595420 13 ) Takano , M. , Aida , H. , Tsuneki , I. , Takakuwa , K. , Hasegawa , I. , Tanaka , H. , Saito , M. , Tsuji , S. , Sonoda , T. , Hatae , M. , Chen , J.\u2010T. , Takahashi , K. , Hasegawa , K. , Toyoda , N. , Saito , N. , Yakushiji , M. , Araki , T. and Tanaka , K. Mutational analysis of BRCA1 gene in ovarian and breast\u2010ovarian cancer families in Japan . Jpn. J. Cancer Res. , 88 , 407 \u2013 413 ( 1997 ). 9197534 14 ) Emi , M. , Matsushima , M. , Katagiri , T. , Yoshimoto , M. , Kasumi , F. , Yokota , T. , Makata , T. , Miki , Y. and Nakamura , Y. Multiplex mutation screening of the BRCA1 gene in 1000 Japanese breast cancers . Jpn. J. Cancer Res. , 89 , 12 \u2013 16 ( 1998 ). 9510469 15 ) Futreal , P. A. , S\u00f6derkvist , P. , Marks , J. R. , Iglehart , J. D. , Cochran , C. , Barrett , J. C. and Wiseman , R. W. Detection of frequent allelic loss on proximal chromosome 17q in sporadic breast carcinoma using microsatellite length polymorphisms . Cancer Res. , 52 , 2624 \u2013 2627 ( 1992 ). 1568230 16 ) Cropp , C. S. , Nevanlinna , H. A. , Pyrh\u00f6nen , S. , Stenman , U.\u2010H. , Salmikangas , P. , Albertsen , H. , White , R. and Callahan , R. Evidence for involvement of BRCA1 in sporadic breast carcinomas . Cancer Res. , 54 , 2548 \u2013 2551 ( 1994 ). 8168077 17 ) Futreal , P. A. , Liu , Q. , Shattuck\u2010Eidens , D. , Cochran , C. , Harshman , K. , Tavtigian , S. , Bennett , L. M. , Haugen\u2010Strano , A. , Swensen , J. , Miki , Y. , Eddington , K. , McClure , M. , Frye , C. , Weaver\u2010Feldhaus , J. , Ding , W. , Gholami , Z. , S\u00f6derkvist , P. , Terry , L. , Jhanwar , S. , Berchuch , A. , Iglehart , K. D. , Marks , J. , Ballinger , D. G. , Barrett , J. C. , Skolnick , M. H. , Kamb , A. and Wiseman , R. BRCA1 mutations in primary breast and ovarian carcinomas . Science , 266 , 120 \u2013 122 ( 1994 ). 7939630 18 ) Blin , N. and Stafford , D. M. A general method for isolation of high\u2010molecular\u2010weight DNA from eukaryotes . Nucleic Acids Res. , 3 , 2303 \u2013 2308 ( 1976 ). 987581 19 ) Castilla , L. H. , Couch , F. J. , Erdos , M. R. , Hoskins , K. F. , Calzone , K. , Garber , J. E. , Boyd , J. , Lubin , M. B. , Deshano , M. L. , Brody , L. C. , Collins , F. S. and Weber , B. L. Mutations in the BRCA1 gene in families with early\u2010onset breast and ovarian cancer . Nat. Genet. , 8 , 387 \u2013 391 ( 1994 ). 7894491 20 ) Orita , M. , Suzuki , Y. , Sekiya , T. and Hayashi , K. Rapid and sensitive detection of point mutations and DNA polymorphisms using the polymerase chain reaction . Genomics , 5 , 875 \u2013 879 ( 1989 ). 21 ) Suzuki , Y. , Sekiya , T. and Hayashi , K. Allele\u2010specific polymerase chain reaction, a method for amplification and sequence determination of a single component among a mixture of sequence variants . Anal. Biochem. , 192 , 82 \u2013 84 ( 1991 ). 2048738 22 ) Friedman , L. S. , Ostermeyer , E. A. , Szabo , C. I. , Dowd , P. , Lynch , E. D. , Rowell , S. E. and King , M.\u2010C. Confirmation of BRCA1 by analysis of germline mutations linked to breast and ovarian cancer in ten families . Nat. Genet. , 8 , 399 \u2013 404 ( 1994 ). 7894493 23 ) Simard , J. , Tonin , P. , Durocher , F. , Morgan , K. , Rommens , J. , Gingras , S. , Samson , C. , Leblanc , J.\u2010F. , B\u00e9langer , C. , Dion , F. , Liu , Q. , Skolnick , M. , Goldgar , D. , Shattuck\u2010Eidens , D. , Labrie , F. and Narod , S. A. Common origins of BRCA1 mutations in Canadian breast and ovarian cancer families . Nat. Genet. , 8 , 392 \u2013 398 ( 1994 ). 7894492 24 ) Goldgar , D. E. and Reilly , P. R. A common BRCA1 mutation in the Ashkenazim . Nat. Genet. , 11 , 113 \u2013 114 ( 1995 ). 7550331 25 ) Johannsson , O. , Ostermeyer , E. A. , H\u00e5kansson , S. , Friedman , L. S. , Johansson , U. , Sellberg , G. , Br\u00f8ndum\u2010Nielsen , K. , Sele , V. , Olsson , H. , King , M.\u2010C. and Borg , \u00c5. Founding BRCA1 mutations in hereditary breast and ovarian cancer in southern Sweden . Am. J. Hum. Genet. , 58 , 441 \u2013 450 ( 1996 ). 8644702 26 ) Muto , M. G. , Cramer , D. W. , Tangir , J. , Berkowitz , R. and Mok , S. Frequency of the BRCA1 185delAG mutation among Jewish women with ovarian cancer and matched population controls . Cancer Res. , 56 , 1250 \u2013 1252 ( 1996 ). 8640808 27 ) Struewing , J. P. , Abeliovich , D. , Peretz , T. , Avishai , N. , Kaback , M. M. , Collins , F. S. and Brody , L. C. The carrier frequency of the BRCA1 185delAG mutation is approximately 1 percent in Ashkenazi Jewish individuals . Nat. Genet. , 11 , 198 \u2013 200 ( 1995 ). 7550349 28 ) Holt , J. T. , Thompson , M. E. , Szabo , C. , Robinson\u2010Benion , C. , Arteaga , C. L. , King , M.\u2010C. and Jensen , R. A. Growth retardation and tumor inhibition by BRCA1 . Nat. Genet. , 12 , 298 \u2013 302 ( 1996 ). 8589721 29 ) Toguchida , J. , Yamaguchi , T. , Dayton , S. H. , Beauchamp , R. L. , Herrera , G. E. , Ishizaki , K. , Yamamuro , T. , Meyers , P. A. , Little , J. B. and Sasaki , M. S. Prevalence and spectrum of germline mutations of p53 gene among patients with sarcoma . N. Engl. J. Med. , 326 , 1301 \u2013 1308 ( 1992 ). 1565143 30 ) Chen , Y. , Chen , C.\u2010F. , Riley , D. J. , Allred , D. C. , Chen , P.\u2010L. , Hoff , D. V. , Osborne , C. K. and Lee , W.\u2010H. Aberrant subcellular localization of BRCA1 in breast cancer . Science , 270 , 789 \u2013 791 ( 1995 ). 7481765",
    "full_text_abstract": "The involvement of abnormalities of the BRCA1 gene in breast cancers in Japanese patients without any family history of this cancer was investigated by polymerase chain reaction\u2010based single\u2010strand conformation polymorphism analysis of the DNA sequences corresponding to the zinc finger domain (exons 2, 3 and 5) and the binding domain with Rad51 (exon 11) of the BRCA1 protein. An identical nonsense mutation at codon 63 (TTA to TAA) was found in 2 of 56 (3.5%) breast cancers from independent patients. The nucleotide change was also detected in the DNAs from non\u2010cancerous tissues of both patients and therefore was a germline mutation. One of the patients was a member of a pedigree involving 3 ovarian cancer and 1 gastric cancer patients, while the other patient had no family history of malignancy. The same germline mutation at codon 63 was reported in four other independent Japanese pedigrees with frequent breast cancer, but not in such families in other countries. These observations suggest that the mutation commonly originated from a single Japanese ancestor. No other mutation of the BRCA1 gene was observed in the samples analyzed in this study. A low incidence of germline mutation and the absence of somatic mutation suggest that the aberration of the BRCA1 gene is involved only in a subset of Japanese breast cancers."
}