{
  "PMC": "5926665",
  "DOI": "10.1111/j.1349-7006.2001.tb02139.x",
  "PMID": "11714443",
  "PMCID": "PMC5926665",
  "title": "High frequency of deletions at the hypoxanthine-guanine phosphoribosyltransferase locus in an ataxia-telangiectasia lymphoblastoid cell line irradiated with gamma-rays.",
  "year": 2001,
  "source_url": "https://europepmc.org/article/PMC/PMC5926665",
  "source": "MED",
  "abstract_text": "The molecular nature of gamma-ray-induced mutations at the hypoxanthine-guanine phosphoribosyltransferase (HPRT) locus in an ataxia-telangiectasia (A-T) lymphoblastoid cell line was investigated. Twelve of 15 gamma-ray-induced HPRT-deficient mutants showed deletions. Eight of them had lost the entire HPRT gene, one showed a 1.9-kb deletion, and three had deletions of about 40-150 base pairs. Of the eight mutants that lost the entire gene, five had also lost both DXS79 and DXS86, flanking markers of the HPRT locus. The spectrum of mutations induced by gamma-irradiation in the A-T cells showed a high frequency of deletions in comparison with that in a control cell line, WIL2-NS. Sequence analysis of breakpoint junctions in four mutants revealed that three of them had junctions between short identical sequences at each breakpoint, leaving one copy at the junction. These results suggest that non-homologous end-joining is the major mechanism for deletion formation in A-T cells.",
  "full_text": "Jpn J Cancer Res Jpn. J. Cancer Res 10.1111/(ISSN)1349-7006a CAS Japanese Journal of Cancer Research : Gann 0910-5050 1876-4673 Blackwell Publishing Ltd Oxford, UK 5926665 11714443 10.1111/j.1349-7006.2001.tb02139.x CAE1190 Article High Frequency of Deletions at the Hypoxanthine‐guanine Phosphoribosyl‐transferase Locus in an Ataxia‐telangiectasia Lymphoblastoid Cell Line Irradiated with y‐Rays Tachibana Akira 1 Tatsumi Kouichi 2 Furuno‐Fukushi Ikuko 2 Sasaki Masao S. 1 1 Radiation Biology Center, Kyoto University, Yoshida‐Konoecho, Sakyo‐ku, Kyoto 606–8501 2 Division of Biology and Oncology, National Institute of Radiological Science, 4–9‐1 Anagawa, Inage‐ku, Chiba 263–8555 * To whom correspondence should be addressed. E‐mail: atachibana@house.rbc.kyoto-u.ac.jp 11 2001 92 11 10.1111/cas.2001.92.issue-11 1190 1198 ( Received July 18, 2001/Revised August 30, 2001/Accepted September 4, 2001 ) The molecular nature of y‐ray‐induced mutations at the hypoxanthine‐guanine phosphoribosyl‐transferase ( HPRT ) locus in an ataxia‐telangiectasia (A‐T) lymphoblastoid cell line was investigated. Twelve of 15 y‐ray‐induced HPRT‐deficient mutants showed deletions. Eight of them had lost the entire HPRT gene, one showed a 1.9‐kb deletion, and three had deletions of about 40–150 base pairs. Of the eight mutants that lost the entire gene, five had also lost both DXS79 and DXS86 , flanking markers of the HPRT locus. The spectrum of mutations induced by y‐irradiation in the A‐T cells showed a high frequency of deletions in comparison with that in a control cell line, WIL2NS. Sequence analysis of breakpoint junctions in four mutants revealed that three of them had junctions between short identical sequences at each breakpoint, leaving one copy at the junction. These results suggest that non‐homologous end‐joining is the major mechanism for deletion formation in A‐T cells. Ataxia‐telangiectasia Ionizing radiation Non‐homologous end‐joining Deletion junction source-schema-version-number 2.0 cover-date November 2001 details-of-publishers-convertor Converter:WILEY_ML3GV2_TO_NLMPMC version:4.6.9 mode:remove_FC converted:04.11.2015 REFERENCES 1 ) Gatti , R. A. , Boder , E. , Vinters , H. V. , Sparkes , R. S. , Norman , A. and Lange , K. Ataxia‐telangiectasia: an interdisciplinary approach to pathogenesis . Medicine , 70 , 99 – 117 ( 1991 ). 2005780 2 ) Taylor , A. M. , Metcalfe , J. A. , Thick , J. and Mak , Y. R Leukemia and lymphoma in ataxia telangiectasia . Blood , 87 , 423 – 438 ( 1996 ). 8555463 3 ) Shiloh , Y. , Tabor , E. and Becker , Y. Cellular hypersensitivity to neocarzinostatin in ataxia‐telangiectasia skin fibroblasts . Cancer Res. , 42 , 2247 – 2249 ( 1982 ). 6210429 4 ) Taylor , A. M. , Harnden , D. G. , Arlett , C. F. , Harcourt , S. A. , Lehmann , A. R. , Stevens , S. and Bridges , B. A. Ataxia telangiectasia: a human mutation with abnormal radiation sensitivity . Nature , 258 , 427 – 429 ( 1975 ). 1196376 5 ) Taylor , A. M. , Rosney , C. M. and Campbell , J. B. Unusual sensitivity of ataxia telangiectasia cells to bleomycin . Cancer Res. 39 , 1046 – 1050 ( 1979 ). 85479 6 ) Aurias , A. , Dutrillaux , B. , Buriot , D. and Lejeune , J. High frequencies of inversions and translocations of chromosomes 7 and 14 in ataxia telangiectasia . Mutat. Res. , 69 , 369 – 374 ( 1980 ). 7360152 7 ) Oxford , J. M. , Harnden , D. G. , Parrington , J. M. and Delhanty , J. D. Specific chromosome aberrations in ataxia telangiectasia . J. Med. Genet. , 12 , 251 – 262 ( 1975 ). 1177276 8 ) Taylor , A. M. , Metcalfe , J. A. , Oxford , J. M. and Harnden , D. G. Is chromatid‐type damage in ataxia telangiectasia after irradiation at G0 a consequence of defective repair ? Nature , 260 , 441 – 443 ( 1976 ). 1256587 9 ) Savitsky , K. , Bar‐Shira , A. , Gilad , S. , Rotman , G. , Ziv , Y. , Vanagaite , L. , Tagle , D. A. , Smith , S. , Uziel , T. , Sfez , S. , Ashkenazi , M. , Pecker , L , Frydman , M. , Harnik , R. , Patanjali , S. R. , Simmons , A. , Clines , G. A. , Sartiel , A. , Gatti , R. A. , Chessa , L. , Sanal , O. , Lavin , M. F. , Jaspers , N. G. J. , Taylor , A. M. R. , Arlett , C. F. , Miki , T. , Weissman , S. M. , Lovett , M. , Collins , F. S. and Shiloh , Y. A single ataxia telangiectasia gene with a product similar to PI‐3 kinase . Science , 268 , 1749 – 1753 ( 1995 ). 7792600 10 ) Lavin , M. F. and Shiloh , Y. The genetic defect in ataxia‐telangiectasia . Annu. Rev. Immunol. , 15 , 177 – 202 ( 1997 ). 9143686 11 ) Shiloh , Y. Ataxia‐telangiectasia and the Nijmegen breakage syndrome: related disorders but genes apart . Annu. Rev. Genet. , 31 , 635 – 662 ( 1997 ). 9442910 12 ) Lavin , M. F. and Khanna , K. K. ATM: the protein encoded by the gene mutated in the radiosensitive syndrome ataxia‐telangiectasia . Int. J. Radial. Biol. , 75 , 1201 – 1214 ( 1999 ). 13 ) Banin , S. , Moyal , L. , Shieh , S. , Taya , Y. , Anderson , C. W. , Chessa , L. , Smorodinsky , N. L , Prives , C. , Reiss , Y. , Shiloh , Y. and Ziv , Y. Enhanced phosphorylation of p53 by ATM in response to DNA damage . Science , 281 , 1674 – 1677 ( 1998 ). 9733514 14 ) Canman , C. E. , Lim , D. S. , Cimprich , K. A. , Taya , Y. , Tamai , K. , Sakaguchi , K. , Appella , E. , Kastan , M. B. and Siliciano , J. D. Activation of the ATM kinase by ionizing radiation and phosphorylation of p53 . Science , 281 , 1677 – 1679 ( 1998 ). 9733515 15 ) Matsuoka , S. , Huang , M. and Elledge , S. J. Linkage of ATM to cell cycle regulation by the Chk2 protein kinase . Science , 282 , 1893 – 1897 ( 1998 ). 9836640 16 ) Carr , A. M. Piecing together the p53 puzzle . Science , 287 , 1765 – 1766 ( 2000 ). 10755928 17 ) Kaufmann , W. K. and Paules , R. S. DNA damage and cell cycle checkpoints . FASEB J. , 10 , 238 – 247 ( 1996 ). 8641557 18 ) Jeggo , P. A. , Carr , A. M. and Lehmann , A. R. Splitting the ATM: distinct repair and checkpoint defects in ataxia‐telangiectasia . Trends Genet. , 14 , 312 – 316 ( 1998 ). 9724963 19 ) Cornforth , M. N. and Bedford , J. S. On the nature of a defect in cells from individuals with ataxia‐telangiectasia . Science , 221 , 1589 – 1591 ( 1985 ). 20 ) Pandita , T. K. and Hittelman , W. N. Initial chromosome damage but not DNA damage is greater in ataxia telangiectasia cells . Radial. Res. , 130 , 94 – 103 ( 1992 ). 21 ) Sasaki , M. S. and Taylor , A. M. Dissociation between radioresistant DNA replication and chromosomal radiosensitivity in ataxia telangiectasia cells . Mutat. Res. , 307 , 107 – 113 ( 1994 ). 7513786 22 ) Carney , J. P. , Maser , R. S. , Olivares , H. , Davis , E. M. , Le Beau , M. , Yates , J. R. , 3rd , Hays , L. , Morgan , W. F. and Petrini , J. H. The hMrell/hRad50 protein complex and Nijmegen breakage syndrome: linkage of double‐strand break repair to the cellular DNA damage response . Cell , 93 , 477 – 486 ( 1998 ). 9590181 23 ) Matsuura , S. , Tauchi , H. , Nakamura , A. , Kondo , N. , Sakamoto , S. , Endo , S. , Smeets , D. , Solder , B. , Belohradsky , B. H. , Der Kaloustian , V. M. , Oshimura , M. , Isomura , M. , Nakamura , Y. and Komatsu , K. Positional cloning of the gene for Nijmegen breakage syndrome . Nat. Genet. , 19 , 179 – 181 ( 1998 ). 9620777 24 ) Varon , R. , Vissinga , C. , Platzer , M. , Cerosaletti , K. M. , Chrzanowska , K. H. , Saar , K. , Beckmann , G. , Seemanova , E. , Cooper , P. R. , Nowak , N. J. , Stumm , M. , Weemaes , C. M. , Gatti , R. A. , Wilson , R. K. , Digweed , M. , Rosenthal , A. , Sperling , K. , Concannon , P. and Reis , A. Nibrin, a novel DNA double‐strand break repair protein, is mutated in Nijmegen breakage syndrome . Cell , 93 , 467 – 476 ( 1998 ). 9590180 25 ) Gatei , M. , Young , D. , Cerosaletti , K. M. , Desai‐Mehta , A. , Spring , K. , Kozlov , S. , Lavin , M. F. , Gatti , R. A. , Concannon , P. and Khanna , K. ATM‐dependent phosphorylation of nibrin in response to radiation exposure . Nat. Genet. 25 , 115 – 119 ( 2000 ). 10802669 26 ) Lim , D. S. , Kim , S. T. , Xu , B. , Maser , R. S. , Lin , J. , Petrini , J. H. and Kastan , M. B. ATM phosphorylates p95/nbsl in an S‐phase checkpoint pathway . Nature , 404 , 613 – 617 ( 2000 ). 10766245 27 ) Wu , X. , Ranganathan , V. , Weisman , D. S. , Heine , W. F. , Ciccone , D. N. , O'Neill , T. B. , Crick , K. E. , Pierce , K. A. , Lane , W. S. , Rathbun , G. , Livingston , D. M. and Weaver , D. T. ATM phosphorylation of Nijmegen breakage syndrome protein is required in a DNA damage response . Nature , 405 , 477 – 482 ( 2000 ). 10839545 28 ) Zhao , S. , Weng , Y. C. , Yuan , S. S. , Lin , Y. T. , Hsu , H. C. , Lin , S. C. , Gerbino , E. , Song , M. H. , Zdzienicka , M. Z. , Gatti , R. A. , Shay , J. W. , Ziv , Y. , Shiloh , Y. and Lee , E. Y. Functional link between ataxia‐telangiectasia and Nijmegen breakage syndrome gene products . Nature , 405 , 473 – 477 ( 2000 ). 10839544 29 ) Arlett , C. F. and Harcourt , S. A. Cell killing and mutagene‐sis in repair‐defective human cells . In “ DNA Repair Mechanisms ,“ ed. Hanawalt P. C. , Friedberg E. C. and Fox C. F. , pp. 633 – 636 ( 1978 ). Academic Press, Inc. , New York . 30 ) Tatsumi , K. and Takebe , H. y‐Irradiation induces mutation in ataxia‐telangiectasia lymphoblastoid cells . Gann , 75 , 1040 – 1043 ( 1984 ). 6526217 31 ) Gibbs , R. A. , Nguyen , P. N. , Edwards , A. , Civitello , A. B. and Caskey , C. T. Multiplex DNA deletion detection and exon sequencing of the hypoxanthine phosphoribosyltransferase gene in Lesch‐Nyhan families . Genomics , 7 , 235 – 244 ( 1990 ). 2347587 32 ) Tachibana , A. , Tatsumi , K. , Masui , T. and Kato , T. Large deletions at the HPRT locus associated with the mutator phenotype in a Bloom's syndrome lymphoblastoid cell line . Mol. Carcinog. , 17 , 41 – 47 ( 1996 ). 8876674 33 ) Morris , T. , Masson , W. , Singleton , B. and Thacker , J. Analysis of large deletions in the HPRT gene of primary human fibroblasts using the polymerase chain reaction . Somat. Cell Mol. Genet. , 19 , 9 – 19 ( 1993 ). 8460402 34 ) Higuchi , R. G. and Ochman , H. Production of single‐stranded DNA templates by exonuclease digestion following the polymerase chain reaction . Nucleic Acids Res. , 17 , 5865 ( 1989 ). 2548171 35 ) Takagi , S. , Kimura , M. and Katsuki , M. Direct sequencing of PCR products using unlabeled primers . Biotechniques , 14 , 218 – 221 ( 1993 ). 8431285 36 ) Edwards , A. , Voss , H. , Rice , P. , Civitello , A. , Stegemann , J. , Schwager , C. , Zimmermann , J. , Erfle , H. , Caskey , C. T. and Ansorge , W. Automated DNA sequencing of the human HPRT locus . Genomics , 6 , 593 – 608 ( 1990 ). 2341149 37 ) Furuno‐Fukushi , I. , Tatsumi , K. , Takahagi , M. and Tachibana , A. Quantitative and qualitative effect of gamma‐ray dose‐rate on mutagenesis in human lymphoblastoid cells . Int. J. Radial. Biol. , 70 , 209 – 217 ( 1996 ). 38 ) Yamada , Y. , Park , M. S. , Okinaka , R. T. and Chen , D. J. Molecular analysis and comparison of radiation‐induced large deletions of the HPRT locus in primary human skin fibroblasts . Radial. Res. , 145 , 481 – 490 ( 1996 ). 39 ) Meuth , M. The structure of mutation in mammalian cells . Biochim. Biophys. Acta , 1032 , 1 – 17 ( 1990 ). 2194566 40 ) Miles , C. , Sargent , G. , Phear , G. and Meuth , M. DNA sequence analysis of gamma radiation‐induced deletions and insertions at the APRT locus of hamster cells . Mol. Carcinog. , 3 , 233 – 242 ( 1990 ). 2206285 41 ) Morris , T. and Thacker , J. Formation of large deletions by illegitimate recombination in the HPRT gene of primary human fibroblasts . Proc. Nail. Acad. Set. USA , 90 , 1392 – 1396 ( 1993 ). 42 ) Lieber , M. R. , Grawunder , U. , Wu , X. and Yaneva , M. Tying loose ends: roles of Ku and DNA‐dependent protein kinase in the repair of double‐strand breaks . Curr. Opin. Genet. Dev. , 7 , 99 – 104 ( 1997 ). 9024627 43 ) Roth , D. and Wilson , J. Illegitimate recombination in mammalian cells . In “ Genetic Recombination ,“ ed. Kucherlapati R. and Smith G. R. , pp. 621 – 653 ( 1988 ). American Society for Microbiology , Washington , DC . 44 ) Dar , M. E. , Winters , T. A. and Jorgensen , T. J. Identification of defective illegitimate recombinational repair of oxidatively‐induced DNA double‐strand breaks in ataxia‐telangiectasia cells . Mutat. Res. 384 , 169 – 179 ( 1997 ). 9330613 45 ) Petrini , J. H. The mammalian Mre 11‐Rad50‐nbsl protein complex: integration of functions in the cellular DNA‐damage response . Am. J. Hum. Genet. 64 , 1264 – 1269 ( 1999 ). 10205255 46 ) Paull , T. T. and Gellert , M. The 3 to 5 exonuclease activity of Mre 11 facilitates repair of DNA double‐strand breaks . Mol. Cell , 1 , 969 – 979 ( 1998 ). 9651580 47 ) Trujillo , K. M. , Yuan , S. S. , Lee , E. Y. and Sung , P. Nuclease activities in a complex of human recombination and DNA repair factors Rad50, Mre 11, and p95 . J. Biol. Chem. , 273 , 21447 – 21450 ( 1998 ). 9705271",
  "plain_text": "The molecular nature of y‐ray‐induced mutations at the hypoxanthine‐guanine phosphoribosyl‐transferase ( HPRT ) locus in an ataxia‐telangiectasia (A‐T) lymphoblastoid cell line was investigated. Twelve of 15 y‐ray‐induced HPRT‐deficient mutants showed deletions. Eight of them had lost the entire HPRT gene, one showed a 1.9‐kb deletion, and three had deletions of about 40–150 base pairs. Of the eight mutants that lost the entire gene, five had also lost both DXS79 and DXS86 , flanking markers of the HPRT locus. The spectrum of mutations induced by y‐irradiation in the A‐T cells showed a high frequency of deletions in comparison with that in a control cell line, WIL2NS. Sequence analysis of breakpoint junctions in four mutants revealed that three of them had junctions between short identical sequences at each breakpoint, leaving one copy at the junction. These results suggest that non‐homologous end‐joining is the major mechanism for deletion formation in A‐T cells."
}
