{
  "PMC": "5956492",
  "DOI": "10.1100/tsw.2004.111",
  "PMID": "15311328",
  "PMCID": "PMC5956492",
  "title": "Could lipoprotein lipase play a role in Alzheimer's disease?",
  "year": 2004,
  "source_url": "https://europepmc.org/article/PMC/PMC5956492",
  "source": "MED",
  "abstract_text": "This paper reviews recent literature on the role of lipoprotein lipase in the central nervous system with a focus on its recently described role in synaptic remodeling. This novel role could have implication for Alzheimer's disease treatment.",
  "full_text": "ScientificWorldJournal ScientificWorldJournal TSWJ The Scientific World Journal 2356-6140 1537-744X TheScientificWorldJOURNAL 5956492 15311328 476364 10.1100/tsw.2004.111 Directions in Science Could Lipoprotein Lipase Play a Role in Alzheimer's Disease? Blain Jean-Francois 1 Poirier Judes 1 2 * Douglas Hospital Research Center, Verdun, Quebec, Canada 2 McGill Center for Studies in Aging, 6825 LaSalle Blvd, Verdun, Quebec, H4H 1R3, Canada *Judes Poirier: judes.poirier@mcgill.ca Academic Editor: Martin Goette 2004 20 7 2004 4 531 535 4 6 2004 8 7 2004 12 7 2004 Copyright © 2004 Jean-Francois Blain and Judes Poirier. 2004 This is an open access article distributed under the Creative Commons Attribution License, which permits unrestricted use, distribution, and reproduction in any medium, provided the original work is properly cited. This paper reviews recent literature on the role of lipoprotein lipase in the central nervous system with a focus on its recently described role in synaptic remodeling. This novel role could have implication for Alzheimer's disease treatment. lipoprotein lipase (LPL) cholesterol lipids Alzheimer’s disease (AD) synaptic remodeling proteoglycans amyloid Alzheimer Society Canadian Institutes of Health Research",
  "plain_text": "This paper reviews recent literature on the role of lipoprotein lipase in the central nervous system with a focus on its recently described role in synaptic remodeling. This novel role could have implication for Alzheimer's disease treatment."
}
