{
    "PMC": "9895433",
    "DOI": "10.1038/s41467-023-36264-y",
    "PMID": "36732511",
    "PMCID": "PMC9895433",
    "title": "Author Correction: Protein interaction network of alternatively spliced isoforms from brain links genetic risk factors for autism.",
    "year": 2023,
    "source_url": "https://europepmc.org/article/PMC/PMC9895433",
    "source": "MED",
    "full_text": "pmc Nat Commun Nat Commun Nature Communications 2041-1723 Nature Publishing Group UK London 9895433 36732511 36264 10.1038/s41467-023-36264-y Author Correction Author Correction: Protein interaction network of alternatively spliced isoforms from brain links genetic risk factors for autism Corominas Roser 1 Yang Xinping 2 3 Lin Guan Ning 1 Kang Shuli 1 Shen Yun 2 3 Ghamsari Lila 2 3 10 Broly Martin 2 3 Rodriguez Maria 2 3 Tam Stanley 2 3 Wanamaker Shelly A. 2 3 11 Fan Changyu 2 3 Yi Song 2 3 Tasan Murat 4 Lemmens Irma 5 Kuang Xingyan 6 Zhao Nan 6 Malhotra Dheeraj 7 Michaelson Jacob J. 7 12 Vacic Vladimir 8 Calderwood Michael A. 2 3 Roth Frederick P. 2 3 4 Tavernier Jan 5 Horvath Steve 9 Salehi-Ashtiani Kourosh 2 3 13 Korkin Dmitry 6 Sebat Jonathan 7 Hill David E. 2 3 Hao Tong tong_hao@dfci.harvard.edu 2 3 Vidal Marc marc_vidal@dfci.harvard.edu 2 3 Iakoucheva Lilia M. lilyak@ucsd.edu 1 1 grid.266100.3 0000 0001 2107 4242 Department of Psychiatry, University of California San Diego, La Jolla, California 92093 USA 2 grid.65499.37 0000 0001 2106 9910 Center for Cancer Systems Biology (CCSB) and Department of Cancer Biology, Dana-Farber Cancer Institute, Boston, Massachusetts 02115 USA 3 grid.38142.3c 000000041936754X Department of Genetics, Harvard Medical School, Boston, Massachusetts 02115 USA 4 grid.416166.2 0000 0004 0473 9881 Donnelly Centre and Departments of Molecular Genetics & Computer Science, University of Toronto, and Samuel Lunenfeld Research Institute, Mt. Sinai Hospital, Toronto, Ontario M5S 3E1 Canada 5 grid.5342.0 0000 0001 2069 7798 Department of Medical Protein Research, VIB, and Department of Biochemistry, Faculty of Medicine and Health Sciences, Ghent University, Ghent, B-9000 Belgium 6 grid.134936.a 0000 0001 2162 3504 Department of Computer Science and Informatics Institute, University of Missouri, Columbia, Missouri 65203 USA 7 grid.266100.3 0000 0001 2107 4242 Beyster Center for Genomics of Psychiatric Diseases and Department of Psychiatry, University of California San Diego, La Jolla, California 92093 USA 8 grid.429884.b 0000 0004 1791 0895 New York Genome Center, New York, New York, 10013 USA 9 grid.19006.3e 0000 0000 9632 6718 Department of Human Genetics and Biostatistics, University of California, Los Angeles, California 90095 USA 10 grid.21729.3f 0000000419368729 Present Address: Columbia University, New York, New York, 10032 USA 11 grid.250671.7 0000 0001 0662 7144 Present Address: Salk Institute for Biological Studies, La Jolla, California 92037 USA 12 grid.214572.7 0000 0004 1936 8294 Present Address: Department of Psychiatry, University of Iowa, Iowa City, Iowa 52242 USA 13 grid.440573.1 0000 0004 1755 5934 Present Address: Division of Science and Math, and Center for Genomics and Systems Biology, New York University Abu Dhabi, P.O. Box 129188, Abu Dhabi, United Arab Emirates 2 2 2023 2 2 2023 2023 14 569 \u00a9 The Author(s) 2014 2023 https://creativecommons.org/licenses/by/4.0/ Open Access This article is licensed under a Creative Commons Attribution 4.0 International License, which permits use, sharing, adaptation, distribution and reproduction in any medium or format, as long as you give appropriate credit to the original author(s) and the source, provide a link to the Creative Commons license, and indicate if changes were made. The images or other third party material in this article are included in the article\u2019s Creative Commons license, unless indicated otherwise in a credit line to the material. If material is not included in the article\u2019s Creative Commons license and your intended use is not permitted by statutory regulation or exceeds the permitted use, you will need to obtain permission directly from the copyright holder. To view a copy of this license, visit http://creativecommons.org/licenses/by/4.0/ . issue-copyright-statement \u00a9 The Author(s) 2023 Correction to: Nature Communications 10.1038/ncomms4650, published online 11 April 2014 Since the publication of this work, Shelly A. Wanamaker has changed their name from Shelly A. Trigg. This has now been amended."
}