{
  "PMC": "6009486",
  "DOI": "10.1100/tsw.2002.352",
  "PMID": "12805935",
  "PMCID": "PMC6009486",
  "title": "Enhanced hepatocarcinogenicity due to agonists of peroxisome proliferator-activated receptors in senescent rats: role of peroxisome proliferation, cell proliferation, and apoptosis.",
  "year": 2002,
  "source_url": "https://europepmc.org/article/PMC/PMC6009486",
  "source": "MED",
  "abstract_text": "Exposure to agonists of peroxisome proliferator-activated receptor alpha (PPARalpha) causes liver cancer in rodents, with aged animals being more susceptible than their younger counterparts to this effect. Treatment with these chemicals produced a five- to sevenfold higher yield of grossly visible hepatic tumors in old rats compared to young animals. The enhanced susceptibility of the aged livers to the carcinogenic effect of PPAR agonists could not be explained by differences in levels of peroxisomal and/or cell proliferation between young and old animals, as neither of these responses was exaggerated with aging. Reported studies have shown that activating PPARalpha results in the suppression of hepatic apoptosis. This effect is expected to diminish the ability of the liver to purge itself of pre-existing neoplastic cells, allowing them to progress to tumors. New findings from our laboratories show that the aged liver is exceedingly sensitive to the antiapoptotic effect of PPAR agonists. In addition, aged livers showed remarkably higher levels of the antiapoptotic protein Bcl-2 than livers of young, adult, and middle-aged animals. Interestingly, the PPARalpha agonist Wy-14,643 significantly diminished elements of the proapoptotic machinery (e.g., Bax, caspases, and fas) in the aged liver, while remarkably increasing elements of this machinery in younger animals. Taken together, while activation of PPARs appears to inhibit apoptosis in livers of senescent animals, activating these receptors seems to stimulate the apoptotic machinery in young animals. This paradoxical effect may be responsible for the exaggerated sensitivity of the aged liver to the carcinogenic effect of agents that activate PPARs.",
  "full_text": "ScientificWorldJournal ScientificWorldJournal TSWJ The Scientific World Journal 2356-6140 1537-744X TheScientificWorldJOURNAL 6009486 12805935 953053 10.1100/tsw.2002.352 Mini-Review Article Enhanced Hepatocarcinogenicity Due to Agonists of Peroxisome Proliferator-Activated Receptors in Senescent Rats: Role of Peroxisome Proliferation, Cell Proliferation, and Apoptosis Youssef Jihan Badr Mostafa * University of Missouri-Kansas City, 2411 Holmes Street, M3-115, Kansas City, MO 64108-2792, USA *Mostafa Badr: badrm@umkc.edu 2002 30 5 2002 2 1491 1500 18 4 2002 22 4 2002 24 4 2002 Copyright © 2002 Jihan Youssef and Mostafa Badr. 2002 This is an open access article distributed under the Creative Commons Attribution License, which permits unrestricted use, distribution, and reproduction in any medium, provided the original work is properly cited. Exposure to agonists of peroxisome proliferator-activated receptor alpha (PPAR α ) causes liver cancer in rodents, with aged animals being more susceptible than their younger counterparts to this effect. Treatment with these chemicals produced a five- to sevenfold higher yield of grossly visible hepatic tumors in old rats compared to young animals. The enhanced susceptibility of the aged livers to the carcinogenic effect of PPAR agonists could not be explained by differences in levels of peroxisomal and/or cell proliferation between young and old animals, as neither of these responses was exaggerated with aging. Reported studies have shown that activating PPARa results in the suppression of hepatic apoptosis. This effect is expected to diminish the ability of the liver to purge itself of pre-existing neoplastic cells, allowing them to progress to tumors. New findings from our laboratories show that the aged liver is exceedingly sensitive to the antiapoptotic effect of PPAR agonists. In addition, aged livers showed remarkably higher levels of the antiapoptotic protein Bcl-2 than livers of young, adult, and middle-aged animals. Interestingly, the PPARa agonist Wy-14,643 significantly diminished elements of the proapoptotic machinery (e.g., Bax, caspases, and fas) in the aged liver, while remarkably increasing elements of this machinery in younger animals. Taken together, while activation of PPARs appears to inhibit apoptosis in livers of senescent animals, activating these receptors seems to stimulate the apoptotic machinery in young animals. This paradoxical effect may be responsible for the exaggerated sensitivity of the aged liver to the carcinogenic effect of agents that activate PPARs. aging peroxisomes peroxisome proliferator-activated receptors apoptosis cell proliferation oxidative stress liver cancer National Institutes of Health AG 18479",
  "plain_text": "Exposure to agonists of peroxisome proliferator-activated receptor alpha (PPAR α ) causes liver cancer in rodents, with aged animals being more susceptible than their younger counterparts to this effect. Treatment with these chemicals produced a five- to sevenfold higher yield of grossly visible hepatic tumors in old rats compared to young animals. The enhanced susceptibility of the aged livers to the carcinogenic effect of PPAR agonists could not be explained by differences in levels of peroxisomal and/or cell proliferation between young and old animals, as neither of these responses was exaggerated with aging. Reported studies have shown that activating PPARa results in the suppression of hepatic apoptosis. This effect is expected to diminish the ability of the liver to purge itself of pre-existing neoplastic cells, allowing them to progress to tumors. New findings from our laboratories show that the aged liver is exceedingly sensitive to the antiapoptotic effect of PPAR agonists. In addition, aged livers showed remarkably higher levels of the antiapoptotic protein Bcl-2 than livers of young, adult, and middle-aged animals. Interestingly, the PPARa agonist Wy-14,643 significantly diminished elements of the proapoptotic machinery (e.g., Bax, caspases, and fas) in the aged liver, while remarkably increasing elements of this machinery in younger animals. Taken together, while activation of PPARs appears to inhibit apoptosis in livers of senescent animals, activating these receptors seems to stimulate the apoptotic machinery in young animals. This paradoxical effect may be responsible for the exaggerated sensitivity of the aged liver to the carcinogenic effect of agents that activate PPARs."
}
