{
    "PMC": "1968542",
    "DOI": "10.1038/bjc.1993.318",
    "PMID": "8347474",
    "PMCID": "PMC1968542",
    "title": "Molecular epidemiology studies of cancer in families.",
    "year": 1993,
    "source_url": "https://europepmc.org/article/PMC/PMC1968542",
    "source": "MED",
    "full_text": "pmc Br J Cancer Br J Cancer British Journal of Cancer 0007-0920 1532-1827 Nature Publishing Group 1968542 8347474 Research Article Molecular epidemiology studies of cancer in families. Li F. P. Dana Farber Cancer Institute, Boston, Massachusetts. 8 1993 68 2 217 219 https://creativecommons.org/licenses/by/4.0/ This article is licensed under a Creative Commons Attribution 4.0 International License, which permits use, sharing, adaptation, distribution and reproduction in any medium or format, as long as you give appropriate credit to the original author(s) and the source, provide a link to the Creative Commons license, and indicate if changes were made. The images or other third party material in this article are included in the article\u2019s Creative Commons license, unless indicated otherwise in a credit line to the material. If material is not included in the article\u2019s Creative Commons license and your intended use is not permitted by statutory regulation or exceeds the permitted use, you will need to obtain permission directly from the copyright holder. To view a copy of this license, visit https://creativecommons.org/licenses/by/4.0/ ."
}