{
    "PMC": "5901351",
    "DOI": "10.1100/tsw.2007.312",
    "PMID": "18167615",
    "PMCID": "PMC5901351",
    "title": "Met receptor subcellular localization depends on E-cadherin function.",
    "year": 2007,
    "source_url": "https://europepmc.org/article/PMC/PMC5901351",
    "source": "MED",
    "full_text": "ScientificWorldJournal ScientificWorldJournal TSWJ The Scientific World Journal 2356-6140 1537-744X TheScientificWorldJOURNAL 5901351 18167615 303689 10.1100/tsw.2007.312 Directions in Science Met Receptor Subcellular Localization Depends on E-Cadherin Function Reshetnikova Galina * Institute of Cytology, Russian Academy of Sciences, St. Petersburg, Russia *Galina Reshetnikova: greshet@mail.cytspb.rssi.ru Academic Editor: Martin Goette 2007 18 12 2007 7 2009 2011 13 7 2007 29 11 2007 4 12 2007 Copyright \u00a9 2007 Galina Reshetnikova. 2007 This is an open access article distributed under the Creative Commons Attribution License, which permits unrestricted use, distribution, and reproduction in any medium, provided the original work is properly cited. E-cadherin hepatocyte growth factor Met signaling epithelial cell polarization Citrus Research & Development Foundation Russian Foundation for Basic Research"
}